automatic URI	Proposed URI	bookTitle	authorName	collection	id	tfidf
		ديوان الخرنق بنت بدر	الخرنق بنت بدر بن هفان	ShamAY	37827	0.96834
		ديوان ابن المعتز	أبو العباس عبد الله بن محمد المعتز بالله بن المتوكل بن المعتصم بن الرشيد العباسي، المتوفى سنة 296 هـ	ShamAY	37841	0.28197
		ديوان دعبل بن علي	دعبل الخزاعى، ابو على دعبل بن على بن رزين (148 - 246 هـ)	ShamAY	37947	0.27888
		ديوان علي بن أبي طالب	علي بن أبي طالب الصحابي الجليل	ShamAY	37911	0.27285
		ديوان ابن عبد ربه الأندلسي	ابن عبد ربه الأندلسي	ShamAY	37874	0.27174
		ديوان الحسن بن هانئ أبي نواس	أبو نواس	ShamAY	37852	0.27157
		ديوان ابن عنين	محمد بن نصر الله بن مكارم الحسن بن عنين الزرعي الدمشقي الأنصاري	ShamAY	37875	0.26742
		ديوان كشاجم	كشاجم، ابو الفتح محمد بن الحسين بن السندى بن مشاهك الرملى	ShamAY	37962	0.26452
		ديوان أسامة بن منقذ	أبو المظفر أسامة بن مرشد بن منقذ الكناني المتوفى سنة 488 هـ	ShamAY	37915	0.26348
		ديوان ديك الجن	ديك الجن الحمصي عبد السلام بن رغبان. (161 - 236 هـ).	ShamAY	37948	0.26006
		ديوان أبي فراس الحمداني	أبو فراس الحمداني	ShamAY	37823	0.25834
		ديوان الباخرزي	علي بن الحسن بن علي بن أبي الطيب الباخرزي أبو الحسن المتوفى سنة 460 هـ	ShamAY	37843	0.25811
		ديوان الحكم بن أبي الصلت	أمية بن عبد العزيز الأندلسي أبو الصلت (1068 ـ 1134م)	ShamAY	37851	0.25711
		ديوان الشاب الظريف	شمس الدين محمد بن العفيف التلمساني المتوفى سنة 688 هـ	ShamAY	37889	0.25637
		ديوان الواواء الدمشقي	محمد بن أحمد الغساني الدمشقي أبو الفرج	ShamAY	37832	0.25626
		ديوان الإمام الشافعي	أبى عبد الله محمد بن ادريس الشافعى المتوفى عام 204 هـ	ShamAY	37916	0.25601
		ديوان الأحوص	عبد الله بن محمد بن عبد الله بن عاصم الأنصاري المتوفى سنة 105هـ	ShamAY	37939	0.25572
		ديوان عرقلة الكلبي	حسان بن نمير بن عجل الكلبي والمعروف أيضا بـ عرقلة الدمشقي وعرقلة الأعور	ShamAY	37935	0.25512