automatic URI	Proposed URI	bookTitle	authorName	collection	id	tfidf
		مَوسوعةُ المفاهيمِ الإسْلاميَّةِ	الواحدي :: علي بن نايف الشحود	ShamAY	32994	0.26638
		فقه أشراط الساعة	محمد بن أحمد بن إسماعيل المقدم	ShamAY	31964	0.26637
		التفسير الموضوعي 1 - جامعة المدينة	مناهج جامعة المدينة العالمية	ShamelaY19	31076	0.26637
		صناعة الفتوى وفقه الأقليات	الشيخ العلامة عبد الله بن بيه	ShamAY	37601	0.26635
		المعجزة القرآنية حقائق علمية قاطعة	أحمد عمر أبو شوفة	Sham19Y	37987	0.26635
		فقه النوازل	بكر بن عبد الله أبو زيد بن محمد بن عبد الله بن بكر بن عثمان بن يحيى بن غيهب بن محمد (المتوفى : 1429هـ)	ShamAY	10776	0.26634
		شرح زاد المستقنع - عبد الكريم الخضير	عبد الكريم الخضير	ShamAY	166	0.26633
		قضاء الأرب في أسئلة حلب	أبو الحسن تقي الدين علي بن عبد الكافي السبكي (المتوفى: 756 ه)	ShamelaY19	18610	0.26633
		النفحة المسكية في الرحلة المكية	عبد الله بن حسين السويدي البغدادي	Rafed	2252	0.26633
		التعليق على تفسير الجلالين - عبد الكريم الخضير	عبد الكريم الخضير	ShamAY	74	0.26632
		الفرقان في تفسير القرآن بالقرآن والسنّة [ج ١٧]	الشيخ محمد الصادقي	Rafed	3038	0.26632
		طبّ الإمام الصادق عليه السلام	محمد الخليلي	Masaha	1740	0.26632
		 دلائل الصدق لنهج الحق 	 الشيخ محمد حسن المظفر 	ABLibrary	939	0.26631
		فقه القرآن [ج ١]	قطب الدين سعيد بن هبة الله الراوندي [ قطب الدين الراوندي ]	Rafed	1287	0.26631
		أيسر التفاسير لكلام العليّ الكبير [ج ٢]	أبي بكر جابر الجزائري	Rafed	3465	0.26631
		مباحث في التفسير الموضوعي	مصطفى مسلم	ShamAY	7314	0.2663
		الفتنة ووقعة الجمل	سيف بن عمر الأسدي التَّمِيمي (المتوفى: 200هـ)	ShamAY	7536	0.2663
		موسوعه توقيعات الامام المهدي ( عجل الله تعالي فرجه الشريف )	محمد تقي اكبر نژاد	Ghbook	885	0.2663
		 إتحاف الورى بأخبار أم القرى 	 عمر بن محمد ابن فهد 	ABLibrary	8941	0.26628
		الدكتور علي جمعة إلى أين	طلحة محمد المسير	ShamelaY19	37659	0.26627
		البشري في ذكر من حظي برويه  الحجه  الكبري (عجل الله تعالي فرجه)	موسسه پيام امام هادي عليه السلام	Ghbook	14747	0.26627
		لماذا يمزق القرآن الكريم؟؟	علي بن نايف الشحود	ShamAY	33273	0.26626
		درج الدرر في تفسير الآي والسور ط الفكر	أبو بكر عبد القاهر بن عبد الرحمن بن محمد الفارسي الأصل، الجرجاني الدار (المتوفى: 471ه)	ShamelaY19	122187	0.26625
		شرح منظومة الزمزمي في علوم القرآن	عبد الكريم الخضير	ShamAY	36814	0.26624
		أحكام القرآن [ج ٣-٤]	عماد الدين بن محمد الطبري [ الكيا الهرّاسي ]	Rafed	3147	0.26624
		التّفسير الحديث [ج ٩]	محمّد عزّة دروزة	Rafed	3762	0.26623
		علوم القرآن الكريم - نور الدين عتر	نور الدين محمد عتر الحلبي	ShamelaY19	29910	0.26622
		 مجموعة مصنفات في الخيمياء والإكسير الأعظم 	 جابر بن حيان 	ABLibrary	9805	0.26622
		أبهى المداد في شرح مؤتمر علماء بغداد [ج ١]	مقاتل بن عطيّة	Rafed	3308	0.26622
		القُرآنُ الكريمُ في مواجهِةِ الجاهليَّة	علي بن نايف الشحود	ShamAY	354	0.26621
		جامع المسائل لابن تيمية ط عالم الفوائد - المجموعة الرابعة	شيخ الإسلام أحمد بن عبد الحليم بن عبد السلام ابن تيمية (661 - 728 هـ)	ShamAY	37985	0.26621
		علم البديع	الدكتور عبدالعزيز عتيق	Rafed	2535	0.26621
		شمس العلوم [ج ١٢]	نشوان بن سعيد الحميري	Rafed	1473	0.26621
		نظره في كتاب الصراع بين الاسلام و الوثنيه	عبدالحسين اميني ( علامه اميني )	Ghbook	4545	0.26621
		الآيات البينات في عدم سماع الأموات على مذهب الحنفية السادات	نعمان بن محمود الألوسي (المتوفى: 1317هـ)	ShamAY	247	0.2662
		المفصل في شرح آية الولاء والبراء	علي بن نايف الشحود	ShamAY	33095	0.2662
		كيف نحب الله ونشتاق إليه	مجدي الهلالي	ShamelaY19	36410	0.2662
		تفسير التّحرير والتّنوير [ج ١٢]	الشيخ محمّد الطاهر ابن عاشور	Rafed	2916	0.2662
		المعجزة القرآنية حقائق علمية قاطعة	أحمد عمر أبو شوفة	ShamAY	1473	0.26618
		شرح الطحاوية ت الأرناؤوط	صدر الدين محمد بن علاء الدين عليّ بن محمد ابن أبي العز الحنفي، الأذرعي الصالحي الدمشقي (المتوفى: 792هـ)	ShamAY	8352	0.26618
		منهج أهل السنة والجماعة في نقد الرجال والكتب والطوائف	ربيع بن هادي المدخلي	ShamAY	33009	0.26618
		فتاوى منوعة - الراجحي	عبد العزيز بن عبد الله بن عبد الرحمن الراجحي	ShamelaY19	36975	0.26617
		حروب صلاح الدين وفتح بيت المقدس «وهو الكتاب المسمى الفتح القسي في الفتح القدسي»	أبو عبد الله، محمد بن (محمد صفي الدين) ابن (نفيس الدين حامد) بن أُلْه، عِمَاد الدِّين الكاتب الأصبهاني (المتوفى: 597هـ)	ShamAY	32076	0.26616
		الأمثل في تفسير كتاب الله المنزل [ج ١٤]	آية الله مكارم الشيرازي	Rafed	2059	0.26616
		معالم التنزيل في تفسير القرآن = تفسير البغوي	محيي السنة، أبو محمد الحسين بن مسعود البغوي (المتوفى: 510هـ)	ShamAY	41	0.26615
		العقائد الاسلامية [ج ١]	مركز المصطفى للدراسات الإسلامية	Rafed	85	0.26614
		التعرف لمذهب أهل التصوف	أبو بكر محمد بن أبي إسحاق بن إبراهيم بن يعقوب الكلاباذي البخاري الحنفي (المتوفى: 380ه)	Sham19Y	6518	0.26612
		 الكشف عن مناهج الأدلة في عقائد الملة 	 ابن رشد 	ABLibrary	8577	0.26612
		قيس بن سعد بن عبادة الأنصاري وشعره في الغدير	الشيخ عبد الحسين الأميني النجفي	Masaha	380	0.26612
		حقيقه السنة والبدعة = الأمر بالاتباع والنهي عن الابتداع	عبد الرحمن بن أبي بكر، جلال الدين السيوطي (المتوفى: 911ه)	Sham19Y	248	0.26611
		وفيات الأعيان وأنباء أبناء الزمان	أبو العباس شمس الدين أحمد بن محمد بن إبراهيم بن أبي بكر ابن خلكان البرمكي الإربلي (المتوفى: 681هـ)	ShamAY	1000	0.2661
		شرح لامية شيخ الإسلام	عبد الكريم الخضير	ShamAY	17	0.26609
		شرح  نهج البلاغه (ابن  ميثم)	كمال الدين ميثم بن علي بن ميثم ابن ميثم بحراني	Ghbook	15955	0.26609
		فتاوى السبكي	أبو الحسن تقي الدين علي بن عبد الكافي السبكي (المتوفى: 756هـ)	ShamAY	11498	0.26608
		مختصر كتاب الاعتصام	علوي بن عبد القادر السَّقَّاف	ShamAY	22888	0.26608
		رسالة التوحيد المسمى ب تقوية الإيمان	إسماعيل بن عبد الغني بن ولي الله بن عبد الرحيم العمري الدهلوي (المتوفى: 1246ه)	Sham19Y	1123	0.26608
		بحار الأنوار [ج ٦]	الشيخ محمّد باقر بن محمّد تقي المجلسي	Rafed	519	0.26608
		المنتقى من فرائد الفوائد	محمد بن صالح بن محمد العثيمين (المتوفى: 1421هـ)	ShamAY	21802	0.26607
		الكواشف الجلية عن معاني الواسطية	الواحدي	ShamAY	35649	0.26607
		شرح زاد المستقنع - عبد الكريم الخضير	عبد الكريم الخضير	ShamelaY19	23834	0.26607
		شرح صحيح البخاري - عبد الكريم الخضير	عبد الكريم الخضير	ShamelaY19	21724	0.26606
		الأمثل في تفسير كتاب الله المنزل [ج ٥]	آية الله مكارم الشيرازي	Rafed	2042	0.26605
		البحر المحيط في التّفسير [ج ٧]	محمّد بن يوسف [ أبي حيّان الأندلسي الغرناطي ]	Rafed	2425	0.26603
		التفسير المنير [ج ١٩]	الدكتور وهبة الزحيلي	Rafed	2964	0.26601
		حلية البشر في تاريخ القرن الثالث عشر	عبد الرزاق بن حسن بن إبراهيم البيطار الميداني الدمشقي (المتوفى: 1335هـ)	ShamAY	31371	0.266
		نزهة النظر في توضيح نخبة الفكر في مصطلح أهل الأثر	أحمد بن علي بن محمد بن حجر العسقلاني (773 - 852 ه)	ShamelaY19	37456	0.266
		موسوعة علوم القرآن	عبد القادر محمد منصور	ShamelaY19	38103	0.26599
		الدّرر النجفيّة [ج ١]	الشيخ يوسف بن أحمد البحراني [ صاحب الحدائق ]	Rafed	1549	0.26598
		نزهة الأنام في محاسن الشام	أبي البقاء عبدالله بن محمد البدري المصري الدمشقي	Rafed	3209	0.26598
		رحلة ابن خلدون	عبد الرحمن بن محمد بن محمد، ابن خلدون أبو زيد، ولي الدين الحضرمي الإشبيلي (المتوفى: 808ه)	ShamelaY19	37022	0.26597
		طبّ الإمام الصادق عليه السلام	محمّد الخليلي	Rafed	74	0.26597
		القرآن منهاج حياة	غازي صبحي آق بيق	ShamAY	36734	0.26595
		المغرب في ترتيب المعرب [ج ١]	أبي الفتح ناصر الدين المطرّزي	Rafed	2322	0.26595
		أيسر التفاسير لكلام العليّ الكبير [ج ١]	أبي بكر جابر الجزائري	Rafed	3464	0.26595
		الانتصار للقرآن 	ابوبكر محمد بن طيب باقلاني	Ghbook	2849	0.26595
		شعر الفتوح الإسلامية في صدر الإسلام	الدكتور/ النعمان عبد المتعال القاضي	ShamAY	10001	0.26594
		كيف نحب الله ونشتاق إليه	مجدي الهلالي	ShamAY	284	0.26592
		الخصال الموجبة لدخول النار	علي بن نايف الشحود	ShamAY	34830	0.26592
		موسوعة فقه الابتلاء	الواحدي :: علي بن نايف الشحود	ShamAY	36105	0.2659
		بيان العلم الأصيل والمزاحم الدخيل	أبو محمد عبد الكريم بن صالح بن عبد الكريم الحميد	ShamAY	980	0.26588
		مرهم العلل المعضلة في الرد على أئمة المعتزلة	أبو محمد عفيف الدين عبد الله بن أسعد بن علي بن سليمان اليافعي (المتوفى: 768هـ)	ShamAY	6555	0.26587
		 رسائل ومقالات 	 الشيخ السبحاني 	ABLibrary	8438	0.26587
		عين اليقين [ج ١]	محمّد بن المرتضى [ الفيض الكاشاني ]	Rafed	3591	0.26587
		نيل المرام من تفسير آيات الأحكام	أبو الطيب محمد صديق خان بن حسن بن علي ابن لطف الله الحسيني البخاري القِنَّوجي (المتوفى: 1307هـ)	ShamAY	9759	0.26586
		شرح التجريد الصريح لأحاديث الجامع الصحيح - عبد الكريم الخضير	عبد الكريم الخضير	ShamAY	62	0.26586
		بحار الأنوار [ج ٧]	الشيخ محمّد باقر بن محمّد تقي المجلسي	Rafed	521	0.26586
		أصول الوصول إلى الله تعالى	أبو العلاء محمد بن حسين بن يعقوب السلفي المصري	ShamAY	31601	0.26585
		الطرائف في معرفة مذاهب الطوائف‏ - الجزء1	السيد علي بن موسى بن طاووس	Masaha	2052	0.26585
		مقامات الزمخشري	أبو القاسم محمود بن عمرو بن أحمد، الزمخشري جار الله (المتوفى: 538ه)	ShamelaY19	26586	0.26584
		نحو ثقافة إسلامية أصيلة	سليمان الأشقر، عمر	ShamelaY19	96254	0.26584
		علم المعاني	عبد العزيز عتيق (المتوفى: 1396 هـ)	ShamAY	32342	0.26583
		لطائف الإشارات = تفسير القشيري	عبد الكريم بن هوازن بن عبد الملك القشيري (المتوفى: 465ه)	ShamelaY19	23629	0.26583
		خطوات إلى السعادة	عبد المحسن بن محمد بن عبد الرحمن القاسم القحطاني	ShamAY	32279	0.26582
		 شرح توحيد الصدوق 	 القاضي سعيد القمي 	ABLibrary	8479	0.26582
		الإيمان بالجن بين الحقيقة والتهويل	علي بن نايف الشحود	ShamAY	34	0.26581
		شرح حديث الافتراق	يوسف بن محمد علي الغفيص	ShamelaY19	37784	0.2658
		 أعيان الشيعة 	 السيد محسن الأمين 	ABLibrary	82	0.2658
		بريقة محمودية في شرح طريقة محمدية وشريعة نبوية في سيرة أحمدية	محمد بن محمد بن مصطفى بن عثمان، أبو سعيد الخادمى الحنفي (المتوفى: 1156ه)	ShamelaY19	21654	0.26579
		مجمع البحرين [ج ٦]	الشيخ فخر الدين الطريحي	Rafed	1247	0.26577
		تسلية المجالس و زينة المجالس - الجزء1	السيد محمد الكركي الحائري‏	Masaha	1978	0.26577
		الجديد في تفسير القرآن المجيد	محمد بن حبيب الله سبزواري نجفي	Ghbook	2680	0.26577
		لطائف الإشارات = تفسير القشيري	عبد الكريم بن هوازن بن عبد الملك القشيري (المتوفى: 465هـ)	ShamAY	23629	0.26576
		المهذب في تفسير سورة الملك	علي بن نايف الشحود	ShamAY	33098	0.26576
		الأدب النبوي	محمد عبد العزيز بن علي الشاذلي الخَوْلي (المتوفى: 1349هـ)	ShamAY	9763	0.26575
		تراثنا ـ العدد [ 34 ]	مؤسسة آل البيت عليهم السلام لإحياء التراث ـ قم	Rafed	2785	0.26575
		أصول مهذبة	غلام حسين التبريزي	Masaha	2399	0.26575
		سلسلة الأحاديث الصحيحة وشيء من فقهها وفوائدها	أبو عبد الرحمن محمد ناصر الدين، بن الحاج نوح بن نجاتي بن آدم، الأشقودري الألباني (المتوفى: 1420ه)	Sham19Y	9442	0.26573
		 الفوائد الرجالية 	 الخاجوئي 	ABLibrary	9771	0.26572
		التفسير الجامع لسورة الملك	أبو يوسف بن اسماعيل المصري	ShamAY	33110	0.26571
		التعليق على تفسير الجلالين - عبد الكريم الخضير	عبد الكريم الخضير	ShamelaY19	23842	0.26571
		 موسوعة العتبات المقدسة 	 جعفر الخليلي 	ABLibrary	9246	0.26571
		اللّباب في علوم الكتاب [ج ١٨]	أبي حفص عمر بن علي بن عادل الدمشقي الحنبلي	Rafed	3122	0.26571
		فيض الرحيم الرحمن في أحكام ومواعظ رمضان	أبو محمد عبد الله بن محمد أحمد الطيار	ShamAY	34939	0.2657
		شرح الموطأ - عبد الكريم الخضير	عبد الكريم الخضير	ShamAY	58	0.2657
		قيمة الزمن عند العلماء	عبد الفتاح أبو غدة الحلبي الحنفي (المتوفى: 1417هـ)	ShamAY	2030	0.2657
		التبيان في أقسام القرآن - الفكر	محمد بن أبي بكر أيوب الزرعي ابن القيم أبو عبد الله	ShamAY	34413	0.26569
		واقعنا المعاصر	الواحدي :: محمد قطب	ShamAY	33331	0.26569
		أمراض القلوب وشفاؤها	تقي الدين أبو العباس أحمد بن عبد الحليم بن عبد السلام بن عبد الله بن أبي القاسم بن محمد ابن تيمية الحراني الحنبلي الدمشقي (المتوفى: 728هـ)	ShamAY	1512	0.26568
		الإستعمار أحقاد وأطماع	محمد الغزالي	ShamAY	33235	0.26567
		شرح الزرقاني على المواهب اللدنية بالمنح المحمدية	أبو عبد الله محمد بن عبد الباقي بن يوسف بن أحمد بن شهاب الدين بن محمد الزرقاني المالكي (المتوفى: 1122هـ)	ShamAY	26568	0.26567
		الانتصار للقرآن للباقلاني	محمد بن الطيب بن محمد بن جعفر بن القاسم، القاضي أبو بكر الباقلاني المالكي (المتوفى: 403هـ)	ShamAY	1397	0.26567
		المقابسات	أبو حيان التوحيدي، علي بن محمد بن العباس (المتوفى: نحو 400ه)	Sham19Y	10916	0.26567
		الجامع اللطيف في فضل مكة وأهلها وبناء البيت الشريف‏	محمد بن محمد ابن ظهيرة	Masaha	4755	0.26566
		تفسير السراج المنير ـ موافق للمطبوع	محمد بن أحمد الشربيني, شمس الدين	ShamAY	34068	0.26565
		الشبهات التي أثيرت حول دعوة الشيخ محمد بن عبد الوهاب (مطبوع ضمن بحوث ندوة دعوة الشيخ محمد بن عبد الوهاب)	عبد الكريم الخطيب	ShamAY	7648	0.26565
		الفردوس الاعلي	محمد حسين آل كاشف الغطاء	Ghbook	11123	0.26565
		معاملة الحكام في ضوء الكتاب والسنة	عبد السلام بن برجس آل عبد الكريم	ShamAY	36557	0.26564
		جامع المسائل لابن تيمية ط عالم الفوائد - المجموعة الثالثة	شيخ الإسلام أحمد بن عبد الحليم بن عبد السلام ابن تيمية (661 - 728 ه)	Sham19Y	17835	0.26564
		البرهان في متشابه القرآن	محمود بن حمزة بن نصر الكرماني	Rafed	3806	0.26564
		تفسير ابن عطية = المحرر الوجيز في تفسير الكتاب العزيز	أبو محمد عبد الحق بن غالب بن عبد الرحمن بن تمام بن عطية الأندلسي المحاربي (المتوفى: 542هـ)	ShamAY	23632	0.26562
		الخصائص [ج ٣]	أبي الفتح عثمان بن جنّي	Rafed	2089	0.26562
		العودة إلى القرآن لماذا وكيف	مجدي الهلالي	ShamAY	269	0.2656
		مأساة الزهراء عليها السلام - الجزء1	السيد جعفر مرتضى العاملي	Masaha	3216	0.2656
		الإمام الحسين في حلّة البرفير	سليمان كتّاني	Rafed	1535	0.26559
		إعلام النبلاء بتاريخ حلب الشهباء [ج ٦]	محمد راغب بن محمود بن هاشم الطبّاخ الحلبي	Rafed	2381	0.26559
		مائة من عظماء أمة الإسلام غيروا مجرى التاريخ	جهاد التُرباني	ShamAY	32419	0.26557
		تفسير القرآن الكريم - أسامة سليمان	أسامة علي محمد سليمان	Sham19Y	37769	0.26557
		 أهل البيت في مصر 	 مجموعة مؤلفين 	ABLibrary	7432	0.26557
		مع المعلمين	-	ShamAY	1990	0.26556
		شرح شواهد المغني	عبد الرحمن بن أبي بكر، جلال الدين السيوطي (المتوفى: 911 هـ)	ShamAY	32346	0.26554
		الكوكب الوهاج شرح صحيح مسلم (المسمَّى:	محمد الأمين الهرري	ShamAY	38884	0.26554
		التفسير الحديث [مرتب حسب ترتيب النزول]	محمد عزة دروزة	ShamelaY19	23603	0.26554
		العصبةُ المؤمنة بين عناية الرحمن ومكر الشيطان	علي بن نايف الشحود	ShamAY	353	0.26553
		الفتح الرباني من فتاوى الإمام الشوكاني	محمد بن علي بن محمد بن عبد الله الشوكاني اليمني (المتوفى: 1250هـ)	ShamAY	344	0.26553
		أضواء على الثقافة الاسلامية	الدكتورة نادية شريف العمري	ShamAY	8669	0.26552
		موسوعة محاسن الإسلام ورد شبهات اللئام	أحمد بن سليمان أيوب، ونخبة من الباحثين	ShamelaY19	146418	0.26552
		الانتصار لحزب الله الموحدين والرد على المجادل عن المشركين	عبد الله بن عبد الرحمن بن عبد العزيز بن عبد الرحمن بن عبد الله بن سلطان بن خميس الملقب ب"أبابطين" (المتوفى: 1282ه)	Sham19Y	7554	0.26551
		 ولاية الفقيه في حكومة الإسلام 	 السيد محمد حسين الطهراني 	ABLibrary	9445	0.26551
		تفسير التّحرير والتّنوير [ج ٧]	الشيخ محمّد الطاهر ابن عاشور	Rafed	2911	0.26551
		التّفسير الحديث  [ج ٢]	محمّد عزّة دروزة	Rafed	3690	0.26549
		غاية المنوة في آداب الصحبة وحقوق الأخوة	حازم خنفر	ShamAY	334	0.26548
		 معرفة الإمام 	 السيد محمد حسين الطهراني 	ABLibrary	8882	0.26548
		التفسير المنير [ج ١٥]	الدكتور وهبة الزحيلي	Rafed	2960	0.26548
		حقيقة البدعة وأحكامها	سعيد بن ناصر الغامدي	ShamAY	21539	0.26547
		كتاب 1213سؤال وجواب في القرآن الكريم	أبو إسلام أحمد بن علي	ShamAY	37000	0.26546
		التقرير في حكم وخطورة التكفير والتفجير	يوسف بن محمد الدخيل	ShamAY	33490	0.26546
		 أنوار الحكمة 	 الفيض الكاشاني 	ABLibrary	8351	0.26546
		البديع في نقد الشعر	أبو المظفر مؤيد الدولة مجد الدين أسامة بن مرشد بن علي بن مقلد بن نصر بن منقذ الكناني الكلبي الشيزري (المتوفى: 584هـ)	ShamAY	9225	0.26545
		طريق الهجرتين وباب السعادتين - ط عالم الفوائد	ابن القيم	ShamAY	38387	0.26545
		بحوث في الملل والنّحل [ج ٢]	الشيخ جعفر السبحاني	Rafed	42	0.26545
		الحدائق الناضرة [ج ١٠]	الشيخ يوسف بن أحمد البحراني [ صاحب الحدائق ]	Rafed	2845	0.26545
		بحار الأنوار [ج ٦٥]	الشيخ محمّد باقر بن محمّد تقي المجلسي	Rafed	1066	0.26545
		نواهد الأبكار وشوارد الأفكار = حاشية السيوطي على تفسير البيضاوي	عبد الرحمن بن أبي بكر، جلال الدين السيوطي (المتوفى: 911ه)	ShamelaY19	29882	0.26544
		مدخل إلى تفسير القرآن وعلومه	عدنان محمد زرزور	ShamelaY19	38031	0.26544
		نزهة الأنام في محاسن الشام‏  - الجزء1	عبد الله بن محمد البدري	Masaha	4227	0.26543
		 الوهابية بين المباني الفكرية والنتائج العملية 	 الشيخ السبحاني 	ABLibrary	8677	0.26542
		درء تعارض العقل والنقل أو موافقة صحيح المنقول لصريح المعقول	تقي الدين أحمد بن عبد السلام بن عبد الحليم بن عبد السلام بن تيمية	ShamAY	33865	0.2654
		النهر الفائق شرح كنز الدقائق	سراج الدين عمر بن إبراهيم بن نجيم الحنفي (ت 1005ه)	Sham19Y	13620	0.2654
		تراثنا العدد [ 58 ]	مؤسسة آل البيت عليهم السلام لإحياء التراث ـ قم	Rafed	3242	0.2654
		العقائد الاسلامية	علي كوراني	Ghbook	15126	0.2654
		رسائل وفتاوى العلامة عبد الله بن عبد الرحمن أبي بطين (مطبوع ضمن مجموعة الرسائل والمسائل النجدية، الجزء الثاني)	عبد الله بن عبد الرحمن بن عبد العزيز بن عبد الرحمن بن عبد الله بن سلطان بن خميس الملقب بـ"أبابطين" (المتوفى: 1282هـ)	ShamAY	11212	0.26539
		التعرف لمذهب أهل التصوف	أبو بكر محمد بن أبي إسحاق بن إبراهيم بن يعقوب الكلاباذي البخاري الحنفي (المتوفى: 380هـ)	ShamAY	6518	0.26539
		وليد الكعبة	السيد محمد رضا الحسيني الجلالي	Rafed	3121	0.26539
		الإيضاح في علوم البلاغة	جلال الدين محمّد بن عبد الرحمن بن عمر بن أحمد	Rafed	1998	0.26538
