automatic URI	Proposed URI	bookTitle	authorName	collection	id	tfidf
		ديوان الأقيشر السعدي	أبو معرض المغيرة بن عبد الله بن معرض الأسدي المتوفى سنة 80هـ	ShamAY	37940	0.99297
		ديوان دعبل بن علي	دعبل الخزاعى، ابو على دعبل بن على بن رزين (148 - 246 هـ)	ShamAY	37947	0.58656
		ديوان ابن المعتز	أبو العباس عبد الله بن محمد المعتز بالله بن المتوكل بن المعتصم بن الرشيد العباسي، المتوفى سنة 296 هـ	ShamAY	37841	0.56488
		ديوان علي بن أبي طالب	علي بن أبي طالب الصحابي الجليل	ShamAY	37911	0.54986
		ديوان ديك الجن	ديك الجن الحمصي عبد السلام بن رغبان. (161 - 236 هـ).	ShamAY	37948	0.54636
		ديوان الإمام الشافعي	أبى عبد الله محمد بن ادريس الشافعى المتوفى عام 204 هـ	ShamAY	37916	0.5373
		ديوان ابن عنين	محمد بن نصر الله بن مكارم الحسن بن عنين الزرعي الدمشقي الأنصاري	ShamAY	37875	0.53719
		ديوان الحسن بن هانئ أبي نواس	أبو نواس	ShamAY	37852	0.53298
		ديوان أسامة بن منقذ	أبو المظفر أسامة بن مرشد بن منقذ الكناني المتوفى سنة 488 هـ	ShamAY	37915	0.52926
		ديوان الواواء الدمشقي	محمد بن أحمد الغساني الدمشقي أبو الفرج	ShamAY	37832	0.52633
		ديوان ابن عبد ربه الأندلسي	ابن عبد ربه الأندلسي	ShamAY	37874	0.52587
		ديوان الأحوص	عبد الله بن محمد بن عبد الله بن عاصم الأنصاري المتوفى سنة 105هـ	ShamAY	37939	0.52319
		ديوان الباخرزي	علي بن الحسن بن علي بن أبي الطيب الباخرزي أبو الحسن المتوفى سنة 460 هـ	ShamAY	37843	0.52141
		ديوان كشاجم	كشاجم، ابو الفتح محمد بن الحسين بن السندى بن مشاهك الرملى	ShamAY	37962	0.52
		ديوان عبد الصمد بن المعذل	عبد الصمد بن المعذل	ShamAY	37953	0.51996
		ديوان الحكم بن أبي الصلت	أمية بن عبد العزيز الأندلسي أبو الصلت (1068 ـ 1134م)	ShamAY	37851	0.51157
		ديوان عرقلة الكلبي	حسان بن نمير بن عجل الكلبي والمعروف أيضا بـ عرقلة الدمشقي وعرقلة الأعور	ShamAY	37935	0.51118
		ديوان الشاب الظريف	شمس الدين محمد بن العفيف التلمساني المتوفى سنة 688 هـ	ShamAY	37889	0.51081
		ديوان أبي منصور الثعالبي	عبد الملك بن محمد بن إسماعيل الثعالبي النيسابوري	ShamAY	37824	0.51023
		ديوان أبي الفضل بن الأحنف	أبو الفضل العباس بن الاحنف بن الأسود بن طلحة 192 هـ	ShamAY	37818	0.50751
		ديوان ابن رشيق القيرواني الأزدي	أبو علي الحسن بن رشيق المعروف بالقيرواني (390 ـ 463 هـ)	ShamAY	37868	0.50273
		ديوان الخالديان	الخالديان	ShamAY	37826	0.49592
		ديوان عمر ابن أبي ربيعة	عمر بن عبد الله بن أبي ربيعة المخزومي القرشي، أبو الخطاب.	ShamAY	37902	0.49389
		ديوان المتنبي	أبو الطيب المتنبي أحمد بن الحسين الكوفي (303هـ -354 هـ).	ShamAY	37830	0.48963
		ديوان علية بنت المهدي	علية بنت المهدي المشهورة بالعباسة	ShamAY	37900	0.48881
		ديوان أبي فراس الحمداني	أبو فراس الحمداني	ShamAY	37823	0.48745
		ديوان إبراهيم اليازجي	اليازجي، إبراهيم	ShamAY	37937	0.48515
		ديوان أبي نواس	أبو نواس الحسن بن هاني الحكمي المتوفى سنة 338هـ	ShamAY	37825	0.48282
		ديوان بهاء الدين	أبو الفضل بهاء الدين زهير بن محمد بن على بن يحى 581 - 656هـ	ShamAY	37942	0.47677
		ديوان أبي العتاهية	أبو العَتاهِيَة إسماعيل بن القاسم بن سويد العيني، العنزي، أبو إسحاق.	ShamAY	37815	0.47256
		ديوان ابن القيسراني	محمد بن نصر بن صغير بن داغر المخزومي الخالدي، أبو عبد الله، شرف الدين بن القيسراني (478 - 548 هـ / 1085 - 1153 م)	ShamAY	37840	0.44816
		ديوان لسان الدين الخطيب	محمد بن عبدالله بن سعيد السلماني اللوشي الأصل، الغرناطي الأندلسي، أبو عبد الله الشهير بـ " لسان الدين بن الخطيب "	ShamAY	37834	0.44411
		ديوان ابن معصوم المدني	علي صدر الدين بن محمد معصوم المدني ( 1052 ـ 1119 هـ	ShamAY	37878	0.44126
		ديوان معاوية بن أبي سفيان	معاوية بن أبي سفيان صخر بن حرب بن أمية بن عبد شمس بن عبد مناف القرشي	ShamAY	37860	0.44089
		ديوان بديع الزمان الهمذاني	الهمذانى، ابوالفضل احمد بن الحسين بن يحيى بن سعيد 398 هـ	ShamAY	37929	0.44
		ديوان عبد الله بن المبارك	الإمام عبدالله بن المبارك (110 هـ - 181 هـ)	ShamAY	37918	0.43995
		ديوان سبط ابن التعاويذي	أبو الفتح محمد بن عبيد الله بن عبد الله، المعروف بـ"سبط ابن التعاويذي"	ShamAY	37949	0.4399
		ديوان الحطيئة	أبو مُلَيْكة جرول بن أوس بن مالك العبسي المشهور بـ الحطيئة	ShamAY	37850	0.43622
		ديوان صفي الدين الحلي	صفى الدين الحلى، عبدالعزيز بن سرايا على بن ابى القاسم السنبسى	ShamAY	37951	0.43341
		ديوان محمود سامي البارودي	محمود سامي باشا بن حسن حسين بن عبد الله البارودي المصري	ShamAY	37857	0.42993
		ديوان ابن الزقاق البلنسي	ابن الزقاق البلنسي	ShamAY	37839	0.42544
		ديوان جبران خليل جبران	جبران بن خليل جبران بن ميخائيل بن سعد، من أحفاد يوسف جبران الماروني شاعر لبناني (1300 - 1349 هـ / 1883 - 1931 م)	ShamAY	37946	0.42014
		ديوان ابن سهل الأندلسي	ابراهيم بن سهل الاندلسي الاسرائيلي الاشبيلي	ShamAY	37871	0.41913
		ديوان ابن دريد	ابوبكر محمد بن الحسن بن دريد بن عتاهيه بن خيثم 223 - 321هـ	ShamAY	37867	0.41789
		ديوان أبي تمام	أبي تمام الطائي حبيب بن أوس المتوفى سنة 231 هـ	ShamAY	37821	0.41747
		ديوان عبد الله الخفاجي	ابو محمد عبد الله بن محمد بن سعيد بن يحيى بن الحسين بن محمود بن الربيع المعروف بابن سنان الخفاجي الحلبي	ShamAY	37956	0.41518
		ديوان الأخطل	غياث بن غوث الأخطل	ShamAY	37927	0.41472
		ديوان النابغة الذبياني	هو زياد بن معاوية بن ضباب بن جابر بن يربوع بن مرّة بن عوف بن سعد، الذبياني، الغطفاني (605 م)	ShamAY	37896	0.41392
		ديوان بشار بن برد	أبو معاذ بشار بن برد بن يرجوخ العقيلى 95 - 167 هـ	ShamAY	37930	0.4138
		ديوان ابن الخياط	ابن الخياط، احمد بن محمد بن على بن يحيى التغلبى 450 - 517 هـ	ShamAY	37837	0.4136
		ديوان عبد الجبار بن حمديس	عبد الجبار بن أبي بكر بن محمد بن حمديس الأزدي الصقلي أبو محمد	ShamAY	37952	0.41139
		ديوان عماد الدين الأصبهاني	محمد بن صفي الدين الملقب بـ عماد الدين الأصفهاني (1125 ـ 1201م )	ShamAY	37901	0.41006
		ديوان مروان ابن أبي حفصة	مروان بن سلمان بن يحيى بن أبي حفصة، كنيته أبو الهيندام أو أبو السمط، ولقبه ذو الكمر. ( 105 - 182 هـ / 723 - 798 م )	ShamAY	37859	0.40964
		ديوان أبي الشمقمق	مروان بن محمد أبو الشمقمق.	ShamAY	37964	0.40902
		ديوان ابن زيدون	أحمد بن عبد الله بن زيدون	ShamAY	37870	0.40877
		ديوان حافظ إبراهيم	حافظ إبراهيم الملقب بشاعر النيل	ShamAY	37924	0.40627
		ديوان ابن خفاجة	أبو إسحاق إبراهيم بن أبي الفتح الأندلسي المتوفى سنة 533 هـ	ShamAY	37865	0.40195
		ديوان ابن النبيه	علي بن محمد بن الحسن بن يوسف أبو الحسن كمال الدين	ShamAY	37842	0.39779
		ديوان جرير	جرير بن عطية بن حذيفة الخطفي الكلبي اليربوعي (28 ـ 110 هـ)	ShamAY	37926	0.39718
		ديوان البحتري	البحتري	ShamAY	37844	0.39512
		ديوان ابن شهاب	أبو بكر بن شهاب الحميني الحضرمي	ShamAY	37872	0.39201
		ديوان عدي بن الرقاع	عدي بن زيد بن مالك بن عدي بن زيد بن مالك بن عدي بن الرقاع العاملي	ShamAY	37957	0.39165
		ديوان الشريف المرتضى	علي بن الحسين بن موسى بن محمد بن إبراهيم أبو القاسم.	ShamAY	37891	0.38924
		ديوان الراعي النميري	الراعي عُبَيد بن حُصين بن معاوية بن جندل، النميري، أبو جندل	ShamAY	37882	0.38851
		ديوان الهبل	الهبل	ShamAY	37831	0.38708
		ديوان الفرزدق	همام بن غالب بن صعصعة التميمي الدارمي وكنيته أبو فراس (38هـ/658م - 110هـ/728م).	ShamAY	37829	0.38678
		ديوان الرصافي البلنسي	أبو عبد الله محمد بن غالب الرصافي البلنسي المتوفى سنة 572 هـ	ShamAY	37883	0.38597
		ديوان مجنون ليلى	مجنون ليلى، قيس بن الملوح	ShamAY	37853	0.38376
		ديوان أبي الفضل الميكالي	أبو الفضل الميكالي	ShamAY	37817	0.38308
		ديوان الشريف الرضي	محمد بن الحسين بن موسى، أبو الحسن، الرضي العلوي الحسيني الموسوي.	ShamAY	37890	0.38249
		ديوان معروف الرصافي	معروف الرصافي	ShamAY	37861	0.37836
		ديوان أحمد محرم	أحمد محرم	ShamAY	37925	0.37775
		ديوان أبي طالب	أبو طالب (عم النبي ـ صلى الله عليه وسلم)	ShamAY	37822	0.37748
		ديوان قيس لبنى	قيس بن ذريح بن سنة بن حذافة الكناني. شاعر من العشاق المتيمين، اشتهر بحب لبنى بنت الحباب الكعبية، المتوفى سنة (68 هـ / 687 م)	ShamAY	37908	0.37585
		ديوان السيد الحميري	إسماعيل بن محمد بن يزيد بن ربيعة بن مفرّع الحميري. لقبه " السيّد " وكنيته " أبو هاشم " وجدّه " يزيد بن ربيعة "	ShamAY	37888	0.37484
		ديوان عامر بن الطفيل	عامر بن الطفيل بن مالك بن جعفر العامرى، 10 هـ	ShamAY	37922	0.37411
		ديوان الخنساء	تماضر بنت عمرو والمعروفة بـ الخنساء	ShamAY	37828	0.37402
		ديوان جميل بثينة	جميل بن عبد الله بن معمر العذري القضاعي، أبو عمرو	ShamAY	37931	0.37311
		ديوان كثير عزة	كثير عزة بن عبد الرحمن بن الأسود بن مليح من خزاعة	ShamAY	37909	0.37018
		ديوان عبد الغفار الأخرس	عبد الغفار بن عبد الواحد بن دهب الأخرس 1290 هـ	ShamAY	37954	0.36885
		ديوان ابن نباتة المصري	جمال الدين بن نباته المصرى المتوفى سنة 768هـ	ShamAY	37880	0.36878
		ديوان البوصيري	شرف الدين محمد بن سعيد بن حمّاد الجنوني الصنهاجي (608 ـ 696 هـ)	ShamAY	37846	0.36783
		ديوان عبد الغني النابلسي	الشيخ عبد الغني ابن اسماعيل بن عبد الغني بن اسماعيل بن أحمد بن إبراهيم المعروف كأسلافه بالنابلسي الحنفي الدمشقي النقشبندي (1050 ـ 1143 هـ)	ShamAY	37955	0.36599
		ديوان عروة بن أذينة	عروة بن يحيى بن مالك بن الحارث الليثي ( 130 هـ / 747 م )	ShamAY	37958	0.36587
		ديوان أحمد شوقي	أحمد شوقي (1285 - 1351 هـ)	ShamAY	37923	0.36542
		ديوان حيدر بن سليمان الحلي	حيدر بن سليمان بن داود الحلي الحسيني	ShamAY	37945	0.36527
		ديوان الحداد القيسي	أبو عبد الله محمد بن أحمد بن عثمان القيسي المتوفى سنة 480 هـ	ShamAY	37849	0.36076
		ديوان الأبيوردي	أبو المظفر محمد بن أحمد القرشي الأموي المعلوي المشهور بالابيوردي المتوفى سنة 557 هـ	ShamAY	37938	0.36065
		ديوان ابن هانئ الأندلسي	أبو القاسم محمد بن هانئ بن سعدون الأزدي الأندلسي	ShamAY	37881	0.35807
		ديوان ابن مقبل	تميم بن أبي بن مقبل	ShamAY	37879	0.35594
		ديوان السري الرفاء	أبو الحسن السرى بن أحمد بن السرى الكندى - 366 هـ	ShamAY	37885	0.35428
		ديوان ابن مشرف	أحمد بن علي بن حسين بن مشرف , ت: 1285 هـ	ShamAY	37876	0.34715
		ديوان ثابت بن جابر	ثابت بن جابر بن سفيان بن عميثل المشهور بلقب: تأبط شرا	ShamAY	37943	0.3456
		ديوان ابن دارج القسطلي	أحمد بن محمد بن العاصي بن دراج القسطلي الأندلسي أبو عمر	ShamAY	37866	0.34355
		ديوان طفيل الغنوي	طفيل بن عوف بن كعب من بني غني من قيس عيلان المتوفى سنة 609م	ShamAY	37934	0.34189
		ديوان أوس بن حجر	أوس بن حجر بن مالك التميمي أبو شريح	ShamAY	37914	0.34146
		ديوان ابن الرومي	ابن الرومي علي بن العباس بن جريج	ShamAY	37838	0.33941
		ديوان الطرماح	الطرماح بن حكيم بن الحكم بن نفر بن قيس الطائي	ShamAY	37894	0.33933
		منار الهدى في بيان الوقف والابتدا ومعه المقصد لتلخيص ما في المرشد	الأُشْمُوني، المقرئ	ShamAY	1234	0.33832
		غزو البحار فضله، وأحكامه، وأشهر قادته المسلمين في القرن الهجري الأول	سامي صالح القحطاني	ShamAY	36117	0.33699
		ديوان محمد بن حازم الباهلي	محمد بن حازم بن عمرو الباهلي بالولاء أبو جعفر المتوفى سنة 830 م	ShamAY	37856	0.33506
		ديوان وضاح اليمن	وضاح اليمن, عبد الرحمن بن إسماعيل بن عبد كلال من آل خوذان الحميري المتوفى سنة (90 هـ / 708 م)	ShamAY	37963	0.33291
		ديوان ابن حيوس	محمد بن سلطان بن محمد بن حيوس، الغنوي	ShamAY	37864	0.33149
		ديوان حاتم الطائي	حاتم بن عبد الله بن سعد بن الحشرج بن أمرئ القيس	ShamAY	37913	0.33032
		ديوان أبي الهدى الصيادي	محمد بن حسن وادي بن علي بن خزام الصيادي الرفاعي الحسيني، أبو الهدى.	ShamAY	37820	0.32999
		ديوان عروة بن الورد	عروة بن الورد بن زيد العبسي، من غطفان من شعراء الجاهلية	ShamAY	37959	0.32936
		منار الهدى في بيان الوقف والابتدا ت عبد الرحيم الطرهوني	أحمد بن عبد الكريم بن محمد بن عبد الكريم الأشموني المصري الشافعي (المتوفى: نحو 1100هـ)	ShamAY	1291	0.32841
		 رحلة ابن معصوم المدني ( سلوة الغريب وأسوة الأريب ) 	 السيد علي صدر الدين المدني ( ابن معصوم ) 	ABLibrary	9080	0.3273
		ديوان مهلهل بن ربيعة	عدي بن ربيعة بن الحارث بن مرة بن هبيرة التغلبي الوائلي. بني جشم، من تغلب (توفي 94 ق. هـ/531 م).	ShamAY	37862	0.32651
		رحلة ابن معصوم المدني أو سلوة الغريب وأسوة الأريب	السيد علي صدر الدين المدني	Rafed	2267	0.32577
		ديوان ذو الرمة	غيلان بن عقبة بن نهيس بن مسعود العدوي. أبو الحارث. ذو الرمة	ShamAY	37932	0.32349
		رحلة الشتاء والصيف	محمد بن عبد الله بن محمد، من أحفاد شرف الدين بن يحيى الحمزي الحسيني المولوي المعروف بـ كِبْرِيت (المتوفى: 1070هـ)	ShamAY	622	0.32274
		التمثيل والمحاضرة	عبد الملك بن محمد بن إسماعيل أبو منصور الثعالبي (المتوفى: 429ه)	Sham19Y	5683	0.32238
		ديوان علي بن محمد التهامي	أبو الحسن على بن محمد بن فهد التهامي المتوفى سنة 416 هـ	ShamAY	37899	0.32183
		قلائد العقيان	الفتح بن خاقان بن أحمد بن غرطوج، أبو محمد (المتوفى: 247ه)	Sham19Y	21510	0.32174
		التمثيل والمحاضرة	عبد الملك بن محمد بن إسماعيل أبو منصور الثعالبي (المتوفى: 429هـ)	ShamAY	5683	0.32129
		رحلة الشتاء والصيف	محمد بن عبد الله بن محمد، من أحفاد شرف الدين بن يحيى الحمزي الحسيني المولوي المعروف ب كبريت (المتوفى: 1070ه)	ShamelaY19	37345	0.32105
		ديوان مهيار الديلمي	مهيار بن مرزويه، أبو الحسن الديلمي المتوفى سنة (428 هـ / 1037 م)	ShamAY	37863	0.32013
		ديوان ابن شهيد	أحمد بن عبد الملك بن أحمد بن شهيد 382 - 426 هـ	ShamAY	37873	0.31975
		نزهة الأبصار بطرائف الأخبار والأشعار	عبد الرحمن بن عبد الله بن أحمد بن درهم (المتوفى: 1362هـ)	ShamAY	5375	0.31939
		 أدب الطف أو شعراء الحسين ( ع ) 	 جواد شبر 	ABLibrary	7400	0.31882
		منار الهدى في بيان الوقف والابتدا ومعه المقصد لتلخيص ما في المرشد	الأشموني، المقرئ	ShamelaY19	38091	0.31866
		قلائد العقيان	الفتح بن خاقان بن أحمد بن غرطوج، أبو محمد (المتوفى: 247ه)	ShamelaY19	21510	0.31858
		أدب الطّف أو شعراء الحسين عليه السلام [ج ٢]	جواد شبّر	Rafed	318	0.31776
		قلائد العقيان	الفتح بن خاقان بن أحمد بن غرطوج، أبو محمد (المتوفى: 247هـ)	ShamAY	21510	0.31765
		ديوان ابن معتوق	شهاب الدين بن معتوق الموسوي الحويزي.	ShamAY	37877	0.3173
		الكشكول	محمد بن حسين بن عبد الصمد الحارثي العاملي الهمذاني، بهاء الدين (المتوفى: 1031هـ)	ShamAY	1571	0.31609
		ديوان ابن زمرك	محمد بن يوسف الصريحي الاندلسي الغرناطي	ShamAY	37869	0.31593
		النكت العصرية في أخبار الوزراء المصرية	عمارة بن علي بن زيدان الحكمي المذحجي اليمني، أبو محمد، نجم الدين (المتوفى: 569ه)	Sham19Y	9248	0.31587
		ديوان كعب بن زهير	كعب بن زهير بن أبي سلمى، المزني، أبو المضرَّب شاعر مخضرم	ShamAY	37833	0.31501
		أشعار أولاد الخلفاء وأخبارهم	أبو بكر محمد بن يحيى بن عبد الله الصولي (المتوفى: 335هـ)	ShamAY	7822	0.31493
		النكت العصرية في أخبار الوزراء المصرية	عمارة بن علي بن زيدان الحكمي المذحجي اليمني، أبو محمد، نجم الدين (المتوفى: 569هـ)	ShamAY	9248	0.31488
		رسالة الغفران	أحمد بن عبد الله بن سليمان بن محمد بن سليمان، أبو العلاء المعري، التنوخي (المتوفى: 449هـ)	ShamAY	1589	0.31366
		الذخيرة في محاسن أهل الجزيرة	أبو الحسن علي بن بسام الشنتريني (المتوفى: 542هـ)	ShamAY	1035	0.31314
		التذكرة الفخرية	الصاحب بهاء الدين علي بن عيسى بن أبي الفتح الإربلي (المتوفى: 692هـ)	ShamAY	724	0.31306
		نور الطرف ونور الظرف	إبراهيم بن علي بن تميم الأنصاري، أبو إسحاق الحصري (المتوفى: 453هـ)	ShamAY	5351	0.31276
		 أدب الطف أو شعراء الحسين ( ع ) 	 جواد شبر 	ABLibrary	7401	0.31276
		طوق الحمامة في الألفة والألاف	أبو محمد علي بن أحمد بن سعيد بن حزم الأندلسي القرطبي الظاهري (المتوفى: 456هـ)	ShamAY	10518	0.31251
		تحرير التحبير في صناعة الشعر والنثر وبيان إعجاز القرآن	عبد العظيم بن الواحد بن ظافر ابن أبي الإصبع العدواني، البغدادي ثم المصري (المتوفى: 654ه)	Sham19Y	26520	0.31239
		زهر الآداب وثمر الألباب	إبراهيم بن علي بن تميم الأنصاري، أبو إسحاق الحصري القيرواني (المتوفى: 453ه)	Sham19Y	10768	0.31217
		أدب الطّف أو شعراء الحسين عليه السلام [ج ٣]	جواد شبّر	Rafed	361	0.31209
		مجموعة القصائد الزهديات	أبو محمد عبد العزيز بن محمد بن عبد الرحمن بن عبد المحسن السلمان (المتوفى: 1422هـ)	ShamAY	1268	0.31203
		ربيع الأبرار ونصوص الأخيار	جار الله الزمخشري توفي 583 هـ	ShamAY	10668	0.31177
		الوسيط في تراجم أدباء شنقيط والكلام على تلك البلاد تحديدا وتخطيطا وعاداتهم وأخلاقهم وما يتعلق بذلك	أحمد بن الأمين الشّنْقِيطي (المتوفى: 1331هـ)	ShamAY	1629	0.31175
		 مسالك الأبصار في ممالك الأمصار 	 أحمد بن يحيى العمري 	ABLibrary	9197	0.31113
		 البخلاء 	 الجاحظ 	ABLibrary	809	0.31042
		مجموعة القصائد الزهديات	أبو محمد عبد العزيز بن محمد بن عبد الرحمن بن عبد المحسن السلمان (المتوفى: 1422ه)	ShamelaY19	38155	0.30984
		خاص الخاص	عبد الملك بن محمد بن إسماعيل أبو منصور الثعالبي (المتوفى: 429هـ)	ShamAY	7830	0.3096
		الوسيط في تراجم أدباء شنقيط والكلام على تلك البلاد تحديدا وتخطيطا وعاداتهم وأخلاقهم وما يتعلق بذلك	أحمد بن الأمين الشنقيطي (المتوفى: 1331ه)	ShamelaY19	95696	0.30948
		تحرير التحبير في صناعة الشعر والنثر وبيان إعجاز القرآن	عبد العظيم بن الواحد بن ظافر ابن أبي الإصبع العدواني، البغدادي ثم المصري (المتوفى: 654ه)	ShamelaY19	26520	0.30942
		ربيع الأبرار و نصوص الأخبار - الجزء1	ابو القاسم محمود بن عمر الزمخشري	Masaha	2979	0.3093
		 مسالك الأبصار في ممالك الأمصار 	 أحمد بن يحيى العمري 	ABLibrary	9194	0.30912
		تاريخ مدينة دمشق [ج ٧٧]	أبي القاسم علي بن الحسن ابن هبة الله بن عبد الله الشافعي [ ابن عساكر ]	Rafed	2664	0.30907
		تاريخ مدينة دمشق [ج ٧٨]	الناشر: دار الفكر للطباعة والنشر والتوزيع	Rafed	2665	0.309
		 أدب الطف أو شعراء الحسين ( ع ) 	 جواد شبر 	ABLibrary	7402	0.30895
		المحمدون من الشعراء وأشعارهم	جمال الدين أبو الحسن علي بن يوسف القفطي (المتوفى: 646هـ)	ShamAY	1253	0.30886
		 مجموعه رسائل ابن عربي 	 ابن عربي 	ABLibrary	8751	0.30885
		خريدة القصر وجريدة العصر - قسم شعراء المغرب والأندلس جـ 2	عماد الدين الكاتب الأصبهاني، محمد بن محمد صفي الدين بن نفيس الدين حامد بن أله، أبو عبد الله (المتوفى: 597هـ)	ShamAY	12856	0.30882
		نفحة الريحانة ورشحة طلاء الحانة	محمد أمين بن فضل الله بن محب الدين بن محمد المحبي (المتوفى: 1111هـ)	ShamAY	579	0.30872
		 المواعظ والإعتبار في ذكر الخطط والآثار ( ط بيروت ) 	 المقريزي 	ABLibrary	9233	0.3086
