automatic URI	Proposed URI	bookTitle	authorName	collection	id	tfidf
		 منتهى السؤل على وسائل الوصول إلى شمائل الرسول ( ص ) 	 عبد الله بن سعيد محمد عبادي اللحجي 	ABLibrary	7801	0.25824
		معدن الجواهر ورياضة الخواطر	الشيخ القاضي أبي الفتح محمد بن علي الكراجكي	Masaha	4571	0.25824
		الفرقان بين أولياء الرحمن وأولياء الشيطان	تقي الدين أبو العباس أحمد بن عبد الحليم بن عبد السلام بن عبد الله بن أبي القاسم بن محمد ابن تيمية الحراني الحنبلي الدمشقي (المتوفى: 728ه)	Sham19Y	21499	0.25823
		 دفع شبه التشبيه بأكف التنزيه 	 ابن الجوزي 	ABLibrary	995	0.25823
		 الفرقة الناجية 	 الشيخ ابراهيم القطيفي 	ABLibrary	8524	0.25823
		 غاية المرام في علم الكلام 	 سيف الدين الآمدي 	ABLibrary	8522	0.25822
		الوافية في أصول الفقه	عبد الله بن محمّد البشروي الخراساني	Rafed	336	0.25822
		الحسام الماحق لكل مشرك ومنافق	أبو شكيب محمد تقي الدين بن عبد القادر الهلالي (المتوفى: 1407هـ)	ShamAY	1702	0.25821
		 الجامع اللطيف 	 ابن ظهيرة 	ABLibrary	9031	0.25821
		التعليقات على شرائع الإسلام - الجزء1	السيد صادق الحسيني الشيرازي	Masaha	4950	0.25821
		حوار في التسامح والعنف	معهد الرسول الأكرم(ص)	Masaha	566	0.25821
		المفهم لما أشكل من تلخيص كتاب مسلم	أبو العبَّاس أحمَدُ بنُ عُمَرَ بنِ إبراهيمَ الحافظ، الأنصاريُّ القرطبيُّ ت 656 هـ	ShamAY	35976	0.2582
		كشف الأسرار شرح أصول البزدوي	عبد العزيز بن أحمد بن محمد، علاء الدين البخاري الحنفي (المتوفى: 730هـ)	ShamAY	9062	0.25819
		دروس الشيخ سيد حسين العفاني	أبو التراب سيد بن حسين بن عبد الله العفاني	ShamAY	845	0.25819
		 جواهر الكلام في ثوبه الجديد 	 الشيخ الجواهري 	ABLibrary	9365	0.25819
		إستقصاء الإعتبار [ج ١]	الشيخ محمّد بن الحسن بن الشّهيد الثّاني	Rafed	549	0.25818
		نشر المحاسن اليمانيّة	ابن الديبع الشيباني الشافعي	Rafed	2551	0.25818
		السلفيون وقضية فلسطين في واقعنا المعاصر وفيه (حكم عمليات الاقتحام بالنفس)	أبو عبيدة مشهور بن حسن بن محمود آل سلمان	ShamAY	1691	0.25817
		فقه الزكاة	يوسف القرضاوي	ShamAY	36406	0.25816
		نظرات في التربية الإيمانية	مجدي الهلالي	Sham19Y	36414	0.25816
		المدرّس الأفضل [ج ٢]	الشيخ محمّد علي المدرّس الأفغاني	Rafed	2680	0.25816
		القمقام الزخار والصمصام البتار	فرهاد ميرزا قاجار	Ghbook	12701	0.25816
		خطرة الطيف	أبي عبد الله محمّد بن عبد الله بن سعيد بن أحمد السلماني [ لسان الدين بن الخطيب ]	Rafed	2292	0.25815
		الحديقه الهلاليه شرح دعاء الهلال من صحيفه السجاديه	بهاءالدين محمد بن حسين شيخ بهائي	Ghbook	14627	0.25814
		الوهابيّون والبيوت المرفوعة	الشيخ محمد علي بن الحسن الهمداني السنقري الكردستاني	Rafed	3456	0.25813
		جواهر البلاغة في المعاني والبيان والبديع	أحمد بن إبراهيم بن مصطفى الهاشمي (المتوفى: 1362هـ)	ShamAY	9256	0.25812
		الحاكم الجشمي ومنهجه في التفسير	عدنان محمد زرزور	ShamAY	1091	0.25812
		تراثنا ـ العددان [ 38 و 39 ]	مؤسسة آل البيت عليهم السلام لإحياء التراث ـ قم	Rafed	2798	0.25812
		السيرة النبوية - دروس وعبر	مصطفى بن حسني السباعي (المتوفى: 1384ه)	ShamelaY19	20364	0.25811
		تفسير كنز الدّقائق وبحر الغرائب [ج ٦]	الشيخ محمّد بن محمّد رضا القمّي المشهدي	Rafed	3007	0.2581
		وا محمداه {إن شانئك هو الأبتر}	أبو التراب سيد بن حسين بن عبد الله العفاني	ShamelaY19	96964	0.25808
		شريعة الله لا شريعة البشر	شحاتة محمد صقر	ShamAY	843	0.25807
		القطوف الدانية	أبو هاشم صالح بن عواد بن صالح المغامسي	ShamelaY19	37742	0.25807
		أصول الفقه المقارن فيما لا نصّ فيه	الشيخ جعفر السبحاني	Rafed	3613	0.25807
		الحدائق الناضرة [ج ٨]	الشيخ يوسف بن أحمد البحراني [ صاحب الحدائق ]	Rafed	2831	0.25807
		نتائج الفكر في النَّحو للسُّهَيلي	أبو القاسم عبد الرحمن بن عبد الله بن أحمد السهيلي (المتوفى: 581هـ)	ShamAY	613	0.25806
		منهج القرآن الكريم في دعوة المشركين إلى الإسلام	د. حمود بن أحمد بن فرج الرحيلي	ShamAY	7252	0.25805
		الاخلاق والتزكية في رحاب القرآن والسنة	عبد الكريم الحمداوي	ShamAY	34946	0.25804
		قواعد العقائد	أبو حامد محمد بن محمد الغزالي الطوسي (المتوفى: 505ه)	Sham19Y	6397	0.25804
		لوعة الشاكي ودمعة الباكي	صلاح الدين خليل بن أيبك بن عبد الله الصفدي (المتوفى: 764ه)	ShamelaY19	37494	0.25804
		علوم القرآن عند الشاطبي من خلال كتابه الموافقات	محمد سالم أبو عاصي	ShamAY	1477	0.25803
		الروح - ط عالم الفوائد	ابن القيم	ShamAY	38394	0.25803
		 ولاية الأمر في عصر الغيبة 	 السيد كاظم الحائري 	ABLibrary	9614	0.25803
		أسواق الذهب	أحمد شوقي بن علي بن أحمد شوقي (المتوفى: 1351هـ)	ShamAY	8188	0.25802
		كيف تصبح عالما	راغب السرجاني	ShamAY	639	0.25802
		العقد التليد في اختصار الدر النضيد = المعيد في أدب المفيد والمستفيد	عبد الباسط بن موسى بن محمد بن إسماعيل العلموي ثم الموقت الدمشقي الشافعيّ (المتوفى: 981هـ)	ShamAY	10016	0.25802
		 الإحاطة في أخبار غرناطة 	 لسان الدين ابن الخطيب 	ABLibrary	8949	0.25802
		إرشاد أولى البصائر والألباب لنيل الفقة بأقرب الطرق وأيسر الأسباب	أبو عبد الله، عبد الرحمن بن ناصر بن عبد الله بن ناصر بن حمد آل سعدي (المتوفى: 1376هـ)	ShamAY	1602	0.258
		شرح حديث جابر في صفة حج النبي صلى الله عليه وسلم	عبد الكريم بن عبد الله بن عبد الرحمن بن حمد الخضير	ShamAY	69	0.258
		مراحل تشريع القتال في الإسلام	الواحدي :: علي بن نايف الشحود	ShamAY	36101	0.25799
		موسوعة الاذان : اشهد ان عليا ولي الله في الاذان بين الشرعيه والابتداع	علي شهرستاني	Ghbook	16153	0.25798
		الدين الخالص أو إرشاد الخلق إلى دين الحق	محمود خطاب السبكى	ShamAY	33229	0.25797
		كتاب السرائر [ج ٢]	أبي جعفر محّمد بن منصور بن أحمد بن إدريس الحلّي	Rafed	1282	0.25797
		نضد القواعد الفقهية على مذهب الإمامية	المقداد السيوري	Masaha	1129	0.25797
		مفاهيم القرآن [ج ١٠]	الشيخ جعفر السبحاني	Rafed	452	0.25796
		الإسلام أصوله ومبادئه	محمد بن عبد الله بن صالح السحيم	ShamAY	12624	0.25794
		دروس للشيخ سفر الحوالي	سفر بن عبد الرحمن الحوالي	ShamAY	425	0.25794
		مذاهب فكرية معاصرة	محمد بن قطب بن إبراهيم	ShamAY	7378	0.25793
		علي الطنطاوي أديب الفقهاء وفقيه الأدباء	مجاهد مأمون ديرانية	ShamAY	38586	0.25793
		تفسير الماتريدي = تأويلات أهل السنة	محمد بن محمد بن محمود، أبو منصور الماتريدي (المتوفى: 333هـ)	ShamAY	1549	0.25793
		فتح الباري شرح صحيح البخاري	زين الدين عبد الرحمن بن أحمد بن رجب بن الحسن، السَلامي، البغدادي، ثم الدمشقي، الحنبلي (المتوفى: 795هـ)	ShamAY	137	0.25793
		وفاء الوفاء بأخبار دار المصطفى	علي بن عبد الله بن أحمد الحسني الشافعي، نور الدين أبو الحسن السمهودي (المتوفى: 911ه)	ShamelaY19	23695	0.25793
		تحفة المجيب على أسئلة الحاضر والغريب	أبو عبد الرحمن مقبل بن هادي بن مقبل بن قائدة (اسم رجل) الهمداني الوادعي (المتوفى: 1422ه)	ShamelaY19	96784	0.25793
		شرح المنظومة الحائية لابن أبي داود	عبد الكريم الخضير	Sham19Y	23408	0.25792
		كتاب و عتاب	الشيخ قيس بهجة العطار	Masaha	382	0.25792
		الروضة البهية في شرح اللمعة الدمشقية - الجزء1	الشهيد الثاني	Masaha	587	0.25791
		دروس للشيخ سفر الحوالي	سفر بن عبد الرحمن الحوالي	Sham19Y	7716	0.2579
		منهج القرآن الكريم في دعوة المشركين إلى الإسلام	د. حمود بن أحمد بن فرج الرحيلي	Sham19Y	7252	0.2579
		30 طريقة لخدمة الدين	رضا أحمد صمدي	ShamAY	33514	0.25789
		التعليقات الحسان على الفرقان - صالح آل الشيخ	صالح آل الشيخ	ShamAY	34731	0.25789
		غذاء الألباب في شرح منظومة الآداب	شمس الدين، أبو العون محمد بن أحمد بن سالم السفاريني الحنبلي (المتوفى : 1188هـ)	ShamAY	25791	0.25789
		تفسير بيان السعادة في مقامات العبادة [ج ١]	سلطان محمّد الجنابذي [ سلطان علي شاه ]	Rafed	3362	0.25789
		المسالك والممالك	أبي إسحاق إبراهيم بن محمّد الفارسي الإصطخري	Rafed	2303	0.25789
		اللّباب في علوم الكتاب [ج ٥]	أبي حفص عمر بن علي بن عادل الدمشقي الحنبلي	Rafed	3096	0.25789
		المحرّر الوجيز في تفسير الكتاب العزيز [ج ٣]	أبي محمّد عبدالحقّ بن غالب بن عطيّة الأندلسي	Rafed	3297	0.25789
		دلائل الامامه	طبري امامي ( صغير ) ابوجعفر محمد بن جرير بن رستم ( قرن 4و5 ق ) ( صاحب دلائل الامامه )	Ghbook	10443	0.25789
		الكشف والبيان [ج ٣]	أبو إسحاق أحمد [ الثّعلبي ]	Rafed	1649	0.25788
		عدة البروق في جمع ما في المذهب من الجموع والفروق	أبو العباس أحمد بن يحيى الونشريسي	ShamelaY19	20588	0.25787
		تفسير جزء عم للشيخ مساعد الطيار	د مساعد بن سليمان بن ناصر الطيار	ShamelaY19	21561	0.25787
		قواعد في الحكم على الآخرين	الواحدي :: وليد السعيدان	ShamAY	37489	0.25786
		لمحات في الثقافة الإسلامية	عمر عودة الخطيب	ShamAY	11364	0.25785
		تفسير سورة هل أتى [ج ١]	السيد جعفر مرتضى العاملي	Rafed	3890	0.25785
		خصائص التعبير القرآني وسماته البلاغية	عبد العظيم إبراهيم محمد المطعني (المتوفى: 1429ه)	ShamelaY19	21785	0.25784
		شرح الأربعين النووية - العباد	عبد المحسن بن حمد بن عبد المحسن بن عبد الله بن حمد العباد البدر	ShamelaY19	36944	0.25784
		فتاوى المرأة المسلمة	مجموعة من المؤلفين	ShamAY	37637	0.25783
		الفرج بعد الشدة للتنوخي	المحسن بن علي بن محمد بن أبي الفهم داود التنوخي البصري، أبو علي (المتوفى: 384هـ)	ShamAY	12828	0.25783
		شرح (التبصرة والتذكرة = ألفية العراقي)	أبو الفضل زين الدين عبد الرحيم بن الحسين بن عبد الرحمن بن أبي بكر بن إبراهيم العراقي (المتوفى: 806هـ)	ShamAY	1779	0.25783
		رحلة الصفار إلي فرنسا	محمد بن عبد الله الصفار	Masaha	4832	0.25783
		الروضتين في أخبار الدولتين النورية والصلاحية	أبو القاسم شهاب الدين عبد الرحمن بن إسماعيل بن إبراهيم المقدسي الدمشقي المعروف بأبي شامة (المتوفى: 665 هـ)	ShamAY	32323	0.25781
		السنة في مواجهة الأباطيل	محمد طاهر بن حكيم غلام رسول	ShamelaY19	26583	0.25779
		الباعث الحثيث شرح اختصار علوم الحديث ط ابن الجوزي	عماد الدين أبو الفداء إسماعيل ابن كثير - أبو الأشبال أحمد محمد شاكر	ShamelaY19	150481	0.25779
		 شرح أصول الكافي 	 صدر الدين محمد الشيرازي ( صدر المتألهين ) 	ABLibrary	7916	0.25779
		تفسير العثيمين: الحجرات - الحديد	محمد بن صالح بن محمد العثيمين (المتوفى: 1421هـ)	ShamAY	21805	0.25778
		الكواكب الدراري في شرح صحيح البخاري	محمد بن يوسف بن علي بن سعيد، شمس الدين الكرماني (المتوفى: 786هـ)	ShamAY	31908	0.25778
		 خطرة الطيف ( رحلات في المغرب والأندلس ) 	 لسان الدين ابن الخطيب 	ABLibrary	9053	0.25778
		فرائد الأصول - الجزء1	الشيخ مرتضى الأنصاري	Masaha	4022	0.25778
		بداية المعارف الإلهيّة في شرح عقائد الإماميّة [ج ١]	الشيخ محمّد رضا المظفّر	Rafed	2652	0.25777
		لمسات بيانية في نصوص من التنزيل - محاضرات	فاضل بن صالح بن مهدي بن خليل البدري السامرائي	Sham19Y	8312	0.25776
		الرزق أبوابه ومفاتحه	عبد الملك بن محمد القاسم	ShamelaY19	95675	0.25776
		دروس الشيخ سيد حسين العفاني	أبو التراب سيد بن حسين بن عبد الله العفاني	ShamelaY19	36323	0.25776
		 موسوعة مصطلحات علم الكلام الإسلامي 	 سميح دغيم 	ABLibrary	8657	0.25775
		كشف اللثام و الإبهام عن قواعد الأحكام - الجزء1	الفاضل الهندي	Masaha	1431	0.25774
		جريدة «الشريعة» النبوية المحمدية	تصدرها «جمعية العلماء المسلمين الجزائريين» تحت إشراف رئيسها الأستاذ عبد الحميد بن باديس.	ShamAY	394	0.25773
		القراءات المتواترة وأثرها في الرسم القرآني والأحكام الشرعية	محمد الحبش	ShamelaY19	38020	0.25773
		الجامع اللطيف	ابن ظهيرة	Rafed	2208	0.25773
		إتحاف أعلام الناس بجمال أخبار حاضرة مكناس	ابن زيدان عبد الرحمن بن محمد السجلماسي (المتوفى: 1365)	ShamAY	32704	0.25772
		الخلاصة في أهداف القتال في الإسلام	الواحدي :: علي بن نايف الشحود	ShamAY	36079	0.25772
		أحكام القرآن [ج ٤]	أبي بكر أحمد بن علي الرازي الجصّاص	Rafed	1999	0.25772
		بحوث في مباني علم الرجال	محمّد صالح التبريزي	Rafed	2651	0.25772
		 الاقتصاد في الاعتقاد 	 الغزالي 	ABLibrary	8311	0.25771
		 شرح المقاصد 	 التفتازاني 	ABLibrary	8467	0.25771
		لمسات بيانية في نصوص من التنزيل - محاضرات	فاضل بن صالح بن مهدي بن خليل البدري السامرائي	ShamAY	8312	0.2577
		مسامرات الظريف بحسن التعريف	محمد بن عثمان بن محمد السنوسي، أبو عبد الله (المتوفى: 1318هـ)	ShamAY	5440	0.2577
		الاستغاثة في الرد على البكري	شيخ الإسلام أحمد بن تيمية (المتوفى: 728 ه)	ShamelaY19	18328	0.2577
		عقيدة الولاء والبراء - المقدم	محمد أحمد إسماعيل المقدم	ShamelaY19	36991	0.25769
		تأويلات أهل السنّة تفسير الماتريدي [ج ١]	أبي منصور محمّد بن محمّد بن محمود الماتريدي	Rafed	3962	0.25769
		الاخلاق	عبدالله بن محمدرضا شبر حسيني كاظميني	Ghbook	12378	0.25769
		 تاريخ الادب في ايران من الفردوسى الى السعدى 	 ادوارد براون ( تعريب : ابراهيم امين الشواربى ) 	ABLibrary	8001	0.25768
		غاية المرام في علم الكلام	أبي الحسن علي بن محمد بن سالم الثعلبي [ سيف الدين الآمدي ]	Rafed	3481	0.25768
		بحوث ندوة أثر القرآن الكريم في تحقيق الوسطية ودفع الغلو	مجموعة من المؤلفين	ShamelaY19	31448	0.25767
		التذكرة الحمدونية	محمد بن الحسن بن محمد بن علي بن حمدون، أبو المعالي، بهاء الدين البغدادي (المتوفى: 562ه)	Sham19Y	10646	0.25765
		 إثنا عشر رسالة 	 السيد محمد باقر الداماد ( الميرداماد ) 	ABLibrary	840	0.25765
		مذكرة في أصول الفقه	محمد الأمين بن محمد المختار بن عبد القادر الجكني الشنقيطي (المتوفى: 1393هـ)	ShamAY	9885	0.25762
		وفاء الوفاء بأخبار دار المصطفى	علي بن عبد الله بن أحمد الحسني الشافعي، نور الدين أبو الحسن السمهودي (المتوفى: 911هـ)	ShamAY	23695	0.25762
		الإقناع في حل ألفاظ أبي شجاع	شمس الدين، محمد بن أحمد الخطيب الشربيني الشافعي (المتوفى: 977ه)	Sham19Y	6121	0.25762
		مناهج الأحكام في مسائل الحلال و الحرام	الميرزا القمي	Masaha	1540	0.25762
		البرهان فى تناسب سور القرآن	أحمد بن إبراهيم بن الزبير الثقفي الغرناطي، أبو جعفر (المتوفى: 708هـ)	ShamAY	1388	0.25761
		السنة المفترى عليها	سالم البهنساوي (المتوفى: 1427هـ)	ShamAY	1632	0.25761
		نفي ظاهرة التكفير عند الامامية	ابومحمد ساعدي	Ghbook	10522	0.25761
		ولا تقربوا الفواحش	جمال بن عبد الرحمن إسماعيل	ShamelaY19	31360	0.25759
		تحفةُ العروسين	مجدي بن منصور بن سيد الشورى :: مجدي الشورى	ShamAY	36108	0.25757
		نهج الرشاد في نظم الاعتقاد	يوسف بن محمد بن مسعود بن محمد العبادي العقيلي، جمال الدين السرمري (المتوفى: 776هـ)	ShamAY	31919	0.25757
		البرنس في باريس	محمّد المقداد الورتتاني	Rafed	2151	0.25757
		النظر الفسيح عند مضائق الأنظار في الجامع الصحيح	محمد الطاهر ابن عاشور	ShamelaY19	133359	0.25756
		اجتماع الجيوش الإسلامية على غزو المعطلة والجهمية	محمد بن أبي بكر أيوب الزرعي ابن القيم أبو عبد الله	ShamAY	34408	0.25755
		 منتهى الآمال في تواريخ النبي والآل ( ع ) 	 الشيخ عباس القمي 	ABLibrary	7797	0.25755
		الإمامة في أهمّ الكتب الكلاميّة وعقيدة الشيعة الإماميّة	السيّد علي الحسيني الميلاني	Rafed	73	0.25755
		المسائل المستحدثة	الشيخ محمد إسحاق الفياض	Masaha	5018	0.25755
		أبو هريرة	السيد عبد الحسين شرف الدين	Masaha	74	0.25755
		جامع العلوم والحكم في شرح خمسين حديثاً من جوامع الكلم	زين الدين عبد الرحمن بن أحمد بن رجب بن الحسن، السَلامي، البغدادي، ثم الدمشقي، الحنبلي (المتوفى: 795هـ)	ShamAY	10443	0.25754
		 شرح المقاصد 	 التفتازاني 	ABLibrary	8466	0.25754
		شرح الدروس المهمة لعامة الأمة	عبد الكريم الخضير	ShamAY	177	0.25753
		الوارف في مشروعية التثريب على المخالف	عبد العزيز الجربوع	ShamAY	36190	0.25753
		شرح نظم عقيدة السفاريني	عبد الكريم الخضير	ShamelaY19	27254	0.25753
		الله لعباس محمود العقاد	عباس محمود العقاد	ShamAY	35499	0.25752
		 موسوعة كشاف اصطلاحات الفنون والعلوم 	 محمد علي التهانوي 	ABLibrary	8654	0.25752
		صفوة الإعتبار بمستودع الأمصار و الأقطار [ج ١]	السيّد محمّد بيرم الخامس التونسي	Rafed	2395	0.25752
		السيرة النبوية - دروس وعبر	مصطفى بن حسني السباعي (المتوفى: 1384هـ)	ShamAY	914	0.25751
		العفو والاعتذار	أبو الحسن محمد بن عمران العبدي المعروف بالرقام البصري صاحب ابن دريد	ShamAY	33734	0.25751
		القصص العجيبه	آيت الله شهيد سيد عبدالحسين دستغيب	Ghbook	12723	0.25751
		ثمرات النظر في علم الأثر	محمد بن إسماعيل بن صلاح بن محمد الحسني، الكحلاني ثم الصنعاني، أبو إبراهيم، عز الدين، المعروف كأسلافه بالأمير (المتوفى: 1182هـ)	ShamAY	5983	0.2575
		شوائب التفسير في القرن الرابع عشر الهجري	عبد الرحيم فارس ابو علبة :: عبد الرحيم أبو علبة	ShamAY	36750	0.2575
		بحوث في مباني علم الرجال‌	الشيخ محمد السند	Masaha	3517	0.2575
		تتمة صوان الحكمة	أبو الحسن ظهير الدين علي بن زيد بن محمد بن الحسين البيهقي، الشهير بابن فندمه (المتوفى: 565هـ)	ShamAY	273	0.25749
		حي بن يقظان	محمد بن عبد الملك بن محمد بن محمد بن طفيل القيسي الأندلسي، أبو بكر (المتوفى: 581ه)	Sham19Y	9734	0.25749
		السنة في مواجهة الأباطيل	محمد طاهر بن حكيم غلام رسول	ShamAY	128	0.25748
		نيل الأوطار	محمد بن علي بن محمد بن عبد الله الشوكاني اليمني (المتوفى: 1250هـ)	ShamAY	9242	0.25748
		جامع الخلاف و الوفاق	الشيخ علي المؤمن السبزواري القمي	Masaha	1064	0.25748
		التبيان في تفسير القرآن	محمد بن حسن شيخ طوسي ( شيخ الطائفه )	Ghbook	4810	0.25748
		أسبابُ تخلُّفِ الوعيدِ	الواحدي :: علي بن نايف الشحود	ShamAY	36066	0.25747
		من معاناه الاسلام و المسلمين	آيت الله العظمي سيد محمد حسيني شيرازي	Ghbook	7854	0.25747
		المدخل إلى عذب المنهل في أصول الفقه‏	أبو الحسن‏ الشعراني	Masaha	3567	0.25746
		معارج القدس في مدارج معرفه النفس	أبو حامد محمد بن محمد الغزالي الطوسي (المتوفى: 505هـ)	ShamAY	6494	0.25745
		أحكام القرآن [ج ٣]	أبي بكر أحمد بن علي الرازي الجصّاص	Rafed	1989	0.25744
		معارج الأصول	المحقق الحلي	Masaha	4329	0.25744
		تحقيق الوصال بين القلب والقرآن	مجدي الهلالي	ShamAY	275	0.25743
		 المغرب في حلي المغرب 	 علي بن موسى الغرناطي الأندلسي 	ABLibrary	9220	0.25743
		تراثنا ـ العددان [ 81 و 82 ]	مؤسسة آل البيت عليهم السلام لإحياء التراث ـ قم	Rafed	3623	0.25743
		المحكم و المحيط  الاعظم	ابي الحسن علي بن اسماعيل النحوي اللغوي الاندلسي معروف بابن سيده	Ghbook	16204	0.25743
		 موسوعة الإمام أمير المؤمنين على بن أبى طالب ( ع ) 	 الشيخ باقر شريف القرشي 	ABLibrary	7806	0.25742
		علوم القرآن عند الشاطبي من خلال كتابه الموافقات	محمد سالم أبو عاصي	ShamelaY19	37998	0.25741
