automatic URI	Proposed URI	bookTitle	authorName	collection	id	tfidf
		نخبة عقد الأجياد في الصافنات الجياد	محمد (باشا) ابن الأمير عبد القادر ابن محيي الدين الحسني الجزائري (المتوفى: 1331هـ)	ShamAY	9752	0.27646
		حياة حافظ بن أحمد الحكمي	زيد بن محمد بن هادي المدخلي	ShamAY	32979	0.27646
		التفسير الوسيط - مجمع البحوث	مجموعة من العلماء بإشراف مجمع البحوث الإسلامية بالأزهر	Sham19Y	115098	0.27646
		المقداد ابن الأسود الكندي أوّل فارس في الإسلام	الشيخ محمد جواد الفقيه	Rafed	44	0.27646
		الموافقات. ط المعرفة - دراز	إبراهيم بن موسى الشاطبي اللخمي الغرناطي المالكي	ShamAY	34196	0.27645
		موعظة المؤمنين من إحياء علوم الدين	محمد جمال الدين بن محمد سعيد بن قاسم الحلاق القاسمي (المتوفى: 1332هـ)	ShamAY	22842	0.27644
		لوامع الأنوار البهية وسواطع الأسرار الأثرية لشرح الدرة المضية في عقد الفرقة المرضية	شمس الدين، أبو العون محمد بن أحمد بن سالم السفاريني الحنبلي (المتوفى: 1188ه)	Sham19Y	8353	0.27644
		المرأة في الشعر الأموي ( دراسة )	فاطمة تجور	ShamAY	34472	0.27641
		المنطلق	محمد أحمد الراشد	ShamAY	33335	0.2764
		 تاريخ الخميس في أحوال أنفس النفيس 	 الشيخ حسين بن الحسن الريار بكري 	ABLibrary	7446	0.27639
		جواب الاعتراضات المصرية على الفتيا الحموية - قطعة منه	تقي الدين أبو العباس أحمد بن عبد الحليم بن تيمية الحراني (المتوفى: 728هـ)	ShamAY	34353	0.27638
		غديريات	عبدالحسين اميني ( علامه اميني )	Ghbook	10563	0.27638
		تفسير النسفي = مدارك التنزيل وحقائق التأويل	أبو البركات عبد الله بن أحمد بن محمود حافظ الدين النسفي (المتوفى: 710هـ)	ShamAY	1394	0.27634
		المطلب الحميد في بيان مقاصد التوحيد	عبد الرحمن بن حسن بن محمد بن عبد الوهاب بن سليمان التميمي (المتوفى: 1285هـ)	ShamAY	8555	0.27634
		مفاهيم القرآن [ج ٥]	الشيخ جعفر السبحاني	Rafed	273	0.27632
		التفسير المنير [ج ٧]	الدكتور وهبة الزحيلي	Rafed	2949	0.27632
		الفن القصي في القرآن الكريم	محمد خلف الله	Masaha	2356	0.27632
		أين تقع لا إله إلا الله في دين المرجئة الجُدُد	محمد إبراهيم شقرة	ShamAY	37772	0.2763
		الصراط المستقيم إلى مستحقي التقديم‏ - الجزء1	الشيخ علي النباطي‏	Masaha	2048	0.27629
		مسالك الأفهام إلى آيات الأحكام - الجزء1	الفاضل الكاظمي	Masaha	1291	0.27629
		 مناظرات عقائدية بين الشيعة وأهل السنة 	 السيد أمير محمد القزويني 	ABLibrary	8645	0.27626
		تفسير من وحي القرآن [ج ١٠]	السيد محمد حسين فضل الله	Rafed	3272	0.27626
		الرحلة المعينية	ماء العينين ابن العتيق	Masaha	4349	0.27626
		خزانة الأدب وغاية الأرب لابن حجة الحموي	ابن حجة الحموي، تقي الدين أبو بكر بن علي بن عبد الله الحموي الأزراري (المتوفى: 837هـ)	ShamAY	8675	0.27625
		درج الدرر في تفسير الآي والسور ط الحكمة	أبو بكر عبد القاهر بن عبد الرحمن بن محمد الفارسي الأصل، الجرجاني الدار (المتوفى: 471ه)	ShamelaY19	122173	0.27625
		إلى المجمع العلمي العربي بدمشق	السيد عبدالحسين شرف الدين الموسوي	Rafed	3436	0.27625
		الأساس في التفسير [ج ٤]	سعيد حوّى	Rafed	3137	0.27624
		شفاء العليل في مسائل القضاء والقدر والحكمة والتعليل	محمد بن أبي بكر بن أيوب بن سعد شمس الدين ابن قيم الجوزية (المتوفى: 751هـ)	ShamAY	12021	0.27623
		فقه السيرة النبوية مع موجز لتاريخ الخلافة الراشدة	محمد سعيد رمضان البوطي	Sham19Y	23657	0.27623
		من أعلام المجددين	صالح بن فوزان بن عبد الله الفوزان	Sham19Y	12066	0.27623
		شرح سنن الترمذي - عبد الكريم الخضير	عبد الكريم الخضير	ShamelaY19	23777	0.27623
		مجالس التذكير من حديث البشير النذير	عبد الحميد محمد بن باديس الصنهاجي (المتوفى: 1359ه)	ShamelaY19	34886	0.27622
		 خزانة التواريخ النجدية 	 عبد الله بن عبد الرحمن آل بسام 	ABLibrary	9052	0.27621
		عيون المعجزات	الشيخ حسين بن عبد الوهاب	Masaha	2311	0.27621
		أصول الإيمان	عبدالقاهر التميمي الشافعي	Rafed	3271	0.2762
		الأصول العامة في الفقه المقارن	السيد محمد تقي الحكيم	Masaha	4052	0.2762
		باهر البرهان فى معانى مشكلات القرآن	محمود بن أبي الحسن (علي) بن الحسين النيسابورىّ الغزنوي، أبو القاسم، الشهير بـ (بيان الحق) (المتوفى: بعد 553هـ)	ShamAY	925	0.27619
		الغدير في الكتاب والسنّة والأدب [ج ٣]	الشيخ عبد الحسين أحمد الأميني النجفي	Rafed	2001	0.27619
		دلائل الإعجاز - الكتاب العربي	أبو بكر عبدالقاهر بن عبدالرحمن بن محمد الجرجاني	ShamAY	34098	0.27618
		الخلافة	محمد رشيد بن علي رضا بن محمد شمس الدين بن محمد بهاء الدين بن منلا علي خليفة القلموني الحسيني (المتوفى: 1354هـ)	ShamAY	9682	0.27618
		 الموضح عن جهة إعجاز القرآن 	 الشريف المرتضى 	ABLibrary	8653	0.27618
		بيان تلبيس الجهمية في تأسيس بدعهم الكلامية	تقي الدين أبو العباس أحمد بن عبد الحليم بن عبد السلام بن عبد الله بن أبي القاسم بن محمد ابن تيمية الحراني الحنبلي الدمشقي (المتوفى: 728هـ)	ShamAY	2864	0.27617
		الفتح على أبي الفتح	محمد بن حمد بن محمد بن عبد الله بن محمود بن فورجة البروجردي (المتوفى: نحو 455ه)	ShamelaY19	37025	0.27617
		هداية العلم	السيد حسين شيخ الإسلامي	Rafed	1153	0.27617
		المحتسب في تبيين وجوه شواذ القراءات والإيضاح عنها	أبو الفتح عثمان بن جني الموصلي (المتوفى: 392هـ)	ShamAY	8660	0.27616
		البخلاء للجاحظ - العلمية	أبو عثمان عمرو بن بحر الجاحظ	ShamAY	33775	0.27615
		تفسير التّحرير والتّنوير [ج ٤]	الشيخ محمّد الطاهر ابن عاشور	Rafed	2908	0.27615
		فضائل الأندلس وأهلها	ابن حزم وابن سعيد والشقندي	Sham19Y	6701	0.27614
		تفسير من وحي القرآن [ج ١٣]	السيد محمد حسين فضل الله	Rafed	3276	0.27613
		خلق المسلم	محمد الغزالي	ShamAY	34811	0.27612
		نكث الهميان في نكت العميان	صلاح الدين خليل بن أيبك الصفدي (المتوفى: 764ه)	ShamelaY19	28182	0.27612
		التفسير المنير [ج ٢]	الدكتور وهبة الزحيلي	Rafed	2943	0.27612
		 رسائل ابن حزم الأندلسي 	 ابن حزم 	ABLibrary	8431	0.27611
		في ظلال القرآن [ج ١]	سيّد قطب	Rafed	3878	0.27611
		 ولاية الفقيه في حكومة الإسلام 	 السيد محمد حسين الطهراني 	ABLibrary	9447	0.2761
		الفتاوى الشرعية في المسائل الطبية	الواحدي :: ابن جبرين	ShamAY	33199	0.27609
		فقه السيرة للغزالي	محمد الغزالي السقا (المتوفى: 1416ه)	ShamelaY19	23659	0.27609
		الكلام على مسألة السماع	أبو عبد الله محمد بن أبي بكر بن أيوب ابن قيم الجوزية (المتوفى: 751 هـ)	ShamAY	38482	0.27608
		التفسير المنير [ج ١٢]	الدكتور وهبة الزحيلي	Rafed	2955	0.27608
		البحر المحيط في التّفسير [ج ٩]	محمّد بن يوسف [ أبي حيّان الأندلسي الغرناطي ]	Rafed	2456	0.27608
		معالم المدرستين [ج ٢]	السيد مرتضى العسكري	Rafed	3472	0.27607
		التعصب بين المسيحية والإسلام	محمد الغزالي	ShamAY	36030	0.27606
		علم المعاني	الدكتور عبدالعزيز عتيق	Rafed	2555	0.27605
		الغيبة	الشيخ الطوسي	Masaha	2069	0.27605
		شيعة ممدوحة .. وأشياع مذمومة	أحمد بن محمد السعيد	ShamAY	37811	0.27604
		الفائق في غريب الحديث والأثر	أبو القاسم محمود بن عمرو بن أحمد، الزمخشري جار الله (المتوفى: 538ه)	Sham19Y	7015	0.27604
		 تاج العقائد ومعدن الفوائد 	 علي بن محمد الوليد 	ABLibrary	8373	0.27603
		المرشد الوجيز	الميرزا محسن آل عصفور	Rafed	875	0.27602
		موسوعة الرقائق والأدب - ياسر الحمداني	ياسر بن أحمد بن محمود بن أحمد بن أبي الحمد الكويس الحمداني	ShamelaY19	38154	0.27598
		المعجزة الكبرى القرآن	محمد بن أحمد بن مصطفى بن أحمد المعروف بأبي زهرة (المتوفى: 1394ه)	ShamelaY19	23137	0.27598
		المنهل الحديث في شرح الحديث	الأستاذ الدكتور موسى شاهين لاشين	Sham19Y	14106	0.27597
		رسائل الشريف المرتضي	سيدمهدي رجايي	Ghbook	15619	0.27597
		لوامع الأنوار البهية وسواطع الأسرار الأثرية لشرح الدرة المضية في عقد الفرقة المرضية	شمس الدين، أبو العون محمد بن أحمد بن سالم السفاريني الحنبلي (المتوفى: 1188هـ)	ShamAY	8353	0.27596
		استمتع بحياتك	محمد العريفي	ShamAY	35044	0.27595
		الجامع الكبير في صناعة المنظوم من الكلام والمنثور	نصر الله بن محمد بن محمد بن عبد الكريم الشيباني، الجزري، أبو الفتح، ضياء الدين، المعروف بابن الأثير الكاتب (المتوفى: 637ه)	ShamelaY19	37475	0.27595
		تفسير غرائب القرآن ورغائب الفرقان [ج ١]	نظام الدين الحسن بن محمّد بن حسين القمي النيسابوري	Rafed	1792	0.27595
		تأريخ مكّة دراسات في السياسة والعلم والاجتماع والعمران [ج ١-٢]	أحمد السباعي	Rafed	2297	0.27595
		الفردوس الأعلى	الشيخ محمد حسين كاشف الغطاء	Masaha	2350	0.27595
		تفسير التّحرير والتّنوير [ج ١٦]	الشيخ محمّد الطاهر ابن عاشور	Rafed	2920	0.27594
		الدرر النجفية من الملتقطات اليوسفية - الجزء1	الشيخ يوسف البحراني	Masaha	1449	0.27592
		أوائل المقالات في المذاهب والمختارات	الشيخ المفيد	Masaha	188	0.27592
		 الكوكب الأنور على عقد الجوهر في مولد النبي الأزهر ( ص ) 	 جعفر بن البرزنجي 	ABLibrary	7691	0.27591
		التحفة السنية في شرح النخبة المحسنية	السيد عبد الله الجزائري	Masaha	1443	0.27591
		روضات الجنات في احوال العلماء و السادات	محمد باقر الموسوي الخوانساري الاصبهاني	Ghbook	16245	0.27591
		حجة الله البالغة	أحمد بن عبد الرحيم بن الشهيد وجيه الدين بن معظم بن منصور المعروف بـ «الشاه ولي الله الدهلوي» (المتوفى: 1176هـ)	ShamAY	773	0.2759
		تفسير التّحرير والتّنوير [ج ١٨]	الشيخ محمّد الطاهر ابن عاشور	Rafed	2925	0.2759
		تراثنا ـ العدد [ 27 ]	مؤسسة آل البيت عليهم السلام لإحياء التراث ـ قم	Rafed	2767	0.27588
		الأنوار و مفتاح السرور و الأفكار في مولد النبي المختار	أحمد بن عبد الله البكري‏	Masaha	1919	0.27588
		الزواجر عن اقتراف الكبائر	أحمد بن محمد بن علي بن حجر الهيتمي السعدي الأنصاري، شهاب الدين شيخ الإسلام، أبو العباس (المتوفى: 974هـ)	ShamAY	21629	0.27586
		أنوار النبي(ص) أسرارها و أنواعها	عبد الحق بن سبعين المرسي‏	Masaha	1941	0.27586
		علم التفسير كيف نشأ وتطور حتى انتهى إلى عصرنا الحاضر	عبد المنعم النمر (المتوفى: 1991 م)	ShamelaY19	37996	0.27585
		 الدرر النجفية من الملتقطات اليوسفية 	 المحقق البحراني 	ABLibrary	992	0.27585
		من هدى القرآن [ج ١٨]	السيّد محمّد تقي المدرّسي	Rafed	2148	0.27585
		اصل الشيعه و اصولها	محمد حسين آل كاشف الغطاء	Ghbook	12190	0.27585
		مجلة «الزهور» المصرية	أنطون الجميل	ShamelaY19	36534	0.27583
		98 خطبة للشيخ سامي الحمود	سامي الحمود	ShamAY	34755	0.27582
		 تصنيف غرر الحكم ودرر الكلم 	 عبد الواحد الآمدى التميمي 	ABLibrary	7906	0.27582
		الكامل في التاريخ - العلمية	أبو الحسن علي بن أبي الكرم محمد بن محمد بن عبد الكريم الشيباني الجزري، عز الدين ابن الأثير (المتوفى: 630هـ)	ShamAY	34612	0.27581
		العواصم من القواصم في تحقيق مواقف الصحابة بعد وفاة النبي صلى الله عليه وسلم	القاضي محمد بن عبد الله أبو بكر بن العربي المعافري الاشبيلي المالكي (المتوفى: 543ه)	ShamelaY19	30897	0.27581
		الدر المنثور في طبقات ربات الخدور	زينب بنت علي بن حسين بن عبيد الله بن حسن بن إبراهيم بن محمد بن يوسف فواز العاملي (المتوفى: 1332هـ)	ShamAY	9229	0.27578
		حكم ومواعظ من حياة الانبياء عليهم السلام [ج ٢]	مرتضى الميلاني	Rafed	110	0.27578
		شرح شواهد المغني	جلال الدين عبد الرحمن بن أبي بكر السيوطي	Rafed	2896	0.27577
		شعاع من المحراب	د. سليمان بن حمد العودة	ShamelaY19	20948	0.27576
		ديوان الإمام علي	الناشر: دار ابن زيدون	Rafed	294	0.27575
		من بلاغة القرآن	احمد احمد بدوي	Ghbook	8904	0.27574
		منازل الآخرة والمطالب الفاخرة	الشيخ عباس القمي	Masaha	1751	0.27573
		المزهر في علوم اللغة وأنواعها	عبد الرحمن بن أبي بكر، جلال الدين السيوطي (المتوفى: 911هـ)	ShamAY	6936	0.27571
		آل رسول الله وأولياؤه	محمد بن عبد الرحمن بن محمد بن عبد الله بن عبد الرحمن بن محمد بن قاسم العاصمي الحنبلي (المتوفى: 1421هـ)	ShamAY	7335	0.27571
		 مشارق أنوار القلوب ومفاتح أسرار الغيوب ( ويليه سر الأسرار في كشف الأنوار للغزالي ) 	 عبد الرحمن الأنصاري الدباغ 	ABLibrary	8782	0.27571
		التّفسير القرآني للقرآن [ج ١٣]	عبدالكريم الخطيب	Rafed	3356	0.27571
		الموازنة بين شعر أبي تمام والبحتري	أبو القاسم الحسن بن بشر الآمدي (ت 370 هـ)	ShamAY	31849	0.2757
		مرشد الزوّار إلى قبور الأبرار [ج ١]	موفق الدين بن عثمان	Rafed	2657	0.2757
		الذب عن مذهب الإمام مالك	أبو محمد عبد الله بن (أبي زيد) عبد الرحمن النفزي، القيرواني، المالكي (المتوفى: 386 هـ)	ShamAY	32672	0.27569
		البحر المحيط في التّفسير [ج ٢]	محمّد بن يوسف [ أبي حيّان الأندلسي الغرناطي ]	Rafed	2416	0.27568
		مختارات من أجمل الشعر في مدح الرسول	محمد سعيد رمضان البوطي	ShamelaY19	23670	0.27567
		التّفسير القرآني للقرآن [ج ١٦]	عبدالكريم الخطيب	Rafed	3359	0.27567
		 الكواكب الزاهرة 	 عبد القادر الشاذلي 	ABLibrary	8823	0.27565
		الموضح عن جهة إعجاز القرآن	علي بن الحسين الموسوي العلوي [ الشريف المرتضى علم الهدى ]	Rafed	3620	0.27565
		الأساس في التفسير [ج ١]	سعيد حوّى	Rafed	3117	0.27565
		مفهوم الشكر عند ابن تيمية رحمه الله	أبو حمزة الشامي	ShamAY	35203	0.27562
		الإصابة في تمييز الصحابة [ج ١]	أحمد بن علي بن حجر العسقلاني	Rafed	3386	0.27562
		بحوث ودراسات من موقع الإسلام اليوم	مجموعة من المؤلفين	ShamAY	36432	0.27561
		 دستور معالم الحكم ومأثور مكارم الشيم من كلام أمير المؤمنين علي ابن أبي طالب ( ك ) 	 محمد بن سلامة القضاعي 	ABLibrary	877	0.27561
		كتاب المواعظ والإعتبار بذكر الخطط والآثار المعروف بالخطط المقريزيّة [ج ٢]	تقي الدين احمد بن علي المقريزي	Rafed	2320	0.2756
		الفرقان في تفسير القرآن بالقرآن والسنّة [ج ٢٦]	الشيخ محمد الصادقي	Rafed	3053	0.27559
		الديباج الوضي في الكشف عن أسرار كلام الوصي (شرح نهج البلاغة)	يحيي بن حمزه الحسيني	Ghbook	15848	0.27557
		الرد علي الشاذلي في حزبيه - ت العمران - ط عالم الفوائد	شيخ الإسلام أحمد بن عبد الحليم بن عبد السلام ابن تيمية (661 - 728 هـ)	ShamAY	38471	0.27555
		العواصم من القواصم في تحقيق مواقف الصحابة بعد وفاة النبي صلى الله عليه وسلم	القاضي محمد بن عبد الله أبو بكر بن العربي المعافري الاشبيلي المالكي (المتوفى: 543ه)	Sham19Y	30897	0.27554
		بدائع الفوائد ط عالم الفوائد	أبو عبد الله محمد بن أبي بكر بن أيوب ابن قيم الجوزية (691 - 751)	ShamelaY19	145410	0.27553
		 المكتوبات ( الدرر المكنونات النفيسة ) 	 أحمد الفاروقي السرهندي 	ABLibrary	8846	0.27553
		التشيّع	الدكتور محمد زين الدين	Rafed	789	0.27552
		الكشاف عن حقائق التنزيل وعيون الأقاويل في وجوه التأويل	أبو القاسم محمود بن عمر الزمخشري الخوارزمي	ShamAY	34052	0.27549
		محاضرات الأدباء ومحاورات الشعراء والبلغاء	أبو القاسم الحسين بن محمد المعروف بالراغب الأصفهانى (المتوفى: 502هـ)	ShamAY	9078	0.27549
		 الرحيق المختوم 	 صفي الرحمان مباركفوري 	ABLibrary	7530	0.27549
		فضائل الأندلس وأهلها	ابن حزم :: مجموعة من المؤلفين	ShamAY	6701	0.27548
		التفسير الوسيط للقرآن الكريم [ج ٧]	الدكتور محمد سيد طنطاوي	Rafed	3945	0.27548
		كيف نتعامل مع السنة النبوية ط الشروق	يوسف عبد الله القرضاوي	ShamAY	31649	0.27545
		حماسة الظرفاء، من أشعار المحدثين والقدماء	عبد الله بن محمد بن يوسف العبدلكاني الزوزني (المتوفى: 431هـ)	ShamAY	752	0.27545
		السقيفه 	محمد رضا مظفر	Ghbook	16290	0.27545
		سيدالمرسلين صلي الله عليه و آله	آيت الله العظمي جعفر سبحاني	Ghbook	10441	0.27545
		مقالات الشيخ سلمان العودة	سلمان بن فهد العودة	ShamAY	34748	0.27544
		الإيمان الأوسط - ط طيبة	شيخ الإسلام أحمد بن عبد الحليم بن تيمية	ShamAY	34372	0.27542
		التحف والهدايا	الخالديان أبو بكر محمد بن هاشم الخالدي، (المتوفى: نحو 380هـ) ، و أبو عثمان سعيد بن هاشم الخالدي (المتوفى: 371هـ)	ShamAY	5429	0.27541
		الموسوعة القرآنيّة [ج ٩]	ابراهيم الأبياري	Rafed	3868	0.27541
		مناهل العرفان في علوم القرآن	محمد عبدالعظيم الزرقاني	ShamAY	34096	0.2754
		المقداد ابن الأسود الكندي أوّل فارس في الإسلام	الشيخ محمد جواد آل الفقيه	Masaha	1732	0.2754
		اللقاء الشهري	محمد بن صالح بن محمد العثيمين (المتوفى : 1421هـ)	ShamAY	7686	0.27539
		الأشربة وذكر اختلاف الناس فيها لابن قتيبة	أبو محمد عبد الله بن مسلم بن قتيبة الدينوري (المتوفى: 276هـ)	ShamAY	25793	0.27539
		تاريخ طبق الحلوي وصحاف المن والسلوي المعروف بتاريخ اليمن‏	عبد الله بن علي الوزير	Masaha	4658	0.27539
		الاعتصام للشاطبي ت الشقير والحميد والصيني	إبراهيم بن موسى بن محمد اللخمي الغرناطي الشهير بالشاطبي (المتوفى: 790ه)	ShamelaY19	36558	0.27538
		مناظرات عقائديّة بين الشيعة وأهل السنّة	السيد أمير محمد القزويني	Rafed	3531	0.27538
		عصمة الأنبياء عليهم السلام في القرآن الكريم	الشيخ جعفر السبحاني	Rafed	3503	0.27537
		بحوث في الملل والنّحل [ج ١]	الشيخ جعفر السبحاني	Rafed	40	0.27537
		السباق إلى العقول	الدكتور عبد الله قادري الأهدل	ShamAY	1879	0.27536
		القائد إلى تصحيح العقائد (وهو القسم الرابع من كتاب «التنكيل بما تأنيب الكوثري من الأباطيل» )	عبد الرحمن بن يحيى بن علي بن محمد المعلمي العتمي اليماني (المتوفى: 1386هـ)	ShamAY	12761	0.27535
		من هدى القرآن [ج ١٠]	السيّد محمّد تقي المدرّسي	Rafed	2132	0.27535
		الكلمة الغراء في تفضيل الزهراء(ع) وعقيلة الوحي‏	السيد عبد الحسين شرف الدين	Masaha	2858	0.27535
		النهاية في مجرد الفقه و الفتاوى	الشيخ الطوسي	Masaha	953	0.27534
		وَقَفَاتٌ على الطَّريق	علي بن نايف الشحود	ShamAY	359	0.27533
		المهذب في تفسير سورة يس	علي بن نايف الشحود	ShamAY	33094	0.27532
		في ظلال القرآن [ج ٢]	سيّد قطب	Rafed	3879	0.27532
		زبدة التّفاسير [ج ٧]	فتح الله بن شكر الله الشريف الكاشاني	Rafed	1738	0.27532
		دروس للشيخ سعيد بن مسفر	سعيد بن مسفر بن مفرح القحطاني	ShamAY	908	0.2753
		سماحة الإسلام في الدعوة إلى الله والعلاقات الإنسانية منهاجا ... وسيرة	عبد العظيم إبراهيم محمد المطعني (المتوفى: 1429هـ)	ShamAY	1411	0.2753
		الكشف والبيان [ج ٦]	أبو إسحاق أحمد [ الثّعلبي ]	Rafed	1668	0.2753
		نقد الشعر	قدامة بن جعفر بن قدامة بن زياد البغدادي، أبو الفرج (المتوفى: 337هـ)	ShamAY	28181	0.27529
		لمحات من محاسن الإسلام	محمد بن علي العرفج	ShamAY	33406	0.27529
		معترك الأقران في إعجاز القرآن، ويُسمَّى (إعجاز القرآن ومعترك الأقران)	عبد الرحمن بن أبي بكر، جلال الدين السيوطي (المتوفى: 911هـ)	ShamAY	1417	0.27528
		 المثنوي المعنوي ( معرب الكفافي ) 	 جلال الدين الرومي 	ABLibrary	8767	0.27528
		الجامع في الرسائل الدعوية	علي بن نايف الشحود	ShamAY	33260	0.27527
		تفسير ابن عربي [ج ٢]	محيي الدين بن علي بن أحمد بن عبدالله الطائي الحاتمي [ ابن عربي ]	Rafed	3855	0.27527
		مناهل العرفان في علوم القرآن	محمد عبد العظيم الزُّرْقاني (المتوفى: 1367هـ)	ShamAY	7249	0.27525
