automatic URI	Proposed URI	bookTitle	authorName	collection	id	tfidf
		تلخيص الخطابة	أبو الوليد محمد بن أحمد بن محمد بن أحمد بن رشد القرطبي الشهير بابن رشد الحفيد (المتوفى: 595هـ)	ShamAY	698	0.32552
		دلائل الإعجاز في علم المعاني	عبد القاهر بن عبد الرحمن الجرجاني	Rafed	2081	0.32544
		دلائل الإعجاز في علم المعاني	أبو بكر عبد القاهر بن عبد الرحمن بن محمد الفارسي الأصل، الجرجاني الدار (المتوفى: 471هـ)	ShamAY	1040	0.3247
		دلائل الإعجاز في علم المعاني	أبو بكر عبد القاهر بن عبد الرحمن بن محمد الفارسي الأصل، الجرجاني الدار (المتوفى: 471ه)	ShamelaY19	22664	0.32296
		أسرار البلاغة	أبو بكر عبد القاهر بن عبد الرحمن بن محمد الفارسي الأصل، الجرجاني الدار (المتوفى: 471هـ)	ShamAY	8187	0.32287
		الهوامل والشوامل سؤالات أبي حيان التوحيد لأبي علي مسكويه	أبو علي أحمد بن محمد بن يعقوب مسكويه (المتوفى: 421هـ)	ShamAY	4135	0.32235
		تفسير من وحي القرآن [ج ١٧]	السيد محمد حسين فضل الله	Rafed	3282	0.32205
		تفسير من وحي القرآن [ج ١٢]	السيد محمد حسين فضل الله	Rafed	3274	0.32194
		أسرار البلاغة	أبو بكر عبد القاهر بن عبد الرحمن بن محمد الفارسي الأصل، الجرجاني الدار (المتوفى: 471ه)	Sham19Y	8187	0.32194
		الهوامل والشوامل سؤالات أبي حيان التوحيد لأبي علي مسكويه	أبو علي أحمد بن محمد بن يعقوب مسكويه (المتوفى: 421ه)	Sham19Y	4135	0.32156
		تهذيب الأخلاق وتطهير الأعراق	أبو علي أحمد بن محمد بن يعقوب مسكويه (المتوفى: 421ه)	Sham19Y	12720	0.32079
		دلائل الإعجاز في علم المعاني	أبو بكر عبد القاهر بن عبد الرحمن بن محمد الفارسي الأصل، الجرجاني الدار (المتوفى: 471ه)	ShamelaY19	37697	0.31988
		 أصول الدين 	 محمد حسن آل ياسين 	ABLibrary	8335	0.3197
		تفسير من وحي القرآن [ج ١٦]	السيد محمد حسين فضل الله	Rafed	3281	0.31953
		دلائل الإعجاز في علم المعاني	أبو بكر عبد القاهر بن عبد الرحمن بن محمد الفارسي الأصل، الجرجاني الدار (المتوفى: 471هـ)	ShamAY	1056	0.31952
		تفسير من وحي القرآن [ج ١٥]	السيد محمد حسين فضل الله	Rafed	3280	0.31943
		 الكشف عن مناهج الأدلة في عقائد الملة 	 ابن رشد 	ABLibrary	8577	0.31918
		 رسالة التوحيد 	 الشيخ محمد عبده 	ABLibrary	8430	0.31903
		تفسير من وحي القرآن [ج ١٩]	السيد محمد حسين فضل الله	Rafed	3284	0.31886
		 رسائل ابن حزم الأندلسي 	 ابن حزم 	ABLibrary	8431	0.3183
		تفسير من وحي القرآن [ج ٤]	السيد محمد حسين فضل الله	Rafed	3261	0.31772
		تفسير من وحي القرآن [ج ٦]	السيد محمد حسين فضل الله	Rafed	3265	0.31764
		تهذيب الأخلاق وتطهير الأعراق	أبو علي أحمد بن محمد بن يعقوب مسكويه (المتوفى: 421هـ)	ShamAY	12720	0.3175
		النّفس من كتاب الشّفاء	أبو علي حسين بن عبد الله بن سينا [ شيخ الرئيس ابن سينا ]	Rafed	904	0.31729
		تفسير من وحي القرآن [ج ١٣]	السيد محمد حسين فضل الله	Rafed	3276	0.31692
		تفسير من وحي القرآن [ج ٢٤]	السيد محمد حسين فضل الله	Rafed	3289	0.31682
		تفسير من وحي القرآن [ج ٢٣]	السيد محمد حسين فضل الله	Rafed	3288	0.3168
		 جامع العلوم في اصطلاحات الفنون الملقب بدستور العلماء 	 القاضى عبد النبي بن عبد الرسول الأحمد نگري 	ABLibrary	8403	0.31665
		 تلخيص الشافي 	 الشيخ الطوسي 	ABLibrary	8390	0.31665
		تفسير من وحي القرآن [ج ٢٠]	السيد محمد حسين فضل الله	Rafed	3285	0.31645
		تفسير من وحي القرآن [ج ٧]	السيد محمد حسين فضل الله	Rafed	3268	0.31589
		المدرّس الأفضل [ج ١]	الشيخ محمّد علي المدرّس الأفغاني	Rafed	2679	0.31547
		 جامع العلوم في اصطلاحات الفنون الملقب بدستور العلماء 	 القاضى عبد النبي بن عبد الرسول الأحمد نگري 	ABLibrary	8402	0.31546
		أسرار البلاغة فى علم البيان	أبو بكر عبد القاهر بن عبد الرحمن بن محمد الفارسي الأصل، الجرجاني الدار (المتوفى: 471 هـ)	ShamAY	32338	0.31545
		 المطالب العالية من العلم الإلهي 	 فخر الدين الرازي 	ABLibrary	8611	0.31544
		تفسير من وحي القرآن [ج ٥]	السيد محمد حسين فضل الله	Rafed	3264	0.31466
		دلائل الإعجاز في علم المعاني	أبو بكر عبد القاهر بن عبد الرحمن بن محمد الفارسي الأصل، الجرجاني الدار (المتوفى: 471هـ)	ShamAY	1039	0.31449
		رسائل الشريف المرتضى [ج ١]	علي بن الحسين الموسوي العلوي [ الشريف المرتضى علم الهدى ]	Rafed	3614	0.31436
		مقالات موقع الدرر السنية	مجموعة من المؤلفين	ShamAY	1572	0.31402
		 المطالب العالية من العلم الإلهي 	 فخر الدين الرازي 	ABLibrary	8613	0.31399
		رسائل الشريف المرتضى [ج ٣]	علي بن الحسين الموسوي العلوي [ الشريف المرتضى علم الهدى ]	Rafed	3616	0.31393
		تفسير من وحي القرآن [ج ١٤]	السيد محمد حسين فضل الله	Rafed	3277	0.31389
		مقالات موقع الدرر السنية	مجموعة من المؤلفين	ShamelaY19	95660	0.31389
		دلائل الإعجاز في علم المعاني	أبو بكر عبد القاهر بن عبد الرحمن بن محمد الفارسي الأصل، الجرجاني الدار (المتوفى: 471ه)	Sham19Y	12055	0.3137
		تفسير من وحي القرآن [ج ٩]	السيد محمد حسين فضل الله	Rafed	3270	0.31361
		 الذخيرة في علم الكلام 	 الشريف المرتضى 	ABLibrary	8424	0.31358
		 مجموعة تلخيصات ابن رشد از تأليفات جالينوس 	 ابن رشد 	ABLibrary	9879	0.31333
		النبأ العظيم نظرات جديدة في القرآن - ط الثقافة	محمد بن عبد الله دراز	ShamAY	34078	0.31329
		تفسير من وحي القرآن [ج ١٠]	السيد محمد حسين فضل الله	Rafed	3272	0.31317
		 مجموعة الرسائل ( تسع رسائل ) 	 ابن رشد 	ABLibrary	9878	0.31301
		رسائل فلسفية لابن باجه	محمد بن يحيى بن باجه، وقد يعرف بابن الصائغ، أبو بكر التجيبى الأندلسي السرقسطى (المتوفى: 533هـ)	ShamAY	8301	0.31296
		 رحلة فريزر إلى بغداد 	 جيمس بيلي فريزر 	ABLibrary	9103	0.31296
		دلائل الإعجاز - الكتاب العربي	أبو بكر عبدالقاهر بن عبدالرحمن بن محمد الجرجاني	ShamAY	34098	0.31272
		تفسير من وحي القرآن [ج ٣]	السيد محمد حسين فضل الله	Rafed	3260	0.31271
		 شرح توحيد الصدوق 	 القاضي سعيد القمي 	ABLibrary	8480	0.31258
		إعجاز القرآن والبلاغة النبوية للرافعي	مصطفى صادق بن عبد الرزاق بن سعيد بن أحمد بن عبد القادر الرافعي (المتوفى: 1356هـ)	ShamAY	8506	0.31238
		المثل السائر في أدب الكاتب والشاعر ت الحوفي	ضياء الدين بن الأثير، نصر الله بن محمد (المتوفى: 637هـ)	ShamAY	10551	0.31217
		تفسير من وحي القرآن [ج ٢]	السيد محمد حسين فضل الله	Rafed	3259	0.31191
		المطالب العالية من العلم الإلهي [ج ٦]	محمّد بن عمر بن الحسن بن الحسين التيمي البكري [ فخر الدين الرازي ]	Rafed	3635	0.31189
		معارج القدس في مدارج معرفه النفس	أبو حامد محمد بن محمد الغزالي الطوسي (المتوفى: 505هـ)	ShamAY	6494	0.31182
		الاسلام ينابيعه. مناهجه. غاياته	محمّد أمين زين الدين	Rafed	823	0.31168
		مجلة «الثقافة» السورية	خليل مردم بك	ShamAY	893	0.31126
		المطالب العالية من العلم الإلهي [ج ٨]	محمّد بن عمر بن الحسن بن الحسين التيمي البكري [ فخر الدين الرازي ]	Rafed	3641	0.31112
		معجم المصطلحات العلمية العربية	د. فايز الداية (معاصر)	ShamAY	34687	0.31088
		تاريخ الفقه الجعفري	هاشم معروف الحسني	Rafed	3882	0.31081
		رحلة فريزر	جيمس بيلي فريزر	Rafed	2444	0.31078
		تفسير ابن بدران = جواهر الأفكار ومعادن الأسرار المستخرجة من كلام العزيز الجبار	عبد القادر بن أحمد بدران	ShamelaY19	20643	0.31067
		منطق المشرقيين	ابوعلي حسين بن عبدالله ابن سينا	Ghbook	7953	0.31067
		 شرح ابن رشد لأرجوزة ابن سينا في الطب 	 ابن رشد 	ABLibrary	9880	0.31048
		تفسير من وحي القرآن [ج ٨]	السيد محمد حسين فضل الله	Rafed	3269	0.31045
		الجامع الكبير في صناعة المنظوم من الكلام والمنثور	نصر الله بن محمد بن محمد بن عبد الكريم الشيباني، الجزري، أبو الفتح، ضياء الدين، المعروف بابن الأثير الكاتب (المتوفى: 637هـ)	ShamAY	865	0.31038
		تفسير من وحي القرآن [ج ١]	السيد محمد حسين فضل الله	Rafed	3257	0.31033
		المثل السائر في أدب الكاتب والشاعر ت محيي الدين عبد الحميد	نصر الله بن محمد بن محمد بن عبد الكريم الشيباني، الجزري، أبو الفتح، ضياء الدين، المعروف بابن الأثير الكاتب (المتوفى: 637ه)	ShamelaY19	23794	0.31032
		الشّفاء ـ طبيعيّات [ج ٢ [٦]]	أبو علي حسين بن عبد الله بن سينا [ شيخ الرئيس ابن سينا ]	Rafed	3070	0.31026
		تفسير من وحي القرآن [ج ١٨]	السيد محمد حسين فضل الله	Rafed	3283	0.31023
		 الكليات في الطب 	 ابن رشد 	ABLibrary	9877	0.31017
		 كتاب الشكوك على كلام فاضل الأطباء جالينوس 	 محمد بن زكريا الرازي 	ABLibrary	9816	0.31005
		 الشيعة " نص الحوار مع المستشرق كوربان " 	 السيد الطباطبائي ( تعريب : جواد على كسار ) 	ABLibrary	8485	0.31005
		مجلة «الثقافة» السورية	خليل مردم بك	ShamelaY19	73350	0.30992
		مجلة المنار (كاملة 35 مجلدا)	مجموعة من المؤلفين، محمد رشيد بن علي رضا (المتوفى: 1354هـ) وغيره من كتاب المجلة	ShamAY	6947	0.30972
		الجامع الكبير في صناعة المنظوم من الكلام والمنثور	نصر الله بن محمد بن محمد بن عبد الكريم الشيباني، الجزري، أبو الفتح، ضياء الدين، المعروف بابن الأثير الكاتب (المتوفى: 637ه)	ShamelaY19	37475	0.30943
		 نور العيون وجامع الفنون 	 صلاح الدين بن يوسف الكحال الحموي 	ABLibrary	9932	0.30943
		 سيرة المصطفى ( ص ) ( نظرة جديدة ) 	 هاشم معروف الحسني 	ABLibrary	7577	0.3092
		مجلة المقتبس	محمد كرد علي	ShamAY	443	0.30914
		 إرشاد الطالبين إلى نهج المسترشدين 	 المقداد السيوري 	ABLibrary	8328	0.30896
		 عيون مسائل النفس وسرح العيون في شرح العيون 	 حسن حسن زاده آملى 	ABLibrary	8521	0.30892
		 سيد المرسلين 	 الشيخ السبحاني 	ABLibrary	7634	0.30892
		 تحقيق ما للهند 	 أبو ريحان البيروني 	ABLibrary	9023	0.30886
		 بد العارف 	 ابن سبعين 	ABLibrary	8759	0.30858
		تفسير من وحي القرآن [ج ١١]	السيد محمد حسين فضل الله	Rafed	3273	0.30855
		 المغني في أبواب التوحيد والعدل 	 القاضي عبد الجبار الهمذاني 	ABLibrary	8633	0.30855
		فصول في الثقافة والأدب	علي بن مصطفى الطنطاوي (المتوفى: 1420هـ)	ShamAY	32247	0.3084
		 شرح المقاصد 	 التفتازاني 	ABLibrary	8465	0.3084
		 عين اليقين الملقب بالأنوار والأسرار 	 الفيض الكاشاني 	ABLibrary	8519	0.30833
		رسائل الشريف المرتضى - الجزء1	السيد المرتضى	Masaha	998	0.30825
		المثل السائر في أدب الكاتب والشاعر ت محيي الدين عبد الحميد	نصر الله بن محمد بن محمد بن عبد الكريم الشيباني، الجزري، أبو الفتح، ضياء الدين، المعروف بابن الأثير الكاتب (المتوفى: 637هـ)	ShamAY	23794	0.30804
		 عين اليقين الملقب بالأنوار والأسرار 	 الفيض الكاشاني 	ABLibrary	8520	0.3079
		التوحيد لمحمد عبده	محمد عبده بن حسن خير الله (المتوفى: 1323هـ)	ShamAY	6392	0.30786
		المساكين	مصطفى صادق بن عبد الرزاق بن سعيد بن أحمد بن عبد القادر الرافعي (المتوفى: 1356هـ)	ShamAY	5418	0.30785
		 الرحلة الحجازية ( الارتسامات اللطاف في خاطر الحاج إلى أقدس مطاف ) 	 شكيب أرسلان 	ABLibrary	9092	0.30784
		 المثنوي المعنوي ( معرب الدسوقي ) 	 جلال الدين الرومي 	ABLibrary	8764	0.3077
		رحلة فريزر إلى بغداد سنة 1834	جيمس بيلي فريزر	Masaha	3968	0.30767
		تحت راية القرآن	مصطفى صادق بن عبد الرزاق بن سعيد بن أحمد بن عبد القادر الرافعي (المتوفى: 1356ه)	ShamelaY19	21784	0.30763
		حصوننا مهددة من داخلها	محمد محمد حسين (المتوفى: 1402ه)	ShamelaY19	121375	0.30758
		الضروري في أصول الفقه أو مختصر المستصفى	أبو الوليد محمد بن أحمد بن محمد بن أحمد بن رشد القرطبي الشهير بابن رشد الحفيد (المتوفى: 595هـ)	ShamAY	1703	0.30756
		تفسير من وحي القرآن [ج ٢٢]	السيد محمد حسين فضل الله	Rafed	3287	0.30756
		نفائس التأويل - الجزء1	السيد المرتضى	Masaha	2507	0.30752
		مجلة المقتبس	محمد كرد علي	ShamelaY19	26523	0.30743
		رسائل الشريف المرتضى [ج ٢]	علي بن الحسين الموسوي العلوي [ الشريف المرتضى علم الهدى ]	Rafed	3615	0.30711
		 النفس والروح وشرح قواهما 	 فخر الدين الرازي 	ABLibrary	8668	0.30711
		تعريف عام بدين الإسلام	علي بن مصطفى الطنطاوي (المتوفى: 1420هـ)	ShamAY	986	0.30694
		تعريف عام بدين الإسلام	علي بن مصطفى الطنطاوي (المتوفى: 1420ه)	ShamelaY19	37562	0.30692
		التقريب لحد المنطق والمدخل إليه بالألفاظ العامية والأمثلة الفقهية	أبو محمد علي بن أحمد بن سعيد بن حزم الأندلسي القرطبي الظاهري (المتوفى: 456هـ)	ShamAY	1028	0.30685
		 مجموعه رسائل ابن عربي 	 ابن عربي 	ABLibrary	8753	0.30671
		تحت راية القرآن	مصطفى صادق بن عبد الرزاق بن سعيد بن أحمد بن عبد القادر الرافعي (المتوفى: 1356ه)	Sham19Y	21784	0.30661
		 مجموعة رسائل الإمام الغزالي 	 الغزالي 	ABLibrary	8593	0.30647
		 دروس في العقائد الإسلامية 	 الشيخ ناصر مكارم الشيرازي 	ABLibrary	8422	0.3063
		تاريخ آداب العرب	مصطفى صادق بن عبد الرزاق بن سعيد بن أحمد بن عبد القادر الرافعي (المتوفى: 1356هـ)	ShamAY	10548	0.30626
		تاريخ الفقه الجعفري‏	هاشم معروف الحسني‏	Masaha	3197	0.30623
		تاريخ الفقه الجعفري‏	هاشم معروف الحسني‏	Masaha	2707	0.30623
		سرّ الفصاحة	أبي محمّد عبد الله بن سعيد بن سنان الخفاجي الحلبي	Rafed	2077	0.30614
		سر الفصاحة	أبو محمد عبد الله بن محمد بن سعيد بن سنان الخفاجي الحلبي (المتوفى: 466هـ)	ShamAY	11239	0.30611
		 سيرة الأئمة الاثني عشر ( ع ) 	 هاشم معروف الحسني 	ABLibrary	7547	0.30602
		أمالي المرزوقي	أبو على أحمد بن محمد بن الحسن المرزوقي الأصفهاني (المتوفى: 421هـ)	ShamAY	722	0.30596
		الحيوان - الجزء1	عمرو بن بحر الجاحظ	Masaha	2972	0.30596
		 المثنوي المعنوي ( معرب الدسوقي ) 	 جلال الدين الرومي 	ABLibrary	8765	0.30595
		البرهان في وجوه البيان (نشر من قبل باسم نقد النثر لقدامة بن جعفر)	أبو الحسين إسحاق بن إبراهيم بن سليمان بن وهب الكاتب	ShamelaY19	20986	0.30594
		النبأ العظيم	محمد بن عبد الله دراز	ShamelaY19	18795	0.30593
		قذائف الحق	محمد الغزالي السقا (المتوفى: 1416هـ)	ShamAY	9818	0.30591
		توحيد المفضّل	المفضل بن عمر الجعفي	Rafed	725	0.30578
		المدرّس الأفضل [ج ٢]	الشيخ محمّد علي المدرّس الأفغاني	Rafed	2680	0.30569
		عين اليقين [ج ٢]	محمّد بن المرتضى [ الفيض الكاشاني ]	Rafed	3592	0.30569
		الحيوان	عمرو بن بحر بن محبوب الكناني بالولاء، الليثي، أبو عثمان، الشهير بالجاحظ (المتوفى: 255ه)	ShamelaY19	23775	0.30558
		المنتقى من بطون الكتب	الواحدي :: محمد بن إبراهيم الحمد	ShamAY	37720	0.30547
		 مقالات تأسيسية في الفكر الإسلامي 	 السيد الطباطبائي ( تعريب : جواد علي كسار ) 	ABLibrary	8638	0.30546
		 المغني في أبواب التوحيد والعدل 	 القاضي عبد الجبار الهمذاني 	ABLibrary	8632	0.30535
		 المغني في أبواب التوحيد والعدل 	 القاضي عبد الجبار الهمذاني 	ABLibrary	8635	0.3053
		أمالي المرزوقي	أبو على أحمد بن محمد بن الحسن المرزوقي الأصفهاني (المتوفى: 421ه)	Sham19Y	722	0.30529
		 المغني في أبواب التوحيد والعدل 	 القاضي عبد الجبار الهمذاني 	ABLibrary	8634	0.30526
		 الإيضاح 	 ابو فراس 	ABLibrary	8354	0.30526
		 ديوان ابن عربي 	 ابن عربي 	ABLibrary	8737	0.30523
		فكر ومباحث	علي بن مصطفى الطنطاوي (المتوفى: 1420هـ)	ShamAY	32251	0.30514
		من روائع القرآن - تأملات علمية وأدبية في كتاب الله عز وجل	محمد سعيد رمضان البوطي	ShamelaY19	38086	0.30511
		الرّحلة الحجازيّة	الأمير شكيب أرسلان	Rafed	2385	0.30508
		مقالات الشيخ محمد الغزالي	محمد الغزالي	ShamAY	33256	0.30501
		 مقالتان في الحواس ومسائل طبيعية 	 عبد اللطيف البغدادي 	ABLibrary	9884	0.30497
		مقالات وبحوث الدكتور عبد الكريم بكار	عبد الكريم بكار	ShamAY	34762	0.30465
		 الإلهيات على هدى الكتاب والسنة والعقل 	 الشيخ السبحاني 	ABLibrary	8345	0.30465
		البصاير النصيريه في علم المنطق	ابن سهلان	Masaha	2326	0.30462
		 المغني في أبواب التوحيد والعدل 	 القاضي عبد الجبار الهمذاني 	ABLibrary	8636	0.30461
		خصائص التراكيب دارسة تحليلية لمسائل علم المعاني	محمد محمد أبو موسى	ShamAY	3334	0.3046
		دستور العلماء = جامع العلوم في اصطلاحات الفنون	القاضي عبد النبي بن عبد الرسول الأحمد نكري (المتوفى: ق 12هـ)	ShamAY	7038	0.3046
		عين اليقين [ج ١]	محمّد بن المرتضى [ الفيض الكاشاني ]	Rafed	3591	0.30459
		مجموعه رسائل الإمام الغزالي	أبو حامد الغزالي	Rafed	3457	0.30455
		تفسير من وحي القرآن [ج ٢١]	السيد محمد حسين فضل الله	Rafed	3286	0.30441
		النص الكامل لكتاب العواصم من القواصم	القاضي محمد بن عبد الله أبو بكر بن العربي المعافري الاشبيلي المالكي (المتوفى: 543ه)	ShamelaY19	96180	0.30439
		الأمثل في تفسير كتاب الله المنزل [ج ١٠]	آية الله مكارم الشيرازي	Rafed	2050	0.30432
		الإمتاع والمؤانسة	أبو حيان التوحيدي، علي بن محمد بن العباس (المتوفى: نحو 400هـ)	ShamAY	10521	0.30421
		رسالة التوحيد - ط الكتاب العربي	محمد عبده	ShamAY	33867	0.30421
		شرح  نهج البلاغه (ابن  ميثم)	كمال الدين ميثم بن علي بن ميثم ابن ميثم بحراني	Ghbook	15955	0.3042
		 الاربعينيات لكشف أنوار القدسيات 	 القاضي سعيد القمي 	ABLibrary	8853	0.30419
		رسائل الشريف المرتضي	سيدمهدي رجايي	Ghbook	15619	0.30418
		ركائز الإيمان بين العقل والقلب	محمد الغزالي	ShamAY	35258	0.30417
		من روائع القرآن - تأملات علمية وأدبية في كتاب الله عز وجل	محّمد سَعيد رَمضان البوطي	ShamAY	1233	0.30405
		 تلخيص الشافي 	 الشيخ الطوسي 	ABLibrary	8391	0.30388
		حُصُوُننا مهدَّدة من دَاخِلِهَا	محمد محمد حسين (المتوفى: 1402هـ)	ShamAY	31682	0.30384
		شرح المقاصد [ج ٣]	مسعود بن عمر بن عبدالله [ سعد الدين التفتازاني ]	Rafed	3515	0.3038
		الملل والنّحل [ج ٢]	أبي الفتح محمد بن عبدالكريم بن أبي بكر أحمد الشهرستاني	Rafed	3570	0.30379
		التّفسير القرآني للقرآن [ج ١٠]	عبدالكريم الخطيب	Rafed	3352	0.30377
		تحت راية القرآن	مصطفى صادق بن عبد الرزاق بن سعيد بن أحمد بن عبد القادر الرافعي (المتوفى: 1356هـ)	ShamAY	21784	0.30361
		عصرنا والعيش في زمان الصعب	عبد الكريم بكار	ShamAY	33452	0.30358
		 منهج الرشاد في معرفة المعاد 	 ملا نعيما العرفي الطالقاني 	ABLibrary	8650	0.30358
		رسالة الصاهل والشاجح	أحمد بن عبد الله بن سليمان بن محمد بن سليمان المعري، التنوخي (المتوفى: 449هـ)	ShamAY	563	0.30343
		الفن القصي في القرآن الكريم	محمد خلف الله	Masaha	2356	0.30338
		 مجموعة مصنفات في الخيمياء والإكسير الأعظم 	 جابر بن حيان 	ABLibrary	9805	0.30335
		التّفسير القرآني للقرآن [ج ٩]	عبدالكريم الخطيب	Rafed	3351	0.30331
		الحيوان	عمرو بن بحر بن محبوب الكناني بالولاء، الليثي، أبو عثمان، الشهير بالجاحظ (المتوفى: 255هـ)	ShamAY	23775	0.3033
		 رسالتان في الحكمة المتعالية والفكر الروحي 	 حسن بن حمزة الشيرازي ( شرف البلاسي ) 	ABLibrary	8784	0.30329
		خلفيات ماساه الزهراء (س)	سيد جعفرمرتضي حسيني عاملي	Ghbook	3900	0.30326
		سيّد المرسلين صلّى الله عليه وآله [ج ١]	الشيخ جعفر السبحاني	Rafed	185	0.3032
		 الشهاب الثاقب في وجوب صلاة الجمعة العيني 	 الفيض الكاشاني 	ABLibrary	9337	0.30317
		النظرات	مصطفى لطفي بن محمد لطفي بن محمد حسن لطفي المَنْفَلُوطي (المتوفى: 1343هـ)	ShamAY	11400	0.30316
		 مصطفى ، الدين القيم 	 الشيخ بشير النجفي 	ABLibrary	9766	0.30309
