automatic URI	Proposed URI	bookTitle	authorName	collection	id	tfidf
		أخلاق الوزيرين = مثالب الوزيرين = أخلاق الصاحب بن عباد وابن العميد	أبو حيان التوحيدي، علي بن محمد بن العباس (المتوفى: نحو 400هـ)	ShamAY	12541	0.28037
		أضواء على أوضاعنا السياسية	عبد الرحمن بن عبد الخالق اليوسف	ShamAY	11570	0.28037
		 نفح الطيب من غصن الأندلس الرطيب 	 أحمد بن محمد المقري التلمساني 	ABLibrary	9297	0.28037
		شرح مشكل الوسيط	عثمان بن عبد الرحمن، أبو عمرو، تقي الدين المعروف بابن الصلاح (المتوفى: 643ه)	ShamelaY19	21525	0.28036
		نشر البنود على مراقي السعود	عبد الله بن إبراهيم العلوي الشنقيطي	ShamAY	38871	0.28035
		 كتاب الزكاة 	 ميرزا محمد حسن الآشتياني 	ABLibrary	9392	0.28035
		شرح مقدمة التفسير لابن تيمية - العثيمين	محمد بن صالح بن محمد العثيمين (المتوفى: 1421ه)	Sham19Y	21521	0.28034
		المراسم العلوية و الأحكام النبوية	الفقيه سلار	Masaha	984	0.28034
		الروض المعطار في خبر الأقطار	محمد بن عبد المنعم الحميري	Masaha	4113	0.28034
		علوم القرآن عند الشاطبي من خلال كتابه الموافقات	محمد سالم أبو عاصي	ShamelaY19	37998	0.28032
		رسائل الإمام حسن البنا	حسن البنا	ShamAY	33353	0.2803
		شرح الحموية - يوسف الغفيص	يوسف بن محمد علي الغفيص	ShamelaY19	37776	0.2803
		موسوعة الرد على المذاهب الفكرية المعاصرة 1-29	علي بن نايف الشحود	ShamAY	32988	0.28029
		 الفقه ، القانون 	 السيد محمد الحسيني الشيرازي 	ABLibrary	9487	0.28029
		 أدب الطف أو شعراء الحسين ( ع ) 	 جواد شبر 	ABLibrary	7402	0.28029
		 المغرب في ترتيب المعرب 	 ناصر الدين المطرزي 	ABLibrary	9218	0.28029
		المقاصد الشافية في شرح الخلاصة الكافية (شرح ألفية ابن مالك)	أبو إسحق إبراهيم بن موسى الشاطبي (المتوفى 790 ه)	ShamelaY19	20562	0.28027
		معيد النعم ومبيد النقم	تاج الدين عبد الوهاب بن تقي الدين السبكي (المتوفى: 771 هـ)	ShamAY	32458	0.28025
		مبادئ الوصول الى علم الاصول	العلامة الحلي	Masaha	1747	0.28025
		تيسير الوصول إلى منهاج الأصول من المنقول والمعقول «المختصر»	كمال الدين محمد بن محمد بن عبد الرحمن المعروف ب «ابن إمام الكاملية» (المتوفى: 874 ه)	Sham19Y	18274	0.28024
		أسس النظام السياسي عند الإمامية	الشيخ محمد السند	Masaha	4913	0.28022
		الفائق في غريب الحديث والأثر	أبو القاسم محمود بن عمرو بن أحمد، الزمخشري جار الله (المتوفى: 538هـ)	ShamAY	7015	0.28021
		المقدمات الممهدات	أبو الوليد محمد بن أحمد بن رشد القرطبي (المتوفى: 520ه)	ShamelaY19	21735	0.28021
		روضة القضاة وطريق النجاة	علي بن محمد بن أحمد، أبو القاسم الرحبي المعروف بابن السمناني (المتوفى: 499 ه)	ShamelaY19	18608	0.2802
		علوم القرآن عند الشاطبي من خلال كتابه الموافقات	محمد سالم أبو عاصي	ShamAY	1477	0.28019
		توضِيحُ الأحكَامِ مِن بُلوُغ المَرَام	أبو عبد الرحمن عبد الله بن عبد الرحمن بن صالح بن حمد بن محمد بن حمد بن إبراهيم البسام التميمي (المتوفى: 1423هـ)	ShamAY	31912	0.28018
		البغداديات	أبو علي الحسن بن أحمد بن عبد الغفار بن محمد بن سليمان بن أبان الفارسي النحوي (377 هـ)	ShamAY	37111	0.28018
		التفسير الحديث [مرتب حسب ترتيب النزول]	محمد عزة دروزة	ShamAY	23603	0.28017
		المسائل الماردينية - وهي مسائل يكثر وقوعها ويحصل الابتلاء بها	تقي الدين أبو العباس أحمد بن عبد الحليم بن عبد السلام بن عبد الله بن أبي القاسم بن محمد ابن تيمية الحراني الحنبلي الدمشقي (المتوفى: 728ه)	ShamelaY19	96844	0.28017
		عقائد السنة وعقائد الشيعة التقارب والتباعد	الكاتب المصري صالح الورداني	Masaha	347	0.28017
		تفسير القاسمي [ج ٥]	محمّد جمال الدين القاسمي	Rafed	3914	0.28016
		ينابيع النصيحة في العقائد الصحيحة	السيد الأمير الحسين بن بدر الدين	Rafed	3448	0.28016
		 معرفة الإمام 	 السيد محمد حسين الطهراني 	ABLibrary	8885	0.28016
		 تقسيم الخواطر ( ويليه العرف العاطر في معرفة الخواطر ) 	 روزبهان البقلي الشيرازي ( شطاح فارس ) 	ABLibrary	8730	0.28016
		اللّباب في علوم الكتاب [ج ١٢]	أبي حفص عمر بن علي بن عادل الدمشقي الحنبلي	Rafed	3106	0.28015
		 جواهر الكلام في ثوبه الجديد 	 الشيخ الجواهري 	ABLibrary	9371	0.28013
		التوحيد للماتريدي	محمد بن محمد بن محمود، أبو منصور الماتريدي (المتوفى: 333ه)	Sham19Y	6365	0.28012
		الإنصاف في التنبيه على الأسباب التي أوجبت الاختلاف بين المسلمين	أبو محمد عبد الله بن محمد بن السيد البطليوسي (المتوفى: 521هـ)	ShamAY	6350	0.28011
		المدخل لابن الحاج	أبو عبد الله محمد بن محمد بن محمد العبدري الفاسي المالكي الشهير بابن الحاج (المتوفى: 737هـ)	ShamAY	11406	0.2801
		الغياثي غياث الأمم في التياث الظلم	عبد الملك بن عبد الله بن يوسف بن محمد الجويني، أبو المعالي، ركن الدين، الملقب بإمام الحرمين (المتوفى: 478هـ)	ShamAY	8323	0.2801
		 معرفة الإمام 	 السيد محمد حسين الطهراني 	ABLibrary	8893	0.2801
		البرهان في أصول الفقه. ط الوفاء- الديب	عبد الملك بن عبد الله بن يوسف الجويني أبو المعالي	ShamAY	34188	0.28008
		المحصول للرازي - جامعة الإمام	محمد بن عمر بن الحسين الرازي	ShamAY	34194	0.28008
		المرأة العربية في جاهليتها وإسلامها	عبد الله بن عفيفي الباجوري (المتوفى: 1364هـ)	ShamAY	609	0.28007
		المسالك والممالك للبكري	أبو عبيد عبد الله بن عبد العزيز بن محمد البكري الأندلسي (المتوفى: 487ه)	ShamelaY19	23849	0.28007
		العقيدة الإسلامية على ضوء مدرسة أهل البيت	الشيخ جعفر السبحاني	Masaha	351	0.28007
		الرد على القائلين بوحدة الوجود	علي بن (سلطان) محمد، أبو الحسن نور الدين الملا الهروي القاري (المتوفى: 1014هـ)	ShamAY	6541	0.28006
		تفسير التّحرير والتّنوير [ج ٢٦]	الشيخ محمّد الطاهر ابن عاشور	Rafed	2935	0.28004
		الأصول في علم الأصول‏ - الجزء1	الشيخ علي الإيرواني	Masaha	2411	0.28
		حَاشِيةُ الشِّهَابِ عَلَى تفْسيرِ البَيضَاوِي، الْمُسَمَّاة: عِنَايةُ القَاضِى وكِفَايةُ الرَّاضِى عَلَى تفْسيرِ البَيضَاوي	شهاب الدين أحمد بن محمد بن عمر الخفاجي المصري الحنفي (المتوفى: 1069هـ)	ShamAY	1535	0.27999
		 الانتصارات الإسلامية في كشف شبه النصرانية 	 سليمان بن عبد القوي الطوفي الصرصي الحنبلي 	ABLibrary	8313	0.27998
		 التعليقات على شرح اللمعة الدمشقية 	 جمال الدين محمد الخوانساري 	ABLibrary	9348	0.27998
		 سند العروة الوثقى ( كتاب الطهارة ) 	 الشيخ محمد السند 	ABLibrary	9547	0.27998
		الموسوعة القرآنيّة خصائص السور [ج ٥]	الناشر: دار التقريب بين المذاهب الإسلامية	Rafed	3735	0.27997
		مَعالِمُ الطَّريقِ في ظلالِ القُرآنِ	علي بن نايف الشحود	ShamAY	36749	0.27996
		 جواهر النصوص في حل كلمات الفصوص 	 الشيخ عبد الغني النابلسي 	ABLibrary	8854	0.27996
		جامع الشتات	الشيخ الخواجوئي	Masaha	1457	0.27996
		نهج الحقّ وكشف الصدق	الحسن بن يوسف بن علي المطّهر [ العلامة الحلّي ]	Rafed	3527	0.27995
		دراسات في علوم القرآن - محمد بكر إسماعيل	محمد بكر إسماعيل (المتوفى: 1426هـ)	ShamAY	10002	0.27993
		 غور الأمور 	 الحكيم الترمذي 	ABLibrary	8696	0.27993
		تعليقة القوچاني على كفاية الأصول‏ - الجزء1	الشيخ علي القوچاني	Masaha	3262	0.27993
		شرح الرضيّ على الكافية [ج ١]	محمّد بن الحسن الرضي الاسترآبادي	Rafed	1797	0.27992
		الرَّوضُ البَاسمْ في الذِّبِّ عَنْ سُنَّةِ أبي القَاسِم - صَلَّى اللَّهُ عَلَيْهِ وَسَلَّمَ -	ابن الوزير، محمد بن إبراهيم بن علي بن المرتضى بن المفضل الحسني القاسمي، أبو عبد الله، عز الدين، من آل الوزير (المتوفى: 840هـ)	ShamAY	28	0.2799
		تراثنا ـ العددان [ 35 و 36 ]	مؤسسة آل البيت عليهم السلام لإحياء التراث ـ قم	Rafed	2789	0.2799
		نزهة النظر في توضيح نخبة الفكر في مصطلح أهل الأثر	أبو الفضل أحمد بن علي بن محمد بن أحمد بن حجر العسقلاني (المتوفى: 852هـ)	ShamAY	12115	0.27989
		إيضاح شواهد الإيضاح	أبو علي الحسن بن عبد الله القيسي (المتوفى: ق 6هـ)	ShamAY	9250	0.27989
		الرسائل الأحمديّة [ج ٢]	الشيخ أحمد آل طعّان	Rafed	1332	0.27988
		عجائب المخلوقات وغرائب الموجودات‏	زكريا بن محمد القزويني	Masaha	4844	0.27986
		تاريخ مكة	أحمد السباعي	Masaha	4803	0.27986
		شرح نونية القرني	كَامِلَةُ الكَوارِي	ShamAY	35708	0.27984
		 المطالب العالية من العلم الإلهي 	 فخر الدين الرازي 	ABLibrary	8608	0.27984
		الموازنة بين شعر أبي تمام والبحتري	أبو القاسم الحسن بن بشر الآمدي (ت 370 هـ)	ShamAY	31849	0.27983
		الشّهيد مسلم بن عقيل عليه السلام	السيد عبد الرزاق الموسوي المقرّم	Rafed	558	0.27983
		الموسوعة القرآنيّة خصائص السور [ج ٦]	الناشر: دار التقريب بين المذاهب الإسلامية	Rafed	3736	0.27983
		شبابنا ومشاكلهم الروحية	السيد كامل الهاشمي	Masaha	568	0.27983
		منتهى الأصول - الجزء1	السيد حسن الموسوي البجنوردي	Masaha	4377	0.27982
		الذخائر والعبقريات - معجم ثقافي جامع	عبد الرحمن بن عبد الرحمن بن سيد بن أحمد البرقوقي الأديب المصري (المتوفى: 1363ه)	ShamelaY19	36072	0.27981
		الملل والنحل	أبو الفتح محمد بن عبد الكريم بن أبى بكر أحمد الشهرستاني (المتوفى: 548هـ)	ShamAY	11812	0.2798
		المدرّس الأفضل [ج ٥]	الشيخ محمّد علي المدرّس الأفغاني	Rafed	2687	0.2798
		مجموعة القصائد الزهديات	أبو محمد عبد العزيز بن محمد بن عبد الرحمن بن عبد المحسن السلمان (المتوفى: 1422ه)	ShamelaY19	38155	0.2798
		العقيدة الإسلاميّة على ضوء مدرسة أهل البيت عليهم السلام	الشيخ جعفر السبحاني	Rafed	3605	0.27979
		البلاغة 2 - المعاني - جامعة المدينة	مناهج جامعة المدينة العالمية	ShamAY	1664	0.27977
		صراع مع الملاحدة حتى العظم	عبد الرحمن بن حسن حَبَنَّكَة الميداني الدمشقي (المتوفى: 1425هـ)	ShamAY	12725	0.27975
		التنبيه على مبادئ التوجيه - قسم العبادات	أبو الطاهر إبراهيم بن عبد الصمد بن بشير التنوخي المهدوي (المتوفى: بعد 536ه)	ShamelaY19	121378	0.27975
		تاريخ ابن خلدون - إحياء التراث	ابن خلدون	ShamAY	33819	0.27973
		المزدكية هي أصل الاشتراكية	عبد اللطيف بن علي بن أحمد بن محمد السلطاني القنطري الجزائري (المتوفى: 1404هـ)	ShamAY	31736	0.27972
		شرح صحيح البخاري - عبد الكريم الخضير	عبد الكريم الخضير	ShamAY	63	0.2797
		جواب الإعتراضات المصرية علي الفتيا الحموية - ت شمس - ط عالم الفوائد	شيخ الإسلام أحمد بن عبد الحليم بن عبد السلام ابن تيمية (661 - 728 هـ)	ShamAY	38455	0.27969
		الإمام الصادق عليه السلام [ج ١]	الشيخ محمّد حسين المظفّر	Rafed	685	0.27969
		الأدب وفنونه - دراسة ونقد	عز الدين إسماعيل (المتوفى: 1428هـ)	ShamAY	8501	0.27967
		شرح جوامع الأخبار - عبد الكريم الخضير	عبد الكريم الخضير	ShamAY	65	0.27967
		شرح رسالة أبي داود لأهل مكة	عبد الكريم الخضير	ShamelaY19	23424	0.27967
		 الشامل في الصناعة الطبية 	 ابن النفيس 	ABLibrary	9897	0.27967
		في ظلال القرآن [ج ٣]	سيّد قطب	Rafed	3880	0.27966
		 سيرة الأئمة الاثني عشر ( ع ) 	 هاشم معروف الحسني 	ABLibrary	7548	0.27966
		الحاكم الجشمي ومنهجه في التفسير	عدنان محمد زرزور	Sham19Y	37682	0.27965
		تراثنا ـ العدد [ 34 ]	مؤسسة آل البيت عليهم السلام لإحياء التراث ـ قم	Rafed	2785	0.27962
		مذكرة في أصول الفقه	محمد الأمين بن محمد المختار بن عبد القادر الجكني الشنقيطي (المتوفى: 1393هـ)	ShamAY	9885	0.27961
		الذريعة إلى حافظ الشريعة - الجزء1	رفيع الدين محمد الجيلاني	Masaha	4739	0.27961
		 الرسائل التوحيدية 	 السيد الطباطبائي 	ABLibrary	8435	0.2796
		شفاء الغليل في بيان الشبه والمخيل ومسالك التعليل	أبو حامد محمد بن محمد الغزالي الطوسي (المتوفى: 505 هـ)	ShamAY	32546	0.27959
		الوهابية بين المباني الفكرية والنتائج العملية	الشيخ جعفر السبحاني	Rafed	3417	0.27959
		ارشاد الطالبين الي نهج المسترشدين	حسن بن يوسف بن مطهر علامه حلي	Ghbook	15556	0.27959
		دروس الشيخ محمد الدويش	محمد بن عبد الله بن إبراهيم الدويش	ShamelaY19	37377	0.27958
		 المغني في أبواب التوحيد والعدل 	 القاضي عبد الجبار الهمذاني 	ABLibrary	8630	0.27958
		نهاية الأرب في فنون الأدب‏ - الجزء1	أحمد بن عبد الوهاب النويري‏	Masaha	3070	0.27958
		 اللوامع الإلهية في المباحث الكلامية 	 المقداد السيوري 	ABLibrary	8584	0.27956
		بدائع الأفكار	الميرزا حبيب الله الرشتي	Masaha	3182	0.27955
		بدائع الأفكار	الميرزا حبيب الله الرشتي	Masaha	2669	0.27955
		نهاية الوصول في دراية الأصول	صفي الدين محمد بن عبد الرحيم الأرموي الهندي (715 هـ)	ShamAY	32587	0.27954
		قواعد التحديث من فنون مصطلح الحديث	محمد جمال الدين بن محمد سعيد بن قاسم الحلاق القاسمي (المتوفى: 1332هـ)	ShamAY	9993	0.27954
		الوسيط في تراجم أدباء شنقيط والكلام على تلك البلاد تحديدا وتخطيطا وعاداتهم وأخلاقهم وما يتعلق بذلك	أحمد بن الأمين الشّنْقِيطي (المتوفى: 1331هـ)	ShamAY	1629	0.27953
		 حواريات فقهية 	 السيد محمد سعيد الحكيم 	ABLibrary	9615	0.27953
		 أنوار الفقاهة ( كتاب البيع ) 	 الشيخ ناصر مكارم الشيرازي 	ABLibrary	9676	0.27953
		مباني الفقيه‏	الشيخ محمد تقي الفقيه	Masaha	4270	0.27953
		المدرّس الأفضل [ج ٣]	الشيخ محمّد علي المدرّس الأفغاني	Rafed	2683	0.27952
		التحقيق في كلمات القرآن الكريم - الجزء1	حسن المصطفوي	Masaha	4922	0.27952
		 سلسلة المسائل الفقهية 	 الشيخ السبحاني 	ABLibrary	9591	0.2795
		البلاغة العربية	عبد الرحمن بن حسن حَبَنَّكَة الميداني الدمشقي (المتوفى: 1425هـ)	ShamAY	12825	0.27949
		دروس الشيخ محمد الدويش	محمد بن عبد الله بن إبراهيم الدويش	ShamAY	848	0.27949
		نفح الطيب من غصن الأندلس الرطيب، وذكر وزيرها لسان الدين بن الخطيب	شهاب الدين أحمد بن محمد المقري التلمساني (المتوفى: 1041هـ)	ShamAY	1002	0.27949
		 معرفة المعاد 	 السيد محمد حسين الطهراني 	ABLibrary	8874	0.27949
		الصفات الإلهية في الكتاب والسنة النبوية في ضوء الإثبات والتنزيه	أبو أحمد محمد أمان بن علي جامي علي (المتوفى: 1415هـ)	ShamAY	10423	0.27948
		المطالب العالية من العلم الإلهي [ج ١]	محمّد بن عمر بن الحسن بن الحسين التيمي البكري [ فخر الدين الرازي ]	Rafed	3630	0.27948
		الفائق في غريب الحديث والأثر	أبو القاسم محمود بن عمرو بن أحمد، الزمخشري جار الله (المتوفى: 538ه)	Sham19Y	7015	0.27948
		مستقبل الإسلام خارج أرضه	محمد الغزالي	ShamAY	33252	0.27947
		الميزان في تفسير القرآن [ج ١٧]	آية الله السيد محمد حسين الطباطبائي	Rafed	1450	0.27947
		الفواكه الدواني على رسالة ابن أبي زيد القيرواني - الثقافة الدينية	أحمد بن غنيم بن سالم النفراوي (المتوفى : 1126هـ)	ShamAY	34228	0.27946
		تسهيل النظر وتعجيل الظفر في أخلاق الملك	أبو الحسن علي بن محمد بن محمد بن حبيب البصري البغدادي، الشهير بالماوردي (المتوفى: 450هـ)	ShamAY	7239	0.27946
		 المسامرة شرح المسايرة في العقائد المنجية في الآخرة 	 ابن أبي شريف المقدسي 	ABLibrary	8598	0.27946
		هويه التشيع	احمد وائلي	Ghbook	7734	0.27946
		العباس(ع)	السيد عبد الرزاق المقرم	Masaha	515	0.27946
		القواعد الفقهية - الجزء1	السيد حسن الموسوي البجنوردي	Masaha	889	0.27946
		العقيده الاسلاميه علي ضوء مدرسه اهل البيت عليهم السلام	آيت الله العظمي جعفر سبحاني	Ghbook	5050	0.27945
		عوائد الأيام في بيان قواعد الأحكام	الشيخ أحمد بن محمد مهدي النراقي	Masaha	1461	0.27945
		الإنصاف في مسائل دام فيها الخلاف [ج ٣]	الشيخ جعفر السبحاني	Rafed	1975	0.27944
		المفيد في شرح أصول الفقه‏  - الجزء1	ابراهيم شهركاني	Masaha	3576	0.27944
		روح المعاني في تفسير القرآن العظيم والسبع المثاني	شهاب الدين محمود بن عبد الله الحسيني الألوسي (المتوفى: 1270هـ)	ShamAY	22835	0.27943
		مع المعلمين	-	ShamAY	1990	0.27942
		من تراث شيخ الإسلام ابن تيمية: «المسائل والأجوبة» (وفيها «جواب سؤال أهل الرحبة» ) لشيخ الإسلام ابن تيمية، ومعه «اختيارات شيخ الإسلام ابن تيمية» للحافظ العلامة محمد بن عبد الهادي، مع «ترجمة شيخ الإسلام ابن تيمية» لمؤرخ الإسلام الحافظ الذهبي	تقي الدين أبو العَباس أحمد بن عبد الحليم بن عبد السلام بن عبد الله بن أبي القاسم بن محمد ابن تيمية الحراني الحنبلي الدمشقي (المتوفى: 728هـ)	ShamAY	13088	0.27942
		المحصول في أصول الفقه	القاضي محمد بن عبد الله أبو بكر بن العربي المعافري الاشبيلي المالكي (المتوفى: 543هـ)	ShamAY	6281	0.27942
		إظهار الحق [ج ١ ـ ٢]	رحمة الله بن خليل الرحمن الهندي	Rafed	3394	0.27942
		تفسير التّحرير والتّنوير [ج ١٠]	الشيخ محمّد الطاهر ابن عاشور	Rafed	2914	0.27942
		 الشافي في شرح الكافي 	 المولى خليل القزويني 	ABLibrary	7922	0.27937
		 الشامل في أصول الدين 	 عبد الملك الجويني 	ABLibrary	8449	0.27937
		رحلة إيمانية مع رجال ونساء أسلموا	عبد الرحمن محمود	ShamAY	2196	0.27936
		فتاوى منوعة - الراجحي	عبد العزيز بن عبد الله بن عبد الرحمن الراجحي	ShamAY	367	0.27934
		أحكام القرآن [ج ٣-٤]	عماد الدين بن محمد الطبري [ الكيا الهرّاسي ]	Rafed	3147	0.27933
		كتاب المكاسب (للشيخ الأنصاري) - الجزء1	الشيخ مرتضى الأنصاري	Masaha	822	0.27933
		الدكتور علي جمعة إلى أين	طلحة محمد المسير	ShamAY	1054	0.27931
		أفلا تتفكرون	الشيخ: عبد العزيز بن ناصر الجليل	ShamAY	35032	0.27931
		اللباب في علل البناء والإعراب	محبّ الدين عبدالله بن الحسين البغدادي [ أبي البقاء العكبري ]	Rafed	2815	0.27931
		بحوث في الملل والنّحل [ج ٣]	الشيخ جعفر السبحاني	Rafed	61	0.27931
		نزهة النظر في توضيح نخبة الفكر في مصطلح أهل الأثر	أحمد بن علي بن محمد بن حجر العسقلاني (773 - 852 ه)	ShamelaY19	37456	0.27931
		ما دل عليه القرآن مما يعضد الهيئة الجديدة القويمة بالبرهان	أبو المعالي محمود شكري بن عبد الله بن محمد بن أبي الثناء الألوسي (المتوفى: 1342ه)	Sham19Y	5551	0.27929
		منهج الأشاعرة في العقيدة - الكبير	سفر بن عبد الرحمن الحوالي	ShamAY	31935	0.27928
		الأمثل في تفسير كتاب الله المنزل [ج ٦]	آية الله مكارم الشيرازي	Rafed	2043	0.27928
		اتجاهات الشعر العربي المعاصر	دكتور إحسان عباس (المتوفى: 1424ه)	Sham19Y	1018	0.27927
		رسالة الملائكة ت الجندي	أَبُو العَلاء المَعَرِّي	ShamAY	38986	0.27926
		حوار مع صديقي الملحد	مصطفى محمود	ShamAY	35536	0.27926
		الأساس في التفسير [ج ٦]	سعيد حوّى	Rafed	3139	0.27925
		أزهار الرياض في أخبار القاضي عياض	شهاب الدين أحمد بن محمد بن أحمد بن يحيى، أبو العباس المقري التلمساني (المتوفى: 1041ه)	Sham19Y	26350	0.27925
		فتح البيان في مقاصد القرآن	أبو الطيب محمد صديق خان بن حسن بن علي ابن لطف الله الحسيني البخاري القنوجي (المتوفى: 1307ه)	ShamelaY19	37458	0.27924
		المسالك والممالك للبكري	أبو عبيد عبد الله بن عبد العزيز بن محمد البكري الأندلسي (المتوفى: 487هـ)	ShamAY	23849	0.27923
		القوانين المحكمة في الأصول [ج ٤]	الميرزا أبو القاسم القمّي	Rafed	2626	0.27923
		نهاية الوصول إلى علم الأصول [ج ٤]	الحسن بن يوسف بن علي المطّهر [ العلامة الحلّي ]	Rafed	3667	0.27923
