automatic URI	Proposed URI	bookTitle	authorName	collection	id	tfidf
		شرح كتاب سيبويه [ج ٢]	أبي سعيد السّيرافي الحسن بن عبدالله بن المرزبان	Rafed	2787	0.26884
		دروس الشيخ عمر الأشقر	عمر بن سليمان بن عبد الله الأشقر العتيبي	ShamelaY19	37419	0.26883
		 كتاب الزكاة 	 الشيخ المنتظري 	ABLibrary	9529	0.26883
		 الجراحة ، المقالة الثلاثون من التصريف لمن عجز عن التأليف 	 خلف بن عباس الزهراوي 	ABLibrary	9847	0.26883
		إكفار الملحدين في ضروريات الدِّين	محمد أنور شاه بن معظم شاه الكشميري الهندي (المتوفى: 1353هـ)	ShamAY	21788	0.26882
		دروس الشيخ عمر الأشقر	عمر بن سليمان بن عبد الله الأشقر العتيبي	ShamAY	853	0.26882
		أصول الإنشاء والخطابة	محمد الطاهر ابن عاشور (المتوفى: 1393 هـ)	ShamAY	38854	0.26882
		دراسات في علم الأصول [ج ٢]	آية الله السيّد علي الشاهرودي	Rafed	3673	0.26882
		القطوف الدانية	أبو هاشم صالح بن عواد بن صالح المغامسي	ShamelaY19	37742	0.26882
		الإعجاز العلمي إلى أين؟ مقالات تقويمية للإعجاز العلمي.	د مساعد بن سليمان بن ناصر الطيار	Sham19Y	13768	0.26882
		 المكتوبات ( الدرر المكنونات النفيسة ) 	 أحمد الفاروقي السرهندي 	ABLibrary	8847	0.26882
		 معجم فقه الجواهر 	 مؤسسة دائرة المعارف الفقه الاسلامي 	ABLibrary	9644	0.26881
		نهاية الأفكار في مباحث الألفاظ / تقريرات - الجزء1	الشيخ محمد تقي البروجردي	Masaha	4711	0.26881
		مناهج المفسرين	عبدالحليم محمود	Ghbook	9472	0.2688
		محاضرات في النصرانية (تبحث في الأدوار التي مرَّت عليها عقائد النصاري وفي كتبهم ومجامعهم المقدسة وفرقهم)	محمد بن أحمد بن مصطفى بن أحمد المعروف بأبي زهرة (المتوفى: 1394هـ)	ShamAY	2280	0.26878
		موسوعه الامام المهدي ( عجل الله تعالي فرجه الشريف )	مركز الابحاث العقائدية	Ghbook	4584	0.26878
		شرح كتاب سيبويه [ج ٤]	أبي سعيد السّيرافي الحسن بن عبدالله بن المرزبان	Rafed	2846	0.26877
		عودة الحجاب	محمد أحمد إسماعيل المقدم	Sham19Y	9133	0.26876
		مسائل أبي الوليد ابن رشد (الجد)	أبو الوليد محمد بن أحمد بن رشد القرطبي (المتوفى: 520هـ)	ShamAY	32004	0.26875
		ينابيع الأحكام في معرفة الحلال والحرام [ج ١]	السيّد علي الموسوي القزويني	Rafed	1463	0.26875
		التطور والثبات في حياة البشرية	الواحدي :: محمد قطب	ShamAY	33320	0.26874
		(الحماسة المغربية) مختصر كتاب صفوة الأدب ونخبة ديوان العرب	أبو العباس أحمد بن عبد السلام الجرّاوي التادلي (المتوفى: 609هـ)	ShamAY	6902	0.26873
		 إثنا عشر رسالة 	 السيد محمد باقر الداماد ( الميرداماد ) 	ABLibrary	834	0.26873
		أحكام القرآن للجصاص ت قمحاوي	أحمد بن علي أبو بكر الرازي الجصاص الحنفي (المتوفى: 370ه)	ShamelaY19	23579	0.26872
		الإيمان والرد على أهل البدع (مطبوع ضمن مجموعة الرسائل والمسائل النجدية لبعض علماء نجد الأعلام، الجزء الثاني)	عبد الرحمن بن حسن بن محمد بن عبد الوهاب بن سليمان التميمي (المتوفى: 1285هـ)	ShamAY	9841	0.26871
		 مسالك الأبصار في ممالك الأمصار 	 أحمد بن يحيى العمري 	ABLibrary	9198	0.26871
		إتحاف أعلام الناس بجمال أخبار حاضرة مكناس	ابن زيدان عبد الرحمن بن محمد السجلماسي (المتوفى: 1365)	ShamAY	32704	0.2687
		 نفح الطيب من غصن الأندلس الرطيب 	 أحمد بن محمد المقري التلمساني 	ABLibrary	9299	0.2687
		رحلة ديللاقالية إلى العراق	بيترو دلاوالة	Masaha	4718	0.26869
		النهاية	الشيخ الطوسي	Masaha	622	0.26869
		بذل النظر في الأصول	العلاء محمد بن عبد الحميد الأسمندي (552 ه)	Sham19Y	133362	0.26868
		مجموعة الرسائل والمسائل - ط وهبة	تقي الدين أبو العباس أحمد بن عبد الحليم بن تيمية الحراني (المتوفى : 728هـ)	ShamAY	34371	0.26867
		الرد على السبكي في مسألة تعليق الطلاق	شيخ الإسلام أحمد بن عبد الحليم بن عبد السلام ابن تيمية (661 - 728 ه)	Sham19Y	32384	0.26866
		جواهر الكلام في شرح شرائع الاسلام	محمد حسن بن باقر نجفي ( صاحب جواهر )	Ghbook	10694	0.26866
		شرح التسهيل لابن مالك	محمد بن عبد الله، ابن مالك الطائي الجياني، أبو عبد الله، جمال الدين (المتوفى: 672هـ)	ShamAY	31770	0.26865
		الوجيز في تفسير القرآن العزيز [ج ١]	الشيخ علي بن الحسين بن أبي جامع العاملي	Rafed	3840	0.26865
		التيسير في أحاديث التفسير	محمد المكي الناصري (المتوفى: 1414هـ)	ShamAY	31629	0.26864
		الرسالة المحمدية	السيد سليمان الندوي الحسيني (المتوفى: 1373هـ)	ShamAY	9821	0.26864
		الروضة البهيّة في شرح اللمعة الدمشقيّة [ج ٢]	زين الدين بن علي العاملي [ الشهيد الثاني ]	Rafed	3227	0.26864
		الاختلاط بين الرجال والنساء، أحكام وفتاوى - ثمار مرة وقصص مخزية - كشف 136 شبهة لدعاة الاختلاط	شحاتة صقر	ShamelaY19	26006	0.26864
		روح البيان - إحياء التراث	إسماعيل حقي بن مصطفى الإستانبولي الحنفي الخلوتي	ShamAY	34059	0.26862
		مجموع فتاوى فضيلة الشيخ صالح بن فوزان	صالح بن فوزان بن عبد الله الفوزان	ShamAY	8612	0.26862
		الإيضاح في علوم البلاغة	محمد بن عبد الرحمن بن عمر، أبو المعالي، جلال الدين القزويني الشافعي، المعروف بخطيب دمشق (المتوفى: 739هـ)	ShamAY	7380	0.26862
		مقاصد المكلفين فيما يتعبد به لرب العالمين	عمر بن سليمان بن عبد الله الأشقر العتيبي	ShamelaY19	97808	0.26861
		موسوعة الإمام الخوئي [ج ٢١]	الشيخ مرتضى البروجردي	Rafed	1610	0.2686
		 جواهر الكلام في ثوبه الجديد 	 الشيخ الجواهري 	ABLibrary	9368	0.2686
		إيضاح الغوامض في تقسيم الفرائض	الشيخ علي الغروي العلي ياري	Rafed	1290	0.26859
		دلالة المدينة في الخطاب الشعري العربي المعاصر	قادة عقاق	ShamAY	34543	0.26857
		بيان العلم الأصيل والمزاحم الدخيل	أبو محمد عبد الكريم بن صالح بن عبد الكريم الحميد	ShamAY	980	0.26857
		شرح كتاب الفقه الأكبر للإمام الأعظم أبي حنيفة	الملّا علي القاري الحنفي	Rafed	3451	0.26857
		شأن الدعاء	أبو سليمان حمد بن محمد بن إبراهيم بن الخطاب البستي المعروف بالخطابي (المتوفى: 388ه)	ShamelaY19	95700	0.26857
		 موسوعة مصطلحات التصوف الإسلامي 	 رفيق العجم 	ABLibrary	8899	0.26857
		خلل الصلاة وأحكامه	الشيخ مرتضى الحائري	Masaha	5127	0.26857
		مرآة العقول [ج ١٠]	الشيخ محمّد باقر بن محمّد تقي المجلسي	Rafed	1028	0.26856
		بدر شاكر السياب دراسة في حياته وشعره	دكتور إحسان عباس (المتوفى: 1424ه)	Sham19Y	1017	0.26855
		الرد علي الشاذلي في حزبيه - ت العمران - ط عالم الفوائد	شيخ الإسلام أحمد بن عبد الحليم بن عبد السلام ابن تيمية (661 - 728 هـ)	ShamAY	38471	0.26854
		التّفسير الحديث  [ج ٢]	محمّد عزّة دروزة	Rafed	3690	0.26854
		الطريق الى خراسان	كمال السيد	Rafed	70	0.26854
		 نظرية الحكم في الإسلام 	 الشيخ محسن الأراكي 	ABLibrary	9531	0.26854
		البحر الرائق شرح كنز الدقائق - ط العلمية	ابن نجيم الحنفي	ShamAY	34204	0.26853
		 حياة الإمام زين العابدين ( ع ) 	 الشيخ باقر شريف القرشي 	ABLibrary	7500	0.26853
		الرسالة التدمرية - المطبعة السلفية	الواحدي :: ابن تيمية	ShamAY	34381	0.26852
		الكلام على مسألة السماع	أبو عبد الله محمد بن أبي بكر بن أيوب ابن قيم الجوزية (المتوفى: 751 هـ)	ShamAY	38482	0.26852
		الإشارة في أصول الفقه	أبو الوليد سليمان بن خلف بن سعد بن أيوب بن وارث التجيبي القرطبي الباجي الأندلسي (المتوفى: 474 هـ)	ShamAY	32522	0.26852
		تحفة المشتاق إلى شرح أبيات المولى إسحق	الحسين بن أحمد بن الحسين السياغي (المتوفى: 1221هـ)	ShamAY	662	0.26852
		موسوعه احكام  الاطفال و ادلتها : مقارنه تفصيليه بين مذهب الاماميه و المذاهب الاخ...	محمد جواد فاضل لنكراني	Ghbook	9624	0.26852
		تفريغ «أشرطة متفرقة» للشيخ الألباني	الواحدي :: ناصر الدين الألباني	ShamAY	33161	0.26851
		تفسير ابن جزي = التسهيل لعلوم التنزيل	أبو القاسم، محمد بن أحمد بن محمد بن عبد الله، ابن جزي الكلبي الغرناطي (المتوفى: 741ه)	ShamelaY19	23626	0.26851
		الثبات والشمول في الشريعة الإسلامية	الدكتور عابد بن محمد السفياني	ShamAY	32602	0.2685
		آثار البلاد وأخبار العباد	زكريا بن محمد القزويني	Masaha	4128	0.2685
		موسوعة الفقه الإسلامي المصرية	مجموعة من المؤلفين	ShamAY	437	0.26849
		شرح مقدمة التفسير (من النقاية) للسيوطي	عبد الكريم الخضير	ShamAY	75	0.26849
		تاج العروس [ج ١]	محبّ الدين أبي فيض السيد محمّد مرتضى الحسيني الواسطي الزبيدي الحنفي	Rafed	1464	0.26849
		اللغة العربية معناها ومبناها	تمام حسان عمر	ShamAY	9970	0.26848
		العلم للعثيمين	محمد بن صالح بن محمد العثيمين (المتوفى: 1421هـ)	ShamAY	11332	0.26846
		لماذا يمزق القرآن الكريم؟؟	علي بن نايف الشحود	ShamAY	33273	0.26846
		البلاغة الصافية في المعاني والبيان والبديع	حسن بن إسماعيل بن حسن بن عبد الرازق الجناجي رئيس قسم البلاغة بجامعة الأزهر (المتوفى: 1429 ه)	ShamelaY19	151012	0.26846
		شرح العقيدة الأصفهانية	تقي الدين أبو العباس أحمد بن عبد الحليم بن عبد السلام بن عبد الله بن أبي القاسم بن محمد ابن تيمية الحراني الحنبلي الدمشقي (المتوفى: 728هـ)	ShamAY	1137	0.26845
		شرح اللّمع في النحو	أبي الفتح عثمان بن جنّي	Rafed	2232	0.26845
		 مآثر الكبراء تاريخ سامراء 	 الشيخ ذبيح الله المحلاتي 	ABLibrary	9174	0.26845
		معالم الطريق إلى الله	أبو فيصل البدراني	ShamelaY19	96252	0.26844
		 مقالة في تحقيق إقامة الحدود في هذه الأعصار 	 سيد محمد باقر شفتي 	ABLibrary	9364	0.26844
		علم الأخلاق الإسلامية	مقداد يالجن محمد علي	ShamAY	11293	0.26843
		روض الجنان في شرح إرشاد الأذهان [ج ١]	زين الدين بن علي العاملي [ الشهيد الثاني ]	Rafed	1539	0.26843
		 كتاب الزكاة 	 الشيخ المنتظري 	ABLibrary	9526	0.26843
		تطور علم أصول الفقه وتجدده (وتأثره بالمباحث الكلامية)	د. عبد السلام بلاجي	ShamAY	34202	0.26842
		تلبيس مردود في قضايا حية	د صالح بن عبد الله بن حميد	Sham19Y	30823	0.26842
		معالم تاريخ الشرق الأدني القديم	محمد أبو المحاسن عصفور	ShamAY	7320	0.26841
		البلغة الى أصول اللغة	أبو الطيب محمد صديق خان بن حسن بن علي ابن لطف الله الحسيني البخاري القنوجي (المتوفى: 1307ه)	ShamelaY19	35073	0.26839
		نظم اللآل في الحكم والأمثال	عبد الله فكري «باشا» بن محمد بليغ بن عبد الله بن محمد (المتوفى: 1306هـ)	ShamAY	5385	0.26837
		 رحلة الصفار إلى فرنسا 	 محمد بن عبد الله الصفار 	ABLibrary	9099	0.26837
		الفوز الكبير في أصول التفسير	الإمام أحمد بن عبد الرحيم المعروف بـ «ولي الله الدهلوي» (المتوفى: 1176هـ)	ShamAY	9964	0.26835
		الآداب النافعة بالألفاظ المختارة الجامعة	ابن شمس الخلافة، جعفر بن محمد (شمس الخلافة) ابن مختار الأفضلي، أبو الفضل، الملقب مجد الملك (المتوفى: 622هـ)	ShamAY	5433	0.26834
		العودة إلى القرآن لماذا وكيف	مجدي الهلالي	ShamelaY19	36397	0.26834
		النهر الفائق شرح كنز الدقائق	سراج الدين عمر بن إبراهيم بن نجيم الحنفي (ت 1005هـ)	ShamAY	31914	0.26832
		 ينابيع الأحكام في معرفة الحلال والحرام 	 السيد علي الموسوي القزويني 	ABLibrary	9390	0.26831
		شرح كتاب الإيمان - يوسف الغفيص	يوسف بن محمد علي الغفيص	ShamAY	31673	0.2683
		الحاشية على مدارك الأحكام [ج ٣]	محمّد باقر الوحيد البهبهاني	Rafed	680	0.2683
		حكم ومواعظ من حياة الانبياء عليهم السلام [ج ٢]	مرتضى الميلاني	Rafed	110	0.26829
		حاشية البجيرمي على الخطيب = تحفة الحبيب على شرح الخطيب	سليمان بن محمد بن عمر البجيرمي المصري الشافعي (المتوفى: 1221ه)	ShamelaY19	21599	0.26829
		مستمسك العروة الوثقى - الجزء1	السيد محسن الطباطبائي الحكيم	Masaha	1703	0.26829
		شعر الفتوح الإسلامية في صدر الإسلام	الدكتور/ النعمان عبد المتعال القاضي	ShamAY	10001	0.26828
		التفسير المنير [ج ٢٠]	الدكتور وهبة الزحيلي	Rafed	2965	0.26828
		مصباح الفقيه [ج ١٢]	الشيخ آقا رضا الهمداني	Rafed	1875	0.26828
		شرح هداية المسترشدين( حجية الظن)	الشيخ محمد باقر الأصفهاني النجفي	Masaha	3995	0.26828
		قضايا الدعوة الإسلامية من اليقظة إلى الصحوة	أنور الجندي	ShamAY	33414	0.26827
		شرح منسك شيخ الإسلام ابن تيمية	عبد الكريم الخضير	ShamelaY19	25814	0.26827
		رحلة الفرنسي تافرنيية إلى العراق	جان باتيست تاورنية	Masaha	4574	0.26827
		إخراج الناس من عبادة العباد لعبادة الله وحده	علي بن نايف الشحود	ShamAY	34821	0.26826
		 شرح كتاب الفقه الأكبر 	 ملا علي القاري 	ABLibrary	8481	0.26826
		أم البراهين .. في الرد التفصيلي على مذهب الأشعرية والماتردية	حامد بن عبد الله العلي	ShamAY	35448	0.26825
		تفسير الماتريدي = تأويلات أهل السنة	محمد بن محمد بن محمود، أبو منصور الماتريدي (المتوفى: 333هـ)	ShamAY	1549	0.26823
		فقه النكاح والفرائض	محمد عبد اللطيف قنديل	ShamAY	8640	0.26823
		مستمسك العروة الوثقى [ج ٦]	آية الله السيد محسن الطباطبائي الحكيم	Rafed	414	0.26822
		الأدب العربي المعاصر في مصر	أحمد شوقي عبد السلام ضيف الشهير بشوقي ضيف (المتوفى: 1426ه)	Sham19Y	9981	0.26822
		الْأَشْبَاهُ وَالنَّظَائِرُ عَلَى مَذْهَبِ أَبِيْ حَنِيْفَةَ النُّعْمَانِ	زين الدين بن إبراهيم بن محمد، المعروف بابن نجيم المصري (المتوفى: 970هـ)	ShamAY	1666	0.26821
		نصاب الاحتساب	عمر بن محمد بن عوض السَّنَامي الحنفي (المتوفى: 734هـ)	ShamAY	9679	0.2682
		التفسير الواضح [ج ١]	دكتور محمّد محمود حجازي	Rafed	3987	0.2682
		 رحلة إلى رحاب الشريف الأكبر 	 شارل ديدييه 	ABLibrary	9083	0.2682
		تراثنا ـ العددان [ 81 و 82 ]	مؤسسة آل البيت عليهم السلام لإحياء التراث ـ قم	Rafed	3623	0.26817
		علم الأخلاق الإسلامية	مقداد يالجن محمد علي	Sham19Y	11293	0.26817
		روضة الناظر - ط جامعة الإمام	أبو محمد موفق الدين عبد الله بن أحمد بن محمد بن قدامة الجماعيلي المقدسي ثم الدمشقي الحنبلي، الشهير بابن قدامة المقدسي (المتوفى: 620هـ)	ShamAY	34197	0.26815
		موسوعة الفقه الإسلامي المصرية	مجموعة من المؤلفين	Sham19Y	437	0.26815
		من حقي أن أكون شيعية	السيدة أم محمد علي المعتصم	Masaha	437	0.26815
		 المواقف ( شرح الجرجاني ) ( مع حاشيتي السيالكوتي والحلبي ) 	 الإيجي 	ABLibrary	8469	0.26814
		 الحاشية على إلهيات الشرح الجديد للتجريد 	 المحقق الأردبيلي 	ABLibrary	8408	0.26814
		المقال وتطوره في الأدب المعاصر	السيد مرسي أبو ذكري	ShamAY	10540	0.26813
		موسوعة الإعجاز العلمي في القرآن والسنة	النابلسي، محمد راتب	ShamAY	1444	0.26813
		منكرات الأفراح	غانم غالب غانم	ShamelaY19	96336	0.26813
		التعريف بالمصطلح الشريف	أحمد بن يحيى بن فضل الله القرشي العدوي العمري، شهاب الدين (المتوفى: 749ه)	ShamelaY19	37051	0.26813
		 تبصرة الفقهاء 	 الشيخ محمد تقي الرازي الأصفهاني 	ABLibrary	9362	0.26813
		رافضة المدينة النخاولة		ShamAY	35305	0.26812
		النكت في القرآن الكريم (في معاني القرآن الكريم وإعرابه)	علي بن فَضَّال بن علي بن غالب المُجَاشِعِي القيرواني، أبو الحسن (المتوفى: 479هـ)	ShamAY	9066	0.26812
		التفسير البياني للتراكيب القرآنية ذوات الدلالات الاحتمالية		ShamAY	36913	0.26811
		تحقيق الفوائد الغياثية	محمد بن يوسف بن علي بن سعيد، شمس الدين الكرماني (المتوفى: 786 هـ)	ShamAY	32571	0.26811
		الأجوبة المفيدة عن أسئلة المناهج الجديدة	صالح الفوزان	ShamAY	35460	0.26811
		المنهج المقترح لفهم المصطلح	حاتم بن عارف بن ناصر الشريف العوني	ShamAY	9247	0.26811
		الإعلام بفوائد عمدة الأحكام	ابن الملقن سراج الدين أبو حفص عمر بن علي بن أحمد الشافعي المصري (المتوفى: 804هـ)	ShamAY	31785	0.2681
		أحكام القرآن [ج ١]	أبي بكر محمّد بن عبدالله [ ابن العربي ]	Rafed	3218	0.2681
		مجمع الأفكار ومطرح الأنظار [ج ٥]	محمد علي الإسماعيل پور الشهرضائي	Rafed	3791	0.26808
		المقترح في أجوبة بعض أسئلة المصطلح - أكثر من 200 سؤال في المصطلح مع محاضرات في:	أبو عبد الرحمن مقبل بن هادي بن مقبل بن قائدة (اسم رجل) الهمداني الوادعي (المتوفى: 1422ه)	ShamelaY19	96783	0.26808
		الشريف الرضي	الشيخ محمد رضا كاشف الغطاء	Masaha	2342	0.26808
		تقريرات آية الله المجدّد الشيرازي [ج ١]	المولى علي الروزدري	Rafed	941	0.26807
		محاسبة النفس	إبراهيم بن علي الكفعمي	Masaha	517	0.26807
		إعراب القرآن للأصبهاني	إسماعيل بن محمد بن الفضل بن علي القرشي الطليحي التيمي الأصبهاني، أبو القاسم، الملقب بقوام السنة (المتوفى: 535هـ)	ShamAY	581	0.26806
		صفات المفلحين في القرآن والسنة	علي بن نايف الشحود	ShamAY	34847	0.26806
		جواهر الكلام [ج ٣٨]	الشيخ محمّد حسن النّجفي	Rafed	764	0.26806
		البراهين القاطعة [ج ٢]	محمّد جعفر الأسترآبادي	Rafed	718	0.26804
		شرح الطحاوية ت الأرناؤوط	صدر الدين محمد بن علاء الدين عليّ بن محمد ابن أبي العز الحنفي، الأذرعي الصالحي الدمشقي (المتوفى: 792هـ)	ShamAY	8352	0.26803
		(الحماسة المغربية) مختصر كتاب صفوة الأدب ونخبة ديوان العرب	أبو العباس أحمد بن عبد السلام الجراوي التادلي (المتوفى: 609ه)	Sham19Y	6902	0.26803
		 جواهر الكلام في ثوبه الجديد 	 الشيخ الجواهري 	ABLibrary	9370	0.26801
		القواعد الفقهيه	آيت الله العظمي ناصرمكارم شيرازي	Ghbook	3294	0.26801
		تحرير المجله	محمد حسين آل كاشف الغطاء	Ghbook	11370	0.26801
		المعاجم العربية مع اعتناء خاص بمعجم "العين" للخليل بن أحمد	عبد الله درويش	ShamAY	22867	0.268
		الكتاب دعامه الحياه	آيت الله العظمي سيد محمد حسيني شيرازي	Ghbook	7782	0.268
		الحدائق الناضرة [ج ٨]	الشيخ يوسف بن أحمد البحراني [ صاحب الحدائق ]	Rafed	2831	0.26799
		منتهى المطلب في تحقيق المذهب - الجزء1	العلامة الحلي	Masaha	1212	0.26799
		التذكرة في الوعظ	جمال الدين أبو الفرج عبد الرحمن بن علي بن محمد الجوزي (المتوفى: 597هـ)	ShamAY	6858	0.26798
		القضاء و الشهادات	الشيخ مرتضى الأنصاري	Masaha	1597	0.26798
		المدخل إلى علوم القرآن الكريم	محمد فاروق النبهان	ShamelaY19	38032	0.26797
		الجامع الصحيح للسيرة النبوية	الأستاذ الدكتور سعد المرصفي	Sham19Y	17666	0.26797
		تذكرة بالأخبار عن اتقافات الأسفار  - الجزء1	محمد بن أحمد ابن جبير	Masaha	4170	0.26796
		 شرح تشريح القانون 	 ابن النفيس 	ABLibrary	9927	0.26795
		معركة النص	فهد بن صالح العجلان	ShamAY	32421	0.26794
		موسوعة الإمام الخوئي [ج ٦]	الشيخ علي الغروي	Rafed	849	0.26794
		حطم صنمك وكن عند نفسك صغيرا	مجدي الهلالي	ShamelaY19	36328	0.26794
		القضاء و الشهادات (للشيخ الأنصاري)	الشيخ مرتضى الأنصاري	Masaha	831	0.26794
		تهافت العلمانية في الصحافة العربية	المستشار سالم علي البهنساوي (المتوفى: 1427هـ)	ShamAY	31711	0.26793
		سبل النجاة من الفتنة	عبد الحميد السحيباني	ShamAY	34975	0.26792
		رحلات في فارس/ تعريب	السير جون شاردان (المتوفى: 1713م)	ShamAY	33804	0.26792
		العمدة في محاسن الشعر وآدابه	أبو على الحسن بن رشيق القيرواني الأزدي (المتوفى: 463 هـ)	ShamAY	10909	0.26792
		الخلاصة في معرفة الحديث	الحسين بن محمد بن عبد الله، شرف الدين الطيبي (المتوفى: 743 ه)	Sham19Y	17807	0.26792
		تقريرات في اصول الفقه	آيت الله العظمي سيد حسين طباطبايي بروجردي	Ghbook	12014	0.26792
		تحريرات في الأصول‏ - الجزء1	السيد مصطفى الموسوي الخميني	Masaha	2715	0.26792
