automatic URI	Proposed URI	bookTitle	authorName	collection	id	tfidf
		النكت على مقدمة ابن الصلاح للزركشي	أبو عبد الله بدر الدين محمد بن عبد الله بن بهادر الزركشي الشافعي (المتوفى: 794هـ)	ShamAY	5978	0.25918
		شرح الطحاوية لابن جبرين	عبد الله بن عبد الرحمن بن عبد الله بن إبراهيم بن فهد بن حمد بن جبرين (المتوفى: 1430هـ)	ShamAY	7724	0.25918
		أنس المسجون وراحة المحزون	صفي الدين، أبو الفتح عيسى بن البحتري الحلبي (المتوفى: بعد 625ه)	ShamelaY19	120146	0.25918
		وضوء النبي (صلى الله عليه و آله و سلم‌) - الجزء1	السيد علي الشهرستاني	Masaha	3679	0.25918
		دراسات أصولية في القرآن الكريم	محمد إبراهيم الحفناوى	ShamAY	1472	0.25917
		أزواج بالكذب	عبد الله بن ضيف الله الرحيلي	Sham19Y	7500	0.25916
		اثنان وسبعون مقالا وبحثا للعلامة أنور الجندي	أنور الجندي	ShamAY	34719	0.25915
		التفسير المنير [ج ١٨]	الدكتور وهبة الزحيلي	Rafed	2963	0.25915
		الشيخ الطوسي مفسراً	خضير جعفر	Masaha	1722	0.25915
		المهذب في ثمرات الإيمان	علي بن نايف الشحود	ShamAY	35267	0.25914
		تفسير ابن عطية = المحرر الوجيز في تفسير الكتاب العزيز	أبو محمد عبد الحق بن غالب بن عبد الرحمن بن تمام بن عطية الأندلسي المحاربي (المتوفى: 542ه)	ShamelaY19	23632	0.25913
		موسوعة الإمام الخوئي [ج ١٦]	الشيخ مرتضى البروجردي	Rafed	1588	0.25912
		 موسوعة أحكام الأطفال وأدلتها 	 مركز فقه الأئمة الأطهار ( ع ) 	ABLibrary	9674	0.25912
		قطب السرور في أوصاف الأنبذة والخمور	الرقيق القيرواني، أبو اسحاق إبراهيم بن القاسم المعروف بالرقيق النديم (المتوفى: نحو 425هـ)	ShamAY	672	0.25911
		ديوان صفي الدين الحلي	صفى الدين الحلى، عبدالعزيز بن سرايا على بن ابى القاسم السنبسى	ShamAY	37951	0.25911
		معالم المدرستين [ج ٢]	السيد مرتضى العسكري	Rafed	3472	0.25911
		 دولة المهدي ( عج ) المنتظر 	 إبراهيم الأنصاري 	ABLibrary	971	0.25911
		منهاج الأصول [ج ٤]	محمّد ابراهيم الكرباسي	Rafed	3684	0.2591
		التفسير الواضح	الحجازي، محمد محمود	ShamAY	23589	0.25909
		بحوث في علم الأصول [ج ٢]	السيّد محمود الهاشمي الشاهرودي	Rafed	655	0.25907
		الشيعة والقرآن	إحسان إلهي ظهير الباكستاني (المتوفى: 1407ه)	ShamelaY19	37550	0.25907
		السحر الحلال في الحكم والأمثال	أحمد بن إبراهيم بن مصطفى الهاشمي (المتوفى: 1362هـ)	ShamAY	6903	0.25906
		المنثور في القواعد الفقهية	أبو عبد الله بدر الدين محمد بن عبد الله بن بهادر الزركشي (المتوفى: 794ه)	Sham19Y	21592	0.25906
		 منهاج الصالحين 	 السيد محمد سعيد الحكيم 	ABLibrary	9625	0.25906
		السيرة النبوية دروس وعبر	الواحدي :: علي بن نايف الشحود	ShamAY	37428	0.25904
		شرح كتاب الإبانة من أصول الديانة	أبو الأشبال حسن الزهيري آل مندوه المنصوري المصري	ShamAY	646	0.25904
		المقنع	الشيخ الصدوق	Masaha	713	0.25904
		الشامل في الصناعة الطبية، الأدوية والأغذية: كتاب الهمزة	علاء الدين ابن النفيس، علي بن أبي الحزم القرشي (المتوفى: 687هـ)	ShamAY	240	0.25903
		الأساليب والإطلاقات العربية	أبو المنذر محمود بن محمد بن مصطفى بن عبد اللطيف المنياوي	ShamAY	844	0.25902
		الخلاصة في حياة الأنبياء	الواحدي :: علي بن نايف الشحود	ShamAY	36083	0.25901
		إرشاد العقول إلى مباحث الأصول [ج ٢]	الشيخ جعفر السبحاني	Rafed	438	0.25901
		منهج أهل السنة والجماعة في نقد الرجال والكتب والطوائف	ربيع بن هادي المدخلي	ShamAY	33009	0.259
		شكري فيصل العالم الأديب المجمعي	د. محمد مطيع الحافظ	ShamAY	38609	0.25899
		 رسائل مولانا ( معرب عاكوب ) 	 جلال الدين الرومي 	ABLibrary	8770	0.25899
		الصوم في الشريعة الإسلامية الغراء - الجزء1	الشيخ جعفر السبحاني	Masaha	4939	0.25898
		الأقسام في القرآن الكريم	الشيخ جعفر السبحاني	Rafed	3170	0.25897
		استقصاء الاعتبار في شرح الاستبصار - الجزء1	الشيخ البهائي	Masaha	1130	0.25897
		المستشرقون والتراث	عبد العظيم محمود الديب (المتوفى: 1431ه)	ShamelaY19	23307	0.25896
		تاريخ الطب في الدولة الاسلامية	عامر نجار	Ghbook	10026	0.25896
		حاشية على درر الفوائد	محمود الآشتياني	Masaha	3633	0.25896
		شرح الورقات في أصول الفقه - للصقعبي	خالد بن إبراهيم الصقعبي	ShamAY	37569	0.25895
		المحاجّة في القرآن الكريم .. دراسة دلالية	أسيل الجنابي	ShamAY	36997	0.25894
		عيون الأدلة في مسائل الخلاف بين فقهاء الأمصار	أبو الحسن علي بن عمر بن أحمد البغدادي المالكي المعروف بابن القصار (المتوفى: 397هـ)	ShamAY	32022	0.25894
		حكم تارك الصلاة - الألباني	محمد ناصر الدين الألباني (المتوفى: 1420هـ)	ShamAY	416	0.25894
		رسالة قواعد العقائد	الخواجة نصير الدين الطوسي	Rafed	3498	0.25894
		الانتصار للصحب والآل من افتراءات السماوي الضال	إبراهيم بن عامر بن عليّ الرّحيلي	ShamAY	1790	0.25893
		رسالة في الطريق إلى ثقافتنا - ط المدني	أبو فهر، محمود محمد شاكر	ShamAY	34763	0.25893
		سراج الملوك	أبو بكر محمد بن محمد ابن الوليد الفهري الطرطوشي المالكي (المتوفى: 520هـ)	ShamAY	1585	0.25893
		رد البهتان عن إعراب آيات من القرآن الكريم	د يوسف بن خلف بن محل العيساوي	Sham19Y	37174	0.25893
		تبيان الصلاة - الجزء1	السيد حسين البروجردي	Masaha	4992	0.25892
		رسالة في العدالة	السيد علي الموسوي القزويني	Masaha	1600	0.25892
		الدر المنثور في طبقات ربات الخدور	زينب بنت علي بن حسين بن عبيد الله بن حسن بن إبراهيم بن محمد بن يوسف فواز العاملي (المتوفى: 1332هـ)	ShamAY	9229	0.25891
		الحريه الاسلاميه	آيت الله العظمي سيد محمد حسيني شيرازي	Ghbook	8145	0.25891
		اللّباب في علوم الكتاب [ج ١]	أبي حفص عمر بن علي بن عادل الدمشقي الحنبلي	Rafed	3089	0.2589
		مصباح الفقيه [ج ١١]	الشيخ آقا رضا الهمداني	Rafed	1874	0.2589
		 ختم الأولياء 	 الحكيم الترمذي 	ABLibrary	8693	0.2589
		 شرح مواقف النفري 	 عفيف الدين التلمساني 	ABLibrary	8781	0.2589
		المقتضب	محمد بن يزيد بن عبد الأكبر الثمالى الأزدي، أبو العباس، المعروف بالمبرد (المتوفى: 285هـ)	ShamAY	6965	0.25889
		الغدير في الكتاب والسنّة والأدب [ج ٧]	الشيخ عبد الحسين أحمد الأميني النجفي	Rafed	2015	0.25889
		علماء المغرب ومقاومتهم للبدع والتصوف والقبورية والمواسم	أبو سفيان مصطفى باحو السلاوي المغربي	ShamelaY19	96922	0.25889
		في سبيل العقيدة الإسلامية	عبد اللطيف بن علي بن أحمد بن محمد السلطاني القنطري الجزائري (المتوفى: 1404هـ)	ShamAY	31655	0.25887
		تحريم آلات الطرب	أبو عبد الرحمن محمد ناصر الدين، بن الحاج نوح بن نجاتي بن آدم، الأشقودري الألباني (المتوفى: 1420هـ)	ShamAY	11081	0.25887
		التفسير المنير [ج ٢١]	الدكتور وهبة الزحيلي	Rafed	2966	0.25886
		بيان الفقه في شرح العروة الوثقى (الاجتهاد والتقليد) - الجزء1	السيد صادق الحسيني الشيرازي	Masaha	3282	0.25886
		بحوث ومقالات في اللغة والأدب وتقويم النصوص (مقالات محمد أجمل الإصلاحي)	د. محمد أجمل أيوب الإصلاحي	Sham19Y	18270	0.25885
		مصادر السنة ومناهج مصنفيها	حاتم العوني	ShamAY	37322	0.25884
		الرسالة الأكملية في ما يجب لله من صفات الكمال	تقي الدين أبو العباس أحمد بن عبد الحليم بن عبد السلام بن عبد الله بن أبي القاسم بن محمد ابن تيمية الحراني الحنبلي الدمشقي (المتوفى: 728ه)	Sham19Y	7631	0.25884
		جواهر الكلام [ج ١٦]	الشيخ محمّد حسن النّجفي	Rafed	647	0.25883
		أضواء وآراء؛ تعليقات على كتابنا بحوث في علم الأصول‏ - الجزء1	السيد محمود الهاشمي الشاهرودي	Masaha	2400	0.25883
		جامع الخلاف و الوفاق	الشيخ علي المؤمن السبزواري القمي	Masaha	1064	0.25883
		التفسير المنير [ج ١١]	الدكتور وهبة الزحيلي	Rafed	2954	0.25881
		الأساليب والإطلاقات العربية	أبو المنذر محمود بن محمد بن مصطفى بن عبد اللطيف المنياوي	Sham19Y	36193	0.25881
		جلال الدين السيوطي عصره وحياته وآثاره وجهوده في الدرس اللغوي	طاهر سليمان حمودة	ShamAY	1050	0.2588
		شرح شافية ابن حاجب المشهور بكمال	ابن حاجب	Rafed	2173	0.2588
		شرح [مختصر المنتهى الأصولي للإمام أبي عمرو عثمان ابن الحاجب المالكي (المتوفى 646 ه)]	عضد الدين عبد الرحمن الإيجي (المتوفى: 756 ه)	ShamelaY19	133411	0.2588
		 رسالة في المعاملة والاختلاف بين المتعاقدين 	 الشيخ محمد رضا حسين آبادى الجرقويئي 	ABLibrary	9415	0.2588
		النور المبين في قصص الأنبياء والمرسلين	السيد نعمة الله الجزائري	Masaha	4680	0.2588
		تاريخ شبه الجزيرة العربية في عصورها القديمة	عبد العزيز صالح	ShamAY	481	0.25879
		أصول العقيدة - عبد الرحيم السلمي	عبد الرحيم بن صمايل العلياني السلمي	ShamAY	807	0.25879
		الرسائل التسع (للمحقق الحلي)	المحقق الحلي	Masaha	1022	0.25879
		الانتصار للقرآن للباقلاني	محمد بن الطيب بن محمد بن جعفر بن القاسم، القاضي أبو بكر الباقلاني المالكي (المتوفى: 403هـ)	ShamAY	1397	0.25878
		المنهاج في شعب الإيمان	الحسين بن الحسن بن محمد بن حليم البخاري الجرجاني، أبو عبد الله الحليمي (المتوفى: 403 ه)	ShamelaY19	18567	0.25878
		الامام المهدي (عجل الله تعالي فرجه الشريف) قدوه الصديقين	آيت الله العظمي سيد محمد تقي مدرسي	Ghbook	6586	0.25877
		السنة المفترى عليها	سالم البهنساوي (المتوفى: 1427هـ)	ShamAY	1632	0.25876
		الاعتصام للشاطبي ت الشقير والحميد والصيني	إبراهيم بن موسى بن محمد اللخمي الغرناطي الشهير بالشاطبي (المتوفى: 790هـ)	ShamAY	445	0.25876
		كليات في علم الرجال	الشيخ جعفر السبحاني	Rafed	149	0.25876
		ديوان الشريف الرضي - الجزء1	الشريف الرضي	Masaha	3399	0.25875
		شرح الدروس المهمة لعامة الأمة	عبد الكريم الخضير	ShamAY	177	0.25874
		سرّ صناعة الإعراب [ج ١]	أبي الفتح عثمان بن جنّي	Rafed	2072	0.25874
		مختصر المعاني (مختصر لشرح تلخيص المفتاح)	سعد الدين مسعود بن عمر التفتازاني (المتوفى: 793هـ)	ShamAY	33799	0.25873
		الأسرة وقضايا الزواج	د. علي القائمي	Masaha	556	0.25873
		رسالة في الفقه الميسر	أ. د صالح بن غانم بن عبد الله بن سليمان بن علي السدلان	ShamelaY19	31260	0.25872
		رفع الملام عن الأئمة الأعلام - ط العصرية	تقي الدين أبو العباس أحمد بن عبد الحليم بن تيمية الحراني (المتوفى : 728هـ)	ShamAY	34369	0.2587
		عُقودُ الزَّبَرْجَدِ على مُسْند الإِمَام أَحْمد	عبد الرحمن بن أبي بكر، جلال الدين السيوطي (المتوفى: 911هـ)	ShamAY	31988	0.2587
		الاستغاثة في الرد على البكري	شيخ الإسلام أحمد بن تيمية (المتوفى: 728 ه)	ShamelaY19	18328	0.25869
		قطب السرور في أوصاف الأنبذة والخمور	الرقيق القيرواني، أبو اسحاق إبراهيم بن القاسم المعروف بالرقيق النديم (المتوفى: نحو 425ه)	Sham19Y	672	0.25869
		نشوار المحاضرة و أخبار المذاكرة - الجزء1	محمد بن علي التنوخي	Masaha	2964	0.25868
		ديوان محمود سامي البارودي	محمود سامي باشا بن حسن حسين بن عبد الله البارودي المصري	ShamAY	37857	0.25867
		المقنع في علوم الحديث	ابن الملقن سراج الدين أبو حفص عمر بن علي بن أحمد الشافعي المصري (المتوفى: 804هـ)	ShamAY	5976	0.25867
		ضرائر الشعر	علي بن مؤمن بن محمد، الحضرمي الإشبيلي، أبو الحسن المعروف بابن عصفور (المتوفى: 669ه)	ShamelaY19	37489	0.25867
		المخزاة الجعيطية في كتابة السيرة النبوية	إبراهيم عوض	ShamAY	37450	0.25866
		شرح شذور الذهب في معرفة كلام العرب	عبد الله بن يوسف بن أحمد بن عبد الله ابن يوسف، أبو محمد، جمال الدين، ابن هشام (المتوفى: 761هـ)	ShamAY	6969	0.25866
		 الجامع لمفردات الأدوية والأغذية 	 ابن البيطار 	ABLibrary	9889	0.25864
		مصابيح الظلام [ج ١١]	محمّد باقر الوحيد البهبهاني	Rafed	3686	0.25863
		رحلة ابن بطوطة [ج ٢]	شمس الدين أبي عبد الله محمد بن عبد الله اللواتي الطنجي	Rafed	2358	0.25863
		نهاية الأفكار [ج ٣]	الشيخ محمد تقي البروجردي النجفي	Rafed	326	0.25863
		 شرح فصول أبقراط 	 ابن النفيس 	ABLibrary	9929	0.25861
		أصول مسائل العقيدة عند السلف وعند المبتدعة	سعود بن عبد العزيز الخلف	ShamAY	7259	0.2586
		دروس الدكتور راغب السرجاني	راغب السرجاني	ShamelaY19	37383	0.2586
		شرح طيبة النشر في القراءات العشر	محمد بن محمد بن محمد، أبو القاسم، محب الدين النويري (المتوفى: 857ه)	ShamelaY19	38740	0.2586
		الأشباه والنظائر للسيوطي	عبد الرحمن بن أبي بكر، جلال الدين السيوطي (المتوفى: 911ه)	ShamelaY19	21719	0.2586
		تاريخ طبق الحلوي وصحاف المن والسلوي المعروف بتاريخ اليمن‏	عبد الله بن علي الوزير	Masaha	4658	0.2586
		موسوعة الأسرة تحت رعاية الإسلام	عطية صقر	ShamAY	38650	0.25859
		مجلة التنكيت والتبكيت	صحيفة صدر العدد الأول منها في 16 يونيو عام 1881 م على يد عبد الله النديم (المتوفى 1314 هـ)	ShamAY	167	0.25859
		العلل في النحو	محمد بن عبدالله وراق	Ghbook	16344	0.25859
		العقيدة في الله عز وجل	صالح الرقب	ShamAY	35629	0.25858
		جواهر الكلام [ج ٢٧]	الشيخ محمّد حسن النّجفي	Rafed	661	0.25858
		صلاة المسافر	السيد أبو الحسن الأصفهاني	Masaha	4962	0.25858
		تصنيف غرر الحكم ودرر الكلم‏	عبد الواحد بن محمد التميمي الآمدي	Masaha	4559	0.25857
		 رحلة ابن بطوطة ( تحفة النظار في غرائب الأمصار وعجائب الأسفار ) 	 ابن بطوطة 	ABLibrary	9076	0.25856
		العقد الفريد - الجزء1	ابن عبد ربه	Masaha	2985	0.25856
		الاجتهاد (من كتاب التلخيص لإمام الحرمين)	عبد الملك بن عبد الله بن يوسف بن محمد الجويني، أبو المعالي، ركن الدين، الملقب بإمام الحرمين (المتوفى: 478هـ)	ShamAY	6352	0.25855
		الفتوى الحموية الكبرى	تقي الدين أبو العَباس أحمد بن عبد الحليم بن عبد السلام بن عبد الله بن أبي القاسم بن محمد ابن تيمية الحراني الحنبلي الدمشقي (المتوفى: 728هـ)	ShamAY	18381	0.25855
		سند العروه الوثقي (كتاب الحج)	محمد السند	Ghbook	15217	0.25855
		حاشية المكاسب	الميرزا أبو الفضل النجم آبادي	Rafed	1486	0.25854
		القواعد النورانية الفقهية - ط السنة المحمدية	تقي الدين أبو العباس أحمد بن عبد الحليم بن تيمية الحراني (المتوفى : 728هـ)	ShamAY	34365	0.25853
		جواهر الكلام [ج ٣٥]	الشيخ محمّد حسن النّجفي	Rafed	698	0.25853
		بحوث في الملل والنّحل [ج ٥]	الشيخ جعفر السبحاني	Rafed	186	0.25853
		 دلائل الصدق لنهج الحق 	 الشيخ محمد حسن المظفر 	ABLibrary	939	0.25853
		حاشية الدرة المضية في عقد الفرقة المرضية	عبد الرحمن بن محمد بن قاسم العاصمي الحنبلي النجدي (المتوفى: 1392هـ)	ShamAY	7369	0.25852
		بحث حول المهدي (عج)	آية الله السيّد محمّد باقر الصدر	Rafed	83	0.25852
		الفكر السياسي عند الشيعه و السنه (الخلفيات و النتائج)	محمد مسجد جامعي	Ghbook	15293	0.25852
		الموشى = الظرف والظرفاء	محمد بن أحمد بن إسحاق بن يحيى، أبو الطيب، المعروف بالوشاء (المتوفى: 325هـ)	ShamAY	26102	0.25851
		شبهات حول السنة	عبد الرزاق عفيفي (المتوفى: 1415ه)	Sham19Y	30836	0.2585
		 معجم فقه الجواهر 	 مؤسسة دائرة المعارف الفقه الاسلامي 	ABLibrary	9645	0.2585
		 المسالك والممالك 	 أبي عبيد البكري 	ABLibrary	9205	0.2585
		شرح كتاب العلم لأبي خيثمة - عبد الكريم الخضير	عبد الكريم الخضير	ShamAY	155	0.25849
		قرة العين لشرح ورقات إمام الحرمين	أبو عبد الله محمد بن محمد بن عبد الرحمن الرعيني المالكي المعروف بالحطاب	ShamAY	37540	0.25849
		المفصل في صنعة الإعراب	أبي القاسم محمود بن عمر الزمخشري	Rafed	2078	0.25849
		 الدر المنضود في أحكام الحدود 	 تقرير بحث السيد الگلپايگاني للجهرمي 	ABLibrary	9442	0.25849
		غاية الوصول في شرح لب الأصول	زكريا بن محمد بن أحمد بن زكريا الأنصاري، زين الدين أبو يحيى السنيكي (المتوفى: 926هـ)	ShamAY	9112	0.25848
		كشف ما ألقاه إبليس من البهرج والتلبيس على قلب داود بن جرجيس	عبد الرحمن بن حسن بن محمد بن عبد الوهاب بن سليمان التميمي (المتوفى: 1285ه)	Sham19Y	11354	0.25847
		جامعه الاصول	ملا محمد مهدي نراقي	Ghbook	8814	0.25847
		ديوان ابن الخياط	أبو عبد الله أحمد بن محمد بن علي التغلبي المعروف بابن الخياط الدمشقي (450 - 517)	Sham19Y	148537	0.25846
		عاشوراء امتداد لحركه الانبياء	آيت الله العظمي سيد محمد تقي مدرسي	Ghbook	5966	0.25846
		مشرق الشمسين و إكسير السعادتين مع تعليقات الخواجوئى	الشيخ البهائي	Masaha	1208	0.25846
		ريحانة الكتاب ونجعة المنتاب	محمد بن عبد الله بن سعيد السلماني اللوشي الأصل، الغرناطي الأندلسي، أبو عبد الله، الشهير بلسان الدين ابن الخطيب (المتوفى: 776هـ)	ShamAY	6955	0.25845
		نفح الأزهار في منتخبات الأشعار	شاكر بن مغامس بن محفوظ بن صالح شقير البتلوني (المتوفى: 1314هـ)	ShamAY	28175	0.25845
		مستمسك العروة الوثقى [ج ٨]	آية الله السيد محسن الطباطبائي الحكيم	Rafed	416	0.25845
		بحار الأنوار [ج ٨٩]	الشيخ محمّد باقر بن محمّد تقي المجلسي	Rafed	1164	0.25845
		موسوعة الرقائق والأدب - ياسر الحمداني	ياسر بن أحمد بن محمود بن أحمد بن أبي الحمد الكويس الحمداني	ShamelaY19	38154	0.25845
		شرح منظومة التفسير	أبو عبد الله، أحمد بن عمر بن مساعد الحازمي	ShamelaY19	36126	0.25844
		النكت على مقدمة ابن الصلاح للزركشي	أبو عبد الله بدر الدين محمد بن عبد الله بن بهادر الزركشي الشافعي (المتوفى: 794ه)	Sham19Y	5978	0.25844
		المختار في الرد على النصارى	عمرو بن بحر بن محبوب الكناني بالولاء، الليثي، أبو عثمان، الشهير بالجاحظ (المتوفى: 255هـ)	ShamAY	1169	0.25843
		فتاوى الأئمة في النوازل المدلهمة، وتبرئة دعوة وأتباع محمد بن عبدالوهاب من تهمة التطرف والإرهاب	محمد بن حسين بن سعيد بن هادي بن عبد الرحمن بن محمد بن حسن بن سفران القحطاني	ShamAY	847	0.25843
		المرأة في الإسلام	محمد الغزالي	ShamAY	36038	0.25842
		غاية المرام في شرح شرائع الإسلام [ج ١]	الشيخ مفلح الصّيمري البحراني	Rafed	1490	0.25842
		إفاضة القدير في أحكام العصير	شيخ الشريعة الأصفهاني	Masaha	4907	0.25842
		الفكر الصوفي في ضوء الكتاب والسنة	عبد الرحمن بن عبد الخالق اليوسف	ShamAY	11545	0.25841
		 تفصيل الشريعة في شرح تحرير الوسيلة ( الصوم والاعتكاف ) 	 الشيخ فاضل اللنكراني 	ABLibrary	9508	0.25841
		شرح زاد المستقنع للخليل	أحمد بن محمد بن حسن بن إبراهيم الخليل	ShamAY	1967	0.2584
		شعاع من المحراب	د. سليمان بن حمد العودة	ShamAY	38889	0.25839
		منهج المتقدمين والمتأخرين فى الصناعة الحديثية	مجموعة من المؤلفين	ShamAY	37330	0.25838
		السيرة النبوية الصحيحة محاولة لتطبيق قواعد المحدثين في نقد روايات السيرة النبوية	د. أكرم ضياء العمري	ShamelaY19	122396	0.25838
		 الكامل في التاريخ 	 ابن الأثير 	ABLibrary	8246	0.25838
		محاضرات في الاعتقادات - الجزء1	السيد علي الحسيني الميلاني	Masaha	401	0.25837
		الميسر في شرح مصابيح السنة للتوربشتي	فضل الله بن حسن بن حسين بن يوسف أبو عبد الله، شهاب الدين التُّورِبِشْتِي (المتوفى: 661 هـ)	ShamAY	32667	0.25836
		التضمين النحوي في القرآن الكريم	محمد نديم فاضل	ShamelaY19	95526	0.25836
		بحوث ندوة أثر القرآن الكريم في تحقيق الوسطية ودفع الغلو	مجموعة من المؤلفين	ShamelaY19	31448	0.25836
		الحاشية على استصحاب القوانين‏	الشيخ مرتضى الأنصاري	Masaha	3350	0.25836
