automatic URI	Proposed URI	bookTitle	authorName	collection	id	tfidf
		وقفات مع قضايا معاصرة شبهات ردود	محمد حازم صلاح أبو إسماعيل محمد عبد الرحيم	ShamelaY19	98121	0.25998
		سر الفصاحة	أبو محمد عبد الله بن محمد بن سعيد بن سنان الخفاجي الحلبي (المتوفى: 466هـ)	ShamAY	11239	0.25996
		كتاب المغني للإمام المتولي	الإمام أبو سعيد عبد الرحمن بن محمد المأمون المتولي الشافعي	ShamAY	33882	0.25996
		مصادر التشريع عند الإمامية والسنة	السيد محمد الموسوي البجنوردي	Masaha	4320	0.25991
		رفع الشبهة والغرر عمن يحتج على فعل المعاصي بالقدر	مرعي بن يوسف بن أبى بكر بن أحمد الكرمى المقدسي الحنبلى (المتوفى: 1033ه)	Sham19Y	6481	0.25991
		أمالي المرزوقي	أبو على أحمد بن محمد بن الحسن المرزوقي الأصفهاني (المتوفى: 421هـ)	ShamAY	722	0.2599
		 الدر المنضود في أحكام الحدود 	 تقرير بحث السيد الگلپايگاني للجهرمي 	ABLibrary	9440	0.2599
		تفسير القرآن الكريم «سورة الشعراء»	محمد بن صالح العثيمين	ShamelaY19	150304	0.25987
		جامع الافكار وناقد الانظار [ج ٢]	محمد مهدي بن أبي ذر النراقي [ المولى مهدي النراقي ]	Rafed	730	0.25986
		إعراب القرآن لابن سيده	ابن سيده	ShamAY	36821	0.25982
		 تسليك النفس الى حظيرة القدس 	 العلامة الحلي 	ABLibrary	8383	0.25982
		خطى متعثّرة على طريق تجديد النحو العربي	الدكتور عفيف دمشقيّة	Rafed	1986	0.25977
		أمالي المرزوقي	أبو على أحمد بن محمد بن الحسن المرزوقي الأصفهاني (المتوفى: 421ه)	Sham19Y	722	0.25975
		تفسير غرائب القرآن ورغائب الفرقان [ج ٥]	نظام الدين الحسن بن محمّد بن حسين القمي النيسابوري	Rafed	1803	0.25972
		 المثنوي المعنوي ( معرب الدسوقي ) 	 جلال الدين الرومي 	ABLibrary	8764	0.25964
		مائة سوأل عن الإسلام	محمد الغزالي	ShamAY	33250	0.25962
		منهج الرشاد في معرفه المعاد	محمد نعيم  بن محمدتقي نعيما طالقاني	Ghbook	16366	0.25962
		من أسرار التنزيل	الإمام فخر الدين محمد بن عمر بن الحسين الرازى المتوفى سنة 606 هـ	ShamAY	34048	0.25954
		نصاب الاحتساب	عمر بن محمد بن عوض السَّنَامي الحنفي (المتوفى: 734هـ)	ShamAY	9679	0.25953
		الآداب الطبية في الاسلام	السيد جعفر مرتضى العاملي	Masaha	513	0.25953
		 الدروس ( شرح الحلقة الثانية ) 	 تقرير بحث السيد كمال الحيدري لعلاء السالم 	ABLibrary	987	0.25952
		 مجموع رسائل الإمام المنصور بالله 	 المنصور بالله عبد الله بن حمزة بن سليمان 	ABLibrary	8589	0.2595
		دراسات في الأصول [ج ٤]	السيد صمد علي الموسوي	Rafed	3694	0.2595
		أصول الفقه [ج ٥]	آية الله الشيخ حسين الحلّي	Rafed	973	0.25949
		أصول الفقه [ج ٤]	آية الله الشيخ حسين الحلّي	Rafed	970	0.25948
		تفسير آيات الأحكام للسايس	محمد علي السايس الأستاذ بالأزهر الشريف	ShamelaY19	23599	0.25941
		 معرفة المعاد 	 السيد محمد حسين الطهراني 	ABLibrary	8875	0.25937
		أضواء على ثورة الحسين عليه السلام	السيد محمّد الصدر	Rafed	1564	0.25937
		منية الطالب في حاشية المكاسب‌  - الجزء1	الميرزا محمد حسين الغروي النائيني	Masaha	3649	0.25932
		إعراب القرآن - الجزء1	الزجاج	Masaha	3238	0.25928
		المحاضرات / تقريرات - الجزء1	السيد جلال الدين الطاهري الاصفهاني	Masaha	3483	0.25926
		المدرّس الأفضل [ج ١]	الشيخ محمّد علي المدرّس الأفغاني	Rafed	2679	0.25924
		الدر المنضود في أحكام الحدود - الجزء1	السيد محمد رضا الگلپايگاني	Masaha	4917	0.25922
		مباني الأحكام في أصول شرائع الإسلام‏  - الجزء1	الشيخ مرتضى الحائري	Masaha	4263	0.25922
		دستور الوحدة الثقافية بين المسلمين	محمد الغزالي	ShamAY	36046	0.2592
		نصاب الاحتساب	عمر بن محمد بن عوض السنامي الحنفي (المتوفى: 734ه)	Sham19Y	9679	0.25912
		مقالات الإسلاميين واختلاف المصلين	أبو الحسن علي بن إسماعيل بن إسحاق بن سالم بن إسماعيل بن عبد الله بن موسى بن أبي بردة بن أبي موسى الأشعري (المتوفى: 324ه)	ShamelaY19	37614	0.25909
		تلخيص كتاب القياس	أبو الوليد محمد بن أحمد بن رشد القرطبي الشهير بابن رشد الحفيد (المتوفى: 595هـ)	ShamAY	34178	0.25904
		نواهد الأبكار وشوارد الأفكار = حاشية السيوطي على تفسير البيضاوي	عبد الرحمن بن أبي بكر، جلال الدين السيوطي (المتوفى: 911ه)	ShamelaY19	29882	0.25904
		الاقتراح في أصول النحو ط القلم	عبد الرحمن بن أبي بكر، جلال الدين السيوطي (المتوفى: 911هـ)	ShamAY	31819	0.259
		الجامع الكبير في صناعة المنظوم من الكلام والمنثور	نصر الله بن محمد بن محمد بن عبد الكريم الشيباني، الجزري، أبو الفتح، ضياء الدين، المعروف بابن الأثير الكاتب (المتوفى: 637هـ)	ShamAY	865	0.25899
		الإصباح على المصباح في معرفة الملك الفتاح	ابراهيم بن محمد بن أحمد المؤيدي	Rafed	3493	0.25898
		الذخر في علم الأصول‏  - الجزء1	احمد الأردبيلي	Masaha	3446	0.25898
		نتائج الأفكار في الأصول‏ / تقريرات - الجزء1	السيد محمد جعفر الجزائري	Masaha	4620	0.25889
		نظريّة المعرفة	الشيخ حسن محمد مكي العاملي	Rafed	3494	0.25887
		 معرفة الإمام 	 السيد محمد حسين الطهراني 	ABLibrary	8896	0.25881
		الاقتراح في أصول النحو ط البيروتي	عبد الرحمن بن أبي بكر، جلال الدين السيوطي (المتوفى: 911ه)	ShamelaY19	95692	0.25878
		 الرسائل الأربع 	 الشيخ السبحاني 	ABLibrary	9565	0.25875
		أصول الإيمان	عبدالقاهر التميمي الشافعي	Rafed	3271	0.25873
		أحكام القرآن [ج ٣]	أبي بكر أحمد بن علي الرازي الجصّاص	Rafed	1989	0.25869
		كتاب الفنون لابن عقيل	أبو الوفاء، علي بن عقيل بن محمد بن عقيل البغدادي الحنبلي	ShamAY	38993	0.25864
		شرح منظومة القواعد الفقهية للسعدي - حمد الحمد	حمد بن عبد الله بن عبد العزيز الحمد	ShamelaY19	37791	0.25856
		تعليقات الفصول في الأصول [ج ٢]	محمّد حسين بن عبد الرحيم الحائري الإصفهاني	Rafed	3874	0.25848
		الموضع عن جهه اعجاز القرآن و هو الكتاب المعروف ب "الصرفه"	علي بن حسين علم الهدي	Ghbook	14044	0.25847
		روح المعاني [ج ١]	أبي الفضل شهاب الدين السيّد محمود الألوسي البغدادي	Rafed	3178	0.25847
		شرح كفاية الأصول	الشيخ عبد الحسين الرشتي	Masaha	3994	0.25847
		مغني الأديب [ج ١]	جماعة من أساتذة الأدب العربي في الحوزة العلميّة بقم المقدّسة	Rafed	3194	0.25845
		عوائد الأيام في بيان قواعد الأحكام	الشيخ أحمد بن محمد مهدي النراقي	Masaha	1461	0.25845
		أحكام القرآن [ج ١-٢]	عماد الدين بن محمد الطبري [ الكيا الهرّاسي ]	Rafed	3146	0.25844
		كيف نتعامل مع القرآن	محمد الغزالي	ShamAY	36728	0.25842
		نهاية الإقدام في علم الكلام	أبو الفتح محمد بن عبد الكريم بن أبى بكر أحمد الشهرستاني (المتوفى: 548 هـ)	ShamAY	33895	0.2584
		أصول الفقه المقارن فيما لا نصّ فيه‏	الشيخ جعفر السبحاني	Masaha	2385	0.25839
		القول الرشيد في سرد فوائد التوحيد - الجزء الأول	وليد السعيدان	ShamAY	35763	0.25835
		المحصول في أصول الفقه	القاضي محمد بن عبد الله أبو بكر بن العربي المعافري الاشبيلي المالكي (المتوفى: 543هـ)	ShamAY	6281	0.25829
		بداية المجتهد و نهاية المقتصد	أبو الوليد محمد بن أحمد بن محمد بن أحمد بن رشد القرطبي الشهير بابن رشد الحفيد (المتوفى: 595هـ)	ShamAY	34220	0.25821
		شرح الطحاوية لابن جبرين	عبد الله بن عبد الرحمن بن عبد الله بن إبراهيم بن فهد بن حمد بن جبرين (المتوفى: 1430هـ)	ShamAY	7724	0.2582
		شرح رسالة رفع الملام عن الأئمة الأعلام	يوسف بن محمد علي الغفيص	ShamelaY19	37778	0.25816
		اللّباب في علوم الكتاب [ج ١٣]	أبي حفص عمر بن علي بن عادل الدمشقي الحنبلي	Rafed	3112	0.25814
		مختصر الفتاوى المصرية لابن تيمية	محمد بن علي بن أحمد بن عمر بن يعلى، أبو عبد الله، بدر الدين البعليّ (المتوفى: 778هـ)	ShamAY	1627	0.25812
		تحرير الأصول [ج ١]	آية الله الشيخ مرتضى النجفي المظاهري الإصبهاني	Rafed	3913	0.25811
		العرف الشذي شرح سنن الترمذي	محمد أنور شاه بن معظم شاه الكشميري الهندي (المتوفى: 1353هـ)	ShamAY	119	0.25808
		شرح التّسهيل المسمّى تمهيد القواعد بشرح تسهيل الفوائد [ج ٣]	محمّد بن يوسف بن أحمد [ ناظر الجيش ]	Rafed	1884	0.25803
		 الحاشية على الروضة البهية 	 المحقق النراقي 	ABLibrary	9360	0.25796
		ماساه الزهرا ( سلام الله عليها ) شبهات و ردود	سيد جعفرمرتضي حسيني عاملي	Ghbook	3901	0.25796
		الجامع الكبير في صناعة المنظوم من الكلام والمنثور	نصر الله بن محمد بن محمد بن عبد الكريم الشيباني، الجزري، أبو الفتح، ضياء الدين، المعروف بابن الأثير الكاتب (المتوفى: 637ه)	ShamelaY19	37475	0.25795
		روح المعاني في تفسير القرآن العظيم والسبع المثاني	محمود الألوسي أبو الفضل	ShamAY	34055	0.25794
		الإنصاف في مسائل الخلاف بين النحويين: البصريين والكوفيين	عبد الرحمن بن محمد بن عبيد الله الأنصاري، أبو البركات، كمال الدين الأنباري (المتوفى: 577هـ)	ShamAY	7362	0.25792
		شرح الطحاوية ت الأرناؤوط	صدر الدين محمد بن علاء الدين عليّ بن محمد ابن أبي العز الحنفي، الأذرعي الصالحي الدمشقي (المتوفى: 792هـ)	ShamAY	8352	0.25791
		أسرار العربية - الجيل	عبد الرحمن بن أبي الوفاء محمد بن عبيدالله بن أبي سعيد	ShamAY	34671	0.25788
		مُخْتََصَرُ مِنْهَاجِ القَاصِدِينْ	نجم الدين، أبو العباس، أحمد بن عبد الرحمن بن قدامة المقدسي (المتوفى: 689هـ)	ShamAY	31600	0.25787
		الشيعة: نص الحوار مع المستشرق كوربان	السيد محمد حسين الطباطبائي	Masaha	2320	0.25786
		شرح الآجرومية لحسن حفظي	د حسن بن محمد الحفظي	ShamAY	2122	0.25784
		شبهات النصارى حول الإسلام	وليد كمال شكر	ShamAY	35366	0.25775
		بداية المجتهد - الفكر	أبو الوليد محمد بن أحمد بن محمد بن أحمد بن رشد القرطبي الشهير بابن رشد الحفيد (المتوفى: 595هـ)	ShamAY	34221	0.25772
		 مصطفى ، الدين القيم 	 الشيخ بشير النجفي 	ABLibrary	9766	0.2577
		معاني القرآن للفراء	أبو زكريا يحيى بن زياد بن عبد الله بن منظور الديلمي الفراء (المتوفى: 207ه)	ShamelaY19	23634	0.25768
		الشرح الصوتي لزاد المستقنع - ابن عثيمين	محمد بن صالح بن محمد العثيمين (المتوفى: 1421 ه)	Sham19Y	142264	0.25766
		جدد حياتك	محمد الغزالي	ShamAY	36041	0.25765
		التدمرية: تحقيق الإثبات للأسماء والصفات وحقيقة الجمع بين القدر والشرع	تقي الدين أبو العباس أحمد بن عبد الحليم بن عبد السلام بن عبد الله بن أبي القاسم بن محمد ابن تيمية الحراني الحنبلي الدمشقي (المتوفى: 728ه)	ShamelaY19	22666	0.25764
		شبهات وردود	موقع الكاشف	ShamAY	33308	0.2576
		تفسير القرآن الكريم «سورة الشعراء»	محمد بن صالح العثيمين	Sham19Y	150304	0.2576
		مقالات الشيخ محمد الغزالي	محمد الغزالي	ShamAY	33256	0.25759
		 الدر المنضود في أحكام الحدود 	 تقرير بحث السيد الگلپايگاني للجهرمي 	ABLibrary	9441	0.25754
		ركائز الإيمان بين العقل والقلب	محمد الغزالي	ShamAY	35258	0.25753
		 أساس الحكومة الإسلامية 	 السيد كاظم الحائري 	ABLibrary	9607	0.25751
		الظاهرة القرآنية	مالك بن الحاج عمر بن الخضر بن نبي (المتوفى: 1393هـ)	ShamAY	1697	0.2575
		الإنصاف في مسائل الخلاف بين النحويين: البصريين والكوفيين	عبد الرحمن بن محمد بن عبيد الله الأنصاري، أبو البركات، كمال الدين الأنباري (المتوفى: 577ه)	Sham19Y	7362	0.25749
		القواعد الفقهية - د عياض	عياض السلمي	ShamAY	37528	0.25748
		المعجم الفلسفي (بالألفاظ العربية والفرنسية والإنكليزية واللاتينية)	الدكتور جميل صليبا (المتوفى: 1976م)	ShamAY	34800	0.25746
		 حق اليقين في معرفة أصول الدين 	 السيد عبد الله الشبر 	ABLibrary	8411	0.25744
		جلسات الحج	الواحدي :: ابن عثيمين	ShamAY	36413	0.25741
		اللباب في علوم الكتاب	أبو حفص سراج الدين عمر بن علي بن عادل الحنبلي الدمشقي النعماني (المتوفى: 775هـ)	ShamAY	9108	0.25736
		كفاية الأصول	الشيخ محمد كاظم الخراساني [ الآخوند ]	Rafed	334	0.25735
		إعراب القرآن للأصبهاني	إسماعيل بن محمد بن الفضل بن علي القرشي الطليحي التيمي الأصبهاني، أبو القاسم، الملقب بقوام السنة (المتوفى: 535هـ)	ShamAY	581	0.25731
		الفوائد الطوسية	الحر العاملي	Masaha	1263	0.2573
		القوانين المحكمة في الأصول - الجزء1	الميرزا القمي	Masaha	3479	0.25726
		جواب الاعتراضات المصرية على الفتيا الحموية - قطعة منه	تقي الدين أبو العباس أحمد بن عبد الحليم بن تيمية الحراني (المتوفى: 728هـ)	ShamAY	34353	0.25725
		نهاية الوصول إلى علم الأصول [ج ١]	الحسن بن يوسف بن علي المطّهر [ العلامة الحلّي ]	Rafed	3660	0.25721
		الشرح الصوتي لزاد المستقنع - ابن عثيمين	محمد بن صالح بن محمد العثيمين (المتوفى: 1421 ه)	ShamelaY19	142264	0.25721
		نهاية الوصول إلى علم الأصول [ج ٢]	الحسن بن يوسف بن علي المطّهر [ العلامة الحلّي ]	Rafed	3661	0.2572
		روح المعاني [ج ٧]	أبي الفضل شهاب الدين السيّد محمود الألوسي البغدادي	Rafed	3191	0.2572
		الرسالة الأكملية في ما يجب لله من صفات الكمال	تقي الدين أبو العباس أحمد بن عبد الحليم بن عبد السلام بن عبد الله بن أبي القاسم بن محمد ابن تيمية الحراني الحنبلي الدمشقي (المتوفى: 728هـ)	ShamAY	7631	0.25717
		دروس في مسائل علم الأصول - الجزء1	الميرزا جواد التبريزي	Masaha	3821	0.25717
		 الإنصاف في مسائل دام فيها الخلاف 	 الشيخ السبحاني 	ABLibrary	9556	0.25715
		البحر المحيط في التّفسير [ج ٦]	محمّد بن يوسف [ أبي حيّان الأندلسي الغرناطي ]	Rafed	2424	0.25715
		الإلهيّات على هدى الكتاب والسنّة والعقل	الشيخ حسن محمد مكي العاملي	Masaha	1663	0.25715
		الحاشيه الاولي علي المكاسب	محمد امامي خوانساري	Ghbook	11278	0.25714
		فصول البدائع في أصول الشرائع	محمد بن حمزة بن محمد، شمس الدين الفناري (أو الفنري) الرومي (المتوفى: 834ه)	ShamelaY19	98083	0.25712
		بين الفضيلة والرذيلة	الواحدي :: الشعراوي	ShamAY	35038	0.25711
		منهاج الأصول [ج ٢]	محمّد ابراهيم الكرباسي	Rafed	3650	0.2571
		نتائج الفكر في النَّحو للسُّهَيلي	أبو القاسم عبد الرحمن بن عبد الله بن أحمد السهيلي (المتوفى: 581هـ)	ShamAY	613	0.25709
		تغيير التنقيح لابن كمال باشا	شيخ الإسلام ابن كمال باشا (ت941هـ)	ShamAY	37541	0.25706
		روح المعاني في تفسير القرآن العظيم والسبع المثاني	شهاب الدين محمود بن عبد الله الحسيني الألوسي (المتوفى: 1270ه)	ShamelaY19	22835	0.25705
		دراسة موضوعية للحائية ولمعة الاعتقاد والواسطية	عبد الرحيم بن صمايل العلياني السلمي	ShamAY	799	0.25704
		دروس وندوات لسفر الحوالي	سفر بن عبد الرحمن الحوالي	ShamAY	34758	0.25702
		تحقيق الحلقة الثانية	السيد علي أكبر الحائري	Masaha	2728	0.25702
		وقفات مع قضايا معاصرة شبهات ردود	محمد حازم صلاح أبو إسماعيل محمد عبد الرحيم	ShamAY	31616	0.25699
		المحصول في أصول الفقه	القاضي محمد بن عبد الله أبو بكر بن العربي المعافري الاشبيلي المالكي (المتوفى: 543ه)	Sham19Y	6281	0.25699
		 الإرشاد إلى قواطع الأدلة في أول الاعتقاد 	 عبد الملك الجويني 	ABLibrary	8329	0.25689
		 الرسائل الفقهية 	 تقرير بحث النائيني والعراقي لنجم آبادي 	ABLibrary	9409	0.25685
		مصادر الحكم الشرعي والقانون المدني [ج ١]	الشيخ علي كاشف الغطاء	Rafed	3655	0.25683
		فصول البدائع في أصول الشرائع	محمد بن حمزة بن محمد، شمس الدين الفناري (أو الفنري) الرومي (المتوفى: 834ه)	Sham19Y	98083	0.25682
		تبصرة الحكام في أصول الأقضية ومناهج الأحكام	إبراهيم بن علي بن محمد، ابن فرحون، برهان الدين اليعمري (المتوفى: 799ه)	ShamelaY19	21595	0.2568
		إعراب القرآن للأصبهاني	إسماعيل بن محمد بن الفضل بن علي القرشي الطليحي التيمي الأصبهاني، أبو القاسم، الملقب بقوام السنة (المتوفى: 535ه)	ShamelaY19	36506	0.25675
		الرسالة الأكملية في ما يجب لله من صفات الكمال	تقي الدين أبو العباس أحمد بن عبد الحليم بن عبد السلام بن عبد الله بن أبي القاسم بن محمد ابن تيمية الحراني الحنبلي الدمشقي (المتوفى: 728ه)	Sham19Y	7631	0.25674
		اللّباب في علوم الكتاب [ج ١٢]	أبي حفص عمر بن علي بن عادل الدمشقي الحنبلي	Rafed	3106	0.25672
		كفايه الاصول	محمد كاظم بن حسين آخوند خراساني	Ghbook	14628	0.25671
		نهاية الوصول إلى علم الأصول [ج ٤]	الحسن بن يوسف بن علي المطّهر [ العلامة الحلّي ]	Rafed	3667	0.25667
		تفريغ فتاوى متنوعة للشيخ الألباني	الواحدي :: ناصر الدين الألباني	ShamAY	33153	0.25665
		العقيده الاسلاميه علي ضوء مدرسه اهل البيت عليهم السلام	آيت الله العظمي جعفر سبحاني	Ghbook	5050	0.25665
		دروس في البلاغة [ج ٢]	الشيخ محمّدي البامياني	Rafed	1980	0.25665
		شرح الطحاوية لابن جبرين	عبد الله بن عبد الرحمن بن عبد الله بن إبراهيم بن فهد بن حمد بن جبرين (المتوفى: 1430ه)	Sham19Y	7724	0.25665
		المنتخب من تفسير القرآن [ج ١]	أبو عبدالله محمّد بن أحمد بن إدريس الحلّي	Rafed	3827	0.25664
		 تاج العروس الحاوى لتهذيب النفوس ( ويليه الهداية لباديس / الورع للأبياري / الطريق إلى الله للمزيدي ) 	 ابن عطاء الله السكندري 	ABLibrary	8789	0.25661
		 أبكار الأفكار في أصول الدين 	 سيف الدين الآمدي 	ABLibrary	8314	0.25659
		اللّباب في علوم الكتاب [ج ٥]	أبي حفص عمر بن علي بن عادل الدمشقي الحنبلي	Rafed	3096	0.25656
		التلقين في الفقة المالكي	أبو محمد عبد الوهاب بن علي بن نصر الثعلبي البغدادي المالكي (المتوفى: 422هـ)	ShamAY	7262	0.25649
		 الجوامع والفوارق بين السنة والشيعة 	 محمد جواد مغنيه 	ABLibrary	8406	0.25649
		فقه الإمام الصادق عليه السلام - الجزء1	الشيخ محمد جواد مغنية	Masaha	5121	0.25649
		البخلاء	عمرو بن بحر الجاحظ	Masaha	2332	0.25647
		 الإلهيات على هدى الكتاب والسنة والعقل 	 الشيخ السبحاني 	ABLibrary	8345	0.25645
		 دروس تمهيدية في القواعد الفقهية 	 الشيخ محمد باقر الإيرواني 	ABLibrary	9542	0.25644
		 البخلاء 	 الجاحظ 	ABLibrary	809	0.25643
		 مجلة فقه أهل البيت ( ع ) 	 مجموعة مؤلفين 	ABLibrary	9751	0.25642
		حليه الصالحين	آيت الله العظمي حسيني	Ghbook	7993	0.25638
		الإسلام يتحدى	وحيد الدين خان	ShamAY	33285	0.25637
		كفاية الأصول [ج ٢]	الشيخ محمد كاظم الخراساني [ الآخوند ]	Rafed	2260	0.25637
		جامعه الاصول	ملا محمد مهدي نراقي	Ghbook	8814	0.25636
		أنوار الأصول [ج ٢]	الناشر: مدرسة الإمام علي بن أبي طالب عليه السلام	Rafed	938	0.25634
		سر تأخر العرب والمسلمين	محمد الغزالي	ShamAY	36048	0.2563
		أساليب بلاغية	الدكتور أحمد مطلوب	Rafed	1954	0.2563
		تلقيح الأفهام العلية بشرح القواعد الفقهية	وليد بن راشد السعيدان	ShamAY	842	0.25627
		موسوعة الإمام الخوئي - الجزء1	السيد أبو القاسم الموسوي الخوئي	Masaha	1762	0.25626
		كشف المراد في شرح تجريد الاعتقاد	محمد بن محمد بن حسن خواجه نصيرالدين طوسي	Ghbook	15434	0.25624
		دراسة موضوعية للحائية ولمعة الاعتقاد والواسطية	عبد الرحيم بن صمايل العلياني السلمي	ShamelaY19	37795	0.25623
		شرح منظومة القواعد الفقهية للسعدي - حمد الحمد	حمد بن عبد الله بن عبد العزيز الحمد	ShamAY	798	0.25619
		تحفة المسؤول في شرح مختصر منتهى السول	أبو زكريا يحيى بن موسى الرهوني (المتوفى: 773 هـ)	ShamAY	38995	0.25617
		 إيصال الطالب إلى المكاسب 	 السيد محمد الحسيني الشيرازي 	ABLibrary	9479	0.25615
