automatic URI	Proposed URI	bookTitle	authorName	collection	id	tfidf
		المنطق	الواحدي :: ابن سينا	ShamAY	35934	0.37533
		 المبدأ والمعاد 	 أبو علي سينا 	ABLibrary	8586	0.35455
		 شرح الأصول الخمسة 	 القاضي عبد الجبار الهمذاني 	ABLibrary	8455	0.35164
		 المطالب العالية من العلم الإلهي 	 فخر الدين الرازي 	ABLibrary	8607	0.34941
		 المطالب العالية من العلم الإلهي 	 فخر الدين الرازي 	ABLibrary	8612	0.34906
		كتاب الانصاف	ابوعلي حسين بن عبدالله ابن سينا	Ghbook	7950	0.34637
		 الأربعين في أصول الدين 	 فخر الدين الرازي 	ABLibrary	8326	0.34432
		 المطالب العالية من العلم الإلهي 	 فخر الدين الرازي 	ABLibrary	8614	0.34301
		 الأربعين في أصول الدين 	 فخر الدين الرازي 	ABLibrary	8325	0.34117
		 موسوعة مصطلحات علم الكلام الإسلامي 	 سميح دغيم 	ABLibrary	8657	0.34012
		 القضاء والقدر 	 فخر الدين الرازي 	ABLibrary	8573	0.33992
		التّعليقات	أبو علي حسين بن عبد الله بن سينا [ شيخ الرئيس ابن سينا ]	Rafed	1723	0.3399
		 المطالب العالية من العلم الإلهي 	 فخر الدين الرازي 	ABLibrary	8608	0.33982
		 تلخيص المحصل المعروف بنقد المحصل 	 خواجه نصير الدين الطوسي 	ABLibrary	8394	0.33841
		 المحصل 	 فخر الدين الرازي 	ABLibrary	8595	0.33551
		 اللمع في الرد على أهل الزيغ والبدع 	 أبو الحسن الأشعري 	ABLibrary	8582	0.3355
		المطالب العالية من العلم الإلهي [ج ٧]	محمّد بن عمر بن الحسن بن الحسين التيمي البكري [ فخر الدين الرازي ]	Rafed	3636	0.33486
		 المنقذ من التقليد 	 الشيخ سديد الدين الحمصي الرازي 	ABLibrary	8647	0.3347
		 منهج الرشاد في معرفة المعاد 	 ملا نعيما العرفي الطالقاني 	ABLibrary	8650	0.33432
		 المطالب العالية من العلم الإلهي 	 فخر الدين الرازي 	ABLibrary	8610	0.33422
		المطالب العالية من العلم الإلهي [ج ٢]	محمّد بن عمر بن الحسن بن الحسين التيمي البكري [ فخر الدين الرازي ]	Rafed	3631	0.33283
		شرح الأصول الخمسة	عبد الجبّار بن أحمد الهمداني الأسدآبادي	Rafed	3424	0.33268
		 النفس والروح وشرح قواهما 	 فخر الدين الرازي 	ABLibrary	8668	0.33215
		 المطالب العالية من العلم الإلهي 	 فخر الدين الرازي 	ABLibrary	8609	0.33161
		منطق المشرقيين	ابوعلي حسين بن عبدالله ابن سينا	Ghbook	7953	0.33088
		موسوعة مصطلحات علم المنطق عند العرب	فريد جبر - سميح دغيم - رفيق العجم - جيرار جهامي	ShamAY	34793	0.33084
		 المغني في أبواب التوحيد والعدل 	 القاضي عبد الجبار الهمذاني 	ABLibrary	8622	0.3306
		الأربعين في أصول الدين [ج ٢]	محمّد بن عمر بن الحسن بن الحسين التيمي البكري [ فخر الدين الرازي ]	Rafed	3315	0.33051
		 المطالب العالية من العلم الإلهي 	 فخر الدين الرازي 	ABLibrary	8613	0.32895
		لوامع الأسرار = شرح مطالع الأنوار في المنطق	قطب الدين محمد بن محمد الرازي (المتوفى: 766هـ)	ShamAY	34795	0.32863
		الشّفاء ـ الإلهيّات	أبو علي حسين بن عبد الله بن سينا [ شيخ الرئيس ابن سينا ]	Rafed	1128	0.32832
		المطالب العالية من العلم الإلهي [ج ٩]	محمّد بن عمر بن الحسن بن الحسين التيمي البكري [ فخر الدين الرازي ]	Rafed	3642	0.3266
		ارسطو طاليس في النفس	عبدالرحمن بدوي	Ghbook	10015	0.32595
		تلخيص الكون والفساد	أبي الوليد محمد بن رشد الحفيد	Rafed	1722	0.32584
		 المغني في أبواب التوحيد والعدل 	 القاضي عبد الجبار الهمذاني 	ABLibrary	8634	0.32521
		 مصارع المصارع في الرد على كتاب مصارعة الفلاسفة 	 خواجه نصير الدين الطوسي 	ABLibrary	8603	0.32501
		القضاء والقدر	محمّد بن عمر بن الحسن بن الحسين التيمي البكري [ فخر الدين الرازي ]	Rafed	3462	0.32404
		 المغني في أبواب التوحيد والعدل 	 القاضي عبد الجبار الهمذاني 	ABLibrary	8628	0.32315
		المقدمات والتنبيهات في شرح أصول الفقه‏  - الجزء1	محمود قانصوه	Masaha	3578	0.32314
		 المغني في أبواب التوحيد والعدل 	 القاضي عبد الجبار الهمذاني 	ABLibrary	8633	0.3231
		المطالب العالية من العلم الإلهي [ج ٣]	محمّد بن عمر بن الحسن بن الحسين التيمي البكري [ فخر الدين الرازي ]	Rafed	3632	0.32283
		الأربعين في أصول الدين [ج ١]	محمّد بن عمر بن الحسن بن الحسين التيمي البكري [ فخر الدين الرازي ]	Rafed	3314	0.32265
		كتاب اللمع في الرّد على أهل الزّيغ والبدع	أبي الحسن الأشعري	Rafed	3452	0.32058
		 المطالب العالية من العلم الإلهي 	 فخر الدين الرازي 	ABLibrary	8606	0.3196
		 الملخص في أصول الدين 	 الشريف المرتضى 	ABLibrary	8641	0.31951
		منهج الرّشاد في معرفة المعاد [ج ٢]	محمّد نعيم بن محمّد تقي [ الملا نعيما العرفي الطالقاني ]	Rafed	3670	0.31932
		المطالب العالية من العلم الإلهي [ج ٥]	محمّد بن عمر بن الحسن بن الحسين التيمي البكري [ فخر الدين الرازي ]	Rafed	3634	0.31861
		التقريب لحد المنطق والمدخل إليه بالألفاظ العامية والأمثلة الفقهية	أبو محمد علي بن أحمد بن سعيد بن حزم الأندلسي القرطبي الظاهري (المتوفى: 456هـ)	ShamAY	1028	0.31757
		 كتاب الشكوك على كلام فاضل الأطباء جالينوس 	 محمد بن زكريا الرازي 	ABLibrary	9816	0.31678
		 غاية المرام في علم الكلام 	 سيف الدين الآمدي 	ABLibrary	8522	0.31662
		 المطالب العالية من العلم الإلهي 	 فخر الدين الرازي 	ABLibrary	8611	0.31564
		 نهاية المرام في علم الكلام 	 العلامة الحلي 	ABLibrary	8673	0.31533
		المطالب العالية من العلم الإلهي [ج ٤]	محمّد بن عمر بن الحسن بن الحسين التيمي البكري [ فخر الدين الرازي ]	Rafed	3633	0.31517
		 موسوعة مصطلحات علم الكلام الإسلامي 	 سميح دغيم 	ABLibrary	8658	0.31432
		 مجموعة تلخيصات ابن رشد از تأليفات جالينوس 	 ابن رشد 	ABLibrary	9879	0.31388
		 المغني في أبواب التوحيد والعدل 	 القاضي عبد الجبار الهمذاني 	ABLibrary	8621	0.31374
		 المغني في أبواب التوحيد والعدل 	 القاضي عبد الجبار الهمذاني 	ABLibrary	8627	0.31356
		المعتمد في أصول الفقه	محمد بن علي الطيب أبو الحسين البَصْري المعتزلي (المتوفى: 436هـ)	ShamAY	6319	0.31355
		 الاقتصاد في الاعتقاد 	 الغزالي 	ABLibrary	8311	0.31317
		المعتمد في أصول الفقه	محمد بن علي الطيب أبو الحسين البصري المعتزلي (المتوفى: 436ه)	Sham19Y	6319	0.31285
		دلائل الإعجاز - الكتاب العربي	أبو بكر عبدالقاهر بن عبدالرحمن بن محمد الجرجاني	ShamAY	34098	0.31213
		تلخيص الخطابة	أبو الوليد محمد بن أحمد بن محمد بن أحمد بن رشد القرطبي الشهير بابن رشد الحفيد (المتوفى: 595هـ)	ShamAY	698	0.31203
		المطالب العالية من العلم الإلهي [ج ٨]	محمّد بن عمر بن الحسن بن الحسين التيمي البكري [ فخر الدين الرازي ]	Rafed	3641	0.31176
		البصاير النصيريه في علم المنطق	ابن سهلان	Masaha	2326	0.31176
		 المغني في أبواب التوحيد والعدل 	 القاضي عبد الجبار الهمذاني 	ABLibrary	8631	0.31141
		المحصول للرازي - جامعة الإمام	محمد بن عمر بن الحسين الرازي	ShamAY	34194	0.31115
		 النبوات وما يتعلق بها 	 فخر الدين الرازي 	ABLibrary	8660	0.31111
		النفس والروح وشرح قوامها	محمّد بن عمر بن الحسن بن الحسين التيمي البكري [ فخر الدين الرازي ]	Rafed	3705	0.31111
		 المغني في أبواب التوحيد والعدل 	 القاضي عبد الجبار الهمذاني 	ABLibrary	8629	0.31047
		معيار العلم في فن المنطق	أبو حامد محمد بن محمد الغزالي الطوسي (المتوفى: 505ه)	Sham19Y	26575	0.30911
		العده  في  اصول  الفقه 	محمد بن حسن شيخ طوسي ( شيخ الطائفه )	Ghbook	15918	0.30885
		 مناهج اليقين في أصول الدين 	 العلامة الحلي 	ABLibrary	8646	0.30847
		الاقتصاد الهادي إلى طريق الرشاد	الشيخ الطوسي	Masaha	1015	0.30847
		 مصارع المصارع في الرد على كتاب مصارعة الفلاسفة 	 خواجه نصير الدين الطوسي 	ABLibrary	8602	0.3084
		الذريعة إلى أصول الشريعة  - الجزء1	السيد علي علم الهدى	Masaha	3448	0.30835
		 المغني في أبواب التوحيد والعدل 	 القاضي عبد الجبار الهمذاني 	ABLibrary	8626	0.30815
		 الحجج البالغة على تجرد النفس الناطقة 	 حسن حسن زاده آملى 	ABLibrary	8409	0.30815
		النّفس من كتاب الشّفاء	أبو علي حسين بن عبد الله بن سينا [ شيخ الرئيس ابن سينا ]	Rafed	904	0.30772
		معيار العلم في فن المنطق	أبو حامد محمد بن محمد الغزالي الطوسي (المتوفى: 505ه)	ShamelaY19	26575	0.30769
		معيار العلم في فن المنطق	أبو حامد محمد بن محمد الغزالي الطوسي (المتوفى: 505هـ)	ShamAY	26575	0.30747
		معالم أصول الدين	أبو عبد الله محمد بن عمر بن الحسن بن الحسين التيمي الرازي الملقب بفخر الدين الرازي خطيب الري (المتوفى: 606هـ)	ShamAY	6372	0.30722
		الرد على المنطقيين	تقي الدين أبو العباس أحمد بن عبد الحليم بن عبد السلام بن عبد الله بن أبي القاسم بن محمد ابن تيمية الحراني الحنبلي الدمشقي (المتوفى: 728هـ)	ShamAY	7626	0.30691
		التفسير الكبير - الجزء1	الفخر الرازي‏	Masaha	2591	0.30666
		تنزيه الأنبياء عليهم السلام‏	السيد المرتضى	Masaha	4743	0.30665
		 المغني في أبواب التوحيد والعدل 	 القاضي عبد الجبار الهمذاني 	ABLibrary	8635	0.30663
		معالم أصول الدين	أبو عبد الله محمد بن عمر بن الحسن بن الحسين التيمي الرازي الملقب بفخر الدين الرازي خطيب الري (المتوفى: 606ه)	Sham19Y	6372	0.30642
		موسوعة مصطلحات الفلسفة عند العرب	جيرار جهامي (معاصر)	ShamAY	34796	0.30581
		تمهيد الأوائل في تلخيص الدلائل	محمد بن الطيب بن محمد بن جعفر بن القاسم، القاضي أبو بكر الباقلاني المالكي (المتوفى: 403هـ)	ShamAY	6389	0.30556
		مشكلات الأحاديث النبوية وبيانها	عبد الله بن علي النجدي القصيمي :: عبد الله القصيمي	ShamAY	35972	0.30505
		 المواقف ( شرح الجرجاني ) ( مع حاشيتي السيالكوتي والحلبي ) 	 الإيجي 	ABLibrary	8472	0.30478
		المحجّة في تقريرات الحجّة [ج ١]	آية الله الحاج آقا علي الصافي الگلپايگاني	Rafed	3687	0.3047
		دلائل الإعجاز في علم المعاني	أبو بكر عبد القاهر بن عبد الرحمن بن محمد الفارسي الأصل، الجرجاني الدار (المتوفى: 471ه)	ShamelaY19	37697	0.30443
		تفسير الرازي: مفاتيح الغيب ـ العلمية	الإمام العالم العلامة والحبر البحر الفهامة فخر الدين محمد بن عمر التميمي الرازي الشافعي	ShamAY	34044	0.30404
		المحجة في تقريرات الحجة  - الجزء1	الشيخ علي الصافي الگلپايگاني	Masaha	3559	0.30384
		 الشامل في أصول الدين 	 عبد الملك الجويني 	ABLibrary	8449	0.30347
		 أبكار الأفكار في أصول الدين 	 سيف الدين الآمدي 	ABLibrary	8315	0.30343
		 إرشاد الطالبين إلى نهج المسترشدين 	 المقداد السيوري 	ABLibrary	8328	0.30325
		 التوحيد 	 أبي منصور محمد الماتريدي السمرقندي الأنصاري 	ABLibrary	8398	0.30304
		 جامع الأفكار وناقد الأنظار 	 ملا محمد مهدي النراقي 	ABLibrary	8401	0.30304
		الصفدية	ابن تيمية	ShamelaY19	22874	0.30267
		تفسير الرازي = مفاتيح الغيب أو التفسير الكبير	أبو عبد الله محمد بن عمر بن الحسن بن الحسين التيمي الرازي الملقب بفخر الدين الرازي خطيب الري (المتوفى: 606ه)	ShamelaY19	23635	0.30234
		المحصول للرازي	أبو عبد الله محمد بن عمر بن الحسن بن الحسين التيمي الرازي الملقب بفخر الدين الرازي خطيب الري (المتوفى: 606هـ)	ShamAY	2022	0.30218
		غاية المرام في علم الكلام	أبي الحسن علي بن محمد بن سالم الثعلبي [ سيف الدين الآمدي ]	Rafed	3481	0.30216
		تلخيص السفسطة	أبو الوليد محمد بن أحمد بن محمد بن أحمد بن رشد القرطبي الشهير بابن رشد الحفيد (المتوفى: 595ه)	ShamelaY19	21503	0.30191
		 نهاية المرام في علم الكلام 	 العلامة الحلي 	ABLibrary	8674	0.3019
		الإقتصاد في الإعتقاد	أبو حامد الغزالي	Rafed	3312	0.30158
		تنزيه الأنبياء	علي بن الحسين الموسوي العلوي [ الشريف المرتضى علم الهدى ]	Rafed	1746	0.30142
		 المغني في أبواب التوحيد والعدل 	 القاضي عبد الجبار الهمذاني 	ABLibrary	8630	0.30131
		المطالب العالية من العلم الإلهي [ج ١]	محمّد بن عمر بن الحسن بن الحسين التيمي البكري [ فخر الدين الرازي ]	Rafed	3630	0.30104
		 شرح توحيد الصدوق 	 القاضي سعيد القمي 	ABLibrary	8480	0.30069
		الصفدية	تقي الدين أبو العَباس أحمد بن عبد الحليم بن عبد السلام بن عبد الله بن أبي القاسم بن محمد ابن تيمية الحراني الحنبلي الدمشقي (المتوفى : 728هـ)	ShamAY	22874	0.30065
		معارج القدس في مدارج معرفه النفس	أبو حامد محمد بن محمد الغزالي الطوسي (المتوفى: 505هـ)	ShamAY	6494	0.30061
		تلخيص السفسطة	أبو الوليد محمد بن أحمد بن محمد بن أحمد بن رشد القرطبي الشهير بابن رشد الحفيد (المتوفى: 595هـ)	ShamAY	21503	0.30045
		تفسير الرازي = مفاتيح الغيب أو التفسير الكبير	أبو عبد الله محمد بن عمر بن الحسن بن الحسين التيمي الرازي الملقب بفخر الدين الرازي خطيب الري (المتوفى: 606هـ)	ShamAY	31578	0.30033
		جهد القريحة في تجريد النصيحة (مطبوع مع: صون المنطق والكلام عن فني المنطق والكلام)	جلال الدين السيوطي	ShamelaY19	151020	0.30012
		مجمع الأفكار ومطرح الأنظار  - الجزء1	محمد علي إسماعيل پور	Masaha	4273	0.29992
		نهاية المرام في علم الكلام [ج ٢]	الحسن بن يوسف بن علي المطّهر [ العلامة الحلّي ]	Rafed	3370	0.29989
		 البراهين الواضحات ( دراسات في القضاء ) 	 الشيخ محمد علي اسماعيل پور القمشه‌اى 	ABLibrary	9703	0.29968
		نهاية الوصول في دراية الأصول	صفي الدين محمد بن عبد الرحيم الأرموي الهندي (715 ه)	Sham19Y	16562	0.2996
		المطالب العالية من العلم الإلهي [ج ٦]	محمّد بن عمر بن الحسن بن الحسين التيمي البكري [ فخر الدين الرازي ]	Rafed	3635	0.29952
		الإقتصاد فيما يتعلّق بالإعتقاد	أبي جعفر محمّد بن الحسن بن علي بن الحسن الطّوسي [ شيخ الطائفة ]	Rafed	3319	0.29822
		 مجموعة الرسائل ( تسع رسائل ) 	 ابن رشد 	ABLibrary	9878	0.29805
		الهداية إلى غوامض الكفاية  - الجزء1	محمد حسين الميرسجادي	Masaha	3587	0.29801
		الشّفاء ـ طبيعيّات [ج ٢ [٦]]	أبو علي حسين بن عبد الله بن سينا [ شيخ الرئيس ابن سينا ]	Rafed	3070	0.29795
		نهاية الوصول في دراية الأصول	صفي الدين محمد بن عبد الرحيم الأرموي الهندي (715 هـ)	ShamAY	32587	0.29742
		جامع المسائل لابن تيمية ط عالم الفوائد - المجموعة السادسة	شيخ الإسلام أحمد بن عبد الحليم بن عبد السلام ابن تيمية (661 - 728 هـ)	ShamAY	37987	0.29737
		 جامع العلوم في اصطلاحات الفنون الملقب بدستور العلماء 	 القاضى عبد النبي بن عبد الرسول الأحمد نگري 	ABLibrary	8402	0.29713
		المسلك في أصول الدّين	الشيخ نجم الدين أبي القاسم جعفر بن الحسن بن يحيى بن سعيد الهذلي [ المحقق الحلّي ]	Rafed	3474	0.29709
		 المواقف ( شرح الجرجاني ) ( مع حاشيتي السيالكوتي والحلبي ) 	 الإيجي 	ABLibrary	8475	0.29677
		تسديد الأصول‏ - الجزء1	السيد محمد المؤمن القمي	Masaha	3255	0.29671
		غاية المرام في علم الكلام	أبو الحسن سيد الدين علي بن أبي علي بن محمد بن سالم الثعلبي الآمدي (المتوفى: 631هـ)	ShamAY	6364	0.29657
		متشابه القرآن [ج ١ ـ ٢]	القاضي عبد الجبّار بن أحمد الهمذاني	Rafed	1140	0.29649
		 المغني في أبواب التوحيد والعدل 	 القاضي عبد الجبار الهمذاني 	ABLibrary	8636	0.29648
		غاية المرام في علم الكلام	أبو الحسن سيد الدين علي بن أبي علي بن محمد بن سالم الثعلبي الآمدي (المتوفى: 631ه)	Sham19Y	6364	0.29626
		المسائل الحلبيات	أبو علي الفارسيّ (المتوفى 377 هـ)	ShamAY	32697	0.29607
		 منهج الرشاد في معرفة المعاد 	 ملا نعيما العرفي الطالقاني 	ABLibrary	8649	0.29604
		رسائل فلسفية للرازي	أبو بكر، محمد بن زكريا الرازي (المتوفى: 313هـ)	ShamAY	12834	0.296
		المسائل البصريات	أبو علي الفارسي (ت 377 هـ)	ShamAY	32669	0.29595
		 المغني في أبواب التوحيد والعدل 	 القاضي عبد الجبار الهمذاني 	ABLibrary	8625	0.2958
		الأشباه والنظائر في النحو [ج ٤]	جلال الدين عبد الرحمن بن أبي بكر السيوطي	Rafed	2070	0.29579
		كتاب الشعر أو شرح الأبيات المشكلة الإعراب	الحسن بن أحمد بن عبد الغفار الفارسيّ الأصل، أبو علي (المتوفى: 377هـ)	ShamAY	870	0.29564
		 المغني في أبواب التوحيد والعدل 	 القاضي عبد الجبار الهمذاني 	ABLibrary	8632	0.29528
		مجمع الأفكار ومطرح الأنظار [ج ١]	محمد علي الإسماعيل پور الشهرضائي	Rafed	3787	0.29526
		كتاب الشعر أو شرح الأبيات المشكلة الإعراب	الحسن بن أحمد بن عبد الغفار الفارسي الأصل، أبو علي (المتوفى: 377ه)	ShamelaY19	37492	0.29493
		معجم المصطلحات العلمية العربية	د. فايز الداية (معاصر)	ShamAY	34687	0.29463
		رسائل في اللغة (رسائل ابن السيد البطليوسي)	أبو محمد عبد الله بن السيد البطليوسي (444 - 521 هـ)	ShamAY	38985	0.29442
		محك النظر في المنطق	أبو حامد محمد بن محمد الغزالي الطوسي (المتوفى: 505ه)	ShamelaY19	26538	0.29441
		الإعلام بما في دين النصارى من الفساد والأوهام وإظهار محاسن الإسلام	أبو عبد الله محمد بن أحمد بن أبي بكر بن فرح الأنصاري الخزرجي شمس الدين القرطبي (المتوفى: 671هـ)	ShamAY	6517	0.29434
		دلائل الإعجاز في علم المعاني	عبد القاهر بن عبد الرحمن الجرجاني	Rafed	2081	0.29425
		منهاج السنة النبوية - ط قرطبة	أحمد بن عبد الحليم بن تيمية الحراني أبو العباس	ShamAY	34375	0.29414
		الاقتصاد في الاعتقاد للغزالي	أبو حامد محمد بن محمد الغزالي الطوسي (المتوفى: 505هـ)	ShamAY	9217	0.29395
		 بد العارف 	 ابن سبعين 	ABLibrary	8759	0.29367
		 الكامل في الاستقصاء فيما بلغنا من كلام القدماء 	 مختار بن محمود العجالي ( تقي الدين النجراني ) 	ABLibrary	8576	0.29357
		ارشاد الطالبين الى نهج المسترشدين	جمال الدين مقداد بن عبد الله السيوري الحلّي	Rafed	3450	0.2933
		دستور الأخلاق في القرآن	محمد بن عبد الله دراز (المتوفى: 1377هـ)	ShamAY	8665	0.29282
		 أبكار الأفكار في أصول الدين 	 سيف الدين الآمدي 	ABLibrary	8316	0.29271
		 الذخيرة في علم الكلام 	 الشريف المرتضى 	ABLibrary	8424	0.29265
		 التعليقات على شرح الدواني للعقائد العضدية 	 سيد جمال الدين الافغاني ( بقلم محمد عبده ) 	ABLibrary	8387	0.29255
		العلل في النحو	أبو الحسن محمد بن عبد الله [ الوراق ]	Rafed	2629	0.29253
		الألفاظ المستعملة في المنطق	الفارابي، أبو نصر	ShamAY	35930	0.29235
		محك النظر في المنطق	أبو حامد محمد بن محمد الغزالي الطوسي (المتوفى: 505هـ)	ShamAY	26538	0.29218
		الفصل في الملل والأهواء والنّحل [ج ١]	أبي محمد علي بن أحمد [ ابن حزم الأندلسي الظاهري ]	Rafed	3571	0.29103
		التبيين عن مذاهب النحويين البصريين والكوفيين	أبو البقاء عبد الله بن الحسين بن عبد الله العكبري البغدادي محب الدين (المتوفى: 616هـ)	ShamAY	31791	0.29099
		 الكشف عن مناهج الأدلة في عقائد الملة 	 ابن رشد 	ABLibrary	8577	0.29096
		 المواقف ( شرح الجرجاني ) ( مع حاشيتي السيالكوتي والحلبي ) 	 الإيجي 	ABLibrary	8469	0.29077
		الحروف	الفارابي، أبو نصر	ShamAY	35931	0.2904
		 البراهين القاطعة في شرح تجريد العقائد الساطعة 	 محمد جعفر استر آبادى ( شريعتمدار ) 	ABLibrary	8366	0.29036
		 جامع العلوم في اصطلاحات الفنون الملقب بدستور العلماء 	 القاضى عبد النبي بن عبد الرسول الأحمد نگري 	ABLibrary	8403	0.2901
		 فيه ما فيه 	 جلال الدين الرومي 	ABLibrary	8769	0.29004
		الحجج البالغة على تجرّد النفس الناطقة	الشيخ حسن حسن زاده الآملي	Rafed	1724	0.28996
