automatic URI	Proposed URI	bookTitle	authorName	collection	id	tfidf
		روح المعاني [ج ٩]	أبي الفضل شهاب الدين السيّد محمود الألوسي البغدادي	Rafed	3193	0.2561
		لقاءات أبي الحسن المأربي مع الألباني	الواحدي :: ناصر الدين الألباني	ShamAY	33149	0.25608
		التقريرات المسمى بالمحاكمات بين الأعلام‏	عبد النبي النجفي العراقي	Masaha	2427	0.25603
		أصول الفقه [ج ٢]	آية الله الشيخ محمد علي الأراكي	Rafed	3600	0.256
		سلسلة المتون الفقهية	علي بن بابويه القمي	Masaha	626	0.25597
		شرح المقاصد [ج ٣]	مسعود بن عمر بن عبدالله [ سعد الدين التفتازاني ]	Rafed	3515	0.25595
		قضايا المرأة بين التقاليد الراكدة والوافدة	محمد الغزالي	ShamAY	33246	0.25591
		الاجتهاد و التقليد (معارج الأصول)	المحقق الحلي	Masaha	1011	0.25591
		اللّباب في علوم الكتاب [ج ٦]	أبي حفص عمر بن علي بن عادل الدمشقي الحنبلي	Rafed	3097	0.2559
		الظاهرة القرآنية	مالك بن الحاج عمر بن الخضر بن نبي (المتوفى: 1393ه)	Sham19Y	2910	0.2559
		شرح (قواعد الإعراب لابن هشام)	محمد بن مصطفى القوجوي، شيخ زاده (المتوفى: 950 ه)	ShamelaY19	19236	0.25588
		القوانين المحكمة في الأصول [ج ٣]	الميرزا أبو القاسم القمّي	Rafed	2625	0.25587
		تبصرة الحكام في أصول الأقضية ومناهج الأحكام	إبراهيم بن علي بن محمد، ابن فرحون، برهان الدين اليعمري (المتوفى: 799هـ)	ShamAY	21595	0.25586
		بداية المعارف الإلهيّة في شرح عقائد الإماميّة [ج ١]	الشيخ محمّد رضا المظفّر	Rafed	2652	0.25582
		دروس الشيخ محمد بن صالح العثيمين	محمد بن صالح بن محمد العثيمين (المتوفى : 1421هـ)	ShamAY	414	0.25579
		 انشاء الدوائر ( ويليه عُقلَة المستوفز وكتاب التدبيرات الالهية ) 	 ابن عربي 	ABLibrary	8733	0.25579
		تحفة المسؤول في شرح مختصر منتهى السول	أبو زكريا يحيى بن موسى الرهوني (المتوفى: 773 ه)	ShamelaY19	32193	0.25578
		التلقين في الفقه المالكي - المكتبة التجارية	عبد الوهاب بن علي بن نصر الثعلبي المالكي أبو محمد	ShamAY	34245	0.25577
		 شرح العقيدة الإصفهانية 	 ابن تيميه 	ABLibrary	8459	0.25574
		 المثنوي المعنوي ( معرب الدسوقي ) 	 جلال الدين الرومي 	ABLibrary	8765	0.2557
		البحر المحيط في التّفسير [ج ٤]	محمّد بن يوسف [ أبي حيّان الأندلسي الغرناطي ]	Rafed	2420	0.2557
		الأشاعرة		ShamAY	35644	0.25569
		شرح حلية طالب العلم	الواحدي :: ابن عثيمين	ShamAY	35127	0.25567
		الإيضاح في علل النحو	أبو القاسم الزجاجي (المتوفى: 337 ه)	ShamelaY19	143170	0.25567
		الكليات معجم في المصطلحات والفروق اللغوية	أيوب بن موسى الحسيني القريمي الكفوي، أبو البقاء الحنفي (المتوفى: 1094هـ)	ShamAY	7037	0.25566
		شرح الحلقة الثانية	ناجي طالب‏ آل فقيه العاملي	Masaha	3984	0.25565
		 تكملة شوارق الألهام 	 محمد المحمدي الگيلاني 	ABLibrary	8389	0.25562
		البرهان في وجوه البيان (نشر من قبل باسم نقد النثر لقدامة بن جعفر)	أبو الحسين إسحاق بن إبراهيم بن سليمان بن وهب الكاتب	ShamAY	38891	0.2556
		حياة محمد ورسالته	محمد علي اللاهوري القادياني (1874-1951 م) أحد أتباع غلام أحمد القادياني (الذي ادعى النبوة) ، ورئيس الفرع اللاهوري للقاديانية (فليُحذر)	ShamAY	9798	0.25559
		مقالات حول مباحث الألفاظ	السيد علي الموسوي البهبهاني	Masaha	4366	0.25558
		تحت راية القرآن	مصطفى صادق بن عبد الرزاق بن سعيد بن أحمد بن عبد القادر الرافعي (المتوفى: 1356ه)	ShamelaY19	21784	0.25557
		الحكمه المتعاليه في الاسفار العقليه الاربعه	محمد بن ابراهيم صدرالدين شيرازي	Ghbook	12174	0.25554
		شرح المشكل من شعر المتنبي	علي بن إسماعيل بن سيده (المتوفى: 458هـ)	ShamAY	775	0.25553
		الرسائل - الجزء1	السيد روح الله الموسوي الخميني	Masaha	3452	0.25553
		 رسائل ومقالات 	 الشيخ السبحاني 	ABLibrary	8439	0.25552
		دروس للشيخ سلمان العودة	سلمان بن فهد بن عبد الله العودة	ShamAY	7729	0.25551
		اختلاف الفقهاء لابن جرير	محمد بن جرير بن يزيد بن كثير بن غالب الآملي، أبو جعفر الطبري (المتوفى: 310هـ)	ShamAY	7492	0.2555
		مجمع الأفكار ومطرح الأنظار [ج ٤]	محمد علي الإسماعيل پور الشهرضائي	Rafed	3790	0.2555
		الحق المر	محمد الغزالي	ShamAY	36032	0.25549
		توضيح المراد [ج ١]	السيد هاشم الحسيني الطهراني	Rafed	778	0.25544
		الكليات معجم في المصطلحات والفروق اللغوية	أيوب بن موسى الحسيني القريمي الكفوي، أبو البقاء الحنفي (المتوفى: 1094ه)	Sham19Y	7037	0.2554
		مصادر الحكم الشرعي والقانون المدني‏  - الجزء1	الشيخ كاشف الغطاء	Masaha	4321	0.25539
		 فقه العقود 	 السيد كاظم الحائري 	ABLibrary	9611	0.25537
		النكت في تفسير كتاب سيبويه	أبي الحجاج يوسف بن سليمان بن عيسى أعلم الشنتمري	Rafed	3002	0.25533
		أصول الفوائد الغروية في مسائل علم أصول الفقه الإسلامي‏ - الجزء1	محمد باقر كمرئي	Masaha	2372	0.25533
		اختلاف الفقهاء لابن جرير	محمد بن جرير بن يزيد بن كثير بن غالب الآملي، أبو جعفر الطبري (المتوفى: 310ه)	Sham19Y	7492	0.25532
		المهذب - الجزء1	القاضي ابن البراج	Masaha	722	0.2553
		النكت في القرآن الكريم (في معاني القرآن الكريم وإعرابه)	علي بن فَضَّال بن علي بن غالب المُجَاشِعِي القيرواني، أبو الحسن (المتوفى: 479هـ)	ShamAY	9066	0.25526
		فصول البدائع في أصول الشرائع	محمد بن حمزة بن محمد، شمس الدين الفناري (أو الفَنَري) الرومي (المتوفى: 834هـ)	ShamAY	31597	0.25525
		 رسائل ومقالات 	 الشيخ السبحاني 	ABLibrary	8440	0.25522
		التنكيل - دار المعارف	عبد الرحمن المعلمي اليماني	ShamAY	34036	0.2552
		شرح صحيح البخاري للحويني	أبو إسحاق الحويني الأثري حجازي محمد شريف	ShamAY	2082	0.2551
		الأمثل في تفسير كتاب الله المنزل [ج ١٢]	آية الله مكارم الشيرازي	Rafed	2056	0.2551
		تحت راية القرآن	مصطفى صادق بن عبد الرزاق بن سعيد بن أحمد بن عبد القادر الرافعي (المتوفى: 1356ه)	Sham19Y	21784	0.2551
		أصول البزدوي - كنز الوصول الى معرفة الأصول	علي بن محمد البزدوي الحنفي	ShamAY	34183	0.25509
		العثمانية	عمرو بن بحر بن محبوب الكناني بالولاء، الليثي، أبو عثمان، الشهير بالجاحظ (المتوفى: 255هـ)	ShamAY	1785	0.25507
		آراؤنا في أصول الفقه [ج ٢]	السيّد تقي الطباطبائي القمّي	Rafed	3707	0.25507
		المفيد في شرح أصول الفقه‏  - الجزء1	ابراهيم شهركاني	Masaha	3576	0.25507
		شرح (قواعد الإعراب لابن هشام)	محمد بن مصطفى القُوجَوي، شيخ زاده (المتوفى: 950 هـ)	ShamAY	37995	0.25506
		تحقيق الاصول	آيت الله علي حسيني ميلاني	Ghbook	4785	0.25505
		دروس للشيخ أبي إسحاق الحويني	أبو إسحاق الحويني الأثري حجازي محمد شريف	ShamAY	898	0.25502
		البرهان في وجوه البيان (نشر من قبل باسم نقد النثر لقدامة بن جعفر)	أبو الحسين إسحاق بن إبراهيم بن سليمان بن وهب الكاتب	ShamelaY19	20986	0.25498
		جواهر الاصول: تقرير ابحاث لاستاد روح الله الموسوي الامام الخميني قدس سره	محمد حسن لنگرودي	Ghbook	12045	0.25494
		الحاشية على قوانين الأصول‏ - الجزء1	الشيخ جواد الطارمي	Masaha	3351	0.25493
		البيان في تفسير القرآن	السيّد أبو القاسم الموسوي الخوئي	Rafed	691	0.2549
		أنوار الأصول [ج ١]	الناشر: مدرسة الإمام علي بن أبي طالب عليه السلام	Rafed	936	0.25489
		الإلهيّات على هدى الكتاب والسنّة والعقل [ج ١]	الشيخ حسن محمد مكي العاملي	Rafed	3379	0.25488
		لباب اللباب في بيان ما تضمنته أبواب الكتاب من الأركان والشروط والموانع والأسباب	ابن راشد البكري	ShamAY	34242	0.25487
		الوسيط في أصول الفقه [ج ١]	الشيخ جعفر السبحاني	Rafed	2655	0.25486
		الفَرق بين الفِرق	عبدالقاهر بن طاهر البغدادي	Rafed	3488	0.25486
		المحاور الخمسة للقرآن الكريم	محمد الغزالي	ShamAY	36727	0.25485
		مغني الأديب [ج ٢]	جماعة من أساتذة الأدب العربي في الحوزة العلميّة بقم المقدّسة	Rafed	3195	0.25481
		علم أصول الفقه في ثوبه الجديد	الشيخ محمد جواد مغنية	Masaha	4001	0.25481
		الفكر الخالد في بيان العقائد [ج ١]	الشيخ جعفر السبحاني	Rafed	3509	0.25478
		من معالم الحق في كفاحنا الإسلامي الحديث	محمد الغزالي	ShamAY	33257	0.25471
		دروس في البلاغة [ج ١]	الشيخ محمّدي البامياني	Rafed	1978	0.25471
		أنيس المجتهدين [ج ١]	محمد مهدي بن أبي ذر النراقي [ المولى مهدي النراقي ]	Rafed	999	0.25469
		البخلاء للجاحظ	عمرو بن بحر بن محبوب الكناني بالولاء، الليثي، أبو عثمان، الشهير بالجاحظ (المتوفى: 255هـ)	ShamAY	10501	0.25467
		اللّباب في علوم الكتاب [ج ٣]	أبي حفص عمر بن علي بن عادل الدمشقي الحنبلي	Rafed	3092	0.25466
		النكت في القرآن الكريم (في معاني القرآن الكريم وإعرابه)	علي بن فضال بن علي بن غالب المجاشعي القيرواني، أبو الحسن (المتوفى: 479ه)	Sham19Y	9066	0.25466
		 كتاب الوجود 	 الشيخ عبد الغني النابلسي 	ABLibrary	8857	0.25464
		تحريرات في الأصول‏  - الجزء1	السيد مصطفى الموسوي الخميني	Masaha	3205	0.25464
		تحريرات في الأصول‏ - الجزء1	السيد مصطفى الموسوي الخميني	Masaha	2715	0.25463
		مع الناس	علي بن مصطفى الطنطاوي (المتوفى: 1420 هـ)	ShamAY	32334	0.25455
		أعلام النبوّة	أبو حاتم الرازي	Rafed	3391	0.25453
		القواعد الفقهية - الجزء1	السيد حسن الموسوي البجنوردي	Masaha	889	0.2545
		نهاية الوصول إلى كفاية الأصول‏	السيد مصطفى الموسوي الحائري	Masaha	4797	0.2545
		البخلاء للجاحظ	عمرو بن بحر بن محبوب الكناني بالولاء، الليثي، أبو عثمان، الشهير بالجاحظ (المتوفى: 255ه)	Sham19Y	10501	0.2545
		مناهل العرفان في علوم القرآن	محمد عبدالعظيم الزرقاني	ShamAY	34096	0.25448
		الأحكام السلطانية لأبي يعلى الفراء	أبو يعلى ابن الفراء	ShamelaY19	22877	0.25448
		النهاية	الشيخ الطوسي	Masaha	622	0.25447
		حقوق الإنسان	محمد الغزالي	ShamAY	36044	0.25446
		بحوث في علم الأصول [ج ٣]	السيّد محمود الهاشمي الشاهرودي	Rafed	664	0.25444
		العثمانية	عمرو بن بحر بن محبوب الكناني بالولاء، الليثي، أبو عثمان، الشهير بالجاحظ (المتوفى: 255ه)	ShamelaY19	96338	0.25444
		الإسلام وأوضاعنا السياسية	عبد القادر عودة (المتوفى: 1373هـ)	ShamAY	1940	0.25441
		شرح صحيح البخاري للحويني	أبو إسحاق الحويني الأثري حجازي محمد شريف	Sham19Y	2082	0.2544
		 الشافي في شرح الكافي 	 المولى خليل القزويني 	ABLibrary	7922	0.25439
		روح المعاني [ج ٥]	أبي الفضل شهاب الدين السيّد محمود الألوسي البغدادي	Rafed	3189	0.25438
		دروس للشيخ عبد الله بن عبد الرحمن الجبرين	عبد الله بن عبد الرحمن بن عبد الله بن جبرين	ShamAY	897	0.25429
		 المعجزة القرآنية 	 دكتور محمد حسن هيتو 	ABLibrary	8620	0.25427
		 دلائل الصدق لنهج الحق 	 الشيخ محمد حسن المظفر 	ABLibrary	941	0.25427
		مفتاح الأصول [ج ٢]	آية الله الشيخ إسماعيل الصالحي المازندراني	Rafed	3809	0.25426
		اللّباب في علوم الكتاب [ج ٩]	أبي حفص عمر بن علي بن عادل الدمشقي الحنبلي	Rafed	3101	0.25425
		أمالي السيد المرتضى *	الشريف المرتضى	ShamAY	34519	0.25424
		 ولاية الفقيه في حكومة الإسلام 	 السيد محمد حسين الطهراني 	ABLibrary	9445	0.25419
		سرّ الفصاحة	أبي محمّد عبد الله بن سعيد بن سنان الخفاجي الحلبي	Rafed	2077	0.25419
		شرح العقيدة السفارينية - الدرة المضية في عقد أهل الفرقة المرضية	محمد بن صالح بن محمد العثيمين (المتوفى: 1421هـ)	ShamAY	9725	0.25416
		 شرح ابن رشد لأرجوزة ابن سينا في الطب 	 ابن رشد 	ABLibrary	9880	0.25416
		 اليواقيت والجواهر في بيان عقائد الأكابر ( وفي الحاشية الكبريت الأحمر ) 	 عبد الوهاب الشعراني 	ABLibrary	8836	0.25416
		نهايه الدرايه في شرح الكفايه [آخوند خراساني] ( طبع جديد )	محمد حسين غروي اصفهاني ( كمپاني )	Ghbook	12204	0.25415
		النور الساطع في الفقه النافع‏  - الجزء1	الشيخ كاشف الغطاء	Masaha	3583	0.25413
		 محاضرات في المواريث 	 محاضرات السيد الخوئي لمحمد علي الخرسان 	ABLibrary	9433	0.25412
		الإسلام وأوضاعنا السياسية	عبد القادر عودة (المتوفى: 1373ه)	ShamelaY19	96559	0.25412
		بداية المجتهد ونهاية المقتصد	أبو الوليد محمد بن أحمد بن محمد بن أحمد بن رشد القرطبي الشهير بابن رشد الحفيد (المتوفى: 595ه)	ShamelaY19	21739	0.25409
		حوار هادئ مع محمد الغزالي	سلمان بن فهد العودة	ShamAY	10280	0.25408
		عقائد الإماميّة الإثنى عشريّة [ج ٢]	السيد إبراهيم الموسوي الزنجاني	Rafed	3538	0.25406
		أصول النحو 2 - جامعة المدينة	مناهج جامعة المدينة العالمية	ShamAY	1651	0.25403
		 دلالة الحائرين 	 ابن ميمون 	ABLibrary	8420	0.254
		شرح ملّا جامي [ج ٢]	عبد الرحمن بن أحمد نور الدين الجامي	Rafed	2284	0.254
		 مصباح الفقاهة ( ط أنصاريان ) 	 تقرير بحث السيد الخوئي للتبريزي 	ABLibrary	9436	0.25399
		إفاضة العوائد [ج ٢]	آية الله السيّد محمّد رضا الگلپايگاني	Rafed	3872	0.25399
		أسرار الصلاة	الشيخ عبد الله جوادي آملي	Masaha	4938	0.25397
		النبأ العظيم نظرات جديدة في القرآن - ط الثقافة	محمد بن عبد الله دراز	ShamAY	34078	0.25394
		روضة الناظر وجنة المناظر في أصول الفقه على مذهب الإمام أحمد بن حنبل	أبو محمد موفق الدين عبد الله بن أحمد بن محمد بن قدامة الجماعيلي المقدسي ثم الدمشقي الحنبلي، الشهير بابن قدامة المقدسي (المتوفى: 620هـ)	ShamAY	12010	0.25392
		المعجم الأصولي [ج ٢]	الشيخ محمّد صنقور علي البحراني	Rafed	1049	0.25392
		مختصر المعاني	مسعود بن عمر بن عبدالله [ سعد الدين التفتازاني ]	Rafed	2556	0.25391
		المجلى في شرح القواعد المثلى في صفات الله وأسمائه الحسنى للعلامة محمد صالح العثيمين	كاملة بنت محمد بن جاسم بن علي آل جهام الكواري	ShamAY	6942	0.2539
		 الدلائل في شرح منتخب المسائل 	 السيد تقي الطباطبائي 	ABLibrary	9706	0.25389
		 المعاد الجسماني 	 شاكر الساعدي 	ABLibrary	8616	0.25387
		عقيدة المسلم	محمد الغزالي	ShamAY	35259	0.25383
		التبر المسبوك في نصيحة الملوك	أبو حامد محمد بن محمد الغزالي الطوسي (المتوفى: 505هـ)	ShamAY	4129	0.25383
		المدرّس الأفضل [ج ٥]	الشيخ محمّد علي المدرّس الأفغاني	Rafed	2687	0.25379
		التدمرية: تحقيق الإثبات للأسماء والصفات وحقيقة الجمع بين القدر والشرع	تقي الدين أبو العباس أحمد بن عبد الحليم بن عبد السلام بن عبد الله بن أبي القاسم بن محمد ابن تيمية الحراني الحنبلي الدمشقي (المتوفى: 728ه)	Sham19Y	22666	0.25379
		الفوائد الطوسيّة	محمد بن الحسن الحرّ العاملي [ العلامة الشيخ حرّ العاملي ]	Rafed	1302	0.25377
		 الشهاب الثاقب في وجوب صلاة الجمعة العيني 	 الفيض الكاشاني 	ABLibrary	9337	0.25375
		تحقيق الأصول‏ - الجزء1	السيد علي الحسيني الميلاني	Masaha	2723	0.25373
		تفسير غرائب القرآن ورغائب الفرقان [ج ٤]	نظام الدين الحسن بن محمّد بن حسين القمي النيسابوري	Rafed	1802	0.25372
		القواعد الفقهية من مباحث الأصول - الجزء3	السيد محمد باقر الصدر	Masaha	5031	0.25368
		الأصول في النحو	أبو بكر محمد بن السري بن سهل النحوي المعروف بابن السراج (المتوفى: 316هـ)	ShamAY	7365	0.25367
		الإيضاح في علل النحو	أبو القاسم الزجاجي (المتوفى: 337 ه)	Sham19Y	143170	0.25367
		الجانب العاطفي من الإسلام	محمد الغزالي :: أبو حامد الغزالي	ShamAY	36031	0.25361
		إعراب القرآن للباقولي - منسوب خطأ للزجاج	علي بن الحسين بن علي، أبو الحسن نور الدين جامع العلوم الأصفهاني الباقولي (المتوفى: نحو 543ه)	ShamelaY19	23585	0.25357
		محاضرات الشيخ محمد الغزالي في إصلاح الفرد والمجتمع	محمد الغزالي	ShamAY	33251	0.25354
		فتاوى الشيخ مشهور بن حسن آل سلمان	الواحدي :: مشهور آل سلمان	ShamAY	37666	0.25349
		شرح الطحاوية لسفر الحوالي	سفر بن عبد الرحمن الحوالي	ShamAY	2827	0.25349
		تراثنا الفكري في ميزان العقل والشرع	محمد الغزالي	ShamAY	36040	0.25349
		 مجلة فقه أهل البيت ( ع ) 	 مجموعة مؤلفين 	ABLibrary	9742	0.25347
		النور الساطع في الفقه النافع	محمد رضا آل كاشف الغطاء	Ghbook	10214	0.25346
		شرح قطر الندى وبل الصدى	عبد الله بن يوسف بن أحمد بن عبد الله ابن يوسف، أبو محمد، جمال الدين، ابن هشام (المتوفى: 761هـ)	ShamAY	6970	0.25344
		حاشية الكفاية	آية الله السيد محمد حسين الطباطبائي	Rafed	3651	0.25344
		الحاوي الكبير في فقه مذهب الإمام الشافعي وهو شرح مختصر المزني	أبو الحسن علي بن محمد بن محمد بن حبيب البصري البغدادي، الشهير بالماوردي (المتوفى: 450هـ)	ShamAY	6157	0.25343
		 البحر المحيط في أصول الفقه 	 الزركشي 	ABLibrary	805	0.25341
		تحت راية القرآن	مصطفى صادق بن عبد الرزاق بن سعيد بن أحمد بن عبد القادر الرافعي (المتوفى: 1356هـ)	ShamAY	21784	0.2534
		تعليقات الفصول في الاصول	احمد شيرازي	Ghbook	12036	0.2534
		إشارات الإعجاز في مظان الإيجاز	بديع الزمان سعيد النورسي (المتوفى: 1379هـ)	ShamAY	7849	0.25339
		مجمع الفرائد في الأصول‏	علي فريدة الإسلام الكاشاني‏	Masaha	4280	0.25338
		 الإيضاح 	 ابو فراس 	ABLibrary	8354	0.25337
		شرح الواسطية - يوسف الغفيص	يوسف بن محمد علي الغفيص	ShamelaY19	37783	0.25337
		المدرّس الأفضل [ج ٤]	الشيخ محمّد علي المدرّس الأفغاني	Rafed	2684	0.25335
		شرح مقدمة التفسير لابن تيمية - العثيمين	محمد بن صالح بن محمد العثيمين (المتوفى: 1421ه)	ShamelaY19	21521	0.25335
		 الغاية القصوى في التعليق على العروة الوثقى ( كتاب الخمس ) 	 السيد تقي الطباطبائي القمي 	ABLibrary	9715	0.25334
		في موكب الدعوة	محمد الغزالي	ShamAY	33245	0.25333
		 دراسات في منهاج السنة لمعرفة ابن تيمية ، مدخل لشرح منهاج الكرامة 	 السيد علي الحسيني الميلاني 	ABLibrary	918	0.25333
		مفهوم الشكر عند ابن تيمية رحمه الله	أبو حمزة الشامي	ShamAY	35203	0.25332
		قصة موسى والخضر	أبو إسحاق الحويني الأثري حجازي محمد شريف	ShamAY	7690	0.25331
		أحكام القرآن  [ج ١]	أبي بكر أحمد بن علي الرازي الجصّاص	Rafed	1987	0.25331
		القوانين المحكمة في الأصول [ج ٢]	الميرزا أبو القاسم القمّي	Rafed	2624	0.25328
		تأويلات أهل السنّة تفسير الماتريدي [ج ٤]	أبي منصور محمّد بن محمّد بن محمود الماتريدي	Rafed	3970	0.25323
		مختصر الصواعق المرسلة على الجهمية والمعطلة	ابن الموصلي	ShamAY	8363	0.25322
		المقنع	الشيخ الصدوق	Masaha	713	0.2532
		 مصباح الناسك في شرح المناسك 	 السيد تقي الطباطبائي القمي 	ABLibrary	9729	0.25318
		محاضرات في الإلهيّات	الشيخ علي الربّاني الگلبايگاني	Rafed	2446	0.25318
		الفصول الغروية في الأصول الفقهية	الشيخ محمد حسين الأصفهاني صاحب الفصول	Masaha	3465	0.25314
		الملل والنحل	أبو الفتح محمد بن عبد الكريم بن أبى بكر أحمد الشهرستاني (المتوفى: 548ه)	Sham19Y	11812	0.25311
		دروس في علم الأصول(شرح الحلقة الثالثة) - الجزء1	ناجي طالب‏ آل فقيه العاملي	Masaha	3806	0.25309
		المجلى في شرح القواعد المثلى في صفات الله وأسمائه الحسنى للعلامة محمد صالح العثيمين	كاملة بنت محمد بن جاسم بن علي آل جهام الكواري	Sham19Y	6942	0.25306
		تفسير القرآن الكريم - أسامة سليمان	أسامة علي محمد سليمان	ShamAY	776	0.25305
		شرح المقاصد [ج ٤]	مسعود بن عمر بن عبدالله [ سعد الدين التفتازاني ]	Rafed	3516	0.25305
		الأحكام السلطانية لأبي يعلى الفراء	القاضي أبو يعلى ، محمد بن الحسين بن محمد بن خلف ابن الفراء (المتوفى : 458هـ)	ShamAY	22877	0.25304
