automatic URI	Proposed URI	bookTitle	authorName	collection	id	tfidf
		المقصور والممدود المنسوب لأبي عمر الزاهد	محمد بن عبد الواحد بن أبي هاشم، أبو عمر الزاهد المطرزي الباوَرْدي، المعروف بغلام ثعلب (المتوفى: 345هـ)	ShamAY	32025	0.94485
		المقصور والممدود لابن ولاد	ابن ولاد أبو العباس أحمد بن محمد بن الوليد التميمي المصري (المتوفى: 332ه)	Sham19Y	14565	0.38979
		المقصور والممدود لابن ولاد	ابن ولاد أبو العباس أحمد بن محمد بن الوليد التميمي المصري (المتوفى: 332هـ)	ShamAY	32013	0.38908
		أدب الكاتب = أدب الكتاب لابن قتيبة	أبو محمد عبد الله بن مسلم بن قتيبة الدينوري (المتوفى: 276ه)	ShamelaY19	26349	0.31201
		أدب الكاتب = أدب الكتاب لابن قتيبة	أبو محمد عبد الله بن مسلم بن قتيبة الدينوري (المتوفى: 276هـ)	ShamAY	26349	0.3104
		أدب الكاتب - ت: محمد محيي الدين	أبو محمد عبدالله بن مسلم بن قتيبة الكوفي المروري الدينوري	ShamAY	33771	0.30844
		أدب الكاتب	ابن قتيبة	Masaha	2345	0.30446
		المقصور والممدود لأبي علي القالي	أبو علي القالي إسماعيل بن القاسم (280 ه - 356 ه).	ShamelaY19	20949	0.29415
		المقصور والممدود لأبي علي القالي	أبو علي القالي إسماعيل بن القاسم (280 هـ - 356 هـ).	ShamAY	38881	0.29232
		المستقصى في أمثال العرب	أبو القاسم محمود بن عمرو بن أحمد، الزمخشري جار الله (المتوفى: 538هـ)	ShamAY	6895	0.26154
		يتمة الدهر في محاسن أهل العصر	عبد الملك بن محمد بن إسماعيل أبو منصور الثعالبي (المتوفى: 429هـ)	ShamAY	6743	0.2578
		المخصّص [ج ١٥]	أبي الحسن علي بن إسماعيل بن سيده المرسي [ ابن سيده ]	Rafed	3563	0.25558
		تاريخ مدينة دمشق [ج ٨٠]	أبي القاسم علي بن الحسن ابن هبة الله بن عبد الله الشافعي [ ابن عساكر ]	Rafed	2667	0.25519
		الحيوان - الجزء1	عمرو بن بحر الجاحظ	Masaha	2972	0.25514
		الحيوان	عمرو بن بحر بن محبوب الكناني بالولاء، الليثي، أبو عثمان، الشهير بالجاحظ (المتوفى: 255ه)	ShamelaY19	23775	0.25425
		الدر الفريد وبيت القصيد	محمد بن أيدمر المستعصمي (639 ه - 710 ه)	ShamelaY19	20762	0.25421
		الحيوان	عمرو بن بحر بن محبوب الكناني بالولاء، الليثي، أبو عثمان، الشهير بالجاحظ (المتوفى: 255هـ)	ShamAY	23775	0.25359
		المخصّص [ج ١٦]	أبي الحسن علي بن إسماعيل بن سيده المرسي [ ابن سيده ]	Rafed	3564	0.25334
		التمثيل والمحاضرة	عبد الملك بن محمد بن إسماعيل أبو منصور الثعالبي (المتوفى: 429ه)	Sham19Y	5683	0.2505