automatic URI	Proposed URI	bookTitle	authorName	collection	id	tfidf
		الاقتراح في أصول النحو ط البيروتي	عبد الرحمن بن أبي بكر، جلال الدين السيوطي (المتوفى: 911هـ)	ShamAY	31827	0.26411
		النّحو الوافي [ج ١]	عبّاس حسن	Rafed	2576	0.26409
		الأدب المقارن - جامعة المدينة (بكالوريوس)	مناهج جامعة المدينة العالمية	ShamAY	1643	0.26407
		 موسوعة مصطلحات علم الكلام الإسلامي 	 سميح دغيم 	ABLibrary	8657	0.26406
		 حياة الإمام الحسن بن علي ( ع ) 	 الشيخ باقر شريف القرشي 	ABLibrary	7491	0.26404
		المذاهب والفرق في الإسلام	الدكتور صائب عبد الحميد	Rafed	21	0.26404
		نتائج البحوث وخواتيم الكتب	هذه نتائج وخواتيم رسائل علمية وأبحاث لمؤلفين مختلفين تحوي خلاصات ما فيها	Sham19Y	95557	0.26403
		 المعجزة القرآنية 	 دكتور محمد حسن هيتو 	ABLibrary	8620	0.26399
		 تمهيد القواعد الأصولية والعربية لتفريع قواعد الأحكام الشرعية 	 الشهيد الثاني 	ABLibrary	9333	0.26397
		تفسير غرائب القرآن ورغائب الفرقان [ج ٣]	نظام الدين الحسن بن محمّد بن حسين القمي النيسابوري	Rafed	1794	0.26396
		الأمثل في تفسير كتاب الله المنزل [ج ١٣]	آية الله مكارم الشيرازي	Rafed	2057	0.26396
		 تاج العقائد ومعدن الفوائد 	 علي بن محمد الوليد 	ABLibrary	8373	0.26395
		معجم المصطلحات العلمية العربية	د. فايز الداية (معاصر)	ShamAY	34687	0.26395
		 نفح الطيب من غصن الأندلس الرطيب 	 أحمد بن محمد المقري التلمساني 	ABLibrary	9298	0.26392
		المعجزة الكبرى القرآن	محمد بن أحمد بن مصطفى بن أحمد المعروف بأبي زهرة (المتوفى: 1394ه)	ShamelaY19	23137	0.26391
		جمهرة مقالات الأستاذ محمود محمد شاكر	محمود شاكر، أبو فهر	ShamelaY19	20641	0.26387
		درر الفوائد	الشيخ عبد الكريم الحائري اليزدي	Masaha	3785	0.26386
		 ولاية الفقيه ، تأريخها ومبانيها 	 محسن الحيدري 	ABLibrary	9626	0.26385
		صلح الحسن(ع)	الشيخ راضي آل ياسين	Masaha	2315	0.26384
		نواهد الأبكار وشوارد الأفكار = حاشية السيوطي على تفسير البيضاوي	عبد الرحمن بن أبي بكر، جلال الدين السيوطي (المتوفى: 911ه)	ShamelaY19	29882	0.26381
		الأجوبة الكافية عن الأسئلة الشامية	محمد بن يوسف بن محمد بن سعد الحيدري التونسي الكافي المالكي (المتوفى: 1380ه)	ShamelaY19	36571	0.26378
		إيضاح المحصول من برهان الأصول	أبو عبد الله محمد بن علي بن عمر المازري (536 هـ)	ShamAY	32514	0.26371
		اعجاز القرآن بين المعتزلة والأشاعرة	دكتور منير سلطان	Rafed	3292	0.26371
		في سبيل الإصلاح	علي بن مصطفى الطنطاوي (المتوفى: 1420هـ)	ShamAY	32184	0.26367
		بحوث في مباني علم الرجال‌	الشيخ محمد السند	Masaha	3517	0.26366
		آيات الأحكام في تفسير كلام الملك العلام (للأسترآبادي)	محمد بن علي بن ابراهيم الاسترابادي	Masaha	1149	0.26365
		موسوعة الغزو الفكري والثقافي وأثره على المسلمين	علي بن نايف الشحود	ShamAY	33270	0.26362
		فضائح الباطنية	أبو حامد محمد بن محمد الغزالي الطوسي (المتوفى: 505هـ)	ShamAY	6554	0.26361
		في ظلال القرآن [ج ٢]	سيّد قطب	Rafed	3879	0.26361
		الجامع الكبير في صناعة المنظوم من الكلام والمنثور	نصر الله بن محمد بن محمد بن عبد الكريم الشيباني، الجزري، أبو الفتح، ضياء الدين، المعروف بابن الأثير الكاتب (المتوفى: 637هـ)	ShamAY	865	0.26358
		توجيه النظر إلى أصول الأثر	طاهر بن صالح (أو محمد صالح) ابن أحمد بن موهب، السمعوني الجزائري، ثم الدمشقيّ (المتوفى: 1338هـ)	ShamAY	5981	0.26354
		المعيار المعرب والجامع المغرب عن فتاوي أهل إفريقية والأندلس والمغرب	الوَنْشَرِيسي	ShamAY	34230	0.26352
		حاشية الوافي	الوحيد البهبهاني	Masaha	1518	0.26351
		النظرات	مصطفى لطفي بن محمد لطفي بن محمد حسن لطفي المَنْفَلُوطي (المتوفى: 1343هـ)	ShamAY	11400	0.2635
		مجلة البيان (238 عددا)	تصدر عن المنتدى الإسلامي	Sham19Y	1541	0.26349
		إيثار الحق على الخلق في رد الخلافات إلى المذهب الحق من أصول التوحيد	ابن الوزير، محمد بن إبراهيم بن علي بن المرتضى بن المفضل الحسني القاسمي، أبو عبد الله، عز الدين اليمني (المتوفى: 840هـ)	ShamAY	1238	0.26348
		مناهج المفسرين	منيع بن عبد الحليم محمود (المتوفى: 1430هـ)	ShamAY	1236	0.26347
		أصول الفقه (المظفر) (مع تعليق زارعي السبزواري)	الشيخ محمد رضا المظفر	Masaha	2386	0.26347
		أصول الإيمان	عبدالقاهر التميمي الشافعي	Rafed	3271	0.26346
		تعريف عام بدين الإسلام	علي بن مصطفى الطنطاوي (المتوفى: 1420ه)	ShamelaY19	37562	0.26344
		تاريخ طبرستان	بهاء الدين محمد بن حسن بن إسفنديار	Rafed	2197	0.26343
		تفسير سورة هل أتى [ج ٢]	السيد جعفر مرتضى العاملي	Rafed	3891	0.26342
		نهاية الوصول إلى علم الأصول [ج ٥]	الحسن بن يوسف بن علي المطّهر [ العلامة الحلّي ]	Rafed	3668	0.26341
		القرآن وإعجازه العلمي	محمد إسماعيل ابراهيم	ShamAY	1188	0.2634
		الملل والنّحل [ج ١]	أبي الفتح محمد بن عبدالكريم بن أبي بكر أحمد الشهرستاني	Rafed	3569	0.26338
		 ولاية الفقيه في حكومة الإسلام 	 السيد محمد حسين الطهراني 	ABLibrary	9447	0.26337
		مباني الأحكام في أصول شرائع الإسلام‏  - الجزء1	الشيخ مرتضى الحائري	Masaha	4263	0.26337
		الهوامل والشوامل سؤالات أبي حيان التوحيد لأبي علي مسكويه	أبو علي أحمد بن محمد بن يعقوب مسكويه (المتوفى: 421هـ)	ShamAY	4135	0.26335
		الرسائل الجديدة والفرائد الحديثة	الشيخ علي المشكيني	Masaha	3459	0.26335
		 القضاء والقدر 	 فخر الدين الرازي 	ABLibrary	8573	0.26333
		الحدائق الناضرة [ج ٢٠]	الشيخ يوسف بن أحمد البحراني [ صاحب الحدائق ]	Rafed	2876	0.26331
		مفتاح العلوم	يوسف بن محمّد بن علي السّكّاكي [ السّكّاكي ]	Rafed	1996	0.26329
		الفوائد المدنية و بذيله الشواهد المكية	السيد نور الدين العاملي	Masaha	1264	0.26328
		ماذا خسر العالم بانحطاط المسلمين	علي أبو الحسن بن عبد الحي بن فخر الدين الندوي (المتوفى: 1420ه)	ShamelaY19	21575	0.26326
		معارج الأصول	الشيخ نجم الدين أبي القاسم جعفر بن الحسن بن يحيى بن سعيد الهذلي [ المحقق الحلّي ]	Rafed	271	0.26325
		أنيس المجتهدين في علم الأصول‏  - الجزء1	الشيخ محمد مهدي النراقي	Masaha	3137	0.26325
		الجامع الكبير في صناعة المنظوم من الكلام والمنثور	نصر الله بن محمد بن محمد بن عبد الكريم الشيباني، الجزري، أبو الفتح، ضياء الدين، المعروف بابن الأثير الكاتب (المتوفى: 637ه)	ShamelaY19	37475	0.26325
		 الكهف والرقيم في شرح بسم الله الرحمن الرحيم ( ويليه مراتب الوجود وحقيقة كل موجود ونسيم السحر ) 	 عبد الكريم بن ابراهيم الجيلي 	ABLibrary	8815	0.26324
		جدد حياتك	محمد الغزالي	ShamAY	36041	0.26323
		في ظلال القرآن [ج ٥]	سيّد قطب	Rafed	3885	0.26323
		رحلة أفوقاي الأندلسي‏	أحمد بن قاسم الحجري	Masaha	4509	0.26323
		الحقيقة الضائعة رحلتي نحو مذهب آل البيت(ع)	الشيخ معتصم سيد أحمد	Masaha	240	0.26322
		موسوعة الأعمال الكاملة للإمام محمد الخضر حسين	الإمام محمد الخضر حسين (المتوفى: 1377 ه)	Sham19Y	14579	0.26321
		أنيس المجتهدين في علم الأصول‏ - الجزء1	الشيخ محمد مهدي النراقي	Masaha	2643	0.26321
		الهوامل والشوامل سؤالات أبي حيان التوحيد لأبي علي مسكويه	أبو علي أحمد بن محمد بن يعقوب مسكويه (المتوفى: 421ه)	Sham19Y	4135	0.2632
		الوسيط في اُصول الفقه‏  - الجزء1	الشيخ جعفر السبحاني	Masaha	3597	0.26319
		مناهج المفسرين	منيع بن عبد الحليم محمود (المتوفى: 1430ه)	Sham19Y	38093	0.26318
		الغزو الثقافي	محمد الغزالي	ShamAY	36036	0.26316
		قضاء الأرب في أسئلة حلب	أبو الحسن تقي الدين علي بن عبد الكافي السبكي (المتوفى: 756 ه)	ShamelaY19	18610	0.26316
		المفصل في الرد على الحضارة الغربية1 - 8	علي بن نايف الشحود	ShamAY	33266	0.26315
		كتاب الصلاة (للشيخ الأنصاري) - الجزء1	الشيخ مرتضى الأنصاري	Masaha	828	0.26315
		رحلة الشتاء والصيف	محمد بن عبد الله بن محمد، من أحفاد شرف الدين بن يحيى الحمزي الحسيني المولوي المعروف بـ كِبْرِيت (المتوفى: 1070هـ)	ShamAY	622	0.26314
		الحاكم الجشمي ومنهجه في التفسير	عدنان محمد زرزور	ShamAY	1091	0.2631
		تحليل العروة	راضي بن محمد حسين التبريزي	Masaha	2729	0.2631
		رسائل أصولية	الشيخ جعفر السبحاني	Masaha	3827	0.26309
		نهاية الوصول إلى علم الأصول‏  - الجزء1	العلامة الحلي	Masaha	4768	0.26309
		اللّباب في علوم الكتاب [ج ٩]	أبي حفص عمر بن علي بن عادل الدمشقي الحنبلي	Rafed	3101	0.26308
		خطى متعثّرة على طريق تجديد النحو العربي	الدكتور عفيف دمشقيّة	Rafed	1986	0.26307
		الدكتور علي جمعة إلى أين	طلحة محمد المسير	ShamelaY19	37659	0.26307
		مجلة لغة العرب العراقية - مجلة شهرية أدبية علمية تاريخية	أنستاس الكرملي	ShamAY	340	0.26306
		علل وأدوية	محمد الغزالي	ShamAY	33244	0.26304
		بحار الأنوار [ج ٦١]	الشيخ محمّد باقر بن محمّد تقي المجلسي	Rafed	1058	0.26303
		شرح الدماميني على المغني اللبيب [ج ٢]	محمّد بن أبي بكر الدماميني	Rafed	2096	0.26301
		 مصطلحات الفقه 	 الشيخ علي المشكيني 	ABLibrary	9775	0.263
		بحوث في الملل والنّحل [ج ٣]	الشيخ جعفر السبحاني	Rafed	61	0.263
		الطريق من هنا	محمد الغزالي	ShamAY	36035	0.26295
		من بلاغة القرآن	أحمد أحمد عبد الله البيلي البدوي (المتوفى: 1384هـ)	ShamAY	1232	0.26295
		بين الرشاد والتيه	مالك بن الحاج عمر بن الخضر بن نبي (المتوفى: 1393هـ)	ShamAY	1725	0.26293
		المسائل الحلبيات	أبو علي الفارسيّ (المتوفى 377 هـ)	ShamAY	32697	0.26293
		مجلة لغة العرب العراقية - مجلة شهرية أدبية علمية تاريخية	أنستاس الكرملي	Sham19Y	36540	0.26291
		 مجلة فقه أهل البيت ( ع ) 	 مجموعة مؤلفين 	ABLibrary	9749	0.26289
		البرهان في علوم القرآن (ط المعرفة)	محمد بن بهادر بن عبد الله الزركشي أبو عبد الله	ShamAY	34086	0.26289
		تأويلات أهل السنّة تفسير الماتريدي [ج ٤]	أبي منصور محمّد بن محمّد بن محمود الماتريدي	Rafed	3970	0.26289
		محمد بخيت المطيعي شيخ الإسلام والمفتي العالمي	د. محمد الدسوقي	ShamAY	38610	0.26286
		من حديث النفس	علي بن مصطفى الطنطاوي (المتوفى: 1420 هـ)	ShamAY	32332	0.26284
		أساس الحكومة الإسلامية	السيد كاظم الحسيني الحائري	Masaha	4892	0.26282
		أضواء على الصحيحين	الشيخ محمد صادق النجمي	Masaha	143	0.26281
		تفسير المراغي [ج ٢]	أحمد مصطفى المراغي	Rafed	1659	0.26278
		فوائد الأصول [ج ١ - ٢]	الشيخ محمّد علي الكاظمي الخراساني	Rafed	578	0.26278
		الاجتهاد و التقليد (هداية الأبرار إلى طريق الأئمة الأطهار)	الشيخ الحسين بن شهاب الدين الكركي	Masaha	1254	0.26276
		مجلة لغة العرب العراقية - مجلة شهرية أدبية علمية تاريخية	أنستاس الكرملي	ShamelaY19	36540	0.26276
		 الفوائد البهية في شرح عقائد الإمامية 	 الشيخ محمد جميل حمود 	ABLibrary	8528	0.26275
		تراثنا ـ العدد [ 18 ]	مؤسسة آل البيت عليهم السلام لإحياء التراث ـ قم	Rafed	2738	0.26275
		الحاكم الجشمي ومنهجه في التفسير	عدنان محمد زرزور	Sham19Y	37682	0.26274
		رحلات في الجزيرة العربية	جي. آر. ويستلد	Rafed	2286	0.26272
		الأمثل في تفسير كتاب الله المنزل - الجزء2	الشيخ ناصر مكارم الشيرازي	Masaha	95	0.26272
		محاضرات في الإلهيّات	الشيخ علي الربّاني الگلبايگاني	Rafed	2446	0.2627
		 معرفة المعاد 	 السيد محمد حسين الطهراني 	ABLibrary	8875	0.26268
		أنوار الأصول [ج ٢]	الناشر: مدرسة الإمام علي بن أبي طالب عليه السلام	Rafed	938	0.26268
		شرح العقيدة الطّحاويّة	ابن أبي العزّ الحنفي	Rafed	3437	0.26267
		من بلاغة القرآن	أحمد أحمد عبد الله البيلي البدوي (المتوفى: 1384ه)	ShamelaY19	38085	0.26267
		 نفح الطيب من غصن الأندلس الرطيب 	 أحمد بن محمد المقري التلمساني 	ABLibrary	9300	0.26265
		المواعظ والاعتبار بذكر الخطط والآثار المعروف بالخطط المقريزية  - الجزء1	أحمد بن علي المقريزي	Masaha	4351	0.26264
		الحدائق الناضرة [ج ١٠]	الشيخ يوسف بن أحمد البحراني [ صاحب الحدائق ]	Rafed	2845	0.26262
		المدارس النحويّة	الدكتور شوقي ضيف	Rafed	2811	0.26259
		شرح الرضيّ على الكافية [ج ١]	محمّد بن الحسن الرضي الاسترآبادي	Rafed	1797	0.26257
		موسوعة العتبات المقدسة  - الجزء1	جعفر الخليلي	Masaha	3747	0.26254
		البغداديات	أبو علي الحسن بن أحمد بن عبد الغفار بن محمد بن سليمان بن أبان الفارسي النحوي (377 هـ)	ShamAY	37111	0.26253
		مع الناس	علي بن مصطفى الطنطاوي (المتوفى: 1420 هـ)	ShamAY	32334	0.26252
		أصول النحو 2 - جامعة المدينة	مناهج جامعة المدينة العالمية	ShamAY	1651	0.26251
		تفسير ابن باديس ((في مجالس التذكير من كلام الحكيم الخبير)).	عبد الحميد محمد بن باديس الصنهاجي (المتوفى: 1359هـ)	ShamAY	55	0.2625
		منهج الرّشاد في معرفة المعاد [ج ١]	محمّد نعيم بن محمّد تقي [ الملا نعيما العرفي الطالقاني ]	Rafed	3669	0.2625
		الإقتصاد في الإعتقاد	أبو حامد الغزالي	Rafed	3312	0.2625
		الموجز في أصول الفقه	الشيخ جعفر السبحاني	Rafed	1985	0.26246
		 تاج العروس الحاوى لتهذيب النفوس ( ويليه الهداية لباديس / الورع للأبياري / الطريق إلى الله للمزيدي ) 	 ابن عطاء الله السكندري 	ABLibrary	8789	0.26239
		أسرار البيان في التعبير القرآني - كتاب	فاضل بن صالح بن مهدي بن خليل البدري السامرائي	ShamAY	1445	0.26239
		مناهج المفسرين	منيع بن عبد الحليم محمود (المتوفى: 1430ه)	ShamelaY19	38093	0.26239
		 رحلة أبي طالب خان إلى العراق واوروبا 	 حاجي محمد بيك خان 	ABLibrary	9206	0.26238
		كنز الفوائد  - الجزء1	الشيخ القاضي أبي الفتح محمد بن علي الكراجكي	Masaha	4568	0.26238
		 الخيال عالم البرزخ والمثال من كلام الشيخ الأكبر 	 محمود محمود الغراب 	ABLibrary	8909	0.26237
		 نقض الوشيعة أو الشيعة بين الحقائق الأوهم 	 السيد محسن الأمين 	ABLibrary	8670	0.26237
		الفَرق بين الفِرق	عبدالقاهر بن طاهر البغدادي	Rafed	3488	0.26237
		تفسير التّحرير والتّنوير [ج ٢٧]	الشيخ محمّد الطاهر ابن عاشور	Rafed	2936	0.26237
		بدائع الفوائد - ط عالم الفوائد	أبو عبد الله محمد بن أبي بكر بن أيوب ابن قيم الجوزية	ShamAY	34433	0.26236
		مدخل إلى تفسير القرآن وعلومه	عدنان محمد زرزور	ShamelaY19	38031	0.26236
		 رسائل في ولاية الفقيه 	 رحمان ستايش ومحمد كاظم 	ABLibrary	9633	0.26233
		رسائل فقهية	الشيخ مرتضى الأنصاري	Masaha	1598	0.26227
		القرآن وإعجازه العلمي	محمد إسماعيل ابراهيم	Sham19Y	1188	0.26226
		 نحو القلوب 	 ابو القاسم عبد الكريم القشيري 	ABLibrary	8713	0.26225
		رسالة التوحيد - ط الكتاب العربي	محمد عبده	ShamAY	33867	0.26223
		من بلاغة القرآن	أحمد أحمد عبد الله البيلي البدوي (المتوفى: 1384ه)	Sham19Y	38085	0.26222
		بدائع الفوائد - نزار الباز	محمد بن أبي بكر أيوب الزرعي أبو عبد الله	ShamAY	34422	0.26222
		الكليات معجم في المصطلحات والفروق اللغوية	أيوب بن موسى الحسيني القريمي الكفوي، أبو البقاء الحنفي (المتوفى: 1094هـ)	ShamAY	7037	0.26221
		آثاَرُ ابْنُ بَادِيسَ	عبد الحميد محمد بن باديس الصنهاجي (المتوفى: 1359هـ)	ShamAY	428	0.26221
		الدّرر النجفيّة [ج ٤]	الشيخ يوسف بن أحمد البحراني [ صاحب الحدائق ]	Rafed	3713	0.26221
		معالم الأصول(مع حاشية سلطان العلماء)	الشيخ جمال الدين الحسن بن زين الدين‏ العاملي	Masaha	4330	0.2622
		التفسير الحديث [مرتب حسب ترتيب النزول]	محمد عزة دروزة	ShamelaY19	23603	0.2622
		الإسلام ومشكلات الحضارة	الواحدي :: سيد قطب	ShamAY	33417	0.26217
		الرسائل الفقهية	الوحيد البهبهاني	Masaha	3461	0.26217
		فقه القرآن - الجزء1	القطب الراوندي	Masaha	708	0.26214
		مقالات في كلمات	علي بن مصطفى الطنطاوي (المتوفى: 1420 ه)	Sham19Y	17802	0.26213
		موسوعة العتبات المقدسة - الجزء1	جعفر الخليلي	Masaha	3049	0.26212
		اللآلي العبقريّة في شرح العينيّة الحميريّة	محمّد بهاء الدين الاصبهاني	Rafed	178	0.26211
		إشارات الإعجاز في مظان الإيجاز	بديع الزمان سعيد النورسي (المتوفى: 1379هـ)	ShamAY	7849	0.26209
		رحلة الشتاء والصيف	محمد بن عبد الله بن محمد، من أحفاد شرف الدين بن يحيى الحمزي الحسيني المولوي المعروف ب كبريت (المتوفى: 1070ه)	ShamelaY19	37345	0.26208
		بداية المجتهد - الفكر	أبو الوليد محمد بن أحمد بن محمد بن أحمد بن رشد القرطبي الشهير بابن رشد الحفيد (المتوفى: 595هـ)	ShamAY	34221	0.26207
		البرهان في أصول الفقه. ط الوفاء- الديب	عبد الملك بن عبد الله بن يوسف الجويني أبو المعالي	ShamAY	34188	0.26207
		 اللوامع الإلهية في المباحث الكلامية 	 المقداد السيوري 	ABLibrary	8584	0.26206
		شروط النهضة	مالك بن الحاج عمر بن الخضر بن نبي (المتوفى: 1393ه)	ShamelaY19	21841	0.26206
		التأصيل الإسلامي للعلوم الإجتماعية	الواحدي :: محمد قطب	ShamAY	33319	0.26205
		تهذيب الأخلاق وتطهير الأعراق	أبو علي أحمد بن محمد بن يعقوب مسكويه (المتوفى: 421هـ)	ShamAY	12720	0.26204
		شفاء الغليل في بيان الشبه والمخيل ومسالك التعليل	أبو حامد محمد بن محمد الغزالي الطوسي (المتوفى: 505 هـ)	ShamAY	32546	0.26204
		30 طريقة لخدمة الدين	رضا أحمد صمدي	ShamAY	33514	0.26202
		عمر والتشيع		ShamAY	35310	0.26198
		المناهج التفسيريّة في علوم القرآن	الشيخ جعفر السبحاني	Rafed	39	0.26196
		السرائر الحاوي لتحرير الفتاوي - الجزء1	ابن إدريس الحلي	Masaha	719	0.26196
		مواهب الفتّاح في شرح تلخيص المفتاح [ج ٢]	أبي العبّاس أحمد بن محمّد بن محمّدابن يعقوب المغربي	Rafed	2210	0.26195
		الكشاف - الجزء1	ابو القاسم محمود بن عمر الزمخشري	Masaha	3234	0.26194
		لمحات في الثقافة الإسلامية	عمر عودة الخطيب	ShamAY	11364	0.26192
		الكليات معجم في المصطلحات والفروق اللغوية	أيوب بن موسى الحسيني القريمي الكفوي، أبو البقاء الحنفي (المتوفى: 1094ه)	Sham19Y	7037	0.26188
		معارج الأصول	المحقق الحلي	Masaha	4329	0.26187
		 الشافي في شرح الكافي 	 المولى خليل القزويني 	ABLibrary	7921	0.26182
		غنائم الأيّام في مسائل الحلال و الحرام - الجزء1	الميرزا القمي	Masaha	1464	0.26179
		 مجموعة الرسائل ( تسع رسائل ) 	 ابن رشد 	ABLibrary	9878	0.26178
		نضد القواعد الفقهية على مذهب الإمامية	المقداد السيوري	Masaha	1129	0.26178
		الحديث النبوي في النحو العربي	الدكتور محمود فجال	Rafed	1991	0.26176
		 الإمامة وأهل البيت ( ع ) النظرية والإستدلال 	 السيد محمد باقر الحكيم 	ABLibrary	8348	0.26172
		إشارات الإعجاز في مظان الإيجاز	بديع الزمان سعيد النورسي (المتوفى: 1379ه)	Sham19Y	7849	0.26172
		حوار مع صديقي الملحد	مصطفى محمود	ShamAY	35536	0.26172
		خطط الشام [ج ٥]	محمّد كرد علي	Rafed	2285	0.26172
		الرسائل الأصولية	الوحيد البهبهاني	Masaha	3458	0.26172
		 تدبير الحبالى والأطفال والصبيان وحفظ صحتهم ومداواة الأمراض العارضة لهم 	 أحمد بن محمد البلدي 	ABLibrary	9839	0.2617
		 مسالك الأبصار في ممالك الأمصار 	 أحمد بن يحيى العمري 	ABLibrary	9194	0.26168
		التحرير الأدبي	د. حسين علي محمد حسين (المتوفى: 1431هـ)	ShamAY	7585	0.26166
		 نهاية المرام في علم الكلام 	 العلامة الحلي 	ABLibrary	8672	0.26165
		تحذير الساجد من اتخاذ القبور مساجد	محمد ناصر الدين الألباني (المتوفى: 1420هـ)	ShamAY	349	0.26163
		الأشباه والنظائر في النحو [ج ٣]	جلال الدين عبد الرحمن بن أبي بكر السيوطي	Rafed	2069	0.26163
		روح المعاني [ج ٨]	أبي الفضل شهاب الدين السيّد محمود الألوسي البغدادي	Rafed	3192	0.26163
