automatic URI	Proposed URI	bookTitle	authorName	collection	id	tfidf
		 منهاج الملة في بيان الوقت والقبلة 	 الشيخ علي الغروي 	ABLibrary	9397	0.4066
		زيج الصابئ	محمد بن جابر بن سنان الحراني الرقي الصابئ، أبو عبد الله المعروف بالبتاني (المتوفى: 317ه)	Sham19Y	452	0.40212
		زيج الصابئ	محمد بن جابر بن سنان الحراني الرقي الصابئ، أبو عبد الله المعروف بالبتاني (المتوفى: 317هـ)	ShamAY	452	0.39887
		المطالب العالية من العلم الإلهي [ج ٦]	محمّد بن عمر بن الحسن بن الحسين التيمي البكري [ فخر الدين الرازي ]	Rafed	3635	0.30996
		 المطالب العالية من العلم الإلهي 	 فخر الدين الرازي 	ABLibrary	8611	0.30858
		 عجائب المخلوقات وغرايب الموجودات 	 زكريا القزويني 	ABLibrary	9136	0.30187
		 المواقف ( شرح الجرجاني ) ( مع حاشيتي السيالكوتي والحلبي ) 	 الإيجي 	ABLibrary	8474	0.2981
		تفسير من وحي القرآن [ج ٢٤]	السيد محمد حسين فضل الله	Rafed	3289	0.29663
		عجائب المخلوقات وغرائب الموجودات‏	زكريا بن محمد القزويني	Masaha	4844	0.2961
		 صفة جزيرة العرب 	 الحسن الهمداني ( ابن الحائك ) 	ABLibrary	9129	0.29268
		صفة جزيرة العرب	الحسن بن أحمد بن يعقوب الهمداني	Rafed	2485	0.29239
		 جامع العلوم في اصطلاحات الفنون الملقب بدستور العلماء 	 القاضى عبد النبي بن عبد الرسول الأحمد نگري 	ABLibrary	8403	0.29195
		 انشاء الدوائر ( ويليه عُقلَة المستوفز وكتاب التدبيرات الالهية ) 	 ابن عربي 	ABLibrary	8733	0.29131
		تفسير من وحي القرآن [ج ٤]	السيد محمد حسين فضل الله	Rafed	3261	0.29066
		 جامع العلوم في اصطلاحات الفنون الملقب بدستور العلماء 	 القاضى عبد النبي بن عبد الرسول الأحمد نگري 	ABLibrary	8402	0.29058
		تفسير من وحي القرآن [ج ٢٣]	السيد محمد حسين فضل الله	Rafed	3288	0.2894
		تفسير من وحي القرآن [ج ١]	السيد محمد حسين فضل الله	Rafed	3257	0.28929
		 عين اليقين الملقب بالأنوار والأسرار 	 الفيض الكاشاني 	ABLibrary	8520	0.28925
		تفسير من وحي القرآن [ج ٣]	السيد محمد حسين فضل الله	Rafed	3260	0.28877
		 شرح المقاصد 	 التفتازاني 	ABLibrary	8465	0.28837
		تفسير من وحي القرآن [ج ١٨]	السيد محمد حسين فضل الله	Rafed	3283	0.28796
		عين اليقين [ج ٢]	محمّد بن المرتضى [ الفيض الكاشاني ]	Rafed	3592	0.28789
		تفسير من وحي القرآن [ج ١٩]	السيد محمد حسين فضل الله	Rafed	3284	0.28739
		 أصول الدين 	 محمد حسن آل ياسين 	ABLibrary	8335	0.28697
		تفسير من وحي القرآن [ج ٦]	السيد محمد حسين فضل الله	Rafed	3265	0.2869
		تفسير من وحي القرآن [ج ٥]	السيد محمد حسين فضل الله	Rafed	3264	0.28616
		تفسير من وحي القرآن [ج ٧]	السيد محمد حسين فضل الله	Rafed	3268	0.2861
		 المطالب العالية من العلم الإلهي 	 فخر الدين الرازي 	ABLibrary	8613	0.28557
		تفسير من وحي القرآن [ج ٢٢]	السيد محمد حسين فضل الله	Rafed	3287	0.28551
		تفسير من وحي القرآن [ج ١٦]	السيد محمد حسين فضل الله	Rafed	3281	0.28514
		 الكشف عن مناهج الأدلة في عقائد الملة 	 ابن رشد 	ABLibrary	8577	0.28466
		مجلة «الثقافة» السورية	خليل مردم بك	ShamAY	893	0.28465
		شرح المقاصد [ج ٣]	مسعود بن عمر بن عبدالله [ سعد الدين التفتازاني ]	Rafed	3515	0.2842
		 الشهاب الثاقب في وجوب صلاة الجمعة العيني 	 الفيض الكاشاني 	ABLibrary	9337	0.28394
		مجلة «الثقافة» السورية	خليل مردم بك	ShamelaY19	73350	0.28394
		أسرار البلاغة	أبو بكر عبد القاهر بن عبد الرحمن بن محمد الفارسي الأصل، الجرجاني الدار (المتوفى: 471هـ)	ShamAY	8187	0.28393
		روض الجنان في شرح إرشاد الأذهان [ج ٢]	زين الدين بن علي العاملي [ الشهيد الثاني ]	Rafed	1540	0.28389
		أسرار البلاغة	أبو بكر عبد القاهر بن عبد الرحمن بن محمد الفارسي الأصل، الجرجاني الدار (المتوفى: 471ه)	Sham19Y	8187	0.28383
		تفسير من وحي القرآن [ج ١٢]	السيد محمد حسين فضل الله	Rafed	3274	0.28366
		دلائل الإعجاز في علم المعاني	عبد القاهر بن عبد الرحمن الجرجاني	Rafed	2081	0.28342
		 الشيعة " نص الحوار مع المستشرق كوربان " 	 السيد الطباطبائي ( تعريب : جواد على كسار ) 	ABLibrary	8485	0.28341
		تفسير من وحي القرآن [ج ١٧]	السيد محمد حسين فضل الله	Rafed	3282	0.28314
		تفسير من وحي القرآن [ج ١٥]	السيد محمد حسين فضل الله	Rafed	3280	0.28306
		المدرّس الأفضل [ج ١]	الشيخ محمّد علي المدرّس الأفغاني	Rafed	2679	0.28294
		المطالب العالية من العلم الإلهي [ج ٨]	محمّد بن عمر بن الحسن بن الحسين التيمي البكري [ فخر الدين الرازي ]	Rafed	3641	0.28265
		تفسير من وحي القرآن [ج ٢]	السيد محمد حسين فضل الله	Rafed	3259	0.28243
		 الرحلة الحجازية ( الارتسامات اللطاف في خاطر الحاج إلى أقدس مطاف ) 	 شكيب أرسلان 	ABLibrary	9092	0.2823
		نفائس التأويل - الجزء1	السيد المرتضى	Masaha	2507	0.28174
		تفسير من وحي القرآن [ج ١٤]	السيد محمد حسين فضل الله	Rafed	3277	0.2817
		 الذخيرة في علم الكلام 	 الشريف المرتضى 	ABLibrary	8424	0.2815
		تفسير من وحي القرآن [ج ١٠]	السيد محمد حسين فضل الله	Rafed	3272	0.28143
		 رسالة التوحيد 	 الشيخ محمد عبده 	ABLibrary	8430	0.28132
		 تلخيص الشافي 	 الشيخ الطوسي 	ABLibrary	8390	0.28108
		حصوننا مهددة من داخلها	محمد محمد حسين (المتوفى: 1402ه)	ShamelaY19	121375	0.28058
		 الدرر النجفية من الملتقطات اليوسفية 	 المحقق البحراني 	ABLibrary	991	0.28046
		 معارج الفهم في شرح النظم 	 العلامة الحلي 	ABLibrary	8618	0.28042
		دلائل الإعجاز في علم المعاني	أبو بكر عبد القاهر بن عبد الرحمن بن محمد الفارسي الأصل، الجرجاني الدار (المتوفى: 471ه)	Sham19Y	12055	0.28021
		دلائل الإعجاز في علم المعاني	أبو بكر عبد القاهر بن عبد الرحمن بن محمد الفارسي الأصل، الجرجاني الدار (المتوفى: 471هـ)	ShamAY	1039	0.28021
		 رحلة المكناسي 	 محمد بن عبد الوهاب المكناسي 	ABLibrary	9109	0.28008
		 رسائل ابن حزم الأندلسي 	 ابن حزم 	ABLibrary	8431	0.28005
		 الإلهيات على هدى الكتاب والسنة والعقل 	 الشيخ السبحاني 	ABLibrary	8345	0.27999
		 العقيدة وعلم الكلام ( ويليه نظرة عابرة في مزاعم من ينكر نزول عيسى ( ع ) قبل الآخرة و . . . ) 	 الشيخ محمد زاهد الكوثري 	ABLibrary	8349	0.27993
		 إرشاد ذوي العقول إلى براءة الصوفية من الاتحاد والحلول 	 مجموعة مؤلفين 	ABLibrary	8828	0.27991
		تفسير من وحي القرآن [ج ٢٠]	السيد محمد حسين فضل الله	Rafed	3285	0.2799
		 شرح المقاصد 	 التفتازاني 	ABLibrary	8463	0.27988
		تفسير من وحي القرآن [ج ٩]	السيد محمد حسين فضل الله	Rafed	3270	0.27987
		اللّباب في علوم الكتاب [ج ٣]	أبي حفص عمر بن علي بن عادل الدمشقي الحنبلي	Rafed	3092	0.27986
		رسائل الشريف المرتضى [ج ١]	علي بن الحسين الموسوي العلوي [ الشريف المرتضى علم الهدى ]	Rafed	3614	0.27986
		تفسير من وحي القرآن [ج ٢١]	السيد محمد حسين فضل الله	Rafed	3286	0.27982
		المدخل إلى عذب المنهل في أصول الفقه‏	أبو الحسن‏ الشعراني	Masaha	3567	0.27941
		 المقدمات من كتاب نص النصوص 	 السيد حيدر الآملي 	ABLibrary	8806	0.27921
		الأمثل في تفسير كتاب الله المنزل [ج ٧]	آية الله مكارم الشيرازي	Rafed	2047	0.2792
		تحقيق النصوص ونشرها	عبد السلام محمد هارون (المتوفى: 1408هـ)	ShamAY	7300	0.27895
		 نور العيون وجامع الفنون 	 صلاح الدين بن يوسف الكحال الحموي 	ABLibrary	9932	0.27889
		 كتاب الشكوك على كلام فاضل الأطباء جالينوس 	 محمد بن زكريا الرازي 	ABLibrary	9816	0.27877
		 مجموعة رسائل الإمام الغزالي 	 الغزالي 	ABLibrary	8593	0.27854
		دلائل الإعجاز في علم المعاني	أبو بكر عبد القاهر بن عبد الرحمن بن محمد الفارسي الأصل، الجرجاني الدار (المتوفى: 471هـ)	ShamAY	1040	0.27832
		مجلة المنار (كاملة 35 مجلدا)	مجموعة من المؤلفين، محمد رشيد بن علي رضا (المتوفى: 1354هـ) وغيره من كتاب المجلة	ShamAY	6947	0.27819
		تفسير من وحي القرآن [ج ٨]	السيد محمد حسين فضل الله	Rafed	3269	0.27818
		تفسير الشريف المرتضى [ج ١]	الناشر: شركة الأعلمي للمطبوعات	Rafed	3793	0.27804
		الرّحلة الحجازيّة	الأمير شكيب أرسلان	Rafed	2385	0.27804
		حُصُوُننا مهدَّدة من دَاخِلِهَا	محمد محمد حسين (المتوفى: 1402هـ)	ShamAY	31682	0.278
		عصمة المعصوم عليه السلام وفق المعطيات القرآنية	الشيخ جلال الدين علي الصغير	Rafed	1093	0.27788
		 المغني في أبواب التوحيد والعدل 	 القاضي عبد الجبار الهمذاني 	ABLibrary	8633	0.27782
		مفاهيم القرآن [ج ١]	الشيخ جعفر السبحاني	Rafed	234	0.27766
		 مقالات تأسيسية في الفكر الإسلامي 	 السيد الطباطبائي ( تعريب : جواد علي كسار ) 	ABLibrary	8638	0.27763
		سرّ الفصاحة	أبي محمّد عبد الله بن سعيد بن سنان الخفاجي الحلبي	Rafed	2077	0.27763
		دلائل الإعجاز في علم المعاني	أبو بكر عبد القاهر بن عبد الرحمن بن محمد الفارسي الأصل، الجرجاني الدار (المتوفى: 471ه)	ShamelaY19	22664	0.27755
		 دروس في العقائد الإسلامية 	 الشيخ ناصر مكارم الشيرازي 	ABLibrary	8422	0.27734
		 قاعدة لا ضرر ولا ضرار 	 تقرير بحث السيد محمد باقر الصدر لسيد كمال الحيدري 	ABLibrary	9427	0.27729
		 رسائل ومقالات 	 الشيخ السبحاني 	ABLibrary	8443	0.27722
		تفسير من وحي القرآن [ج ١٣]	السيد محمد حسين فضل الله	Rafed	3276	0.27719
		خصائص التراكيب دارسة تحليلية لمسائل علم المعاني	محمد محمد أبو موسى	ShamAY	3334	0.27713
		 معرفة الإمام 	 السيد محمد حسين الطهراني 	ABLibrary	8896	0.27703
		مقالات موقع الدرر السنية	مجموعة من المؤلفين	ShamAY	1572	0.27703
		روح المعاني [ج ١٢]	أبي الفضل شهاب الدين السيّد محمود الألوسي البغدادي	Rafed	3198	0.27702
		تفسير التّحرير والتّنوير [ج ٢]	الشيخ محمّد الطاهر ابن عاشور	Rafed	2906	0.277
		أنيس المجتهدين [ج ١]	محمد مهدي بن أبي ذر النراقي [ المولى مهدي النراقي ]	Rafed	999	0.27698
		مجلة المقتبس	محمد كرد علي	ShamAY	443	0.27695
		 تحقيق ما للهند 	 أبو ريحان البيروني 	ABLibrary	9023	0.27691
		 الملخص في أصول الدين 	 الشريف المرتضى 	ABLibrary	8641	0.27685
		مقالات موقع الدرر السنية	مجموعة من المؤلفين	ShamelaY19	95660	0.27678
		 رسائل ومقالات 	 الشيخ السبحاني 	ABLibrary	8442	0.27674
		الوافية في أصول الفقه	عبد الله بن محمّد البشروي الخراساني	Rafed	336	0.2767
		وانقضت أوهام العمر	السيّد جمال محمّد صالح	Rafed	1221	0.27657
		الخصائص	أبو الفتح عثمان بن جني الموصلي (المتوفى: 392هـ)	ShamAY	9986	0.27627
		الخصائص	أبو الفتح عثمان بن جني الموصلي (المتوفى: 392ه)	Sham19Y	9986	0.27623
		مفاتيح العلوم	محمد بن أحمد بن يوسف، أبو عبد الله، الكاتب البلخي الخوارزمي (المتوفى: 387هـ)	ShamAY	12077	0.27612
		تحقيق ما للهند	محمد بن أحمد أبو ريحان البيروني	Masaha	4804	0.27607
		تاريخ الفقه الجعفري	هاشم معروف الحسني	Rafed	3882	0.27606
		ما دل عليه القرآن مما يعضد الهيئة الجديدة القويمة بالبرهان	أبو المعالي محمود شكري بن عبد الله بن محمد بن أبي الثناء الألوسي (المتوفى: 1342هـ)	ShamAY	1529	0.276
		قذائف الحق	محمد الغزالي السقا (المتوفى: 1416هـ)	ShamAY	9818	0.27597
		ما دل عليه القرآن مما يعضد الهيئة الجديدة القويمة بالبرهان	أبو المعالي محمود شكري بن عبد الله بن محمد بن أبي الثناء الألوسي (المتوفى: 1342هـ)	ShamAY	5551	0.27576
		المراجعات الريحانية	الشيخ محمد حسين كاشف الغطاء	Masaha	4072	0.27569
		مجلة المقتبس	محمد كرد علي	ShamelaY19	26523	0.27569
		ما دل عليه القرآن مما يعضد الهيئة الجديدة القويمة بالبرهان	أبو المعالي محمود شكري بن عبد الله بن محمد بن أبي الثناء الألوسي (المتوفى: 1342ه)	Sham19Y	5551	0.27567
		دستور العلماء = جامع العلوم في اصطلاحات الفنون	القاضي عبد النبي بن عبد الرسول الأحمد نكري (المتوفى: ق 12هـ)	ShamAY	7038	0.27563
		أسرار البلاغة فى علم البيان	أبو بكر عبد القاهر بن عبد الرحمن بن محمد الفارسي الأصل، الجرجاني الدار (المتوفى: 471 هـ)	ShamAY	32338	0.27557
		مجموعه رسائل الإمام الغزالي	أبو حامد الغزالي	Rafed	3457	0.27546
		 الاربعينيات لكشف أنوار القدسيات 	 القاضي سعيد القمي 	ABLibrary	8853	0.27542
		معارج الفهم في شرح النظم	الحسن بن يوسف بن علي المطّهر [ العلامة الحلّي ]	Rafed	3595	0.27541
		 المغني في أبواب التوحيد والعدل 	 القاضي عبد الجبار الهمذاني 	ABLibrary	8636	0.27527
		 رحلة فريزر إلى بغداد 	 جيمس بيلي فريزر 	ABLibrary	9103	0.2752
		مقالات الشيخ محمد الغزالي	محمد الغزالي	ShamAY	33256	0.27515
		 تلخيص الشافي 	 الشيخ الطوسي 	ABLibrary	8391	0.27511
		تأملات في الدين والحياة	محمد الغزالي	ShamAY	36039	0.27507
		شرح المقاصد [ج ١]	مسعود بن عمر بن عبدالله [ سعد الدين التفتازاني ]	Rafed	3513	0.27491
		الرسائل العشر	أبي جعفر محمّد بن الحسن بن علي بن الحسن الطّوسي [ شيخ الطائفة ]	Rafed	1252	0.27478
		 بحوث في الملل والنحل 	 الشيخ السبحاني 	ABLibrary	8358	0.27473
		تفسير من وحي القرآن [ج ١١]	السيد محمد حسين فضل الله	Rafed	3273	0.27471
		 رحلة مدام ديولافوا من المحمرة إلى البصرة وبغداد 	 ژن ديولافوا 	ABLibrary	9106	0.27461
		 مجلة فقه أهل البيت ( ع ) 	 مجموعة مؤلفين 	ABLibrary	9742	0.27443
		تفسير التّحرير والتّنوير [ج ١]	الشيخ محمّد الطاهر ابن عاشور	Rafed	2905	0.27442
		الرحلة الحجازية المسماة الارتسامات اللطاف في خاطر الحاج إلى أقدس مطاف‏	شكيب أرسلان	Masaha	4551	0.27442
		تحرير الأصول [ج ١]	آية الله الشيخ مرتضى النجفي المظاهري الإصبهاني	Rafed	3913	0.27436
		كيف نفهم الإسلام	محمد الغزالي	ShamAY	33248	0.27425
		الظاهرة القرآنية	مالك بن الحاج عمر بن الخضر بن نبي (المتوفى: 1393هـ)	ShamAY	1697	0.27424
		تفسير التّحرير والتّنوير [ج ١٨]	الشيخ محمّد الطاهر ابن عاشور	Rafed	2925	0.27418
		الإلهيّات على هدى الكتاب والسنّة والعقل [ج ٣]	الشيخ حسن محمد مكي العاملي	Rafed	3381	0.27418
		مفاهيم القران - الجزء1	الشيخ جعفر السبحاني	Masaha	647	0.27416
		معركة المصحف في العالم الإسلامي	محمد الغزالي	ShamAY	33255	0.27414
		مباحث في إعجاز القرآن	د مصطفى مسلم	ShamAY	1505	0.27411
		 كنز الفوائد 	 أبي الفتح الكراجكي 	ABLibrary	7902	0.27405
		مشكلات في طريق الحياة الإسلامية	محمد الغزالي	ShamAY	33253	0.27401
		 بحار الأنوار 	 العلامة المجلسي 	ABLibrary	752	0.274
		نفحات القرآن [ج ٨]	آية الله مكارم الشيرازي	Rafed	3823	0.274
		 فقه الطب والتضخم النقدي 	 الشيخ محمد السند 	ABLibrary	9552	0.27396
		 عيون مسائل النفس وسرح العيون في شرح العيون 	 حسن حسن زاده آملى 	ABLibrary	8521	0.27387
		من معالم الحق في كفاحنا الإسلامي الحديث	محمد الغزالي	ShamAY	33257	0.27377
		مقالات وبحوث الدكتور عبد الكريم بكار	عبد الكريم بكار	ShamAY	34762	0.27374
		 المغني في أبواب التوحيد والعدل 	 القاضي عبد الجبار الهمذاني 	ABLibrary	8632	0.27372
		رسائل الشريف المرتضى - الجزء1	السيد المرتضى	Masaha	998	0.2737
		 سيد المرسلين 	 الشيخ السبحاني 	ABLibrary	7634	0.27367
		ظلام من الغرب	محمد الغزالي	ShamAY	33243	0.27364
		 البحر المحيط في أصول الفقه 	 الزركشي 	ABLibrary	804	0.2735
		دلائل الإعجاز في علم المعاني	أبو بكر عبد القاهر بن عبد الرحمن بن محمد الفارسي الأصل، الجرجاني الدار (المتوفى: 471هـ)	ShamAY	1056	0.27345
		سر الفصاحة	أبو محمد عبد الله بن محمد بن سعيد بن سنان الخفاجي الحلبي (المتوفى: 466هـ)	ShamAY	11239	0.27341
		 دراسات في نهج البلاغة 	 الشيخ محمد مهدي شمس الدين 	ABLibrary	917	0.27338
		 بحار الأنوار 	 العلامة المجلسي 	ABLibrary	750	0.27332
		مباحث في إعجاز القرآن	د مصطفى مسلم	Sham19Y	9675	0.27331
		 بد العارف 	 ابن سبعين 	ABLibrary	8759	0.27328
		الأشباه والنظائر في النحو [ج ٤]	جلال الدين عبد الرحمن بن أبي بكر السيوطي	Rafed	2070	0.27326
		 رسائل ومقالات 	 الشيخ السبحاني 	ABLibrary	8439	0.27324
		الدّرر النجفيّة [ج ١]	الشيخ يوسف بن أحمد البحراني [ صاحب الحدائق ]	Rafed	1549	0.27316
		تفسير التّحرير والتّنوير [ج ١٤]	الشيخ محمّد الطاهر ابن عاشور	Rafed	2918	0.27309
		نظرات في القرآن الكريم	محمد الغزالي	ShamAY	36730	0.27308
		 الدرر النجفية من الملتقطات اليوسفية 	 المحقق البحراني 	ABLibrary	993	0.27307
		 الدرر النجفية من الملتقطات اليوسفية 	 المحقق البحراني 	ABLibrary	992	0.27298
		آلاء الرحمن في تفسير القرآن [ج ١]	الشيخ محمد جواد البلاغي	Rafed	3150	0.27297
		 معرفة المعاد 	 السيد محمد حسين الطهراني 	ABLibrary	8876	0.27296
		الظاهرة القرآنية	مالك بن الحاج عمر بن الخضر بن نبي (المتوفى: 1393ه)	Sham19Y	2910	0.27295
		وانقضت أوهام العمر	السيد جمال محمد صالح	Masaha	481	0.27293
		الإسلام والمناهج الإشتراكية	محمد الغزالي	ShamAY	33241	0.27292
		تاريخ الفقه الجعفري‏	هاشم معروف الحسني‏	Masaha	2707	0.27292
		تاريخ الفقه الجعفري‏	هاشم معروف الحسني‏	Masaha	3197	0.27292
		نفحات القرآن [ج ٢]	آية الله مكارم الشيرازي	Rafed	3800	0.27288
		 سيرة الأئمة الاثني عشر ( ع ) 	 هاشم معروف الحسني 	ABLibrary	7547	0.27287
		 منتقد المنافع في شرح المختصر النافع 	 ملا حبيب الله الشريف الكاشاني 	ABLibrary	9405	0.27286
		 رؤيت هلال ( فارسي ) 	 رضا مختاري / محسن صادقي 	ABLibrary	9759	0.27284
		 مجموعه رسائل ابن عربي 	 ابن عربي 	ABLibrary	8753	0.27279
		الإمام الحسين في حلّة البرفير	سليمان كتّاني	Rafed	1535	0.27278
		مطارح الأنظار [ج ١]	الميرزا أبو القاسم الكلانتري الطهراني	Rafed	991	0.27278
		وقاية الأذهان والألباب ولباب أصول السنة والكتاب‏	الشيخ محمد رضا النجفي الأصفهاني	Masaha	4267	0.27278
		الشيعة: نص الحوار مع المستشرق كوربان	السيد محمد حسين الطباطبائي	Masaha	2320	0.27275
		بدائع الفوائد ط عالم الفوائد	أبو عبد الله محمد بن أبي بكر بن أيوب ابن قيم الجوزية (691 - 751)	ShamelaY19	145410	0.27273
		تراثنا ـ العدد [ 6 ]	مؤسسة آل البيت عليهم السلام لإحياء التراث ـ قم	Rafed	2636	0.2727
		الحاكم الجشمي ومنهجه في التفسير	عدنان محمد زرزور	ShamelaY19	37682	0.2727
		ركائز الإيمان بين العقل والقلب	محمد الغزالي	ShamAY	35258	0.27268
		خلفيات ماساه الزهراء (س)	سيد جعفرمرتضي حسيني عاملي	Ghbook	3900	0.27265
		 فضائح الباطنية 	 الغزالي 	ABLibrary	8525	0.27258
		رسائل في اللغة (رسائل ابن السيد البطليوسي)	أبو محمد عبد الله بن السيد البطليوسي (444 - 521 هـ)	ShamAY	38985	0.27257
		 البحر المحيط في أصول الفقه 	 الزركشي 	ABLibrary	802	0.27242
		 ينابيع النصيحة في العقائد الصحيحة 	 الأمير الحسين بن بدر الدين 	ABLibrary	8681	0.27233
		درر الفوائد [ج ١ و ٢]	آية الله الشيخ عبدالكريم الحائري اليزدي	Rafed	3826	0.27224
		خزائن الأحكام‏  - الجزء1	آغا بن عابد الدربندي	Masaha	3642	0.27222
		أسرار التكرار في القرآن	محمود بن حمزة بن نصر الكرماني	Rafed	3162	0.27215
		 أساس الحكومة الإسلامية 	 السيد كاظم الحائري 	ABLibrary	9607	0.27207
		الوافية في أصول الفقه‏	الفاضل التوني	Masaha	3595	0.27204
		فدك في التاريخ	آية الله السيّد محمّد باقر الصدر	Rafed	187	0.27197
		 تاريخ مكة 	 أحمد السباعي 	ABLibrary	9006	0.27196
		القوانين المحكمة في الأصول [ج ١]	الميرزا أبو القاسم القمّي	Rafed	2622	0.27193
		صناعة الفتوى وفقه الأقليات	الشيخ العلامة عبد الله بن بيه	ShamAY	37601	0.27189
		 سيرة المصطفى ( ص ) ( نظرة جديدة ) 	 هاشم معروف الحسني 	ABLibrary	7577	0.27188
		رحلة فريزر	جيمس بيلي فريزر	Rafed	2444	0.27187
		 تاريخ الأدب الجغرافي العربي 	 اغناطيوس يوليانوفتش كراتشكوفسكي ( تعريب : عثمان هاشم ) 	ABLibrary	8976	0.27185
