automatic URI	Proposed URI	bookTitle	authorName	collection	id	tfidf
		دفاع عن السُنَّة ورد شبه المُسْتَشْرِقِينَ والكتاب المعاصرين	محمد بن محمد بن سويلم أبو شُهبة (المتوفى: 1403هـ)	ShamAY	1103	0.25803
		 المنقذ من التقليد 	 الشيخ سديد الدين الحمصي الرازي 	ABLibrary	8647	0.25802
		 في ظلال نهج البلاغة 	 محمد جواد مغنية 	ABLibrary	962	0.258
		النبأ العظيم نظرات جديدة في القرآن الكريم	محمد بن عبد الله دراز (المتوفى : 1377هـ)	ShamAY	18795	0.25798
		 دراسات في علم الدراية 	 علي أكبر غفاري 	ABLibrary	923	0.25794
		حُكمُ الجَاهِليَّةِ	أحمد بن محمد عبد القادر المعروف بأحمد شاكر (المتوفى: 1377هـ 1958م)	ShamAY	31963	0.2579
		معجم متن اللغة (موسوعة لغوية حديثة)	أحمد رضا (عضو المجمع العلمي العربي بدمشق)	ShamelaY19	29613	0.25789
		محك النظر في المنطق	أبو حامد محمد بن محمد الغزالي الطوسي (المتوفى: 505ه)	ShamelaY19	26538	0.25789
		موسوعة الرد على المذاهب الفكرية المعاصرة 1-29	علي بن نايف الشحود	ShamAY	32988	0.25788
		تفسير سورة هل أتى [ج ١]	السيد جعفر مرتضى العاملي	Rafed	3890	0.25788
		المواعظ والاعتبار بذكر الخطط والآثار	أحمد بن علي بن عبد القادر، أبو العباس الحسيني العبيدي، تقي الدين المقريزي (المتوفى: 845هـ)	ShamAY	11566	0.25787
		الخصائص	عثمان بن جني ابن جني	Ghbook	16345	0.25787
		 البرنس في باريس 	 محمد المقداد الورتتاني 	ABLibrary	8967	0.25782
		الإلهيّات على هدى الكتاب والسنّة والعقل [ج ١]	الشيخ حسن محمد مكي العاملي	Rafed	3379	0.25782
		دفاع عن السنة ورد شبه المستشرقين والكتاب المعاصرين	محمد بن محمد بن سويلم أبو شهبة (المتوفى: 1403ه)	ShamelaY19	37972	0.25779
		تربة الحسين عليه السلام الإستشفاء والتبرّك بها ـ السجود عليها دراسة وتحليل [ج ٣]	الشيخ أمين حبيب آل درويش	Rafed	2554	0.25778
		المسائل المستحدثة	الشيخ محمد إسحاق الفياض	Masaha	5018	0.25778
		السنة ومكانتها في التشريع الإسلامي	مصطفى بن حسني السباعي (المتوفى: 1384هـ)	ShamAY	1005	0.25776
		هل نحن مسلمون	الواحدي :: محمد قطب	ShamAY	33329	0.25775
		اللّباب في علوم الكتاب [ج ٨]	أبي حفص عمر بن علي بن عادل الدمشقي الحنبلي	Rafed	3100	0.25775
		مصباح الفقيه - الجزء1	الشيخ آقا رضا الهمداني	Masaha	1809	0.2577
		المفيد في شرح أصول الفقه‏  - الجزء1	ابراهيم شهركاني	Masaha	3576	0.25767
		دفاع عن السنة ورد شبه المستشرقين والكتاب المعاصرين	محمد بن محمد بن سويلم أبو شُهبة (المتوفى: 1403هـ)	ShamAY	1181	0.25766
		الأمثل في تفسير كتاب الله المنزل [ج ٣]	آية الله مكارم الشيرازي	Rafed	2030	0.25766
		تفسير التّحرير والتّنوير [ج ٧]	الشيخ محمّد الطاهر ابن عاشور	Rafed	2911	0.25766
		صفوة الإعتبار بمستودع الأمصار و الأقطار [ج ٢]	السيّد محمّد بيرم الخامس التونسي	Rafed	2396	0.25765
		الموجز في أصول الفقه‏	الشيخ جعفر السبحاني	Masaha	3582	0.25765
		خاتم النبيين صلى الله عليه وآله وسلم	محمد بن أحمد بن مصطفى بن أحمد المعروف بأبي زهرة (المتوفى: 1394هـ)	ShamAY	9800	0.25763
		أدب الطّف أو شعراء الحسين عليه السلام [ج ٤]	جواد شبّر	Rafed	365	0.25763
		كيف تصبح عالما	راغب السرجاني	ShamelaY19	37382	0.25763
		نقض أصول العقلانيين	سليمان بن صالح الخراشي	ShamAY	3935	0.25762
		أصول النحو 1 - جامعة المدينة	مناهج جامعة المدينة العالمية	ShamAY	1648	0.25762
		نفحات القرآن [ج ٦]	آية الله مكارم الشيرازي	Rafed	3817	0.25762
		دروس في علم الأصول [ج ١]	آية الله السيّد محمّد باقر الصدر	Rafed	625	0.2576
		مأساة الزهراء(ع) الجزء الأول	السيد جعفر مرتضى العاملي	Masaha	394	0.2576
		طالب العلم والسيرة الأخلاقية	السيّد عادل العلوي	Rafed	1372	0.25757
		نشأة النحو وتاريخ أشهر النحاة	الشيخ محمد الطنطاوي رحمه الله	ShamAY	7328	0.25756
		عدة المريد الصادق	شهاب الدين أبو العباس أحمد بن أحمد بن محمد بن عيسى البرنسي الفاسي، المعروف بـ زروق (المتوفى: 899هـ)	ShamAY	31741	0.25756
		الانتصار في انفرادات الإمامية	السيد المرتضى	Masaha	978	0.25755
		المقاصد الشافية في شرح الخلاصة الكافية (شرح ألفية ابن مالك)	أبو إسحق إبراهيم بن موسى الشاطبي (المتوفى 790 ه)	ShamelaY19	20562	0.25755
		 كتاب الأزل 	 محمد وفا الكبير 	ABLibrary	8799	0.25753
		معراج الهداية	الدكتور سعيد يعقوب	Rafed	1202	0.25752
		جماليات المفردة القرآنية	أحمد ياسوف	ShamelaY19	37654	0.25752
		النهر الفائق شرح كنز الدقائق	سراج الدين عمر بن إبراهيم بن نجيم الحنفي (ت 1005ه)	Sham19Y	13620	0.25751
		التقريب لحد المنطق والمدخل إليه بالألفاظ العامية والأمثلة الفقهية	أبو محمد علي بن أحمد بن سعيد بن حزم الأندلسي القرطبي الظاهري (المتوفى: 456هـ)	ShamAY	1028	0.25751
		تفسير التّحرير والتّنوير [ج ١٠]	الشيخ محمّد الطاهر ابن عاشور	Rafed	2914	0.25751
		 سند العروة الوثقى - كتاب النكاح 	 الشيخ محمد السند 	ABLibrary	9550	0.2575
		مجلة «المعرفة» السورية	عادل العوا	ShamAY	467	0.2575
		تفسير التّحرير والتّنوير [ج ٦]	الشيخ محمّد الطاهر ابن عاشور	Rafed	2910	0.2575
		دفاع عن الرسول ضد الفقهاء والمحدثين	الكاتب المصري صالح الورداني	Masaha	256	0.25748
		وسيلة الوسائل في شرح الرسائل‏	السيد محمد باقر الطباطبائي اليزدي	Masaha	4840	0.25747
		السنة ومكانتها في التشريع الإسلامي	مصطفى بن حسني السباعي (المتوفى: 1384ه)	ShamelaY19	37639	0.25746
		لكي لا تتنازعوا ..	آيت الله العظمي سيد محمد حسيني شيرازي	Ghbook	7911	0.25746
		 المسالك والممالك 	 أبي عبيد البكري 	ABLibrary	9204	0.25745
		أحكام القرآن [ج ٤]	أبي بكر محمّد بن عبدالله [ ابن العربي ]	Rafed	3221	0.25745
		الميزان في تفسير القرآن [ج ٧]	آية الله السيد محمد حسين الطباطبائي	Rafed	1436	0.25741
		البحر المحيط في التّفسير [ج ٥]	محمّد بن يوسف [ أبي حيّان الأندلسي الغرناطي ]	Rafed	2423	0.2574
		موسوعة الإمام الخوئي - الجزء1	السيد أبو القاسم الموسوي الخوئي	Masaha	1762	0.2574
		 تسليك النفس الى حظيرة القدس 	 العلامة الحلي 	ABLibrary	8383	0.25738
		الحدائق الناضرة [ج ٧]	الشيخ يوسف بن أحمد البحراني [ صاحب الحدائق ]	Rafed	2829	0.25738
		مبادئ الوصول الى علم الاصول	الحسن بن يوسف بن علي المطّهر [ العلامة الحلّي ]	Rafed	126	0.25738
		منبع الحياة و حجية قول المجتهد من الأموات	السيد نعمة الله الجزائري	Masaha	1496	0.25736
		تاريخ الأدب الأندلسي (عصر الطوائف والمرابطين)	دكتور إحسان عباس (المتوفى: 1424هـ)	ShamAY	1015	0.25732
		السنة ومكانتها للسباعي ط المكتب الإسلامي	مصطفى بن حسني السباعي (المتوفى: 1384ه)	ShamelaY19	37638	0.25732
		كيف تصبح عالما	راغب السرجاني	ShamAY	639	0.25731
		دروس للشيخ سلمان العودة	سلمان بن فهد بن عبد الله العودة	ShamAY	7729	0.25731
		كشف المراد في شرح تجريد الاعتقاد	الحسن بن يوسف بن علي المطّهر [ العلامة الحلّي ]	Rafed	3486	0.25729
		أحكام القرآن [ج ١-٢]	عماد الدين بن محمد الطبري [ الكيا الهرّاسي ]	Rafed	3146	0.25727
		بدائع الكلام في تفسير آيات الأحكام	محمد باقر الملكي	Rafed	3974	0.25726
		رسائل السنة والشيعة لرشيد رضا	محمد رشيد بن علي رضا بن محمد شمس الدين بن محمد بهاء الدين بن منلا علي خليفة القلموني الحسيني (المتوفى: 1354هـ)	ShamAY	12723	0.25725
		أسرار الآيات	صدر الدين محمّد بن إبراهيم الشيرازي	Rafed	3291	0.25725
		صفوة الاعتبار بمستودع الأمصار والأقطار  - الجزء1	محمد مصطفى بيرم الخامس	Masaha	4581	0.25725
		 المغني في أبواب التوحيد والعدل 	 القاضي عبد الجبار الهمذاني 	ABLibrary	8631	0.25724
		أصول النحو 1 - جامعة المدينة	مناهج جامعة المدينة العالمية	Sham19Y	11199	0.25722
		 القول المتين في تشيع الشيخ الأكبر 	 الشيخ قاسم الطهراني 	ABLibrary	8905	0.25721
		فلسفة الحج في الاسلام	الشيخ حسن طراد	Rafed	98	0.25721
		نهج الحقّ وكشف الصدق‏	العلامة الحلي	Masaha	4552	0.25721
		 شرح القصيدة النونية المسماة الكافية الشافية في الانتصار للفرقة الناجية 	 ابن قيم الجوزية 	ABLibrary	8460	0.2572
		العلم يدعو للإيمان	كريسى موريسون	ShamAY	4312	0.2572
		الحدائق الناضرة [ج ٦]	الشيخ يوسف بن أحمد البحراني [ صاحب الحدائق ]	Rafed	2827	0.2572
		 سلسلة المسائل الفقهية 	 الشيخ السبحاني 	ABLibrary	9591	0.25719
		الرسائل السياسية	عمرو بن بحر بن محبوب الكناني بالولاء، الليثي، أبو عثمان، الشهير بالجاحظ (المتوفى: 255ه)	Sham19Y	10709	0.25718
		الرسائل السياسية	عمرو بن بحر بن محبوب الكناني بالولاء، الليثي، أبو عثمان، الشهير بالجاحظ (المتوفى: 255هـ)	ShamAY	10709	0.25718
		إرشاد العقول إلى مباحث الأصول - الجزء1	محمد حسين الحاج العاملي	Masaha	683	0.25718
		تحرير المقال في موازنة الأعمال وحكم غير المكلفين في العقبى والمآل	أبو طالب وأبو المجد عقيل بن عطية بن أبي أحمد جعفر بن محمد بن عطية القضاعي الأندلسي الطرطوشي، ثم المراكشي (المتوفى: 608ه)	ShamelaY19	22712	0.25718
		نصائح الهدى والدين	الشيخ محمد جواد البلاغي	Masaha	449	0.25717
		الخلافة	محمد رشيد بن علي رضا بن محمد شمس الدين بن محمد بهاء الدين بن منلا علي خليفة القلموني الحسيني (المتوفى: 1354هـ)	ShamAY	9682	0.25716
		مفاهيم القرآن [ج ٧]	الشيخ جعفر السبحاني	Rafed	348	0.25716
		فرائد الأصول - الجزء1	الشيخ مرتضى الأنصاري	Masaha	4022	0.25715
		خاتم النبيين صلى الله عليه وآله وسلم	محمد بن أحمد بن مصطفى بن أحمد المعروف بأبي زهرة (المتوفى: 1394ه)	Sham19Y	9800	0.25714
		الله لعباس محمود العقاد	عباس محمود العقاد	ShamAY	35499	0.25714
		رسالة الملائكة - نشرها الميمني كملحق في آخر كتابه (أبو العلاء وما إليه)	أحمد بن عبد الله بن سليمان بن محمد بن سليمان، أبو العلاء المعري، التنوخي (المتوفى: 449هـ)	ShamAY	12817	0.25712
		من هدى القرآن [ج ١١]	السيّد محمّد تقي المدرّسي	Rafed	2133	0.2571
		القواعد و الفوائد - الجزء1	الشهيد الأول	Masaha	1078	0.2571
		بحر الفوائد - الجزء2	الميرزا محمد حسن الآشتياني	Masaha	1803	0.25707
		مناهج الأحكام في مسائل الحلال و الحرام	الميرزا القمي	Masaha	1540	0.25707
		 أنوار النبي ( ص ) أسرارها وأنواعها 	 ابن سبعين 	ABLibrary	7431	0.25706
		القوانين المحكمة في الأصول [ج ٤]	الميرزا أبو القاسم القمّي	Rafed	2626	0.25706
		البحر المحيط في أصول الفقه - العلمية	الزركشي، بدر الدين	ShamAY	34187	0.25703
		مواهب الفتّاح في شرح تلخيص المفتاح [ج ١]	أبي العبّاس أحمد بن محمّد بن محمّدابن يعقوب المغربي	Rafed	2113	0.25703
		المرتجل في شرح الجمل لابن الخشاب	أبو محمد عبد الله بن أحمد بن أحمد بن أحمد ابن الخشاب (492 - 567 هـ)	ShamAY	38977	0.25702
				ShamAY	38958	0.25702
		البرهان في وجوه البيان (نشر من قبل باسم نقد النثر لقدامة بن جعفر)	أبو الحسين إسحاق بن إبراهيم بن سليمان بن وهب الكاتب	ShamelaY19	20986	0.25702
		نزهة النظر في توضيح نخبة الفكر في مصطلح أهل الأثر	أبو الفضل أحمد بن علي بن محمد بن أحمد بن حجر العسقلاني (المتوفى: 852هـ)	ShamAY	1565	0.25701
		أصول الفقه - الجزء1	الشيخ حسين الحلي	Masaha	2387	0.25701
		الميزان في تفسير القرآن [ج ١٤]	آية الله السيد محمد حسين الطباطبائي	Rafed	1447	0.25699
		 معرفة المعاد 	 السيد محمد حسين الطهراني 	ABLibrary	8872	0.25697
		الإعراب المحيط من تفسير البحر المحيط «هو إعراب القرآن مستلًّا من (البحر المحيط) لأبي حيان الغرناطي (ت 745 هـ) »	د. ياسين جاسم المحيميد	ShamAY	2505	0.25697
		تفسير الزمخشري = الكشاف عن حقائق غوامض التنزيل	أبو القاسم محمود بن عمرو بن أحمد، الزمخشري جار الله (المتوفى: 538هـ)	ShamAY	23627	0.25696
		 الفكر الخالد في بيان العقائد 	 الشيخ السبحاني 	ABLibrary	8527	0.25695
		 الشيخ محيي الدين بن عربي ترجمة حياته من كلامه 	 محمود محمود الغراب 	ABLibrary	8910	0.25691
		رسالة الغفران	أحمد بن عبد الله بن سليمان بن محمد بن سليمان، أبو العلاء المعري، التنوخي (المتوفى: 449هـ)	ShamAY	1589	0.25691
		 أقوم المسالك في معرفة أحوال الممالك 	 خير الدين التونسي 	ABLibrary	8934	0.2569
		مقالات الطناحي (صفحات في التراث والتراجم واللغة والأدب) = مقالات العلامة الدكتور محمود محمد الطناحي	محمود محمد الطناحي، أبو أروى (المتوفى: 1419 ه)	ShamelaY19	148533	0.2569
		موصل الطلاب	الشيخ خالد الأزهري	Rafed	2026	0.25689
		المعتصر من شرح مختصر الأصول من علم الأصول	أبو المنذر محمود بن محمد بن مصطفى بن عبد اللطيف المنياوي	ShamAY	1117	0.25688
		عون الحنّان في شرح الأمثال في القرآن	الشيخ علي أحمد عبد العال الطهطاوي	Rafed	3960	0.25687
		الخطر اليهودي بروتوكولات حكماء صهيون	محمد خليفة التونسي	ShamelaY19	38100	0.25686
		فرج المهموم - معرفة نهج الحلال من علم النجوم	السيد علي بن موسى بن طاووس	Masaha	1035	0.25685
		شرح المعالم في أصول الفقه	ابن التلمساني عبد الله بن محمد علي شرف الدين أبو محمد الفهري المصري (المتوفى: 644 ه)	ShamelaY19	145168	0.25679
		 سند العروة الوثقى ( كتاب الطهارة ) 	 الشيخ محمد السند 	ABLibrary	9548	0.25675
		معجم مقاليد العلوم في الحدود والرسوم	عبد الرحمن بن أبي بكر، جلال الدين السيوطي (المتوفى: 911هـ)	ShamAY	7039	0.25673
		نظريّة المعرفة	الشيخ حسن محمد مكي العاملي	Rafed	3494	0.25673
		النجاة في القيامة في تحقيق أمر الإمامة	ميثم بن علي بن ميثم البحراني	Rafed	3523	0.25673
		كتاب المكاسب (للشيخ الأنصاري) - الجزء1	الشيخ مرتضى الأنصاري	Masaha	822	0.25673
		العراق في أحاديث وآثار الفتن	أبو عبيدة مشهور بن حسن بن محمود آل سلمان	ShamAY	3346	0.25672
		الحاشية على مدارك الأحكام - الجزء1	الوحيد البهبهاني	Masaha	1446	0.25672
		 الإنصاف في مسائل دام فيها الخلاف 	 الشيخ السبحاني 	ABLibrary	9556	0.25669
		الكشاف عن حقائق غوامض التنزيل وعيون الأقاويل فى وجوه التأويل	العلامة جار الله أبو القاسم محمود بن عمر الزمخشرى (467 ـ 538 هـ)	ShamAY	34070	0.25669
		علم التفسير	عبدالمنعم احمد النمر	Ghbook	8748	0.25669
		 الياقوت في علم الكلام 	 ابو اسحاق ابراهيم بن نوبخت 	ABLibrary	8680	0.25666
		نزهة النظر في توضيح نخبة الفكر في مصطلح أهل الأثر	أحمد بن علي بن محمد بن حجر العسقلاني (773 - 852 ه)	ShamelaY19	37456	0.25665
		الاعجاز العلمي في القرآن	الدكتور السيد الجميلي	Rafed	3244	0.25663
		الكشّاف [ج ٤]	محمود بن عمر الزمخشري	Rafed	3124	0.25662
		 المنقذ من التقليد 	 الشيخ سديد الدين الحمصي الرازي 	ABLibrary	8648	0.25661
		زبدة البيان في أحكام القرآن	المقدس الأردبيلي	Masaha	1168	0.2566
		 الفقه ومسائل طبية 	 الشيخ محمد آصف المحسني 	ABLibrary	9736	0.25658
		نور وهداية	علي بن مصطفى الطنطاوي (المتوفى: 1420هـ)	ShamAY	31960	0.25658
		رحلة العبدري	أبو عبدالله العبدري	Rafed	2452	0.25657
		 ينابيع الأحكام في معرفة الحلال والحرام 	 السيد علي الموسوي القزويني 	ABLibrary	9389	0.25656
		 أبكار الأفكار في أصول الدين 	 سيف الدين الآمدي 	ABLibrary	8316	0.25656
		دروس للشيخ عبد الله بن عبد الرحمن الجبرين	عبد الله بن عبد الرحمن بن عبد الله بن جبرين	ShamAY	897	0.25656
		تفسير الراغب الأصفهاني	أبو القاسم الحسين بن محمد المعروف بالراغب الأصفهانى (المتوفى: 502هـ)	ShamAY	1641	0.25656
		ارشاد الطالبين الى نهج المسترشدين	جمال الدين مقداد بن عبد الله السيوري الحلّي	Rafed	3450	0.25656
		العرف الشذي شرح سنن الترمذي	محمد أنور شاه بن معظم شاه الكشميري الهندي (المتوفى: 1353هـ)	ShamAY	119	0.25655
		درة التنزيل وغرة التأويل	أبو عبد الله محمد بن عبد الله الأصبهاني المعروف بالخطيب الإسكافي (المتوفى: 420هـ)	ShamAY	1340	0.25654
		فتاوى دار الإفتاء المصرية	دار الإفتاء المصرية	ShamAY	432	0.25654
		بحار الأنوار [ج ٣]	الشيخ محمّد باقر بن محمّد تقي المجلسي	Rafed	505	0.25654
		المدرّس الأفضل [ج ٧]	الشيخ محمّد علي المدرّس الأفغاني	Rafed	2696	0.25653
		 دفاع عن الرسول ضد الفقهاء والمحدثين 	 صالح الورداني 	ABLibrary	881	0.25651
		النحو الوافي	عباس حسن (المتوفى: 1398هـ)	ShamAY	10641	0.25651
		 الحاكمية في الإسلام 	 السيد محمد مهدي الموسوي الخلخالي 	ABLibrary	9628	0.2565
		معالم الدين و ملاذ المجتهدين (قسم الفقه) - الجزء1	جمال الدين الحسن بن زين الدين العاملي	Masaha	1209	0.2565
		روضة الناظر وجنة المناظر في أصول الفقه على مذهب الإمام أحمد بن حنبل	أبو محمد موفق الدين عبد الله بن أحمد بن محمد بن قدامة الجماعيلي المقدسي ثم الدمشقي الحنبلي، الشهير بابن قدامة المقدسي (المتوفى: 620هـ)	ShamAY	12010	0.25649
		البحر المحيط في أصول الفقه	أبو عبد الله بدر الدين محمد بن عبد الله بن بهادر الزركشي (المتوفى: 794هـ)	ShamAY	21593	0.25648
		شرح مقدمة في أصول التفسير لابن تيمية	د. مُساعِدُ بن سُلَيْمَان بن نَاصِر الطَّيَّار	ShamAY	31802	0.25646
		نظرات معاصرة في القرآن الكريم	الدكتور محمد حسين علي الصّغير	Rafed	225	0.25646
		البحر المحيط في التفسير	أبو حيان محمد بن يوسف بن علي بن يوسف بن حيان أثير الدين الأندلسي (المتوفى: 745هـ)	ShamAY	23591	0.25644
		معيار العلم في فن المنطق	أبو حامد محمد بن محمد الغزالي الطوسي (المتوفى: 505هـ)	ShamAY	26575	0.25643
		نفح الطّيب [ج ٢]	الشيخ أحمد بن محمد المقري التلمساني	Rafed	2788	0.25643
		تفسير التّحرير والتّنوير [ج ١٣]	الشيخ محمّد الطاهر ابن عاشور	Rafed	2917	0.25643
		حاشية التوضيح والتصحيح لمشكلات كتاب التنقيح على شرح تنقيح الفصول في الأصول (لشهاب الدين القرافي ت 684 ه)	محمد الطاهر بن عاشور (المتوفى: 1393 ه)	ShamelaY19	150938	0.2564
		مجموع رسائل الإمام المنصور بالله عبدالله بن حمزه [ج ٢]	المنصور بالله عبدالله بن حمزة	Rafed	3420	0.25636
				ShamAY	32600	0.25635
		الأساس في التفسير	سعيد حوّى (المتوفى 1409 هـ)	ShamAY	32601	0.25635
		أصل الشيعة وأصولها	الشيخ محمد حسين كاشف الغطاء	Masaha	142	0.25635
		ينابيع الأحكام في معرفة الحلال و الحرام - الجزء1	السيد علي الموسوي القزويني	Masaha	1760	0.25634
		الإعلام بفوائد عمدة الأحكام	ابن الملقن سراج الدين أبو حفص عمر بن علي بن أحمد الشافعي المصري (المتوفى: 804هـ)	ShamAY	31785	0.25633
		في مهب المعركة	مالك بن الحاج عمر بن الخضر بن نبي (المتوفى: 1393هـ)	ShamAY	1151	0.25633
		موسوعة كشّاف إصطلاحات الفنون والعلوم [ج ١]	محمّد علي التهانوي	Rafed	1548	0.25633
		التفسير الحديث [مرتب حسب ترتيب النزول]	محمد عزة دروزة	Sham19Y	23603	0.25632
		 دفع شبه التشبيه بأكف التنزيه 	 ابن الجوزي 	ABLibrary	995	0.25629
		رحلة أبي طالب خان إلى العراق و أوروبة	أبو طالب بن محمد الأصفهاني	Masaha	4459	0.25627
		الختّارين المجددين وإخوان الشياطين	أحمد بن محمد السعيد العزيزي	ShamAY	33492	0.25626
		درج الدرر في تفسير الآي والسور ط الحكمة	أبو بكر عبد القاهر بن عبد الرحمن بن محمد الفارسي الأصل، الجرجاني الدار (المتوفى: 471ه)	ShamelaY19	122173	0.25626
		علوم البلاغة البيان والمعاني والبديع	أحمد مصطفى المراغي	Rafed	2618	0.25624
		شرح درة الغواص في أوهام الخواص (مطبوع ضمن «درة الغواص وشرحها وحواشيها وتكملتها»)	أحمد بن محمد الخفاجي المصري	ShamelaY19	29600	0.25624
		 شرح المقاصد 	 التفتازاني 	ABLibrary	8464	0.25621
