automatic URI	Proposed URI	bookTitle	authorName	collection	id	tfidf
		نقد الشعر	قدامة بن جعفر بن قدامة بن زياد البغدادي، أبو الفرج (المتوفى: 337هـ)	ShamAY	28181	0.25465
		الآيات البينات في عدم سماع الأموات على مذهب الحنفية السادات	نعمان بن محمود الألوسي (المتوفى: 1317هـ)	ShamAY	247	0.25465
		 شرح أصول الكافي 	 صدر الدين محمد الشيرازي ( صدر المتألهين ) 	ABLibrary	7915	0.25464
		شرح كتاب سيبويه	أبو سعيد السيرافي الحسن بن عبد الله بن المرزبان (المتوفى: 368 هـ)	ShamAY	32582	0.25464
		قالوا عن الإسلام	عماد الدين خليل	ShamAY	35547	0.25464
		فقه النصر والتمكين في القرآن الكريم	علي محمد محمد الصلابي	ShamAY	36740	0.25464
		دراسة في السيرة	عماد الدين خليل	ShamAY	9802	0.25463
		التنبيه على مبادئ التوجيه - قسم العبادات	أبو الطاهر إبراهيم بن عبد الصمد بن بشير التنوخي المهدوي (المتوفى: بعد 536هـ)	ShamAY	31684	0.25462
		 شرح حكم الشيخ الأكبر 	 حسن بن موسى القادري 	ABLibrary	8861	0.2546
		 كلمات سديدة في مسائل جديدة 	 الشيخ محمد المؤمن القمي 	ABLibrary	9735	0.2546
		تعليقة على معالم الاصول [ج ١]	السيّد علي الموسوي القزويني	Rafed	1367	0.2546
		مصباح الفقيه [ج ١٠]	الشيخ آقا رضا الهمداني	Rafed	1873	0.25458
		البرنس في باريس‏	محمد مقداد الورتتاني	Masaha	4641	0.25457
		المنطلق	محمد أحمد الراشد	ShamAY	33335	0.25455
		فتاوى حديثية - سعد آل حميد	سعد الحميد	ShamAY	37281	0.25454
		البلاغة 2 - المعاني - جامعة المدينة	مناهج جامعة المدينة العالمية	ShamAY	1664	0.25454
		مجمع الفرائد في الأصول‏	علي فريدة الإسلام الكاشاني‏	Masaha	4280	0.25454
		أشهد أنّ عليّاً وليّ الله بين الشرعيّة والابتداع	السيد علي الشهرستاني	Rafed	3847	0.25453
		عليّ المرتضى نقطة باء البسملة	السيّد عادل العلوي	Rafed	1582	0.25453
		قاعدة لا ضرر ولا ضرار	آية الله العظمى السيد علي السيستاني	Rafed	209	0.25453
		بغية المرتاد في الرد على المتفلسفة والقرامطة والباطنية	تقي الدين أبو العباس أحمد بن عبد الحليم بن عبد السلام بن عبد الله بن أبي القاسم بن محمد ابن تيمية الحراني الحنبلي الدمشقي (المتوفى: 728ه)	Sham19Y	11071	0.25452
		التفسير الحديث [مرتب حسب ترتيب النزول]	محمد عزة دروزة	ShamAY	23603	0.25452
		الهداية في شرح الكفاية	الشيخ عبد الحسين التستري الكاظميني	Masaha	3594	0.2545
		 دور أهل البيت ( ع ) في بناء الجماعة الصالحة 	 السيد محمد باقر الحكيم 	ABLibrary	972	0.25446
		التبيان في أيمان القرآن ط عالم الفوائد	أبو عبد الله محمد بن أبي بكر بن أيوب ابن قيم الجوزية (691 - 751)	ShamAY	38512	0.25443
		عصمة الانبياء في القرآن الكريم	الشيخ جعفر السبحاني	Masaha	341	0.25442
		إيضاح المسالك إلى قواعد الإمام مالك (مع دراسة لحياة المؤلف وآثاره وعصره)	أبو العباس أحمد بن يحيى الونشريسى	ShamelaY19	132374	0.25442
		الفائق في غريب الحديث‌  - الجزء1	ابو القاسم محمود بن عمر الزمخشري	Masaha	3492	0.25441
		الرسائل الأحمديّة [ج ٣]	الشيخ أحمد آل طعّان	Rafed	1358	0.2544
		 أنوار الفقاهة ( كتاب البيع ) 	 الشيخ ناصر مكارم الشيرازي 	ABLibrary	9676	0.25438
		بدائع الكلام في تفسير آيات الأحكام	الشيخ محمد باقر الملكي الميانجي	Masaha	5005	0.25437
		معجم متن اللغة (موسوعة لغوية حديثة)	أحمد رضا (عضو المجمع العلمي العربي بدمشق)	ShamAY	38979	0.25436
				ShamAY	38974	0.25436
		البحث اللغوي عند العرب	د أحمد مختار عبد الحميد عمر	ShamAY	8670	0.25436
		شرح درة الغواص في أوهام الخواص (مطبوع ضمن «درة الغواص وشرحها وحواشيها وتكملتها»)	أحمد بن محمد الخفاجي المصري	ShamAY	38970	0.25436
		التّفسير الحديث [ج ٨]	محمّد عزّة دروزة	Rafed	3761	0.25436
		جامع المقاصد في شرح القواعد [ج ١]	الشيخ عليّ بن الحسين بن عبد العالي الكركي	Rafed	545	0.25434
		فتاوى الأزهر	مجموعة من المؤلفين	ShamAY	37642	0.25433
		 شرح دعاء الصباح 	 حاج ملا هادي السبزواري 	ABLibrary	8866	0.25432
		 نهاية الأفكار ونزهة الأبصار 	 عبد الله بن قاسم الحريري الإشبيلي البغدادي 	ABLibrary	9885	0.25432
		كتاب التّعارض	آية الله السيّد محمّد كاظم الطباطبائي اليزدي	Rafed	3718	0.25431
		غاية الأصول في شرح كفاية الأصول‏	الشيخ علي آغا ميري الدزفولي	Masaha	4018	0.25431
		الحدائق الناضرة [ج ١١]	الشيخ يوسف بن أحمد البحراني [ صاحب الحدائق ]	Rafed	2847	0.2543
		الأنوار اللوامع في شرح مفاتيح الشرائع - الجزء10-1	الشيخ حسين آل عصفور	Masaha	1502	0.25429
		تفسير غرائب القرآن ورغائب الفرقان [ج ١]	نظام الدين الحسن بن محمّد بن حسين القمي النيسابوري	Rafed	1792	0.25426
		 جواهر الكلام في ثوبه الجديد 	 الشيخ الجواهري 	ABLibrary	9371	0.25425
		ديوان المبتدأ والخبر في تاريخ العرب والبربر ومن عاصرهم من ذوي الشأن الأكبر	عبد الرحمن بن محمد بن محمد، ابن خلدون أبو زيد، ولي الدين الحضرمي الإشبيلي (المتوفى: 808هـ)	ShamAY	12320	0.25425
		المسائل البصريات	أبو علي الفارسي (ت 377 هـ)	ShamAY	32669	0.25425
		مباني الفقيه‏	الشيخ محمد تقي الفقيه	Masaha	4270	0.25425
		الفكر العربي في عصر النهضة 1798 - 1939	ألبرت حوراني (المتوفى: 1413 ه)	ShamelaY19	150935	0.25424
		دو فصلنامه « ميقات الحج »	محمد محمدي ري شهري	Ghbook	3479	0.25424
		الإنصاف في مسائل الخلاف بين النحويين: البصريين والكوفيين	عبد الرحمن بن محمد بن عبيد الله الأنصاري، أبو البركات، كمال الدين الأنباري (المتوفى: 577هـ)	ShamAY	7362	0.25423
		أحكام القرآن [ج ٢]	أبي بكر محمّد بن عبدالله [ ابن العربي ]	Rafed	3219	0.25423
		إشكالية الواقع والتحولات الجديدة في الرواية العربية	دريد يحيى الخواجة	ShamAY	34525	0.25422
		شرح رسالة أبي داود لأهل مكة	عبد الكريم الخضير	ShamelaY19	23424	0.25422
		 عنقا مغرب في ختم الأولياء وشمس المغرب 	 ابن عربي 	ABLibrary	8734	0.25421
		الأدب العربي المعاصر في مصر	أحمد شوقي عبد السلام ضيف الشهير بشوقي ضيف (المتوفى: 1426هـ)	ShamAY	9981	0.25421
		مغني اللبيب عن كتب الأعاريب	عبد الله بن يوسف بن أحمد بن عبد الله ابن يوسف، أبو محمد، جمال الدين، ابن هشام (المتوفى: 761هـ)	ShamAY	6972	0.25421
		تعريف بشروح الكتب الستة	أبو عبد العزيز الحربي	ShamAY	35959	0.2542
		المقابسات	أبو حيان التوحيدي، علي بن محمد بن العباس (المتوفى: نحو 400هـ)	ShamAY	10916	0.25419
		الميزان في تفسير القرآن [ج ١٣]	آية الله السيد محمد حسين الطباطبائي	Rafed	1446	0.25419
		أمالي ابن الحاجب	عثمان بن عمر بن أبي بكر بن يونس، أبو عمرو جمال الدين ابن الحاجب الكردي المالكي (المتوفى: 646هـ)	ShamAY	31958	0.25416
		تلخيص البيان في مجازات القرآن	الشريف الرضي	Masaha	2328	0.25416
		بحر الفوائد في شرح الفرائد - الجزء1	الشيخ محمد حسن الآشتياني	Masaha	3332	0.25414
		شرح الإلمام بأحاديث الأحكام	تقي الدين أبو الفتح محمد بن علي بن وهب بن مطيع القشيري، المعروف بابن دقيق العيد (المتوفى: 702 هـ)	ShamAY	32554	0.25412
		 الكشكول 	 الشيخ البهائي العاملي 	ABLibrary	8844	0.25411
		إعراب القرآن لابن سيده	ابن سيده	ShamAY	36821	0.25411
		الأخلاق في القرآن [ج ١]	آية الله مكارم الشيرازي	Rafed	3948	0.2541
		تفسير الشريف المرتضى [ج ٣]	الناشر: شركة الأعلمي للمطبوعات	Rafed	3798	0.2541
		الروضة البهية (حاشية سلطان العلماء) - الجزء1	الشهيد الثاني	Masaha	1142	0.25409
		قلائد الفرائد  - الجزء1	الآخوند الشيخ غلام رضا القمي	Masaha	4036	0.25409
		الشهب الثاقبه (تلخيص الصوارم المهرقه في رد الصواعق المحرقه)	نورالله تستري	Ghbook	11353	0.25409
		شرح الحلقة الأولى	ناجي طالب‏ آل فقيه العاملي	Masaha	3982	0.25407
		تهذيب الأصول - الجزء1	السيد عبد الأعلى السبزواري	Masaha	3191	0.25406
		تهذيب الأصول - الجزء1	السيد عبد الأعلى السبزواري	Masaha	2678	0.25406
		النجاة في القيامة في تحقيق أمر الإمامة	الشيخ ميثم بن علي البحراني	Masaha	433	0.25406
		الإنصاف في مسائل الخلاف بين النحويين: البصريين والكوفيين	عبد الرحمن بن محمد بن عبيد الله الأنصاري، أبو البركات، كمال الدين الأنباري (المتوفى: 577ه)	Sham19Y	7362	0.25405
		القواعد والفوائد [ج ١]	محمّد بن جمال الدّين مكّي العاملي الجزيني [ الشهيد الأول ]	Rafed	1374	0.25404
		 من البحر المتوسط إلى الخليج 	 ماكس فرايهر فون اوپنهايم 	ABLibrary	9223	0.25403
		 الرد الجميل لإلهية عيسى بصريح الإنجيل 	 الغزالي 	ABLibrary	8425	0.25402
		الجديد في الحكمة	سعيد بن منصور بن كمونة	ShamAY	33849	0.25402
		اتحاف السادة المتقين بشرح إحياء علوم الدين	محمد بن محمد بن الحسيني الزبيدي الشهير بمرتضى	ShamAY	35035	0.25402
		محك النظر - دار الفكر	أبو حامد محمد بن محمد الغزالي الطوسي (المتوفى: 505هـ)	ShamAY	34794	0.25401
		الإبهاج في شرح المنهاج ((منهاج الوصول إلي علم الأصول للقاضي البيضاوي المتوفي سنه 785هـ))	تقي الدين أبو الحسن علي بن عبد الكافي بن علي بن تمام بن حامد بن يحيي السبكي وولده تاج الدين أبو نصر عبد الوهاب	ShamAY	11727	0.25398
		 رحلة ديلاوالية إلى العراق 	 پيترو دلاواله 	ABLibrary	9121	0.25397
		نزهة النظر في توضيح نخبة الفكر في مصطلح أهل الأثر	أبو الفضل أحمد بن علي بن محمد بن أحمد بن حجر العسقلاني (المتوفى: 852هـ)	ShamAY	12115	0.25396
		 تلخيص الشافي 	 الشيخ الطوسي 	ABLibrary	8393	0.25395
		الأخلاق في القرآن [ج ٢]	آية الله مكارم الشيرازي	Rafed	3949	0.25395
		الإلهيّات على هدى الكتاب والسنّة والعقل	الشيخ حسن محمد مكي العاملي	Masaha	1663	0.25394
		الحدائق الناضره في احكام العتره الطاهره	يوسف بحراني	Ghbook	10764	0.25394
		مطارح الأنظار [ج ٤]	الميرزا أبو القاسم الكلانتري الطهراني	Rafed	998	0.25393
		مذاهب فكرية معاصرة	محمد بن قطب بن إبراهيم	ShamAY	7378	0.25391
		مغنى اللبيب [ج ٢]	أبي محمّد عبد الله جمال الدين بن يوسف بن أحمد بن عبد الله بن هشام الأنصاري المصري	Rafed	1844	0.25391
		منتهى المطلب في تحقيق المذهب - الجزء1	العلامة الحلي	Masaha	1212	0.25389
		أجوبة مسائل و رسائل في مختلف فنون المعرفة	ابن إدريس الحلي	Masaha	1009	0.25388
		معراج الهداية	د. سعيد يعقوب	Masaha	383	0.25388
		تفسير آيات الأحكام للسايس	محمد علي السايس الأستاذ بالأزهر الشريف	ShamelaY19	23599	0.25386
		مختصر الأمثل في تفسير كتاب الله المنزل [ج ١]	آية الله مكارم الشيرازي	Rafed	3859	0.25384
		الأمثل في تفسير كتاب الله المنزل [ج ١٨]	آية الله مكارم الشيرازي	Rafed	2065	0.25383
		الفوائد المشوّق إلى علوم القرآن وعلم البيان	شمس الدّين محمّد بن أبي بكر بن أيّوب الزّرعي [ ابن قيّم الجوزيّة ]	Rafed	864	0.25382
		الموسوعة القرآنية، خصائص السور	جعفر شرف الدين	ShamelaY19	21769	0.25382
		من هدى القرآن [ج ٧]	السيّد محمّد تقي المدرّسي	Rafed	2109	0.25381
		درة الغواص في أوهام الخواص	القاسم بن علي بن محمد بن عثمان، أبو محمد الحريري البصري (المتوفى: 516هـ)	ShamAY	6920	0.2538
		محاضرات في أصول الفقه [ج ٤٣]	آية الله الشيخ محمّد إسحاق الفيّاض	Rafed	924	0.2538
		مرعاة المفاتيح شرح مشكاة المصابيح	أبو الحسن عبيد الله بن محمد عبد السلام بن خان محمد بن أمان الله بن حسام الدين الرحماني المباركفوري (المتوفى: 1414هـ)	ShamAY	8862	0.25379
		أدب الطّف أو شعراء الحسين عليه السلام [ج ١٠]	جواد شبّر	Rafed	384	0.25379
		شرح  نهج البلاغه (ابن  ميثم)	كمال الدين ميثم بن علي بن ميثم ابن ميثم بحراني	Ghbook	15955	0.25379
		 الكليات في الطب 	 ابن رشد 	ABLibrary	9877	0.25378
		الميزان في تفسير القرآن - الجزء1	السيد محمد حسين الطباطبائي	Masaha	51	0.25378
		رَي الظَّمآن في بَيَانِ القُرآن	فهد الحبيشي	ShamAY	36811	0.25377
		تفسير البحر المحيط ـ موافق للمطبوع	محمد بن يوسف الشهير بأبي حيان الأندلسي دار النشر: دار الكتب العلمية - لبنان/ بيروت - 1422 هـ - 2001 م	ShamAY	34064	0.25377
		قضايا الدعوة الإسلامية من اليقظة إلى الصحوة	أنور الجندي	ShamAY	33414	0.25375
		الرأي السديد في الاجتهاد والتقليد والاحتياط والقضاء / تقريرات	الشيخ غلام رضا عرفانيان اليزدي	Masaha	3451	0.25372
		الرسائل للجاحظ	عمرو بن بحر بن محبوب الكناني بالولاء، الليثي، أبو عثمان، الشهير بالجاحظ (المتوفى: 255هـ)	ShamAY	10428	0.2537
		الهداية في الأصول [ج ١]	آية الله الشيخ حسن الصافي الإصفهاني	Rafed	3830	0.2537
		معالم الفتن - الجزء1	سعيد أيوب	Masaha	423	0.25369
		 دليل تحرير الوسيلة ( ولاية الفقيه ) 	 علي أكبر السيفي المازندراني 	ABLibrary	892	0.25368
		 الوصلة إلى الحبيب في وصف الطيبات والطيب 	 عمر بن أحمد العقيلي الحلبي ( ابن العديم ) 	ABLibrary	9892	0.25366
		 النفحة المسكية في الرحلة المكية 	 عبد الله بن حسين السويدي البغدادي 	ABLibrary	9307	0.25366
		جلاء العينين في محاكمة الأحمدين	نعمان بن محمود بن عبد الله، أبو البركات خير الدين، الآلوسي (المتوفى: 1317هـ)	ShamAY	9943	0.25366
		 كتاب القضاء ( ط . ج ) 	 ميرزا محمد حسن الآشتياني 	ABLibrary	9394	0.25365
		درء القول القبيح بالتحسين والتقبيح	سليمان بن عبد القوي بن الكريم الطوفي الصرصري، أبو الربيع، نجم الدين (المتوفى: 716 ه)	ShamelaY19	148531	0.25365
		رحلتي من الظلمات إلى النّور	السيد عبد الكريم هاشمي نجاد	Rafed	1396	0.25364
		دَرْجُ الدُّرر في تَفِسيِر الآيِ والسُّوَر	أبو بكر عبد القاهر بن عبد الرحمن بن محمد الفارسي الأصل، الجرجاني الدار (المتوفى: 471هـ)	ShamAY	31694	0.25363
		شرح رسالة أبي داود لأهل مكة	عبد الكريم الخضير	ShamAY	141	0.25362
		تاريخ العرب القديم	توفيق برو	ShamAY	11084	0.2536
		الإمامة والقيادة	الدكتور احمد عزّ الدين	Rafed	8	0.25358
		مزيل اللبس	السيد محمد مهدي الخرسان	Masaha	521	0.25358
		الفلاكة والمفلوكون	أحمد بن علي بن عبد الله، شهاب الدين الدلجي المصري (المتوفى: 838ه)	Sham19Y	36075	0.25357
		 جواهر النصوص في حل كلمات الفصوص 	 الشيخ عبد الغني النابلسي 	ABLibrary	8854	0.25356
		خَصائِصُ المنْهَجِ الإسلاميِّ في القرآن الكريم	علي بن نايف الشحود	ShamAY	357	0.25356
		أوضاع المرأة المسلمة ودورها الإجتماعي من منظور إسلامي	الشيخ حسن الجواهري	Rafed	1565	0.25355
		مناهج البحث في اللغة	تمام حسان	ShamAY	11540	0.25354
		تفسير المراغي [ج ٣٠]	أحمد مصطفى المراغي	Rafed	1707	0.25354
		الكافي في الفقه	أبي الصّلاح تقيّ بن نجم الحلبي	Rafed	1312	0.25353
		البدء والتاريخ	المطهر بن طاهر المقدسي (المتوفى: نحو 355ه)	Sham19Y	12318	0.25352
		مرعاة المفاتيح شرح مشكاة المصابيح	أبو الحسن عبيد الله بن محمد عبد السلام بن خان محمد بن أمان الله بن حسام الدين الرحماني المباركفوري (المتوفى: 1414ه)	Sham19Y	8862	0.25352
		الاجتهاد والتقليد وتقليد غير الأئمة الأربعة		ShamAY	37600	0.25352
		 نظرية الحكم في الإسلام 	 الشيخ محسن الأراكي 	ABLibrary	9531	0.25351
		سرّ صناعة الإعراب [ج ٢]	أبي الفتح عثمان بن جنّي	Rafed	2074	0.25351
		أضواء على عقائد الشيعة الإماميّة وتأريخهم	الشيخ جعفر السبحاني	Rafed	3659	0.2535
		نشر البنود على مراقي السعود	عبد الله بن إبراهيم العلوي الشنقيطي	ShamelaY19	20892	0.2535
		منار الهدى في النصّ على إمامة الأئمّة الإثني عشر	الشيخ علي البحراني	Rafed	3574	0.25348
		 دلالة الحائرين 	 ابن ميمون 	ABLibrary	8420	0.25347
		الفوائد المنتقاة من حديث مثل القائم	عبد الآخر الغنيمي	ShamAY	35978	0.25347
		مصطلحات الفقه	الشيخ علي المشكيني	Masaha	2313	0.25347
		 رسالة الصلاة في المشكوك 	 ميرزا محمد حسين النائيني 	ABLibrary	9408	0.25346
		تاج العروس [ج ١]	محبّ الدين أبي فيض السيد محمّد مرتضى الحسيني الواسطي الزبيدي الحنفي	Rafed	1464	0.25346
		التبيان في أيمان القرآن ط عالم الفوائد	أبو عبد الله محمد بن أبي بكر بن أيوب ابن قيم الجوزية (691 - 751)	ShamelaY19	18337	0.25344
		مقالة في تحقيق إقامة الحدود في هذه الأعصار	السيد الشفتي	Masaha	1582	0.25343
		من حقي أن أكون شيعية	السيدة أم محمد علي المعتصم	Masaha	437	0.25343
		واقعنا المعاصر	الواحدي :: محمد قطب	ShamAY	33331	0.25341
		البحر المحيط في التّفسير [ج ٧]	محمّد بن يوسف [ أبي حيّان الأندلسي الغرناطي ]	Rafed	2425	0.25341
		التّفسير القرآني للقرآن [ج ١٠]	عبدالكريم الخطيب	Rafed	3352	0.25341
		تفسير المراغي [ج ١٢]	أحمد مصطفى المراغي	Rafed	1682	0.25341
		حجة الله البالغة	أحمد بن عبد الرحيم بن الشهيد وجيه الدين بن معظم بن منصور المعروف بـ «الشاه ولي الله الدهلوي» (المتوفى: 1176هـ)	ShamAY	773	0.2534
		من وحي الإسلام [ج ٢]	الشيخ حسن طراد	Rafed	147	0.2534
		شرح تنقيح الفصول	أبو العباس شهاب الدين أحمد بن إدريس بن عبد الرحمن المالكي الشهير بالقرافي (المتوفى: 684ه)	ShamelaY19	21813	0.2534
		 دعوة الأطباء 	 ابن بطلان ( ابن عبدون ) 	ABLibrary	9862	0.25339
		 كتاب القضاء ( ط . ج ) 	 ميرزا محمد حسن الآشتياني 	ABLibrary	9393	0.25338
		عبد الله بن الصديق الغماري الحافظ الناقد	د. فاروق حمادة	ShamAY	38600	0.25338
		روح المعاني في تفسير القرآن العظيم والسبع المثاني	محمود الألوسي أبو الفضل	ShamAY	34055	0.25338
		سيدالمرسلين صلي الله عليه و آله	آيت الله العظمي جعفر سبحاني	Ghbook	10441	0.25338
		محمد فوزي فيض الله العلامة الفقيه المربي	محمد ياسر القضماني	ShamAY	38618	0.25336
		رسائل المحقق الكركي - الجزء1	علي بن الحسين‏ المحقق الكركي	Masaha	1162	0.25336
		اصول الفقه	محمد رضا مظفر	Ghbook	15691	0.25335
		 المغرب في ترتيب المعرب 	 ناصر الدين المطرزي 	ABLibrary	9218	0.25334
		موسوعة الأسئلة العقائديّة [ج ٥]	مركز الأبحاث العقائديّة	Rafed	1394	0.25334
		 الإلهيات على هدى الكتاب والسنة والعقل 	 الشيخ السبحاني 	ABLibrary	8344	0.25333
		رسائل فلسفية للرازي	أبو بكر، محمد بن زكريا الرازي (المتوفى: 313هـ)	ShamAY	12834	0.25333
		حصان طروادة الغارة الفكرية على الديار السُّنية	د. عمرو كامل عمر	ShamAY	31934	0.25333
		المعاجم العربية مع اعتناء خاص بمعجم "العين" للخليل بن أحمد	عبد الله درويش	ShamelaY19	22867	0.25333
		الله يتجلى في عصر العلم	مجموعة من المؤلفين	ShamAY	9830	0.25332
		المحصول في أصول الفقه	القاضي محمد بن عبد الله أبو بكر بن العربي المعافري الاشبيلي المالكي (المتوفى: 543هـ)	ShamAY	6281	0.25332
		أمالي ابن الحاجب	عثمان بن عمر بن أبي بكر بن يونس، أبو عمرو جمال الدين ابن الحاجب الكردي المالكي (المتوفى: 646ه)	ShamelaY19	124755	0.25331
		مصطلحات في كتب العقائد	محمد بن إبراهيم بن أحمد الحمد	ShamAY	12070	0.2533
		 فوائح الجمال وفواتح الجلال 	 نجم الدين الكبرى 	ABLibrary	8731	0.25328
		العائدون إلى الله	محمد بن عبد العزيز المسند	ShamAY	35160	0.25326
		مرزبان نامه	اسبهبد مرزبان بن شروين بن رستم بن شهريار (المتوفى: ق 4 هـ)	ShamAY	8305	0.25326
		روح المعاني في تفسير القرآن العظيم والسبع المثاني	شهاب الدين محمود بن عبد الله الحسيني الألوسي (المتوفى: 1270ه)	ShamelaY19	22835	0.25326
		 نفح الطيب من غصن الأندلس الرطيب 	 أحمد بن محمد المقري التلمساني 	ABLibrary	9301	0.25325
		المسار	محمد أحمد الراشد	ShamAY	33338	0.25325
		هذا هو الطريق	علي بن نايف الشحود	ShamAY	33274	0.25325
		فاكهة الخلفاء ومفاكهة الظرفاء	أبو محمد أحمد بن محمد، المعروف بابن عربشاه (المتوفى: 854هـ)	ShamAY	12726	0.25324
