automatic URI	Proposed URI	bookTitle	authorName	collection	id	tfidf
		قصيدة عنوان الحكم	علي بن محمد بن الحسين بن يوسف بن محمد بن عبد العزيز البُسْتي، أَبُو الفَتح (المتوفى: 400هـ)	ShamAY	6873	0.976
		نظم اللآل في الحكم والأمثال	عبد الله فكري «باشا» بن محمد بليغ بن عبد الله بن محمد (المتوفى: 1306هـ)	ShamAY	5385	0.35011
		التمثيل والمحاضرة	عبد الملك بن محمد بن إسماعيل أبو منصور الثعالبي (المتوفى: 429هـ)	ShamAY	5683	0.3393
		التمثيل والمحاضرة	عبد الملك بن محمد بن إسماعيل أبو منصور الثعالبي (المتوفى: 429ه)	Sham19Y	5683	0.33824
		رسائل الثعالبي	عبد الملك بن محمد بن إسماعيل أبو منصور الثعالبي (المتوفى: 429هـ)	ShamAY	623	0.32751
		مجمع الحكم والأمثال في الشعر العربي	أحمد قبش بن محمد نجيب	ShamAY	32578	0.32728
		مجموعة القصائد الزهديات	أبو محمد عبد العزيز بن محمد بن عبد الرحمن بن عبد المحسن السلمان (المتوفى: 1422هـ)	ShamAY	1268	0.32622
		السحر الحلال في الحكم والأمثال	أحمد بن إبراهيم بن مصطفى الهاشمي (المتوفى: 1362هـ)	ShamAY	6903	0.3246
		مجموعة القصائد الزهديات	أبو محمد عبد العزيز بن محمد بن عبد الرحمن بن عبد المحسن السلمان (المتوفى: 1422ه)	ShamelaY19	38155	0.32407
		الكشكول	محمد بن حسين بن عبد الصمد الحارثي العاملي الهمذاني، بهاء الدين (المتوفى: 1031هـ)	ShamAY	1571	0.321
		الآداب النافعة بالألفاظ المختارة الجامعة	ابن شمس الخلافة، جعفر بن محمد (شمس الخلافة) ابن مختار الأفضلي، أبو الفضل، الملقب مجد الملك (المتوفى: 622هـ)	ShamAY	5433	0.32087
		المنتقى من بطون الكتب	الواحدي :: محمد بن إبراهيم الحمد	ShamAY	37720	0.32048
		 الكشكول 	 الشيخ البهائي العاملي 	ABLibrary	8844	0.31434
		خاص الخاص	عبد الملك بن محمد بن إسماعيل أبو منصور الثعالبي (المتوفى: 429هـ)	ShamAY	7830	0.31352
		 مجموعه رسائل ابن عربي 	 ابن عربي 	ABLibrary	8751	0.31311
		هكذا علمتني الحياة	مصطفى بن حسني السباعي (المتوفى: 1384هـ)	ShamAY	969	0.31264
		المساكين	مصطفى صادق بن عبد الرزاق بن سعيد بن أحمد بن عبد القادر الرافعي (المتوفى: 1356هـ)	ShamAY	5418	0.31254
		غرر الخصائص الواضحة، وعرر النقائض الفاضحة	أبو إسحق برهان الدين محمد بن إبراهيم بن يحيى بن علي المعروف بالوطواط (المتوفى: 718هـ)	ShamAY	1349	0.3109
		الأخلاق والسير لابن حزم الأندلسي - دار المشرق	علي بن أحمد بن سعيد بْنِ حَزْمٍ، أبو محمد، الأَنْدَلُسِيّ (384 - 456هـ)	ShamAY	33746	0.31078
		ريحانة الألبّا وزهرة الحياة الدنيا	شهاب الدين أحمد بن محمد بن عمر الخفاجي (المتوفى: 1069هـ)	ShamAY	1522	0.31067
		نزهة الأبصار بطرائف الأخبار والأشعار	عبد الرحمن بن عبد الله بن أحمد بن درهم (المتوفى: 1362هـ)	ShamAY	5375	0.31029
		رسائل الشريف المرتضى [ج ٤]	علي بن الحسين الموسوي العلوي [ الشريف المرتضى علم الهدى ]	Rafed	3626	0.31025
		الأخلاق والسير في مداواة النفوس	أبو محمد علي بن أحمد بن سعيد بن حزم الأندلسي القرطبي الظاهري (المتوفى: 456هـ)	ShamAY	6874	0.30981
		 رسالة التوحيد 	 الشيخ محمد عبده 	ABLibrary	8430	0.30968
		نفحة الريحانة ورشحة طلاء الحانة	محمد أمين بن فضل الله بن محب الدين بن محمد المحبي (المتوفى: 1111هـ)	ShamAY	579	0.30965
		التذكرة في الوعظ	جمال الدين أبو الفرج عبد الرحمن بن علي بن محمد الجوزي (المتوفى: 597هـ)	ShamAY	6858	0.30896
		رحلة الشتاء والصيف	محمد بن عبد الله بن محمد، من أحفاد شرف الدين بن يحيى الحمزي الحسيني المولوي المعروف بـ كِبْرِيت (المتوفى: 1070هـ)	ShamAY	622	0.30876
		ديوان محمود سامي البارودي	محمود سامي باشا بن حسن حسين بن عبد الله البارودي المصري	ShamAY	37857	0.30848
		مقامات القرني	عائض بن عبدالله القرني :: عائض القرني	ShamAY	34503	0.30834
		أدب الطّف أو شعراء الحسين عليه السلام [ج ٢]	جواد شبّر	Rafed	318	0.30824
		جواهر الأدب في أدبيات وإنشاء لغة العرب	أحمد بن إبراهيم بن مصطفى الهاشمي (المتوفى: 1362ه)	ShamelaY19	21505	0.30823
		أدب الطّف أو شعراء الحسين عليه السلام [ج ٤]	جواد شبّر	Rafed	365	0.30805
		 أدب الطف أو شعراء الحسين ( ع ) 	 جواد شبر 	ABLibrary	7400	0.30797
		مقالات موقع الدرر السنية	مجموعة من المؤلفين	ShamAY	1572	0.30788
		 أدب الطف أو شعراء الحسين ( ع ) 	 جواد شبر 	ABLibrary	7402	0.3075
		طوق الحمامة في الألفة والألاف	أبو محمد علي بن أحمد بن سعيد بن حزم الأندلسي القرطبي الظاهري (المتوفى: 456هـ)	ShamAY	10518	0.30716
		 كنز الفوائد 	 أبي الفتح الكراجكي 	ABLibrary	7903	0.3071
		مقالات موقع الدرر السنية	مجموعة من المؤلفين	ShamelaY19	95660	0.30691
		رحلة الشتاء والصيف	محمد بن عبد الله بن محمد، من أحفاد شرف الدين بن يحيى الحمزي الحسيني المولوي المعروف ب كبريت (المتوفى: 1070ه)	ShamelaY19	37345	0.30685
		الرسائل للجاحظ	عمرو بن بحر بن محبوب الكناني بالولاء، الليثي، أبو عثمان، الشهير بالجاحظ (المتوفى: 255هـ)	ShamAY	10428	0.30656
		 تصنيف غرر الحكم ودرر الكلم 	 عبد الواحد الآمدى التميمي 	ABLibrary	7906	0.3063
		 آداب النفوس ( ويليه كتاب الوهم ) 	 الحارث المحاسبي 	ABLibrary	8685	0.30605
		الذخائر والعبقريات - معجم ثقافي جامع	عبد الرحمن بن عبد الرحمن بن سيد بن أحمد البرقوقي الأديب المصري (المتوفى: 1363هـ)	ShamAY	819	0.3059
		رسالة الغفران	أحمد بن عبد الله بن سليمان بن محمد بن سليمان، أبو العلاء المعري، التنوخي (المتوفى: 449هـ)	ShamAY	1589	0.30581
		المنتخب من الشعر والبيان .. مكتبة الخطيب والداعية من الشعر	الواحدي :: أمير بن محمد المدري	ShamAY	34542	0.30581
		جواهر الأدب في أدبيات وإنشاء لغة العرب	أحمد بن إبراهيم بن مصطفى الهاشمي (المتوفى: 1362هـ)	ShamAY	21505	0.30574
		التوحيد لمحمد عبده	محمد عبده بن حسن خير الله (المتوفى: 1323هـ)	ShamAY	6392	0.30553
		هداية العلم	السيد حسين شيخ الإسلامي	Rafed	1153	0.3053
		أمراء البيان	محمد علي كرد	ShamAY	35859	0.30523
		مجلة الحقائق (الدمشقية)	عبد القادر الإسكندراني	ShamAY	187	0.30489
		أدب الطّف أو شعراء الحسين عليه السلام [ج ٣]	جواد شبّر	Rafed	361	0.30485
		النظرات	مصطفى لطفي بن محمد لطفي بن محمد حسن لطفي المَنْفَلُوطي (المتوفى: 1343هـ)	ShamAY	11400	0.30482
		 أدب الطف أو شعراء الحسين ( ع ) 	 جواد شبر 	ABLibrary	7401	0.30463
		خريدة القصر وجريدة العصر - أقسام أخرى	عماد الدين الكاتب الأصبهاني، محمد بن محمد صفي الدين بن نفيس الدين حامد بن أله، أبو عبد الله (المتوفى: 597هـ)	ShamAY	12815	0.3046
		 مجموعه رسائل ابن عربي 	 ابن عربي 	ABLibrary	8753	0.30455
		لا تحزن	عائض بن عبد الله القرني	ShamAY	12729	0.30439
		الجواهر الثمينة في محاسن المدينة	محمد كبريت الحسيني المدني	Masaha	4131	0.30439
		 أعيان الشيعة 	 السيد محسن الأمين 	ABLibrary	81	0.30412
		 تاج العروس الحاوى لتهذيب النفوس ( ويليه الهداية لباديس / الورع للأبياري / الطريق إلى الله للمزيدي ) 	 ابن عطاء الله السكندري 	ABLibrary	8789	0.30408
		الذخائر والعبقريات - معجم ثقافي جامع	عبد الرحمن بن عبد الرحمن بن سيد بن أحمد البرقوقي الأديب المصري (المتوفى: 1363ه)	ShamelaY19	36072	0.30405
		تصنيف غرر الحكم ودرر الكلم‏	عبد الواحد بن محمد التميمي الآمدي	Masaha	4559	0.30404
		تفسير المراغي [ج ٣]	أحمد مصطفى المراغي	Rafed	1660	0.30397
		الفوائد لابن القيم	محمد بن أبي بكر بن أيوب بن سعد شمس الدين ابن قيم الجوزية (المتوفى: 751هـ)	ShamAY	6832	0.30396
		 قوانين حكم الاشراق إلى كافة الصوفية بجميع الآفاق 	 محمد بن أحمد الشاذلي ( ابن زغدان ) 	ABLibrary	8818	0.30386
		تفسير المراغي [ج ٢]	أحمد مصطفى المراغي	Rafed	1659	0.30372
		بذل النصائح الشرعية فيما على السلطان وولاة الأمور وسائر الرعية	محب الدين أبو حامد محمد بن أحمد المقدسي الشافعي	ShamelaY19	36111	0.30359
		المحاضرات في اللغة والأدب	الحسن بن مسعود بن محمد، أبو علي، نور الدين اليوسي (المتوفى: 1102هـ)	ShamAY	473	0.30357
		الذخيرة في محاسن أهل الجزيرة	أبو الحسن علي بن بسام الشنتريني (المتوفى: 542هـ)	ShamAY	1035	0.30352
		ربيع الأبرار ونصوص الأخيار	جار الله الزمخشري توفي 583 هـ	ShamAY	10668	0.3035
		تعريف عام بدين الإسلام	علي بن مصطفى الطنطاوي (المتوفى: 1420هـ)	ShamAY	986	0.30338
		مجلة الحقائق (الدمشقية)	عبد القادر الإسكندراني	Sham19Y	29676	0.30336
		الوسيط في تراجم أدباء شنقيط والكلام على تلك البلاد تحديدا وتخطيطا وعاداتهم وأخلاقهم وما يتعلق بذلك	أحمد بن الأمين الشّنْقِيطي (المتوفى: 1331هـ)	ShamAY	1629	0.30321
		مجلة الحقائق (الدمشقية)	عبد القادر الإسكندراني	ShamelaY19	29676	0.30316
		ديوان أحمد شوقي	أحمد شوقي (1285 - 1351 هـ)	ShamAY	37923	0.30313
		 البحر المورود في المواثيق والعهود 	 عبد الوهاب الشعراني 	ABLibrary	8833	0.30295
		نور وهداية	علي بن مصطفى الطنطاوي (المتوفى: 1420ه)	Sham19Y	1791	0.3029
		(الحماسة المغربية) مختصر كتاب صفوة الأدب ونخبة ديوان العرب	أبو العباس أحمد بن عبد السلام الجرّاوي التادلي (المتوفى: 609هـ)	ShamAY	6902	0.30283
		نور الطرف ونور الظرف	إبراهيم بن علي بن تميم الأنصاري، أبو إسحاق الحصري (المتوفى: 453هـ)	ShamAY	5351	0.30242
		خريدة القصر وجريدة العصر - قسم شعراء المغرب والأندلس جـ 2	عماد الدين الكاتب الأصبهاني، محمد بن محمد صفي الدين بن نفيس الدين حامد بن أله، أبو عبد الله (المتوفى: 597هـ)	ShamAY	12856	0.30227
		ديوان المعاني	أبو هلال الحسن بن عبد الله بن سهل بن سعيد بن يحيى بن مهران العسكري (المتوفى: نحو 395هـ)	ShamAY	6909	0.30216
		أزهار الرياض في أخبار القاضي عياض	شهاب الدين أحمد بن محمد بن أحمد بن يحيى، أبو العباس المقري التلمساني (المتوفى: 1041ه)	Sham19Y	26350	0.30211
		الجانب العاطفي من الإسلام	محمد الغزالي :: أبو حامد الغزالي	ShamAY	36031	0.30207
		البرهان في وجوه البيان (نشر من قبل باسم نقد النثر لقدامة بن جعفر)	أبو الحسين إسحاق بن إبراهيم بن سليمان بن وهب الكاتب	ShamelaY19	20986	0.302
		(الحماسة المغربية) مختصر كتاب صفوة الأدب ونخبة ديوان العرب	أبو العباس أحمد بن عبد السلام الجراوي التادلي (المتوفى: 609ه)	Sham19Y	6902	0.30181
		مجلة البيان للبرقوقي	البرقوقي	ShamAY	464	0.30174
		 نفح الطيب من غصن الأندلس الرطيب 	 أحمد بن محمد المقري التلمساني 	ABLibrary	9303	0.30173
		مقامات الزمخشري	ابو القاسم محمود بن عمر الزمخشري	Masaha	2358	0.30167
		 الطريق إلى الله تعالى ( الشيخ والمريد ) 	 ابن عربي 	ABLibrary	8747	0.30165
		البخلاء للجاحظ	عمرو بن بحر بن محبوب الكناني بالولاء، الليثي، أبو عثمان، الشهير بالجاحظ (المتوفى: 255هـ)	ShamAY	10501	0.30158
		 ديوان ابن عربي 	 ابن عربي 	ABLibrary	8737	0.30154
		 تلخيص الشافي 	 الشيخ الطوسي 	ABLibrary	8390	0.30153
		دراسات وتوجيهات إسلامية	أحمد سحنون (المتوفى: 1424هـ)	ShamAY	1937	0.30151
		عيون الحكم والمواعظ	علي بن محمد الليثي الواسطي	Masaha	4575	0.30151
		تعريف عام بدين الإسلام	علي بن مصطفى الطنطاوي (المتوفى: 1420ه)	ShamelaY19	37562	0.30149
		ديوان عبد الغفار الأخرس	عبد الغفار بن عبد الواحد بن دهب الأخرس 1290 هـ	ShamAY	37954	0.30143
		 الحقائق في محاسن الأخلاق 	 الفيض الكاشاني 	ABLibrary	8850	0.3013
		رسالة الصاهل والشاجح	أحمد بن عبد الله بن سليمان بن محمد بن سليمان المعري، التنوخي (المتوفى: 449هـ)	ShamAY	563	0.30129
		أدب الطلب ومنتهى الأدب	محمد بن علي بن محمد بن عبد الله الشوكاني اليمني (المتوفى: 1250هـ)	ShamAY	6854	0.30127
		موارد الظمآن لدروس الزمان، خطب وحكم وأحكام وقواعد ومواعظ وآداب وأخلاق حسان	عبد العزيز بن محمد بن عبد المحسن السلمان (المتوفى: 1422هـ)	ShamAY	7480	0.30123
		طالب العلم والسيرة الأخلاقية	السيّد عادل العلوي	Rafed	1372	0.30116
		إعجاز القرآن والبلاغة النبوية للرافعي	مصطفى صادق بن عبد الرزاق بن سعيد بن أحمد بن عبد القادر الرافعي (المتوفى: 1356هـ)	ShamAY	8506	0.30112
		مجلة المقتبس	محمد كرد علي	ShamAY	443	0.30109
		أشعار أولاد الخلفاء وأخبارهم	أبو بكر محمد بن يحيى بن عبد الله الصولي (المتوفى: 335هـ)	ShamAY	7822	0.30108
		رسائل الشريف المرتضى [ج ٣]	علي بن الحسين الموسوي العلوي [ الشريف المرتضى علم الهدى ]	Rafed	3616	0.30108
		سلافة العصر في محاسن الشعراء بكل مصر	صدر الدين المدني، علي بن أحمد بن محمد معصوم الحسني الحسيني، المعروف بعلي خان بن ميرزا أحمد، الشهير بابن معصوم (المتوفى: 1119هـ)	ShamAY	298	0.30105
		الحيوان - الجزء1	عمرو بن بحر الجاحظ	Masaha	2972	0.30103
		رسالة التوحيد - ط الكتاب العربي	محمد عبده	ShamAY	33867	0.30087
		الوسيط في تراجم أدباء شنقيط والكلام على تلك البلاد تحديدا وتخطيطا وعاداتهم وأخلاقهم وما يتعلق بذلك	أحمد بن الأمين الشنقيطي (المتوفى: 1331ه)	ShamelaY19	95696	0.30085
		ديوان ابن مشرف	أحمد بن علي بن حسين بن مشرف , ت: 1285 هـ	ShamAY	37876	0.30078
		المثل السائر في أدب الكاتب والشاعر ت الحوفي	ضياء الدين بن الأثير، نصر الله بن محمد (المتوفى: 637هـ)	ShamAY	10551	0.30076
		صيد الخاطر	جمال الدين أبو الفرج عبد الرحمن بن علي بن محمد الجوزي (المتوفى: 597هـ)	ShamAY	12028	0.30066
		أزهار الرياض في أخبار القاضي عياض	شهاب الدين أحمد بن محمد بن أحمد بن يحيى، أبو العباس المقري التلمساني (المتوفى: 1041ه)	ShamelaY19	26350	0.30064
		البخلاء للجاحظ	عمرو بن بحر بن محبوب الكناني بالولاء، الليثي، أبو عثمان، الشهير بالجاحظ (المتوفى: 255ه)	Sham19Y	10501	0.3006
		خريدة القصر وجريدة العصر - قسم شعراء العراق جـ 1	عماد الدين الكاتب الأصبهاني، محمد بن محمد صفي الدين بن نفيس الدين حامد بن أله، أبو عبد الله (المتوفى: 597هـ)	ShamAY	12821	0.30046
		تأملات في الدين والحياة	محمد الغزالي	ShamAY	36039	0.30043
		المقتطف من أزاهر الطرف	أبو الحسن على بن موسى بن سعيد المغربي الأندلسي (المتوفى: 685هـ)	ShamAY	9100	0.30042
		 كنز الفوائد 	 أبي الفتح الكراجكي 	ABLibrary	7902	0.30036
		الأفضليات	علي بن منجب بن سليمان، أبو القاسم، تاج الرياسة، ابن الصيرفي (المتوفى: 542هـ)	ShamAY	5432	0.30029
		شرح نهج البلاغة - الجزء1	ابن ابي الحديد	Masaha	2790	0.30028
		كلمات في مناسبات	عبد الله بن ضيف الله الرحيلي	Sham19Y	11356	0.30024
		المدرّس الأفضل [ج ١]	الشيخ محمّد علي المدرّس الأفغاني	Rafed	2679	0.30024
		نور وهداية	علي بن مصطفى الطنطاوي (المتوفى: 1420هـ)	ShamAY	31960	0.30009
		زهر الآداب وثمر الألباب	إبراهيم بن علي بن تميم الأنصاري، أبو إسحاق الحصري القيرواني (المتوفى: 453ه)	Sham19Y	10768	0.30009
		تيسير التفسير للقطان	إبراهيم القطان (المتوفى: 1404هـ)	ShamAY	29	0.3
		 مسالك الأبصار في ممالك الأمصار 	 أحمد بن يحيى العمري 	ABLibrary	9194	0.3
		مجلة البيان للبرقوقي	البرقوقي	ShamelaY19	73348	0.29997
		موسوعة الشعر الإسلامي	علي بن نايف الشحود	ShamAY	34454	0.29994
		تفسير المراغي [ج ١]	أحمد مصطفى المراغي	Rafed	1658	0.29988
		آلاء الرحمن في تفسير القرآن [ج ١]	الشيخ محمد جواد البلاغي	Rafed	3150	0.29986
		كنز الفوائد  - الجزء1	الشيخ القاضي أبي الفتح محمد بن علي الكراجكي	Masaha	4568	0.29973
		النكت الدالة على البيان في أنواع العلوم والأحكام	أحمد محمد بن علي بن محمد الكَرَجي القصَّاب (المتوفى: نحو 360هـ)	ShamAY	9065	0.29966
		المستطرف في كل فن مستطرف - العلمية	شهاب الدين محمد بن أحمد أبي الفتح الأبشيهي	ShamAY	33781	0.29964
		البخلاء	عمرو بن بحر الجاحظ	Masaha	2332	0.29963
		إيقاظ أولي الهمم العالية إلى اغتنام الأيام الخالية	الواحدي :: عبد العزيز السلمان	ShamAY	35000	0.29954
		نصرة الثائر على المثل السائر	صلاح الدين خليل بن أيبك الصفدي (المتوفى: 764هـ)	ShamAY	514	0.29954
		 نفح الطيب من غصن الأندلس الرطيب 	 أحمد بن محمد المقري التلمساني 	ABLibrary	9302	0.29954
		دراسات وتوجيهات إسلامية	أحمد سحنون (المتوفى: 1424ه)	ShamelaY19	96557	0.2995
		المثل السائر في أدب الكاتب والشاعر ت محيي الدين عبد الحميد	نصر الله بن محمد بن محمد بن عبد الكريم الشيباني، الجزري، أبو الفتح، ضياء الدين، المعروف بابن الأثير الكاتب (المتوفى: 637ه)	ShamelaY19	23794	0.29935
		ديوان محمد العيد آل خليفة	محمد العيد بن محمد علي خليفة (المتوفى: 1399هـ)	ShamAY	1630	0.29934
		الأفضليات	علي بن منجب بن سليمان، أبو القاسم، تاج الرياسة، ابن الصيرفي (المتوفى: 542ه)	Sham19Y	5432	0.29933
		رحلة ابن معصوم المدني أو سلوة الغريب وأسوة الأريب	السيد علي صدر الدين المدني	Rafed	2267	0.29926
		 في ظلال نهج البلاغة 	 محمد جواد مغنية 	ABLibrary	965	0.29924
		كنز الكتاب ومنتخب الآداب (السفر الأول من النسخة الكبرى)	أبو إسحاق إبراهيم بن أبي الحسن الفهري المعروف بالبونسي (651ه)	Sham19Y	13666	0.29915
		كتاب الجواهر الثمينة في محاسن المدينة	محمّد كبريت الحسيني المدني	Rafed	2347	0.29914
		المستطرف في كل فن مستطرف	شهاب الدين محمد بن أحمد بن منصور الأبشيهي أبو الفتح (المتوفى: 852ه)	ShamelaY19	23802	0.29913
		 الشيخ محيي الدين بن عربي ترجمة حياته من كلامه 	 محمود محمود الغراب 	ABLibrary	8910	0.29912
		الإمام السجاد جهاد و أمجاد	أ. د. حسين الحاج حسن	Masaha	1854	0.29908
		الوحي المحمدي	محمد رشيد بن علي رضا بن محمد شمس الدين بن محمد بهاء الدين بن منلا علي خليفة القلموني الحسيني (المتوفى: 1354هـ)	ShamAY	1202	0.29906
		ديوان ابن أبي حصينة	الأمير أبو الفتح الحسن بن عبد الله المشهور بابن أبي حصينة السلمي المعري	Sham19Y	148536	0.29904
		فكر ومباحث	علي بن مصطفى الطنطاوي (المتوفى: 1420هـ)	ShamAY	32251	0.29902
		التذكرة الفخرية	الصاحب بهاء الدين علي بن عيسى بن أبي الفتح الإربلي (المتوفى: 692هـ)	ShamAY	724	0.29895
		البرهان في وجوه البيان (نشر من قبل باسم نقد النثر لقدامة بن جعفر)	أبو الحسين إسحاق بن إبراهيم بن سليمان بن وهب الكاتب	ShamAY	38891	0.29893
		ديوان محمد العيد آل خليفة	محمد العيد بن محمد علي خليفة (المتوفى: 1399ه)	ShamelaY19	95843	0.29887
		دلائل الإعجاز في علم المعاني	عبد القاهر بن عبد الرحمن الجرجاني	Rafed	2081	0.29885
		أزهار الرياض في أخبار القاضي عياض	شهاب الدين أحمد بن محمد بن أحمد بن يحيى، أبو العباس المقري التلمساني (المتوفى: 1041هـ)	ShamAY	26350	0.29884
		عدة المريد الصادق	شهاب الدين أبو العباس أحمد بن أحمد بن محمد بن عيسى البرنسي الفاسي، المعروف ب زروق (المتوفى: 899ه)	ShamelaY19	123663	0.29864
		سلافة العصر في محاسن الشعراء بكل مصر	علي بن أحمد بن محمد معصوم الحسني الحسيني، الشهير بابن معصوم (المتوفى: 1119هـ)	ShamAY	34642	0.29862
		مقتل الحسين عليه السلام	السيد عبد الرزاق الموسوي المقرّم	Rafed	1574	0.29859
		مجلة المقتبس	محمد كرد علي	ShamelaY19	26523	0.29842
		 شرح الحكم الغوثية 	 أحمد بن ابراهيم النقشبندي 	ABLibrary	8845	0.29839
		ربيع الأبرار و نصوص الأخبار - الجزء1	ابو القاسم محمود بن عمر الزمخشري	Masaha	2979	0.29838
		 رحلة ابن معصوم المدني ( سلوة الغريب وأسوة الأريب ) 	 السيد علي صدر الدين المدني ( ابن معصوم ) 	ABLibrary	9080	0.29836
