automatic URI	Proposed URI	bookTitle	authorName	collection	id	tfidf
		أصول الفقه المسمى إجابة السائل شرح بغية الآمل	محمد بن إسماعيل بن صلاح بن محمد الحسني، الكحلاني ثم الصنعاني، أبو إبراهيم، عز الدين، المعروف كأسلافه بالأمير (المتوفى: 1182هـ)	ShamAY	6315	0.2781
		موسوعة الأخلاق والزهد والرقائق	ياسر عبد الرحمن	ShamelaY19	96918	0.27809
		أين تقع لا إله إلا الله في دين المرجئة الجُدُد	محمد إبراهيم شقرة	ShamAY	37772	0.27808
		شرح أصول اعتقاد أهل السنة للالكائي - حسن أبو الأشبال	أبو الأشبال حسن الزهيري آل مندوه المنصوري المصري	ShamelaY19	37437	0.27808
		أمراض القلوب وشفاؤها	تقي الدين أبو العباس أحمد بن عبد الحليم بن عبد السلام بن عبد الله بن أبي القاسم بن محمد ابن تيمية الحراني الحنبلي الدمشقي (المتوفى: 728هـ)	ShamAY	1512	0.27807
		أدب الخلاف - ياسر برهامي	الشيخ ياسر بن حسين برهامي	ShamAY	371	0.27807
		علم المعاني	الدكتور عبدالعزيز عتيق	Rafed	2555	0.27807
		شيعة ممدوحة .. وأشياع مذمومة	أحمد بن محمد السعيد	ShamAY	37811	0.27805
		الزواجر عن اقتراف الكبائر	أحمد بن محمد بن علي بن حجر الهيتمي السعدي الأنصاري، شهاب الدين شيخ الإسلام، أبو العباس (المتوفى: 974هـ)	ShamAY	21629	0.27804
		التعصب بين المسيحية والإسلام	محمد الغزالي	ShamAY	36030	0.27804
		الدرر النجفيه من الملتقطات اليوسفيه	يوسف بن احمد بن ابراهيم بحراني آل عصفور	Ghbook	12119	0.27804
		تحفة القادم	ابن الأبار، محمد بن عبد الله بن أبي بكر القضاعي البلنسي (المتوفى: 658هـ)	ShamAY	26108	0.27802
		الحور العين	نشوان بن سعيد الحميرى اليمني (المتوفى: 573 هـ)	ShamAY	22885	0.27802
		التجارة الرابحة	أبو مالك محمد بن حامد بن عبد الوهاب	ShamAY	33735	0.27802
		سلسلة الدار الآخرة - عمر عبد الكافي	عمر عبد الكافى شحاتة	ShamAY	382	0.27802
		الأساس في السنة وفقهها - السيرة النبوية	سعيد حوى (المتوفى 1409 ه)	ShamelaY19	18332	0.27802
		تفسير آيات الأحكام للسايس	محمد علي السايس الأستاذ بالأزهر الشريف	ShamelaY19	23599	0.27802
		إلى المجمع العلمي العربي بدمشق	السيد عبدالحسين شرف الدين الموسوي	Rafed	3436	0.27802
		الضوء اللامع المبين عن مناهج المحدثين	أحمد محرم الشيخ ناجي	ShamAY	7452	0.27801
		علوم البلاغة «البيان، المعاني، البديع»	أحمد بن مصطفى المراغي (المتوفى: 1371هـ)	ShamAY	9997	0.278
		الأشباه والنظائر للسبكي	تاج الدين عبد الوهاب بن تقي الدين السبكي (المتوفى: 771هـ)	ShamAY	8634	0.278
		درء تعارض العقل والنقل	تقي الدين أبو العباس أحمد بن عبد الحليم بن عبد السلام بن عبد الله بن أبي القاسم بن محمد ابن تيمية الحراني الحنبلي الدمشقي (المتوفى: 728ه)	Sham19Y	21506	0.27799
		الجمل	محمّد بن محمّد النعمان العكبري [ الشيخ المفيد ]	Rafed	1726	0.27798
		الصداقة بين العلماء	الواحدي :: محمد بن إبراهيم الحمد	ShamAY	33493	0.27795
		علم التفسير كيف نشأ وتطور حتى انتهى إلى عصرنا الحاضر	عبد المنعم النمر (المتوفى: 1991 م)	ShamAY	1474	0.27795
		تفسير التّحرير والتّنوير [ج ١٢]	الشيخ محمّد الطاهر ابن عاشور	Rafed	2916	0.27793
		خطط الشام [ج ٥]	محمّد كرد علي	Rafed	2285	0.27793
		 دراسات في علم الدراية 	 علي أكبر غفاري 	ABLibrary	923	0.27792
		أصول الفقه الذي لا يسع الفقيه جهله	عياض بن نامي بن عوض السلمي	ShamelaY19	36379	0.27791
		كشف الريبة	الشهيد الثاني	Masaha	4651	0.27791
		الولاء والبراء والعداء في الإسلام	أبو فيصل البدراني	ShamelaY19	96246	0.2779
		من هدى القرآن [ج ٧]	السيّد محمّد تقي المدرّسي	Rafed	2109	0.2779
		التبصرة - ت عبد الواحد	ابن الجوزي	ShamAY	38311	0.27789
		الفواكه الدواني على رسالة ابن أبي زيد القيرواني	أحمد بن غانم (أو غنيم) بن سالم ابن مهنا، شهاب الدين النفراوي الأزهري المالكي (المتوفى: 1126هـ)	ShamAY	21589	0.27789
		العصبةُ المؤمنة بين عناية الرحمن ومكر الشيطان	علي بن نايف الشحود	ShamAY	353	0.27788
		التّفسير القرآني للقرآن [ج ١٠]	عبدالكريم الخطيب	Rafed	3352	0.27788
		بلوغ الغاية من تهذيب بداية الهداية للإمام أبي حامد الغزالي (رحمه الله)	وائل حافظ خلف	ShamelaY19	37549	0.27787
		الذب عن مذهب الإمام مالك	أبو محمد عبد الله بن (أبي زيد) عبد الرحمن النفزي، القيرواني، المالكي (المتوفى: 386 ه)	Sham19Y	18606	0.27786
		البيان في تفسير القرآن	السيّد أبو القاسم الموسوي الخوئي	Rafed	691	0.27786
		الدعوة الإسلامية تستقبل عامها الخامس عشر	محمد الغزالي	ShamAY	36034	0.27785
		 الأنوار في علم الاسرار ومقامات الأبرار 	 عبد الرحمن بن محمد البكري 	ABLibrary	8701	0.27784
		القسم العربي من موقع (الإسلام، سؤال وجواب)	الموقع بإشراف الشيخ محمد صالح المنجد - حفظه الله -	ShamelaY19	26332	0.27783
		شرح أسماء الله الحسنى	زين الدين أبي القاسم عبدالكريم ابن هوازن بن عبدالملك ابن طلحة بن محمد النيسابوري القشيري	Rafed	3485	0.27783
		المورد العذب الزلال فيما انتقد على بعض المناهج الدعوية من العقائد والأعمال	أحمد النجمي	ShamAY	33354	0.27782
		الغدير في الكتاب والسنّة والأدب [ج ٣]	الشيخ عبد الحسين أحمد الأميني النجفي	Rafed	2001	0.27782
		التفسير القرآني للقرآن	عبد الكريم يونس الخطيب (المتوفى: بعد 1390هـ)	ShamAY	23607	0.27781
		الاعتصام للشاطبي ت الشقير والحميد والصيني	إبراهيم بن موسى بن محمد اللخمي الغرناطي الشهير بالشاطبي (المتوفى: 790ه)	ShamelaY19	36558	0.27781
		إعجاز القرآن العلمي والبلاغي والحسابي	محمّد حسن قنديل	Rafed	3107	0.27781
		مرآة العقول [ج ٧]	الشيخ محمّد باقر بن محمّد تقي المجلسي	Rafed	1022	0.2778
		الإيمان الكبير لابن تيمية - مشكول	ابن تيمية	ShamAY	35410	0.27779
		أدب الاختلاف في الإسلام	طه جابر فياض العلواني	Sham19Y	1523	0.27779
		الذب عن مذهب الإمام مالك	أبو محمد عبد الله بن (أبي زيد) عبد الرحمن النفزي، القيرواني، المالكي (المتوفى: 386 ه)	ShamelaY19	18606	0.27779
		 جواهر النصوص في حل كلمات الفصوص 	 الشيخ عبد الغني النابلسي 	ABLibrary	8854	0.27779
		أدب الطّف أو شعراء الحسين عليه السلام [ج ٨]	جواد شبّر	Rafed	379	0.27779
		شرح سنن الترمذي - عبد الكريم الخضير	عبد الكريم الخضير	ShamAY	70	0.27778
		نهاية الأرب في فنون الأدب	أحمد بن عبد الوهاب بن محمد بن عبد الدائم القرشي التيمي البكري، شهاب الدين النويري (المتوفى: 733هـ)	ShamAY	10283	0.27776
		سماحة الإسلام في الدعوة إلى الله والعلاقات الإنسانية منهاجا ... وسيرة	عبد العظيم إبراهيم محمد المطعني (المتوفى: 1429هـ)	ShamAY	1411	0.27775
		التفسير المنير في العقيدة والشريعة والمنهج	د وهبة بن مصطفى الزحيلي	ShamAY	22915	0.27775
		الإفصاح في الإمامة	محمّد بن محمّد النعمان العكبري [ الشيخ المفيد ]	Rafed	3676	0.27773
		من أعلام المجددين	صالح بن فوزان بن عبد الله الفوزان	Sham19Y	12066	0.27772
		خَصائِصُ المنْهَجِ الإسلاميِّ في القرآن الكريم	علي بن نايف الشحود	ShamAY	357	0.2777
		 مسند الإمام السجاد ( ع ) 	 الشيخ عزيز الله عطاردي 	ABLibrary	7707	0.2777
		تراثنا ـ العددان [ 71 و 72 ]	مؤسسة آل البيت عليهم السلام لإحياء التراث ـ قم	Rafed	3304	0.2777
		تعريب سيد المرسلين - الجزء1	جعفر الهادي	Masaha	2887	0.27769
		سلسلة الدار الآخرة - عمر عبد الكافي	عمر عبد الكافى شحاتة	ShamelaY19	37011	0.27766
		الغلو واثره في الانحرافات العقدية والمنهجية عند الفرق والأحزاب والجماعات الإسلامية	أبو سيف خليل بن إبراهيم العراقي الأثري	ShamAY	35730	0.27763
		صفات المفلحين في القرآن والسنة	علي بن نايف الشحود	ShamAY	34847	0.27763
		يا اباذر !	آيت الله العظمي حسيني	Ghbook	7995	0.27763
		من تاريخ النحو العربي	سعيد بن محمد بن أحمد الأفغاني (المتوفى: 1417ه)	Sham19Y	9937	0.27761
		لمعات التنقيح في شرح مشكاة المصابيح	عبد الحق بن سيف الدين بن سعد الله البخاري الدهلوي الحنفي «المولود بدهلي في الهند سنة (958 ه) والمتوفى بها سنة (1052 ه) رحمه الله تعالى»	ShamelaY19	145212	0.27761
		منتهى الطلب من أشعار العرب	محمد بن المبارك بن محمد بن ميمون البغدادي (المتوفى: 597هـ)	ShamAY	732	0.2776
		التيسير في أحاديث التفسير	محمد المكي الناصري (المتوفى: 1414هـ)	ShamAY	31629	0.2776
		إيضاح المحصول من برهان الأصول	أبو عبد الله محمد بن علي بن عمر المازري (536 ه)	Sham19Y	16974	0.2776
		 معرفة الإمام 	 السيد محمد حسين الطهراني 	ABLibrary	8893	0.2776
		مقالات الشيخ عبد الرحمن عبد الخالق	عبد الرحمن عبد الخالق اليوسف	ShamAY	34712	0.27758
		 مجلة فقه أهل البيت ( ع ) 	 مجموعة مؤلفين 	ABLibrary	9748	0.27758
		الإقتصاد فيما يتعلّق بالإعتقاد	أبي جعفر محمّد بن الحسن بن علي بن الحسن الطّوسي [ شيخ الطائفة ]	Rafed	3319	0.27758
		معالم الأصول(مع حاشية سلطان العلماء)	الشيخ جمال الدين الحسن بن زين الدين‏ العاملي	Masaha	4330	0.27758
		إكفار الملحدين في ضروريات الدِّين	محمد أنور شاه بن معظم شاه الكشميري الهندي (المتوفى: 1353هـ)	ShamAY	21788	0.27757
		شرح مشكل الوسيط	عثمان بن عبد الرحمن، أبو عمرو، تقي الدين المعروف بابن الصلاح (المتوفى: 643ه)	ShamelaY19	21525	0.27756
		روضة القضاة وطريق النجاة	علي بن محمد بن أحمد، أبو القاسم الرحبي المعروف بابن السمناني (المتوفى: 499 ه)	ShamelaY19	18608	0.27756
		 محاضرة الأبرار ومسامرة الأخيار 	 ابن عربي 	ABLibrary	8746	0.27751
		الكلام على مسألة السماع	أبو عبد الله محمد بن أبي بكر بن أيوب ابن قيم الجوزية (المتوفى: 751 هـ)	ShamAY	38482	0.27748
		تفسير المراغي [ج ١٦]	أحمد مصطفى المراغي	Rafed	1686	0.27748
		نقد الشعر	قدامة بن جعفر بن قدامة بن زياد البغدادي، أبو الفرج (المتوفى: 337ه)	ShamelaY19	28181	0.27747
		 البحر المحيط في أصول الفقه 	 الزركشي 	ABLibrary	802	0.27746
		تفسير البيضاوي = أنوار التنزيل وأسرار التأويل	ناصر الدين أبو سعيد عبد الله بن عمر بن محمد الشيرازي البيضاوي (المتوفى: 685هـ)	ShamAY	23588	0.27745
		التفسير الواضح	الحجازي، محمد محمود	ShamelaY19	23589	0.27743
		المرقبة العليا فيمن يستحق القضاء والفتيا = تاريخ قضاة الأندلس	أبو الحسن علي بن عبد الله بن محمد بن محمد ابن الحسن الجذامي النباهي المالقي الأندلسي (المتوفى: نحو 792هـ)	ShamAY	4363	0.27741
		نتائج البحوث وخواتيم الكتب	هذه نتائج وخواتيم رسائل علمية وأبحاث لمؤلفين مختلفين تحوي خلاصات ما فيها	ShamAY	1540	0.27741
		 النور الأبهر في الدفاع عن الشيخ الأكبر 	 مجموعة مؤلفين 	ABLibrary	8805	0.2774
		الكلمة الغراء في تفضيل الزهراء(ع) وعقيلة الوحي‏	السيد عبد الحسين شرف الدين	Masaha	2858	0.2774
		هَلْ تَخَلَّى اللهُ عَنْ أُمَّةِ مُحَمَّدٍ - صلى الله عليه وسلم -؟	علي بن نايف الشحود	ShamAY	33276	0.27738
		الصراع بين الأمويين ومبادئ الاسلام	الدكتور نوري جعفر	Rafed	79	0.27738
		البلدان	أبي عبدالله أحمد بن محمد بن إسحاق الهمذاني [ ابن الفقيه ]	Rafed	3770	0.27737
		مشاهير أعلام المسلمين	علي بن نايف الشحود	ShamAY	35792	0.27736
		فقه القرآن - الجزء1	القطب الراوندي	Masaha	708	0.27732
		علوم الحديث ومصطلحه - عرض ودراسة	د. صبحي إبراهيم الصالح (المتوفى: 1407ه)	ShamelaY19	96229	0.27731
		التفسير الوسيط للقرآن الكريم [ج ٧]	الدكتور محمد سيد طنطاوي	Rafed	3945	0.2773
		لمسات بيانية في نصوص من التنزيل - كتاب	فاضل بن صالح بن مهدي بن خليل البدري السامرائي	ShamAY	9097	0.27729
		الأمثل في تفسير كتاب الله المنزل [ج ٧]	آية الله مكارم الشيرازي	Rafed	2047	0.27729
		معالم الدين وملاذ المجتهدين‏	الشيخ جمال الدين الحسن بن زين الدين‏ العاملي	Masaha	4331	0.27728
		جامع الشتات	الشيخ الخواجوئي	Masaha	1457	0.27726
		المسلك في أصول الدّين	الشيخ نجم الدين أبي القاسم جعفر بن الحسن بن يحيى بن سعيد الهذلي [ المحقق الحلّي ]	Rafed	3474	0.27725
		فقه القرآن [ج ٢]	قطب الدين سعيد بن هبة الله الراوندي [ قطب الدين الراوندي ]	Rafed	1310	0.27725
		تنزيه الأنبياء	علي بن الحسين الموسوي العلوي [ الشريف المرتضى علم الهدى ]	Rafed	1746	0.27721
		روح المعاني [ج ٤]	أبي الفضل شهاب الدين السيّد محمود الألوسي البغدادي	Rafed	3184	0.2772
		البحر المحيط في التفسير	أبو حيان محمد بن يوسف بن علي بن يوسف بن حيان أثير الدين الأندلسي (المتوفى: 745هـ)	ShamAY	23591	0.27719
		تفسير التّحرير والتّنوير [ج ٢٩]	الشيخ محمّد الطاهر ابن عاشور	Rafed	2939	0.27718
		ديوان علي الجارم	علي بن صالح بن عبد الفتاح الجارم	ShamAY	37961	0.27717
		تأويل مختلف الحديث	أبو محمد عبد الله بن مسلم بن قتيبة الدينوري (المتوفى: 276هـ)	ShamAY	7292	0.27716
		معجم الأدباء أو إرشاد الأريب إلى معرفة الأديب	أبو عبد الله ياقوت بن عبد الله الرومي الحموي	ShamAY	34599	0.27716
		أعلام المغرب والأندلس في القرن الثامن	إسماعيل بن يوسف بن محمد بن نصر الخزرجي الأنصاري النصري، أبو الوليد، المعروف بابن الأحمر (المتوفى: 807ه)	ShamelaY19	120143	0.27715
		إلى الإسلام من جديد	علي أبو الحسن بن عبد الحي بن فخر الدين الندوي (المتوفى: 1420هـ)	ShamAY	985	0.27714
		موسوعة محاسن الإسلام ورد شبهات اللئام	أحمد بن سليمان أيوب، ونخبة من الباحثين	ShamelaY19	146418	0.27714
		وقعة صفّين	نصر بن مزاحم المنقري	Rafed	401	0.27714
		فصل الخطاب في شرح مسائل الجاهلية (المسائل التي خالف فيها رسول الله صلى الله عليه وسلم أهل الجاهلية)	أبو المعالي محمود شكري بن عبد الله بن محمد بن أبي الثناء الألوسي (المتوفى: 1342هـ)	ShamAY	8549	0.27713
		الإعلام بفوائد عمدة الأحكام	ابن الملقن سراج الدين أبو حفص عمر بن علي بن أحمد الشافعي المصري (المتوفى: 804هـ)	ShamAY	31785	0.27713
		الزواجر عن اقتراف الكبائر - العصرية	الواحدي :: ابن حجر الهيتمي	ShamAY	33753	0.27712
		قصة آدم عليه السلام	الواحدي :: ياسر برهامي	ShamAY	34985	0.27712
		تفسير ابن جزي = التسهيل لعلوم التنزيل	أبو القاسم، محمد بن أحمد بن محمد بن عبد الله، ابن جزي الكلبي الغرناطي (المتوفى: 741ه)	ShamelaY19	23626	0.27711
		المراسم العلوية و الأحكام النبوية	الفقيه سلار	Masaha	984	0.27711
		شرح ديوان الحماسة (ديوان الحماسة: اختاره أبو تمام حبيب بن أوس ت 231 ه)	يحيى بن علي بن محمد الشيباني التبريزي، أبو زكريا (المتوفى: 502ه)	Sham19Y	6907	0.2771
		نثر الدر في المحاضرات	منصور بن الحسين الرازي، أبو سعد الآبى (المتوفى: 421هـ)	ShamAY	7853	0.27709
		بحار الأنوار [ج ٩١]	الشيخ محمّد باقر بن محمّد تقي المجلسي	Rafed	1171	0.27708
		آيات الأحكام	محمد بن علي الاسترابادي	Rafed	3183	0.27707
		المكاسب المحرمه (للاراكي)	محمد علي اراكي	Ghbook	15435	0.27707
		 الانتصارات الإسلامية في كشف شبه النصرانية 	 سليمان بن عبد القوي الطوفي الصرصي الحنبلي 	ABLibrary	8313	0.27706
		تفسير من وحي القرآن [ج ١]	السيد محمد حسين فضل الله	Rafed	3257	0.27706
		الخلاصة في بيان أسباب اختلاف الفقهاء	الواحدي :: علي بن نايف الشحود	ShamAY	36080	0.27705
		لطائف الإشارات = تفسير القشيري	عبد الكريم بن هوازن بن عبد الملك القشيري (المتوفى: 465ه)	ShamelaY19	23629	0.27705
		دروس الشيخ أسامة سليمان	أسامة علي محمد سليمان	ShamelaY19	37774	0.27705
		شرح زروق على متن الرسالة لابن أبي زيد القيرواني	شهاب الدين أبو العباس أحمد بن أحمد بن محمد بن عيسى البرنسي الفاسي، المعروف بـ زروق (المتوفى: 899هـ)	ShamAY	32008	0.27704
		روضة المحبين ونزهة المشتاقين	محمد بن أبي بكر بن أيوب بن سعد شمس الدين ابن قيم الجوزية (المتوفى: 751هـ)	ShamAY	11229	0.27703
		الإفصاح في إمامة أمير المؤمنين عليه السلام	محمّد بن محمّد النعمان العكبري [ الشيخ المفيد ]	Rafed	1568	0.27702
		التبيان في أقسام القرآن	محمد بن أبي بكر بن أيوب بن سعد شمس الدين ابن قيم الجوزية (المتوفى: 751هـ)	ShamAY	7572	0.277
		شرح أصول اعتقاد أهل السنة للالكائي - حسن أبو الأشبال	أبو الأشبال حسن الزهيري آل مندوه المنصوري المصري	Sham19Y	37437	0.27699
		نهج الحقّ وكشف الصدق‏	العلامة الحلي	Masaha	4552	0.27699
		تفسير ابن عربي [ج ١]	محيي الدين بن علي بن أحمد بن عبدالله الطائي الحاتمي [ ابن عربي ]	Rafed	3854	0.27698
		تفسير التّحرير والتّنوير [ج ١٥]	الشيخ محمّد الطاهر ابن عاشور	Rafed	2919	0.27694
		الشعائر الحسينيه في الميزان الفقهي 	عبدالحسين حلي	Ghbook	5965	0.27691
		فيض الرحمن تفسير جواهر القرآن	أبو يوسف محمد زايد	ShamAY	33116	0.27689
		التهذيب في فقه الإمام الشافعي	محيي السنة، أبو محمد الحسين بن مسعود بن محمد بن الفراء البغوي الشافعي (المتوفى: 516 ه)	Sham19Y	17885	0.27689
		ديوان ابن الخياط	ابن الخياط، احمد بن محمد بن على بن يحيى التغلبى 450 - 517 هـ	ShamAY	37837	0.27688
		شرح لامية شيخ الإسلام	عبد الكريم الخضير	ShamAY	17	0.27688
		خزائن الأحكام‏  - الجزء1	آغا بن عابد الدربندي	Masaha	3642	0.27688
		 فقه الطب والتضخم النقدي 	 الشيخ محمد السند 	ABLibrary	9552	0.27686
		سيّد المرسلين صلّى الله عليه وآله [ج ١]	الشيخ جعفر السبحاني	Rafed	185	0.27686
		الروض المعطار في خبر الأقطار	أبو عبد الله محمد بن عبد الله بن عبد المنعم الحِميرى (المتوفى: 900هـ)	ShamAY	1043	0.27685
		دقائق التفسير الجامع لتفسير ابن تيمية	تقي الدين أبو العباس أحمد بن عبد الحليم بن عبد السلام بن عبد الله بن أبي القاسم بن محمد ابن تيمية الحراني الحنبلي الدمشقي (المتوفى: 728ه)	Sham19Y	5487	0.27685
		شرح لامية شيخ الإسلام	عبد الكريم الخضير	ShamelaY19	27248	0.27685
		بدائع الفوائد - نزار الباز	محمد بن أبي بكر أيوب الزرعي أبو عبد الله	ShamAY	34422	0.27684
		 شرح توحيد الصدوق 	 القاضي سعيد القمي 	ABLibrary	8479	0.27684
		أخبار الزمان ومن أباده الحدثان، وعجائب البلدان والغامر بالماء والعمران	أبو الحسن على بن الحسين بن على المسعودي (المتوفى: 346هـ)	ShamAY	8620	0.27683
		بريقة محمودية في شرح طريقة محمدية وشريعة نبوية في سيرة أحمدية	محمد بن محمد بن مصطفى بن عثمان، أبو سعيد الخادمى الحنفي (المتوفى: 1156ه)	ShamelaY19	21654	0.27682
		علم التفسير كيف نشأ وتطور حتى انتهى إلى عصرنا الحاضر	عبد المنعم النمر (المتوفى: 1991 م)	ShamelaY19	37996	0.27681
		الحسنة والسيئة	تقي الدين أبو العباس أحمد بن عبد الحليم بن عبد السلام بن عبد الله بن أبي القاسم بن محمد ابن تيمية الحراني الحنبلي الدمشقي (المتوفى: 728هـ)	ShamAY	7609	0.2768
		ثم اهتديت	الدكتور محمّد التيجاني السماوي	Rafed	249	0.27679
		في سبيل العقيدة الإسلامية	عبد اللطيف بن علي بن أحمد بن محمد السلطاني القنطري الجزائري (المتوفى: 1404هـ)	ShamAY	31655	0.27678
		الإعجاز اللغوي والبياني في القرآن الكريم	علي بن نايف الشحود	ShamAY	36742	0.27678
		 معرفة الإمام 	 السيد محمد حسين الطهراني 	ABLibrary	8885	0.27678
		موسوعة العتبات المقدسة  - الجزء1	جعفر الخليلي	Masaha	3747	0.27677
		خصائص التراكيب دارسة تحليلية لمسائل علم المعاني	محمد محمد أبو موسى	ShamAY	3334	0.27676
		فقه السيرة للغزالي	محمد الغزالي السقا (المتوفى: 1416هـ)	ShamAY	23659	0.27674
