automatic URI	Proposed URI	bookTitle	authorName	collection	id	tfidf
		آداب الزفاف في السنة المطهرة	أبو عبد الرحمن محمد ناصر الدين، بن الحاج نوح بن نجاتي بن آدم، الأشقودري الألباني (المتوفى: 1420هـ)	ShamAY	7494	0.25814
		مقالات العلامة الدكتور محمود محمد الطناحي	محمود محمد الطناحي	ShamAY	38630	0.25814
		حياة الإمام الحسين عليه السلام [ج ٣]	باقر شريف القرشي	Rafed	1622	0.25814
		علم الروحانيات في الاسلام: دراسه تبحث بالدليل العلمي الفقهي عن الاوفاق و الطلاسم...	مصطفي الامامي الاهوازي	Ghbook	16365	0.25814
		الخلاصة في أحكام الاجتهاد والتقليد	الواحدي :: علي بن نايف الشحود	ShamAY	36069	0.25813
		السيرة النبوية والدعوة في العهد المكي	أحمد أحمد غلوش	ShamAY	10552	0.25813
		المنثور في القواعد الفقهية	أبو عبد الله بدر الدين محمد بن عبد الله بن بهادر الزركشي (المتوفى: 794هـ)	ShamAY	21592	0.25813
		 كنوز الذهب في تاريخ حلب 	 أبي ذر سبط ابن العجمي 	ABLibrary	9167	0.25813
		العصمة حقيقتها ادلتها	مركز الرسالة	Masaha	343	0.25813
		تفسير العثيمين: جزء عم	محمد بن صالح بن محمد العثيمين (المتوفى: 1421هـ)	ShamAY	21808	0.25811
		الخلاصة في معاني النصر الحقيقية	علي بن نايف الشحود	ShamAY	33263	0.25811
		مجمع البحرين [ج ٣]	الشيخ فخر الدين الطريحي	Rafed	1241	0.25811
		النجم الزاهر في صلاة المسافر	السيد محمد علي الحجة الكوهكمري	Masaha	5003	0.25811
		شَرح المُقَدّمَة الحضرمية المُسمّى بُشرى الكريم بشَرح مَسَائل التَّعليم	سَعيد بن محمد بَاعَليّ بَاعِشن الدَّوْعَنِيُّ الرباطي الحضرمي الشافعي (المتوفى: 1270هـ)	ShamAY	506	0.2581
		طريق الوصول الي مهمات علم الاصول: اصول الفقه باسلوب حديث و آراء جديدة	آيت الله العظمي ناصرمكارم شيرازي	Ghbook	12028	0.2581
		مقاصد الشريعة	عياض السلمي	ShamAY	37580	0.25809
		 رحلات في فارس 	 ژان شاردن ( تعريب : صلاح صلاح ) 	ABLibrary	9124	0.25809
		مصادر الحكم الشرعي والقانون المدني‏  - الجزء1	الشيخ كاشف الغطاء	Masaha	4321	0.25809
		أسرار العربية	عبد الرحمن بن محمد بن عبيد الله الأنصاري، أبو البركات، كمال الدين الأنباري (المتوفى: 577هـ)	ShamAY	7502	0.25808
		نصره المظلوم	محمد علي الحلو	Ghbook	12334	0.25808
		الوفا بما يجب لحضرة المصطفى	السمهودي	ShamAY	38406	0.25807
		المحاسن و المساوي	ابراهيم بن محمد البيهقي	Masaha	2349	0.25807
		الزاهر في غريب ألفاظ الشافعي	محمد بن أحمد بن الأزهري الهروي، أبو منصور (المتوفى: 370ه)	Sham19Y	11319	0.25806
		طبّ الإمام الصادق عليه السلام	محمّد الخليلي	Rafed	74	0.25806
		جواهر الكلام [ج ٢٥]	الشيخ محمّد حسن النّجفي	Rafed	659	0.25806
		كتاب الخمس	الشيخ مرتضى الأنصاري	Masaha	629	0.25806
		في ضيافة الرحمن	محمد مهدي آصفي	Ghbook	10934	0.25806
		أخبار الشيعة وأحوال رواتها	الألوسي، محمود شكري	ShamAY	35891	0.25805
		القصص القرآني - ياسر برهامي	الشيخ ياسر بن حسين برهامي	ShamAY	378	0.25805
		شرح حديث جابر في صفة حج النبي صلى الله عليه وسلم	عبد الكريم بن عبد الله بن عبد الرحمن بن حمد الخضير	ShamAY	69	0.25804
		بدائع الأفكار	الميرزا حبيب الله الرشتي	Masaha	2669	0.25804
		بدائع الأفكار	الميرزا حبيب الله الرشتي	Masaha	3182	0.25804
		منازل الحور العِين في قلوب العارفين برب العالمين	أبو محمد عبد الكريم بن صالح بن عبد الكريم الحميد	ShamAY	1081	0.25803
		دستور الأخلاق في القرآن	محمد بن عبد الله دراز (المتوفى: 1377هـ)	ShamAY	8665	0.25803
		تاريخ النقد الأدبي عند العرب	دكتور إحسان عباس (المتوفى: 1424هـ)	ShamAY	1014	0.25802
		استقصاء النّظر في القضاء والقدر	الحسن بن يوسف بن علي المطّهر [ العلامة الحلّي ]	Rafed	3422	0.25802
		معالم التنزيل في تفسير القرآن = تفسير البغوي	محيي السنة، أبو محمد الحسين بن مسعود البغوي (المتوفى: 510هـ)	ShamAY	41	0.25801
		من بلاغة القرآن فى التعبير بالغدو والأصال والعشى والإبكار	الدكتور محمد محمد عبد العليم دسوقي	ShamAY	2087	0.25801
		المقال وتطوره في الأدب المعاصر	السيد مرسي أبو ذكري	ShamAY	10540	0.25801
		مستمسك العروة الوثقى [ج ١٠]	آية الله السيد محسن الطباطبائي الحكيم	Rafed	418	0.25801
		يسئلونك عن ... الاسئله المطروحه علي النبي الاكرم صلي الله عليه واله و سلم في الق...	آيت الله العظمي ناصرمكارم شيرازي	Ghbook	11971	0.25801
		الجواب الصحيح لمن بدل دين المسيح لابن تيمية	تقي الدين أبو العباس أحمد بن عبد الحليم بن عبد السلام بن عبد الله بن أبي القاسم بن محمد ابن تيمية الحراني الحنبلي الدمشقي (المتوفى: 728هـ)	ShamAY	170	0.258
		رحلة ابن جبير ط دار بيروت	ابن جبير، محمد بن أحمد بن جبير الكناني الأندلسي، أبو الحسين (المتوفى: 614هـ)	ShamAY	11203	0.25799
		المختار في الرد على النصارى	عمرو بن بحر بن محبوب الكناني بالولاء، الليثي، أبو عثمان، الشهير بالجاحظ (المتوفى: 255هـ)	ShamAY	1169	0.25799
		أصول الفقه [ج ١]	آية الله الشيخ محمد علي الأراكي	Rafed	3599	0.25799
		 بحار الأنوار 	 العلامة المجلسي 	ABLibrary	785	0.25798
		الاعتقاد الخالص من الشك والانتقاد	علي بن إبراهيم بن داود بن سلمان بن سليمان، أبو الحسن، علاء الدين ابن العطار (المتوفى: 724هـ)	ShamAY	32187	0.25797
		القيامة الصغرى	عمر بن سليمان بن عبد الله الأشقر العتيبي	ShamAY	9834	0.25797
		شرح رياض الصالحين	محمد بن صالح بن محمد العثيمين (المتوفى: 1421هـ)	ShamAY	9260	0.25797
		 الذخيرة في الحقيقة 	 علي بن محمد الوليد 	ABLibrary	8423	0.25797
		الوسيط في أصول الفقه [ج ١]	الشيخ جعفر السبحاني	Rafed	2655	0.25797
		القرآن الكريم و روايات المدرستين	مرتضي عسكري	Ghbook	7582	0.25797
		الاعتصام للشاطبي ت الشقير والحميد والصيني	إبراهيم بن موسى بن محمد اللخمي الغرناطي الشهير بالشاطبي (المتوفى: 790ه)	Sham19Y	36558	0.25796
		شرح الطحاوية - يوسف الغفيص	يوسف بن محمد علي الغفيص	ShamAY	31670	0.25795
		رحلة مدام ديولافوا من المحمّرة إلى البصرة وبغداد	ديولافوا	Rafed	2623	0.25795
		معالم الدين و ملاذ المجتهدين (قسم الفقه) - الجزء1	جمال الدين الحسن بن زين الدين العاملي	Masaha	1209	0.25795
		الموسوعة الفقهية الكويتية	مجموعة من المؤلفين	ShamAY	11430	0.25793
		الدّروع الواقية	السيّد رضي الدين أبو القاسم علي بن موسى بن جعفر بن طاووس الحسني الحلّي [ السيّد بن طاووس ]	Rafed	231	0.25792
		الخلاصة في أحاديث الطائفة المنصورة	الواحدي :: علي بن نايف الشحود	ShamAY	36068	0.25791
		قرة العين بفتاوى علماء الحرمين	حسين بن إبراهيم المغربي أصلا المصري ولادة ومنشأ، الأزهري طالبا، المكي جوارا ومهاجرا المالكي مذهبا (المتوفى: 1292ه)	Sham19Y	36569	0.25791
		كتاب الهداية	الشيخ الصدوق	Masaha	620	0.2579
		شرح المنهج المنتخب إلى قواعد المذهب	المنجور أحمد بن علي المنجور (المتوفى 995 ه)	Sham19Y	18279	0.25789
		الحميري وشعره في الغدير	الشيخ عبد الحسين الأميني النجفي	Masaha	241	0.25789
		المَطَالِعُ النَّصرية للمَطَابِعِ المصريَّةِ في الأصُول الخَطيَّةِ	نصر (أبو الوفاء) ابن الشيخ نصر يونس الوفائي الهوريني الأحمدي الأزهري الأشعري الحنفي الشافعيّ (المتوفى: 1291هـ)	ShamAY	32171	0.25788
		المختار في الرد على النصارى	عمرو بن بحر بن محبوب الكناني بالولاء، الليثي، أبو عثمان، الشهير بالجاحظ (المتوفى: 255ه)	ShamelaY19	37716	0.25784
		 الرحلة المعينية 	 ماء العينين بن العتيق 	ABLibrary	9108	0.25784
		 دفع أباطيل الكاتب 	 السيد المرتضى المهري 	ABLibrary	967	0.25784
		دروس تمهيديه في العقيده الاسلاميه	علي شيرواني	Ghbook	15025	0.25784
		رحلة ابن بطوطة المسماة تحفة النظار في غرائب الامصار وعجائب الأسفار	محمد بن عبد الله بن محمد بن إبراهيم اللواتي الطنجي، أبو عبد الله، ابن بطوطة (المتوفى: 779ه)	Sham19Y	12009	0.25783
		قاعدة في الانغماس في العدو وهل يباح	تقي الدين أبو العباس أحمد بن عبد الحليم بن عبد السلام بن عبد الله بن أبي القاسم بن محمد ابن تيمية الحراني الحنبلي الدمشقي (المتوفى: 728هـ)	ShamAY	11288	0.25782
		الأنس الجليل بتاريخ القدس والخليل	عبد الرحمن بن محمد بن عبد الرحمن العليمي الحنبلي، أبو اليمن، مجير الدين (المتوفى: 928هـ)	ShamAY	6626	0.25782
		الوقت أنفاس لا تعود	عبد الملك بن محمد القاسم	ShamelaY19	95684	0.25782
		أساس الحكومة الإسلامية	السيد كاظم الحسيني الحائري	Masaha	4892	0.25782
		التعليقات والنوادر	أبو علي الهجري، هارون بن زكريا (المتوفى: نحو 300هـ)	ShamAY	664	0.25781
		مرآة الزمان في تواريخ الأعيان	شمس الدين أبو المظفر يوسف بن قِزْأُوغلي بن عبد الله المعروف بـ «سبط ابن الجوزي» (581 - 654 هـ)	ShamAY	38953	0.2578
		تيسير العزيز الحميد في شرح كتاب التوحيد	سليمان بن عبد الله بن محمد بن عبد الوهاب	ShamAY	33888	0.25779
		تلخيص البيان فى مجازات القرآن	الشريف الرضى	ShamAY	34094	0.25779
		فتاوى مهمة لعموم الأمة	عبد العزيز بن باز , محمد بن صالح العثيمين	ShamAY	6394	0.25778
		الكفاية في التفسير بالمأثور والدراية	د. عبد الله خضر حمد	ShamelaY19	151008	0.25778
		الموالاة والمعاداة في الشريعة الإسلامية	محماس بن عبد الله بن محمد الجلعود	ShamAY	485	0.25777
		المدخل إلى علوم القرآن الكريم	محمد فاروق النبهان	ShamelaY19	38032	0.25777
		 خلاصة عبقات الأنوار 	 السيد حامد النقوي 	ABLibrary	93	0.25777
		 إثنا عشر رسالة 	 السيد محمد باقر الداماد ( الميرداماد ) 	ABLibrary	834	0.25776
		الموسوعة القرآنيّة [ج ٢]	ابراهيم الأبياري	Rafed	3784	0.25776
		أصول الدعوة وطرقها 2 - جامعة المدينة	مناهج جامعة المدينة العالمية	ShamAY	1669	0.25775
		موسوعة الفرق المنتسبة للإسلام - الدرر السنية	مجموعة من المؤلفين	ShamelaY19	32150	0.25775
		الكلمات النيرات في شرح الورقات	مشهور آل سلمان	ShamAY	37530	0.25772
		موقف ابن تيمية من الأشاعرة	عبد الرحمن بن صالح المحمود	ShamAY	12766	0.25771
		 مسالك الأبصار في ممالك الأمصار 	 أحمد بن يحيى العمري 	ABLibrary	9189	0.2577
		 كتاب المكاسب ( المحشَّى ) 	 الشيخ الأنصاري 	ABLibrary	9376	0.2577
		التنبيه والإشراف	أبو الحسن على بن الحسين بن على المسعودي (المتوفى: 346هـ)	ShamAY	23718	0.25769
		كليلة ودمنة	عبد الله بن المقفع (المتوفى: 142 ه) (ترجمة لكتاب الفيلسوف الهندي بيدبا)	ShamelaY19	26537	0.25769
		بذل النصح والتذكير لبقايا المفتونين بالتكفير والتفجير	الواحدي	ShamAY	35516	0.25768
		الامام الثاني عشر (عجل الله تعالي فرجه الشريف) 	محمد سعيد موسوي	Ghbook	6577	0.25768
		الامام الباقر ( عليه السلام ) قدوه و اسوه	آيت الله العظمي سيد محمد تقي مدرسي	Ghbook	6274	0.25768
		صحبه الرسول صلي الله عليه وآله بين المنقول و المعقول	محمد علي نجفي	Ghbook	10946	0.25767
		رساله الولاية	السيد محمد حسين الطباطبائي	Masaha	2836	0.25766
		روضه المتقين	ملا محمدتقي علامه مجلسي اول	Ghbook	2442	0.25766
		شرح ثلاثة الأصول لصالح الفوزان	صالح بن فوزان بن عبد الله الفوزان	ShamAY	8600	0.25765
		سلسلة الإيمان والكفر - المقدم	محمد أحمد إسماعيل المقدم	ShamAY	10	0.25765
		سوس العالمة	محمد المختار بن علي بن أحمد الإلغي السوسي (المتوفى: 1383ه)	ShamelaY19	30038	0.25765
		المغرب في ترتيب المعرب - مكتبة أسامة	ناصر بن عبد السيد أبى المكارم ابن على، أبو الفتح، برهان الدين الخوارزمي المُطَرِّزِىّ (المتوفى: 610هـ)	ShamAY	34680	0.25763
		 بحار الأنوار 	 العلامة المجلسي 	ABLibrary	763	0.25763
		الصفدية	تقي الدين أبو العَباس أحمد بن عبد الحليم بن عبد السلام بن عبد الله بن أبي القاسم بن محمد ابن تيمية الحراني الحنبلي الدمشقي (المتوفى : 728هـ)	ShamAY	22874	0.25762
		دروس الشيخ يوسف الغفيص	يوسف بن محمد علي الغفيص	Sham19Y	37775	0.25762
		دروس للشيخ صالح المغامسي	أبو هاشم صالح بن عواد بن صالح المغامسي	ShamelaY19	37431	0.25762
		 الغاية القصوى في التعليق على العروة الوثقى ( كتاب الخمس ) 	 السيد تقي الطباطبائي القمي 	ABLibrary	9715	0.25762
		إيضاح الغوامض في تقسيم الفرائض	الشيخ علي الغروي العلي ياري	Rafed	1290	0.25762
		مسائل معاصرة في فقه القضاء	السيد محمد سعيد الطباطبائي الحكيم	Masaha	608	0.25762
		المسالِك في شرح مُوَطَّأ مالك	القاضي محمد بن عبد الله أبو بكر بن العربي المعافري الاشبيلي المالكي (المتوفى: 543هـ)	ShamAY	31743	0.25761
		فتح المنعم شرح صحيح مسلم	الأستاذ الدكتور موسى شاهين لاشين	ShamAY	38844	0.25761
		لطائف قرآنية للشيخ محمود غريب	محمود محمد غريب: من علماء الأزهر الشريف والموجه الديني لشباب جامعة القاهرة	ShamAY	114	0.2576
		محمد صلى الله عليه وآله وسلم في مكة	المستشرق الإنجليزي ويليام مونتجمري وات	ShamelaY19	23669	0.2576
		كفاية الأصول(مع تعليقة الزارعي السبزواري)  - الجزء1	علي‏ الزارعي السبزواري	Masaha	4185	0.2576
		الحسبة في الإسلام، أو وظيفة الحكومة الإسلامية	تقي الدين أبو العباس أحمد بن عبد الحليم بن عبد السلام بن عبد الله بن أبي القاسم بن محمد ابن تيمية الحراني الحنبلي الدمشقي (المتوفى: 728هـ)	ShamAY	7263	0.25759
		مِنهاجُ المُسلم - كتاب عقائد وآداب وأخلاق وعَبادات ومعَاملات	أبو بَكر جَابِر الجَزَائِرِي	ShamAY	2071	0.25759
		كتاب الشعر أو شرح الأبيات المشكلة الإعراب	الحسن بن أحمد بن عبد الغفار الفارسيّ الأصل، أبو علي (المتوفى: 377هـ)	ShamAY	870	0.25759
		" آثَارُ الإِمَام مُحَمَّد البَشِير الإِبْرَاهِيمِي ".	محمّد بن بشير بن عمر الإبراهيمي (المتوفى: 1385هـ)	ShamAY	462	0.25759
		صفات الطائفة المنصورة ومفاهمها	عدنان بن محمد آل عرعور	ShamelaY19	147097	0.25759
		 دروس تمهيدية في القواعد الفقهية 	 الشيخ محمد باقر الإيرواني 	ABLibrary	9541	0.25758
		قواعد استنباط الأحكام‏	السيد حسين مكي العاملي	Masaha	4152	0.25758
		مفتاح الأحكام‏	الشيخ أحمد بن محمد مهدي النراقي	Masaha	4339	0.25756
		الفرقان بين أولياء الرحمن وأولياء الشيطان	الشيخ ياسر بن حسين برهامي	ShamAY	45	0.25755
		سلسلة الأحاديث الضعيفة والموضوعة وأثرها السيئ في الأمة	أبو عبد الرحمن محمد ناصر الدين، بن الحاج نوح بن نجاتي بن آدم، الأشقودري الألباني (المتوفى: 1420هـ)	ShamAY	12762	0.25755
		العدالة في أنظمة المجتمع الاسلامي	محمد أحمد عبد الغني	ShamAY	36490	0.25755
		التنقيح في شرح العروة الوثقى - الجزء1	الشيخ علي الغروي	Masaha	924	0.25755
		التذكرة بأحوال الموتى وأمور الآخرة	أبو عبد الله محمد بن أحمد بن أبي بكر بن فرح الأنصاري الخزرجي شمس الدين القرطبي (المتوفى: 671هـ)	ShamAY	21536	0.25754
		خصائص التعبير القرآني وسماته البلاغية	عبد العظيم إبراهيم محمد المطعني (المتوفى: 1429هـ)	ShamAY	21785	0.25754
		لنبدا من جديد ..	آيت الله العظمي سيد محمد حسيني شيرازي	Ghbook	7804	0.25754
		دليل النص بخبر الغدير على امامة امير المؤمنين عليه السلام	أبي الفتح محمّد بن علي الكراجكي	Rafed	191	0.25753
		الخراج لأبي يوسف	أبو يوسف يعقوب بن إبراهيم بن حبيب بن سعد بن حبتة الأنصاري (المتوفى : 182هـ)	ShamAY	26333	0.25752
		موقف الشوكاني في تفسيره من المناسبات	أحمد بن محمد الشرقاوى سالم	ShamAY	943	0.25752
		تأويلات أهل السنّة تفسير الماتريدي [ج ١]	أبي منصور محمّد بن محمّد بن محمود الماتريدي	Rafed	3962	0.25752
		اللّباب في علوم الكتاب [ج ١٠]	أبي حفص عمر بن علي بن عادل الدمشقي الحنبلي	Rafed	3102	0.25752
		نفحات القرآن [ج ١٠]	آية الله مكارم الشيرازي	Rafed	3825	0.25752
		أنوار الأصول [ج ٢]	الناشر: مدرسة الإمام علي بن أبي طالب عليه السلام	Rafed	938	0.25752
		الجديد في الحكمة	سعيد بن منصور بن كمونة	ShamAY	33849	0.25751
		اللباب في علل البناء والإعراب	محبّ الدين عبدالله بن الحسين البغدادي [ أبي البقاء العكبري ]	Rafed	2815	0.25751
		شرح الرضيّ على الكافية [ج ٣]	محمّد بن الحسن الرضي الاسترآبادي	Rafed	1800	0.25751
		الدر المنثور في طبقات ربات الخدور	زينب بنت علي بن حسين بن عبيد الله بن حسن بن إبراهيم بن محمد بن يوسف فواز العاملي (المتوفى: 1332هـ)	ShamAY	9229	0.2575
		حاشية كتاب التوحيد	عبد الرحمن بن محمد بن قاسم العاصمي القحطاني الحنبلي النجدي (المتوفى: 1392هـ)	ShamAY	11149	0.2575
		اعلام الهدايه (الامام الحسن المجتبي عليه السلام)	جمعي از نويسندگان	Ghbook	6051	0.2575
		وفيات الأعيان وأنباء أبناء الزمان	أبو العباس شمس الدين أحمد بن محمد بن إبراهيم بن أبي بكر ابن خلكان البرمكي الإربلي (المتوفى: 681هـ)	ShamAY	1000	0.25749
		تاج العروس من جواهر القاموس - ط الفكر	محمّد بن محمّد بن عبد الرزّاق الحسيني، الملقّب بمرتضى الزَّبيدي (المتوفى: 1205هـ)	ShamAY	34693	0.25749
		دراسات أصولية في القرآن الكريم	محمد إبراهيم الحفناوى	ShamAY	1472	0.25749
		القواعد الفقهيّة [ج ٤]	آية الله السيّد محمّد حسن البجنوردي	Rafed	711	0.25749
		مفهوم تجديد الدين	بسطامي محمد سعيد خير	Sham19Y	17731	0.25748
		البديع في علم العربية - الجزء1_1	ابن الأثير الجزري	Masaha	3375	0.25748
		الرحيق المختوم	صفي الرحمن المباركفوري (المتوفى: 1427هـ)	ShamAY	9820	0.25747
		المحاسن والمساوئ	إبراهيم بن محمد البيهقي (المتوفى: نحو 320هـ)	ShamAY	564	0.25747
		الموسوعة القرآنيّة [ج ٣]	ابراهيم الأبياري	Rafed	3812	0.25747
		المجتبى عليه السلام بين وميض الحرف ووهج القافية	الناشر: المكتبة الأدبيّة المختصّة	Rafed	20	0.25747
		الوسيط في اُصول الفقه‏  - الجزء1	الشيخ جعفر السبحاني	Masaha	3597	0.25747
		الإقناع في الفقه الشافعي	أبو الحسن علي بن محمد بن محمد بن حبيب البصري البغدادي، الشهير بالماوردي (المتوفى: 450هـ)	ShamAY	6120	0.25744
		فتح المجيد شرح كتاب التوحيد - ت: الفقي	عبد الرحمن بن الحسن آل الشيخ	ShamAY	33892	0.25741
		ثمار يانعة وتعليقات نافعة	أبو محمد عبد الكريم بن صالح بن عبد الكريم الحميد	ShamAY	1086	0.2574
		موسوعة الإمام الخوئي - الجزء1	السيد أبو القاسم الموسوي الخوئي	Masaha	1762	0.2574
		شرح العقيدة الواسطية للفوزان	صالح بن فوزان الفوزان	ShamAY	35431	0.25739
		آداب المتعلمين	فرج البوسيفي	ShamAY	35013	0.25739
		 موسوعة مرآة الحرمين الشريفين وجزيرة العرب 	 أيوب صبري باشا 	ABLibrary	9288	0.25739
		دروس للشيخ محمد حسان	محمد بن إبراهيم بن إبراهيم بن حسان	ShamAY	417	0.25738
		التنجيم والمنجمون وحكم ذلك في الإسلام	عبد المجيد بن سالم المشعبي	ShamAY	7591	0.25738
		فقه الخلاف وأثره في القضاء على الإرهاب	د. يوسف بن عبد الله الشبيلي	ShamAY	1199	0.25738
		اباطيل البهائيه و بروتوكولات صهيون	عبدالعزيز شرف	Ghbook	7018	0.25738
		مطاعن سيد قطب في أصحاب رسول الله صلى الله عليه وسلم	ربيع بن هادي المدخلي	ShamAY	33007	0.25737
		شرح الكافية الشافية	محمد بن عبد الله، ابن مالك الطائي الجياني، أبو عبد الله، جمال الدين (المتوفى: 672هـ)	ShamAY	12024	0.25737
		الأدب العربي المعاصر في مصر	أحمد شوقي عبد السلام ضيف الشهير بشوقي ضيف (المتوفى: 1426هـ)	ShamAY	9981	0.25737
		 موسوعة العتبات المقدسة 	 جعفر الخليلي 	ABLibrary	9245	0.25737
