automatic URI	Proposed URI	bookTitle	authorName	collection	id	tfidf
		رفقاء طريق	عبد الملك بن محمد القاسم	ShamelaY19	95685	0.26687
		ورثة الأنبياء	عبد الملك بن محمد القاسم	ShamelaY19	36550	0.26687
		البيزرة	بازيار العزيز بالله نزار الفاطمي، يظن أنه أبو عبد الله الحسن بن الحسين (المتوفى: ق 4هـ)	ShamAY	3944	0.26685
		 روض الرياحين في حكايات الصالحين ( نزهة العيون النواظر . . . ) 	 عبد الله بن أسعد اليافعي اليمني المكي 	ABLibrary	8803	0.26685
		دعائم الإسلام - الجزء1	ابو حنيفة	Masaha	996	0.26685
		شخصية المسلم كما يصوغها الإسلام في الكتاب والسنة	الدكتور محمد علي الهاشمي	ShamelaY19	96265	0.26684
		حاشية المكاسب / تقريرات النجم آبادي	الشيخ آقا ضياء الدين العراقي	Masaha	5019	0.26684
		القواعد الأصولية والفقهية في المستمسك‏	الشيخ محمد آصف المحسني	Masaha	3473	0.26684
		 سلسلة المسائل الفقهية 	 الشيخ السبحاني 	ABLibrary	9591	0.26683
		الاتباع لابن أبي العز	صدر الدين محمد بن علاء الدين عليّ بن محمد ابن أبي العز الحنفي، الأذرعي الصالحي الدمشقي (المتوفى: 792هـ)	ShamAY	6248	0.26682
		نهاية إسرائيل والولايات المتحدة الأمريكية من ومتى وكيف؟ دراسة تحليلية للقرآن والسنة والتوراة والإنجيل	خالد عبد الواحد	ShamAY	37705	0.26682
		فضائل الأندلس وأهلها	ابن حزم وابن سعيد والشقندي	Sham19Y	6701	0.26682
		اليواقيت الحسان في تفسير سوره الرحمن؛ المختار من القصائد و الاشعار	مجدالدين نجفي اصفهاني	Ghbook	12924	0.26682
		هذه مفاهيمنا	صالح بن عبد العزيز بن محمد بن إبراهيم آل الشيخ	ShamAY	12120	0.26681
		التّفسير الحديث [ج ٨]	محمّد عزّة دروزة	Rafed	3761	0.2668
		كتاب الأزمنة والأمكنة	الشيخ أبي علي أحمد بن محمد بن الحسن المرزوقي الاصفهاني	Rafed	2404	0.2668
		شرح كتاب فضل الإسلام لمحمد بن عبد الوهاب - ناصر العقل	ناصر بن عبد الكريم العلي العقل	ShamelaY19	37719	0.26679
		هداية المسترشدين - الجزء1	الشيخ محمد تقي الأصفهاني النجفي	Masaha	4828	0.26679
		 عين اليقين الملقب بالأنوار والأسرار 	 الفيض الكاشاني 	ABLibrary	8520	0.26678
		العقائد الإسلامية - الجزء1	مركز المصطفى	Masaha	370	0.26676
		 في بيان الحاجة إلى الطب والأطباء ووصاياهم 	 محمود الكازروني ( قطب الدين محمود الشيرازي ) 	ABLibrary	9933	0.26675
		 المعاد الجسماني 	 شاكر الساعدي 	ABLibrary	8616	0.26675
		علوم القرآن عند الشاطبي من خلال كتابه الموافقات	محمد سالم أبو عاصي	ShamelaY19	37998	0.26674
		 تاريخ مكة 	 أحمد السباعي 	ABLibrary	9006	0.26674
		أصول الفقه المقارن فيما لا نصّ فيه‏	الشيخ جعفر السبحاني	Masaha	2385	0.26673
		المسالك والممالك للبكري	أبو عبيد عبد الله بن عبد العزيز بن محمد البكري الأندلسي (المتوفى: 487هـ)	ShamAY	23849	0.26672
		الامامه (حجه الاسلام شفتي)	محمد باقر شفتي گيلاني	Ghbook	15561	0.26672
		كتاب 1213سؤال وجواب في القرآن الكريم	أبو إسلام أحمد بن علي	ShamAY	37000	0.26671
		ريحانة الكتاب ونجعة المنتاب	محمد بن عبد الله بن سعيد السلماني اللوشي الأصل، الغرناطي الأندلسي، أبو عبد الله، الشهير بلسان الدين ابن الخطيب (المتوفى: 776هـ)	ShamAY	6955	0.26671
		التفسير والمفسرون	الدكتور محمد السيد حسين الذهبي (المتوفى: 1398ه)	Sham19Y	12393	0.26671
		الأمثل في تفسير كتاب الله المنزل [ج ٤]	آية الله مكارم الشيرازي	Rafed	2037	0.26671
		سنّة أهل البيت(ع)	السيد محمد تقي الحكيم	Masaha	306	0.26671
		الأشاعرة		ShamAY	35644	0.2667
		سعد السّعود	السيّد رضي الدين أبو القاسم علي بن موسى بن جعفر بن طاووس الحسني الحلّي [ السيّد بن طاووس ]	Rafed	4013	0.26669
		الخلاصة في معرفة الحديث	الحسين بن محمد بن عبد الله، شرف الدين الطيبي (المتوفى: 743 هـ)	ShamAY	32381	0.26668
		مقدمة ابن الصلاح = معرفة أنواع علوم الحديث - ت فحل	عثمان بن عبد الرحمن، أبوعمرو، تقي الدين المعروف بابن الصلاح (المتوفى: 643ه)	ShamelaY19	23799	0.26668
		أشهد أنّ عليّاً وليّ الله بين الشرعيّة والابتداع	السيد علي الشهرستاني	Rafed	3847	0.26668
		نفحات القرآن [ج ٣]	آية الله مكارم الشيرازي	Rafed	3803	0.26668
		الصحيفة الصادقية	باقر شريف القرشي	Rafed	80	0.26667
		هكذا فلندع إلى الإسلام	محّمد سَعيد رَمضان البوطي	ShamAY	1751	0.26666
		خطب من جامع ابن عثيمين بالزلفي ( 99 خطبة )	الواحدي	ShamAY	34743	0.26665
		العقائد الاسلامية	علي كوراني	Ghbook	15126	0.26664
		جريدة «الشريعة» النبوية المحمدية	تصدرها «جمعية العلماء المسلمين الجزائريين» تحت إشراف رئيسها الأستاذ عبد الحميد بن باديس.	ShamAY	394	0.26663
		فقه الزكاة	يوسف القرضاوي	ShamAY	36406	0.26663
		 الدرجات الرفيعة في طبقات الشيعة 	 السيد علي خان المدني الشيرازي 	ABLibrary	919	0.26663
		التعجب من أغلاط العامة في مسألة الإمامة	الشيخ القاضي أبي الفتح محمد بن علي الكراجكي	Masaha	201	0.26663
		مجمع الأمثال	أبو الفضل أحمد بن محمد بن إبراهيم الميداني النيسابوري (المتوفى: 518هـ)	ShamAY	12929	0.26661
		النصيحة الكافية لمن خصه الله بالعافية	شهاب الدين أبو العباس أحمد بن أحمد بن محمد بن عيسى البرنسي الفاسي، المعروف بـ زروق (المتوفى: 899هـ)	ShamAY	258	0.26661
		حلية البشر في تاريخ القرن الثالث عشر	عبد الرزاق بن حسن بن إبراهيم البيطار الميداني الدمشقي (المتوفى: 1335ه)	ShamelaY19	31371	0.26661
		 الفقه ومسائل طبية 	 الشيخ محمد آصف المحسني 	ABLibrary	9736	0.26661
		التفسير الحديث [مرتب حسب ترتيب النزول]	محمد عزة دروزة	ShamelaY19	23603	0.2666
		 الرسالة القشيرية 	 ابو القاسم عبد الكريم القشيري 	ABLibrary	8711	0.2666
		مدخل إلى تفسير القرآن وعلومه	عدنان محمد زرزور	ShamAY	1492	0.26659
		كشف النقاب عما في «كلمات» أبي غدة من الأباطيل والافتراءات	محمد ناصر الدين الألباني	ShamelaY19	133365	0.26659
		المسائل المستحدثة	الشيخ محمد إسحاق الفياض	Masaha	5018	0.26658
		 جواهر الكلام في ثوبه الجديد 	 الشيخ الجواهري 	ABLibrary	9365	0.26657
		التفسير الوسيط للقرآن الكريم [ج ٨]	الدكتور محمد سيد طنطاوي	Rafed	3946	0.26657
		تحريم آلات الطرب	أبو عبد الرحمن محمد ناصر الدين، بن الحاج نوح بن نجاتي بن آدم، الأشقودري الألباني (المتوفى: 1420هـ)	ShamAY	11081	0.26656
		جلباب المرأة المسلمة في الكتاب والسنة	أبو عبد الرحمن محمد ناصر الدين، بن الحاج نوح بن نجاتي بن آدم، الأشقودري الألباني (المتوفى: 1420ه)	Sham19Y	9994	0.26656
		اللّباب في علوم الكتاب [ج ٣]	أبي حفص عمر بن علي بن عادل الدمشقي الحنبلي	Rafed	3092	0.26654
		الإمام البقاعي ومنهاجه في تأويل بلاغة القرآن	محمود توفيق محمد سعد	ShamAY	952	0.26653
		اللّباب في علوم الكتاب [ج ١٢]	أبي حفص عمر بن علي بن عادل الدمشقي الحنبلي	Rafed	3106	0.26653
		صحيفه مهديه / الصحيفه المهديه ، او الصحيفه الهاديه و التحفه المهديه	ابراهيم بن محسن كاشاني	Ghbook	7112	0.26653
		قضية التنوير	الواحدي :: محمد قطب	ShamAY	33324	0.26652
		جواهر الدرر في حل ألفاظ المختصر	أبو عبد الله شمس الدين محمد بن إبراهيم بن خليل التتائي المالكي (000 - 942 ه)	ShamelaY19	150676	0.26652
		غاية المريد شرح كتاب التوحيد	د. عبد الرحمن بن عبد العزيز العقل	ShamelaY19	145172	0.26652
		المدرّس الأفضل [ج ٢]	الشيخ محمّد علي المدرّس الأفغاني	Rafed	2680	0.26652
		 الإرشاد إلى قواطع الأدلة في أول الاعتقاد 	 عبد الملك الجويني 	ABLibrary	8329	0.26651
		التفسير الوسيط للقرآن الكريم [ج ٦]	الدكتور محمد سيد طنطاوي	Rafed	3944	0.26649
		دروس وفتاوى الحرم المدني لعام 1416هـ	محمد بن صالح بن محمد العثيمين (المتوفى : 1421هـ)	ShamAY	7688	0.26647
		الحماسة البصرية	علي بن أبي الفرج بن الحسن، صدر الدين، أبو الحسن البصري (المتوفى: 659ه)	Sham19Y	6901	0.26647
		مجمع البحرين [ج ٦]	الشيخ فخر الدين الطريحي	Rafed	1247	0.26647
		تصنيف الناس بين الظن واليقين	بكر بن عبد الله أبو زيد	ShamAY	34768	0.26645
		البحر الرائق شرح كنز الدقائق - ط العلمية	ابن نجيم الحنفي	ShamAY	34204	0.26645
		معاني القرآن للفراء	أبو زكريا يحيى بن زياد بن عبد الله بن منظور الديلمي الفراء (المتوفى: 207ه)	ShamelaY19	23634	0.26645
		 معرفة الإمام 	 السيد محمد حسين الطهراني 	ABLibrary	8895	0.26645
		تفسير الجلالين	جلال الدين محمد بن أحمد المحلي (المتوفى: 864هـ) وجلال الدين عبد الرحمن بن أبي بكر السيوطي (المتوفى: 911هـ)	ShamAY	12876	0.26644
		تفسير العثيمين: الحجرات - الحديد	محمد بن صالح بن محمد العثيمين (المتوفى: 1421ه)	ShamelaY19	21805	0.26644
		مدخل التفسير	محمد فاضل لنكراني	Ghbook	8893	0.26644
		نظرات معاصرة في القرآن الكريم	الدكتور محمد حسين علي الصّغير	Rafed	225	0.26643
		الاجتهاد و التقليد	الوحيد البهبهاني	Masaha	1499	0.26643
		شرح باب توحيد الربوبية من فتاوى ابن تيمية	ناصر بن عبد الكريم العلي العقل	ShamelaY19	37722	0.26642
		نواهد الأبكار وشوارد الأفكار = حاشية السيوطي على تفسير البيضاوي	عبد الرحمن بن أبي بكر، جلال الدين السيوطي (المتوفى: 911هـ)	ShamAY	21	0.26641
		شرح معاني شعر المتنبي لابن الإفليلي - السفر الأول	إبراهيم بن محمد بن زكريا الزهري، من بني سعد بن أبي وقاص، أبو القاسم ابن الإفليلي (المتوفى: 441ه)	ShamelaY19	37065	0.26641
		الموسوعة الموجزة في التاريخ الإسلامي	مجموعة من المؤلفين	ShamelaY19	36578	0.2664
		شفاء الضرر بفهم التوكل والقضاء والقدر	أبو فيصل البدراني	ShamelaY19	96249	0.2664
		 التمهيد لقواعد التوحيد 	 أبو الثناء محمود الماتريدي 	ABLibrary	8395	0.2664
		الانتصار لأهل السنة والحديث في رد أباطيل حسن المالكي	عبد المحسن بن حمد بن عبد المحسن بن عبد الله بن حمد العباد البدر	ShamAY	7553	0.26639
		تفريغ فتاوى متنوعة للشيخ الألباني	الواحدي :: ناصر الدين الألباني	ShamAY	33153	0.26639
		تاريخ الأدب الأندلسي (عصر سيادة قرطبة)	دكتور إحسان عباس (المتوفى: 1424ه)	Sham19Y	1016	0.26639
		 كتاب الإعلام بأعلام بيت الله الحرام 	 محمد بن أحمد النهرواني 	ABLibrary	9161	0.26639
		محاضرات في الاعتقادات - الجزء2	السيد علي الحسيني الميلاني	Masaha	402	0.26639
		مهج الدعوات و منهج العبادات	السيد علي بن موسى بن طاووس	Masaha	1041	0.26638
		موسوعة أدب المحنة	السيد محمد علي الحلو	Masaha	77	0.26638
		شرح الإلمام بأحاديث الأحكام	تقي الدين أبو الفتح محمد بن علي بن وهب بن مطيع القشيري، المعروف بابن دقيق العيد (المتوفى: 702 هـ)	ShamAY	32554	0.26633
		الخلاصة في فقه القلوب	الواحدي :: علي بن نايف الشحود	ShamAY	36091	0.26633
		تراثنا ـ العدد [ 37 ]	مؤسسة آل البيت عليهم السلام لإحياء التراث ـ قم	Rafed	2790	0.26633
		التفسير ورجاله للطاهر بن عاشور		ShamAY	36931	0.26632
		اتحاف الفقهاء في تحقيق مسألة اختلاف القراءات والقرّاء	الميرزا محسن آل عصفور	Masaha	1649	0.26632
		الأنوار ومحاسن الأشعار	أبو الحسن علي بن محمد بن المطهر العدوي المعروف بالشمشاطي (المتوفى: 377هـ)	ShamAY	601	0.26631
		بلوغ الأمل في تقرير قاعدةالجزاء من جنس العمل	محمد شومان	ShamAY	37557	0.26631
		هذا هو الطريق	علي بن نايف الشحود	ShamAY	33274	0.26631
		موسوعة الأسئلة العقائديّة [ج ٤]	مركز الأبحاث العقائديّة	Rafed	1389	0.26631
		القصص التربوية	الشيخ محمد تقي الفلسفي	Masaha	562	0.26631
		منكرات الأفراح	غانم غالب غانم	ShamelaY19	96336	0.2663
		بحار الأنوار [ج ١٧]	الشيخ محمّد باقر بن محمّد تقي المجلسي	Rafed	859	0.2663
		الهداية في الأصول‏ / تقريرات - الجزء1	حسن الصافي الأصفهاني	Masaha	3590	0.2663
		الموسوعة العقدية - الدرر السنية	مجموعة من المؤلفين	ShamelaY19	38058	0.26629
		عمدة القاري شرح صحيح البخاري	أبو محمد محمود بن أحمد بن موسى بن أحمد بن حسين الغيتابى الحنفى بدر الدين العينى (المتوفى: 855هـ)	ShamAY	5756	0.26628
		تفصيل النشأتين وتحصيل السعادتين	أبو القاسم الحسين بن محمد المعروف بالراغب الأصفهانى (المتوفى: 502هـ)	ShamAY	21562	0.26628
		نفائس الأصول في شرح المحصول	شهاب الدين أحمد بن إدريس القرافي (ت 684هـ)	ShamAY	31974	0.26628
		دروس للشيخ سفر الحوالي	سفر بن عبد الرحمن الحوالي	Sham19Y	7716	0.26628
		نضرة النعيم في مكارم أخلاق الرسول الكريم	مجموعة من المؤلفين	ShamelaY19	22798	0.26628
		 النفس والروح وشرح قواهما 	 فخر الدين الرازي 	ABLibrary	8668	0.26628
		أيسر التفاسير لكلام العليّ الكبير [ج ٢]	أبي بكر جابر الجزائري	Rafed	3465	0.26628
		التّفسير الحديث  [ج ٢]	محمّد عزّة دروزة	Rafed	3690	0.26628
		التنبيهات اللطيفة على ما احتوت عليه العقيدة الواسطية من المباحث المنيفة	أبو عبد الله، عبد الرحمن بن ناصر بن عبد الله بن ناصر بن حمد آل سعدي (المتوفى: 1376هـ)	ShamAY	9430	0.26627
		شرح العقيدة الواسطية - عبد الكريم الخضير	عبد الكريم الخضير	ShamAY	16	0.26627
		شرح المنظومة البيقونية - عبد الكريم الخضير	عبد الكريم الخضير	ShamelaY19	23743	0.26627
		 الرسائل التوحيدية 	 السيد الطباطبائي 	ABLibrary	8435	0.26627
		معارج الأصول	الشيخ نجم الدين أبي القاسم جعفر بن الحسن بن يحيى بن سعيد الهذلي [ المحقق الحلّي ]	Rafed	271	0.26627
		التحصين لأسرار ما زاد من كتاب اليقين‏	السيد علي بن موسى بن طاووس	Masaha	4805	0.26627
		جمل العلم و العمل	السيد المرتضى	Masaha	994	0.26627
		السياسة الشرعية في إصلاح الراعي والرعية - ت العمران - ط عالم الفوائد	شيخ الإسلام أحمد بن عبد الحليم بن عبد السلام ابن تيمية (661 - 728 هـ)	ShamAY	38472	0.26626
		الأمثال المولدة	محمد بن العباس الخوارزمي، أبو بكر (المتوفى: 383هـ)	ShamAY	10497	0.26626
		مأساة الزهراء(ع) الجزء الأول	السيد جعفر مرتضى العاملي	Masaha	394	0.26626
		الإيضاح في مناسك الحج والعمرة	أبو زكريا محيي الدين يحيى بن شرف النووي (المتوفى: 676هـ)	ShamAY	1706	0.26624
		شرح حديث الافتراق	يوسف بن محمد علي الغفيص	ShamAY	31677	0.26624
		الطبقات السنية في تراجم الحنفية	تقي الدين بن عبد القادر التميمي الداري الغزي (المتوفى: 1010هـ)	ShamAY	322	0.26623
		متن الطحاوية بتعليق الألباني	أبو جعفر أحمد بن محمد بن سلامة بن عبد الملك بن سلمة الأزدي الحجري المصري المعروف بالطحاوي (المتوفى: 321هـ)	ShamAY	9568	0.26623
		دروس الشيخ حسن أبو الأشبال	حسن أبو الأشبال الزهيري	ShamelaY19	37626	0.26622
		الرد على الدكتور عبد الواحد وافي في كتابه بين الشيعة وأهل السنة	إحسان إلهي ظهير الباكستاني (المتوفى: 1407ه)	ShamelaY19	37553	0.26622
		المال والحكم في الإسلام	عبد القادر عودة (المتوفى: 1373هـ)	ShamAY	1935	0.26621
		 الجبر والاختيار 	 السيد محمد صادق الروحاني 	ABLibrary	8404	0.26621
		تفسير الصّافي [ج ٤]	محمّد بن المرتضى [ الفيض الكاشاني ]	Rafed	3035	0.26621
		الدلائل في شرح منتخب المسائل - الجزء1	السيد تقي الطباطبائي القمي	Masaha	4902	0.26621
		الإيضاح في مناسك الحج والعمرة	أبو زكريا محيي الدين يحيى بن شرف النووي (المتوفى: 676ه)	ShamelaY19	96232	0.2662
		شرح ألفية العراقي - عبد الكريم الخضير	عبد الكريم الخضير	ShamelaY19	23769	0.2662
		 إعلام النبلاء بتاريخ حلب الشهباء 	 محمد راغب الطباخ الحلبي 	ABLibrary	8960	0.2662
		مطارح الأنظار	الشيخ أبي القاسم الكلانتري	Masaha	1595	0.2662
		الشيعة والقرآن	إحسان إلهي ظهير الباكستاني (المتوفى: 1407هـ)	ShamAY	957	0.26619
		شرح كتاب فضل الإسلام لمحمد بن عبد الوهاب - ناصر العقل	ناصر بن عبد الكريم العلي العقل	ShamAY	745	0.26618
		تلبيس مردود في قضايا حية	د صالح بن عبد الله بن حميد	ShamelaY19	30823	0.26618
		كتاب السرائر [ج ٣]	أبي جعفر محّمد بن منصور بن أحمد بن إدريس الحلّي	Rafed	1300	0.26618
		أنوار الحُجَج في أسرار الحجج	الواحدي :: الملا على القاري	ShamAY	35033	0.26617
		الفاضح لمذهب الشيعة الإمامية	حامد مسوحلي الإدريسي	ShamAY	27	0.26617
		 رسائل ومقالات 	 الشيخ السبحاني 	ABLibrary	8440	0.26617
		التفسير الموضوعي لسورة الكهف	أحمد بن محمد الشرقاوى	ShamAY	33132	0.26616
		الفتاوى الحديثية لابن حجر الهيتمي (ط الحلبي)	أحمد شهاب الدين بن حجر الهيتمي المكي.	ShamAY	34350	0.26615
		التعليقات المختصرة على متن العقيدة الطحاوية	صالح بن فوزان بن عبد الله الفوزان	ShamelaY19	21523	0.26614
		لمحات	آيت الله العظمي لطف اللّه صافي گلپايگاني	Ghbook	7140	0.26613
		المعتصر من شرح مختصر الأصول من علم الأصول	أبو المنذر محمود بن محمد بن مصطفى بن عبد اللطيف المنياوي	ShamAY	1117	0.26612
		من عبق المرجعيه	آيت الله العظمي حسيني	Ghbook	8020	0.26612
		من أصول الفقه على منهج أهل الحديث	زكريا بن غلام قادر الباكستاني	ShamAY	12085	0.26611
		 ولاية الفقيه في حكومة الإسلام 	 السيد محمد حسين الطهراني 	ABLibrary	9444	0.26611
		الداء والدواء = الجواب الكافي ط عالم الفوائد	أبو عبدالله محمد بن أبي بكر بن أيوب ابن قيم الجوزية (691 - 751)	ShamAY	38516	0.2661
		المسالك في شرح موطأ مالك	القاضي محمد بن عبد الله أبو بكر بن العربي المعافري الاشبيلي المالكي (المتوفى: 543ه)	ShamelaY19	123665	0.2661
		الغلو  و الفرق  الباطنيه	محمد السند	Ghbook	15172	0.2661
		المختصر المفيد في عقائد أئمة التوحيد	أبو يوسف مدحت بن حسن آل فراج المصري (المتوفى: 1435هـ)	ShamAY	32277	0.26608
		فيض الباري على صحيح البخاري	(أمالي) محمد أنور شاه بن معظم شاه الكشميري الهندي ثم الديوبندي (المتوفى: 1353ه)	Sham19Y	98124	0.26608
		لمسات بيانية في نصوص من التنزيل - محاضرات	فاضل بن صالح بن مهدي بن خليل البدري السامرائي	Sham19Y	8312	0.26607
		دراسة موضوعية للحائية ولمعة الاعتقاد والواسطية	عبد الرحيم بن صمايل العلياني السلمي	ShamAY	799	0.26606
		موسوعة عبد الله بن عبّاس [ج ٤]	السيد محمد مهدي السيد حسن الموسوي الخرسان	Rafed	1172	0.26606
		مشرق الشمسين و إكسير السعادتين مع تعليقات الخواجوئى	الشيخ البهائي	Masaha	1208	0.26606
		مناط الأحكام‏	الشيخ نظر علي الطالقاني	Masaha	4367	0.26605
		مباحث التفسير لابن المظفَّر (وهو استدركات وتعليقات على تفسير الكشف والبيان للثعلبي)	أحمد بن محمد بن أحمد المظفر ابن المختار، أبو العباس بدر الدين الرازيّ الحنفي (المتوفى: بعد 630هـ)	ShamAY	22	0.26604
		الرسالة الشافية	أبو بكر عبد القاهر بن عبد الرحمن بن محمد الفارسي الأصل، الجرجاني الدار (المتوفى: 471هـ)	ShamAY	31986	0.26604
		النصيحة الكافية لمن خصه الله بالعافية	شهاب الدين أبو العباس أحمد بن أحمد بن محمد بن عيسى البرنسي الفاسي، المعروف ب زروق (المتوفى: 899ه)	Sham19Y	258	0.26604
		الحدائق الناضرة [ج ١١]	الشيخ يوسف بن أحمد البحراني [ صاحب الحدائق ]	Rafed	2847	0.26604
		الإمامة الإلهية - الجزء2	الشيخ صادق الساعدي	Masaha	86	0.26603
		رسائل المحقق الكركي - الجزء1	علي بن الحسين‏ المحقق الكركي	Masaha	1162	0.26603
		أنوار الأصول‏  - الجزء1	الشيخ أحمد القدسي	Masaha	3132	0.26603
		أنوار الأصول‏ - الجزء1	الشيخ أحمد القدسي	Masaha	2638	0.26603
		نهاية المطلب في دراية المذهب	عبد الملك بن عبد الله بن يوسف بن محمد الجويني، أبو المعالي، ركن الدين، الملقب بإمام الحرمين (المتوفى: 478هـ)	ShamAY	1788	0.26602
		التفسير الوسيط للقرآن الكريم [ج ١٥]	الدكتور محمد سيد طنطاوي	Rafed	3957	0.26602
