automatic URI	Proposed URI	bookTitle	authorName	collection	id	tfidf
		 فارسنامه ناصرى ( فارسى ) 	 ميرزا حسن حسينى فسايى 	ABLibrary	8239	0.70437
		 مطلع سعدين ومجمع بحرين ( فارسى ) 	 كمال الدين عبد الرزاق سمرقندى 	ABLibrary	8280	0.70396
		 الكامل في التاريخ ( تاريخ كامل ) ( فارسي ) 	 ابن الأثير ( مترجم : خليلى / حالت ) 	ABLibrary	7677	0.70351
		 ايران در جنگ بزرگ 1914 - 1918 ( فارسي ) 	 احمد على سپهر ( مورخ الدوله ) 	ABLibrary	7971	0.70335
		 منتخب التواريخ معينى ( فارسى ) 	 معين الدين نطنزى 	ABLibrary	8288	0.70289
		 تاريخ يزد ( فارسى ) 	 جعفر بن محمد بن حسن جعفرى 	ABLibrary	8087	0.70249
		 موسوعة كلمات الامام الحسين ( ع ) ( فرهنگ جامع سخنان امام حسين ع ) ( فارسي ) 	 مجموعة مؤلفين ( مترجم : على مؤيدى ) 	ABLibrary	7630	0.70224
		 اثبات الوصية لعلي بن أبي طالب ( ع ) ( فارسي ) 	 المسعودي ( مترجم : محمد جواد نجفي ) 	ABLibrary	7395	0.7012
		 صحيفة الارشاد ( تاريخ افشار كرمان - پايان كار صفويه ) ( فارسى ) 	 ملا محمد مومن كرمانى 	ABLibrary	8224	0.70112
		 شاهنامهء ثعالبى در شرح احوال سلاطين ايران ( فارسى ) 	 عبد الملك الثعالبي النيسابوري ( مترجم : محمود هدايت ) 	ABLibrary	8217	0.70078
		 شجرة الملوك ( تاريخ منظوم سيستان ) ( فارسى ) 	 صبورى / ناصح / ظهير 	ABLibrary	8218	0.69889
		 مجمل رشوند ( فارسى ) 	 محمد على خان رشوند 	ABLibrary	8269	0.69863
		 راحة الأرواح ( در شرح زندگانى ، فضائل و معجزات ائمه اطهار ( ع ) ) ( فارسي ) 	 حسن بن حسين شيعى سبزوارى 	ABLibrary	7529	0.6986
		 روزنامه خاطرات عين السلطنه ( فارسى ) 	 قهرمان ميرزا عين السلطنه 	ABLibrary	8153	0.69806
		علوم العربيّة [ج ١]	السيد هاشم الحسيني الطهراني	Rafed	2709	0.69776
		 مجموعه آثار شهيد مطهرى ( فارسي ) 	 مرتضى مطهرى 	ABLibrary	7561	0.69693
		 سمط العلى للحضرة العليا ( در تاريخ قراختائيان كرمان ) ( فارسى ) 	 ناصر الدين منشى كرمانى 	ABLibrary	8209	0.6961
		 مسافرتنامه كرمان و بلوچستان ( فارسى ) 	 عبد الحسين ميرزا فرمانفرما 	ABLibrary	8277	0.69598
		 مجموعه آثار شهيد مطهرى ( فارسي ) 	 مرتضى مطهرى 	ABLibrary	7562	0.69533
		 مجموعة آثار السلمي 	 السلمي 	ABLibrary	8707	0.69459
		 عبقات الأنوار في إمامة الأئمة الأطهار ( فارسي ) 	 السيد حامد النقوي 	ABLibrary	8507	0.694
		 تاريخ الفي ( فارسى ) 	 قاضى احمد تتوى / آصف خان قزوينى 	ABLibrary	8017	0.69368
		 تاريخ هيجده ساله آذربايجان ( فارسى ) 	 احمد كسروى 	ABLibrary	8086	0.69321
		 تاريخ آل مظفر ( فارسي ) 	 محمود كتبى 	ABLibrary	7985	0.69303
		 الكامل في التاريخ ( تاريخ كامل ) ( فارسي ) 	 ابن الأثير ( مترجم : خليلى / حالت ) 	ABLibrary	7665	0.69279
		 روزشمار تاريخ معاصر ايران ( فارسى ) 	 حسن فراهانى 	ABLibrary	8144	0.69262
		 تاريخ لرستان ( روزگار قاجار ) ( فارسى ) 	 محمد رضا واليزاده معجزى 	ABLibrary	8062	0.69241
		 تاريخ سلسله سلجوقى ( زبدة النصره ونخبة العصره ) ( فارسى ) 	 فتح بن على بندارى اصفهانى ( مترجم : محمد حسين جليلى ) 	ABLibrary	8041	0.69176
		 عبقات الأنوار في إمامة الأئمة الأطهار ( فارسي ) 	 السيد حامد النقوي 	ABLibrary	8495	0.69155
		 الكامل في التاريخ ( تاريخ كامل ) ( فارسي ) 	 ابن الأثير ( مترجم : خليلى / حالت ) 	ABLibrary	7663	0.69115
		جامع المقدّمات	جمع من العلماء	Rafed	1838	0.69086
		 وقايع السنين والاعوام ( يا گزارشهاى ساليانه از ابتداى خلقت تا سال 1195 هجرى ) ( فارسى ) 	 سيد عبد الحسين الحسينى خاتون آبادى 	ABLibrary	8299	0.69068
		 عبقات الأنوار في إمامة الأئمة الأطهار ( فارسي ) 	 السيد حامد النقوي 	ABLibrary	8509	0.69
		 الكامل في التاريخ ( تاريخ كامل ) ( فارسي ) 	 ابن الأثير ( مترجم : خليلى / حالت ) 	ABLibrary	7667	0.69
		 دلائل الصدق لنهج الحق ( فارسي ) 	 الشيخ محمد حسن المظفر ( مترجم : سپهري ) 	ABLibrary	945	0.68952
		 تاريخ خانى ( شامل حوادث چهل ساله گيلان ) ( فارسى ) 	 على بن شمس الدين بن حاجى حسين لاهيجى 	ABLibrary	8040	0.68903
		 الكامل في التاريخ ( تاريخ كامل ) ( فارسي ) 	 ابن الأثير ( مترجم : خليلى / حالت ) 	ABLibrary	7661	0.68803
		 طبقات ناصرى ( تاريخ كامل ايران واسلام ) ( فارسى ) 	 منهاج سراج 	ABLibrary	8226	0.68802
		 جامع عباسى ( فارسي ) 	 الشيخ البهائي العاملي 	ABLibrary	84	0.68771
		 تجارب الأمم ( فارسى ) 	 أحمد بن محمد مسكويه الرازي ( مترجم : ابو القاسم امامى و على نقى منزوى ) 	ABLibrary	8090	0.68748
		 تاريخ نو ( شامل حوادث دوره قاجاريه ) ( فارسى ) 	 جهانگير ميرزا 	ABLibrary	8073	0.68714
		 مناقب الطاهرين ( فارسي ) 	 عماد الدين حسن بن علي الطبري 	ABLibrary	7782	0.68628
		 بحار الأنوار ( زندگانى حضرت امام جعفر صادق ع ) ( فارسي ) 	 العلامة المجلسي ( مترجم : موسى خسروى ) 	ABLibrary	7438	0.68576
		 ظفرنامه ( قسم الاسلاميه ) ( فارسى ) 	 حمد الله مستوفى قزوينى 	ABLibrary	8231	0.68536
		 تاريخ مغول در ايران ( فارسى ) 	 برتولد اشپولر ( مترجم : محمود ميرآفتاب ) 	ABLibrary	8067	0.68468
		 نامه هاى حكومتى فيروز ميرزا فرمانفرما ( فارسى ) 	 فيروز ميرزا بن عباس ميرزا فرمانفرما 	ABLibrary	8292	0.68218
		 الكامل في التاريخ ( تاريخ كامل ) ( فارسي ) 	 ابن الأثير ( مترجم : خليلى / حالت ) 	ABLibrary	7662	0.68199
		 الكامل في التاريخ ( تاريخ كامل ) ( فارسي ) 	 ابن الأثير ( مترجم : خليلى / حالت ) 	ABLibrary	7668	0.68136
		 روضات الجنات في اوصاف مدينه هرات ( فارسى ) 	 معين الدين محمد زمچى اسفزارى 	ABLibrary	8161	0.68134
		 ألواح الصحة ( فارسي ) 	 متطبب جيلاني ( گيلانى ) 	ABLibrary	9955	0.68072
		 دستور الكاتب في تعيين المراتب ( فارسى ) 	 محمد بن هندوشاه نخجوانى 	ABLibrary	8129	0.68054
		 تاريخ جهان آراى عباسى ( فارسى ) 	 ميرزا محمد طاهر وحيد قزوينى 	ABLibrary	8035	0.68047
		 دقائق العلاج ( فارسي ) 	 الحاج محمد كريمخان الكرماني ( مترجم : ابراهيمى ) 	ABLibrary	9976	0.67994
		 تاريخ ايران باستان ( تاريخ مفصل ايران قديم ) ( فارسى ) 	 حسن پيرنيا ( مشير الدوله ) 	ABLibrary	8026	0.67982
		 الصحيفة العلوية والتحفة المرتضوية 	 عبد الله بن صالح السماهيجي 	ABLibrary	7936	0.67944
		 مجمل التواريخ والقصص ( تصحيح نجم الدين سيف آبادى ) ( فارسى ) 	 ابن مهلب ( نواده مهلب پسر محمد پسر شادى ) 	ABLibrary	8268	0.67882
		 شرح الاربعين 	 القاضي سعيد القمي 	ABLibrary	8852	0.67862
		 عبقات الأنوار في إمامة الأئمة الأطهار ( فارسي ) 	 السيد حامد النقوي 	ABLibrary	8500	0.67746
		 الكامل في التاريخ ( تاريخ كامل ) ( فارسي ) 	 ابن الأثير ( مترجم : خليلى / حالت ) 	ABLibrary	7660	0.67699
		 تاريخ الفي ( فارسى ) 	 قاضى احمد تتوى / آصف خان قزوينى 	ABLibrary	8018	0.67645
		 الكامل في التاريخ ( تاريخ كامل ) ( فارسي ) 	 ابن الأثير ( مترجم : خليلى / حالت ) 	ABLibrary	7664	0.67642
		 الكامل في التاريخ ( تاريخ كامل ) ( فارسي ) 	 ابن الأثير ( مترجم : خليلى / حالت ) 	ABLibrary	7659	0.67627
		الكشكول - الجزء1	الشيخ البهائي	Masaha	3394	0.67573
		 الكامل في التاريخ ( تاريخ كامل ) ( فارسي ) 	 ابن الأثير ( مترجم : خليلى / حالت ) 	ABLibrary	7658	0.67445
		 تاريخ گيلان و ديلمستان ( فارسى ) 	 سيد ظهير الدين مرعشى 	ABLibrary	8061	0.67356
		 ظفرنامه ( تاريخ فتوحات امير تيمور گوركانى ) ( فارسى ) 	 نظام الدين شامى 	ABLibrary	8233	0.67338
		 إحياء الأطفال مظفري ( فارسي ) 	 ميرزا علي بن زين العابدين همدانى ( ميرزا علي دكتور ) 	ABLibrary	9982	0.6732
		 در محضر شيخ فضل الله نورى ، اسناد حقوقى عهد ناصرى ( فارسى ) 	 منصوره اتحاديه و سعيد روحى 	ABLibrary	8126	0.6731
		 تاريخ ذو القرنين ( فارسى ) 	 ميرزا فضل الله شيرازى ( خاورى ) 	ABLibrary	8043	0.67265
		 مطلع سعدين ومجمع بحرين ( فارسى ) 	 كمال الدين عبد الرزاق سمرقندى 	ABLibrary	8281	0.67207
		 روزنامه خاطرات عين السلطنه ( فارسى ) 	 قهرمان ميرزا عين السلطنه 	ABLibrary	8151	0.67179
		 سلجوقنامه ( وذيل سلجوقنامه محمد بن ابراهيم ) ( فارسى ) 	 خواجه امام ظهير الدين نيشابورى / ابو حامد محمد بن ابراهيم ت 599 	ABLibrary	8206	0.67143
		 خصائص أمير المؤمنين ( ع ) ( ويژگيهاى على بن ابى طالب ع ) ( فارسي ) 	 النسائي ( مترجم : فتح الله نجارزادگان ) 	ABLibrary	7518	0.67103
		 تاريخ گيتى گشا ( در تاريخ سلسله زنديه ) ( فارسى ) 	 محمد صادق موسوى اصفهانى 	ABLibrary	8059	0.67056
		 راحة الصدور و آية السرور در تاريخ آل سلجوق ( فارسى ) 	 محمد بن علي بن سليمان الراوندي 	ABLibrary	8139	0.66973
		 سفرنامه استرآباد و مازندران و گيلان و . . . ( فارسى ) 	 ميرزا ابراهيم 	ABLibrary	8178	0.66825
		 الخرائج والجرائح ( جلوه هاى اعجاز معصومين ع ) ( فارسي ) 	 قطب الدين الراوندي ( مترجم : غلام حسن محرمى ) 	ABLibrary	7517	0.66776
		 تاريخ تطبيقى ايران با كشورهاى جهان ( فارسى ) 	 عزيز الله بيات 	ABLibrary	8034	0.66638
		 پيراسته تاريخنامه هرات ( فارسى ) 	 سيف بن محمد سيفى هروى 	ABLibrary	7983	0.66604
		 تاريخ ايران باستان ( تاريخ مفصل ايران قديم ) ( فارسى ) 	 حسن پيرنيا ( مشير الدوله ) 	ABLibrary	8027	0.66339
		 روزنامه خاطرات عين السلطنه ( فارسى ) 	 قهرمان ميرزا عين السلطنه 	ABLibrary	8149	0.66338
		 مجموعة آثار السلمي 	 السلمي 	ABLibrary	8706	0.66293
		 خلاصة التواريخ ( فارسى ) 	 قاضى احمد بن شرف الدين الحسين الحسينى القمى 	ABLibrary	8123	0.66265
		 تزوكات تيمورى ( فارسى ) 	 ابو طالب حسينى تربتى 	ABLibrary	8095	0.66245
		 سفرهاى ناصر الدين شاه به قم ( فارسى ) 	 ناصر الدين شاه قاجار 	ABLibrary	8204	0.66127
		 سفرنانه كروسينسكى ( فارسى ) 	 كروسينسكى ( مترجم : عبد الرزاق دنبلى " مفتون " ) 	ABLibrary	8200	0.65944
		 سفرنامه عراق عجم ( فارسى ) 	 ناصر الدين شاه قاجار 	ABLibrary	8193	0.65915
		 خوشه هاى طلائى ( فارسي ) 	 محمد على مجاهدى 	ABLibrary	7890	0.65642
		 زبدة التواريخ ( فارسى ) 	 عبدالله ابن لطف الله ( حافظ ابرو ) 	ABLibrary	8167	0.65376
		 إيقاظ النائمين 	 صدر الدين محمد الشيرازي ( صدر المتألهين ) 	ABLibrary	8848	0.65308
		 ميراث حوزه اصفهان ( رسائل إجالة الفكر للهندي وأجل محتوم ، تجسم الأعمال ، سهو النبي ووحدت وجود للخواجوئي ) 	 مجموعة مؤلفين 	ABLibrary	8429	0.65197
		 عبقات الأنوار في إمامة الأئمة الأطهار ( فارسي ) 	 السيد حامد النقوي 	ABLibrary	8508	0.6508
		 زبدة التواريخ ( فارسى ) 	 عبدالله ابن لطف الله ( حافظ ابرو ) 	ABLibrary	8168	0.65018
		 اسناد تاريخى خاندان غفارى ( فارسي ) 	 كريم اصفهانيان و بهرام غفارى و على اصغر عمران 	ABLibrary	7958	0.64916
		 تذكره همايون و اكبر ( فارسى ) 	 بايزيد بيات 	ABLibrary	8093	0.64764
		 روزنامه خاطرات ناصر الدين شاه ( در سفر دوم فرنگستان ) ( فارسى ) 	 ناصر الدين شاه قاجار 	ABLibrary	8158	0.64744
		 روزنامه سفر مازندران ( فارسى ) 	 ناصر الدين شاه قاجار 	ABLibrary	8160	0.64688
		 سيرة جلال الدين يا تاريخ جلالى ( فارسى ) 	 نور الدين محمد خرندزي زيدري نسوي ( مترجم : محمد علي ناصح ) 	ABLibrary	8214	0.64539
		 مناقب الطاهرين ( فارسي ) 	 عماد الدين حسن بن علي الطبري 	ABLibrary	7783	0.64523
		 مسخر البلاد ( تاريخ شيبانيان ) ( فارسى ) 	 محمد يار بن عرب قطغان 	ABLibrary	8278	0.64513
		 الكامل في التاريخ ( تاريخ كامل ) ( فارسي ) 	 ابن الأثير ( مترجم : خليلى / حالت ) 	ABLibrary	7666	0.64498
		 تاريخ سرى مغولان ( يوان چائوپى شه ) ( فارسى ) 	 مؤلف مجهول ( مترجم : شيرين بيانى ) 	ABLibrary	8046	0.64402
		 تاريخ منتظم ناصرى ( فارسى ) 	 محمد حسن خان اعتماد السلطنه 	ABLibrary	8071	0.64102
		 تاريخ آل سلجوق در آناطولى ( فارسي ) 	 مؤلف مجهول 	ABLibrary	7984	0.64092
		 شاه عباس ( مجموعه اسناد و مكاتبات تاريخى همراه با يادداشتهاى تفصيلى ) ( فارسى ) 	 عبد الحسين نوايى 	ABLibrary	8216	0.63904
		 ايران در دوره سلطنت قاجار ( فارسي ) 	 على اصغر شميم 	ABLibrary	7972	0.63568
		 مطلع سعدين ومجمع بحرين ( فارسى ) 	 كمال الدين عبد الرزاق سمرقندى 	ABLibrary	8282	0.63403
		 خلاصهء سيرت رسول الله ( ص ) 	 محمد بن عبد الله بن عمر 	ABLibrary	7519	0.63393
		 روزنامه خاطرات سيد محمد كمره اى ( فارسى ) 	 سيد محمد كمره اى 	ABLibrary	8146	0.6303
		 همايون نامه ( تاريخ منظوم حكيم زجاجى ) ( فارسى ) 	 حكيم زجاجى 	ABLibrary	8300	0.6293
		 روزشمار تاريخ معاصر ايران ( فارسى ) 	 حسن فراهانى 	ABLibrary	8143	0.62876
		 سفر نامه هاى سهام الدولة بجنوردى ( فارسى ) 	 يار محمد خان سهام الدوله / خاور بى بى شادلو 	ABLibrary	8203	0.62159
		 رجال عصر مشروطيت ( فارسى ) 	 سيد ابو الحسن علوى 	ABLibrary	8140	0.62067
		 سبع رسائل 	 المحقق الدواني / ملا اسماعيل خواجوئي 	ABLibrary	8446	0.61864
		 شهريار جاده ها ( سفرنامه ناصر الدين شاه به عتبات ) ( فارسى ) 	 ناصر الدين شاه قاجار 	ABLibrary	8222	0.616
		فهرست نسخه هاي خطي كتابخانه آيه الله گلپايگاني ( قدس سره )	ابوالفضل عربزاده	Ghbook	7180	0.61514
		موسوعة كشّاف إصطلاحات الفنون والعلوم [ج ٢]	محمّد علي التهانوي	Rafed	3030	0.61249
		 الكشكول 	 الشيخ البهائي العاملي 	ABLibrary	8843	0.61065
		 رؤيت هلال ( فارسي ) 	 رضا مختاري / محسن صادقي 	ABLibrary	9762	0.60981
		 فهرس التواريخ ( فارسى ) 	 رضا قليخان هدايت 	ABLibrary	8245	0.60605
		 اشرف التواريخ ( فارسي ) 	 محمدتقى نورى 	ABLibrary	7964	0.60512
		 سوانح عمر ( فارسى ) 	 شمس الدين رشديه 	ABLibrary	8210	0.60381
		 تقويم التواريخ ( فارسى ) 	 مصطفى بن عبدالله چلپى ( حاجى خليفه ) ( مترجم : مجهول ) 	ABLibrary	8094	0.60199
		 تاريخ گيلان ( فارسى ) 	 ملا عبد الفتاح فومنى گيلانى 	ABLibrary	8060	0.59852
		 تاريخ منتظم ناصرى ( فارسى ) 	 محمد حسن خان اعتماد السلطنه 	ABLibrary	8070	0.59536
		 در محضر شيخ فضل الله نورى ، اسناد حقوقى عهد ناصرى ( فارسى ) 	 منصوره اتحاديه و سعيد روحى 	ABLibrary	8127	0.59428
		 بررسى تاريخى ، سياسى و اجتماعى اسناد بندر عباس ( فارسي ) 	 حسن حبيبى ومحمد باقر وثوقى 	ABLibrary	7982	0.5941
		 تاريخ مبارك غازانى ( داستان غازان خان ) ( فارسى ) 	 رشيد الدين فضل الله همدانى 	ABLibrary	8066	0.593
		 دستور الكاتب في تعيين المراتب ( فارسى ) 	 محمد بن هندوشاه نخجوانى 	ABLibrary	8128	0.59214
		 آراء المراجع في الحج 	 الشيخ علي افتخاري الگلپايگاني 	ABLibrary	9739	0.58071
		 خاطرات ديوان بيگى ( فارسى ) 	 ميرزا حسين خان 	ABLibrary	8115	0.57979
		تفسير كنز الدقائق وبحر الغرائب‏  - الجزء1	محمد بن محمد رضا القمي المشهدي	Masaha	4778	0.57955
		 روزنامه خاطرات ناصر الدين شاه ( در سفر سوم فرنگستان ) ( فارسى ) 	 ناصر الدين شاه قاجار 	ABLibrary	8159	0.57529
		 ضياء العيون ( فارسي ) 	 محمد باقر بن عماد الدين شيرازي 	ABLibrary	9967	0.57451
		 تاريخ مبارك شاهى ( فارسى ) 	 يحيى بن احمد عبد الله السيهرندى 	ABLibrary	8065	0.56842
		 همايون نامه ( تاريخ منظوم حكيم زجاجى ) ( فارسى ) 	 حكيم زجاجى 	ABLibrary	8301	0.56595
		 جامع مفيدى ( فارسى ) 	 محمد مفيد مستوفى بافقى 	ABLibrary	8103	0.56592
		أحكام المياه	الشيخ محمد رضا النجفي الأصفهاني	Masaha	4862	0.56567
		 عبقات الأنوار في إمامة الأئمة الأطهار ( فارسي ) 	 السيد حامد النقوي 	ABLibrary	8497	0.56513
		 جامع التواريخ ( تاريخ اغوز ) ( فارسى ) 	 رشيد الدين فضل الله همدانى 	ABLibrary	8098	0.56314
		 مناقب علي بن أبي طالب ( ع ) ( بهمراه مناقب كلابى ) ( فارسي ) 	 ابن المغازلي / الكلابي ( مترجم : سيد جواد مرعشى نجفى ) 	ABLibrary	7784	0.5591
		 عبقات الأنوار في إمامة الأئمة الأطهار ( فارسي ) 	 السيد حامد النقوي 	ABLibrary	8504	0.55839
		فرهنگ ابجدى = المنجد الأبجدي	فؤاد افرام البستاني (ت: 1906م)	ShamAY	34691	0.55038
		إحقاق الحقّ وإزهاق الباطل [ج ٣٠]	آية الله السيّد شهاب الدين الحسيني المرعشي النجفي	Rafed	2806	0.55002
		فهرس المخطوطات العربية والفارسية في مكتبة راجا محمودآباد-لكهنو-الهند-عربي		ShamAY	37624	0.54718
		 روزنامه خاطرات امين لشكر ( فارسى ) 	 ميرزا قهرمان امين لشكر 	ABLibrary	8145	0.54586
		احكام المياه	محمد رضا نجفي	Ghbook	11141	0.54552
		 روزنامه خاطرات سيد محمد كمره اى ( فارسى ) 	 سيد محمد كمره اى 	ABLibrary	8147	0.54534
		 الدليل على موضوعات نهج البلاغة 	 علي انصاريان 	ABLibrary	930	0.54175
		الذخيره في العقبي في موده ذوي القربي	سيدمهدي رجايي	Ghbook	15611	0.53692
		 جامع التواريخ ( تاريخ افرنج و پايان قياصره ) ( فارسى ) 	 رشيد الدين فضل الله همدانى 	ABLibrary	8099	0.53569
		 ناسخ التواريخ ( زندگانى پيامبر ) ( فارسي ) 	 لسان الملك سپهر 	ABLibrary	7870	0.5325
		 موسوعة كشاف اصطلاحات الفنون والعلوم 	 محمد علي التهانوي 	ABLibrary	8655	0.52469
		فهرس مخطوطات مكتبة عالية مهدوية-كجرات-الهند-عربي		ShamAY	37627	0.52396
		 طبقات ناصرى ( تاريخ كامل ايران واسلام ) ( فارسى ) 	 منهاج سراج 	ABLibrary	8227	0.51589
		 روزنامه خاطرات عين السلطنه ( فارسى ) 	 قهرمان ميرزا عين السلطنه 	ABLibrary	8148	0.51125
		 عبقات الأنوار في إمامة الأئمة الأطهار ( فارسي ) 	 السيد حامد النقوي 	ABLibrary	8501	0.50948
		فهرس مخطوطات مكتبة عالية جستية-كجرات-الهند-عربي		ShamAY	37626	0.50511
		 الكشكول 	 الشيخ البهائي العاملي 	ABLibrary	8844	0.5047
		الغارات أو الاستنفار والغارات - الجزء1	إبراهيم بن محمد الثقفي	Masaha	4561	0.50398
		 أعلام النبوة 	 أبو حاتم الرازي 	ABLibrary	8339	0.49653
		العقد الحسيني - الرسالة الوسواسية	الحسين بن عبد الصمد العاملي	Masaha	1145	0.49423
		كتب حوزه : صرف	جمعي از نويسندگان	Ghbook	16310	0.48878
		إحقاق الحقّ وإزهاق الباطل [ج ٢٩]	آية الله السيّد شهاب الدين الحسيني المرعشي النجفي	Rafed	2797	0.48225
		الفهرست - منتجب الدين	منتجب الدين علي بن بابويه رازي	Ghbook	7054	0.46456
		 رسائل طبي محمد بن زكرياى رازى 	 محمد بن زكريا الرازي 	ABLibrary	9827	0.46348
		 الآثار الباقية عن القرون الخالية 	 أبو ريحان البيروني 	ABLibrary	8916	0.46208
		إحقاق الحقّ وإزهاق الباطل [ج ٣٣]	آية الله السيّد شهاب الدين الحسيني المرعشي النجفي	Rafed	2814	0.45995
		كتاب المراتب في فضائل أمير المؤمنين و سيد الوصيين(ع)	أبو القاسم إسماعيل بن أحمد البستي‏	Masaha	2490	0.44843
		الذريعة إلى حافظ الشريعة - الجزء1	رفيع الدين محمد الجيلاني	Masaha	4739	0.44574
		 بحر الجواهر ( معجم الطب الطبيعي ) 	 محمد بن يوسف الهروي 	ABLibrary	9952	0.44231
		 عبقات الأنوار في إمامة الأئمة الأطهار ( فارسي ) 	 السيد حامد النقوي 	ABLibrary	8506	0.43476
		 المراتب في فضائل أميرالمؤمنين وسيد الوصيين ( ع ) 	 أبى القاسم اسماعيل بن احمد البستي المعتزلي 	ABLibrary	7700	0.43227
		 تاريخ فيروزشاهى ( فارسى ) 	 شمس سراج عفيف 	ABLibrary	8056	0.42891
		فهرس مخطوطات مكتبة سيد ظل الرحمن-عليكر-الهند-عربي		ShamAY	37625	0.4282
		جامع الشتات	الشيخ الخواجوئي	Masaha	1457	0.4278
		الصحيفه السجاديه الجامعه	محمد باقر بن مرتضي موحد ابطحي اصفهاني	Ghbook	6369	0.42691
		فهرس مخطوطات مكتبة بير محمد شاه - كجرات- الهند		ShamAY	37623	0.42382
		الأمالي	الشيخ الصدوق	Masaha	4545	0.41984
		 الذريعة إلى حافظ الشريعة ( شرح أصول الكافي ) 	 رفيع الدين محمد بن محمد مؤمن الجيلاني 	ABLibrary	7913	0.41684
		رسالة في الغناء	الحر العاملي	Masaha	1271	0.4159
		الجوهر السامي في ترجمه العلامه السيدعلي الامامي	محمدرضا شفتي	Ghbook	12790	0.41285
		 رؤيت هلال ( فارسي ) 	 رضا مختاري / محسن صادقي 	ABLibrary	9761	0.40043
		الرسائل التوحيديه	محمد حسين طباطبايي	Ghbook	12175	0.39324
		ارجوزه في الطب	ابوعلي حسين بن عبدالله ابن سينا	Ghbook	2219	0.39273
