automatic URI	Proposed URI	bookTitle	authorName	collection	id	tfidf
		جامع الشتات	محمد اسماعيل بن الحسين بن محمدرضا مازندراني خواجوئي	Ghbook	15608	0.3922
		العوامل لملّا محسن	محسن بن محمدطاهر قزويني	Ghbook	15379	0.38736
		عوامل ملا محسن (جامع المقدمات) همراه با صوت استاد مدرس افغاني	محسن بن محمدطاهر قزويني	Ghbook	15553	0.38703
		 عبقات الأنوار في إمامة الأئمة الأطهار ( فارسي ) 	 السيد حامد النقوي 	ABLibrary	8496	0.38686
		 رؤيت هلال ( فارسي ) 	 رضا مختاري / محسن صادقي 	ABLibrary	9760	0.38418
		إحقاق الحق و إزهاق الباطل - الجزء1	الشهيد الثالث القاضي السيد التستري	Masaha	1883	0.36431
		 مصنفات مير داماد 	 السيد محمد باقر الداماد ( الميرداماد ) 	ABLibrary	8605	0.35696
		 الرسائل الفقهية 	 السيد مرتضى الحسيني النجومي 	ABLibrary	9523	0.35182
		 الهدايا لشيعة أئمة الهدى ( شرح اصول الكافى ) 	 شرف الدين مجذوب التبريزي 	ABLibrary	7926	0.34998
		وليد الكعبة	السيد محمد رضا الحسيني الجلالي	Rafed	3121	0.34996
		شرح المصطلحات الفلسفية	مجمع البحوث الإسلاميّة في الآستانة الرّضوية	ShamAY	34801	0.34677
		احقاق الحق و ازهاق الباطل	نورالله حسيني مرعشي تستري ( قاضي نورالله شوشتري )	Ghbook	4611	0.34659
		الاجتهاد والتقليد	العلامة الحلي	Masaha	1054	0.34369
		 شرح دعاء الصباح 	 حاج ملا هادي السبزواري 	ABLibrary	8866	0.33908
		 أعيان الشيعة 	 السيد محسن الأمين 	ABLibrary	75	0.33853
		 بغية الحائر في أولاد الإمام الباقر ( ع ) 	 السيد حسين الزرباطي 	ABLibrary	820	0.33649
		حاشية على الرسائل‏	عبد الرسول‏ الساباطي اليزدي	Masaha	3631	0.33304
		 منتقلة الطالبية 	 ابراهيم بن ناصر بن طبطبا 	ABLibrary	9232	0.33295
		وليد الكعبه	محمد حسين حسيني جلالي	Ghbook	8343	0.32777
		 فرق الشيعة 	 حسن بن موسى النوبختي 	ABLibrary	8523	0.32697
		حياة ابن أبي عقيل و فقهه	ابن أبي عقيل النعماني	Masaha	995	0.32689
		الموالاة والمعاداة في الشريعة الإسلامية	محماس بن عبد الله بن محمد الجلعود	ShamAY	485	0.32462
		 إعلام النبلاء بتاريخ حلب الشهباء 	 محمد راغب الطباخ الحلبي 	ABLibrary	8958	0.32302
		 أعيان الشيعة 	 السيد محسن الأمين 	ABLibrary	77	0.32238
		 المصابيح 	 الإمام أبو العباس الحسني 	ABLibrary	8601	0.32158
		الإيضاح	الفضل بن شاذان الأزدي النيسابوري	Rafed	1335	0.32021
		 منتهى الآمال في تواريخ النبي والآل ( ع ) 	 الشيخ عباس القمي 	ABLibrary	7797	0.31996
		 لحظ الألحاظ بذيل طبقات الحفاظ 	 محمد بن محمد ابن محمد بن فهد الهاشمي المكي 	ABLibrary	830	0.31941
		 تاريخ اربل ( نباهة البلد الخامل بمن ورده من الاماثل ) 	 ابن المستوفي 	ABLibrary	8978	0.31932
		 أعيان الشيعة 	 السيد محسن الأمين 	ABLibrary	79	0.31683
		 تحفة الازهار وزلال الانهار في نسب ابناء الائمة الاطهار ( ع ) 	 ضامن بن شدقم الحسيني المدني 	ABLibrary	7459	0.31672
		 مجموعة آثار السلمي 	 السلمي 	ABLibrary	8708	0.31643
		 محاضرة الأبرار ومسامرة الأخيار 	 ابن عربي 	ABLibrary	8745	0.31616
		 أعيان الشيعة 	 السيد محسن الأمين 	ABLibrary	78	0.31598
		 معرفة الإمام 	 السيد محمد حسين الطهراني 	ABLibrary	8890	0.31578
		 معرفة الإمام 	 السيد محمد حسين الطهراني 	ABLibrary	8895	0.31491
		 بهجة النظر في إثبات الوصاية والإمامة للأئمة الاثني عشر ( ع ) 	 السيد هاشم البحراني 	ABLibrary	7444	0.31422
		وقفة مع الدكتور البوطي في مسائله	الأستاذ هشام آل قطيط	Masaha	485	0.31389
		 الدرر في اختصار المغازي والسير 	 ابن عبد البر 	ABLibrary	7522	0.31385
		 أسنى المطالب في مناقب الإمام علي ( ع ) 	 محمد بن محمد الدمشقي ( ابن الجزري ) 	ABLibrary	7411	0.31353
		 العقد الثمين في تاريخ البلد الأمين 	 محمد بن أحمد الفاسي 	ABLibrary	9145	0.31132
		 تاريخ الموصل 	 يزيد بن محمد الأزدي 	ABLibrary	9007	0.31086
		 مناقب الأسد الغالب ممزق الكتائب ومظهر العجائب ليث بن غالب أمير المؤمنين أبي الحسن علي بن أبي طالب ( يليه خصائص أمير المؤمنين علي بن أبي طالب للنسائي ) 	 محمد بن عبد الله ابن الجزري 	ABLibrary	7412	0.31038
		 الرسالة العلوية في فضل أمير المؤمنين ( ع ) على سائر البرية ( التفضيل ) 	 أبي الفتح الكراجكي 	ABLibrary	7532	0.31025
		 التعليقة على أصول الكافي 	 السيد محمد باقر الداماد ( الميرداماد ) 	ABLibrary	7912	0.30939
		 مقتل الحسين ( ع ) 	 الموفق الخوارزمي 	ABLibrary	7775	0.30861
		 مناقب أهل البيت ( ع ) 	 ابن المغازلي 	ABLibrary	7785	0.30842
		خواص الاشياء	بختيشوع بن جبرئيل	Ghbook	10033	0.3075
		 العقد الثمين في تاريخ البلد الأمين 	 محمد بن أحمد الفاسي 	ABLibrary	9142	0.3073
		 إثنا عشر رسالة 	 السيد محمد باقر الداماد ( الميرداماد ) 	ABLibrary	839	0.30702
		 شرح المصطلحات الكلامية 	 مجموعة مؤلفين 	ABLibrary	8462	0.30608
		 معرفة الإمام 	 السيد محمد حسين الطهراني 	ABLibrary	8889	0.30594
		 فرائد السمطين في فضائل المرتضى والبتول والسبطين والأئمة من ذريتهم ( ع ) 	 ابراهيم بن سعد الدين الشافعي 	ABLibrary	7629	0.3059
		 درر الأخبار من بحار الأنوار 	 سيد مهدي حجازي 	ABLibrary	977	0.30589
		الهدايا لشيعة أئمة الهدى - الجزء1	محمد مجذوب التبريزي	Masaha	4847	0.30582
		 الحاشية على أصول الكافي 	 المولى محمد أمين الاسترابادى 	ABLibrary	7911	0.30529
		 الروح المجرد ( في ذكرى السيد هاشم الموسوى الحداد ) 	 السيد محمد حسين الطهراني 	ABLibrary	8897	0.30511
		 الذريعة 	 آقا بزرگ الطهراني 	ABLibrary	855	0.3051
		 العقد الثمين في تاريخ البلد الأمين 	 محمد بن أحمد الفاسي 	ABLibrary	9146	0.30474
		 البلدانيات 	 شمس الدين السخاوي 	ABLibrary	8971	0.30465
		 بغية الطلب في تاريخ حلب 	 عمر بن أحمد العقيلي الحلبي ( ابن العديم ) 	ABLibrary	811	0.30451
		 رؤيت هلال ( فارسي ) 	 رضا مختاري / محسن صادقي 	ABLibrary	9759	0.30449
		 أعيان الشيعة 	 السيد محسن الأمين 	ABLibrary	76	0.30427
		 كفاية الطالب في مناقب علي بن أبي طالب ( ع ) ( ويليه البيان في أخبار صاحب الزمان ع ) 	 محمد بن يوسف الگنجي الشافعي 	ABLibrary	7682	0.30415
		 الذريعة 	 آقا بزرگ الطهراني 	ABLibrary	857	0.30396
		الهدايه في النحو	ابوحيان اندلسي	Ghbook	15378	0.30369
		 المقنع في الإمامة 	 الشيخ عبيد الله بن عبد الله السد آبادي 	ABLibrary	8640	0.3036
		 الذريعة 	 آقا بزرگ الطهراني 	ABLibrary	860	0.30318
		 الدر الكمين بذيل العقد الثمين في تاريخ البلد الأمين 	 عمر بن محمد ابن فهد 	ABLibrary	9063	0.30272
		 أدب الطف أو شعراء الحسين ( ع ) 	 جواد شبر 	ABLibrary	7399	0.30258
		 عين الحياة ( ويليه رسالة آطريلال ) 	 محمد بن يوسف الهروي / عماد الدين الشيرازي 	ABLibrary	9953	0.30251
		 بحوث في الملل والنحل 	 الشيخ السبحاني 	ABLibrary	8361	0.30191
		 العقد الثمين في تاريخ البلد الأمين 	 محمد بن أحمد الفاسي 	ABLibrary	9143	0.30189
		 مسند الإمام الحسين ( ع ) 	 الشيخ عزيز الله عطاردي 	ABLibrary	7705	0.30169
		 حلية الأبرار 	 السيد هاشم البحراني 	ABLibrary	94	0.30143
		 حلية الأبرار 	 السيد هاشم البحراني 	ABLibrary	95	0.30119
		 مكاتيب الأئمة ( ع ) 	 علي الأحمدي الميانجي 	ABLibrary	7778	0.30035
		 حلية الأبرار في أحوال محمد وآله الأطهار ( ع ) 	 السيد هاشم البحراني 	ABLibrary	7486	0.30002
		 الفوائد الرجالية 	 الخاجوئي 	ABLibrary	9771	0.29978
		 العوالم ، الإمام علي بن أبي طالب ( ع ) 	 الشيخ عبد الله البحراني 	ABLibrary	7610	0.29973
		 مسند الإمام العسكري ( ع ) 	 الشيخ عزيز الله عطاردي 	ABLibrary	7742	0.29933
		 حلية الأبرار في أحوال محمد وآله الأطهار ( ع ) 	 السيد هاشم البحراني 	ABLibrary	7485	0.29906
		 القول المتين في تشيع الشيخ الأكبر 	 الشيخ قاسم الطهراني 	ABLibrary	8904	0.29896
		 فضائل بيت المقدس 	 ضياء الدين محمد المقدسي 	ABLibrary	9151	0.29894
		 بغية الطلب في تاريخ حلب 	 عمر بن أحمد العقيلي الحلبي ( ابن العديم ) 	ABLibrary	812	0.29888
		 العقد الثمين في تاريخ البلد الأمين 	 محمد بن أحمد الفاسي 	ABLibrary	9144	0.29885
		 بغية الطلب في تاريخ حلب 	 عمر بن أحمد العقيلي الحلبي ( ابن العديم ) 	ABLibrary	813	0.29872
		 مسند الإمام الجواد ( ع ) 	 الشيخ عزيز الله عطاردي 	ABLibrary	7740	0.29851
		 بحار الأنوار 	 العلامة المجلسي 	ABLibrary	740	0.2979
		 مقتل الحسين ( ع ) 	 الموفق الخوارزمي 	ABLibrary	7774	0.29787
		 الإمام الصادق والمذاهب الأربعة 	 اسد حيدر 	ABLibrary	7423	0.29765
		 شرح فروع الكافي 	 محمد هادي المازندراني 	ABLibrary	9343	0.2975
		 أعيان الشيعة 	 السيد محسن الأمين 	ABLibrary	82	0.29719
		 حلية الأبرار في أحوال محمد وآله الأطهار ( ع ) 	 السيد هاشم البحراني 	ABLibrary	7489	0.29716
		 أخبار الدولة العباسية 	 مؤلف مجهول 	ABLibrary	83	0.29702
		 مناحل الشفا ومناهل الصفا بتحقيق كتاب شرف المصطفى ( ص ) 	 عبد الملك الخركوشي النيسابوري 	ABLibrary	7585	0.29671
		سفينة النجاة	الفيض الكاشاني	Masaha	1287	0.29654
		 الكشف الوافي في شرح أصول الكافي 	 محمد هادي الشيرازي ( آصف شيرازي ) 	ABLibrary	7920	0.29636
		 الفخري في أنساب الطالبيين 	 اسماعيل المروزي الأزوارقاني 	ABLibrary	7626	0.29618
		 العسل المصفى من تهذيب زين الفتى في شرح سورة هل أتى 	 أحمد بن محمد بن علي العاصمي 	ABLibrary	7609	0.2959
		الباب الحادي عشر (به همراه النافع يوم الحشر و مفتاح الباب)	مقداد بن عبدالله السيوري	Ghbook	15656	0.29533
		 الضوء اللامع لأهل القرن التاسع 	 شمس الدين السخاوي 	ABLibrary	951	0.29527
		اليواقيت الحسان في تفسير سورة الرّحمن	آية الله مجد الدّين النّجفي الإصفهاني	Rafed	550	0.29519
		 جامع الأفكار وناقد الأنظار 	 ملا محمد مهدي النراقي 	ABLibrary	8400	0.29514
		 الذريعة 	 آقا بزرگ الطهراني 	ABLibrary	850	0.29498
		 كشف الأسرار في شرح الاستبصار 	 السيد نعمة الله الجزائري 	ABLibrary	9342	0.29485
		 مسند الإمام السجاد ( ع ) 	 الشيخ عزيز الله عطاردي 	ABLibrary	7706	0.29476
		 إثبات الهداة بالنصوص والمعجزات 	 الحر العاملي 	ABLibrary	7392	0.2946
		 الضوء اللامع لأهل القرن التاسع 	 شمس الدين السخاوي 	ABLibrary	957	0.29446
		الذّريعة إلى تصانيف الشّيعة [ج ٢٢]	الشيخ آقا بزرك الطهراني	Rafed	498	0.29392
		 كشف الغمة في معرفة الأئمة ( ط . ق ) 	 علي بن أبي الفتح الإربلي 	ABLibrary	7909	0.29391
		 فضائل أمير المؤمنين ( ع ) 	 ابن عقدة الكوفي 	ABLibrary	7899	0.29386
		 تذكرة الخواص 	 سبط ابن الجوزي 	ABLibrary	7466	0.29384
		 أبصار العين في أنصار الحسين ( ع ) 	 الشيخ محمد السماوي 	ABLibrary	96	0.29368
		 مسند الإمام الحسين ( ع ) 	 الشيخ عزيز الله عطاردي 	ABLibrary	7704	0.29354
		 مقتل الإمام أمير المؤمنين على بن أبى طالب ( ع ) 	 ابن أبي الدنيا 	ABLibrary	7771	0.29333
		 بغية الطلب في تاريخ حلب 	 عمر بن أحمد العقيلي الحلبي ( ابن العديم ) 	ABLibrary	819	0.29331
		 حلية الأبرار في أحوال محمد وآله الأطهار ( ع ) 	 السيد هاشم البحراني 	ABLibrary	7487	0.29315
		موسوعة كشّاف إصطلاحات الفنون والعلوم [ج ١]	محمّد علي التهانوي	Rafed	1548	0.29308
		 إثبات الهداة بالنصوص والمعجزات 	 الحر العاملي 	ABLibrary	7393	0.29305
		مِنْ عَجَائِبِ الدُّعاء - الجزء الثاني (قصَصٌ لِقَوْم دعوا اللهَ فَاسْتَجاب لَهُمْ مِن المُتقدِّمينَ والمُعاصِرين)	خالد بن سليمان بن علي الربعي	ShamAY	505	0.29303
		 الضوء اللامع لأهل القرن التاسع 	 شمس الدين السخاوي 	ABLibrary	954	0.29282
		 الذريعة 	 آقا بزرگ الطهراني 	ABLibrary	858	0.29267
		 كتاب القضاء والقدر 	 أحمد بن الحسين البيهقي 	ABLibrary	8572	0.29251
		 الذريعة 	 آقا بزرگ الطهراني 	ABLibrary	856	0.29239
		 الذريعة 	 آقا بزرگ الطهراني 	ABLibrary	853	0.29234
		اليواقيت الحسان في تفسير سوره الرحمن؛ المختار من القصائد و الاشعار	مجدالدين نجفي اصفهاني	Ghbook	12924	0.29215
		 أخبار مكة في قديم الدهر وحديثه 	 محمد بن اسحاق ابن العباس الفاكهي المكي 	ABLibrary	8923	0.29215
		 الذريعة 	 آقا بزرگ الطهراني 	ABLibrary	861	0.29161
		 الفرقة الناجية 	 الشيخ ابراهيم القطيفي 	ABLibrary	8524	0.29101
		 مسند الإمام الكاظم ( ع ) 	 الشيخ عزيز الله عطاردي 	ABLibrary	7736	0.29095
		 مسند الإمام الباقر ( ع ) 	 الشيخ عزيز الله عطاردي 	ABLibrary	7708	0.29073
		 بحار الأنوار 	 العلامة المجلسي 	ABLibrary	745	0.29023
		 مسند الإمام الهادي ( ع ) 	 الشيخ عزيز الله عطاردي 	ABLibrary	7741	0.29008
		 الضوء اللامع لأهل القرن التاسع 	 شمس الدين السخاوي 	ABLibrary	956	0.28979
		 العسل المصفى من تهذيب زين الفتى في شرح سورة هل أتى 	 أحمد بن محمد بن علي العاصمي 	ABLibrary	7608	0.28956
		 خلاصة عبقات الأنوار 	 السيد حامد النقوي 	ABLibrary	88	0.28942
		بحار الأنوار [ج ٣]	الشيخ محمّد باقر بن محمّد تقي المجلسي	Rafed	505	0.28932
		 بحار الأنوار 	 العلامة المجلسي 	ABLibrary	747	0.28923
		 ترجمة الإمام الحسين ( ع ) من كتاب بغية الطلب في تاريخ حلب لابن عديم 	 عمر بن أحمد العقيلي الحلبي ( ابن العديم ) 	ABLibrary	7468	0.28884
		 تاريخ الموصل 	 يزيد بن محمد الأزدي 	ABLibrary	9008	0.28865
		 الضوء اللامع لأهل القرن التاسع 	 شمس الدين السخاوي 	ABLibrary	955	0.28857
		 الإمامة 	 السيد محمد باقر الشفتي الجيلاني 	ABLibrary	8347	0.28811
		 الآثار المروية في الأطعمة السرية والآلات العطرة 	 ابن بشكوال 	ABLibrary	9875	0.2879
		 أعيان الشيعة 	 السيد محسن الأمين 	ABLibrary	74	0.2878
		 موسوعة الإمام الهادي ( ع ) 	 الشيخ أبو القاسم الخزعلي 	ABLibrary	7845	0.28773
		 الغارات ( ط . ق ) 	 إبراهيم بن محمد الثقفي الكوفي 	ABLibrary	7898	0.28767
		 أمراء الكوفة وحكامها 	 محمد على آل خليفة 	ABLibrary	8937	0.28765
		 ذيل تذكرة الحفاظ 	 محمد الحسيني الدمشقي 	ABLibrary	829	0.28743
		 تاريخ بناكتى ( روضة اولى الالباب في معرفة التواريخ والانساب ) 	 داود بن محمد بناكتى ( فخر البناكتى ) ( تعريب : محمد عبد الكريم علي ) 	ABLibrary	8164	0.28736
		 مآثر الكبراء تاريخ سامراء 	 الشيخ ذبيح الله المحلاتي 	ABLibrary	9175	0.28727
		 الغارات ( ط . ق ) 	 إبراهيم بن محمد الثقفي الكوفي 	ABLibrary	7897	0.28719
		 تاريخ أُمراء المدينة المنورة 	 عارف أحمد عبد الغني 	ABLibrary	8984	0.28709
		 أدوار الفقه الإمامي 	 الشيخ السبحاني 	ABLibrary	9774	0.28707
		 أخبار مكة في قديم الدهر وحديثه 	 محمد بن اسحاق ابن العباس الفاكهي المكي 	ABLibrary	8926	0.28698
		 الضوء اللامع لأهل القرن التاسع 	 شمس الدين السخاوي 	ABLibrary	953	0.28695
		 معرفة الإمام 	 السيد محمد حسين الطهراني 	ABLibrary	8887	0.28675
		جامع الافكار و ناقد الانظار	ملا محمد مهدي نراقي	Ghbook	8421	0.28644
		 الذريعة 	 آقا بزرگ الطهراني 	ABLibrary	845	0.2864
		 الذريعة 	 آقا بزرگ الطهراني 	ABLibrary	844	0.28631
		 نفس المهموم في مصيبة سيدنا الحسين المظلوم ( يليه نفثة المصدور فيما يتجدد به حزن العاشور ) 	 الشيخ عباس القمي 	ABLibrary	7873	0.28602
		 الذريعة 	 آقا بزرگ الطهراني 	ABLibrary	865	0.28581
		 مسند الإمام الباقر ( ع ) 	 الشيخ عزيز الله عطاردي 	ABLibrary	7709	0.2858
		 علم اليقين في أصول الدين 	 الفيض الكاشاني 	ABLibrary	8516	0.28559
		 حلية الأبرار في أحوال محمد وآله الأطهار ( ع ) 	 السيد هاشم البحراني 	ABLibrary	7488	0.28527
		 أصحاب أمير المؤمنين ( ع ) والرواة عنه 	 الشيخ محمد هادي الأميني 	ABLibrary	7413	0.28514
		 الضوء اللامع لأهل القرن التاسع 	 شمس الدين السخاوي 	ABLibrary	952	0.28499
		 رحلة مصر والسودان 	 محمد مهري كركوكي 	ABLibrary	9107	0.28488
		 عيد الغدير في الإسلام والتتويج والقربات يوم الغدير ( من فيض الغدير ) 	 الشيخ الأميني 	ABLibrary	8518	0.28465
		 الذريعة 	 آقا بزرگ الطهراني 	ABLibrary	862	0.28459
		 مسالك الأبصار في ممالك الأمصار 	 أحمد بن يحيى العمري 	ABLibrary	9199	0.2843
		 تحفة الازهار وزلال الانهار في نسب ابناء الائمة الاطهار ( ع ) 	 ضامن بن شدقم الحسيني المدني 	ABLibrary	7460	0.28423
		الرسائل الفقهيه	آيت الله العظمي حسينعلي منتظري	Ghbook	9806	0.28395
		 أخبار الحسن بن علي بن أبي طالب ( ع ) 	 الطبراني 	ABLibrary	7397	0.28395
		 خزانة التواريخ النجدية 	 عبد الله بن عبد الرحمن آل بسام 	ABLibrary	9043	0.28355
		 مسند الإمام حسن ( ع ) 	 الشيخ عزيز الله عطاردي 	ABLibrary	7702	0.28313
		 مسند الإمام الحسين ( ع ) 	 الشيخ عزيز الله عطاردي 	ABLibrary	7703	0.28307
		الزهد	الحسين بن سعيد الكوفي الأهوازي	Masaha	505	0.28299
		 جوامع السيرة النبوية 	 ابن حزم 	ABLibrary	7480	0.28288
		 الكواكب السيارة في ترتيب الزيارة 	 ابن الزيات 	ABLibrary	9169	0.28287
		 الضوء اللامع لأهل القرن التاسع 	 شمس الدين السخاوي 	ABLibrary	948	0.28283
		 العوالم ، الإمام جعفر الصادق ( ع ) 	 الشيخ عبد الله البحراني 	ABLibrary	7617	0.28279
		 تاريخ الادب في ايران من الفردوسى الى السعدى 	 ادوارد براون ( تعريب : ابراهيم امين الشواربى ) 	ABLibrary	8001	0.2821
		 الضوء اللامع لأهل القرن التاسع 	 شمس الدين السخاوي 	ABLibrary	947	0.28204
		 الموسوعة الكبرى عن فاطمة الزهراء ( س ) 	 اسماعيل الأنصاري الزنجاني الخوئيني 	ABLibrary	7821	0.2819
		 بغية الطلب في تاريخ حلب 	 عمر بن أحمد العقيلي الحلبي ( ابن العديم ) 	ABLibrary	815	0.2819
		 مسند الإمام الصادق ( ع ) 	 الشيخ عزيز الله عطاردي 	ABLibrary	7714	0.28183
		 الشافي في شرح الكافي 	 المولى خليل القزويني 	ABLibrary	7921	0.28177
		 ألفية السيرة النبوية ( نظم الدّرر السنية في السّير الزكية ) 	 زين الدّين عبد الرّحيم بن الحسين العراقي 	ABLibrary	7421	0.28153
		 الذريعة 	 آقا بزرگ الطهراني 	ABLibrary	863	0.28144
		 تاريخ معرة النعمان 	 محمد سليم الجندي 	ABLibrary	9005	0.2812
		السواك وسنن الفطرة - المقدم	محمد أحمد إسماعيل المقدم	ShamAY	372	0.28089
		 الذريعة 	 آقا بزرگ الطهراني 	ABLibrary	851	0.28088
		 العوالم ، الإمام الجواد ( ع ) 	 الشيخ عبد الله البحراني 	ABLibrary	7621	0.28044
		 معرفة الإمام 	 السيد محمد حسين الطهراني 	ABLibrary	8884	0.28043
		 الدر الكمين بذيل العقد الثمين في تاريخ البلد الأمين 	 عمر بن محمد ابن فهد 	ABLibrary	9065	0.28039
		 فرائد السمطين في فضائل المرتضى والبتول والسبطين والأئمة من ذريتهم ( ع ) 	 ابراهيم بن سعد الدين الشافعي 	ABLibrary	7628	0.28034
		 العوالم ، الإمام محمد الباقر ( ع ) 	 الشيخ عبد الله البحراني 	ABLibrary	7616	0.2803
		 البرصان والعرجان والعميان والحولان 	 الجاحظ 	ABLibrary	821	0.2803
		 الذريعة 	 آقا بزرگ الطهراني 	ABLibrary	847	0.28024
		 بغية الطلب في تاريخ حلب 	 عمر بن أحمد العقيلي الحلبي ( ابن العديم ) 	ABLibrary	810	0.28021
		الذّريعة إلى تصانيف الشّيعة [ج ٢٣]	الشيخ آقا بزرك الطهراني	Rafed	499	0.28017
		 الذريعة 	 آقا بزرگ الطهراني 	ABLibrary	867	0.28003
		 صحيفة الإمام الرضا ( ع ) ( فارسي ) 	 المنسوب لإمام الرضا ( ع ) 	ABLibrary	7896	0.27993
		 المزار 	 السيد مهدي القزويني 	ABLibrary	9186	0.27971
		 خلاصة عبقات الأنوار 	 السيد حامد النقوي 	ABLibrary	93	0.27928
		 الضوء اللامع لأهل القرن التاسع 	 شمس الدين السخاوي 	ABLibrary	950	0.27926
		 التتمة في تواريخ الأئمة ( ع ) 	 السيد تاج الدين العاملي 	ABLibrary	7455	0.27905
		 مكاتيب الأئمة ( ع ) 	 علي الأحمدي الميانجي 	ABLibrary	7780	0.27904
		 تاريخ ابن يونس الصدفي 	 عبد الرحمن ابن احمد الصدفي المصري 	ABLibrary	8974	0.27902
		 أعيان الشيعة 	 السيد محسن الأمين 	ABLibrary	80	0.27893
		 الذريعة 	 آقا بزرگ الطهراني 	ABLibrary	852	0.27876
		 موسوعة مرآة الحرمين الشريفين وجزيرة العرب 	 أيوب صبري باشا 	ABLibrary	9291	0.27875
