automatic URI	Proposed URI	bookTitle	authorName	collection	id	tfidf
		يتمة الدهر في محاسن أهل العصر	عبد الملك بن محمد بن إسماعيل أبو منصور الثعالبي (المتوفى: 429هـ)	ShamAY	6743	0.28092
		صفة جزيرة الأندلس منتخبة من كتاب الروض المعطار	أبو عبد الله محمد بن عبد الله بن عبد المنعم الحِميرى (المتوفى: 900هـ)	ShamAY	1344	0.2809
		البرهان في تفسير القرآن - الجزء1	السيد هاشم البحراني	Masaha	3228	0.28088
		شرح أسماء الله الحسنى	زين الدين أبي القاسم عبدالكريم ابن هوازن بن عبدالملك ابن طلحة بن محمد النيسابوري القشيري	Rafed	3485	0.28088
		خزانة التّواريخ النجديّة [ج ٩]	عبد الله بن عبد الرحمن بن صالح آل بسام	Rafed	2175	0.28082
		أعلام الدين في صفات المؤمنين	الحسن الديلمي	Masaha	1662	0.28079
		 مسالك الأبصار في ممالك الأمصار 	 أحمد بن يحيى العمري 	ABLibrary	9188	0.28079
		تزيين الأسواق في أخبار العشاق - عالم الكتب	داود بن عمر الأنطاكي الضرير	ShamAY	33794	0.28078
		رحلة ابن جبير ط دار الهلال	ابن جبير، محمد بن أحمد بن جبير الكناني الأندلسي، أبو الحسين (المتوفى: 614هـ)	ShamAY	10883	0.28078
		 معرفة الإمام 	 السيد محمد حسين الطهراني 	ABLibrary	8888	0.28073
		تاريخ مدينة دمشق [ج ٨٠]	أبي القاسم علي بن الحسن ابن هبة الله بن عبد الله الشافعي [ ابن عساكر ]	Rafed	2667	0.28073
		سير أعلام النبلاء ط الحديث	شمس الدين أبو عبد الله محمد بن أحمد بن عثمان بن قَايْماز الذهبي (المتوفى: 748هـ)	ShamAY	22669	0.28072
		 كيفية السلوك إلى رب العالمين 	 الحكيم الترمذي 	ABLibrary	8697	0.28071
		العواصم من القواصم في تحقيق مواقف الصحابة بعد وفاة النبي صلى الله عليه وسلم	القاضي محمد بن عبد الله أبو بكر بن العربي المعافري الاشبيلي المالكي (المتوفى: 543هـ)	ShamAY	30897	0.28068
		الحطة في ذكر الصحاح الستة	أبو الطيب محمد صديق خان بن حسن بن علي ابن لطف الله الحسيني البخاري القِنَّوجي (المتوفى: 1307هـ)	ShamAY	10717	0.28067
		تفسير السمعاني	أبو المظفر، منصور بن محمد بن عبد الجبار ابن أحمد المروزى السمعاني التميمي الحنفي ثم الشافعي (المتوفى: 489هـ)	ShamAY	8320	0.28067
		أساس البلاغة	أبو القاسم محمود بن عمرو بن أحمد، الزمخشري جار الله (المتوفى: 538ه)	Sham19Y	21568	0.28062
		نكث الهميان في نكت العميان	صلاح الدين خليل بن أيبك الصفدي (المتوفى: 764هـ)	ShamAY	28182	0.28061
		 بحار الأنوار 	 العلامة المجلسي 	ABLibrary	748	0.2806
		إتحاف الإلف بذكر الفوائد الألف والنيف من سورة يوسف	سليم الهلالي	ShamAY	38627	0.28059
		تاريخ الإسلام ووفيات المشاهير والأعلام [ج ١]	شمس الدين محمّد بن أحمد بن عثمان الذّهبي	Rafed	3317	0.28059
		إعراب القرآن لابن سيده	ابن سيده	ShamAY	36821	0.28058
		تراثنا ـ العدد [ 25 ]	مؤسسة آل البيت عليهم السلام لإحياء التراث ـ قم	Rafed	2745	0.28056
		الدّرر النجفيّة [ج ٤]	الشيخ يوسف بن أحمد البحراني [ صاحب الحدائق ]	Rafed	3713	0.28055
		 دلائل النبوة ومعرفة أحوال صاحب الشريعة 	 أحمد بن الحسين البيهقي 	ABLibrary	932	0.28054
		المخصّص [ج ١٧]	أبي الحسن علي بن إسماعيل بن سيده المرسي [ ابن سيده ]	Rafed	3565	0.28054
		أنوار التنزيل وأسرار التأويل [ج ١]	عبدالله بن عمر بن محمد الشيرازي الشافعي البيضاوي	Rafed	3166	0.28054
		بحوث في الملل والنحل - الجزء1	الشيخ جعفر السبحاني	Masaha	658	0.28052
		 حياة الإمام موسى بن جعفر ( ع ) 	 الشيخ باقر شريف القرشي 	ABLibrary	7505	0.28052
		مختصر كفاية المهتدي لمعرفة المهدي عليه السلام	مير لوحي سبزواري	Masaha	4067	0.28049
		الإمام الصادق و المذاهب الأربعة - الجزء1	الشيخ أسد حيدر	Masaha	1855	0.28048
		 الأرج المسكي في التاريخ المكي وتراجم الملوك والخلفاء 	 علي بن عبد القادر الطبري 	ABLibrary	8928	0.28048
		المعجب في تلخيص أخبار المغرب من لدن فتح الأندلس إلى آخر عصر الموحدين	عبد الواحد بن علي التميمي المراكشي، محيي الدين (المتوفى: 647هـ)	ShamAY	8559	0.28047
		الخصائص الكبرى	عبد الرحمن بن أبي بكر، جلال الدين السيوطي (المتوفى: 911ه)	Sham19Y	6590	0.28045
		الخصائص الكبرى	عبد الرحمن بن أبي بكر، جلال الدين السيوطي (المتوفى: 911هـ)	ShamAY	6590	0.28044
		ترجمه الامام الحسين و مقتله من القسم غيرالمطبوع من كتاب الطبقات الكبير	محمد بن سعد كاتب واقدي ( ابن سعد )	Ghbook	5946	0.28043
		بحار الأنوار [ج ٤٥]	الشيخ محمّد باقر بن محمّد تقي المجلسي	Rafed	977	0.28041
		القصص و الحكايات	آيت الله العظمي سيد محمد حسيني شيرازي	Ghbook	8072	0.28041
		التذكرة الفخرية	الصاحب بهاء الدين علي بن عيسى بن أبي الفتح الإربلي (المتوفى: 692هـ)	ShamAY	724	0.28038
		حديث تحليلي	طارق الطواري	ShamAY	35985	0.28035
		شرح الترمذي «النفح الشذي شرح جامع الترمذي»	محمد بن محمد بن محمد بن أحمد، ابن سيد الناس، اليعمري الربعي، أبو الفتح، فتح الدين (المتوفى: 734 ه)	Sham19Y	16599	0.28034
		الطّراز الأوّل [ج ٥]	السيّد علي بن أحمد بن محمّد معصوم الحسيني	Rafed	491	0.28034
		شمس العلوم [ج ٩]	نشوان بن سعيد الحميري	Rafed	1412	0.28033
		تفسير نور الثقلين [ج ١]	الشيخ عبد علي بن جمعة العروسي الحويزي	Rafed	3049	0.28029
		 بحوث في الملل والنحل 	 الشيخ السبحاني 	ABLibrary	8360	0.28025
		الذب عن مذهب الإمام مالك	أبو محمد عبد الله بن (أبي زيد) عبد الرحمن النفزي، القيرواني، المالكي (المتوفى: 386 ه)	ShamelaY19	18606	0.28025
		رسالة الشرك ومظاهره	مبارك بن محمد الميلي الجزائري (المتوفى: 1364هـ)	ShamAY	625	0.28023
		 تاريخ اربل ( نباهة البلد الخامل بمن ورده من الاماثل ) 	 ابن المستوفي 	ABLibrary	8978	0.28023
		تقويم البلدان	اسماعيل بن علي ابو الفداء	Ghbook	11104	0.28023
		أساس البلاغة	أبو القاسم محمود بن عمرو بن أحمد، الزمخشري جار الله (المتوفى: 538ه)	ShamelaY19	21568	0.28022
		الموسوعة القرآنية، خصائص السور	جعفر شرف الدين	ShamAY	21769	0.2802
		أساس البلاغة - ط الفكر	أبو القاسم محمود بن عمرو بن أحمد، الزمخشري جار الله	ShamAY	34676	0.28019
		البخلاء للجاحظ - العلمية	أبو عثمان عمرو بن بحر الجاحظ	ShamAY	33775	0.28017
		أنس المسجون وراحة المحزون	صفيّ الدين، أبو الفتح عيسى بن البحتري الحلبي (المتوفى: بعد 625هـ)	ShamAY	31707	0.28017
		القبور لابن أبي الدنيا - ط أطلس الخضراء = مقابل	أبو بكر عبد الله بن محمد ابن أبي الدنيا	ShamAY	38162	0.28017
		الشيعة الجذور والبذور	محمود جابر	Masaha	494	0.28016
		أمراء البيان	محمد علي كرد	ShamAY	35859	0.28013
		تاج العروس [ج ٣]	محبّ الدين أبي فيض السيد محمّد مرتضى الحسيني الواسطي الزبيدي الحنفي	Rafed	1489	0.28013
		الأعضاء والنفس	الترمذي، الحكيم	ShamAY	6794	0.28012
		المدرّس الأفضل [ج ١]	الشيخ محمّد علي المدرّس الأفغاني	Rafed	2679	0.28012
		تراثنا ـ العددان [ 83 و 84 ]	مؤسسة آل البيت عليهم السلام لإحياء التراث ـ قم	Rafed	3624	0.28012
		شرح كتاب الفتن من صحيح البخاري - عبد الكريم الخضير	عبد الكريم الخضير	ShamAY	64	0.28011
		روح البيان	إسماعيل حقي بن مصطفى الإستانبولي الحنفي الخلوتي , المولى أبو الفداء (المتوفى: 1127ه)	Sham19Y	23612	0.28011
		 الفوائد الرجالية 	 الخاجوئي 	ABLibrary	9771	0.28011
		الائمة الاثنا عشر عليهم السلام	آيت الله علي حسيني ميلاني	Ghbook	4791	0.28011
		اجتماع الجيوش الإسلامية على غزو المعطلة والجهمية ـ ط ابن تيمية	الواحدي :: ابن القيم	ShamAY	33845	0.2801
		تذكرة الموضوعات للفتني	محمد طاهر بن علي الصديقي الهندي الفَتَّنِي (المتوفى: 986هـ)	ShamAY	12738	0.2801
		بحوث في الملل والنّحل [ج ٥]	الشيخ جعفر السبحاني	Rafed	186	0.2801
		اللامع الصبيح بشرح الجامع الصحيح	شمس الدين البِرْماوي، أبو عبد الله محمد بن عبد الدائم بن موسى النعيمي العسقلاني المصري الشافعي (المتوفى: 831 هـ)	ShamAY	32555	0.28008
		اليواقيت والدرر في شرح نخبة ابن حجر	زين الدين محمد المدعو بعبد الرؤوف بن تاج العارفين بن علي بن زين العابدين الحدادي ثم المناوي القاهري (المتوفى: 1031هـ)	ShamAY	5979	0.28007
		الجامع اللطيف	محمد بن محمد ابن ظهيره	Ghbook	8363	0.28006
		 قوانين حكم الاشراق إلى كافة الصوفية بجميع الآفاق 	 محمد بن أحمد الشاذلي ( ابن زغدان ) 	ABLibrary	8818	0.28004
		شرح الزرقاني على المواهب اللدنية بالمنح المحمدية	أبو عبد الله محمد بن عبد الباقي بن يوسف بن أحمد بن شهاب الدين بن محمد الزرقاني المالكي (المتوفى: 1122ه)	ShamelaY19	26568	0.28004
		 بهجة المحافل وبغية الأماثل 	 عماد الدين يحيى بن أبي بكر العامري 	ABLibrary	7443	0.28003
		سرّ الفصاحة	أبي محمّد عبد الله بن سعيد بن سنان الخفاجي الحلبي	Rafed	2077	0.28003
		اليواقيت والدرر في شرح نخبة ابن حجر	زين الدين محمد المدعو بعبد الرؤوف بن تاج العارفين بن علي بن زين العابدين الحدادي ثم المناوي القاهري (المتوفى: 1031ه)	Sham19Y	5979	0.28002
		 الطراز الأول والكناز لما عليه من لغة العرب المعول 	 ابن معصوم المدني 	ABLibrary	7950	0.28002
		 مجموع كتب ورسائل الإمام القاسم بن إبراهيم الرسي 	 القاسم بن إبراهيم الرسي 	ABLibrary	8592	0.27997
		الأمان من أخطار الأسفار و الأزمان	السيد علي بن موسى بن طاووس	Masaha	1016	0.27996
		العمدة من الفوائد والأثار الصحاح والغرائب في مشيخة شهدة	شُهْدة بِنْت أحمد بْن الفرج بْن عُمَر الإبري فخر النساء بِنْت أَبِي نصر الدينوري الأصل البغدادي الكاتبة (المتوفى: 574هـ)	ShamAY	7375	0.27995
		شرح درة الغواص في أوهام الخواص (مطبوع ضمن «درة الغواص وشرحها وحواشيها وتكملتها»)	أحمد بن محمد الخفاجي المصري	ShamelaY19	29600	0.27989
		إرشاد السالك إلى أفعال المناسك	برهان الدين إبراهيم بن فرحون المدني المالكي (المتوفى: 799 ه / 1397 م)	ShamelaY19	132974	0.27989
		تاريخ الفقه الجعفري	هاشم معروف الحسني	Rafed	3882	0.27987
		عمدة عيون صحاح الأخبار في مناقب إمام الأبرار	ابن بطريق الحلي‏	Masaha	2303	0.27985
		زاد المسير في علم التفسير [ج ٣]	أبي الفرج عبدالرحمن ابن علي ابن الجوزي	Rafed	3326	0.27985
		الحسين عليه السلام في مواجهة الضلال الأموي وإحياء سيرة النبي صلّى الله عليه وآله وعلي عليه السلام	السيّد سامي البدري	Rafed	1551	0.27984
		كنوز في الرقية والطب النبوي	أبو أحمد كمال مختار إسماعيل	ShamAY	34907	0.27982
		 بحار الأنوار 	 العلامة المجلسي 	ABLibrary	771	0.27981
		 بحار الأنوار 	 العلامة المجلسي 	ABLibrary	741	0.27979
		المقلق لابن الجوزي	جمال الدين أبو الفرج عبد الرحمن بن علي بن محمد الجوزي (المتوفى: 597هـ)	ShamAY	26892	0.27977
		 بحار الأنوار 	 العلامة المجلسي 	ABLibrary	780	0.27976
		تراثنا ـ العددان [ 50 و 51 ]	مؤسسة آل البيت عليهم السلام لإحياء التراث ـ قم	Rafed	3188	0.27976
		الناسخ والمنسوخ في القرآن العزيز وما فيه من الفرائض والسنن	أبو عبيد القاسم بن سلام بن عبد الله الهروي البغدادي (المتوفى: 224ه)	ShamelaY19	37834	0.27976
		عُقودُ الزَّبَرْجَدِ على مُسْند الإِمَام أَحْمد	عبد الرحمن بن أبي بكر، جلال الدين السيوطي (المتوفى: 911هـ)	ShamAY	31988	0.27975
		تاريخ مدينة دمشق [ج ٧٤]	أبي القاسم علي بن الحسن ابن هبة الله بن عبد الله الشافعي [ ابن عساكر ]	Rafed	2608	0.27975
		معجم متن اللغة (موسوعة لغوية حديثة)	أحمد رضا (عضو المجمع العلمي العربي بدمشق)	ShamelaY19	29613	0.27975
		 كتاب الماء 	 ابن الذهبي 	ABLibrary	7942	0.27974
		فتوح البلدان	أبوالحسن البلاذري	Rafed	2401	0.27974
		الأحاديث الواردة في الصحيحين في الجن والشياطين	فيصل سعيد محمد الصاعدي	ShamAY	36051	0.27973
		الذب عن مذهب الإمام مالك	أبو محمد عبد الله بن (أبي زيد) عبد الرحمن النفزي، القيرواني، المالكي (المتوفى: 386 هـ)	ShamAY	32672	0.27972
		البرهان في تفسير القرآن [ج ١]	السيد هاشم الحسيني البحراني	Rafed	1477	0.27972
		بناء المقالة الفاطمية في نقض الرسالة العثمانية	السيد علي بن موسى بن طاووس	Masaha	509	0.2797
		مفتاح الأفكار للتأهب لدار القرار	أبو محمد عبد العزيز بن محمد بن عبد الرحمن بن عبد المحسن السلمان (المتوفى: 1422هـ)	ShamAY	120	0.27968
		 الدر النظيم 	 يوسف بن حاتم الشامي المشغري العاملي 	ABLibrary	980	0.27968
		أحاديث يحتج بها الشيعة	عبد الرحمن محمد سعيد دمشقية	ShamAY	35281	0.27966
		خطبة الكتاب المؤمل للرد إلى الأمر الأول	أبو القاسم شهاب الدين عبد الرحمن بن إسماعيل بن إبراهيم المقدسي الدمشقي المعروف بأبي شامة (المتوفى: 665ه)	Sham19Y	14447	0.27966
		شفاء العليل في مسائل القضاء والقدر والحكمة والتعليل	محمد بن أبي بكر بن أيوب بن سعد شمس الدين ابن قيم الجوزية (المتوفى: 751هـ)	ShamAY	12021	0.27965
		دليل أرباب الفلاح لتحقيق فن الاصطلاح	حافظ بن أحمد حكمي	ShamAY	37276	0.27964
		 بحوث في الملل والنحل 	 الشيخ السبحاني 	ABLibrary	8361	0.27962
		إنارة الدجى في مغازي خير الورى صلى الله عليه وآله وسلم	حسن بن محمد المشاط المالكي (المتوفى: 1399هـ)	ShamAY	9772	0.27961
		تاريخ مدينة السلام وأخبار محدثيها وذكر قطانها العلماء من غير أهلها ووارديها (المعروف بتاريخ بغداد)	أبو بكر أحمد بن علي بن ثابت الخطيب البغدادي	ShamAY	34639	0.2796
		مسائل حرب الكرماني كتاب الطهارة والصلاة - ت السريع	أبو محمد حرب بن إسماعيل بن خلف الكرماني (المتوفى: 280 هـ)	ShamAY	32500	0.27955
		 بغية الطلب في تاريخ حلب 	 عمر بن أحمد العقيلي الحلبي ( ابن العديم ) 	ABLibrary	819	0.27954
		نهج الرشاد في نظم الاعتقاد	يوسف بن محمد بن مسعود بن محمد العبادي العقيلي، جمال الدين السرمري (المتوفى: 776هـ)	ShamAY	31919	0.27952
		كتاب المحاربة من موطأ ابن وهب	أبو محمد عبد الله بن وهب بن مسلم المصري القرشي (المتوفى: 197ه)	ShamelaY19	30173	0.27947
		شأن الدعاء	أبو سليمان حمد بن محمد بن إبراهيم بن الخطاب البستي المعروف بالخطابي (المتوفى: 388هـ)	ShamAY	1624	0.27946
		العقائد الإسلامية - الجزء1	مركز المصطفى	Masaha	370	0.27945
		مثير الأحزان‏	ابن نما الحلي‏	Masaha	2853	0.27944
		فقه السيرة النبوية لمنير الغضبان	منير محمد الغضبان (المتوفى: 1435هـ)	ShamAY	31835	0.27943
		 حياة الإمام موسى بن جعفر ( ع ) 	 الشيخ باقر شريف القرشي 	ABLibrary	7506	0.27943
		فتوح مصر والمغرب	ابن عبد الحكم	Rafed	2445	0.27943
		روح المعاني [ج ١٢]	أبي الفضل شهاب الدين السيّد محمود الألوسي البغدادي	Rafed	3198	0.27935
		 شرح الأنفاس الروحانية لأئمة السلف الصوفية 	 محمد بن عبد الملك الديلمي 	ABLibrary	8727	0.27933
		أنوار التنزيل وأسرار التأويل [ج ٤]	عبدالله بن عمر بن محمد الشيرازي الشافعي البيضاوي	Rafed	3174	0.27932
		المسترشد في الإمامة	محمد بن جرير الطبري‏ الصغير	Masaha	2862	0.2793
		عيون المعجزات	حسين بن عبدالوهاب شعراني	Ghbook	9499	0.2793
		النجم الوهاج في شرح المنهاج	كمال الدين، محمد بن موسى بن عيسى بن علي الدَّمِيري أبو البقاء الشافعي (المتوفى: 808هـ)	ShamAY	31789	0.27927
		شرح درة الغواص في أوهام الخواص (مطبوع ضمن «درة الغواص وشرحها وحواشيها وتكملتها»)	أحمد بن محمد الخفاجي المصري	ShamAY	38970	0.27924
		الإسراء والمعراج - ت القاضي	الواحدي :: السيوطي	ShamAY	37386	0.27924
		موسوعة عبد الله بن عبّاس [ج ٧]	السيد محمد مهدي السيد حسن الموسوي الخرسان	Rafed	1183	0.27924
		تراثنا ـ العدد [ 11 ]	مؤسسة آل البيت عليهم السلام لإحياء التراث ـ قم	Rafed	2721	0.27923
		روضة المحبين ونزهة المشتاقين	محمد بن أبي بكر بن أيوب بن سعد شمس الدين ابن قيم الجوزية (المتوفى: 751هـ)	ShamAY	11229	0.27922
		في رحاب العقيدة - الجزء1	السيد محمد سعيد الطباطبائي الحكيم	Masaha	609	0.27921
		 التبصير في الدين وتمييز الفرقة الناجية عن الفرق الهالكين 	 ابو المظفر الاسفرايني 	ABLibrary	8375	0.27919
		أدب الدنيا والدين	أبو الحسن علي بن محمد بن محمد بن حبيب البصري البغدادي، الشهير بالماوردي (المتوفى: 450هـ)	ShamAY	765	0.27918
		 ديوان ابن عربي 	 ابن عربي 	ABLibrary	8737	0.27913
		الجامع لمسائل المدونة	أبو بكر محمد بن عبد الله بن يونس التميمي الصقلي (المتوفى: 451 ه)	Sham19Y	18607	0.27911
		حول علم الائمه بالغيب	خليفه عبيد كلباني عماني	Ghbook	7639	0.27911
		الغدير في الكتاب والسنّة والأدب [ج ٣]	الشيخ عبد الحسين أحمد الأميني النجفي	Rafed	2001	0.27909
		الإلحاد والظلم في المسجد الحرام بين الإرادة والتنفيذ	د محمد بن سعد بن عبد الرحمن آل سعود	ShamAY	8766	0.27908
		 نقض الوشيعة أو الشيعة بين الحقائق الأوهم 	 السيد محسن الأمين 	ABLibrary	8670	0.27907
		تاج العروس [ج ٨]	محبّ الدين أبي فيض السيد محمّد مرتضى الحسيني الواسطي الزبيدي الحنفي	Rafed	1500	0.27907
		 شمس العلوم ودواء كلام العرب من الكلوم 	 نشوان بن سعيد الحميري 	ABLibrary	9794	0.27906
		الفتوحات الربانية على الأذكار النواوية	محمد بن علان الصديقي الشافعي الأشعري المكي (المتوفى: 1057 ه)	ShamelaY19	23625	0.27904
		الامام الباقر ( عليه السلام ) قدوه و اسوه	آيت الله العظمي سيد محمد تقي مدرسي	Ghbook	6274	0.27904
		الوافي - الجزء1	الفيض الكاشاني	Masaha	1326	0.27903
		التفسير الوسيط للقرآن الكريم [ج ٩]	الدكتور محمد سيد طنطاوي	Rafed	3947	0.27903
		الجد الحثيث في بيان ما ليس بحديث	أحمد بن عبد الكريم بن سعودي الغزي العامري (المتوفى: 1143هـ)	ShamAY	6077	0.27902
		ابو الشهداء الحسين بن علي عليه السلام	عباس محمود العقاد	Masaha	4073	0.27902
		حياة الإمام محمّد الباقر عليه السلام دراسة وتحليل [ج ٢]	باقر شريف القرشي	Rafed	615	0.27902
		 مسند الإمام الصادق ( ع ) 	 الشيخ عزيز الله عطاردي 	ABLibrary	7720	0.27901
		كتاب من لا يحضره الفقيه [ج ٢]	أبي جعفر محمّد بن علي بن الحسين بن بابويه القمّي [ الشيخ الصدوق ]	Rafed	1418	0.27899
		شمس العلوم و دواء كلام العرب من الكلوم	نشوان  بن سعيد حميري	Ghbook	16230	0.27899
		تاريخ بغداد وذيوله ط العلمية	أبو بكر أحمد بن علي بن ثابت بن أحمد بن مهدي الخطيب البغدادي (المتوفى: 463هـ)	ShamAY	31579	0.27898
		معاملة الحكام في ضوء الكتاب والسنة	عبد السلام بن برجس آل عبد الكريم	ShamAY	36557	0.27897
		 وفاء الوفاء بأخبار دار المصطفى ( ص ) 	 نورالدين علي بن أحمد السمهودي 	ABLibrary	7885	0.27897
		مجموع كتب ورسائل الإمام القاسم بن إبراهيم الرسي ( 169 ـ 246 هـ ) [ج ٢]	القاسم بن ابراهيم بن اسماعيل بن ابراهيم بن الحسن بن الحسن بن علي بن أبي طالب عليهم السلام	Rafed	3478	0.27896
		خلاصة الوفا بأخبار دار المصطفى	علي بن عبد الله بن أحمد الحسني السمهودي (المتوفى: 911هـ)	ShamAY	31372	0.27894
		شرح الترمذي «النفح الشذي شرح جامع الترمذي»	محمد بن محمد بن محمد بن أحمد، ابن سيد الناس، اليعمري الربعي، أبو الفتح، فتح الدين (المتوفى: 734 هـ)	ShamAY	32425	0.27894
		منهج في الانتماء المذهبي	صائب عبد الـحميد	Masaha	446	0.27894
		الرسائل السياسية	عمرو بن بحر بن محبوب الكناني بالولاء، الليثي، أبو عثمان، الشهير بالجاحظ (المتوفى: 255ه)	Sham19Y	10709	0.27892
		مقتل الامام امير المؤمنين علي بن أبي طالب(ع)	ابن أبي الدنيا	Masaha	2316	0.27892
		 مكاشفة القلوب المقرب إلى علام الغيوب 	 الغزالي 	ABLibrary	8715	0.27892
