automatic URI	Proposed URI	bookTitle	authorName	collection	id	tfidf
		تفسير غرائب القرآن ورغائب الفرقان [ج ٦]	نظام الدين الحسن بن محمّد بن حسين القمي النيسابوري	Rafed	1804	0.26714
		روح المعاني [ج ١٣]	أبي الفضل شهاب الدين السيّد محمود الألوسي البغدادي	Rafed	3200	0.26713
		عجالة الإملاء المتيسرة من التذنيب	إبراهيم بن محمد بن محمود بن بدر، برهان الدين، أبو إسحاق الحلبي القبيباتي الشافعي الناجي (المتوفى: 900ه)	ShamelaY19	97928	0.26713
		فصل الخطاب في الزهد والرقائق والآداب	محمد نصر الدين محمد عويضة	ShamAY	250	0.26712
		 حلية الأبرار في أحوال محمد وآله الأطهار ( ع ) 	 السيد هاشم البحراني 	ABLibrary	7485	0.26712
		الإكليل في استنباط التنزيل	عبد الرحمن بن أبي بكر، جلال الدين السيوطي (المتوفى: 911هـ)	ShamAY	1385	0.2671
		مجموع رسائل الإمام المنصور بالله عبدالله بن حمزه [ج ٢]	المنصور بالله عبدالله بن حمزة	Rafed	3420	0.2671
		الرسائل الأحمدية - الجزء1	الشيخ أحمد آل طعان البحراني	Masaha	1796	0.26709
		النّهاية [ج ٤]	مجد الدين أبي السعادات المبارك بن محمد الجزري [ ابن الأثير ]	Rafed	3549	0.26709
		عيون الأثر في فنون المغازي والشمائل والسير	محمد بن محمد بن محمد بن أحمد، ابن سيد الناس، اليعمري الربعي، أبو الفتح، فتح الدين (المتوفى: 734ه)	ShamelaY19	23653	0.26709
		التقية في المجتمع الاسلامي: ادلة و آثار	فاضل موسوي	Ghbook	14953	0.26709
		مسند الإمام الشهيد أبي عبدالله الحسين بن علي عليهما السلام [ج ٢]	الشيخ عزيز الله العطاردي	Rafed	3223	0.26708
		سلسلة الأحاديث الواهية و صحح حديثك	الشيخ علي حشيش	ShamAY	33091	0.26707
		كتاب الشعر أو شرح الأبيات المشكلة الإعراب	الحسن بن أحمد بن عبد الغفار الفارسيّ الأصل، أبو علي (المتوفى: 377هـ)	ShamAY	870	0.26707
		التفسير والمفسرون	الدكتور محمد السيد حسين الذهبي (المتوفى: 1398هـ)	ShamAY	12393	0.26706
		تحفة الأحوذي بشرح جامع الترمذي	أبو العلا محمد عبد الرحمن بن عبد الرحيم المباركفورى (المتوفى: 1353هـ)	ShamAY	1163	0.26706
		مرآة العقول [ج ١٣]	الشيخ محمّد باقر بن محمّد تقي المجلسي	Rafed	1034	0.26706
		الاقصي المبارك	آيت الله العظمي سيد محمد حسيني شيرازي	Ghbook	7874	0.26706
		المنهل العذب الروي في ترجمة قطب الأولياء النووي	شمس الدين أبو الخير محمد بن عبد الرحمن بن محمد السخاوي (المتوفى: 902هـ)	ShamAY	317	0.26705
		تكملة الجامع لسيرة شيخ الإسلام ابن تيمية خلال سبعة قرون - ط عالم الفوائد	علي بن محمد العمران	ShamAY	34400	0.26704
		دفاع عن السنة ورد شبه المستشرقين والكتاب المعاصرين	محمد بن محمد بن سويلم أبو شهبة (المتوفى: 1403ه)	ShamelaY19	37593	0.26703
		الكلام على مسألة السماع	أبو عبد الله محمد بن أبي بكر بن أيوب ابن قيم الجوزية (المتوفى: 751 هـ)	ShamAY	38482	0.26702
		شرح جامع الترمذي - الراجحي	عبد العزيز بن عبد الله بن عبد الرحمن الراجحي	Sham19Y	36976	0.26702
		الإنصاف في مسائل دام فيها الخلاف - الجزء1	الشيخ جعفر السبحاني	Masaha	4944	0.26702
		التّفسير الكاشف [ج ٥]	محمّد جواد مغنية	Rafed	2766	0.26702
		فتح العلي المالك في الفتوى على مذهب الإمام مالك	محمد بن أحمد بن محمد عليش، أبو عبد الله المالكي (المتوفى: 1299ه)	ShamelaY19	21688	0.26701
		مناظرات الامام الصادق ( عليه السلام ) و تصديه لحركه الزندقه	حسين الشاكري	Ghbook	5023	0.267
		ألف سؤال وإشكال	الشيخ علي الكوراني	Masaha	185	0.26699
		اتحاف الفقهاء في تحقيق مسألة اختلاف القراءات والقرّاء	الميرزا محسن آل عصفور	Masaha	1649	0.26698
		التفسير والمفسّرون في ثوبه القشيب [ج ١]	محمّد هادي معرفة	Rafed	4026	0.26698
		الإمامة في ضوء الكتاب والسنة	ابن تيمية	ShamAY	35288	0.26697
		الأرج المسكي في التاريخ المكي وتراجم الملوك والخلفاء	علي بن عبد القادر الطبري	Masaha	4487	0.26697
		العقائد الاسلامية [ج ٣]	مركز المصطفى للدراسات الإسلامية	Rafed	87	0.26697
		النكت على صحيح البخاري ويليه «التجريد على التنقيح»	أبو الفضل ابن حجر العسقلاني	ShamelaY19	132963	0.26697
		دروس تربوية من الأحاديث النبوية	أبو عبد الملك خالد بن عبد الرحمن الحسينان	ShamAY	507	0.26695
		 البحر المحيط في أصول الفقه 	 الزركشي 	ABLibrary	804	0.26695
		غاية المنوة في آداب الصحبة وحقوق الأخوة	حازم خنفر	ShamelaY19	36533	0.26694
		دفاع عن السنة ورد شبه المستشرقين والكتاب المعاصرين	محمد بن محمد بن سويلم أبو شهبة (المتوفى: 1403ه)	ShamelaY19	37972	0.26693
		 كتاب الماء 	 ابن الذهبي 	ABLibrary	7943	0.26692
		سلمان سابق فارس عرض وتحليل	الشيخ محمد جواد الفقيه	Rafed	69	0.26692
		فضائل الشّام	الناشر: دار الكتب العلميّة	Rafed	2455	0.2669
		تأويل مختلف الحديث - الجيل	عبدالله بن مسلم بن قتيبة أبو محمد الدينوري	ShamAY	33526	0.26688
		 الإنصاف في مسائل دام فيها الخلاف 	 الشيخ السبحاني 	ABLibrary	9555	0.26685
		 الحلقة الضائعة من تاريخ جبل عامل 	 علي داود جابر 	ABLibrary	9038	0.26685
		البيان في عقائد اهل الايمان	محمد باقر شريعتي اصفهاني	Ghbook	7533	0.26685
		شرح التجريد الصريح لأحاديث الجامع الصحيح - عبد الكريم الخضير	عبد الكريم الخضير	ShamAY	62	0.26684
		نتاج الفكر في أحكام الذكر	أبو محمد عبد الله بن مانع بن غلاب الغبيوي الروقي العتيبي	ShamAY	32012	0.26682
		بلوغ الأمل في تقرير قاعدةالجزاء من جنس العمل	محمد شومان	ShamAY	37557	0.26682
		شرح جامع الترمذي - الراجحي	عبد العزيز بن عبد الله بن عبد الرحمن الراجحي	ShamAY	100	0.26682
		فضائل مصر المحروسة	أبو عمر محمد بن يوسف بن يعقوب الكندي المصري (المتوفى: بعد 355هـ)	ShamAY	405	0.26682
		 نوادر الأخبار فيما يتعلق بأصول الدين 	 الفيض الكاشاني 	ABLibrary	7925	0.26682
		توحيد المفضل‏	المفضل بن عمر	Masaha	4555	0.26681
		طبّ الأئمة عليهم السلام	أبي عتاب عبد الله بن سابور الزيات	Rafed	1749	0.26681
		كتاب الرؤيا	حمود بن عبد الله بن حمود بن عبد الرحمن التويجري (المتوفى: 1413ه)	ShamelaY19	20824	0.26681
		(الحماسة المغربية) مختصر كتاب صفوة الأدب ونخبة ديوان العرب	أبو العباس أحمد بن عبد السلام الجراوي التادلي (المتوفى: 609ه)	Sham19Y	6902	0.26679
		منتهى السؤل على وسائل الوصول إلى شمائل الرسول(ص) - الجزء1	عبد الله بن سعيد محمد العبادي	Masaha	3288	0.26679
		 معرفة المعاد 	 السيد محمد حسين الطهراني 	ABLibrary	8874	0.26679
		جواهر الأدب في أدبيات وإنشاء لغة العرب	أحمد بن إبراهيم بن مصطفى الهاشمي (المتوفى: 1362هـ)	ShamAY	21505	0.26678
		تاريخ النجف الأشرف - الجزء1	عبد الزراق حرز الدين	Masaha	3386	0.26678
		تفسير المراغي [ج ٤]	أحمد مصطفى المراغي	Rafed	1664	0.26675
		اليواقيت الحسان في تفسير سورة الرّحمن	آية الله مجد الدّين النّجفي الإصفهاني	Rafed	550	0.26675
		الخصائص [ج ٣]	أبي الفتح عثمان بن جنّي	Rafed	2089	0.26675
		الضوء اللامع المبين عن مناهج المحدثين	أحمد محرم الشيخ ناجي	ShamAY	7452	0.26674
		فضائل أمير المؤمنين(ع)	ابن عقدة الكوفي‏	Masaha	2871	0.26673
		 معرفة الإمام 	 السيد محمد حسين الطهراني 	ABLibrary	8883	0.26673
		سفينة البحار - الجزء1	الشيخ عباس القمي	Masaha	4042	0.26672
		 معرفة المعاد 	 السيد محمد حسين الطهراني 	ABLibrary	8879	0.26671
		آيات الأحكام	محمد بن علي الاسترابادي	Rafed	3183	0.2667
		الشهاب الثاقب في بيان معني الناصب	سيدمهدي رجايي	Ghbook	15623	0.2667
		الأجوبة الكافية عن الأسئلة الشامية	محمد بن يوسف بن محمد بن سعد الحيدري التونسي الكافي المالكي (المتوفى: 1380ه)	ShamelaY19	36571	0.26669
		(الحماسة المغربية) مختصر كتاب صفوة الأدب ونخبة ديوان العرب	أبو العباس أحمد بن عبد السلام الجرّاوي التادلي (المتوفى: 609هـ)	ShamAY	6902	0.26665
		خصائص الوحى المبين	شمس الدين يحيى بن الحسن الأسدي الربعي الحلّي [ الحافظ ابن البطريق ]	Rafed	1837	0.26665
		فتوح الغيب في الكشف عن قناع الريب (حاشية الطيبي على الكشاف)	شرف الدين الحسين بن عبد الله الطيبي (المتوفى: 743 ه)	ShamelaY19	20891	0.26665
		شرح المشكل من شعر المتنبي	علي بن إسماعيل بن سيده (المتوفى: 458هـ)	ShamAY	775	0.26663
		دقائق التفسير الجامع لتفسير ابن تيمية	تقي الدين أبو العباس أحمد بن عبد الحليم بن عبد السلام بن عبد الله بن أبي القاسم بن محمد ابن تيمية الحراني الحنبلي الدمشقي (المتوفى: 728هـ)	ShamAY	5487	0.2666
		تيسير العزيز الحميد في شرح كتاب التوحيد الذى هو حق الله على العبيد	سليمان بن عبد الله بن محمد بن عبد الوهاب (المتوفى: 1233هـ)	ShamAY	2378	0.2666
		الأمثال لابن سلام	أبو عُبيد القاسم بن سلاّم بن عبد الله الهروي البغدادي (المتوفى: 224هـ)	ShamAY	135	0.2666
		أجوبة مسائل و رسائل في مختلف فنون المعرفة	ابن إدريس الحلي	Masaha	1009	0.2666
		أحكام القرآن [ج ٢]	أبي بكر أحمد بن علي الرازي الجصّاص	Rafed	1988	0.2666
		المقاصد الحسنة في بيان كثير من الأحاديث المشتهرة على الألسنة	شمس الدين أبو الخير محمد بن عبد الرحمن بن محمد السخاوي (المتوفى: 902ه)	ShamelaY19	23177	0.2666
		الإحاطة في أخبار غرناطة	محمد بن عبد الله بن سعيد السلماني اللوشي الأصل، الغرناطي الأندلسي، أبو عبد الله، الشهير بلسان الدين ابن الخطيب (المتوفى: 776ه)	Sham19Y	11682	0.26659
		 تاريخ الموصل 	 يزيد بن محمد الأزدي 	ABLibrary	9007	0.26659
		المسائل الماردينية - وهي مسائل يكثر وقوعها ويحصل الابتلاء بها	تقي الدين أبو العباس أحمد بن عبد الحليم بن عبد السلام بن عبد الله بن أبي القاسم بن محمد ابن تيمية الحراني الحنبلي الدمشقي (المتوفى: 728ه)	ShamelaY19	96844	0.26659
		الاعتصام بالكتاب والسنة	الشيخ جعفر السبحاني	Masaha	4867	0.26658
		فتح العلي المالك في الفتوى على مذهب الإمام مالك	محمد بن أحمد بن محمد عليش، أبو عبد الله المالكي (المتوفى: 1299هـ)	ShamAY	21688	0.26657
		عون الحنان في شرح الأمثال في القرآن	على أحمد عبد العال الطهطاوى	ShamelaY19	38000	0.26656
		 الدر المنظوم في ذكر محاسن الأمصار والرسوم 	 حمود بن أحمد البوسعيدي 	ABLibrary	9066	0.26655
		التفسير المنير [ج ٧]	الدكتور وهبة الزحيلي	Rafed	2949	0.26655
		الاستبصار في عجائب الامصار	مجهول ( بي نا )	Ghbook	8918	0.26655
		الإمام المنتظر عليه السلام من ولادته إلى دولته	السيد علي الحسيني الصدر	Rafed	1014	0.26654
		إعلام الورى بأعلام الهدى [ج ٢]	الشيخ أبي علي الفضل بن الحسن الطبرسي	Rafed	543	0.26654
		الأخبار النبوية الفاصلة في الأحداث العالمية المقبلة	محمد أحمد عبد الغني	ShamAY	36491	0.26653
		الجذور اليهودية للشيعة في كتاب علل الشرايع للصدوق الشيعي	محمد عبد المنعم القيعي	ShamAY	35607	0.26652
		مطمح الأنفس ومسرح التأنس في ملح أهل الأندلس	أبي نصر الفتح بن محمد بن عبيد الله بن خاقان ابن عبد الله القيسي الإشبيلي	ShamAY	1566	0.26652
		الرسائل العشر (للشيخ الطوسي)	الشيخ الطوسي	Masaha	1023	0.2665
		تَكْمِلَةُ الجَامِع لِسِيْرَةِ شَيْخِ الإِسْلَامِ ابْن تَيْمِيَّة خِلَال سَبْعَة قرُون	علي بن محمد بن حسين العِمران	ShamAY	38478	0.26649
		جامع الآثار في السير ومولد المختار	الواحدي :: ابن ناصر الدين الدمشقي	ShamAY	34447	0.26649
		منطلقات طالب العلم	أبو العلاء محمد بن حسين بن يعقوب السلفي المصري	ShamelaY19	98137	0.26649
		قيمة الزمن عند العلماء	عبد الفتاح أبو غدة الحلبي الحنفي (المتوفى: 1417ه)	ShamelaY19	96882	0.26647
		الجديد في تفسير القرآن المجيد [ج ٢]	الشيخ محمّد السبزواري النجفي	Rafed	3700	0.26645
		صحيح وضعيف تاريخ الطبري	الإمام أبو جعفر بن جرير الطبري (224 - 310 ه)	ShamelaY19	145435	0.26645
		التبر المسبوك في نصيحة الملوك	أبو حامد محمد بن محمد الغزالي الطوسي (المتوفى: 505هـ)	ShamAY	4129	0.26644
		فلاح السائل	السيّد رضي الدين أبو القاسم علي بن موسى بن جعفر بن طاووس الحسني الحلّي [ السيّد بن طاووس ]	Rafed	1744	0.26644
		مسبوك الذهب في فضل العرب وشرف العلم على شرف النسب	مرعي بن يوسف بن أبى بكر بن أحمد الكرمى المقدسي الحنبلى (المتوفى: 1033ه)	ShamelaY19	26541	0.26644
		أمالي ابن المزرع	يموت بن المزرع العبدي، من عبد القيس، البصري، أبو بكر (المتوفى: 304هـ)	ShamAY	651	0.26643
		التفسير المنير [ج ٢٩]	الدكتور وهبة الزحيلي	Rafed	2977	0.26643
		 منتخب الأثر في أحوال الإمام الثاني عشر ( عج ) 	 الشيخ لطف الله الصافي الگلپايگاني 	ABLibrary	7791	0.26642
		حياة محمد صلى الله عليه وآله وسلم	محمد حسين هيكل (المتوفى: 1376هـ)	ShamAY	9797	0.26641
		دقائق التفسير الجامع لتفسير ابن تيمية	تقي الدين أبو العباس أحمد بن عبد الحليم بن عبد السلام بن عبد الله بن أبي القاسم بن محمد ابن تيمية الحراني الحنبلي الدمشقي (المتوفى: 728ه)	Sham19Y	5487	0.26641
		 في ظلال نهج البلاغة 	 محمد جواد مغنية 	ABLibrary	965	0.26641
		الإحتجاج [ج ١-٢]	أبي منصور أحمد بن علي بن أبي طالب الطبرسي	Rafed	1121	0.26641
		تراثنا ـ العددان [ 75 و 76 ]	مؤسسة آل البيت عليهم السلام لإحياء التراث ـ قم	Rafed	3307	0.26641
		الامام علي خليفة الله	علي رضوي	Ghbook	11886	0.26641
		أحاديث وقصص لا تثبت انتشرت عبر البريد الإلكتروني	عبد الله بن زقيل	ShamAY	33089	0.2664
		تفسير البيضاوي = أنوار التنزيل وأسرار التأويل	ناصر الدين أبو سعيد عبد الله بن عمر بن محمد الشيرازي البيضاوي (المتوفى: 685ه)	ShamelaY19	23588	0.2664
		رسائل السنة والشيعة لرشيد رضا	محمد رشيد بن علي رضا بن محمد شمس الدين بن محمد بهاء الدين بن منلا علي خليفة القلموني الحسيني (المتوفى: 1354هـ)	ShamAY	12723	0.26638
		مصادر الشعر الجاهلي	ناصر الدين الأسد	ShamAY	2055	0.26638
		مناظرات [ج ٤]	الشيخ عبد الله الحسن	Rafed	213	0.26638
		دعوي السفاره في الغيبه الكبري	محمد السند	Ghbook	6655	0.26638
		تراثنا ـ العددان [ 38 و 39 ]	مؤسسة آل البيت عليهم السلام لإحياء التراث ـ قم	Rafed	2798	0.26637
		كتاب العين [ج ٨]	الخليل بن أحمد الفراهيدي	Rafed	2844	0.26637
		تفسير البيضاوي = أنوار التنزيل وأسرار التأويل	ناصر الدين أبو سعيد عبد الله بن عمر بن محمد الشيرازي البيضاوي (المتوفى: 685هـ)	ShamAY	23588	0.26636
		 النفحة المسكية في الرحلة المكية 	 عبد الله بن حسين السويدي البغدادي 	ABLibrary	9307	0.26636
		ثاره الترغيب و التشويق الي مساجد الثلاثه و البيت العتيق	رسول جعفريان	Ghbook	10426	0.26636
		 موسوعة العتبات المقدسة 	 جعفر الخليلي 	ABLibrary	9254	0.26634
		الصحيح المسبور من التفسير بالمأثور	حكمت بشير ياسين	ShamelaY19	22912	0.26634
		شرح العقيدة الأصفهانية - ط الرشد	أحمد بن عبد الحليم بن تيمية الحراني أبو العباس	ShamAY	34373	0.26632
		موسوعة الطير والحيوان في الحديث النبوي	عبد اللطيف عاشور	Sham19Y	23686	0.26631
		تحقيق ما للهند	محمد بن أحمد أبو ريحان البيروني	Masaha	4804	0.26631
		تعريب تاريخ طبرستان	محمد بن حسن بن إسفنديار	Masaha	4802	0.26631
		الأنوار الساطعات لآيات جامعات أو البرهان المحكم في أن القرآن يدي للتي هي أقوم	الواحدي :: عبد العزيز السلمان	ShamAY	35006	0.2663
		موارد الظمآن لدروس الزمان، خطب وحكم وأحكام وقواعد ومواعظ وآداب وأخلاق حسان	عبد العزيز بن محمد بن عبد المحسن السلمان (المتوفى: 1422هـ)	ShamAY	7480	0.2663
		منحة القريب المجيب في الرد على عباد الصليب	عبد العزيز بن حمد بن ناصر بن عثمان آل معمر (المتوفى: 1244هـ)	ShamAY	10895	0.26629
		 القلائد الجوهرية في تاريخ الصالحية 	 محمد بن طولون الصالحي 	ABLibrary	9159	0.26629
		تفسير التّحرير والتّنوير [ج ٢٦]	الشيخ محمّد الطاهر ابن عاشور	Rafed	2935	0.26629
		بحار الأنوار [ج ٧٤]	الشيخ محمّد باقر بن محمّد تقي المجلسي	Rafed	1095	0.26629
		غيبه المنتظر من منتخب الاثر	آيت الله العظمي لطف اللّه صافي گلپايگاني	Ghbook	11966	0.26628
		اتحاف السادة المتقين بشرح إحياء علوم الدين	محمد بن محمد بن الحسيني الزبيدي الشهير بمرتضى	ShamAY	35035	0.26627
		مدارك الأحكام في شرح شرائع الإسلام - الجزء1	محمد بن علي الموسوي العاملي	Masaha	1185	0.26627
		الدرر الحسان في أحكام الحج على مذهب الإمام أبي حنيفة النعمان	أحمد الحجي الكردي	ShamAY	36720	0.26625
		صفحات مشرقة من حياة السلف، سفيان بن سعيد الثوري	أبو ياسر محمد بن مطر بن عثمان آل مطر الزهراني (المتوفى: 1427هـ)	ShamAY	31643	0.26623
		تفسير الخازن المسمى لباب التأويل في معاني التنزيل (موافق للمطبوع)	علاء الدين علي بن محمد بن إبراهيم البغدادي الشهير بالخازن	ShamAY	34067	0.26623
		القيامة الصغرى	عمر بن سليمان بن عبد الله الأشقر العتيبي	ShamAY	9834	0.26623
		 منتخب الأثر في أحوال الإمام الثاني عشر ( عج ) 	 الشيخ لطف الله الصافي الگلپايگاني 	ABLibrary	7790	0.26623
		بحار الأنوار [ج ٨٩]	الشيخ محمّد باقر بن محمّد تقي المجلسي	Rafed	1164	0.26623
		الامامه عهد الهي،بحوث قرآنيه في الامامه	علي جبوري	Ghbook	11930	0.26623
		فاكهة الخلفاء ومفاكهة الظرفاء	أبو محمد أحمد بن محمد، المعروف بابن عربشاه (المتوفى: 854هـ)	ShamAY	12726	0.26621
		المحجة البيضاء في حماية السنة الغراء من زلات أهل الأخطاء وزيغ أهل الأهواء	ربيع بن هادي المدخلي	ShamAY	33006	0.26621
		اختيار معرفه الرجال	محمد بن حسن شيخ طوسي ( شيخ الطائفه )	Ghbook	7172	0.26621
		الجهاد لابن المبارك	أبو عبد الرحمن عبد الله بن المبارك بن واضح الحنظلي، التركي ثم المرْوزي (المتوفى: 181هـ)	ShamAY	3610	0.2662
		شرح جامع الترمذي - الراجحي	عبد العزيز بن عبد الله بن عبد الرحمن الراجحي	ShamelaY19	36976	0.2662
		رياض النفوس في طبقات علماء القيروان وإفريقية وزهادهم ونساكهم وسير من أخبارهم وفضائلهم وأوصافهم	أبو بكر عبد الله بن محمد المالكي	ShamelaY19	148883	0.2662
		منتقى من أخبار الأصمعي للربعي	عبد الله بن أحمد بن ربيعة بن زبر الربعي، أبو محمد (المتوفى: 329هـ)	ShamAY	26875	0.26618
		 حسن المحاضرة في أخبار مصر والقاهرة 	 جلال الدين السيوطي 	ABLibrary	9036	0.26618
		الخلاصة في بيان رأي شيخ الإسلام ابن تيمية بالرافضة	علي بن نايف الشحود	ShamAY	35264	0.26617
		رسالة الملائكة ت الجندي	أَبُو العَلاء المَعَرِّي	ShamAY	38986	0.26617
		العثمانية	عمرو بن بحر بن محبوب الكناني بالولاء، الليثي، أبو عثمان، الشهير بالجاحظ (المتوفى: 255هـ)	ShamAY	1785	0.26617
		 منازل السائرين ( شرح القاساني ) 	 عبد الله الأنصاري الهروي 	ABLibrary	8792	0.26617
		 أدب الطف أو شعراء الحسين ( ع ) 	 جواد شبر 	ABLibrary	7403	0.26617
		إحسان سلوك العبد المملوك إلى ملك الملوك	أبو محمد عبد الكريم بن صالح بن عبد الكريم الحميد	ShamelaY19	36176	0.26617
		الفائق في غريب الحديث	زمخشري ، محمود بن عمر	Ghbook	8513	0.26617
		الناسخ والمنسوخ	أبي عبيد القاسم بن سلام الهروي	Rafed	1306	0.26616
		فكر ومباحث	علي بن مصطفى الطنطاوي (المتوفى: 1420هـ)	ShamAY	32251	0.26615
		الرسائل الأحمديّة [ج ١]	الشيخ أحمد آل طعّان	Rafed	1330	0.26614
		نفحات الأزهار في خلاصة عبقات الأنوار [ج ١١]	السيّد علي الحسيني الميلاني	Rafed	453	0.26614
		تنبيه اللاهي على تحريم الملاهي	الأنصاري، إسماعيل	ShamAY	36241	0.26613
