automatic URI	Proposed URI	bookTitle	authorName	collection	id	tfidf
		تاريخ اليمن خلال القرن الحادي عشر الهجري- السابع عشر الميلادي/ تاريخ طبق الحلوى وصحاف المن والسلوى	عبد الله بن علي بن أحمد بن محمد الحسني، المعروف بالوزير (المتوفى: 1147هـ)	ShamAY	6640	0.25853
		الأمالي	الشيخ الطوسي	Masaha	698	0.25853
		منهاج السنة النبوية في نقض كلام الشيعة القدرية	تقي الدين أبو العباس أحمد بن عبد الحليم بن عبد السلام بن عبد الله بن أبي القاسم بن محمد ابن تيمية الحراني الحنبلي الدمشقي (المتوفى: 728هـ)	ShamAY	927	0.25852
		تحقيق المطالب بشرح دليل الطالب	أبو المنذر محمود بن محمد بن مصطفى بن عبد اللطيف المنياوي	ShamAY	1101	0.25852
		تأويلات أهل السنّة تفسير الماتريدي [ج ٧]	أبي منصور محمّد بن محمّد بن محمود الماتريدي	Rafed	3973	0.25852
		منتهى السؤل على وسائل الوصول إلى شمائل الرسول صلى الله عليه وآله وسلم	عبد الله بن سعيد بن محمد عبادي اللحجي الحضرمي الشحاري، ثم المراوعي، ثم المكي (المتوفى: 1410ه)	ShamelaY19	23683	0.25852
		موسوعة الطير والحيوان في الحديث النبوي	عبد اللطيف عاشور	ShamelaY19	23686	0.25852
		وأنذرهم يوم الحسرة أَهوالُ الموتِ والقِيامَةِ	محمد أحمد عبد الغني	ShamAY	34976	0.25848
		 رسائل ومقالات 	 الشيخ السبحاني 	ABLibrary	8438	0.25848
		المنتخب من كتب شيخ الإسلام	علوي السقاف	ShamelaY19	22890	0.25847
		محمد و ابراهيم ابنا مسلم بن عقيل عليهم السلام	سيد علي جمال أشرف	Ghbook	16513	0.25847
		الفتح الرباني من فتاوى الإمام الشوكاني	محمد بن علي بن محمد بن عبد الله الشوكاني اليمني (المتوفى: 1250هـ)	ShamAY	344	0.25846
		المحتضرين لابن أبي الدنيا	أبو بكر عبد الله بن محمد بن عبيد بن سفيان بن قيس البغدادي الأموي القرشي المعروف بابن أبي الدنيا (المتوفى: 281هـ)	ShamAY	13058	0.25846
		غاية المرام في شرح شرائع الإسلام - الجزء1	المفلح بن حسن الصيمري	Masaha	1116	0.25846
		التَّحبير لإيضَاح مَعَاني التَّيسير	محمد بن إسماعيل بن صلاح بن محمد الحسني، الكحلاني ثم الصنعاني، أبو إبراهيم، عز الدين، المعروف كأسلافه بالأمير (المتوفى: 1182هـ)	ShamAY	32163	0.25845
		الفرق بين الرقية الشرعية والرقية التجارية ووجوب تعظيم واحترام ذكر الله تعالى	عبد الكريم بن صالح الحميد	ShamAY	34899	0.25844
		أحاديث ومرويات في الميزان 1 - حديث قلب القرآن يس	محمد عمرو بن عبد اللطيف بن محمد بن عبد القادر بن رضوان بن سليمان بن مفتاح بن شاهين الشنقيطي (المتوفى: 1429هـ)	ShamAY	12578	0.25844
		الزواجر عن اقتراف الكبائر	أحمد بن محمد بن علي بن حجر الهيتمي السعدي الأنصاري، شهاب الدين شيخ الإسلام، أبو العباس (المتوفى: 974هـ)	ShamAY	21629	0.25844
		تفسير القاسمي [ج ٦]	محمّد جمال الدين القاسمي	Rafed	3917	0.25844
		الأحكام الشرعية لشهداء الثورات العربية	علي بن نايف الشحود	ShamAY	1576	0.25843
		 نخب الذخائر في أحوال الجواهر 	 محمد بن ابراهيم الأنصاري ( ابن الأكفاني ) 	ABLibrary	9939	0.25843
		تفسير المراغي [ج ٢٢]	أحمد مصطفى المراغي	Rafed	1694	0.25843
		مرزبان نامه	اسبهبد مرزبان بن شروين بن رستم بن شهريار (المتوفى: ق 4 هـ)	ShamAY	8305	0.25842
		 معرفة الإمام 	 السيد محمد حسين الطهراني 	ABLibrary	8892	0.25842
		معالم الدين وملاذ المجتهدين [ج ١]	الشيخ حسن بن زين الدين العاملي	Rafed	1352	0.25842
		تفسير المراغي [ج ٢٧]	أحمد مصطفى المراغي	Rafed	1704	0.25842
		محرمات العلاقة الزوجية في القرآن الكريم	فهد الحبيشي	ShamAY	36360	0.25841
		 مع الركب الحسيني 	 مجموعة مؤلفين 	ABLibrary	7743	0.25841
		تفسير نور الثقلين [ج ٥]	الشيخ عبد علي بن جمعة العروسي الحويزي	Rafed	2885	0.25841
		بين يدي الرسول الاعظم صلي الله عليه و آله	محمد بحرالعلوم	Ghbook	5287	0.25841
		تفسير المراغي [ج ٢٩]	أحمد مصطفى المراغي	Rafed	1706	0.25839
		مسائل العقيدة في كتاب التوحيد من صحيح الإمام البخاري «عرض ودراسة»	يوسف الحوشان	ShamelaY19	142136	0.25839
		الآيات البينات في عدم سماع الأموات على مذهب الحنفية السادات	نعمان بن محمود الألوسي (المتوفى: 1317هـ)	ShamAY	247	0.25838
		 عنقا مغرب في ختم الأولياء وشمس المغرب 	 ابن عربي 	ABLibrary	8734	0.25838
		الرد على الجهمية للدارمي	أبو سعيد عثمان بن سعيد بن خالد بن سعيد الدارمي السجستاني (المتوفى: 280هـ)	ShamAY	13023	0.25837
		منهاج السنة النبوية في نقض كلام الشيعة القدرية	تقي الدين أبو العباس أحمد بن عبد الحليم بن عبد السلام بن عبد الله بن أبي القاسم بن محمد ابن تيمية الحراني الحنبلي الدمشقي (المتوفى: 728ه)	Sham19Y	927	0.25837
		 حياة الإمام الحسن بن علي ( ع ) 	 الشيخ باقر شريف القرشي 	ABLibrary	7490	0.25837
		وانقضت أوهام العمر	السيّد جمال محمّد صالح	Rafed	1221	0.25837
		فضائل اهل البيت عليهم السلام بين تحريف المدونين وتناقض مناهج المحدثين	وسام البلداوي	Ghbook	12286	0.25837
		تيسير التفسير للقطان	إبراهيم القطان (المتوفى: 1404هـ)	ShamAY	29	0.25836
		 نظرة في كتاب منهاج السنة النبوية ( من فيض الغدير ) 	 الشيخ الأميني 	ABLibrary	8666	0.25836
		البرهان المنير في دحض شبهات أهل التكفير والتفجير	عبد العزيز بن ريس الريس	ShamAY	36229	0.25835
		الصواعق الشديدة على اتباع الهيئة الجديدة	حمود بن عبد الله بن حمود بن عبد الرحمن التويجري (المتوفى: 1413هـ)	ShamAY	32259	0.25835
		ظاهرة الإرجاء في الفكر الإسلامي	سفر الحوالي	Sham19Y	23586	0.25835
		الغصون اليانعة في محاسن شعراء المائة السابعة	أبو الحسن على بن موسى بن سعيد المغربي الأندلسي (المتوفى: 685هـ)	ShamAY	9235	0.25834
		المعارف	أبو محمد عبد الله بن مسلم بن قتيبة الدينوري (المتوفى: 276هـ)	ShamAY	12129	0.25834
		مناقب الإمام أمير المؤمنين علي بن أبي طالب(ع) للكوفي‏ - الجزء1	محمد بن سليمان الكوفي‏	Masaha	3296	0.25834
		مختصر البصائر	حسن بن سليمان بن محمد الحلي‏	Masaha	2479	0.25833
		منهج الرشاد لمن اراد السداد ( نص الرساله الجوابيه التي بعث بها الشيخ جعفر كاشف ا...	شيخ جعفر نجفي كاشف الغطاء	Ghbook	5304	0.25832
		العبقات العنبرية	الشيخ محمد حسين كاشف الغطاء	Masaha	4085	0.25831
		العبدي الكوفي وشعره في الغدير	الشيخ عبد الحسين الأميني النجفي	Masaha	336	0.25831
		نواسخ القرآن = ناسخ القرآن ومنسوخه ت آل زهوي	جمال الدين أبو الفرج عبد الرحمن بن علي بن محمد الجوزي (المتوفى: 597ه)	ShamelaY19	38121	0.25831
		تهذيب الكمال في أسماء الرجال	يوسف بن عبد الرحمن بن يوسف، أبو الحجاج، جمال الدين ابن الزكي أبي محمد القضاعي الكلبي المزي (المتوفى: 742هـ)	ShamAY	3722	0.2583
		الإعلام بوجوب التثبت في رواية الحديث وحكم العمل بالحديث الضعيف	سليمان العلوان	ShamAY	37320	0.2583
		شرح كتاب الحج من صحيح مسلم - عبد الكريم الخضير	عبد الكريم الخضير	Sham19Y	23422	0.2583
		الإيمان لابن تيمية	تقي الدين أبو العباس أحمد بن عبد الحليم بن عبد السلام بن عبد الله بن أبي القاسم بن محمد ابن تيمية الحراني الحنبلي الدمشقي (المتوفى: 728هـ)	ShamAY	7564	0.25829
		تفسير الموطأ للقنازعي	عبد الرحمن بن مروان بن عبد الرحمن الأنصاري، أبو المطرف القَنَازِعي (المتوفى: 413 هـ)	ShamAY	32439	0.25829
		تقريب المعارف	أبي الصّلاح تقيّ بن نجم الحلبي	Rafed	699	0.25828
		رسائل في اللغة (رسائل ابن السيد البطليوسي)	أبو محمد عبد الله بن السيد البطليوسي (444 - 521 هـ)	ShamAY	38985	0.25827
		الزواجر عن اقتراف الكبائر - العصرية	الواحدي :: ابن حجر الهيتمي	ShamAY	33753	0.25827
		 بحوث في الملل والنحل 	 الشيخ السبحاني 	ABLibrary	8362	0.25826
		شذرات من كتب مفقودة في التاريخ	استخرجها وحققها الدكتور إحسان عباس (المتوفى: 1424هـ)	ShamAY	1023	0.25825
		الانتصار لأهل السنة والحديث في رد أباطيل حسن المالكي	عبد المحسن بن حمد بن عبد المحسن بن عبد الله بن حمد العباد البدر	ShamAY	7553	0.25825
		 عدة الأكياس في شرح معاني الأساس 	 أحمد الشرفي القاسمي 	ABLibrary	8511	0.25825
		ديوان الشيخ محسن أبو الحبّ ( الكبير )	الشيخ محسن أبو الحبّ	Rafed	1633	0.25824
		الجامع لسيرة شيخ الإسلام ابن تيمية خلال سبعة قرون	محمد عزيز بن شمس وعلي بن محمد العمران	ShamAY	32317	0.25823
		الإعتماد في شرح واجب الإعتقاد	جمال الدين مقداد بن عبد الله السيوري الحلّي	Rafed	3396	0.25823
		الفصول المهمه في معرفه الائمه	ابن صباغ علي بن محمد	Ghbook	11686	0.25822
		رسالة قاطعة اللجاج في تحقيق حل الخراج	علي بن الحسين‏ المحقق الكركي	Masaha	1165	0.25821
		الإفصاح في إمامة أمير المؤمنين عليه السلام	محمّد بن محمّد النعمان العكبري [ الشيخ المفيد ]	Rafed	1568	0.2582
		موسوعة الأخلاق الإسلامية - الدرر السنية	مجموعة من المؤلفين	ShamAY	1521	0.25819
		شرح التائية في القدر	محمد بن إبراهيم بن أحمد الحمد	ShamAY	35706	0.25818
		رسائل الثعالبي	عبد الملك بن محمد بن إسماعيل أبو منصور الثعالبي (المتوفى: 429هـ)	ShamAY	623	0.25818
		الإفصاح في الإمامة	محمّد بن محمّد النعمان العكبري [ الشيخ المفيد ]	Rafed	3676	0.25818
		المنتقى شرح الموطإ	أبو الوليد سليمان بن خلف بن سعد بن أيوب بن وارث التجيبي القرطبي الباجي الأندلسي (المتوفى: 474هـ)	ShamAY	6684	0.25817
		 حياة الإمام الحسين ( ع ) 	 الشيخ باقر شريف القرشي 	ABLibrary	7495	0.25817
		التفسير الواضح [ج ٢]	دكتور محمّد محمود حجازي	Rafed	3988	0.25817
		موسوعة علوم القرآن	عبد القادر محمد منصور	ShamelaY19	38103	0.25817
		شرح كتاب الحج من صحيح مسلم - عبد الكريم الخضير	عبد الكريم الخضير	ShamAY	66	0.25816
		تفسير النيسابوري = غرائب القرآن ورغائب الفرقان	نظام الدين الحسن بن محمد بن حسين القمي النيسابوري (المتوفى: 850هـ)	ShamAY	23613	0.25816
		 العوالم ، الإمام الجواد ( ع ) 	 الشيخ عبد الله البحراني 	ABLibrary	7621	0.25816
		مختصر بصائر الدّرجات	الشيخ عزّ الدين الحسن بن سليمان الحلي	Rafed	1815	0.25813
		التذكرة الحمدونية	محمد بن الحسن بن محمد بن علي بن حمدون، أبو المعالي، بهاء الدين البغدادي (المتوفى: 562هـ)	ShamAY	10646	0.25812
		المدخل إلى مذهب الإمام أحمد بن حنبل - العلمية	عبد القادر بن أحمد بن مصطفى بن عبد الرحيم بن محمد بدران (المتوفى: 1346هـ)	ShamAY	34195	0.25812
		 أدوار الفقه الإمامي 	 الشيخ السبحاني 	ABLibrary	9774	0.25812
		تفسير بيان السعادة في مقامات العبادة [ج ٢]	سلطان محمّد الجنابذي [ سلطان علي شاه ]	Rafed	3364	0.25812
		السياسة الشرعية في إصلاح الراعي والرعية	تقي الدين أبو العباس أحمد بن عبد الحليم بن عبد السلام بن عبد الله بن أبي القاسم بن محمد ابن تيمية الحراني الحنبلي الدمشقي (المتوفى: 728ه)	ShamelaY19	31237	0.2581
		الروض النضر في ترجمة أدباء العصر	عثمان بن علي بن مراد العمري	ShamAY	35857	0.25809
		ذوب النضار في شرح الثار	ابن نما الحلي‏	Masaha	2197	0.25809
		النهاية في غريب الحديث والأثر	مجد الدين أبو السعادات المبارك بن محمد بن محمد بن محمد ابن عبد الكريم الشيباني الجزري ابن الأثير (المتوفى: 606هـ)	ShamAY	23691	0.25808
		التفسير الوسيط للقرآن الكريم [ج ٦]	الدكتور محمد سيد طنطاوي	Rafed	3944	0.25808
		معالم عصر الخلفاء الراشدين	علي بن نايف الشحود	ShamAY	35795	0.25807
		دعوة أهل البدع	خالد بن أحمد الزهراني	ShamAY	33317	0.25806
		مجموعة الرسائل والمسائل - ط وهبة	تقي الدين أبو العباس أحمد بن عبد الحليم بن تيمية الحراني (المتوفى : 728هـ)	ShamAY	34371	0.25805
		الحسنة والسيئة - ت غازي	الواحدي :: ابن تيمية	ShamAY	34359	0.25805
		الكفاية في معرفة أصول علم الرواية للخطيب البغدادي - ت: ماهر الفحل	أبو بكر أحمد بن علي بن ثابت الخطيب البغدادي	ShamAY	33976	0.25803
		الدين الخالص أو إرشاد الخلق إلى دين الحق (والمجلد التاسع طبع باسم: إرشاد الناسك إلى أعمال المناسك)	محمود محمد خطاب السبكي	Sham19Y	20907	0.25803
		 موسوعة مرآة الحرمين الشريفين وجزيرة العرب 	 أيوب صبري باشا 	ABLibrary	9291	0.25802
		الفوائد الطوسية	الحر العاملي	Masaha	1263	0.25801
		ديوان لبيد بن ربيعة العامري	لبيد بن ربيعة بن مالك، أبو عقيل العامري الشاعر معدود من الصحابة (المتوفى: 41ه)	ShamelaY19	35077	0.25801
		التنبيه والرد على أهل الأهواء والبدع	محمد بن أحمد بن عبد الرحمن، أبو الحسين المَلَطي العسقلاني (المتوفى: 377هـ)	ShamAY	6537	0.258
		انيس الفقهاء في تعريفات الألفاظ المتداولة بين الفقهاء	قاسم بن عبد الله بن أمير علي القونوي الرومي الحنفي (المتوفى: 978ه)	Sham19Y	10930	0.25799
		تفسير غريب القرآن - الكواري	كاملة بنت محمد بن جاسم بن علي آل جهام الكواري	ShamAY	1055	0.25798
		شرح مقدمة التفسير لابن تيمية - العثيمين	محمد بن صالح بن محمد العثيمين (المتوفى: 1421هـ)	ShamAY	21521	0.25798
		التقييد الكبير في تفسير كتاب الله المجيد	أبو العباس أحمد بن محمد بن أحمد البسيلي التونسي (المتوفى: 380هـ)	ShamAY	1547	0.25798
		مرآة العقول في شرح أخبار آل الرسول - الجزء1	العلامة المجلسي	Masaha	1364	0.25798
		الامام محمد جواد عليه السلام شبيه عيسي و يحيي و سليمان عليهم السلام	علي كوراني	Ghbook	15139	0.25797
		النظرات	مصطفى لطفي بن محمد لطفي بن محمد حسن لطفي المَنْفَلُوطي (المتوفى: 1343هـ)	ShamAY	11400	0.25796
		الفواكه العذاب في الرد على من لم يحكم السنة والكتاب	حمد بن ناصر بن عثمان بن معمر النجدي التميمي الحنبلي (المتوفى: 1225ه)	Sham19Y	1	0.25796
		سلسلة الآداب - المنجد	محمد صالح المنجد	ShamelaY19	35111	0.25796
		وقعة الطّف	لوط بن يحيى الأزدي الغامدي الكوفي [ أبي مخنف ]	Rafed	1605	0.25795
		السقيفة و فدك	باسم مجيد الساعدي	Ghbook	12337	0.25795
		عبد الله بن الصديق الغماري الحافظ الناقد	د. فاروق حمادة	ShamAY	38600	0.25794
		الغرر السافر فيما يحتاج إليه المسافر	أبو عبد الله بدر الدين الزركشي	ShamAY	36508	0.25794
		التوحيد لابن خزيمة - ت: الزهيري	أبو بكر محمد بن إسحاق بن خزيمة	ShamAY	33974	0.25793
		التقييد الكبير في تفسير كتاب الله المجيد	أبو العباس أحمد بن محمد بن أحمد البسيلي التونسي (المتوفى: 380ه)	Sham19Y	95565	0.25793
		التقييد الكبير في تفسير كتاب الله المجيد	أبو العباس أحمد بن محمد بن أحمد البسيلي التونسي (المتوفى: 380ه)	ShamelaY19	95565	0.25793
		من هدى القرآن [ج ٩]	السيّد محمّد تقي المدرّسي	Rafed	2129	0.25792
		جامع الأحاديث القدسية- قسم الضعيف والموضوع	الشيخ أبو عبدالرحمن عصام الدين الصبابطي	ShamAY	33067	0.25791
		عوالم العلوم والمعارف والاحوال (الجزء 26) في احوال امام زمان عجل الله تعالي فرجه...	محمد باقر بن مرتضي موحد ابطحي اصفهاني	Ghbook	15276	0.25791
		إعجاز القرآن للباقلاني	أبو بكر الباقلاني محمد بن الطيب (المتوفى: 403هـ)	ShamAY	953	0.2579
		التذكرة الحمدونية	محمد بن الحسن بن محمد بن علي بن حمدون، أبو المعالي، بهاء الدين البغدادي (المتوفى: 562ه)	Sham19Y	10646	0.25789
		شرح مشكل الوسيط	عثمان بن عبد الرحمن، أبو عمرو، تقي الدين المعروف بابن الصلاح (المتوفى: 643ه)	ShamelaY19	21525	0.25789
		مشرق الشمسين و اكسير السعادتين	بهاءالدين محمد بن حسين شيخ بهائي	Ghbook	9971	0.25788
		اشارة السبق الى معرفة الحق - الجزء1	الشيخ أبي الحسن الحلبي	Masaha	616	0.25787
		الروضتين في أخبار الدولتين النورية والصلاحية	أبو القاسم شهاب الدين عبد الرحمن بن إسماعيل بن إبراهيم المقدسي الدمشقي المعروف بأبي شامة (المتوفى: 665 هـ)	ShamAY	32323	0.25785
		الروضة في فضائل أمير المؤمنين علي بن أبي طالب (عليهما السلام)	شاذان بن جبرئيل القمي‏	Masaha	2035	0.25785
		نهج البيان عن كشف معاني القرآن [ج ١]	محمّد بن الحسن الشيباني	Rafed	1628	0.25785
		مغني المحتاج إلى معرفة معاني ألفاظ المنهاج	شمس الدين، محمد بن أحمد الخطيب الشربيني الشافعي (المتوفى: 977هـ)	ShamAY	11444	0.25784
		100 فائدة من سورة يوسف	محمد صالح المنجد	ShamAY	33128	0.25784
		 تاريخ افريقية والمغرب 	 الرقيق القيرواني 	ABLibrary	8983	0.25784
		قطر الولي على حديث الولي = ولاية الله والطريق إليها	محمد بن علي بن محمد بن عبد الله الشوكاني اليمني (المتوفى: 1250هـ)	ShamAY	6886	0.25782
		ففروا إلى الله - القلموني	أبو ذر القلموني، عبد المنعم بن حسين بن حنفي بن حسن بن الشاهد	ShamAY	912	0.25782
		كيف تصلي وتخشع	الشيخ ندا أبو أحمد	ShamAY	34927	0.25782
		مقاتل الطالبيين	علي بن الحسين بن محمد بن أحمد بن الهيثم المرواني الأموي القرشي، أبو الفرج الأصبهاني (المتوفى: 356هـ)	ShamAY	12404	0.25782
		أهل البيت في مصر	عدة من الباحثين و المفكرين المصريين	Masaha	1943	0.25782
		الميزان في تفسير القرآن - الجزء1	السيد محمد حسين الطباطبائي	Masaha	51	0.25781
		صحيح القصص النبوي (من 1 - 50)	أبو إسحاق الحويني الأثري حجازي محمد شريف	ShamelaY19	96237	0.25781
		الاربعون حديثا في اثبات امامه اميرالمومنين عليه السلام 	عبدالله بحراني اصفهاني	Ghbook	15555	0.25781
		الرد على الشاذلي في حزبيه، وما صنفه في آداب الطريق	تقي الدين أبو العباس أحمد بن عبد الحليم بن عبد السلام بن عبد الله بن أبي القاسم بن محمد ابن تيمية الحراني الحنبلي الدمشقي (المتوفى: 728هـ)	ShamAY	1463	0.25779
		فاجعة الطف	السيد محمد سعيد الطباطبائي الحكيم	Masaha	607	0.25779
		بحار الأنوار [ج ١٦]	الشيخ محمّد باقر بن محمّد تقي المجلسي	Rafed	857	0.25779
		حاشية البجيرمي على الخطيب = تحفة الحبيب على شرح الخطيب	سليمان بن محمد بن عمر البجيرمي المصري الشافعي (المتوفى: 1221ه)	Sham19Y	21599	0.25778
		 إعلام النبلاء بتاريخ حلب الشهباء 	 محمد راغب الطباخ الحلبي 	ABLibrary	8958	0.25778
		المهذّب [ج ١]	عبد العزيز بن البرّاج الطرابلسي	Rafed	1276	0.25778
		التفسير الموضوعي 1 - جامعة المدينة	مناهج جامعة المدينة العالمية	ShamAY	1657	0.25777
		منهج الأنبياء في الدعوة إلى الله فيه الحكمة والعقل	ربيع بن هادي المدخلي	ShamAY	33033	0.25777
		منهج الإمام البخاري	أبو بكر كافي	Sham19Y	16232	0.25777
		ثلاث صلوات عظيمة مهجورة فأحيها يا عبد الله	عدنان بن محمد آل عرعور	ShamelaY19	147912	0.25777
		ظاهرة الإرجاء في الفكر الإسلامي	سفر الحوالي	ShamelaY19	23586	0.25776
		تاريخ مدينة دمشق [ج ٧٧]	أبي القاسم علي بن الحسن ابن هبة الله بن عبد الله الشافعي [ ابن عساكر ]	Rafed	2664	0.25775
		الإيضاح في مناسك الحج والعمرة	أبو زكريا محيي الدين يحيى بن شرف النووي (المتوفى: 676ه)	ShamelaY19	96232	0.25775
		العرش وما روي فيه - محققا	أبو جعفر محمد بن عثمان بن أبي شيبة العبسي (المتوفى : 297هـ)	ShamAY	12444	0.25773
		كشف المنن في علامات الساعة والملاحم والفتن	محمود رجب حمادي الوليد	ShamAY	32447	0.25773
		الدرر النجفيه من الملتقطات اليوسفيه	يوسف بن احمد بن ابراهيم بحراني آل عصفور	Ghbook	12119	0.25772
		قطر الولي على حديث الولي = ولاية الله والطريق إليها	محمد بن علي بن محمد بن عبد الله الشوكاني اليمني (المتوفى: 1250ه)	Sham19Y	6886	0.25771
		دفع الشبه عن الرسول (ص) و الرساله	ابوبكر بن محمد حصني	Ghbook	5310	0.25771
