automatic URI	Proposed URI	bookTitle	authorName	collection	id	tfidf
		البلغة في الفرق بين المذكر والمؤنث	عبد الرحمن بن محمد بن عبيد الله الأنصاري، أبو البركات، كمال الدين الأنباري (المتوفى: 577هـ)	ShamAY	7002	0.99936
		المذكر والمؤنث	سعيد بن إبراهيم التستري، البغدادي، النصراني، أبو الحسين الكاتب (المتوفى: 361هـ)	ShamAY	99	0.61396
		المذكر والمؤنث	أبو بكر، محمد بن القاسم بن محمد بن بشار بن الحسن بن بيان بن سماعة بن فَروة بن قَطَن بن دعامة الأنباري (المتوفى: 328 هـ)	ShamAY	32543	0.45081
		المخصّص [ج ١٧]	أبي الحسن علي بن إسماعيل بن سيده المرسي [ ابن سيده ]	Rafed	3565	0.39717
		المخصّص [ج ١٦]	أبي الحسن علي بن إسماعيل بن سيده المرسي [ ابن سيده ]	Rafed	3564	0.27659
		شرح جمل الزجاجي	ابن عُصْفُور	ShamAY	37074	0.27243
		كتاب العدد في اللغة	أبو الحسن علي بن إسماعيل بن سيده المرسي (المتوفى: 458هـ)	ShamAY	6983	0.26716
		معجم القواعد العربيّة	عبد الغني الدقر	Rafed	2710	0.26468
		المخصّص [ج ١٤]	أبي الحسن علي بن إسماعيل بن سيده المرسي [ ابن سيده ]	Rafed	3562	0.25942
		مجالس ثعلب	أحمد بن يحيى بن زيد بن سيار الشيباني بالولاء، أبو العباس، المعروف بثعلب (المتوفى: 291هـ)	ShamAY	605	0.25824
		معجم القواعد العربية	عبد الغني بن علي الدقر (المتوفى: 1423هـ)	ShamAY	12933	0.25806
		تفسير القاسمي [ج ٥]	محمّد جمال الدين القاسمي	Rafed	3914	0.25599
		إيضاح شواهد الإيضاح	أبو علي الحسن بن عبد الله القيسي (المتوفى: ق 6هـ)	ShamAY	9250	0.25396
		درة الغواص في أوهام الخواص	القاسم بن علي بن محمد بن عثمان، أبو محمد الحريري البصري (المتوفى: 516هـ)	ShamAY	6920	0.25384
		الحلل في شرح أبيات الجمل	أبو محمد عبد الله بن محمد بن السيد البطليوسي (المتوفى: 521هـ)	ShamAY	634	0.25377
		اللباب في علوم الكتاب	أبو حفص سراج الدين عمر بن علي بن عادل الحنبلي الدمشقي النعماني (المتوفى: 775هـ)	ShamAY	9108	0.25257
		الاقتضاب في غريب الموطأ وإعرابه على الأبواب	محمد بن عبد الحق اليفرني (625 هـ)	ShamAY	32513	0.25208
		سمط اللآلي في شرح أمالي القالي [هو كتاب شرح أمالي القالي / لأبي عبيد البكري؛ نسخه وصححه وحقق ما فيه وخرجه وأضاف إليه عبد العزيز الميمني]	أبو عبيد عبد الله بن عبد العزيز بن محمد البكري الأندلسي (المتوفى: 487هـ)	ShamAY	1586	0.25148
		روح المعاني [ج ١]	أبي الفضل شهاب الدين السيّد محمود الألوسي البغدادي	Rafed	3178	0.25144
		شرح شافية ابن الحاجب [ج ٤]	الشيخ رضي الدين محمّد بن الحسن الاستراباذي النحوي	Rafed	1854	0.25124
		الكشّاف [ج ١]	محمود بن عمر الزمخشري	Rafed	3095	0.25084
		المحرّر الوجيز في تفسير الكتاب العزيز [ج ١]	أبي محمّد عبدالحقّ بن غالب بن عطيّة الأندلسي	Rafed	3293	0.25072
		شرح كتاب سيبويه [ج ٤]	أبي سعيد السّيرافي الحسن بن عبدالله بن المرزبان	Rafed	2846	0.25043
		البحر المحيط في التفسير [ج ١]	محمّد بن يوسف [ أبي حيّان الأندلسي الغرناطي ]	Rafed	2415	0.25041
		النكت في القرآن الكريم (في معاني القرآن الكريم وإعرابه)	علي بن فضال بن علي بن غالب المجاشعي القيرواني، أبو الحسن (المتوفى: 479ه)	Sham19Y	9066	0.25041
		تفسير القاسمي [ج ١]	محمّد جمال الدين القاسمي	Rafed	3902	0.25034
		إعراب القرآن للأصبهاني	إسماعيل بن محمد بن الفضل بن علي القرشي الطليحي التيمي الأصبهاني، أبو القاسم، الملقب بقوام السنة (المتوفى: 535هـ)	ShamAY	581	0.25013
		النكت في القرآن الكريم (في معاني القرآن الكريم وإعرابه)	علي بن فَضَّال بن علي بن غالب المُجَاشِعِي القيرواني، أبو الحسن (المتوفى: 479هـ)	ShamAY	9066	0.25003