automatic URI	Proposed URI	bookTitle	authorName	collection	id	tfidf
		الإبطال لنظرية الخلط بين دين الإسلام وغيره من الأديان	بكر بن عبد الله أبو زيد بن محمد بن عبد الله بن بكر بن عثمان بن يحيى بن غيهب بن محمد (المتوفى: 1429هـ)	ShamAY	10487	0.38558
		الإبطال لنظرية الخلط بين دين الإسلام وغيره من الأديان	بكر بن عبد الله أبو زيد بن محمد بن عبد الله بن بكر بن عثمان بن يحيى بن غيهب بن محمد (المتوفى: 1429ه)	Sham19Y	10487	0.37885
		كمال الدين الإسلامي وحقيقته ومزاياه	عبد الله بن جار الله بن إبراهيم آل جار الله	ShamelaY19	31573	0.36024
		كمال الدين الإسلامي وحقيقته ومزاياه	عبد الله بن جار الله بن إبراهيم آل جار الله	ShamAY	31573	0.35822
		كمال الدين الإسلامي وحقيقته ومزاياه	عبد الله بن جار الله بن إبراهيم آل جار الله	Sham19Y	31573	0.35653
		الإسلام أصوله ومبادئه	محمد بن عبد الله بن صالح السحيم	ShamAY	12624	0.35583
		تقارب الاديان		ShamAY	35521	0.35528
		تفسير التّحرير والتّنوير [ج ١٧]	الشيخ محمّد الطاهر ابن عاشور	Rafed	2924	0.35314
		مسائل لخصها الشيخ محمد بن عبد الوهاب من كلام بن تيمية (مطبوع ضمن مؤلفات الشيخ محمد بن عبد الوهاب، الجزء الثاني عشر)	محمد بن عبد الوهاب بن سليمان التميمي النجدي (المتوفى: 1206هـ)	ShamAY	11572	0.35158
		المنتخب من تفسير القرآن [ج ٢]	أبو عبدالله محمّد بن أحمد بن إدريس الحلّي	Rafed	3828	0.34921
		جامع الرسائل لابن تيمية - رشاد سالم	ابن تيمية	ShamelaY19	22653	0.34497
		تنوير العقول في الفرق بين النبي والرسول	محمد بن عبد الله الإمام	ShamAY	35736	0.34479
		النبوات لابن تيمية	تقي الدين أبو العباس أحمد بن عبد الحليم بن عبد السلام بن عبد الله بن أبي القاسم بن محمد ابن تيمية الحراني الحنبلي الدمشقي (المتوفى: 728هـ)	ShamAY	11817	0.34429
		جامع المسائل لابن تيمية ط عالم الفوائد - المجموعة الخامسة	شيخ الإسلام أحمد بن عبد الحليم بن عبد السلام ابن تيمية (661 - 728 هـ)	ShamAY	37986	0.34379
		فقه القرآن [ج ١]	قطب الدين سعيد بن هبة الله الراوندي [ قطب الدين الراوندي ]	Rafed	1287	0.34261
		تفسير التّحرير والتّنوير [ج ١٨]	الشيخ محمّد الطاهر ابن عاشور	Rafed	2925	0.34246
		تفسير التّحرير والتّنوير [ج ٣]	الشيخ محمّد الطاهر ابن عاشور	Rafed	2907	0.34235
		تفسير التّحرير والتّنوير [ج ١٣]	الشيخ محمّد الطاهر ابن عاشور	Rafed	2917	0.34189
		تفسير التّحرير والتّنوير [ج ٢٥]	الشيخ محمّد الطاهر ابن عاشور	Rafed	2934	0.34165
		وصية لقمان	عبد المجيد يوسف الشاذلي	ShamAY	35080	0.34068
		سهام الإسلام	عبد اللطيف بن علي بن أحمد بن محمد السلطاني القنطري الجزائري (المتوفى: 1404ه)	ShamelaY19	115131	0.34012
		 دراسات في منهاج السنة لمعرفة ابن تيمية ، مدخل لشرح منهاج الكرامة 	 السيد علي الحسيني الميلاني 	ABLibrary	918	0.33981
		مجموعة الرسائل والمسائل النجدية لبعض علماء نجد الأعلام (الجزء الثالث)	عبد اللطيف بن عبد الرحمن بن حسن بن محمد بن عبد الوهاب آل الشيخ (المتوفى: 1293هـ)	ShamAY	11379	0.33977
		جامع المسائل لابن تيمية ط عالم الفوائد - المجموعة التاسعة	شيخ الإسلام أحمد بن عبد الحليم بن عبد السلام ابن تيمية (661 - 728 ه)	ShamelaY19	145376	0.33897
		عون الحنان في شرح الأمثال في القرآن	على أحمد عبد العال الطهطاوى	ShamelaY19	38000	0.33874
		جامع الرسائل لابن تيمية - رشاد سالم	تقي الدين أبو العَباس أحمد بن عبد الحليم بن عبد السلام بن عبد الله بن أبي القاسم بن محمد ابن تيمية الحراني الحنبلي الدمشقي (المتوفى : 728هـ)	ShamAY	22653	0.33862
		وجوب تطبيق الشريعة الإسلامية في كل عصر	صالح بن غانم بن عبد الله بن سليمان بن علي السدلان	ShamAY	32446	0.33787
		عون الحنّان في شرح الأمثال في القرآن	الشيخ علي أحمد عبد العال الطهطاوي	Rafed	3960	0.33705
		عون الحنان في شرح الأمثال في القرآن	على أحمد عبد العال الطهطاوى	ShamAY	1480	0.337
		تفسير التّحرير والتّنوير [ج ٥]	الشيخ محمّد الطاهر ابن عاشور	Rafed	2909	0.33676
		البرهان فى تناسب سور القرآن	أحمد بن إبراهيم بن الزبير الثقفي الغرناطي، أبو جعفر (المتوفى: 708هـ)	ShamAY	1388	0.33671
		الدين العالمي ومنهج الدعوة إليه	عطية صقر	ShamelaY19	95667	0.33645
		تفسير المراغي	أحمد بن مصطفى المراغي (المتوفى: 1371ه)	ShamelaY19	23608	0.33635
		الوحي المحمدي	محمد رشيد بن علي رضا بن محمد شمس الدين بن محمد بهاء الدين بن منلا علي خليفة القلموني الحسيني (المتوفى: 1354هـ)	ShamAY	1202	0.33616
		سهام الإسلام	عبد اللطيف بن علي بن أحمد بن محمد السلطاني القنطري الجزائري (المتوفى: 1404هـ)	ShamAY	31654	0.33586
		منهج القرآن الكريم في دعوة المشركين إلى الإسلام	د. حمود بن أحمد بن فرج الرحيلي	ShamAY	7252	0.33578
		منحة القريب المجيب في الرد على عباد الصليب	عبد العزيز بن حمد بن ناصر بن عثمان آل معمر (المتوفى: 1244هـ)	ShamAY	10895	0.33576
		سهام الإسلام	عبد اللطيف بن علي بن أحمد بن محمد السلطاني القنطري الجزائري (المتوفى: 1404ه)	Sham19Y	115131	0.33537
		بيان المعاني [مرتب حسب ترتيب النزول]	عبد القادر بن ملا حويش السيد محمود آل غازي العاني (المتوفى: 1398ه)	ShamelaY19	23595	0.33521
		المنتخب من تفسير القرآن [ج ١]	أبو عبدالله محمّد بن أحمد بن إدريس الحلّي	Rafed	3827	0.33499
		فصل الخطاب في شرح مسائل الجاهلية (مطبوع مع رسالة قطف الثمر لصديق حسن خان)	أبو المعالي محمود شكري بن عبد الله بن محمد بن أبي الثناء الألوسي (المتوفى: 1342هـ)	ShamAY	9637	0.33479
		لمحات من حياة شيخ الإسلام ابن تيمية	الواحدي :: عبد الرحمن بن عبد الخالق	ShamAY	35828	0.3344
		 رسالة التوحيد 	 الشيخ محمد عبده 	ABLibrary	8430	0.33404
		تفسير التّحرير والتّنوير [ج ٢]	الشيخ محمّد الطاهر ابن عاشور	Rafed	2906	0.33403
		تفسير الشريف المرتضى [ج ٣]	الناشر: شركة الأعلمي للمطبوعات	Rafed	3798	0.33389
		دقائق التفسير الجامع لتفسير ابن تيمية	تقي الدين أبو العباس أحمد بن عبد الحليم بن عبد السلام بن عبد الله بن أبي القاسم بن محمد ابن تيمية الحراني الحنبلي الدمشقي (المتوفى: 728هـ)	ShamAY	5487	0.33379
		عون الحنان في شرح الأمثال في القرآن	على أحمد عبد العال الطهطاوى	Sham19Y	38000	0.33378
		كتاب الأزمنة والأمكنة	الشيخ أبي علي أحمد بن محمد بن الحسن المرزوقي الاصفهاني	Rafed	2404	0.3337
		شرح كتاب فضل الإسلام لمحمد بن عبد الوهاب - ناصر العقل	ناصر بن عبد الكريم العلي العقل	ShamAY	745	0.33318
		شرح كتاب فضل الإسلام لمحمد بن عبد الوهاب - ناصر العقل	ناصر بن عبد الكريم العلي العقل	ShamelaY19	37719	0.33303
		تكملة الجامع لسيرة شيخ الإسلام ابن تيمية خلال سبعة قرون - ط عالم الفوائد	علي بن محمد العمران	ShamAY	34400	0.33289
		بحوث في الملل والنّحل [ج ٤]	الشيخ جعفر السبحاني	Rafed	62	0.33273
		منهج القرآن الكريم في دعوة المشركين إلى الإسلام	د. حمود بن أحمد بن فرج الرحيلي	Sham19Y	7252	0.33261
		تَكْمِلَةُ الجَامِع لِسِيْرَةِ شَيْخِ الإِسْلَامِ ابْن تَيْمِيَّة خِلَال سَبْعَة قرُون	علي بن محمد بن حسين العِمران	ShamAY	38478	0.33222
		عصمة الأنبياء	محمّد بن عمر بن الحسن بن الحسين التيمي البكري [ فخر الدين الرازي ]	Rafed	1357	0.33217
		تفسير المراغي [ج ٨]	أحمد مصطفى المراغي	Rafed	1678	0.33198
		حاشية الدرة المضية في عقد الفرقة المرضية	عبد الرحمن بن محمد بن قاسم العاصمي الحنبلي النجدي (المتوفى: 1392هـ)	ShamAY	7369	0.33178
		الطريق إلى الإسلام	محمد بن إبراهيم بن أحمد الحمد	ShamAY	8382	0.33177
		 بحوث في الملل والنحل 	 الشيخ السبحاني 	ABLibrary	8358	0.33174
		جلاء العينين في محاكمة الأحمدين	نعمان بن محمود بن عبد الله، أبو البركات خير الدين، الآلوسي (المتوفى: 1317هـ)	ShamAY	9943	0.33159
		تفسير التّحرير والتّنوير [ج ٢٣]	الشيخ محمّد الطاهر ابن عاشور	Rafed	2932	0.33157
		الثبات والشمول في الشريعة الإسلامية	الدكتور عابد بن محمد السفياني	ShamAY	32602	0.33151
		تفسير القاسمي = محاسن التأويل	محمد جمال الدين بن محمد سعيد بن قاسم الحلاق القاسمي (المتوفى: 1332ه)	ShamelaY19	23631	0.33132
		الميزان في تفسير القرآن [ج ١٨]	آية الله السيد محمد حسين الطباطبائي	Rafed	1451	0.33131
		المنهج القويم في اختصار «اقتضاء الصراط المستقيم لشيخ الإسلام ابن تيمية»	محمد بن علي بن أحمد بن عمر بن يعلى، أبو عبد الله، بدر الدين البعليّ (المتوفى: 778هـ)	ShamAY	9859	0.3311
		موسوعة محاسن الإسلام ورد شبهات اللئام	أحمد بن سليمان أيوب، ونخبة من الباحثين	ShamelaY19	146418	0.33106
		تفسير المراغي [ج ٦]	أحمد مصطفى المراغي	Rafed	1666	0.3308
		دقائق التفسير الجامع لتفسير ابن تيمية	تقي الدين أبو العباس أحمد بن عبد الحليم بن عبد السلام بن عبد الله بن أبي القاسم بن محمد ابن تيمية الحراني الحنبلي الدمشقي (المتوفى: 728ه)	Sham19Y	5487	0.33074
		تفسير غرائب القرآن ورغائب الفرقان [ج ٥]	نظام الدين الحسن بن محمّد بن حسين القمي النيسابوري	Rafed	1803	0.33074
		تفسير المراغي [ج ٣]	أحمد مصطفى المراغي	Rafed	1660	0.33069
		تفسير المراغي [ج ١]	أحمد مصطفى المراغي	Rafed	1658	0.33062
		منهج الأنبياء في الدعوة إلى الله فيه الحكمة والعقل	ربيع بن هادي المدخلي	ShamAY	33033	0.33059
		جامع المسائل لابن تيمية ط عالم الفوائد - المجموعة الثامنة	شيخ الإسلام أحمد بن عبد الحليم بن عبد السلام ابن تيمية	ShamAY	37977	0.33051
		تفسير المراغي [ج ٢]	أحمد مصطفى المراغي	Rafed	1659	0.33051
		التّفسير الكاشف [ج ٢]	محمّد جواد مغنية	Rafed	2752	0.33031
		حاشية الدرة المضية في عقد الفرقة المرضية	عبد الرحمن بن محمد بن قاسم العاصمي الحنبلي النجدي (المتوفى: 1392ه)	Sham19Y	7369	0.32977
		البحر المحيط في التّفسير [ج ٢]	محمّد بن يوسف [ أبي حيّان الأندلسي الغرناطي ]	Rafed	2416	0.32975
		البراهين الإسلامية في رد الشبهة الفارسية	عبد اللطيف بن عبد الرحمن بن حسن بن محمد بن عبد الوهاب آل الشيخ (المتوفى: 1293هـ)	ShamAY	7567	0.32964
		تفسير المراغي [ج ٩]	أحمد مصطفى المراغي	Rafed	1679	0.32963
		غاية الأماني في الرد على النبهاني	أبو المعالي محمود شكري بن عبد الله بن محمد بن أبي الثناء الألوسي (المتوفى: 1342ه)	Sham19Y	12034	0.32958
		تفسير المراغي	أحمد بن مصطفى المراغي (المتوفى: 1371ه)	Sham19Y	23608	0.32956
		تفسير المراغي	أحمد بن مصطفى المراغي (المتوفى: 1371هـ)	ShamAY	23608	0.32955
		غاية الأماني في الرد على النبهاني	أبو المعالي محمود شكري بن عبد الله بن محمد بن أبي الثناء الألوسي (المتوفى: 1342هـ)	ShamAY	12034	0.32954
		موسوعة محاسن الإسلام ورد شبهات اللئام	أحمد بن سليمان أيوب، ونخبة من الباحثين	Sham19Y	146418	0.32944
		الموسوعة القرآنيّة خصائص السور [ج ٢]	الناشر: دار التقريب بين المذاهب الإسلامية	Rafed	3727	0.32935
		 من ائمة الموحدين الإمام محيي الدين بن عربي 	 عبد الرحمن حسن محمود 	ABLibrary	8913	0.32934
		موسوعة أخلاق القرآن [ج ٤]	الدكتور أحمد الشرباصي	Rafed	3904	0.32932
		بيان المعاني [مرتب حسب ترتيب النزول]	عبد القادر بن ملّا حويش السيد محمود آل غازي العاني (المتوفى: 1398هـ)	ShamAY	23595	0.32926
		الواضح في أصول الفقه	أبو الوفاء، علي بن عقيل بن محمد بن عقيل البغدادي الظفري، (المتوفى: 513ه)	ShamelaY19	122232	0.32918
		البحر المحيط في التّفسير [ج ٣]	محمّد بن يوسف [ أبي حيّان الأندلسي الغرناطي ]	Rafed	2417	0.32907
		قصة البشرية	محمد إبراهيم الحمد :: محمد بن إبراهيم الحمد	ShamAY	1979	0.32903
		شرح كتاب فضل الإسلام لمحمد بن عبد الوهاب - ناصر العقل	ناصر بن عبد الكريم العلي العقل	Sham19Y	37719	0.32896
		الأزمنة والأمكنة	أبو على أحمد بن محمد بن الحسن المرزوقي الأصفهاني (المتوفى: 421هـ)	ShamAY	11469	0.32883
		تيسير التفسير للقطان	إبراهيم القطان (المتوفى: 1404هـ)	ShamAY	29	0.32872
		الفتاوى الكبرى لابن تيمية	تقي الدين أبو العباس أحمد بن عبد الحليم بن عبد السلام بن عبد الله بن أبي القاسم بن محمد ابن تيمية الحراني الحنبلي الدمشقي (المتوفى: 728هـ)	ShamAY	9690	0.3287
		رسائل الشريف المرتضى [ج ٣]	علي بن الحسين الموسوي العلوي [ الشريف المرتضى علم الهدى ]	Rafed	3616	0.3287
		النبوات - ط السلفية	أحمد بن عبد الحليم بن تيمية الحراني أبو العباس	ShamAY	34366	0.32867
		المنهج القويم في اختصار «اقتضاء الصراط المستقيم لشيخ الإسلام ابن تيمية»	محمد بن علي بن أحمد بن عمر بن يعلى، أبو عبد الله، بدر الدين البعلي (المتوفى: 778ه)	Sham19Y	9859	0.32865
		الدين العالمي ومنهج الدعوة إليه	عطية صقر	Sham19Y	95667	0.32859
		العقائد الإسلامية	سيد سابق (المتوفى: 1420هـ)	ShamAY	1136	0.32854
		تفسير المراغي [ج ٧]	أحمد مصطفى المراغي	Rafed	1677	0.32832
		شرح الطحاوية - ط الأوقاف السعودية	صدر الدين محمد بن علاء الدين عليّ بن محمد ابن أبي العز الحنفي، الأذرعي الصالحي الدمشقي (المتوفى: 792هـ)	ShamAY	479	0.32831
		جامع المسائل لابن تيمية ط عالم الفوائد - المجموعة الأولى	شيخ الإسلام أحمد بن عبد الحليم بن عبد السلام ابن تيمية (661 - 728 هـ)	ShamAY	37979	0.32826
		تفسير التّحرير والتّنوير [ج ٢٠]	الشيخ محمّد الطاهر ابن عاشور	Rafed	2928	0.32822
		تيسير الكريم الرحمن في تفسير كلام المنان	عبد الرحمن بن ناصر بن عبد الله السعدي (المتوفى: 1376هـ)	ShamAY	42	0.32821
		الدرر السنية في الأجوبة النجدية	مجموعة من المؤلفين	ShamAY	3055	0.32812
		من أعلام المجددين	صالح بن فوزان بن عبد الله الفوزان	Sham19Y	12066	0.32802
		من أعلام المجددين	صالح بن فوزان بن عبد الله الفوزان	ShamAY	12066	0.32784
		تفسير المراغي [ج ١٤]	أحمد مصطفى المراغي	Rafed	1684	0.32779
		الجديد في تفسير القرآن المجيد [ج ١]	الشيخ محمّد السبزواري النجفي	Rafed	3699	0.32775
		التفسير المنير [ج ٦]	الدكتور وهبة الزحيلي	Rafed	2948	0.32774
		الجواب الصحيح لمن بدل دين المسيح لابن تيمية	تقي الدين أبو العباس أحمد بن عبد الحليم بن عبد السلام بن عبد الله بن أبي القاسم بن محمد ابن تيمية الحراني الحنبلي الدمشقي (المتوفى: 728هـ)	ShamAY	170	0.3277
		موسوعة أخلاق القرآن [ج ٢]	الدكتور أحمد الشرباصي	Rafed	3888	0.32766
		التوحيد لمحمد عبده	محمد عبده بن حسن خير الله (المتوفى: 1323هـ)	ShamAY	6392	0.32755
		تفسير القرآن الحكيم (تفسير المنار)	محمد رشيد بن علي رضا بن محمد شمس الدين بن محمد بهاء الدين بن منلا علي خليفة القلموني الحسيني (المتوفى: 1354هـ)	ShamAY	12304	0.32755
		تفسير المراغي [ج ٢٥]	أحمد مصطفى المراغي	Rafed	1702	0.32752
		كتاب الأزمنة والأمكنة	أحمد بن محمد المرزوقي الأصفهاني	Masaha	4122	0.32738
		تفسير التّحرير والتّنوير [ج ٢١]	الشيخ محمّد الطاهر ابن عاشور	Rafed	2929	0.32733
		الإعتصام [ج ١ و ٢]	أبي اسحاق ابراهيم بن موسى بن محمد اللخمي الشاطبي الغرناطي	Rafed	3388	0.3273
		تفسير الشيخ أحمد حطيبة	الشيخ الطبيب أحمد حطيبة	ShamelaY19	37037	0.32726
		آلاء الرحمن في تفسير القرآن [ج ١]	الشيخ محمد جواد البلاغي	Rafed	3150	0.32722
		تفسير القاسمي [ج ١]	محمّد جمال الدين القاسمي	Rafed	3902	0.32713
		فصل الخطاب في شرح (مسائل الجاهلية، التي خالف فيها رسول الله صلى الله عليه وسلم أهل الجاهلية لمحمد بن عبد الوهاب رحمه الله)	أبو المعالي محمود شكري بن عبد الله بن محمد بن أبي الثناء الألوسي (المتوفى: 1342ه)	ShamelaY19	30866	0.32712
		الجديد في تفسير القرآن المجيد [ج ٢]	الشيخ محمّد السبزواري النجفي	Rafed	3700	0.32708
		الأمر بالمعروف والنهي عن المنكر لابن تيمية	تقي الدين أبو العباس أحمد بن عبد الحليم بن عبد السلام بن عبد الله بن أبي القاسم بن محمد ابن تيمية الحراني الحنبلي الدمشقي (المتوفى: 728ه)	ShamelaY19	30903	0.32704
		البحر المديد في تفسير القرآن المجيد [ج ٣]	أحمد بن محمد بن عجيبة	Rafed	3797	0.32698
		تفسير آيات أشكلت على كثير من العلماء حتى لا يوجد في طائفة من كتب التفسير فيها القول الصواب بل لا يوجد فيها إلا ما هو خطأ	شيخ الإسلام أحمد بن عبد الحليم بن عبد السلام ابن تيمية	ShamAY	34374	0.32689
		البحر المحيط في التّفسير [ج ٥]	محمّد بن يوسف [ أبي حيّان الأندلسي الغرناطي ]	Rafed	2423	0.32682
		تفسير ابن بدران = جواهر الأفكار ومعادن الأسرار المستخرجة من كلام العزيز الجبار	عبد القادر بن أحمد بدران	ShamelaY19	20643	0.32676
		معترك الأقران في إعجاز القرآن، ويُسمَّى (إعجاز القرآن ومعترك الأقران)	عبد الرحمن بن أبي بكر، جلال الدين السيوطي (المتوفى: 911هـ)	ShamAY	1417	0.32672
		قصة البشرية	الشيخ محمد إبراهيم الحمد	Sham19Y	1979	0.32671
		التفسير المنير [ج ٢٥]	الدكتور وهبة الزحيلي	Rafed	2973	0.3267
		فتاوى ورسائل سماحة الشيخ عبد الرزاق عفيفي - قسم العقيدة	عبد الرزاق عفيفي (المتوفى: 1415هـ)	ShamAY	8613	0.32659
		البحر المديد في تفسير القرآن المجيد [ج ٥]	أحمد بن محمد بن عجيبة	Rafed	3836	0.32651
		الموسوعة القرآنية، خصائص السور	جعفر شرف الدين	ShamelaY19	21769	0.32634
		البحر المحيط في التّفسير [ج ٦]	محمّد بن يوسف [ أبي حيّان الأندلسي الغرناطي ]	Rafed	2424	0.32621
		موسوعة أخلاق القرآن [ج ٥]	الدكتور أحمد الشرباصي	Rafed	3905	0.32617
		تفسير غرائب القرآن ورغائب الفرقان [ج ٦]	نظام الدين الحسن بن محمّد بن حسين القمي النيسابوري	Rafed	1804	0.32606
		مواهب الرحمن في تفسير القرآن [ج ٢]	آية الله السيّد عبد الأعلى السبزواري	Rafed	3899	0.32593
		اللّباب في علوم الكتاب [ج ٣]	أبي حفص عمر بن علي بن عادل الدمشقي الحنبلي	Rafed	3092	0.32591
		روح المعاني [ج ١٣]	أبي الفضل شهاب الدين السيّد محمود الألوسي البغدادي	Rafed	3200	0.32567
		بيان المعاني (الترقي)	ملاحويش آل غازى عبدالقادر	ShamAY	34051	0.32563
		فقه القرآن - الجزء1	القطب الراوندي	Masaha	708	0.3256
		شرح الطحاوية - ط الأوقاف السعودية	صدر الدين محمد بن علاء الدين علي بن محمد ابن أبي العز الحنفي، الأذرعي الصالحي الدمشقي (المتوفى: 792ه)	Sham19Y	10777	0.32558
		من مشاهير المجددين في الإسلام	صالح بن فوزان بن عبد الله الفوزان	ShamelaY19	31084	0.32547
		التفسير الوسيط للقرآن الكريم	محمد سيد طنطاوي	ShamelaY19	23590	0.32546
		 الإلهيات على هدى الكتاب والسنة والعقل 	 الشيخ السبحاني 	ABLibrary	8345	0.32545
		موسوعة أخلاق القرآن [ج ٣]	الدكتور أحمد الشرباصي	Rafed	3903	0.32533
		تفسير التّحرير والتّنوير [ج ١٩]	الشيخ محمّد الطاهر ابن عاشور	Rafed	2926	0.32528
		تفسير التّحرير والتّنوير [ج ١٦]	الشيخ محمّد الطاهر ابن عاشور	Rafed	2920	0.32506
		تفسير التّحرير والتّنوير [ج ٢٢]	الشيخ محمّد الطاهر ابن عاشور	Rafed	2930	0.3249
		مناهج المفسرين	منيع بن عبد الحليم محمود (المتوفى: 1430ه)	ShamelaY19	38093	0.32487
		رحلة الشنقيطي إلى إفريقيا ط عالم الفوائد	محمد الأمين بن محمد المختار الجكني الشنقيطي (1325 - 1393)	ShamelaY19	20555	0.32487
		موسوعة أخلاق القرآن [ج ٦]	الدكتور أحمد الشرباصي	Rafed	3906	0.3247
		تفسير الشيخ أحمد حطيبة	الشيخ الطبيب أحمد حطيبة	ShamAY	110	0.32448
