automatic URI	Proposed URI	bookTitle	authorName	collection	id	tfidf
		الكافي في فقه أهل المدينة	أبو عمر يوسف بن عبد الله بن محمد بن عبد البر بن عاصم النمري القرطبي (المتوفى: 463هـ)	ShamAY	7367	0.27707
		المذاهب الفكرية المعاصرة ودورها في المجتمعات وموقف المسلم منها	د. غالب بن علي عواجي	ShamAY	10547	0.27707
		الشفا بتعريف حقوق المصطفى - محذوف الأسانيد	عياض بن موسى بن عياض بن عمرون اليحصبي السبتي، أبو الفضل (المتوفى: 544ه)	ShamelaY19	23645	0.27707
		 في رحاب أهل البيت ( ع ) 	 لجنة بحوث المجمع العالمي لأهل البيت ( ع ) 	ABLibrary	8545	0.27707
		الأطعمة وأحكام الصيد والذبائح	صالح الفوزان	ShamAY	36326	0.27706
		مذكرة - ما نهى عنه الإسلام	عبد الله بن سفر عباده العبدلي الغامدي	ShamAY	36362	0.27706
		أفعال تخالف العقيدة	السيد العربى بن كمال :: الزبيري، محمد العربي	ShamAY	35718	0.27705
		التعجب من أغلاط العامة في مسألة الإمامة	الشيخ القاضي أبي الفتح محمد بن علي الكراجكي	Masaha	201	0.27703
		الحديث النبوي في النحو العربي	الدكتور محمود فجال	Rafed	1991	0.27702
		منازل الحور العِين في قلوب العارفين برب العالمين	أبو محمد عبد الكريم بن صالح بن عبد الكريم الحميد	ShamAY	1081	0.27701
		شفاء الصّدور في شرح زيارة العاشور [ج ١]	ميرزا أبي الفضل الطهراني	Rafed	3232	0.27701
		بيان فضل علم السلف على علم الخلف	عبد الرحمن بن أحمد بن رجب الحنبلي (المتوفى: 795ه)	Sham19Y	132	0.277
		شرح سنن الترمذي - عبد الكريم الخضير	عبد الكريم الخضير	ShamelaY19	23777	0.277
		حاشية العدوي على شرح كفاية الطالب الرباني	أبو الحسن, علي بن أحمد بن مكرم الصعيدي العدوي (نسبة إلى بني عدي، بالقرب من منفلوط) (المتوفى: 1189ه)	ShamelaY19	21597	0.277
		شرح كتاب العلم لأبي خيثمة - عبد الكريم الخضير	عبد الكريم الخضير	ShamAY	155	0.27699
		جمع الوسائل في شرح الشمائل ط المطبعة الأدبية	علي بن سلطان محمد الهروي المشهور بملا علي القارئ المتوفى سنة 1014هـ	ShamAY	34445	0.27699
		طلبة الطلبة في الاصطلاحات الفقهية ـ ط القلم	النسفي، أبو حفص	ShamAY	34685	0.27699
		حياة الحيوان الكبرى	محمد بن موسى بن عيسى بن علي الدميري، أبو البقاء، كمال الدين الشافعي (المتوفى: 808هـ)	ShamAY	31575	0.27699
		وعرفت من هم أهل البيت(ع)	حسينة حسن الدريب	Masaha	484	0.27699
		الكامل في التاريخ - العلمية	أبو الحسن علي بن أبي الكرم محمد بن محمد بن عبد الكريم الشيباني الجزري، عز الدين ابن الأثير (المتوفى: 630هـ)	ShamAY	34612	0.27698
		الوسيط في تفسير القرآن المجيد	أبو الحسن علي بن أحمد بن محمد بن علي الواحدي، النيسابوري، الشافعي (المتوفى: 468ه)	ShamelaY19	21821	0.27698
		أدب الطّف أو شعراء الحسين عليه السلام [ج ٢]	جواد شبّر	Rafed	318	0.27698
		الإفادة الشرعية في بعض المسائل الطبية	الواحدي :: وليد السعيدان	ShamAY	36127	0.27697
		المغانم المطابة في معالم طابة	الفيروزآبادي	ShamAY	38405	0.27696
		حطِّم صنمك وكن عند نفسك صغيرًا	مجدي الهلالي	ShamAY	232	0.27696
		محمد صلى الله عليه وآله وسلم في الكتب المقدسة	سامى عامرى	Sham19Y	23668	0.27696
		تفسير النعماني اورساله المحكم و المتشابه	محمد بن ابراهيم نعماني	Ghbook	13999	0.27696
		سد المفر علي منكر عالم الذر	علي رضوي	Ghbook	12135	0.27696
		المراد الشرعي بالجماعة وأثر تحقيقه في إثبات الهوية الإسلامية أمام عولمة الإرهاب	صالح بن عبد الله العبود	ShamAY	33444	0.27695
		 مآثر الكبراء تاريخ سامراء 	 الشيخ ذبيح الله المحلاتي 	ABLibrary	9175	0.27695
		شرح مقدمة سنن ابن ماجه	عبد الكريم الخضير	ShamAY	81	0.27694
		التبصرة لابن الجوزي	جمال الدين أبو الفرج عبد الرحمن بن علي بن محمد الجوزي (المتوفى: 597ه)	ShamelaY19	26351	0.27692
		المنهاج في شعب الإيمان	الحسين بن الحسن بن محمد بن حليم البخاري الجرجاني، أبو عبد الله الحليمي (المتوفى: 403 ه)	ShamelaY19	18567	0.27691
		شرح كتاب آداب المشي إلى الصلاة أو العبادات (الصلاة، الزكاة، الصيام)	محمد بن إبراهيم بن عبد اللطيف آل الشيخ (المتوفى: 1389هـ)	ShamAY	11263	0.2769
		بيان فضل علم السلف على علم الخلف	عبد الرحمن بن أحمد بن رجب الحنبلي (المتوفى: 795هـ)	ShamAY	32660	0.27689
		الكامل في التاريخ	أبو الحسن علي بن أبي الكرم محمد بن محمد بن عبد الكريم بن عبد الواحد الشيباني الجزري، عز الدين ابن الأثير (المتوفى: 630هـ)	ShamAY	21712	0.27689
		إلزام النّاصب في إثبات الحجّة الغائب عجّل فرجه [ج ١]	الشيخ علي اليزدي الحائري	Rafed	2565	0.27689
		الاقسام في القرآن الكريم	آيت الله العظمي جعفر سبحاني	Ghbook	5032	0.27689
		علم أصول الفقه وخلاصة تاريخ التشريع ط المدني	عبد الوهاب خلاف (المتوفى: 1375هـ)	ShamAY	12380	0.27687
		عمدة الكتاب لأبي جعفر النحاس	أبو جعفر النَّحَّاس أحمد بن محمد بن إسماعيل بن يونس المرادي النحوي (المتوفى: 338هـ)	ShamAY	26803	0.27686
		مواهب الفتّاح في شرح تلخيص المفتاح [ج ١]	أبي العبّاس أحمد بن محمّد بن محمّدابن يعقوب المغربي	Rafed	2113	0.27686
		ما لم ينشر من الأمالي الشجرية	ضياء الدين أبو السعادات هبة الله بن علي بن حمزة، المعروف بابن الشجري (المتوفى: 542هـ)	ShamAY	396	0.27681
		قصص من التاريخ	علي بن مصطفى الطنطاوي (المتوفى: 1420هـ)	ShamAY	31980	0.2768
		محمد صلى الله عليه وآله وسلم في الكتب المقدسة	سامى عامرى	ShamAY	23668	0.2768
		مِنهاجُ المُسلم - كتاب عقائد وآداب وأخلاق وعَبادات ومعَاملات	أبو بَكر جَابِر الجَزَائِرِي	ShamAY	2071	0.27679
		الخلاصة في أحكام التجسس	علي بن نايف الشحود	ShamAY	1603	0.27678
		صحيح السيرة النبوية	محمد ناصر الدين الألباني (المتوفى: 1420هـ)	ShamAY	592	0.27678
		حكم الاسلام بعد نجاه العراق و افغانستان 	آيت الله العظمي سيد محمد حسيني شيرازي	Ghbook	8146	0.27678
		شرح ألفية العراقي في علوم الحديث	عبد الرحمن بن أبي بكر بن محمد، زين الدين المعروف بابن العيني الحنفي (المتوفى: 893ه)	ShamelaY19	96618	0.27677
		شرح تنقيح الفصول	أبو العباس شهاب الدين أحمد بن إدريس بن عبد الرحمن المالكي الشهير بالقرافي (المتوفى: 684ه)	ShamelaY19	21813	0.27677
		أعمال الكفار والجزاء عليها	محمد باكريم	ShamAY	36696	0.27675
		خلاصة الأفكار شرح مختصر المنار	أبو الفداء زين الدين قاسم بن قطلوبغا السودوني الجمالي الحنفي (المتوفى: 879ه)	ShamelaY19	124365	0.27675
		فتح القريب المجيب في شرح ألفاظ التقريب = القول المختار في شرح غاية الاختصار (ويعرف بشرح ابن قاسم على متن أبي شجاع)	محمد بن قاسم بن محمد بن محمد، أبو عبد الله، شمس الدين الغزي، ويعرف بابن قاسم وبابن الغرابيلي (المتوفى: 918ه)	ShamelaY19	35120	0.27675
		فيض الرحمن الرحيم في دروس رمضان الكريم	أبو محمد عبد الله بن محمد بن أحمد الطيار	ShamAY	34938	0.27674
		روض الأخيار المنتخب من ربيع الأبرار	محمد بن قاسم بن يعقوب الأماسي الحنفي، محيي الدين، ابن الخطيب قاسم (المتوفى: 940ه)	Sham19Y	10512	0.27674
		نفحة الريحانة ورشحة طلاء الحانة	محمد أمين بن فضل الله بن محب الدين بن محمد المحبي (المتوفى: 1111هـ)	ShamAY	579	0.27672
		الخلاصة الجامعة في قواعد التفسير النافعة	حامد العلي	ShamAY	36805	0.27672
		الأصول الاعتقادية للأذكار النبوية	-	ShamAY	34877	0.27672
		سلمان سابق فارس عرض وتحليل	الشيخ محمد جواد الفقيه	Rafed	69	0.27672
		كتاب من لا يحضره الفقيه [ج ١]	أبي جعفر محمّد بن علي بن الحسين بن بابويه القمّي [ الشيخ الصدوق ]	Rafed	1414	0.27672
		النهاية في مجرد الفقه و الفتاوى	الشيخ الطوسي	Masaha	953	0.27672
		معاني النحو	د. فاضل صالح السامرائي	ShamAY	38855	0.27671
		القيامة الصغرى	عمر بن سليمان بن عبد الله الأشقر العتيبي	ShamAY	9834	0.27671
		العلمانية والمذهب المالكي	أبو سفيان مصطفى باحو السلاوي المغربي	ShamelaY19	96924	0.27671
		المسلم وحقوق الآخرين	أبو فيصل البدراني	ShamelaY19	96245	0.2767
		 موسوعة الإمام أمير المؤمنين على بن أبى طالب ( ع ) 	 الشيخ باقر شريف القرشي 	ABLibrary	7814	0.2767
		شرح كلمة الإخلاص لابن رجب	عبد الرحمن بن ناصر البراك	ShamAY	32532	0.27669
		عدّة الإنابة في أماكن الإجابة	السيّد عفيف الدين أبي السيادة عبدالله بن إبراهيم بن حسن بن محمّد أمين ميرغني الحسني المتّقي المكّي الطائفي الحنفي [ المحجوب ]	Rafed	2461	0.27669
		صَحِيحُ التَّرْغِيب وَالتَّرْهِيب	محمد ناصر الدين الألباني	ShamAY	32126	0.27668
		الانتصار للقرآن 	ابوبكر محمد بن طيب باقلاني	Ghbook	2849	0.27667
		الأنوار النعمانية في الدعوة الربانية	محمد علي محمد إمام	ShamelaY19	21011	0.27666
		الكلمات المتشابهة في القرآن	عبد اللطيف البلوشي	ShamAY	36828	0.27665
		فضل رب البرية في شرح الدرر البهية	أبو الحسن علي بن مختار الرملي	ShamelaY19	133386	0.27664
		 المنية في حكم الشارب واللحية 	 محمد رضا الطبسي النجفي 	ABLibrary	9428	0.27663
		شرح القصيدة اللامية لابن تيمية - عبد الرحيم السلمي	عبد الرحيم بن صمايل العلياني السلمي	ShamelaY19	37805	0.27662
		إرشاد القلوب - الجزء1	الحسن الديلمي	Masaha	145	0.27661
		تحفة الراكع والساجد بأحكام المساجد	أبو بكر بن زيد الجراعي الصالحي الحنبلي (المتوفى: 883 ه)	Sham19Y	17419	0.2766
		اجتماع الجيوش الإسلامية	محمد بن أبي بكر بن أيوب بن سعد شمس الدين ابن قيم الجوزية (المتوفى: 751ه)	Sham19Y	21714	0.27659
		نظام الحكم في الاسلام	آيت الله العظمي جعفر سبحاني	Ghbook	5068	0.27659
		التحصين لأسرار ما زاد من كتاب اليقين‏	السيد علي بن موسى بن طاووس	Masaha	4805	0.27658
		موسوعة الرد على المذاهب الفكرية المعاصرة 1-29	علي بن نايف الشحود	ShamAY	32988	0.27657
		رفع الملام عن الإئمة الأعلام - ت: الشحود	الواحدي :: ابن تيمية	ShamAY	34383	0.27656
		اجتماع الجيوش الإسلامية	محمد بن أبي بكر بن أيوب بن سعد شمس الدين ابن قيم الجوزية (المتوفى: 751هـ)	ShamAY	21714	0.27656
		ولا تقربوا الفواحش	جمال بن عبد الرحمن إسماعيل	ShamelaY19	31360	0.27656
		نظرات في التربية الإيمانية	مجدي الهلالي	ShamelaY19	36414	0.27656
		كتاب المكاسب (للشيخ الأنصاري) - الجزء1	الشيخ مرتضى الأنصاري	Masaha	822	0.27653
		الطرق السلمية في تغير الحاكم الفاسد	يحيى بن علي جغمان	ShamAY	694	0.27651
		تحقيق ما للهند من مقولة مقبولة في العقل أو مرذولة	أبو الريحان محمد بن أحمد البيروني الخوارزمي (المتوفى: 440هـ)	ShamAY	11655	0.27651
		النصر العزيز على الرد الوجيز حوار مع عبدالرحمن عبدالخالق	ربيع بن هادي المدخلي	ShamAY	37466	0.2765
		الأساليب والإطلاقات العربية	أبو المنذر محمود بن محمد بن مصطفى بن عبد اللطيف المنياوي	Sham19Y	36193	0.2765
		 المثنوي المعنوي ( معرب الكفافي ) 	 جلال الدين الرومي 	ABLibrary	8768	0.2765
		ابراز المعاني من حرز الاماني في القراءات السبع، المقدمه	عبدالرحمن بن اسماعيل بن ابراهيم	Ghbook	2762	0.2765
		التقريب والإرشاد (الصغير)	محمد بن الطيب بن محمد بن جعفر بن القاسم، القاضي أبو بكر الباقلاني المالكي (المتوفى: 403 هـ)	ShamAY	32372	0.27649
		دروس للشيخ عبد الله الجلالي	د. عبد الله بن حمد الجلالي	ShamAY	911	0.27649
		توضيح الأفكار لمعاني تنقيح الأنظار	محمد بن إسماعيل بن صلاح بن محمد الحسني، الكحلاني ثم الصنعاني، أبو إبراهيم، عز الدين، المعروف كأسلافه بالأمير (المتوفى: 1182هـ)	ShamAY	11990	0.27649
		القول البين الأظهر في الدعوة إلى الله والأمر بالمعروف والنهي عن المنكر	عبد العزيز بن عبد الله بن عبد الرحمن الراجحي	ShamAY	1883	0.27648
		دلائل الإعجاز - الكتاب العربي	أبو بكر عبدالقاهر بن عبدالرحمن بن محمد الجرجاني	ShamAY	34098	0.27645
		شرح الطحاوية لصالح آل الشيخ = إتحاف السائل بما في الطحاوية من مسائل	صالح بن عبد العزيز آل الشيخ	ShamAY	934	0.27645
		تفسير غريب ما في الصحيحين البخاري ومسلم	محمد بن فتوح بن عبد الله بن فتوح بن حميد الأزدي الميورقي الحَمِيدي أبو عبد الله بن أبي نصر (المتوفى: 488هـ)	ShamAY	7014	0.27644
		العقيدة في الله	عمر بن سليمان بن عبد الله الأشقر العتيبي	ShamAY	9667	0.27644
		ختم الأولياء للحكيم الترمذي	الحكيم الترمذي أبو عبد الله محمد بن علي بن الحسن (متوفى بعد 318 هـ)	ShamAY	33732	0.27643
		مجلة جامعة أم القرى 19 - 24	مجموعة من المؤلفين	ShamAY	1190	0.27643
		علم أصول الفقه ط مكتبة الدعوة	عبد الوهاب خلاف	Sham19Y	10767	0.27643
		أحكام أهل الذمة	محمد بن أبي بكر بن أيوب بن سعد شمس الدين ابن قيم الجوزية (المتوفى: 751ه)	ShamelaY19	21747	0.27641
		مقامات الحريري	أبو محمد القاسم بن علي الحريري (المتوفى: 516ه)	ShamelaY19	26585	0.27641
		من أخلاق الداعية	سلمان بن فهد العودة	ShamAY	1994	0.27639
		وأنذرهم يوم الحسرة أَهوالُ الموتِ والقِيامَةِ	محمد أحمد عبد الغني	ShamAY	34976	0.27639
		علم أصول الفقه ط مكتبة الدعوة	عبد الوهاب خلاف (المتوفى : 1375هـ)	ShamAY	10767	0.27638
		المدهش	جمال الدين أبو الفرج عبد الرحمن بن علي بن محمد الجوزي (المتوفى: 597هـ)	ShamAY	6940	0.27638
		المراهقة ألم وأمل	وليد كمال شكر	ShamAY	35165	0.27637
		الفواكه العذاب في الرد على من لم يحكم السنة والكتاب	حمد بن ناصر بن عثمان بن معمر النجدي التميمي الحنبلي (المتوفى: 1225هـ)	ShamAY	1	0.27636
		الزينة في ضوء القرآن الكريم - دراسة موضوعية	عوض أبو عليان	ShamAY	36388	0.27636
		مطالع البدور ومنازل السرور	علي بن عبد الله الغزولي البهائي الدمشقي (المتوفى: 815ه)	Sham19Y	5390	0.27633
		محبة الرسول بين الاتباع والابتداع	عبد الرءوف محمد عثمان	ShamelaY19	30862	0.27633
		كيف أخدم الإسلام؟	عبد الملك بن محمد القاسم	ShamelaY19	36553	0.27631
		مقدمة ابن الصلاح = معرفة أنواع علوم الحديث - ت عتر	عثمان بن عبد الرحمن، أبوعمرو، تقي الدين المعروف بابن الصلاح (المتوفى: 643ه)	ShamelaY19	22870	0.27629
		حركة التجديد والإصلاح في نجد	عبد الله العجلان	ShamAY	11156	0.27627
		الاستقامة في مائة حديث نبوي	محمد زكي محمد خضر	ShamAY	34949	0.27626
		قطف الجنى المستطاب	زيد بن محمد المدخلي	ShamAY	32982	0.27625
		عجبا لأمر المؤمن دراسة حديثية دعوية نفسية	فالح بن محمد الصغير	ShamAY	35113	0.27625
		سنّة أهل البيت(ع)	السيد محمد تقي الحكيم	Masaha	306	0.27625
		قطوف من نعوت السلف	زيد بن محمد المدخلي	ShamAY	32983	0.27623
		 الخمس 	 السيد علي بن عبد الأعلى السبزواري 	ABLibrary	9637	0.27623
		الحياه البرزخيه : تبحث عن امتداد حياه الانسان بعد الرحيل من الدنيا ...	آيت الله العظمي جعفر سبحاني	Ghbook	5044	0.27623
		نفاضة الجراب في علالة الاغتراب	لسان الدين بن الخطيب، محمد بن عبد الله (المتوفى: 776ه)	Sham19Y	477	0.27622
		الرد على أسئلة توني بولدروجوفاك	عبد الرحمن عبد الخالق	ShamAY	35340	0.27621
		ثم اهتديت ...	محمد تيجاني سماوي	Ghbook	7621	0.27621
		نعم لقد تشيّعت	محمّد الرصافي المقداد	Rafed	1216	0.2762
		 موسوعة كشاف اصطلاحات الفنون والعلوم 	 محمد علي التهانوي 	ABLibrary	8654	0.2762
		غاية المرام في علم الكلام	أبي الحسن علي بن محمد بن سالم الثعلبي [ سيف الدين الآمدي ]	Rafed	3481	0.27619
		معجم القواعد العربية	عبد الغني بن علي الدقر (المتوفى: 1423هـ)	ShamAY	12933	0.27618
		إمعان النظر في مشروعية البغض والهجر، وإحياء ما عفا منه واندثر ((دراسة علمية في مشروعية البغض في الله والهجر فيه عز وجل))	أبو محمد عبد الكريم بن صالح بن عبد الكريم الحميد	ShamelaY19	36172	0.27618
		الشيعة هم أهل السنّة	الدكتور محمّد التيجاني السماوي	Rafed	1219	0.27618
		كتاب الفنون لابن عقيل	أبو الوفاء، علي بن عقيل بن محمد بن عقيل البغدادي الحنبلي	ShamAY	38993	0.27617
		الانوار الحيرية و الاقمار البدرية الاحمدية	يوسف بحراني	Ghbook	10356	0.27617
		فتح الودود بشرح منظومة ابن أبي داود المصححة	عبد الله بن محمد بن أحمد الطيار	ShamAY	35279	0.27616
		كتاب الجمع والتجريد في شرح كتاب التوحيد	علي الخضير	ShamAY	35481	0.27616
		التوحيد للناشئة والمبتدئين	عبد العزيز بن محمد بن علي آل عبد اللطيف	ShamelaY19	30800	0.27616
		فصل الخطاب في ( تباب اتباع ) مذهب محمد بن عبدالوهاب	سليمان بن عبدالوهاب نجدي	Ghbook	7681	0.27616
		الاعتصام بالكتاب و السنه	آيت الله العظمي جعفر سبحاني	Ghbook	7525	0.27616
		جمهرة مقالات الأستاذ محمود محمد شاكر	محمود شاكر، أبو فهر	ShamAY	38846	0.27615
		الفرقان في تفسير القرآن بالقرآن والسنّة [ج ١٥]	الشيخ محمد الصادقي	Rafed	3032	0.27615
		الشافي في العقائد و الأخلاق و الأحكام - الجزء1	الفيض الكاشاني	Masaha	1257	0.27615
		ما يجب أن يعرفه المسلم عن دينه	أبو عبد الرحمن عبد الله بن عبد الغني بن محمد خياط (المتوفى: 1415هـ)	ShamAY	30856	0.27614
		المرشد الوجيز إلى علوم تتعلق بالكتاب العزيز	المقدسي، أبو شامة	ShamelaY19	22676	0.27614
		فتح الباقي بشرح ألفية العراقي	زين الدين أبي يحيى زكريا بن محمد بن زكريا الأنصاري السنيكي (ت 926 ه)	ShamelaY19	35261	0.27614
		تحبير المختصر وهو الشرح الوسط على مختصر خليل في الفقه المالكي	تاج الدين بهرام بن عبد الله بن عبد العزيز الدميري (المتوفى: 803 ه)	ShamelaY19	147313	0.27614
		ترجمة القرآن الكريم	أحمد علي عبد الله	ShamAY	10062	0.2761
		الاتجاهات الفقهية عند أصحاب الحديث في القرن الثالث الهجري	الدكتور عبد المجيد محمود عبد المجيد	ShamAY	31717	0.27609
		غريب القرآن لابن قتيبة ت سعيد اللحام	أبو محمد عبد الله بن مسلم بن قتيبة الدينوري (المتوفى: 276هـ)	ShamAY	23621	0.27609
		 معرفة الإمام 	 السيد محمد حسين الطهراني 	ABLibrary	8881	0.27609
		 نزهة الامم في العجائب والحكم 	 ابن إياس 	ABLibrary	9293	0.27609
		 بحار الأنوار 	 العلامة المجلسي 	ABLibrary	750	0.27609
		خطبة الجمعة ودورها في تربية الأمة	عبد الغني أحمد جبر مزهر	ShamelaY19	31069	0.27607
		بحار الأنوار [ج ٦٤]	الشيخ محمّد باقر بن محمّد تقي المجلسي	Rafed	1064	0.27607
		الموشى = الظرف والظرفاء	محمد بن أحمد بن إسحاق بن يحيى، أبو الطيب، المعروف بالوشاء (المتوفى: 325ه)	ShamelaY19	26102	0.27606
		مفردات الفاظ القرآن	حسين بن محمد راغب اصفهاني	Ghbook	8514	0.27606
		تسلية المجالس و زينة المجالس - الجزء1	السيد محمد الكركي الحائري‏	Masaha	1978	0.27605
		الشهاب الثاقب في وجوب صلاة الجمعة العيني	الفيض الكاشاني	Masaha	1259	0.27604
		اشتقاق أسماء الله	عبد الرحمن بن إسحاق البغدادي النهاوندي الزجاجي، أبو القاسم (المتوفى: 337ه)	Sham19Y	14275	0.27603
		موسوعة العتبات المقدسة  - الجزء1	جعفر الخليلي	Masaha	3747	0.27603
		دليل الواعظ إلى أدلة المواعظ (موضوعات للخطب بأدلتها من القرآن الكريم والسنة الصحيحة)	شحاتة محمد صقر	ShamAY	559	0.27602
		حلية الطبيب المسلم	الواحدي :: وسيم فتح الله	ShamAY	34904	0.27602
		 موسوعة التصوف الاسلامي 	 محمود حمدي زقزوق 	ABLibrary	8914	0.27602
		شرح كتاب فضل الاسلام - ابن باز	سماحة الشيخ ابن باز	ShamAY	35628	0.27601
		الخلاصة في معرفة الحديث	الحسين بن محمد بن عبد الله، شرف الدين الطيبي (المتوفى: 743 ه)	Sham19Y	17807	0.27601
