automatic URI	Proposed URI	bookTitle	authorName	collection	id	tfidf
		لوامع الدرر في هتك أستار المختصر [شرح «مختصر خليل» للشيخ خليل بن إسحاق الجندي المالكي (ت: 776 ه)]	محمد بن محمد سالم المجلسي الشنقيطي (1206 - 1302 ه)	ShamelaY19	149697	0.29362
		دراسات تاريخيّة من القرآن الكريم [ج ٢]	دكتور محمد بيومي مهران	Rafed	1781	0.29362
		القول المعتبر في بيان الإعجاز للحروف المقطعة من فواتح السور	إياس محمد حرب آل خطاب	Sham19Y	37350	0.29361
		روح المعاني في تفسير القرآن العظيم والسبع المثاني	محمود الألوسي أبو الفضل	ShamAY	34055	0.29359
		رأس الحسين	تقي الدين أبو العباس أحمد بن عبد الحليم بن تيمية الحراني (المتوفى: 728هـ)	ShamAY	892	0.29358
		تراثنا ـ العددان [ 59 و 60 ]	مؤسسة آل البيت عليهم السلام لإحياء التراث ـ قم	Rafed	3248	0.29358
		شرح الدماميني على المغني اللبيب [ج ١]	محمّد بن أبي بكر الدماميني	Rafed	2087	0.29358
		رسالة الصاهل والشاجح	أحمد بن عبد الله بن سليمان بن محمد بن سليمان المعري، التنوخي (المتوفى: 449هـ)	ShamAY	563	0.29357
		غاية المريد شرح كتاب التوحيد	د. عبد الرحمن بن عبد العزيز العقل	ShamelaY19	145172	0.29357
		الشهب الثاقبه (تلخيص الصوارم المهرقه في رد الصواعق المحرقه)	نورالله تستري	Ghbook	11353	0.29357
		شرح الأربعين النووية للعثيمين	محمد بن صالح بن محمد العثيمين (المتوفى: 1421ه)	ShamelaY19	21812	0.29356
		موسوعة الفرق المنتسبة للإسلام - الدرر السنية	مجموعة من المؤلفين	ShamelaY19	32150	0.29356
		فيض الباري على صحيح البخاري	(أمالي) محمد أنور شاه بن معظم شاه الكشميري الهندي ثم الديوبندي (المتوفى: 1353ه)	Sham19Y	98124	0.29355
		الديمقراطية وأخواتها آثار وثمرات	خليل بن إبراهيم العبيدي	ShamAY	33499	0.29352
		فيض الباري على صحيح البخاري	(أمالي) محمد أنور شاه بن معظم شاه الكشميري الهندي ثم الديوبندي (المتوفى: 1353هـ)	ShamAY	31617	0.29352
		شرح العقيدة الواسطية - عبد الكريم الخضير	عبد الكريم الخضير	ShamelaY19	25863	0.29352
		الأحكام السلطانية للماوردي	أبو الحسن علي بن محمد بن محمد بن حبيب البصري البغدادي، الشهير بالماوردي (المتوفى: 450هـ)	ShamAY	22881	0.29351
		قضية التنوير	الواحدي :: محمد قطب	ShamAY	33324	0.2935
		نظم الدرر في تناسب الآيات والسور	إبراهيم بن عمر بن حسن الرباط بن علي بن أبي بكر البقاعي (المتوفى: 885هـ)	ShamAY	9098	0.29348
		الإمام السجّاد جهاد وأمجاد	الدكتور حسين الحاج حسن	Rafed	689	0.29347
		الإيمان بالجن بين الحقيقة والتهويل	علي بن نايف الشحود	ShamAY	34	0.29345
		مفتاح الأفكار للتأهب لدار القرار	أبو محمد عبد العزيز بن محمد بن عبد الرحمن بن عبد المحسن السلمان (المتوفى: 1422هـ)	ShamAY	120	0.29345
		الغياثي غياث الأمم في التياث الظلم	عبد الملك بن عبد الله بن يوسف بن محمد الجويني، أبو المعالي، ركن الدين، الملقب بإمام الحرمين (المتوفى: 478هـ)	ShamAY	8323	0.29345
		مذاهب فكرية معاصرة	محمد بن قطب بن إبراهيم	ShamAY	7378	0.29344
		الكافية الشافية - ت العريفي وآخرون ط عالم الفوائد	ابن القيم	ShamAY	38329	0.29344
		جلباب المرأة المسلمة في الكتاب والسنة	أبو عبد الرحمن محمد ناصر الدين، بن الحاج نوح بن نجاتي بن آدم، الأشقودري الألباني (المتوفى: 1420هـ)	ShamAY	9994	0.29344
		من بلاغة القرآن	احمد احمد بدوي	Ghbook	8904	0.29344
		 حياة الإمام محمد الباقر ( ع ) 	 الشيخ باقر شريف القرشي 	ABLibrary	7503	0.29343
		دلائل الإعجاز في علم المعاني	أبو بكر عبد القاهر بن عبد الرحمن بن محمد الفارسي الأصل، الجرجاني الدار (المتوفى: 471ه)	ShamelaY19	22664	0.29342
		الدّرر النجفيّة [ج ٣]	الشيخ يوسف بن أحمد البحراني [ صاحب الحدائق ]	Rafed	1553	0.29342
		الإيمانُ والعملُ الصالحُ سَببُ النَّجاحِ والفلاحِ	علي بن نايف الشحود	ShamAY	34826	0.29341
		غاية المقصود فى الرد على النصارى واليهود	السموأل بن يحيى بن عباس المغربي (المتوفى: نحو 570ه)	Sham19Y	12757	0.2934
		 جامع العلوم في اصطلاحات الفنون الملقب بدستور العلماء 	 القاضى عبد النبي بن عبد الرسول الأحمد نگري 	ABLibrary	8402	0.2934
		أزهار الرياض في أخبار القاضي عياض	شهاب الدين أحمد بن محمد بن أحمد بن يحيى، أبو العباس المقري التلمساني (المتوفى: 1041هـ)	ShamAY	26350	0.29337
		فن الذكر والدعاء عند خاتم الأنبياء	محمد الغزالي	ShamAY	34813	0.29336
		سراج الملوك	أبو بكر محمد بن محمد ابن الوليد الفهري الطرطوشي المالكي (المتوفى: 520هـ)	ShamAY	1585	0.29335
		التنجيم والمنجمون وحكم ذلك في الإسلام	عبد المجيد بن سالم المشعبي	ShamAY	7591	0.29334
		الذخيرة في محاسن أهل الجزيرة	أبو الحسن علي بن بسام الشنتريني (المتوفى: 542هـ)	ShamAY	1035	0.29334
		شرح عمدة الأحكام - عبد الكريم الخضير	عبد الكريم الخضير	ShamelaY19	22645	0.29334
		موسوعة علوم القرآن	عبد القادر محمد منصور	ShamAY	1183	0.29333
		المسالك والممالك للبكري - الجزء1	عبد الله بن عبد العزيز البكري	Masaha	3951	0.29333
		رؤية شرعية في الجدال والحوار مع أهل الكتاب	الشريف محمد بن حسين الصمداني	ShamAY	1963	0.29332
		فتاوى إسلامية	محمد بن عبد العزيز المسند	ShamAY	1708	0.29332
		تأملات قرآنية - المغامسي	أبو هاشم صالح بن عوّاد بن صالح المغامسي	ShamAY	648	0.29332
		السِّياحة ُبينَ المفهومِ الإسلاميِّ والمفهومِ الجاهليِّ	الواحدي :: علي بن نايف الشحود	ShamAY	36093	0.29332
		الإعجاز العلمي في القرآن الكريم - جامعة المدينة	مناهج جامعة المدينة العالمية	ShamelaY19	31080	0.29332
		 جواهر النصوص في حل كلمات الفصوص 	 الشيخ عبد الغني النابلسي 	ABLibrary	8855	0.29332
		أخبار الزمان ومن أباده الحدثان، وعجائب البلدان والغامر بالماء والعمران	أبو الحسن على بن الحسين بن على المسعودي (المتوفى: 346هـ)	ShamAY	8620	0.29331
		المسالك والممالك للبكري	أبو عبيد عبد الله بن عبد العزيز بن محمد البكري الأندلسي (المتوفى: 487هـ)	ShamAY	23849	0.29329
		فتاوى في التوحيد	عبد الله بن عبد الرحمن بن عبد الله بن إبراهيم بن فهد بن حمد بن جبرين (المتوفى: 1430ه)	ShamelaY19	36575	0.29329
		التفسير الحديث [مرتب حسب ترتيب النزول]	محمد عزة دروزة	ShamelaY19	23603	0.29328
		الأنوار الساطعات لآيات جامعات أو البرهان المحكم في أن القرآن يدي للتي هي أقوم	الواحدي :: عبد العزيز السلمان	ShamAY	35006	0.29327
		ألف فتوى للشيخ الألباني = مجموع فتاوى العلامة الألباني (الأجزاء الأول والثاني والثالث)	ناصر الدين الألباني	ShamAY	33152	0.29327
		شرح المنظومة الميمية في الآداب الشرعية	عبد الكريم الخضير	ShamAY	183	0.29326
		تحفة الإخوان بأجوبة مهمة تتعلق بأركان الإسلام	عبد العزيز بن عبد الله بن باز (المتوفى: 1420ه)	ShamelaY19	31252	0.29326
		تفسير من وحي القرآن [ج ٢٠]	السيد محمد حسين فضل الله	Rafed	3285	0.29325
		طريق الهجرتين وباب السعادتين	محمد بن أبي بكر بن أيوب بن سعد شمس الدين ابن قيم الجوزية (المتوفى: 751هـ)	ShamAY	12029	0.29324
		 مفتاح المعية في دستور الطريقة النقشبندية 	 الشيخ عبد الغني النابلسي 	ABLibrary	8858	0.29323
		مفردات ألفاظ القرآن‌	الراغب الأصفهاني	Masaha	3644	0.29323
		توجيهات إسلامية لإصلاح الفرد والمجتمع	محمد بن جميل زينو	ShamelaY19	31350	0.29322
		مناظرات ابن تيمية لأهل الملل والنحل	عبد العزيز بن محمد آل عبد اللطيف	ShamAY	12837	0.29321
		فكر ومباحث	علي بن مصطفى الطنطاوي (المتوفى: 1420هـ)	ShamAY	32251	0.29319
		حياة محمد ورسالته	محمد علي اللاهوري القادياني (1874-1951 م) أحد أتباع غلام أحمد القادياني (الذي ادعى النبوة) ، ورئيس الفرع اللاهوري للقاديانية (فليُحذر)	ShamAY	9798	0.29319
		في سبيل الإصلاح	علي بن مصطفى الطنطاوي (المتوفى: 1420هـ)	ShamAY	32184	0.29319
		توحيد العبادة		ShamAY	35523	0.29319
		أطيب النشر في تفسير الوصايا العشر	مرزوق بن هياس الزهراني	ShamelaY19	22750	0.29318
		نظم القواعد الفقهية	عبد الرحمن السعدي	ShamAY	37545	0.29317
		المفصل في شرح الشروط العمرية	الواحدي :: علي بن نايف الشحود	ShamAY	36098	0.29317
		علو الهمة	محمد بن أحمد بن إسماعيل المقدم	ShamAY	1760	0.29315
		مدافع الفقهاء التطرف بين فقهاء السلف و فقهاء الخلف	صالح ورداني	Ghbook	7703	0.29314
		99 شبهة رافضية والرد عليها	جلال	ShamAY	38000	0.29312
		إحسان سلوك العبد المملوك إلى ملك الملوك	أبو محمد عبد الكريم بن صالح بن عبد الكريم الحميد	ShamAY	1033	0.29311
		شرح الطحاوية - يوسف الغفيص	يوسف بن محمد علي الغفيص	Sham19Y	37777	0.29311
		شرح كتاب الإيمان - يوسف الغفيص	يوسف بن محمد علي الغفيص	ShamelaY19	37780	0.29311
		الإمام السجاد جهاد و أمجاد	أ. د. حسين الحاج حسن	Masaha	1854	0.29311
		تحفة الطالب والجليس في كشف شبه داود بن جرجيس	عبد اللطيف بن عبد الرحمن بن حسن بن محمد بن عبد الوهاب آل الشيخ (المتوفى: 1293هـ)	ShamAY	11082	0.29309
		الاقتضاب في غريب الموطأ وإعرابه على الأبواب	محمد بن عبد الحق اليفرني (625 هـ)	ShamAY	32513	0.29308
		المطالع البدرية في المنازل الرومية	محمد بن محمد بن محمد الغزي العامري الدمشقي، أبو البركات، بدر الدين ابن رضي الدين (المتوفى: 984ه)	ShamelaY19	37060	0.29307
		 رسائل الجاحظ 	 الجاحظ 	ABLibrary	8436	0.29307
		الحيوان - ت: عبد السلام هارون	أبو عثمان عمرو بن بحر الجاحظ	ShamAY	33772	0.29304
		الملل والنّحل [ج ٢]	أبي الفتح محمد بن عبدالكريم بن أبي بكر أحمد الشهرستاني	Rafed	3570	0.29302
		 الأسفار عن رسالة الأنوار فيما يتجلى لأهل الذكر من الأنوار 	 عبد الكريم بن ابراهيم الجيلي 	ABLibrary	8809	0.29301
		التكفير أخطاره و ضوابطه (بحث التخرج)	زكريا الخطيب	ShamAY	35724	0.293
		شرح الطحاوية - يوسف الغفيص	يوسف بن محمد علي الغفيص	ShamAY	31670	0.29296
		أصول مسائل العقيدة عند السلف وعند المبتدعة	سعود بن عبد العزيز الخلف	Sham19Y	7259	0.29296
		أركان الإسلام	عمادة البحث العلمي - الجامعة الإسلامية بالمدينة المنورة	ShamAY	35714	0.29295
		مجمل اعتقاد أئمة السلف	عبد الله بن عبد المحسن بن عبد الرحمن التركي	ShamelaY19	30858	0.29295
		الاتجاهات الفقهية عند أصحاب الحديث في القرن الثالث الهجري	الدكتور عبد المجيد محمود عبد المجيد	ShamelaY19	122392	0.29293
		ذكرى العاقل وتنبيه الغافل	الواحدي :: عبد القادر الجزائري	ShamAY	34499	0.29292
		تفسير من وحي القرآن [ج ١٢]	السيد محمد حسين فضل الله	Rafed	3274	0.29292
		نفائس التأويل - الجزء1	السيد المرتضى	Masaha	2507	0.2929
		سماحة الإسلام وحقوق الأقليّات الدينيّة	السيد سعيد كاظم العذاري	Rafed	46	0.29288
		التحفة العراقية في الأعمال القلبية	تقي الدين أبو العباس أحمد بن عبد الحليم بن عبد السلام بن عبد الله بن أبي القاسم بن محمد ابن تيمية الحراني الحنبلي الدمشقي (المتوفى: 728هـ)	ShamAY	6827	0.29287
		أدب الاختلاف في الإسلام	طه جابر فياض العلواني	Sham19Y	1523	0.29286
		لأكون مع الصادقين	الدكتور محمّد التيجاني السماوي	Rafed	3416	0.29286
		تفسير سورة هل أتى [ج ١]	السيد جعفر مرتضى العاملي	Rafed	3890	0.29286
		التوضيحاتُ الكاشفاتُ على كشفِ الشُبَهاتِ		ShamAY	35480	0.29285
		الحج عبر الحضارات والامم	ماجده آل مرتضي مومن	Ghbook	3490	0.29285
		الدر المختار وحاشية ابن عابدين (رد المحتار)	ابن عابدين، محمد أمين بن عمر بن عبد العزيز عابدين الدمشقي الحنفي (المتوفى: 1252هـ)	ShamAY	21613	0.29284
		احذروا اليأس فإنه قتال	علي بن نايف الشحود	ShamAY	34820	0.29283
		أنوار النبي(ص) أسرارها و أنواعها	عبد الحق بن سبعين المرسي‏	Masaha	1941	0.29283
		ماذا خسر العالم بانحطاط المسلمين	علي أبو الحسن بن عبد الحي بن فخر الدين الندوي (المتوفى: 1420ه)	ShamelaY19	21575	0.29282
		التّفسير الحديث [ج ٧]	محمّد عزّة دروزة	Rafed	3737	0.29282
		تحذير أهل الأيمان عن الحكم بغير ما أنزل الرحمن	أبو هبة الله إسماعيل بن إبراهيم الخطيب الحسني الإسعردي الأزهري السلفي	ShamAY	10046	0.29281
		الشهاب الثاقب في بيان معني الناصب	سيدمهدي رجايي	Ghbook	15623	0.29281
		التعليقات على متن لمعة الاعتقاد لابن جبرين	عبد الله بن عبد الرحمن بن عبد الله بن إبراهيم بن فهد بن حمد بن جبرين (المتوفى: 1430هـ)	ShamAY	8586	0.2928
		هذه مفاهيمنا	صالح بن عبد العزيز بن محمد بن إبراهيم آل الشيخ	ShamAY	12120	0.29279
		ذم الفرقة والاختلاف في الكتاب والسنة	عبد الله بن محمد الغنيمان	ShamAY	10252	0.29278
		الرد على السبكي في مسألة تعليق الطلاق	شيخ الإسلام أحمد بن عبد الحليم بن عبد السلام ابن تيمية (661 - 728 ه)	Sham19Y	32384	0.29278
		رسالة في أصول الدين	تقي الدين أبو العباس أحمد بن عبد الحليم بن عبد السلام بن عبد الله بن أبي القاسم بن محمد ابن تيمية الحراني الحنبلي الدمشقي (المتوفى: 728هـ)	ShamAY	11216	0.29277
		الدين الخالص أو إرشاد الخلق إلى دين الحق (والمجلد التاسع طبع باسم: إرشاد الناسك إلى أعمال المناسك)	محمود محمد خطاب السبكي	Sham19Y	20907	0.29277
		الإمامة في أهمّ الكتب الكلاميّة وعقيدة الشيعة الإماميّة	السيّد علي الحسيني الميلاني	Rafed	73	0.29277
		شرح الصحيفة الكاملة السجّاديّة	السيّد محمّد باقر المشتهر بمحقّق الداماد	Rafed	2878	0.29277
		تصحيح إعتقادات الإمامية	الشيخ المفيد	Masaha	220	0.29277
		 الميزان الذرية المبينة لعقائد الفرق العلية 	 عبد الوهاب الشعراني 	ABLibrary	8835	0.29276
		 بحوث في الملل والنحل 	 الشيخ السبحاني 	ABLibrary	8357	0.29275
		بهجة قلوب الأبرار وقرة عيون الأخيار في شرح جوامع الأخبار	أبو عبد الله، عبد الرحمن بن ناصر بن عبد الله بن ناصر بن حمد آل سعدي (المتوفى: 1376هـ)	ShamAY	31304	0.29274
		إنك خلقت للأمومة .. ولن تثنيك أفواههم المسمومة	أحمد بن محمد السعيد العزيزى	ShamAY	33447	0.29273
		التفسير والمفسّرون في ثوبه القشيب [ج ١]	محمّد هادي معرفة	Rafed	4026	0.29273
		هداية القرآن للتي هي أقوم	علي بن نايف الشحود	ShamAY	159	0.29271
		شرح كتاب الصيام من تقريب الأسانيد	عبد الكريم الخضير	ShamelaY19	23839	0.29271
		استقصاء النّظر في القضاء والقدر	الحسن بن يوسف بن علي المطّهر [ العلامة الحلّي ]	Rafed	3422	0.29271
		المعجزة القرآنيّة	الدكتور محمد حسن هيتو	Rafed	3435	0.2927
		طريق الهجرتين - دار ابن القيم	محمد بن أبي بكر أيوب الزرعي أبو عبد الله	ShamAY	34427	0.29269
		النور المبين في قصص الأنبياء والمرسلين	السيد نعمة الله الجزائري	Masaha	4680	0.29269
		دلائل النبوة ومعرفة أحوال صاحب الشريعة	أحمد بن الحسين بن علي بن موسى الخُسْرَوْجِردي الخراساني، أبو بكر البيهقي (المتوفى: 458هـ)	ShamAY	7478	0.29265
		الرد على الأخنائي واستحباب زيارة خير البرية - ت المعلمي	ابن تيمية	ShamAY	34360	0.29264
		بيان التوحيد الذي بعث الله به الرسل جميعا وبعث به خاتمهم محمدا عليه السلام	عبد العزيز بن عبد الله بن باز (المتوفى: 1420ه)	Sham19Y	30822	0.29263
		اكاذيب الوهابيه	صالح ورداني	Ghbook	10930	0.29263
		المرأة في ظلّ الإسلام	السّيدة مريم نور الدّين فضل الله	Masaha	1730	0.29262
		قاعدة جليلة في التوسل والوسيلة	تقي الدين أبو العباس أحمد بن عبد الحليم بن عبد السلام بن عبد الله بن أبي القاسم بن محمد ابن تيمية الحراني الحنبلي الدمشقي (المتوفى: 728هـ)	ShamAY	22649	0.29261
		 الرحيق المختوم 	 صفي الرحمان مباركفوري 	ABLibrary	7530	0.29261
		 شرح الشفاء ( شرح ملا علي القاري ) 	 القاضي عياض 	ABLibrary	8456	0.29261
		مَعالِمُ الطَّريقِ في ظلالِ القُرآنِ	علي بن نايف الشحود	ShamAY	36749	0.29259
		الرسائل الأحمدية - الجزء1	الشيخ أحمد آل طعان البحراني	Masaha	1796	0.29258
		قطر الولي على حديث الولي = ولاية الله والطريق إليها	محمد بن علي بن محمد بن عبد الله الشوكاني اليمني (المتوفى: 1250هـ)	ShamAY	6886	0.29256
		الأمثل في تفسير كتاب الله المنزل - الجزء2	الشيخ ناصر مكارم الشيرازي	Masaha	95	0.29256
		شرح مقدمة التفسير لابن تيمية - العثيمين	محمد بن صالح بن محمد العثيمين (المتوفى: 1421ه)	Sham19Y	21521	0.29255
		شرح الورقات في أصول الفقه - الددو	محمد الحسن ولد محمد الملقب بـ"الددو" الشنقيطي	ShamAY	7689	0.29254
		فاكهة الخلفاء ومفاكهة الظرفاء	أبو محمد أحمد بن محمد، المعروف بابن عربشاه (المتوفى: 854هـ)	ShamAY	12726	0.29254
		الشّهيد مسلم بن عقيل(ع)	السيد عبد الرزاق المقرم	Masaha	1702	0.29253
		اللّباب في علوم الكتاب [ج ٨]	أبي حفص عمر بن علي بن عادل الدمشقي الحنبلي	Rafed	3100	0.29251
		من مخازي الرافضة عبر التاريخ	-	ShamAY	588	0.2925
		تاريخ مكة المشرفة والمسجد الحرام والمدينة الشريفة والقبر الشريف‏  - الجزء1	محمد بن أحمد ابن ضياء	Masaha	4140	0.29249
		فقه أشراط الساعة	محمد بن أحمد بن إسماعيل المقدم	ShamAY	31964	0.29248
		الفوائد المدنيّة	محمّد أمين الإسترابادي	Rafed	1325	0.29248
		مفهوم الحرية بين الإسلام والجاهلية	علي بن نايف الشحود	ShamAY	1608	0.29246
		الإنسانُ بينَ الدَّيْنُونةِ للهِ والدَّيْنونةِ لغيرهِ	علي بن نايف الشحود	ShamAY	346	0.29246
		الفوائد المشوّق إلى علوم القرآن وعلم البيان	شمس الدّين محمّد بن أبي بكر بن أيّوب الزّرعي [ ابن قيّم الجوزيّة ]	Rafed	864	0.29246
		الجديد في تفسير القرآن المجيد	محمد بن حبيب الله سبزواري نجفي	Ghbook	2680	0.29246
		موسوعة الدين النصيحة 1-5	الواحدي :: علي بن نايف الشحود	ShamAY	36104	0.29245
		المعيار و الموازنة في فضائل الإمام أمير المؤمنين علي بن أبي طالب(ع)	جعفر بن محمد الإسكافي‏	Masaha	2874	0.29245
		الأصول العامة في الفقه المقارن	السيد محمد تقي الحكيم	Masaha	4052	0.29245
		تفسير العثيمين: جزء عم	محمد بن صالح بن محمد العثيمين (المتوفى: 1421هـ)	ShamAY	21808	0.29244
		الأحكام السلطانية للماوردي	أبو الحسن علي بن محمد بن محمد بن حبيب البصري البغدادي، الشهير بالماوردي (المتوفى: 450ه)	ShamelaY19	22881	0.29243
		تفسير الثعالبي = الجواهر الحسان في تفسير القرآن	أبو زيد عبد الرحمن بن محمد بن مخلوف الثعالبي (المتوفى: 875ه)	ShamelaY19	23618	0.29241
		دراسات تاريخيّة من القرآن الكريم [ج ٤]	دكتور محمد بيومي مهران	Rafed	1791	0.29241
		تفسير من وحي القرآن [ج ١٠]	السيد محمد حسين فضل الله	Rafed	3272	0.29241
		الإعجاز العلمي في القرآن الكريم - جامعة المدينة	مناهج جامعة المدينة العالمية	ShamAY	1659	0.2924
		فيض الباري على صحيح البخاري	(أمالي) محمد أنور شاه بن معظم شاه الكشميري الهندي ثم الديوبندي (المتوفى: 1353ه)	ShamelaY19	98124	0.2924
		فقه الرد	بسام الغانم العطاوي	ShamAY	36195	0.29239
		الصراط المستقيم إلى مستحقي التقديم‏ - الجزء1	الشيخ علي النباطي‏	Masaha	2048	0.29239
		غياث الأمم في التياث الظلم - دار الدعوة	عبد الملك بن عبد الله بن يوسف الجويني أبو المعالي	ShamAY	34346	0.29238
		البلاغة العالية في آية المداينة		ShamAY	36866	0.29238
		دراسه تحليله في السيره النبويه عصرها قبل الهجره	عباس زريابخويي	Ghbook	5290	0.29238
		قصص الأنبياء	أبو الفداء إسماعيل بن عمر بن كثير القرشي البصري ثم الدمشقي (المتوفى: 774ه)	Sham19Y	932	0.29237
