automatic URI	Proposed URI	bookTitle	authorName	collection	id	tfidf
		 موسوعة الإمام العسكري ( ع ) 	 الشيخ أبو القاسم الخزعلي 	ABLibrary	7849	0.26274
		فتح القدير للكمال ابن الهمام	كمال الدين محمد بن عبد الواحد السيواسي المعروف بابن الهمام (المتوفى: 861هـ)	ShamAY	21744	0.26273
		نفحات الأزهار في خلاصة عبقات الأنوار [ج ٨]	السيّد علي الحسيني الميلاني	Rafed	437	0.26273
		العجاب في بيان الأسباب	أبو الفضل أحمد بن علي بن محمد بن أحمد بن حجر العسقلاني (المتوفى: 852هـ)	ShamAY	2102	0.26271
		كتاب الزكاة والصوم والحج - اللهيمد	سليمان اللهيميد	ShamAY	34759	0.26271
		 الرحلة المعينية 	 ماء العينين بن العتيق 	ABLibrary	9108	0.26271
		قوارب النجاة في حياة الدعاة	فتحي يكن	ShamAY	33403	0.26269
		نزول القران الكريم وتاريخه وما يتعلق به	الدكتور محمد عمر حويه	ShamAY	12112	0.26269
		الباعث على شرح الحوادث	أبو عبد الرحمن مقبل بن هادي بن مقبل بن قائدة (اسم رجل) الهمداني الوادعي (المتوفى: 1422ه)	ShamelaY19	96842	0.26269
		التذكرة في أحوال الموتى وأمور الآخرة - ط العصرية	أبو عبد الله محمد بن أحمد بن أبي بكر بن فرح الأنصاري الخزرجي شمس الدين القرطبي (المتوفى: 671هـ)	ShamAY	33760	0.26268
		ارشاد الطالبين الى نهج المسترشدين	جمال الدين مقداد بن عبد الله السيوري الحلّي	Rafed	3450	0.26268
		الأنوار البهية في القواعد الفقهية	السيد تقي الطباطبائي القمي	Masaha	2417	0.26268
		رفع الملام عن الأئمة الأعلام	تقي الدين أبو العَباس أحمد بن عبد الحليم بن عبد السلام بن عبد الله بن أبي القاسم بن محمد ابن تيمية الحراني الحنبلي الدمشقي (المتوفى: 728هـ)	ShamAY	4118	0.26267
		من أحكام سورة المائدة	د. سعيد بن علي بن وهف القحطاني	ShamAY	1889	0.26267
		الهداية على مذهب الإمام أبي عبد الله أحمد بن محمد بن حنبل الشيباني	محفوظ بن أحمد بن الحسن، أبو الخطاب الكلوذاني	ShamelaY19	26094	0.26267
		حكم الإسلام في الاختلاط		ShamAY	36335	0.26266
		اللامع العزيزي شرح ديوان المتنبي	أبو العلاء أحمد بن عبد الله المعري (363 - 449 ه)	ShamelaY19	29591	0.26265
		الوعد المنجَّز في نقد النَّصِّ المؤسَّس	صلاح بن علي الزيات	ShamAY	35508	0.26264
		بحار الأنوار [ج ٢٥]	الشيخ محمّد باقر بن محمّد تقي المجلسي	Rafed	897	0.26264
		فِقْهُ الأُسرةِ المسلِمة معالِمُ تربويَّةُ لأسرةٍ راشدةٍ	المهندس. عبد اللطيف البريجاوي	ShamAY	36111	0.26263
		علم الأخلاق الإسلامية	مقداد يالجن محمد علي	Sham19Y	11293	0.26263
		فتح ذي الجلال والإكرام بشرح بلوغ المرام ط المكتبة الإسلامية	محمد بن صالح العثيمين	Sham19Y	29558	0.26263
		 إيصال الطالب إلى المكاسب 	 السيد محمد الحسيني الشيرازي 	ABLibrary	9472	0.26262
		نحو المعالي	محمد أحمد الراشد	ShamAY	33345	0.26261
		مفاتيح للتعامل مع القرآن	د صلاح عبد الفتاح الخالدي	ShamelaY19	38071	0.26261
		رسائل آل طوق القطيفي [ج ١]	الشيخ أحمد آل طوق	Rafed	1407	0.26261
		المعاملات والمقاصد	د. عبد الله بن بيّة	ShamAY	36289	0.2626
		التقدم والرجعية	أبو شكيب محمد تقي الدين بن عبد القادر الهلالي (المتوفى: 1407هـ)	ShamAY	1433	0.2626
		 إظهار الحق 	 رحمة الله بن خليل الرحمن الهندي 	ABLibrary	8338	0.26258
		 منتهى المدارك في شرح تائية ابن فارض 	 محمد بن أحمد الفرغاني 	ABLibrary	8785	0.26257
		اتقاء الحرام والشبهات في طلب الرزق	أحمد بن أحمد محمد عبد الله الطويل	ShamAY	32090	0.26256
		كيف يستفيد طالب العلم من كتب السنة	عبد الكريم بن عبد الله بن عبد الرحمن بن حمد الخضير	ShamelaY19	25976	0.26256
				ShamAY	37976	0.26255
		تيسير البيان لأحكام القرآن	محمد بن علي بن عبد الله بن إبراهيم بن الخطيب اليمني الشافعي المشهور بـ «ابن نور الدين» (المتوفى: 825 هـ)	ShamAY	37998	0.26255
		 عجائب الهند بره وبحره 	 بزرگ بن شهريار الرامهرمزي 	ABLibrary	9138	0.26254
		الرسالة الباهرة للإمام ابن حزم الظاهري	أبو محمد علي بن أحمد بن سعيد بن حزم الأندلسي (المتوفى: 456هـ)	ShamAY	37500	0.26252
		دستور الأخلاق في القرآن	محمد بن عبد الله دراز (المتوفى: 1377هـ)	ShamAY	8665	0.26251
		الفروق اللغوية للعسكري	أبو هلال الحسن بن عبد الله بن سهل بن سعيد بن يحيى بن مهران العسكري (المتوفى: نحو 395هـ)	ShamAY	10414	0.26251
		كفاية المستزيد بشرح كتاب التوحيد	الشيخ صالح بن عبد العزيز آل الشيخ	ShamAY	35570	0.2625
		شرح كتاب الإيمان لأبي عبيد - الراجحي	عبد العزيز بن عبد الله بن عبد الرحمن الراجحي	ShamAY	51	0.2625
		 كتاب الشكوك على كلام فاضل الأطباء جالينوس 	 محمد بن زكريا الرازي 	ABLibrary	9816	0.2625
		نظام الحكومة النبوية - الجزء1	عبد الحي الكتاني‏	Masaha	3105	0.2625
		دروس الدكتور راغب السرجاني	راغب السرجاني	ShamAY	850	0.26249
		دعوي السفاره في الغيبه الكبري	محمد السند	Ghbook	6655	0.26249
		الفتاوى الفقهية الكبرى	أحمد بن محمد بن علي بن حجر الهيتمي السعدي الأنصاري، شهاب الدين شيخ الإسلام، أبو العباس (المتوفى: 974هـ)	ShamAY	21628	0.26248
		الصحيح من سيرة النبي الأعظم صلّى الله عليه وآله [ج ٤]	السيد جعفر مرتضى العاملي	Rafed	2482	0.26248
		 تسليك النفس الى حظيرة القدس 	 العلامة الحلي 	ABLibrary	8383	0.26248
		أنس الملا بوحش الفلا	جلال الدين، محمد بن محمود بن منكلي بوغا القاهري (المتوفى: 784هـ)	ShamAY	5362	0.26247
		الأساس في السنة وفقهها - العقائد الإسلامية	سعيد حوى (المتوفى 1409 ه)	ShamelaY19	18338	0.26247
		التصوير القرآني للقيم الخلقية والتشريعية	علي علي صبح	ShamAY	23142	0.26245
		حروب صلاح الدين وفتح بيت المقدس «وهو الكتاب المسمى الفتح القسي في الفتح القدسي»	أبو عبد الله، محمد بن (محمد صفي الدين) ابن (نفيس الدين حامد) بن أُلْه، عِمَاد الدِّين الكاتب الأصبهاني (المتوفى: 597هـ)	ShamAY	32076	0.26245
		التناسب في سورة البقرة		ShamAY	36870	0.26245
		المدرّس الأفضل [ج ٤]	الشيخ محمّد علي المدرّس الأفغاني	Rafed	2684	0.26245
		الطّرائف في معرفة مذاهب الطوائف	السيّد رضي الدين أبو القاسم علي بن موسى بن جعفر بن طاووس الحسني الحلّي [ السيّد بن طاووس ]	Rafed	3590	0.26244
		الفصول المهمة في معرفة الأئمة(ع) - الجزء1	ابن صباغ المالكي‏	Masaha	2915	0.26243
		آخر الزمان	خالد فائق صديق العبيدي	ShamAY	34099	0.26242
		التوازن التربوي وأهميته لكل مسلم	مجدي الهلالي	ShamAY	267	0.26241
		الدعوة الإصلاحية في بلاد نجد على يد الإمام محمد بن عبد الوهاب وأعلامها من بعده	عبد الله بن محمد بن عبد المحسن المطوع	ShamAY	7615	0.26241
		شرح العمدة في بيان مناسك الحج والعمرة المؤلف: تقي الدين أبو العباس أحمد بن عبد الحليم بن عبد السلام بن عبد الله بن أبي القاسم بن محمد ابن تيمية الحراني الحنبلي الدمشقي (المتوفى: 728 ه)	ابن تيمية	Sham19Y	10810	0.2624
		شرح زيارة الغدير	السيّد عبدالمطلب الموسوي الخرسان	Rafed	3061	0.26239
		دفاع عن التشيع	السيد نذير الحسني	Masaha	255	0.26239
		دعوي السفاره في الغيبه الكبري (2)	محمد السند	Ghbook	8423	0.26239
		الإمام المهدي عج عند اهل السنة - الجزء1	السيد مهدي فقيه ايماني	Masaha	4050	0.26238
		مكانه القرآن الكريم في المجتمع الاسلامي	آيت الله العظمي سيد محمد حسيني شيرازي	Ghbook	8011	0.26238
		أسئلة وأجوبة في إعراب القرآن	عبد الله بن يوسف بن أحمد بن عبد الله ابن يوسف، أبو محمد، جمال الدين، ابن هشام (المتوفى: 761هـ)	ShamAY	7501	0.26237
		الإتقان والإحكام في شرح تحفة الحكام المعروف بشرح ميارة	أبو عبد الله، محمد بن أحمد بن محمد الفاسي، ميارة (المتوفى: 1072هـ)	ShamAY	21643	0.26236
		المغرب في حلى المغرب	أبو الحسن على بن موسى بن سعيد المغربي الأندلسي (المتوفى: 685هـ)	ShamAY	6633	0.26236
		النكت والفوائد السنية على مشكل المحرر لمجد الدين ابن تيمية	إبراهيم بن محمد بن عبد الله بن محمد ابن مفلح، أبو إسحاق، برهان الدين (المتوفى: 884ه)	Sham19Y	6094	0.26236
		التنبيه على حدوث التصحيف	حمزة بن الحسن الأصفهاني (280 - 360 ه)	Sham19Y	18257	0.26236
		مناظرات [ج ٣]	الشيخ عبد الله الحسن	Rafed	1504	0.26236
		 اعتقادات فرق المسلمين والمشركين 	 فخر الدين الرازي 	ABLibrary	8341	0.26236
		يسئلونك عن ... الاسئله المطروحه علي النبي الاكرم صلي الله عليه واله و سلم في الق...	آيت الله العظمي ناصرمكارم شيرازي	Ghbook	11971	0.26236
		الباعث على شرح الحوادث	أَبِو عَبد الرَّحمَن مُقْبلُ بنُ هَادِي بنِ مُقْبِلِ بنِ قَائِدَةَ (اسم رجل) الهَمْدَاني الوادعِيُّ (المتوفى: 1422هـ)	ShamAY	2005	0.26235
		اللباب في علل البناء والإعراب	أبو البقاء عبد الله بن الحسين بن عبد الله العكبري البغدادي محب الدين (المتوفى: 616هـ)	ShamAY	6986	0.26234
		خلاصه معرفيه	محمد السند	Ghbook	15180	0.26232
		الحليه اللامعه للبهجه المرضيه	محمد باقربن محمدنقي شفتي بيدآبادي	Ghbook	13084	0.26232
		تفسير القرآن العظيم [ج ١]	أبي الفداء اسماعيل بن عمر ابن كثير الدمشقي	Rafed	3407	0.26231
		حقيقة العبودية	مجدي الهلالي	ShamAY	278	0.2623
		شرح تفسير ابن كثير - الراجحي	عبد العزيز بن عبد الله بن عبد الرحمن الراجحي	ShamAY	112	0.2623
		شرح اللّمع في النحو	أبي الفتح عثمان بن جنّي	Rafed	2232	0.2623
		تبصير الناسك بأحكام المناسك	الواحدي :: وليد السعيدان	ShamAY	36201	0.26229
		نهاية الأرب في أخبار الفرس والعرب	مجهول من أهل القرن الثاني الهجري	ShamAY	33835	0.26228
		الطبّ النبوي	شمس الدّين محمّد بن أبي بكر بن أيّوب الزّرعي [ ابن قيّم الجوزيّة ]	Rafed	1430	0.26228
		الإنصاف في مسائل الخلاف بين النّحويين : البصريّين والكوفييّن [ج ١]	كمال الدين أبي البركات عبد الرحمن بن محمّد بن أبي سعيد الأنباري النحوي [ ابن انباري ]	Rafed	1878	0.26228
		التوحيد وبيان العقيدة السلفية النقية	عبد الله بن محمد بن عبد العزيز بن عبد الرحمن بن حسين بن حميد (المتوفى: 1402هـ)	ShamAY	8588	0.26227
		من فتاوى الشيخ محمد الأمين الشنقيطي	الشنقيطي، محمد الأمين	ShamAY	37670	0.26227
		كليلة ودمنة	عبد الله بن المقفع (المتوفى: 142 ه) (ترجمة لكتاب الفيلسوف الهندي بيدبا)	ShamelaY19	26537	0.26227
		السيرة النبوية كما جاءت في الأحاديث الصحيحة	أبو عمر، محمد بن حمد الصوياني	ShamelaY19	123668	0.26227
		نجعه المرتاد	محمد رضا نجفي	Ghbook	11138	0.26227
		مقدمة أبي الليث السمرقندي	الواحدي :: أبو الليث السمرقندي	ShamAY	36180	0.26226
		تمام نهج البلاغه	جمعي از راويان	Ghbook	15393	0.26226
		قصة الحضارة	وِل ديورَانت = ويليام جيمس ديورَانت (المتوفى: 1981 م)	ShamAY	224	0.26225
		السمو الروحي الأعظم والجمال الفني في البلاغة النبوية	مصطفى صادق بن عبد الرزاق بن سعيد بن أحمد بن عبد القادر الرافعي (المتوفى: 1356ه)	Sham19Y	36191	0.26224
		علي مع القرآن وليس المذهب	عبد الرحمن دمشقية	ShamAY	35686	0.26223
		موسوعة عبد الله بن عبّاس [ج ٥]	السيد محمد مهدي السيد حسن الموسوي الخرسان	Rafed	1173	0.26223
		القواعد و الفوائد و الاجتهاد و التقليد (مفاتيح الأصول)	السيد محمد الطباطبائي المجاهد	Masaha	1456	0.26222
		الجيل الموعود بالنصر والتمكين	مجدي الهلالي	ShamAY	268	0.26221
		ثلاثية البردة بردة الرسول صلى الله عليه وآله وسلم	حسن حسين (المتوفى: معاصر)	ShamAY	9792	0.26221
		شرح الزيارة الجامعة الكبيرة	الشيخ محمّد باقر بن محمّد تقي المجلسي	Rafed	2804	0.26221
		توضيح الرشاد في تاريخ حصر الاجتهاد	الشيخ آقا بزرك الطهراني	Masaha	3620	0.26221
		إرشاد العباد في فضل الجهاد - سلسلة لقاء العشر الأواخر بالمسجد الحرام (14)	حسن بن إبراهيم بن حسن بن محمد، المعروف بالبيطار (المتوفى: 1272 هـ)	ShamAY	32398	0.2622
		الإرشاد إلى توحيد رب العباد	عبد الرحمن بن حماد آل عمر	ShamAY	31	0.2622
		نهج البيان عن كشف معاني القرآن [ج ٤]	محمّد بن الحسن الشيباني	Rafed	1638	0.2622
		أساليب الدعوة إلى الله في القرآن الكريم	أبو المجد سيد نوفل	ShamelaY19	22748	0.26219
		 الشامل في أصول الدين 	 عبد الملك الجويني 	ABLibrary	8449	0.26219
		الشيعه في الاسلام	محمد حسين طباطبايي	Ghbook	12217	0.26219
		شرح صحيح مسلم للقاضى عياض المسمى إكمال المعلم بفوائد مسلم	عياض بن موسى بن عياض بن عمرون اليحصبي السبتي، أبو الفضل (المتوفى: 544ه)	ShamelaY19	122406	0.26218
		المكاسب المحرمه (للاراكي)	محمد علي اراكي	Ghbook	15435	0.26218
		اليسر والسماحة في الإسلام	فالح بن محمد الصغير	ShamAY	1138	0.26214
		كشف اليقين فى فضائل أمير المؤمنين(ع)	العلامة الحلي	Masaha	4583	0.26214
		حاضر العالم الإسلامي	على جريشه ومحمود محمد سالم	ShamAY	10746	0.26213
		 نور العيون وجامع الفنون 	 صلاح الدين بن يوسف الكحال الحموي 	ABLibrary	9932	0.26212
		 تاريخ المستبصر 	 ابن المجاور 	ABLibrary	9001	0.26212
		الاسس المنهجيه في تفسير النص القرآني	عدي جواد علي الحجار	Ghbook	12282	0.26212
		 كتاب الماء 	 ابن الذهبي 	ABLibrary	7942	0.26211
		صفوة الاعتبار بمستودع الأمصار والأقطار  - الجزء1	محمد مصطفى بيرم الخامس	Masaha	4581	0.26211
		الهجمات المغرضة على التاريخ الإسلامي	محمد مظهر صديقي	Sham19Y	9268	0.2621
		الفصول المفيدة في الواو المزيدة	صلاح الدين أبو سعيد خليل بن كيكلدي بن عبد الله الدمشقي العلائي (المتوفى: 761هـ)	ShamAY	6984	0.26208
		الكلمات البينات في قوله تعالى: {وبشر الذين آمنوا وعملوا الصالحات أن لهم جنات}	مرعي بن يوسف بن أبى بكر بن أحمد الكرمى المقدسي الحنبلى (المتوفى: 1033ه)	ShamelaY19	36076	0.26208
		المثل العليا في الإسلام (ضمن «المحاضرات» المطبوعة ب «بآثار الشنقيطي»)	محمد الأمين بن محمد المختار الجكني الشنقيطي (1325 - 1393)	ShamelaY19	18667	0.26208
		الحاشية على مدارك الأحكام - الجزء1	الوحيد البهبهاني	Masaha	1446	0.26208
		الجواهر الفخرية في شرح الروضة البهية - الجزء1	الشيخ قدرت الله وجداني فخر	Masaha	4868	0.26208
		شرح التسهيل لابن مالك	محمد بن عبد الله، ابن مالك الطائي الجياني، أبو عبد الله، جمال الدين (المتوفى: 672هـ)	ShamAY	31770	0.26207
		كيف أتوب	أبو العلاء محمد بن حسين بن يعقوب السلفي المصري	Sham19Y	98089	0.26207
		العباس بن علي عليهما السلام	باقر شريف القرشي	Rafed	14	0.26207
		مطارح الأنظار [ج ٢]	الميرزا أبو القاسم الكلانتري الطهراني	Rafed	993	0.26207
		شرح العمدة في بيان مناسك الحج والعمرة المؤلف: تقي الدين أبو العباس أحمد بن عبد الحليم بن عبد السلام بن عبد الله بن أبي القاسم بن محمد ابن تيمية الحراني الحنبلي الدمشقي (المتوفى: 728 هـ)	ابن تيمية	ShamAY	32298	0.26206
		الآداب الطبيه في الاسلام مع لمحه عن تاريخ الطب	سيد جعفرمرتضي حسيني عاملي	Ghbook	16471	0.26206
		قَشْر الفَسْر	العميد أبو سهل محمد بن الحسن العارض الزَّوزَني (المتوفى: نحو 445هـ)	ShamAY	869	0.26205
		نظرية النظم وقراءة الشعر عند عبد القاهر الجرجاني	محمود توفيق محمد سعد	ShamAY	34505	0.26205
		شرح أَلْفِيَّةِ السُّيوطي في الحديث المسمى «إسعاف ذوي الوَطَر بشرح نظم الدُّرَر في علم الأثر»	الشيخ محمد ابن العلامة علي بن آدم ابن موسى الأثيوبي الولوي	ShamAY	469	0.26205
		تراثنا ـ العدد [ 21 ]	مؤسسة آل البيت عليهم السلام لإحياء التراث ـ قم	Rafed	2741	0.26205
		 حواريات فقهية 	 السيد محمد سعيد الحكيم 	ABLibrary	9615	0.26204
		الروض المربع شرح زاد المستنقع في اختصار المقنع	منصور بن يونس بن إدريس البهوتي (المتوفى: 1051هـ)	ShamAY	34262	0.26203
		الشناعة على من رد أحاديث الشفاعة (رد على مصطفى محمود)	أبو محمد عبد الكريم بن صالح بن عبد الكريم الحميد	ShamelaY19	96159	0.26203
		الانتصار للسلف الأخيار: نقد لكتاب «أسماء الله الحسنى» للدكتور: محمود عبدالرازق الرضواني	محمد محب الدين أبو زيد	ShamelaY19	19449	0.26203
		 منهاج الملة في بيان الوقت والقبلة 	 الشيخ علي الغروي 	ABLibrary	9397	0.26203
		مباحث حول نبوة سيدالانبياء (صلي الله عليه و آله)	محمد السند	Ghbook	15228	0.26203
		البحث الدلالي عند العلامة السيوطي	عادل سعدون القرشي	ShamAY	37242	0.26202
		اعتماد دعوة الشيخ محمد بن عبد الوهاب على الكتاب والسنة (مطبوع ضمن بحوث ندوة دعوة الشيخ محمد بن عبد الوهاب، الجزء الأول)	عبد العزيز بن محمد بن إبراهيم آل الشيخ (المتوفى: 1426هـ)	ShamAY	7510	0.26201
		جامع تراث العلامة الألباني في الفقه	د. شادي بن محمد بن سالم آل نعمان	Sham19Y	145204	0.262
		شرح رسالة رفع الملام عن الأئمة الأعلام	يوسف بن محمد علي الغفيص	ShamAY	31671	0.26199
		 رسائل ابن حزم الأندلسي 	 ابن حزم 	ABLibrary	8432	0.26199
		تيسير التحرير	محمد أمين بن محمود البخاري المعروف بأمير بادشاه الحنفي (المتوفى: 972 هـ)	ShamAY	32376	0.26198
		مبادي الايمان	محمد حسين آل كاشف الغطاء	Ghbook	11122	0.26198
		البدرُ التمام شرح بلوغ المرام	الحسين بن محمد بن سعيد اللاعيّ، المعروف بالمَغرِبي (المتوفى: 1119 هـ)	ShamAY	32509	0.26196
		القرآن وليلة القدر	محمد الغزالي	ShamAY	36726	0.26196
		تنبيه الغافلين عن أعمال الجاهلين وتحذير السالكين من أفعال الجاهلين	محيي الدين أبو زكريا أحمد بن إبراهيم ابن النحاس الدمشقي (المتوفى: 814 ه)	ShamelaY19	35453	0.26196
		 المرتقى إلى الفقه الأرقى ( كتاب الزكاة ) 	 السيد محمد الروحاني 	ABLibrary	9468	0.26196
		زاد الداعية إلى الله (مطبوع ضمن كتاب الصيد الثمين في رسائل ابن عثيمين)	محمد بن صالح بن محمد العثيمين (المتوفى: 1421ه)	ShamelaY19	21579	0.26195
		مطالب أولي النهى في شرح غاية المنتهى	مصطفى بن سعد بن عبده السيوطي شهرة، الرحيبانى مولدا ثم الدمشقي الحنبلي (المتوفى: 1243ه)	ShamelaY19	21677	0.26195
		المفيد في مهمات التوحيد	الدكتور عبد القادر بن محمد عطا صوفي	ShamAY	8672	0.26194
		 خطط الشام 	 محمد كرد علي 	ABLibrary	9057	0.26193
		الرسالة الموضحة في ذكر سرقات أبي الطيب المتنبي وساقط شعره	محمد بن الحسن بن المظفر الحاتمي، أبو علي (المتوفى: 388هـ)	ShamAY	777	0.26192
		الطرق الحكمية في السياسة الشرعية	محمد بن أبي بكر أيوب الزرعي ابن القيم أبو عبد الله	ShamAY	34418	0.26192
		دلائل الصدق لنهج الحق [ج ٥]	الشيخ محمد حسن المظفر	Rafed	252	0.26192
		تسهيل المناسك	عبد الكريم بن صنيتان العمري	ShamAY	11096	0.26191
		خصائص التعبير القرآني وسماته البلاغية	عبد العظيم إبراهيم محمد المطعني (المتوفى: 1429هـ)	ShamAY	21785	0.26191
		آيات الغدير	مركز المصطفى	Masaha	22	0.26191
		أثر الاختلاف في القواعد الأصولية في اختلاف الفقهاء	محمد حسن عبد الغفار	ShamelaY19	37648	0.2619
		مدارك الأحكام في شرح شرائع الإسلام - الجزء1	محمد بن علي الموسوي العاملي	Masaha	1185	0.2619
		عودة الحجاب	محمد أحمد إسماعيل المقدم	Sham19Y	9133	0.26189
		الفصل والوصل في القرآن الكريم	منير سلطان	ShamelaY19	22883	0.26186
		الكشف والبيان [ج ٧]	أبو إسحاق أحمد [ الثّعلبي ]	Rafed	1669	0.26185
		تعليقة على معالم الأصول - الجزء1	السيد علي الموسوي القزويني	Masaha	3267	0.26185
		الرد على الوهابية	الشيخ محمد جواد البلاغي	Rafed	244	0.26184
		شخصيات من الحرمين الشريفين: مجموعه من الباحثين	مركز تحقيقات حج	Ghbook	11360	0.26184
