automatic URI	Proposed URI	bookTitle	authorName	collection	id	tfidf
		الذّريعة إلى تصانيف الشّيعة - الجزء1	الشيخ آقا بزرك الطهراني	Masaha	1670	0.26813
		الجامع لعلوم الإمام أحمد - المقدمات	خالد الرباط، سيد عزت عيد [بمشاركة الباحثين بدار الفلاح]	ShamelaY19	20875	0.26768
		تراثنا ـ العدد [ 20 ]	مؤسسة آل البيت عليهم السلام لإحياء التراث ـ قم	Rafed	2740	0.2676
		تاريخ وفاة الشيوخ الذين أدركهم البغوي	أبو القاسم عبد الله بن محمد بن عبد العزيز بن المرزبان بن سابور بن شاهنشاه البغوي (المتوفى: 317ه)	ShamelaY19	27106	0.26701
		 الضوء اللامع لأهل القرن التاسع 	 شمس الدين السخاوي 	ABLibrary	948	0.26674
		طبقات المفسرين للداوودي	محمد بن علي بن أحمد، شمس الدين الداوودي المالكي (المتوفى: 945هـ)	ShamAY	1451	0.26668
		 نفح الطيب من غصن الأندلس الرطيب 	 أحمد بن محمد المقري التلمساني 	ABLibrary	9299	0.26665
		العقد الثّمين في تاريخ البلد الأمين [ج ١]	تقي الدين محمّد بن أحمد الحسني الفاسي المكّي	Rafed	2209	0.26658
		الرسالة المستطرفة محققة ومعها والتعليقات المستظرفة	الكتاني، محمد بن جعفر	ShamAY	37613	0.26652
		التحصيل من المحصول	سراج الدين محمود بن أبي بكر الأرْمَوي (المتوفى: 682 هـ)	ShamAY	37994	0.26642
		 العقد الثمين في تاريخ البلد الأمين 	 محمد بن أحمد الفاسي 	ABLibrary	9144	0.26629
		الذّريعة إلى تصانيف الشّيعة [ج ١٤]	الشيخ آقا بزرك الطهراني	Rafed	466	0.26628
		 أقوم المسالك في معرفة أحوال الممالك 	 خير الدين التونسي 	ABLibrary	8935	0.26612
		تراثنا ـ العدد [ 17 ]	مؤسسة آل البيت عليهم السلام لإحياء التراث ـ قم	Rafed	2737	0.26611
		نفح الطّيب [ج ٣]	الشيخ أحمد بن محمد المقري التلمساني	Rafed	2799	0.26596
		تراثنا ـ العدد [ 65 ]	مؤسسة آل البيت عليهم السلام لإحياء التراث ـ قم	Rafed	3279	0.26563
		تحفة الطالبين في ترجمة الإمام محيي الدين	علي بن إبراهيم بن داود بن سلمان بن سليمان، أبو الحسن، علاء الدين ابن العطار (المتوفى: 724هـ)	ShamAY	321	0.26549
		تاريخ الإسلام ووفيات المشاهير والأعلام [ج ٣٥]	شمس الدين محمّد بن أحمد بن عثمان الذّهبي	Rafed	3580	0.26532
		تراجم الرجال - الجزء1	السيد أحمد الحسيني	Masaha	549	0.26499
		لوائح الأنوار السنية ولواقح الأفكار السنية «شرح قصيدة ابن أبي داود الحائية في عقيدة أهل الآثار السلفية»	محمد بن أحمد بن سالم السفاريني الحنبلي	ShamAY	38505	0.26499
		 رحلة ابن معصوم المدني ( سلوة الغريب وأسوة الأريب ) 	 السيد علي صدر الدين المدني ( ابن معصوم ) 	ABLibrary	9080	0.26483
		زيادات واستدراكات ألحقها محققا النعت الأكمل بالكتاب من وفاة المؤلف حتى نهاية القرن الرابع عشر الهجري	محمد مطيع الحافظ	Sham19Y	147072	0.26474
		سلك الدرر في أعيان القرن الثاني عشر	محمد خليل بن علي بن محمد بن محمد مراد الحسيني، أبو الفضل (المتوفى: 1206هـ)	ShamAY	9607	0.26454
		محمد بن عبد الوهاب مصلح مظلوم ومفترى عليه	مسعود الندوي	ShamAY	1510	0.26453
		معجم المطبوعات العربية والمعربة	يوسف بن إليان بن موسى سركيس (المتوفى: 1351هـ)	ShamAY	1242	0.26451
		جلاء العينين في محاكمة الأحمدين	نعمان بن محمود بن عبد الله، أبو البركات خير الدين، الآلوسي (المتوفى: 1317هـ)	ShamAY	9943	0.26446
		تاريخ الإسلام ووفيات المشاهير والأعلام [ج ٤٦]	شمس الدين محمّد بن أحمد بن عثمان الذّهبي	Rafed	3640	0.26432
		طبقات المفسرين للداوودي - ط العلمية = التراجم	محمد بن علي بن أحمد، شمس الدين الداوودي المالكي (المتوفى: 945هـ)	ShamAY	38009	0.26406
		 العقد الثمين في تاريخ البلد الأمين 	 محمد بن أحمد الفاسي 	ABLibrary	9141	0.26383
		تراثنا ـ العدد [ 29 ]	مؤسسة آل البيت عليهم السلام لإحياء التراث ـ قم	Rafed	2769	0.26379
		تاريخ الإسلام ووفيات المشاهير والأعلام [ج ٤٤]	شمس الدين محمّد بن أحمد بن عثمان الذّهبي	Rafed	3629	0.26376
		مرآة الزمان في تواريخ الأعيان	شمس الدين أبو المظفر يوسف بن قِزْأُوغلي بن عبد الله المعروف بـ «سبط ابن الجوزي» (581 - 654 هـ)	ShamAY	38953	0.26372
		جمهرة مقالات العلامة الشيخ أحمد محمد شاكر - مع أهم تعقبات الشيخ على دائرة المعارف الإسلامية	أحمد محمد شاكر	ShamelaY19	20642	0.26341
		الدولة الفاطمية	عَلي محمد محمد الصَّلاَّبي	ShamAY	245	0.26325
		جمهرة مقالات العلامة الشيخ أحمد محمد شاكر - مع أهم تعقبات الشيخ على دائرة المعارف الإسلامية	أحمد محمد شاكر	Sham19Y	20642	0.26308
		 المغرب في حلي المغرب 	 علي بن موسى الغرناطي الأندلسي 	ABLibrary	9220	0.26296
		موسوعة تاريخ العراق بين احتلالين [ج ٤]	عباس العزاوي المحامي	Rafed	1922	0.2628
		الإصابة في تمييز الصحابة [ج ١]	أحمد بن علي بن حجر العسقلاني	Rafed	3386	0.26278
		الرسالة للشافعي	الشافعي أبو عبد الله محمد بن إدريس بن العباس بن عثمان بن شافع بن عبد المطلب بن عبد مناف المطلبي القرشي المكي (المتوفى: 204هـ)	ShamAY	8180	0.26257
		تاريخ الإسلام ووفيات المشاهير والأعلام [ج ٣٧]	شمس الدين محمّد بن أحمد بن عثمان الذّهبي	Rafed	3584	0.26237
		رحلة ابن بطوطة المسماة تحفة النظار في غرائب الامصار وعجائب الأسفار	محمد بن عبد الله بن محمد بن إبراهيم اللواتي الطنجي، أبو عبد الله، ابن بطوطة (المتوفى: 779ه)	Sham19Y	12009	0.26228
		تاريخ بيهق / تعريب	أبو الحسن ظهير الدين علي بن زيد بن محمد بن الحسين البيهقي، الشهير بابن فندمه (المتوفى: 565هـ)	ShamAY	11758	0.26214
		 شرفنامه 	 شرف خان البدليسي 	ABLibrary	9128	0.26209
		 شرفنامه 	 شرف خان البدليسي 	ABLibrary	9127	0.26194
		كتاب الأعلام بأعلام بيت الله الحرام	محمّد بن أحمد بن محمّد النهرواني	Rafed	2400	0.2619
		 موسوعة العتبات المقدسة 	 جعفر الخليلي 	ABLibrary	9252	0.26189
		ذيل وفيات الأعيان المسمى «درة الحجال فى أسماء الرجال»	أبو العباس أحمد بن محمد المكناسى الشهير بابن القاضى (960 - 1025 ه‍)	ShamelaY19	132965	0.26158
		المنهل العذب الروي في ترجمة قطب الأولياء النووي	شمس الدين أبو الخير محمد بن عبد الرحمن بن محمد السخاوي (المتوفى: 902هـ)	ShamAY	317	0.26158
		المغرب في حلى المغرب [ج ١]	علي بن موسى بن محمّد بن عبد الملك بن سعيد الغرناطي الأندلسي	Rafed	2271	0.26149
		التحصيل من المحصول	سراج الدين محمود بن أبي بكر الأرموي (المتوفى: 682 ه)	ShamelaY19	19235	0.26146
		العقد الثمين فى تاريخ البلد الأمين	تقي الدين محمد بن أحمد الحسني الفاسى المكي (المتوفى: 832 هـ)	ShamAY	38892	0.26146
		مرآة الجنان وعبرة اليقظان في معرفة حوادث الزمان	اليافعي	ShamAY	33823	0.26141
		تحفة الترك فيما يجب أن يعمل في الملك	إبراهيم بن علي بن أحمد بن عبد الواحد ابن عبد المنعم الطرسوسي، نجم الدين الحنفي (المتوفى: 758هـ)	ShamAY	1044	0.26131
		الطبقات السنية في تراجم الحنفية	تقي الدين بن عبد القادر التميمي الداري الغزي (المتوفى: 1010هـ)	ShamAY	322	0.2613
		الإعلام بفوائد عمدة الأحكام	ابن الملقن سراج الدين أبو حفص عمر بن علي بن أحمد الشافعي المصري (المتوفى: 804هـ)	ShamAY	31785	0.26114
		تراثنا ـ العددان [ 73 و 74 ]	مؤسسة آل البيت عليهم السلام لإحياء التراث ـ قم	Rafed	3305	0.26109
		الانصاف في حكم الاعتكاف	الإمام محمد عبد الحي اللكنوي (ت1304هـ)	ShamAY	36004	0.26105
		صفحات من صبر العلماء على شدائد العلم والتحصيل	عبد الفتاح أبو غدة	ShamAY	33769	0.26099
		ردع الإخوان عن محدثات آخر جمعة رمضان - سلسلة لقاء العشر الأواخر بالمسجد الحرام (7)	محمد عبد الحي بن محمد عبد الحليم الأنصاري اللكنوي الهندي، أبو الحسنات (المتوفى: 1304 هـ)	ShamAY	32393	0.26099
		الوافي بالوفيات	صلاح الدين خليل بن أيبك بن عبد الله الصفدي (المتوفى: 764هـ)	ShamAY	32241	0.26096
		الإصابة في تمييز الصحابة	أبو الفضل أحمد بن علي بن محمد بن أحمد بن حجر العسقلاني (المتوفى: 852ه)	Sham19Y	9767	0.26083
		رحلة ابن بطوطة المسماة تحفة النظار في غرائب الامصار وعجائب الأسفار	محمد بن عبد الله بن محمد بن إبراهيم اللواتي الطنجي، أبو عبد الله، ابن بطوطة (المتوفى: 779هـ)	ShamAY	12009	0.26065
		التسعينية	تقي الدين أبو العباس أحمد بن عبد الحليم بن عبد السلام بن عبد الله بن أبي القاسم بن محمد ابن تيمية الحراني الحنبلي الدمشقي (المتوفى: 728 هـ)	ShamAY	32319	0.26049
		الامام الثاني عشر (عجل الله تعالي فرجه الشريف) 	محمد سعيد موسوي	Ghbook	6577	0.26041
		تراثنا ـ العدد [ 49 ]	مؤسسة آل البيت عليهم السلام لإحياء التراث ـ قم	Rafed	3187	0.26036
		تفضيل أمير المؤمنين(ع)	الشيخ المفيد	Masaha	4681	0.26027
		 معرفة الإمام 	 السيد محمد حسين الطهراني 	ABLibrary	8895	0.26024
		تعريب شرفنامه - الجزء1	شرف خان البدليسي	Masaha	4645	0.26011
		تراثنا ـ العدد [ 61 ]	مؤسسة آل البيت عليهم السلام لإحياء التراث ـ قم	Rafed	3249	0.25993
		السعاية في كشف ما في شرح الوقاية	الإمام محمد عبد الحي اللكنوي (ت1304هـ)	ShamAY	33177	0.25985
		 تاريخ المدينة المنورة ( نصيحة المشاور وتسلية المجاور ) ( ط القاهرة ) 	 ابن فرحون 	ABLibrary	8999	0.25985
		النفحة المسكية في الرحلة المكية	عبد الله بن حسين السويدي البغدادي	Rafed	2252	0.25966
		 مسالك الأبصار في ممالك الأمصار 	 أحمد بن يحيى العمري 	ABLibrary	9188	0.25965
		مسامرات الظريف بحسن التعريف	محمد بن عثمان بن محمد السنوسي، أبو عبد الله (المتوفى: 1318ه)	Sham19Y	5440	0.25947
		الإشارة إلى سيرة المصطفى وتاريخ من بعده من الخلفا	مغلطاي بن قليج بن عبد الله البكجري المصري الحكري الحنفي، أبو عبد الله، علاء الدين (المتوفى: 762هـ)	ShamAY	31700	0.25908
		الإصابة في تمييز الصحابة	أبو الفضل أحمد بن علي بن محمد بن أحمد بن حجر العسقلاني (المتوفى: 852هـ)	ShamAY	9767	0.25899
		اللّباب في علوم الكتاب [ج ١]	أبي حفص عمر بن علي بن عادل الدمشقي الحنبلي	Rafed	3089	0.25896
		شرح طيبة النشر في القراءات العشر	محمد بن محمد بن محمد، أبو القاسم، محب الدين النويري (المتوفى: 857ه)	ShamelaY19	38740	0.25883
		السلطان سيف الدين قطز ومعركة عين جالوت	عَلي محمد محمد الصَّلاَّبي	ShamAY	328	0.2588
		تراثنا ـ العدد [ 26 ]	مؤسسة آل البيت عليهم السلام لإحياء التراث ـ قم	Rafed	2764	0.25877
		الجواهر والدرر في ترجمة شيخ الإسلام ابن حجر	شمس الدين أبو الخير محمد بن عبد الرحمن بن محمد بن أبي بكر بن عثمان بن محمد السخاوي (المتوفى: 902هـ)	ShamAY	32249	0.25875
		مسامرات الظريف بحسن التعريف	محمد بن عثمان بن محمد السنوسي، أبو عبد الله (المتوفى: 1318هـ)	ShamAY	5440	0.25868
		مرآة الزمان في تواريخ الأعيان	شمس الدين أبو المظفر يوسف بن قزأوغلي بن عبد الله المعروف ب «سبط ابن الجوزي» (581 - 654 ه)	ShamelaY19	23644	0.25863
		رحلة العبدري	أبو عبدالله العبدري	Rafed	2452	0.25856
		شد الأثواب في سد الأبواب للسيوطي	الواحدي :: السيوطي	ShamAY	36179	0.25851
		 أعيان الشيعة 	 السيد محسن الأمين 	ABLibrary	82	0.2584
		إسماعيل بن علي الأكوع علامة اليمن ومؤرخها	إبراهيم باجس عبد المجيد المقدسي	ShamAY	38598	0.25838
		 الرحلة الحجازية 	 اولياء چلبي 	ABLibrary	9091	0.25822
		بهجة النفوس والأسرار [ج ١]	الشيخ أبي محمّد عفيف الدين عبد الله بن عبد الملك المرجاني	Rafed	2177	0.25811
		جمهرة مقالات العلامة الشيخ أحمد محمد شاكر - مع أهم تعقبات الشيخ على دائرة المعارف الإسلامية	أحمد محمد شاكر	ShamAY	38847	0.25809
		 تاريخ بيهق 	 علي بن زيد البيهقي 	ABLibrary	8988	0.25807
		العواصم والقواصم في الذب عن سنة أبي القاسم	ابن الوزير، محمد بن إبراهيم بن علي بن المرتضى بن المفضل الحسني القاسمي، أبو عبد الله، عز الدين، من آل الوزير (المتوفى: 840ه)	Sham19Y	29677	0.25802
		الرّحلة الحجازيّة	أوليا چلبي	Rafed	2200	0.25789
		نيل الأمل في ذيل الدول	زين الدين عبد الباسط بن أبي الصفاء غرس الدين خليل بن شاهين الظاهريّ الملطيّ ثم القاهري الحنفيّ (المتوفى: 920هـ)	ShamAY	32108	0.25781
		الدرّ الكمين بذيل العقد الثمين في تاريخ البلد الأمين [ج ٢]	عمر ابن فهد الهاشمي المكّي	Rafed	2206	0.25778
		تاريخ الإسلام ووفيات المشاهير والأعلام [ج ٣٦]	شمس الدين محمّد بن أحمد بن عثمان الذّهبي	Rafed	3581	0.25773
		 الحضرة الأنسية في الرحلة القدسية 	 الشيخ عبد الغني النابلسي 	ABLibrary	9037	0.25758
		نظم العقيان في أعيان الأعيان	عبد الرحمن بن أبي بكر، جلال الدين السيوطي (المتوفى: 911هـ)	ShamAY	9061	0.25757
		الشيعة وفنون الإسلام	السيد حسن الصدر	Masaha	635	0.25735
		تاريخ ابن حجي «حوادث ووفيات: 796 ه - 815 ه»	شهاب الدين أبو العباس أحمد بن حجي السعدي الحسباني الدمشقي (751 ه - 816 ه)	ShamelaY19	19065	0.25735
		تاريخ مقام الامام المهدي (عج) في الحلة	احمد علي مجيد الحلي	Rafed	120	0.25713
		المطالع النصرية للمطابع المصرية في الأصول الخطية	نصر (أبو الوفاء) ابن الشيخ نصر يونس الوفائي الهوريني الأحمدي الأزهري الأشعري الحنفي الشافعي (المتوفى: 1291ه)	Sham19Y	97799	0.25703
		 تاريخ اربل ( نباهة البلد الخامل بمن ورده من الاماثل ) 	 ابن المستوفي 	ABLibrary	8978	0.25703
		 كتاب الإعلام بأعلام بيت الله الحرام 	 محمد بن أحمد النهرواني 	ABLibrary	9161	0.25698
		أخبار سلاجقة الروم = مختصر سلجوقنامه - تعريب	مجهول - من أهل القرن السابع الهجري	Sham19Y	122237	0.25696
		 كامل الصناعتين في البيطرة والزردقة ( الناصري ) 	 أبي بكر بن بدر الدين البيطار 	ABLibrary	9936	0.2568
		 موسوعة تاريخ العراق بين احتلالين 	 عباس العزاوي المحامي 	ABLibrary	9258	0.25675
		لحظ الألحاظ بذيل طبقات الحفاظ	محمد بن محمد بن محمد، أبو الفضل تقي الدين ابن فهد الهاشمي العلويّ الأصفوني ثم المكيّ الشافعي (المتوفى: 871هـ)	ShamAY	7313	0.25672
		تحفة القادم	ابن الأبار، محمد بن عبد الله بن أبي بكر القضاعي البلنسي (المتوفى: 658ه)	ShamelaY19	26108	0.25668
		تَكْمِلَةُ الجَامِع لِسِيْرَةِ شَيْخِ الإِسْلَامِ ابْن تَيْمِيَّة خِلَال سَبْعَة قرُون	علي بن محمد بن حسين العِمران	ShamAY	38478	0.25668
		تاريخ دمشق [ج ١]	الناشر: التكوين للتأليف والترجمة والنشر	Rafed	2261	0.25667
		طبقات مشاهير الدمشقيين من أهل القرن الرابع عشر الهجري	محمد جمال الدين القاسمي (1283 - 1332هـ)	ShamAY	34654	0.25654
		الوافي بالوفيات - النسخة المحررة ط إحياء التراث = التراجم	صلاح الدين خليل بن أيبك بن عبد الله الصفدي (المتوفى: 764هـ)	ShamAY	38166	0.25653
		لحظ الألحاظ بذيل طبقات الحفاظ	محمد بن محمد بن محمد، أبو الفضل تقي الدين ابن فهد الهاشمي العلوي الأصفوني ثم المكي الشافعي (المتوفى: 871ه)	Sham19Y	7313	0.25651
		تأريخ بيهق	فريد خراسان علي بن زيد البيهقي	Rafed	2199	0.25642
		العواصم والقواصم في الذب عن سنة أبي القاسم	ابن الوزير، محمد بن إبراهيم بن علي بن المرتضى بن المفضل الحسني القاسمي، أبو عبد الله، عز الدين، من آل الوزير (المتوفى: 840هـ)	ShamAY	3	0.25639
		 النفحة المسكية في الرحلة المكية 	 عبد الله بن حسين السويدي البغدادي 	ABLibrary	9307	0.2563
		 منائح الكرم 	 علي بن تاج الدين السنجاري 	ABLibrary	9226	0.25628
		الإلحاد الخميني في أرض الحرمين	أبو عبد الرحمن مقبل بن هادي بن مقبل بن قائدة (اسم رجل) الهمداني الوادعي (المتوفى: 1422ه)	ShamelaY19	96926	0.25626
		الجامع لعلوم الإمام أحمد - المقدمات	خالد الرباط، سيد عزت عيد [بمشاركة الباحثين بدار الفلاح]	ShamAY	38864	0.25622
		تاريخ اربل [ج ١]	شرف الدين  أبي البركات المبارك بن أحمد اللخمي الأربلي [ ابن المستوفي ]	Rafed	2314	0.25612
		أدب الطّف أو شعراء الحسين عليه السلام [ج ٤]	جواد شبّر	Rafed	365	0.2561
		 الدر الكمين بذيل العقد الثمين في تاريخ البلد الأمين 	 عمر بن محمد ابن فهد 	ABLibrary	9064	0.25605
		زبدة الحلب من تاريخ حلب [ج ١]	كمال الدّين عمر بن أحمد بن أبي جرادة الحلبي [ ابن العديم ]	Rafed	2422	0.25586
		تاريخ مدينه منوره	عبد الله بن محمد ابن فرحون	Ghbook	11108	0.25582
		أخبار سلاجقة الروم = مختصر سلجوقنامه - تعريب	مجهول - من أهل القرن السابع الهجري	ShamAY	31727	0.25577
		نفح الطّيب [ج ٢]	الشيخ أحمد بن محمد المقري التلمساني	Rafed	2788	0.25569
		تكملة الجامع لسيرة شيخ الإسلام ابن تيمية خلال سبعة قرون - ط عالم الفوائد	علي بن محمد العمران	ShamAY	34400	0.25557
		الانتصارات الإسلامية في كشف شبه النصرانية	سليمان بن عبد القوي بن الكريم الطوفي الصرصري، أبو الربيع، نجم الدين (المتوفى: 716ه)	ShamelaY19	37713	0.25552
		 تاريخ المستبصر 	 ابن المجاور 	ABLibrary	9001	0.25544
		إعلام النبلاء بتاريخ حلب الشهباء [ج ٣]	محمد راغب بن محمود بن هاشم الطبّاخ الحلبي	Rafed	2363	0.25541
		تاريخ الإسلام ووفيات المشاهير والأعلام [ج ٣٤]	شمس الدين محمّد بن أحمد بن عثمان الذّهبي	Rafed	3579	0.25539
		شذرات الذهب في أخبار من ذهب - ابن العماد	ابن العِماد الحنبلي	ShamAY	34625	0.25536
		تاريخ المستبصر، صفة بلاد اليمن ومكة وبعض الحجاز	يوسف بن يعقوب ابن مجاور	Masaha	4138	0.2553
		 سمط الحقائق في عقائد الإسماعيلية 	 علي بن حنظلة ابن ابي سالم الوداعي 	ABLibrary	8447	0.25526
		 لحظ الألحاظ بذيل طبقات الحفاظ 	 محمد بن محمد ابن محمد بن فهد الهاشمي المكي 	ABLibrary	830	0.25506
		مقدمة في أصول البحث العلمي وتحقيق التراث	السيد رزق الطويل	ShamAY	7323	0.25503
		 رحلة المكناسي 	 محمد بن عبد الوهاب المكناسي 	ABLibrary	9109	0.25498
		التوضيح لشرح الجامع الصحيح	ابن الملقن سراج الدين أبو حفص عمر بن علي بن أحمد الشافعي المصري (المتوفى: 804ه)	Sham19Y	13252	0.25495
		 تاريخ اربل ( نباهة البلد الخامل بمن ورده من الاماثل ) 	 ابن المستوفي 	ABLibrary	8979	0.2548
		المدخل إلى مذهب الإمام الشافعي	فهد الحبيشي	ShamAY	37534	0.25479
		 بهجة النفوس والأسرار في تاريخ دار هجرة النبي المختار 	 عبد الله المرجاني 	ABLibrary	8972	0.25474
		الاعتصام للشاطبي ت الشقير والحميد والصيني	إبراهيم بن موسى بن محمد اللخمي الغرناطي الشهير بالشاطبي (المتوفى: 790ه)	Sham19Y	36558	0.25457
		الدرّ الكمين بذيل العقد الثمين في تاريخ البلد الأمين [ج ١]	عمر ابن فهد الهاشمي المكّي	Rafed	2205	0.25441
		 تاريخ الشحر وأخبار القرن العاشر 	 محمد بن عمر الطيب بافقيه 	ABLibrary	8992	0.25436
		 رحلة العبدري 	 أبو عبد الله العبدري 	ABLibrary	9101	0.25434
		اسماء الكتب المتمم لكشف الظنون	عبد اللطيف بن محمد بن مصطفى المتخلص بلطفي، الشهير بـ «رِياض زَادَه» الحنفي (المتوفى: 1078هـ)	ShamAY	10734	0.25427
		النفحة النسرينية واللمحة المرينية	إسماعيل بن يوسف بن محمد بن نصر الخزرجي الأنصاري النصري، أبو الوليد، المعروف بابن الأحمر (المتوفى: 807ه)	Sham19Y	401	0.25422
		 زبدة الحلب من تاريخ حلب 	 عمر بن أحمد بن أبي جرادة 	ABLibrary	9114	0.25416
		المدخل المفصل لمذهب الإمام أحمد	بكر أبو زيد	ShamelaY19	23611	0.25412
		المَطَالِعُ النَّصرية للمَطَابِعِ المصريَّةِ في الأصُول الخَطيَّةِ	نصر (أبو الوفاء) ابن الشيخ نصر يونس الوفائي الهوريني الأحمدي الأزهري الأشعري الحنفي الشافعيّ (المتوفى: 1291هـ)	ShamAY	32171	0.25393
