automatic URI	Proposed URI	bookTitle	authorName	collection	id	tfidf
		 خلاصة عبقات الأنوار 	 السيد حامد النقوي 	ABLibrary	88	0.25385
		 مسالك الأبصار في ممالك الأمصار 	 أحمد بن يحيى العمري 	ABLibrary	9192	0.25369
		 الكامل في التاريخ 	 ابن الأثير 	ABLibrary	8257	0.25363
		الإبهاج في شرح المنهاج (شرح على منهاج الوصول إلى علم الأصول للقاضي البيضاوي المتوفى سنة 685 ه)	شيخ الإسلام علي بن عبد الكافي السبكي (المتوفى: 756 ه) وولده تاج الدين عبد الوهاب بن علي السبكي (المتوفى: 771 ه)	ShamelaY19	147104	0.25359
		زبدة الحلب من تاريخ حلب‏  - الجزء1	عمر بن أحمد ابن أبي جرادة	Masaha	4190	0.25356
		خطط الشام [ج ٤]	محمّد كرد علي	Rafed	2282	0.25347
		تأريخ المستبصر	ابن المجاور	Rafed	2189	0.25345
		الاعتصام للشاطبي ت الشقير والحميد والصيني	إبراهيم بن موسى بن محمد اللخمي الغرناطي الشهير بالشاطبي (المتوفى: 790هـ)	ShamAY	445	0.25343
		 المواعظ والإعتبار في ذكر الخطط والآثار ( ط لندن ) 	 المقريزي 	ABLibrary	9238	0.25342
		تحفة القادم	ابن الأبار، محمد بن عبد الله بن أبي بكر القضاعي البلنسي (المتوفى: 658هـ)	ShamAY	26108	0.25325
		صفه بلاد اليمن و مكه و بعض الحجار: المسماة تاريخ المستبصر	يوسف بن يعقوب ابن مجاور	Ghbook	11110	0.25323
		المجالس الوعظية في شرح أحاديث خير البرية صلى الله عليه وسلم من صحيح الإمام البخاري	شمس الدين محمد بن عمر بن أحمد السفيري الشافعي (المتوفى: 956ه)	Sham19Y	9823	0.25322
		نفحات الأزهار في خلاصة عبقات الأنوار [ج ١]	السيّد علي الحسيني الميلاني	Rafed	426	0.25317
		أخبار سلاجقة الروم = مختصر سلجوقنامه - تعريب	مجهول - من أهل القرن السابع الهجري	ShamelaY19	122237	0.2531
		طبقات المفسرين للسيوطي	عبد الرحمن بن أبي بكر، جلال الدين السيوطي (المتوفى: 911ه)	Sham19Y	6234	0.25309
		تراثنا ـ العدد [ 23 ]	مؤسسة آل البيت عليهم السلام لإحياء التراث ـ قم	Rafed	2743	0.25304
		الشهادة الزكية في ثناء الأئمة على ابن تيمية	مرعي بن يوسف بن أبى بكر بن أحمد الكرمى المقدسي الحنبلى (المتوفى: 1033ه)	Sham19Y	6661	0.25303
		الحلة السيراء	ابن الأبار، محمد بن عبد الله بن أبي بكر القضاعي البلنسي (المتوفى: 658هـ)	ShamAY	6630	0.25301
		تاريخ البيمارستانات في الإسلام	الدكتور أحمد عيسى (المتوفى: 1365ه)	ShamelaY19	36083	0.25288
		الإحاطة في أخبار غرناطة [ج ٢]	أبي عبد الله محمّد بن عبد الله بن سعيد بن أحمد السلماني [ لسان الدين بن الخطيب ]	Rafed	2348	0.2528
		نقض الإمام أبي سعيد عثمان بن سعيد على المريسي الجهمي العنيد فيما افترى على الله عز وجل من التوحيد	أبو سعيد عثمان بن سعيد بن خالد بن سعيد الدارمي السجستاني (المتوفى: 280هـ)	ShamAY	8680	0.25274
		 تاريخ دمشق 	 سهيل زكار 	ABLibrary	8989	0.25264
		الإلحاد الخميني في أرض الحرمين	أَبِو عَبد الرَّحمَن مُقْبلُ بنُ هَادِي بنِ مُقْبِلِ بنِ قَائِدَةَ (اسم رجل) الهَمْدَاني الوادعِيُّ (المتوفى: 1422هـ)	ShamAY	2042	0.25263
		كناشة النوادر	عبد السلام محمد هارون (المتوفى: 1408هـ)	ShamAY	12733	0.25257
		نزهة الأمم في العجائب والحكم	ابن إياس	Rafed	2538	0.25255
		تاريخ اربل [ج ٢]	شرف الدين  أبي البركات المبارك بن أحمد اللخمي الأربلي [ ابن المستوفي ]	Rafed	2427	0.25244
		الإقتباس من القرآن الكريم [ج ١]	أبي منصور عبد الملك بن محمّد بن اسماعيل الثعالبي	Rafed	3176	0.25243
		ابن قيم الجوزية وجهوده في خدمة السنة النبوية وعلومها	جمال بن محمد السيد	Sham19Y	11401	0.25237
		القناعة في ما يحسن الإحاطة من أشراط الساعة	شمس الدين محمد بن عبد الرحمن السخاوي (المتوفى: 902 ه)	ShamelaY19	127668	0.25234
		الأزهر في ألف عام [ج ١]	الدكتور محمد عبد المنعم خفاجي	Rafed	2338	0.25234
		التلخيص الحبير في تخريج أحاديث الرافعي الكبير	أبو الفضل أحمد بن علي بن محمد بن أحمد بن حجر العسقلاني (المتوفى: 852هـ)	ShamAY	1581	0.25233
		التوضيح لشرح الجامع الصحيح	ابن الملقن سراج الدين أبو حفص عمر بن علي بن أحمد الشافعي المصري (المتوفى: 804هـ)	ShamAY	31764	0.25233
		الشهادة الزكية في ثناء الأئمة على ابن تيمية	مرعي بن يوسف بن أبى بكر بن أحمد الكرمى المقدسي الحنبلى (المتوفى: 1033هـ)	ShamAY	6661	0.25231
		بحوث في الملل والنّحل [ج ٤]	الشيخ جعفر السبحاني	Rafed	62	0.25211
		نفحات الأزهار في خلاصة عبقات الأنوار [ج ١٩]	السيّد علي الحسيني الميلاني	Rafed	474	0.25205
		المجالس الوعظية في شرح أحاديث خير البرية صلى الله عليه وسلم من صحيح الإمام البخاري	شمس الدين محمد بن عمر بن أحمد السفيري الشافعي (المتوفى: 956هـ)	ShamAY	9823	0.25204
		العناية بالقرآن الكريم وعلومه من بداية القرن الرابع الهجري إلى عصرنا الحاضر	د. نبيل بن محمد آل إسماعيل	ShamAY	8517	0.25186
		مقدمة ابن الصلاح ومحاسن الاصطلاح	سراج الدين البلقيني	ShamAY	133	0.25178
		المجازر والتعصبات الطائفية في عهد الشيخ المفيد	الشيخ فارس الحسون	Masaha	398	0.25176
		دعائم التمكين للمملكة العربية السعودية على ضوء قوله تعالى: {الذين إن مكناهم في الأرض أقاموا الصلاة وآتوا الزكاة وأمروا بالمعروف ونهوا عن المنكر ولله عاقبة الأمور}	حمد بن حمدي الصاعدي	ShamAY	10223	0.25152
		دعائم التمكين للمملكة العربية السعودية على ضوء قوله تعالى: {الذين إن مكناهم في الأرض أقاموا الصلاة وآتوا الزكاة وأمروا بالمعروف ونهوا عن المنكر ولله عاقبة الأمور}	حمد بن حمدي الصاعدي	Sham19Y	10223	0.25151
		المغرب في حلى المغرب	أبو الحسن على بن موسى بن سعيد المغربي الأندلسي (المتوفى: 685هـ)	ShamAY	6633	0.25149
		 أخبار سلاجقة الروم ( ترجمة مختصر سلجوقنامه ) 	 مؤلف مجهول ( تعريب : محمد سعيد جمال الدين ) 	ABLibrary	7956	0.25136
		تاريخ اربل	المبارك بن أحمد بن المبارك بن موهوب اللخمي الإِربلي، المعروف بابن المستوفي (المتوفى: 637هـ)	ShamAY	11746	0.25129
		البرق الشامي	عماد الدين الكاتب الأصبهاني، محمد بن محمد صفي الدين بن نفيس الدين حامد بن أله، أبو عبد الله (المتوفى: 597هـ)	ShamAY	6628	0.25124
		طبقات المفسرين للسيوطي	عبد الرحمن بن أبي بكر، جلال الدين السيوطي (المتوفى: 911هـ)	ShamAY	6234	0.25118
		نص مستدرك من كتاب العبر	الذهبي، شمس الدين	ShamAY	34591	0.25113
		الأزهر في ألف عام	د. محمد عبد المنعم خفاجي (المتوفى:1427 هـ)	ShamAY	33841	0.25113
		ابن قيم الجوزية وجهوده في خدمة السنة النبوية وعلومها	جمال بن محمد السيد	ShamAY	11401	0.25092
		موسوعة تاريخ العراق بين احتلالين [ج ٨]	عباس العزاوي المحامي	Rafed	1926	0.2509
		الإنباء في تاريخ الخلفاء	محمد بن علي بن محمد المعروف بابن العمراني (المتوفى: 580هـ)	ShamAY	12289	0.25077
		العقود الدرية في ذكر بعض مناقب شيخ الإسلام ابن تيمية ويليه الأعلام العلية - ابن عبد الهادي والبزار - ت العمران - ط عالم الفوائد	ابن عبد الهادي	ShamAY	38476	0.25076
		تاريخ الإسلام ووفيات المشاهير والأعلام [ج ٥٢]	شمس الدين محمّد بن أحمد بن عثمان الذّهبي	Rafed	3665	0.25074
		النفحة النسرينية واللمحة المرينية	إسماعيل بن يوسف بن محمد بن نصر الخزرجي الأنصاري النصري، أبو الوليد، المعروف بابن الأحمر (المتوفى: 807هـ)	ShamAY	401	0.25068
		مرشد الزوّار إلى قبور الأبرار [ج ١]	موفق الدين بن عثمان	Rafed	2657	0.25059
		التمسك بالسنن والتحذير من البدع (السنة 27 -- العددان103 -104)	شمس الدين أبو عبد الله محمد بن أحمد بن عثمان بن قَايْماز الذهبي (المتوفى: 748هـ)	ShamAY	10321	0.25055
		المعجم الجامع في تراجم العلماء وطلبة العلم المعاصرين	أعضاء ملتقى أهل الحديث	ShamAY	2080	0.25046
		رحلة المكانسي‏	محمد بن عبد الوهاب المكانسي	Masaha	4382	0.25043
		 الإحاطة في أخبار غرناطة 	 لسان الدين ابن الخطيب 	ABLibrary	8949	0.25041
		معجم أصحاب شيخ الإسلام ابن تيمية	وليد بن حسني بن بدوي بن محمد الأموي	ShamelaY19	21524	0.25037
		أسماء من عاش ثمانين سنة بعد شيخه أو بعد سماعه	الذهبي، شمس الدين	ShamAY	34571	0.25034
		تراجم المؤلفين التونسيين	محمد محفوظ (المتوفى: 1408 هـ)	ShamAY	38786	0.25032
		أسماء البقاع والجبال في القرآن الكريم	جلال الدين عبد الرحمن بن أبي بكر السيوطي	Rafed	2082	0.2503
		 أدب الطف أو شعراء الحسين ( ع ) 	 جواد شبر 	ABLibrary	7402	0.25024
		التتمة الجلية لطبقات الحنفية لابن الحنائي	الدكتور صلاح محمد أبو الحاج	ShamAY	35845	0.25014
		متن كتاب الشرح والإبانة على أصول السنة والديانة لابن بطة العنكبري	أبو عبد الله عبيد الله بن محمد بن محمد بن حمدان العُكْبَري المعروف بابن بَطَّة العكبري (المتوفى : 387هـ)	ShamAY	35405	0.25009
		القناعة في ما يحسن الإحاطة من أشراط الساعة	شمس الدين محمد بن عبد الرحمن السخاوي (المتوفى: 902 ه)	Sham19Y	127668	0.25002
		العجاب في بيان الأسباب	أبو الفضل أحمد بن علي بن محمد بن أحمد بن حجر العسقلاني (المتوفى: 852هـ)	ShamAY	2102	0.25001