automatic URI	Proposed URI	bookTitle	authorName	collection	id	tfidf
		الدارس في تاريخ المدارس‏  - الجزء1	عبد القادر بن محمد النعيمي الدمشقي	Masaha	4642	0.45891
		المنهل الصافي والمستوفى بعد الوافي	يوسف بن تغري بردي بن عبد الله الظاهري الحنفي، أبو المحاسن، جمال الدين (المتوفى: 874ه)	Sham19Y	23156	0.44377
		المنهل الصافي والمستوفى بعد الوافي	يوسف بن تغري بردي بن عبد الله الظاهري الحنفي، أبو المحاسن، جمال الدين (المتوفى: 874ه)	ShamelaY19	23156	0.44313
		المنهل الصافي والمستوفى بعد الوافي	يوسف بن تغري بردي بن عبد الله الظاهري الحنفي، أبو المحاسن، جمال الدين (المتوفى: 874هـ)	ShamAY	23156	0.44258
		 الدارس في تاريخ المدارس 	 عبد القادر بن محمد النعيمي الدمشقي 	ABLibrary	9062	0.43278
		تاريخ دمشق [ج ٢]	الناشر: التكوين للتأليف والترجمة والنشر	Rafed	2263	0.42959
		ذيل مرآة الزمان	قطب الدين أبو الفتح موسى بن محمد اليونيني (المتوفى: 726 ه)	Sham19Y	12722	0.42863
		ذيل مرآة الزمان	قطب الدين أبو الفتح موسى بن محمد اليونيني (المتوفى: 726 هـ)	ShamAY	12722	0.42748
		الدّارس في تاريخ المدارس [ج ٢]	عبد القادر بن محمّد النعيمي الدمشقي	Rafed	3342	0.4273
		 تاريخ دمشق 	 سهيل زكار 	ABLibrary	8990	0.42212
		عقد الجمان في تاريخ أهل الزمان - الجزء1	محمد محمد أمين	Masaha	4056	0.41695
		عقد الجمان في تاريخ أهل الزمان - ط هيئة الكتاب	محمود بن أحمد بن موسى الحنفى الشهير ببدر الدين العينى (المتوفى: 855هـ)	ShamAY	33840	0.41368
		عقد الجمان في تاريخ أهل الزمان	أبو محمد محمود بن أحمد بن موسى بن أحمد بن حسين الغيتابى الحنفى بدر الدين العينى (المتوفى: 855هـ)	ShamAY	380	0.4107
		طبقات الشافعية للإسنوي	عبد الرحيم بن الحسن بن علي الإسنوي الشافعيّ، أبو محمد، جمال الدين (المتوفى: 772هـ)	ShamAY	34637	0.40815
		 الدارس في تاريخ المدارس 	 عبد القادر بن محمد النعيمي الدمشقي 	ABLibrary	9061	0.40532
		التاريخ المنصوري = تلخيص الكشف والبيان في حوادث الزمان	أبو الفضائل محمد بن علي بن نظيف الحموي	ShamAY	6607	0.40023
		الدارس في تاريخ المدارس	عبد القادر بن محمد النعيمي الدمشقي (المتوفى: 927هـ)	ShamAY	8880	0.39915
		الدّارس في التاريخ المدارس [ج ١]	عبد القادر بن محمّد النعيمي الدمشقي	Rafed	2211	0.39272
		السلوك لمعرفة دول الملوك	أحمد بن علي بن عبد القادر، أبو العباس الحسيني العبيدي، تقي الدين المقريزي (المتوفى: 845هـ)	ShamAY	6667	0.38918
		مورد اللطافة في من ولي السلطنة والخلافة	يوسف بن تغري بردي بن عبد الله الظاهري الحنفي، أبو المحاسن، جمال الدين (المتوفى: 874هـ)	ShamAY	6669	0.38267
		نزهة الأنام فى تاريخ الإسلام	صارم الدين إبراهيم بن محمد بن أيدمر العلائي القاهري الملقب بابن دقماق (المتوفى: 809 ه)	Sham19Y	16363	0.37587
		نزهة الأنام فى تاريخ الإسلام	صارم الدين إبراهيم بن محمد بن أيدمر العلائي القاهري الملقب بابن دُقْماق (المتوفى: 809 هـ)	ShamAY	32327	0.37411
		حسن المحاضرة في أخبار مصر والقاهرة [ج ٢]	جلال الدين عبد الرحمن بن أبي بكر السيوطي	Rafed	2162	0.3741
		زبدة الحلب من تاريخ حلب [ج ٢]	كمال الدّين عمر بن أحمد بن أبي جرادة الحلبي [ ابن العديم ]	Rafed	2436	0.36858
		 حسن المحاضرة في أخبار مصر والقاهرة 	 جلال الدين السيوطي 	ABLibrary	9036	0.36772
		منادمة الأطلال ومسامرة الخيال	عبد القادر بن أحمد بن مصطفى بن عبد الرحيم بن محمد بدران (المتوفى: 1346هـ)	ShamAY	6710	0.36468
		منادمة الأطلال ومسامرة الخيال	عبد القادر بن أحمد بن مصطفى بن عبد الرحيم بن محمد بدران (المتوفى: 1346ه)	Sham19Y	6710	0.36444
		 زبدة الحلب من تاريخ حلب 	 عمر بن أحمد بن أبي جرادة 	ABLibrary	9115	0.36329
		تحفة الأحباب وبغية الطلاب‏	علي بن أحمد السخاوي	Masaha	4661	0.36278
		 القلائد الجوهرية في تاريخ الصالحية 	 محمد بن طولون الصالحي 	ABLibrary	9159	0.36162
		طبقات المفسرين للأدنه وي	أحمد بن محمد الأدنه وي من علماء القرن الحادي عشر (المتوفى: ق 11هـ)	ShamAY	6729	0.36009
		 تحفة الأحباب وبغية الطلاب 	 علي بن أحمد السخاوي 	ABLibrary	9021	0.35906
		الأعلاق الخطيرة في ذكر أمراء الشام و الجزيرة	ابن شداد، عز الدين أبو عبد الله محمد بن علي بن إبراهيم الأنصاري الحلبي (المتوفى: 684هـ)	ShamAY	758	0.35652
		الإعلام بمن في تاريخ الهند من الأعلام المسمى بـ (نزهة الخواطر وبهجة المسامع والنواظر)	عبد الحي بن فخر الدين بن عبد العلي الحسني الطالبي (المتوفى: 1341هـ)	ShamAY	1584	0.35594
		 ذيل طبقات الحفاظ 	 جلال الدين السيوطي 	ABLibrary	831	0.35579
		هدية العارفين أسماء المؤلفين وآثار المصنفين	إسماعيل بن محمد أمين بن مير سليم الباباني البغدادي (المتوفى: 1399هـ)	ShamAY	3003	0.35543
		القلائد الجوهريّة في تاريخ الصالحيّة	أبي عبد الله شمس الدين محمّد بن علي بن طولون الدمشقي الصالحي [ ابن طولون ]	Rafed	2313	0.35522
		تاريخ الدولة العلية العثمانية	محمد فريد (بك) ابن أحمد فريد (باشا) ، المحامي (المتوفى: 1338هـ)	ShamAY	6638	0.35299
		نزهة المالك والمملوك في مختصر سيرة من ولي مصر من الملوك «يؤرخ من عصر الفراعنة والأنبياء حتى سنة 717 هـ»	الحسَن بن أبي محمّد عبد الله بن عمر بن محاسن بن عبد الكريم الهَاشِمِي العبّاسي الصَّفَدِي (المتوفى: بعد 717 هـ)	ShamAY	32328	0.35157
		الزهور المقتطفة من تاريخ مكة المشرفة	محمد بن أحمد الفاسي	Masaha	4654	0.35103
		 الضوء اللامع لأهل القرن التاسع 	 شمس الدين السخاوي 	ABLibrary	949	0.34743
		الثغر البسام في ذكر من ولى قضاة الشام	الواحدي :: ابن طولون	ShamAY	35856	0.34245
		العسجد المسبوك والجوهر المحكوك في طبقات الخلفاء والملوك		ShamAY	34638	0.34244
		مجمع الآداب في معجم الألقاب	كمال الدين أبو الفضل عبد الرزاق بن أحمد المعروف بابن الفوطي الشيباني (المتوفى: 723 هـ)	ShamAY	32700	0.3421
		ذيول العبر - ت: المنجد	محمد بن أحمد بن عثمان بن قايماز الذهبي أبو عبد الله	ShamAY	34590	0.3419
		تحفة الأحباب وبغية الطّلاب	نور الدين علي بن أحمد بن عمر بن خلف بن محمود السخاوي الحنفي	Rafed	2179	0.34169
		 مسالك الأبصار في ممالك الأمصار 	 أحمد بن يحيى العمري 	ABLibrary	9200	0.33895
		 القلائد الجوهرية في تاريخ الصالحية 	 محمد بن طولون الصالحي 	ABLibrary	9160	0.33883
		العقود اللؤلؤية في تاريخ الدولة الرسولية	علي بن الحسن بن أبي بكر بن الحسن ابن وهاس الخزرجي الزبيدي، أبو الحسن موفق الدين (المتوفى: 812ه)	Sham19Y	9233	0.33877
		العقود اللؤلؤية في تاريخ الدولة الرسولية	علي بن الحسن بن أبي بكر بن الحسن ابن وهاس الخزرجي الزبيدي، أبو الحسن موفق الدين (المتوفى: 812هـ)	ShamAY	9233	0.33743
		 من ذيول العبر 	 الذهبي - الحسيني 	ABLibrary	970	0.33663
		معجم المحدثين للذهبى - العلمية	شمس الدين محمد بن أحمد بن عثمان الذهبي	ShamAY	34631	0.33657
		وفيات الأعيان وأنباء أبناء الزمان	أبو العباس شمس الدين أحمد بن محمد بن إبراهيم بن أبي بكر ابن خلكان البرمكي الإربلي (المتوفى: 681هـ)	ShamAY	1000	0.33544
		اكتفاء القنوع بما هو مطبوع، أشهر التآليف العربية في المطابع الشرقية والغربية	ادوارد كرنيليوس فانديك (المتوفى: 1313هـ)	ShamAY	9199	0.33451
		كشف الظنون عن أسامي الكتب والفنون	مصطفى بن عبد الله كاتب جلبي القسطنطيني المشهور باسم حاجي خليفة أو الحاج خليفة (المتوفى: 1067ه)	Sham19Y	2118	0.33094
		كنوز الذهب فى تاريخ حلب	أحمد بن إبراهيم بن محمد بن خليل، موفق الدين، أبو ذر سبط ابن العجمي (المتوفى: 884ه)	Sham19Y	11786	0.33081
		موسوعة تاريخ العراق بين احتلالين [ج ٢]	عباس العزاوي المحامي	Rafed	1920	0.33068
		 المواعظ والإعتبار في ذكر الخطط والآثار ( ط بيروت ) 	 المقريزي 	ABLibrary	9236	0.32957
		إعلام النبلاء بتاريخ حلب الشهباء [ج ٢]	محمد راغب بن محمود بن هاشم الطبّاخ الحلبي	Rafed	2354	0.32883
		كنوز الذهب فى تاريخ حلب	أحمد بن إبراهيم بن محمد بن خليل، موفق الدين، أبو ذر سبط ابن العجمي (المتوفى: 884هـ)	ShamAY	11786	0.32845
		كشف الظنون عن أسامي الكتب والفنون	مصطفى بن عبد الله كاتب جلبي القسطنطيني المشهور باسم حاجي خليفة أو الحاج خليفة (المتوفى: 1067هـ)	ShamAY	38843	0.32735
		البدر الطالع بمحاسن من بعد القرن السابع	محمد بن علي بن محمد بن عبد الله الشوكاني اليمني (المتوفى: 1250هـ)	ShamAY	6671	0.32501
		الأمصار ذوات الآثار	شمس الدين محمّد بن أحمد بن عثمان الذّهبي	Rafed	2180	0.32368
		بهجة الناظرين إلى تراجم المتأخرين من الشافعية البارعين	رضي الدين أبو البركات محمد بن أحمد بن عبد الله الغزي العامري الشافعي (المتوفى: 864 ه)	ShamelaY19	20578	0.32349
		 الزهور المقتطفة من تاريخ مكة المشرفة 	 محمد بن أحمد الفاسي 	ABLibrary	9116	0.32297
		 موسوعة تاريخ العراق بين احتلالين 	 عباس العزاوي المحامي 	ABLibrary	9256	0.32286
		 الذريعة 	 آقا بزرگ الطهراني 	ABLibrary	862	0.32208
		أعيان العصر وأعوان النصر	صلاح الدين خليل بن أيبك الصفدي (المتوفى: 764هـ)	ShamAY	131	0.32179
		سلم الوصول إلى طبقات الفحول	مصطفى بن عبد الله القسطنطيني العثماني المعروف ب «كاتب جلبي» وب «حاجي خليفة» (المتوفى 1067 ه)	ShamelaY19	19199	0.32109
		كتاب المواعظ والإعتبار بذكر الخطط والآثار المعروف بالخطط المقريزيّة [ج ٤]	تقي الدين احمد بن علي المقريزي	Rafed	2325	0.32067
		 المواعظ والإعتبار في ذكر الخطط والآثار ( ط بيروت ) 	 المقريزي 	ABLibrary	9235	0.32056
		مفرج الكروب في أخبار بني أيوب	محمَّد بن سالم بن نصرالله بن سالم ابن واصل، أبو عبد الله المازني التميمي الحموي، جمال الدين (المتوفى: 697هـ)	ShamAY	32278	0.32055
		 الأمصار ذوات الآثار 	 الذهبي 	ABLibrary	8938	0.31991
		الزهور المقتطفة من تاريخ مكّة المشرّفة	تقي الدين محمّد بن أحمد الحسني الفاسي المكّي	Rafed	2374	0.31991
		 إعلام النبلاء بتاريخ حلب الشهباء 	 محمد راغب الطباخ الحلبي 	ABLibrary	8959	0.31969
		طبقات الشافعية لابن قاضى شهبة	أبو بكر بن أحمد بن محمد بن عمر الأسدي الشهبي الدمشقي، تقي الدين ابن قاضي شهبة (المتوفى: 851هـ)	ShamAY	6736	0.3196
		إنباء الأمراء بأنباء الوزراء	شمس الدين محمد بن علي بن خمارويه بن طولون الدمشقي الصالحي الحنفي (المتوفى: 953ه)	ShamelaY19	120145	0.31904
		إنباء الأمراء بأنباء الوزراء	شمس الدين محمد بن علي بن خمارويه بن طولون الدمشقي الصالحي الحنفي (المتوفى: 953ه)	Sham19Y	120145	0.3176
		الأمصار ذوات الآثار	محمد بن أحمد الذهبي	Masaha	4754	0.31758
		إنباء الغمر بأبناء العمر	أبو الفضل أحمد بن علي بن محمد بن أحمد بن حجر العسقلاني (المتوفى: 852ه)	ShamelaY19	26317	0.31641
		تاريخ الإسلام ووفيات المشاهير والأعلام [ج ٤٨]	شمس الدين محمّد بن أحمد بن عثمان الذّهبي	Rafed	3644	0.31576
		 المواعظ والإعتبار في ذكر الخطط والآثار ( ط بيروت ) 	 المقريزي 	ABLibrary	9234	0.31571
		 الذريعة 	 آقا بزرگ الطهراني 	ABLibrary	863	0.31568
		شرح طيبة النشر في القراءات العشر	محمد بن محمد بن محمد، أبو القاسم، محب الدين النُّوَيْري (المتوفى: 857هـ)	ShamAY	1527	0.31564
		لقطة العجلان مما تمس إلى معرفته حاجة الإنسان	أبو الطيب محمد صديق خان بن حسن بن علي ابن لطف الله الحسيني البخاري القِنَّوجي (المتوفى: 1307هـ)	ShamAY	10739	0.31562
		بغية الوعاة في طبقات اللغويين والنحاة	عبد الرحمن بن أبي بكر، جلال الدين السيوطي (المتوفى: 911هـ)	ShamAY	6744	0.31542
		كتاب المواعظ والإعتبار بذكر الخطط والآثار المعروف بالخطط المقريزيّة [ج ٢]	تقي الدين احمد بن علي المقريزي	Rafed	2320	0.31521
		إعلام النبلاء بتاريخ حلب الشهباء [ج ١]	محمد راغب بن محمود بن هاشم الطبّاخ الحلبي	Rafed	2341	0.31513
		إنباء الغمر بأبناء العمر	أبو الفضل أحمد بن علي بن محمد بن أحمد بن حجر العسقلاني (المتوفى: 852هـ)	ShamAY	26317	0.31511
		إنباء الأمراء بأنباء الوزراء	شمس الدين محمد بن علي بن خمارويه بن طولون الدمشقي الصالحي الحنفي (المتوفى: 953هـ)	ShamAY	31706	0.31495
		 علم اليقين في أصول الدين 	 الفيض الكاشاني 	ABLibrary	8516	0.31487
		بغية الوعاة في طبقات اللغويين والنحاة	عبد الرحمن بن أبي بكر، جلال الدين السيوطي (المتوفى: 911هـ)	ShamAY	38016	0.31455
		الذّريعة إلى تصانيف الشّيعة [ج ٢٦]	الشيخ آقا بزرك الطهراني	Rafed	511	0.31432
		الوفيات (معجم زمني للصحابة وأعلام المحدثين والفقهاء والمؤلفين)	أبو العباس أحمد بن حسن بن الخطيب الشهير بابن قنفذ القسنطيني (المتوفى: 810هـ)	ShamAY	10921	0.31429
		زبده  الحلب من تاريخ حلب	كمال الدين عمر بن احمد بن ابي جراده حلبي ( ابن العديم )	Ghbook	11367	0.31333
		رسائل آل طوق القطيفي [ج ٤]	الشيخ أحمد آل طوق	Rafed	1410	0.31327
		العقد الثّمين في تاريخ البلد الأمين [ج ٢]	تقي الدين محمّد بن أحمد الحسني الفاسي المكّي	Rafed	2212	0.31312
		 العقد الثمين في تاريخ البلد الأمين 	 محمد بن أحمد الفاسي 	ABLibrary	9142	0.31296
		ذيل تذكرة الحفاظ للحسيني	شمس الدين أبو المحاسن محمد بن علي بن الحسن بن حمزة الحسيني الدمشقي الشافعي (المتوفى: 765هـ)	ShamAY	7307	0.31291
		تاريخ الإسلام ووفيات المشاهير والأعلام [ج ٥٠]	شمس الدين محمّد بن أحمد بن عثمان الذّهبي	Rafed	3663	0.31231
		وفيات جماعة من المحدثين لأبي مسعود الحاجي	عبد الرحيم بن علي بن أحمد الأصبهاني، أبو مسعود الحاجيّ ابن أبي الوفاء (المتوفى: 566هـ)	ShamAY	26437	0.31212
		وفيات جماعة من المحدثين لأبي مسعود الحاجي	عبد الرحيم بن علي بن أحمد الأصبهاني، أبو مسعود الحاجي ابن أبي الوفاء (المتوفى: 566ه)	ShamelaY19	26437	0.312
		 تاريخ سني ملوك الارض والانبياء ( ع ) 	 حمزة بن الحسن الأصفهاني 	ABLibrary	8047	0.31091
		خطط الشام [ج ٢]	محمّد كرد علي	Rafed	2279	0.31044
		كتاب المواعظ والإعتبار بذكر الخطط والآثار المعروف بالخطط المقريزيّة [ج ٣]	تقي الدين احمد بن علي المقريزي	Rafed	2324	0.31
		كنوز الذّهب في تاريخ حلب [ج ١]	سبط ابن العجمي الحلبي	Rafed	2373	0.30955
		الدليل إلى المتون العلمية	عبد العزيز بن إبراهيم بن قاسم	ShamAY	9816	0.30894
		إبراز الغي الواقع في شفاء العي	الإمام محمد عبد الحي اللكنوي (ت1304هـ)	ShamAY	35998	0.30846
		الدرر الكامنة في أعيان المائة الثامنة	أبو الفضل أحمد بن علي بن محمد بن أحمد بن حجر العسقلاني (المتوفى: 852ه)	Sham19Y	6674	0.30715
		 كنوز الذهب في تاريخ حلب 	 أبي ذر سبط ابن العجمي 	ABLibrary	9167	0.30695
		تاريخ مختصر الدول	غريغوريوس (واسمه في الولادة يوحنا) ابن أهرون (أو هارون) بن توما الملطي، أبو الفرج المعروف بابن العبري (المتوفى: 685ه)	Sham19Y	12348	0.30681
		مطالع الدقائق في تحرير الجوامع والفوارق	جمال الدين الإسنوي	ShamelaY19	147671	0.30627
		 نهر الذهب في تاريخ حلب 	 الغزي 	ABLibrary	9310	0.30584
		الدرر الكامنة في أعيان المائة الثامنة	أبو الفضل أحمد بن علي بن محمد بن أحمد بن حجر العسقلاني (المتوفى: 852هـ)	ShamAY	6674	0.30563
		 الضوء اللامع لأهل القرن التاسع 	 شمس الدين السخاوي 	ABLibrary	952	0.30563
		إعلام النبلاء بتاريخ حلب الشهباء  - الجزء1	محمد راغب الطباخ	Masaha	4237	0.30532
		المختصر في أخبار البشر	أبو الفداء عماد الدين إسماعيل بن علي بن محمود بن محمد ابن عمر بن شاهنشاه بن أيوب، الملك المؤيد، صاحب حماة (المتوفى: 732هـ)	ShamAY	12715	0.30454
		 إعلام النبلاء بتاريخ حلب الشهباء 	 محمد راغب الطباخ الحلبي 	ABLibrary	8955	0.30423
		تاريخ مختصر الدول	غريغوريوس (واسمه في الولادة يوحنا) ابن أهرون (أو هارون) بن توما الملطي، أبو الفرج المعروف بابن العبري (المتوفى: 685هـ)	ShamAY	12348	0.30422
		الذّريعة إلى تصانيف الشّيعة [ج ٣]	الشيخ آقا بزرك الطهراني	Rafed	442	0.3042
		تاريخ ابن الوردي	عمر بن مظفر بن عمر بن محمد ابن أبي الفوارس، أبو حفص، زين الدين ابن الوردي المعري الكندي (المتوفى: 749ه)	Sham19Y	6624	0.30364
		إنباء الغمر بأبناء العمر - ط العلمية	الإمام / شهاب الدين أبي الفضل أحمد بن علي بن حجر العسقلاني	ShamAY	33811	0.30297
		تاريخ ابن الوردي	عمر بن مظفر بن عمر بن محمد ابن أبي الفوارس، أبو حفص، زين الدين ابن الوردي المعري الكندي (المتوفى: 749هـ)	ShamAY	6624	0.30289
		رحلة مصر والسودان‏	محمد مهري	Masaha	4384	0.30274
		تاريخ سني ملوك الأرض والأنبياء عليهم الصلاة والسلام	حمزة بن الحسن الأصفهاني (المتوفى: 360 هـ)	ShamAY	33836	0.30255
		عش مع الخلفاء والملوك (سيرة مختصرة)	الدكتور/ مرزوق بن هياس الزهراني	ShamelaY19	132443	0.3022
		العقد الثّمين في تاريخ البلد الأمين [ج ٣]	تقي الدين محمّد بن أحمد الحسني الفاسي المكّي	Rafed	2217	0.30205
		الفوائد البهية في تراجم الحنفية	أبو الحسنات محمد عبد الحي اللكنوي الهندي	ShamelaY19	132617	0.30175
		 العقد الثمين في تاريخ البلد الأمين 	 محمد بن أحمد الفاسي 	ABLibrary	9143	0.30164
		الدرر الكامنة في أعيان المائة الثامنة = التراجم	أبو الفضل أحمد بن علي بن محمد بن أحمد بن حجر العسقلاني (المتوفى: 852هـ)	ShamAY	38015	0.30158
		 المواعظ والإعتبار في ذكر الخطط والآثار ( ط لندن ) 	 المقريزي 	ABLibrary	9241	0.30148
		 دمشق في مرآت رحلات القرون الوسطى 	 أحمد ايبش 	ABLibrary	9068	0.30144
		 الضوء اللامع لأهل القرن التاسع 	 شمس الدين السخاوي 	ABLibrary	947	0.30085
		ذيل تذكرة الحفاظ للحسيني الدمشقي - ط العلمية = التراجم	أبو المحاسن الحسيني	ShamAY	38190	0.30062
		مختصر سنا البرق الشامي	الفتح بن علي بن محمد البنداري الأصفهاني، أبو إبراهيم (المتوفى: 643هـ)	ShamAY	5400	0.30059
		الضوء اللامع لأهل القرن التاسع	شمس الدين أبو الخير محمد بن عبد الرحمن بن محمد بن أبي بكر بن عثمان بن محمد السخاوي (المتوفى: 902هـ)	ShamAY	6675	0.30042
		 الضوء اللامع لأهل القرن التاسع 	 شمس الدين السخاوي 	ABLibrary	950	0.30035
		النوادر السلطانية والمحاسن اليوسفية = سيرة صلاح الدين الأيوبي	يوسف بن رافع بن تميم بن عتبة الأسدي الموصلي، أبو المحاسن، بهاء الدين ابن شداد (المتوفى: 632هـ)	ShamAY	12716	0.30032
		 رحلة مصر والسودان 	 محمد مهري كركوكي 	ABLibrary	9107	0.30024
		 إعلام النبلاء بتاريخ حلب الشهباء 	 محمد راغب الطباخ الحلبي 	ABLibrary	8956	0.29967
		الكواكب السائرة بأعيان المئة العاشرة	نجم الدين محمد بن محمد الغزي (المتوفى: 1061هـ)	ShamAY	10912	0.29953
		 الضوء اللامع لأهل القرن التاسع 	 شمس الدين السخاوي 	ABLibrary	956	0.29946
		 خطط الشام 	 محمد كرد علي 	ABLibrary	9055	0.29925
		بهجة الناظرين إلى تراجم المتأخرين من الشافعية البارعين	رضي الدين أبو البركات محمد بن أحمد بن عبد الله الغزي العامري الشافعي (المتوفى: 864 ه)	Sham19Y	20578	0.29895
		 خطط الشام 	 محمد كرد علي 	ABLibrary	9059	0.29883
		مشاهير أعلام المسلمين	علي بن نايف الشحود	ShamAY	35792	0.29879
		تاريخ الإسلام ووفيات المشاهير والأعلام [ج ٤١]	شمس الدين محمّد بن أحمد بن عثمان الذّهبي	Rafed	3604	0.2985
