automatic URI	Proposed URI	bookTitle	authorName	collection	id	tfidf
		مآثر الإنافة في معالم الخلافة	أحمد بن علي بن أحمد الفزاري القلقشندي ثم القاهري (المتوفى: 821هـ)	ShamAY	8460	0.29789
		طبقات الشافعية للحسيني	أبو بكر بن هداية الله الحسيني (1014هـ)	ShamAY	34643	0.29742
		خطط الشام [ج ٦]	محمّد كرد علي	Rafed	2288	0.29732
		تاج التراجم لابن قطلوبغا	أبو الفداء زين الدين أبو العدل قاسم بن قُطلُوبغا السودوني (نسبة إلى معتق أبيه سودون الشيخوني) الجمالي الحنفي (المتوفى: 879هـ)	ShamAY	1127	0.29728
		رفع الإصر عن قضاة مصر	أبو الفضل أحمد بن علي بن محمد بن أحمد بن حجر العسقلاني (المتوفى: 852هـ)	ShamAY	12724	0.29724
		مطالع الدقائق في تحرير الجوامع والفوارق	جمال الدين الإسنوي	Sham19Y	147671	0.29693
		فوات الوفيات	محمد بن شاكر بن أحمد بن عبد الرحمن بن شاكر بن هارون بن شاكر الملقب بصلاح الدين (المتوفى: 764هـ)	ShamAY	1003	0.29644
		نهر الذّهب في تاريخ حلب [ج ٣]	كامل البالي الحلبي [ الغزي ]	Rafed	3014	0.29609
		 ذيل تذكرة الحفاظ 	 محمد الحسيني الدمشقي 	ABLibrary	829	0.29528
		الإنصاف في حكم الاعتكاف، ومعه الإسعاف بتحشية الإنصاف - سلسلة لقاء العشر الأواخر بالمسجد الحرام (6)	محمد عبد الحي بن محمد عبد الحليم الأنصاري اللكنوي الهندي، أبو الحسنات (المتوفى: 1304 هـ)	ShamAY	32392	0.29524
		تاريخ الشّحر وأخبار القرن العاشر	محمّد بن عمر الطيّب بافقيه	Rafed	2219	0.29521
		الروضتين في أخبار الدولتين النورية والصلاحية	أبو القاسم شهاب الدين عبد الرحمن بن إسماعيل بن إبراهيم المقدسي الدمشقي المعروف بأبي شامة (المتوفى: 665 هـ)	ShamAY	32323	0.29448
		بهجة النفوس والأسرار في تاريخ دار هجرة النبي المختار  - الجزء1	عبد الله بن عبد الملك المرجاني	Masaha	3955	0.29417
		 مسالك الأبصار في ممالك الأمصار 	 أحمد بن يحيى العمري 	ABLibrary	9199	0.29403
		تاريخ المدينة المنوّرة	أبي محمّد عبد الله بن محمّد بن فرحون المالكي [ ابن فرحون ]	Rafed	2161	0.29373
		 الذريعة 	 آقا بزرگ الطهراني 	ABLibrary	848	0.29356
		تاريخ الإسلام ووفيات المشاهير والأعلام [ج ٤٧]	شمس الدين محمّد بن أحمد بن عثمان الذّهبي	Rafed	3643	0.293
		التاج المكلل من جواهر مآثر الطراز الآخر والأول	أبو الطيب محمد صديق خان بن حسن بن علي ابن لطف الله الحسيني البخاري القِنَّوجي (المتوفى: 1307هـ)	ShamAY	32275	0.29265
		شذرات من كتب مفقودة في التاريخ	استخرجها وحققها الدكتور إحسان عباس (المتوفى: 1424هـ)	ShamAY	1023	0.29209
		أهل البيت عليهم السلام في المكتبة العربية	السيّد عبد العزيز الطباطبائي	Rafed	702	0.29185
		مدرسة الحديث في مصر	محمد رشاد خليفة	Sham19Y	9974	0.29166
		تاريخ الإسلام ووفيات المشاهير والأعلام [ج ٥١]	شمس الدين محمّد بن أحمد بن عثمان الذّهبي	Rafed	3664	0.29123
		تاريخ الآداب العربية في القرن التاسع عشر والربع الأول من القرن العشرين	رزق الله بن يوسف بن عبد المسيح بن يعقوب شيخو (المتوفى: 1346هـ)	ShamAY	10438	0.29086
		مدرسة الحديث في مصر	محمد رشاد خليفة	ShamAY	9974	0.29051
		شذرات الذهب في أخبار من ذهب	عبد الحي بن أحمد بن محمد ابن العماد العَكري الحنبلي، أبو الفلاح (المتوفى: 1089هـ)	ShamAY	12398	0.2902
		 غاية المرام بأخبار سلطنة البلد الحرام 	 عبد العزيز بن عمر ابن فهد 	ABLibrary	9148	0.29018
		الرد الوافر	محمد بن عبد الله (أبي بكر) بن محمد ابن أحمد بن مجاهد القيسي الدمشقي الشافعي، شمس الدين، الشهير بابن ناصر الدين (المتوفى: 842هـ)	ShamAY	6660	0.2901
		الأيوبيون بعد صلاح الدين	عَلي محمد محمد الصَّلاَّبي	ShamAY	253	0.28993
		الزيارات بدمشق‏	محمود بن محمد عدوي الزوكاري	Masaha	4758	0.28988
		 تاريخ المدينة المنورة ( نصيحة المشاور وتسلية المجاور ) ( ط بيروت ) 	 ابن فرحون 	ABLibrary	9000	0.28963
		مطالع البدور ومنازل السرور	علي بن عبد الله الغزولي البهائي الدمشقي (المتوفى: 815ه)	Sham19Y	5390	0.28904
		 الذريعة 	 آقا بزرگ الطهراني 	ABLibrary	844	0.28853
		مطالع البدور ومنازل السرور	علي بن عبد الله الغزولي البهائي الدمشقي (المتوفى: 815هـ)	ShamAY	5390	0.2884
		أهل البيت عليهم السلام في المكتبة العربية	السيد عبد العزيز الطباطبائي	Masaha	1942	0.28802
		الانتصارات الإسلامية في كشف شبه النصرانية	سليمان بن عبد القوي بن الكريم الطوفي الصرصري، أبو الربيع، نجم الدين (المتوفى: 716هـ)	ShamAY	1125	0.28696
		 مسالك الأبصار في ممالك الأمصار 	 أحمد بن يحيى العمري 	ABLibrary	9189	0.28672
		 الزيارات ( بدمشق ) 	 القاضي محمود الزوكاري 	ABLibrary	9117	0.28668
		 أعيان الشيعة 	 السيد محسن الأمين 	ABLibrary	80	0.28655
		إعلام النبلاء بتاريخ حلب الشهباء [ج ٥]	محمد راغب بن محمود بن هاشم الطبّاخ الحلبي	Rafed	2380	0.28643
		سير أعلام النبلاء ط الحديث	شمس الدين أبو عبد الله محمد بن أحمد بن عثمان بن قايماز الذهبي (المتوفى: 748ه)	ShamelaY19	22669	0.28614
		الغصون اليانعة في محاسن شعراء المائة السابعة	أبو الحسن على بن موسى بن سعيد المغربي الأندلسي (المتوفى: 685هـ)	ShamAY	9235	0.28612
		أدوار علم الفقه وأطواره‏	الشيخ علي كاشف الغطاء	Masaha	2377	0.28571
		نيل الابتهاج بتطريز الديباج	أحمد بابا بن أحمد بن الفقيه الحاج أحمد بن عمر بن محمد التكروري التنبكتي السوداني، أبو العباس (المتوفى: 1036 هـ)	ShamAY	32462	0.28507
		موجز عن الدوله العثمانيه	آيت الله العظمي سيد محمد حسيني شيرازي	Ghbook	7849	0.28491
		سلم الوصول إلى طبقات الفحول	مصطفى بن عبد الله القسطنطيني العثماني المعروف ب «كاتب جلبي» وب «حاجي خليفة» (المتوفى 1067 ه)	Sham19Y	19199	0.28473
		 الانتصارات الإسلامية في كشف شبه النصرانية 	 سليمان بن عبد القوي الطوفي الصرصي الحنبلي 	ABLibrary	8312	0.28462
		الموسوعة الميسرة في تراجم أئمة التفسير والإقراء والنحو واللغة «من القرن الأول إلى المعاصرين مع دراسة لعقائدهم وشيء من طرائفهم»	مجموعة من المؤلفين	ShamelaY19	130964	0.28451
		 الضوء اللامع لأهل القرن التاسع 	 شمس الدين السخاوي 	ABLibrary	951	0.28442
		سير أعلام النبلاء ط الحديث	شمس الدين أبو عبد الله محمد بن أحمد بن عثمان بن قَايْماز الذهبي (المتوفى: 748هـ)	ShamAY	22669	0.28441
		الذّريعة إلى تصانيف الشّيعة [ج ١٣]	الشيخ آقا بزرك الطهراني	Rafed	463	0.28434
		 الأرج المسكي في التاريخ المكي وتراجم الملوك والخلفاء 	 علي بن عبد القادر الطبري 	ABLibrary	8928	0.28412
		طبقات المفسرين للداوودي	محمد بن علي بن أحمد، شمس الدين الداوودي المالكي (المتوفى: 945ه)	ShamelaY19	27084	0.28365
		الأوهام الواقعة في أسماء العلماء والأعلام	مصطفى بن قحطان الحبيب	ShamAY	35869	0.28352
		خلاصة الأثر في أعيان القرن الحادي عشر	محمد أمين بن فضل الله بن محب الدين بن محمد المحبي الحموي الأصل، الدمشقي (المتوفى: 1111ه)	Sham19Y	6678	0.2832
		 إتحاف الورى بأخبار أم القرى 	 عمر بن محمد ابن فهد 	ABLibrary	8943	0.28277
		إيضاح المكنون في الذيل على كشف الظنون	إسماعيل بن محمد أمين بن مير سليم الباباني البغدادي (المتوفى: 1399هـ)	ShamAY	851	0.28255
		تراثنا ـ العدد [ 5 ]	مؤسسة آل البيت عليهم السلام لإحياء التراث ـ قم	Rafed	2621	0.28235
		 إعلام النبلاء بتاريخ حلب الشهباء 	 محمد راغب الطباخ الحلبي 	ABLibrary	8961	0.28222
		تاريخ الإسلام ووفيات المشاهير والأعلام [ج ٤٥]	شمس الدين محمّد بن أحمد بن عثمان الذّهبي	Rafed	3637	0.28209
		الحوادث الجامعة والتجارب النافعة في المائة السابعة	كمال الدين عبد الرزاق بن أحمد المعروف بابن الفوطي (المتوفى: 723هـ)	ShamAY	37156	0.28205
		خلاصة الأثر في أعيان القرن الحادي عشر	محمد أمين بن فضل الله بن محب الدين بن محمد المحبي الحموي الأصل، الدمشقي (المتوفى: 1111هـ)	ShamAY	6678	0.28164
		تفسير الصراط المستقيم	آيت الله العظمي سيد حسين طباطبايي بروجردي	Ghbook	10769	0.28121
		العقد الثّمين في تاريخ البلد الأمين [ج ٥]	تقي الدين محمّد بن أحمد الحسني الفاسي المكّي	Rafed	2226	0.28082
		دار الحديث الأشرفية معلم حضاري للأمة في مسيرة ثمانية قرون	الشيخ محمد مجير الخطيب الحسني	ShamAY	37117	0.28053
		سلم الوصول إلى طبقات الفحول	مصطفى بن عبد الله القسطنطيني العثماني المعروف بـ «كاتب جلبي» وبـ «حاجي خليفة» (المتوفى 1067 هـ)	ShamAY	38787	0.28046
		 الذريعة 	 آقا بزرگ الطهراني 	ABLibrary	855	0.28045
		 العقد الثمين في تاريخ البلد الأمين 	 محمد بن أحمد الفاسي 	ABLibrary	9145	0.28026
		الإشارة إلى سيرة المصطفى وتاريخ من بعده من الخلفا	مغلطاي بن قليج بن عبد الله البكجري المصري الحكري الحنفي، أبو عبد الله، علاء الدين (المتوفى: 762ه)	ShamelaY19	122236	0.27999
		تاريخ دمشق	حمزة بن أسد بن علي بن محمّد التيّمي [ ابن القلانسي ]	Rafed	2269	0.27985
		نكث الهميان في نكت العميان	صلاح الدين خليل بن أيبك الصفدي (المتوفى: 764ه)	ShamelaY19	28182	0.27976
		تاريخ الشحر وأخبار القرن العاشر	محمد بن عمر طيب بافقية	Masaha	4137	0.27933
		 الضوء اللامع لأهل القرن التاسع 	 شمس الدين السخاوي 	ABLibrary	953	0.27933
		نكث الهميان في نكت العميان	صلاح الدين خليل بن أيبك الصفدي (المتوفى: 764هـ)	ShamAY	28182	0.279
		الغدير في التراث الإسلامي	السيد عبد العزيز الطباطبائي	Masaha	365	0.27854
		التحفة اللطيفة في تاريخ المدينة الشريفة [ج ١]	شمس الدين السخاوي	Rafed	2247	0.27854
		 الضوء اللامع لأهل القرن التاسع 	 شمس الدين السخاوي 	ABLibrary	954	0.2783
		الحوادث الجامعة والتجارب النافعة في المائة السابعة	كمال الدين أبو الفضل عبد الرزاق بن أحمد بن محمد الصابوني المعروف بابن الفوطي (المتوفى: 723ه)	Sham19Y	400	0.27821
		 الضوء اللامع لأهل القرن التاسع 	 شمس الدين السخاوي 	ABLibrary	955	0.27791
		ذيول تذكرة الحفاظ (الحسيني - ابن فهد - السيوطي)	أبو المحاسن الحسيني	ShamAY	34592	0.27755
		 الذريعة 	 آقا بزرگ الطهراني 	ABLibrary	849	0.27747
		 تاريخ دمشق 	 ابن القلانسي 	ABLibrary	8991	0.27747
		تاريخ صفد	محمد بن عبد الرحمان الحسيني العثماني	Masaha	4116	0.27738
		التحفة اللطيفة في تاريخ المدينة الشريفة  - الجزء1	محمد بن عبد الرحمن السخاوي	Masaha	4395	0.27733
		النور السافر عن أخبار القرن العاشر	محي الدين عبد القادر بن شيخ بن عبد الله العَيْدَرُوس (المتوفى: 1038هـ)	ShamAY	6676	0.27733
		 تاريخ صفد 	 محمد بن عبد الرحمن الحسيني العثماني 	ABLibrary	9016	0.27711
		البستان الجامع لجميع تواريخ أهل الزمان	عماد الدين أبو حامد محمد بن محمد الأصفهاني (المتوفى 597 هـ)	ShamAY	32593	0.27699
		أدوار علم الفقه وأطواره	الشيخ علي كاشف الغطاء	Rafed	3601	0.2769
		الرسالة المستطرفة لبيان مشهور كتب السنة المشرفة	أبو عبد الله محمد بن أبي الفيض جعفر بن إدريس الحسني الإدريسي الشهير بـ الكتاني (المتوفى: 1345هـ)	ShamAY	7636	0.27684
		 إعلام النبلاء بتاريخ حلب الشهباء 	 محمد راغب الطباخ الحلبي 	ABLibrary	8960	0.27665
		قيمة الزمن عند العلماء	عبد الفتاح أبو غدة الحلبي الحنفي (المتوفى: 1417ه)	ShamelaY19	96882	0.27662
		 الضوء اللامع لأهل القرن التاسع 	 شمس الدين السخاوي 	ABLibrary	957	0.2766
		عمدة الرعاية بتحشية شرح الوقاية	الإمام محمد عبد الحي اللكنوي (ت1304هـ)	ShamAY	33182	0.27651
		اهل البيت في المكتبة العربية	عبدالعزيز طباطبايي	Ghbook	9167	0.27643
		الذّريعة إلى تصانيف الشّيعة [ج ٢]	الشيخ آقا بزرك الطهراني	Rafed	441	0.2764
		قواعد الأحكام في معرفة الحلال و الحرام - الجزء1	العلامة الحلي	Masaha	760	0.27561
		كنوز الذّهب في تاريخ حلب [ج ٢]	سبط ابن العجمي الحلبي	Rafed	2375	0.2755
		المقفى الكبير	تقي الدين المقريزي (المتوفى: 845 ه = 1440 م)	ShamelaY19	145334	0.27525
		التحفة اللطيفة في تاريخ المدينة الشريفة	شمس الدين أبو الخير محمد بن عبد الرحمن بن محمد بن أبي بكر بن عثمان بن محمد السخاوي (المتوفى: 902هـ)	ShamAY	7434	0.27504
		النعت الأكمل لأصحاب الإمام أحمد بن حنبل [من سنة 901 - 1207 ه]	محمد كمال الدين بن محمد الغزي العامري (ت: 1214 ه)	ShamelaY19	147073	0.27477
		 الكامل في التاريخ 	 ابن الأثير 	ABLibrary	8256	0.27419
		إعلام النبلاء بتاريخ حلب الشهباء [ج ٦]	محمد راغب بن محمود بن هاشم الطبّاخ الحلبي	Rafed	2381	0.27411
		الجامع لسيرة شيخ الإسلام ابن تيمية خلال سبعة قرون	محمد عزيز بن شمس وعلي بن محمد العمران	ShamAY	32317	0.27405
		الحوادث الجامعة والتجارب النافعة في المائة السابعة	كمال الدين أبو الفضل عبد الرزاق بن أحمد بن محمد الصابوني المعروف بابن الفوطي (المتوفى: 723هـ)	ShamAY	400	0.27362
		إعلام النبلاء بتاريخ حلب الشهباء [ج ٧]	محمد راغب بن محمود بن هاشم الطبّاخ الحلبي	Rafed	2397	0.27361
		مصادر الفكر الإسلامي في اليمن للحبشي	عبد الله محمد الحبشي	ShamAY	34711	0.27352
		تاريخ صفد	محمّد بن عبد الرحمن الحسيني العثماني	Rafed	2230	0.27348
		نكت النهاية - الجزء1	المحقق الحلي	Masaha	1046	0.27338
		موسوعة تاريخ العراق بين احتلالين [ج ٣]	عباس العزاوي المحامي	Rafed	1921	0.27332
		المقصد الأرشد في ذكر أصحاب الإمام أحمد	إبراهيم بن محمد بن عبد الله بن محمد ابن مفلح، أبو إسحاق، برهان الدين (المتوفى: 884ه)	Sham19Y	5890	0.27292
		الأعلام للزركلي	خير الدين بن محمود بن محمد بن علي بن فارس، الزركلي الدمشقي (المتوفى: 1396ه)	Sham19Y	12286	0.27274
		المقصد الأرشد في ذكر أصحاب الإمام أحمد	إبراهيم بن محمد بن عبد الله بن محمد ابن مفلح، أبو إسحاق، برهان الدين (المتوفى: 884هـ)	ShamAY	5890	0.27268
		تكملة إكمال الإكمال في الأنساب والأسماء والألقاب	ابن الصابوني , محمد بن علي بن محمود، أبو حامد، جمال الدين المحمودي (المتوفى: 680ه)	ShamelaY19	21107	0.27266
		تراثنا ـ العدد [ 18 ]	مؤسسة آل البيت عليهم السلام لإحياء التراث ـ قم	Rafed	2738	0.2726
		موجز دائرة المعارف الإسلامية	مجموعة من المؤلفين	ShamAY	38887	0.27256
		 الكامل في التاريخ 	 ابن الأثير 	ABLibrary	8255	0.27248
		الجوهر المنضد في طبقات متأخري أصحاب أحمد	يوسف بن حسن بن أحمد بن حسن ابن عبد الهادي الصالحي، جمال الدين، ابن المبرد الحنبلي (المتوفى: 909 ه)	Sham19Y	17657	0.27234
		قيمة الزمن عند العلماء	عبد الفتاح أبو غدة الحلبي الحنفي (المتوفى: 1417هـ)	ShamAY	2030	0.27232
		موقف ابن تيمية من الأشاعرة	عبد الرحمن بن صالح المحمود	ShamAY	12766	0.27225
		الموسوعة الميسرة في تراجم أئمة التفسير والإقراء والنحو واللغة «من القرن الأول إلى المعاصرين مع دراسة لعقائدهم وشيء من طرائفهم»	مجموعة من المؤلفين	Sham19Y	130964	0.27217
		مختلف الشيعة في أحكام الشريعة - الجزء1	العلامة الحلي	Masaha	841	0.27211
		الذّريعة إلى تصانيف الشّيعة [ج ١]	الشيخ آقا بزرك الطهراني	Rafed	431	0.27207
		قلائد الجمان في فرائد شعراء هذا الزمان، المشهور ب «عقود الجمان في شعراء هذا الزمان»	كمال الدين أبو البركات المبارك بن الشعار الموصلي (المتوفى: 654 ه)	ShamelaY19	20990	0.27171
		تكملة إكمال الإكمال في الأنساب والأسماء والألقاب	ابن الصابوني , محمد بن علي بن محمود، أبو حامد، جمال الدين المحمودي (المتوفى: 680هـ)	ShamAY	21107	0.27151
		زيادات واستدراكات ألحقها محققا النعت الأكمل بالكتاب من وفاة المؤلف حتى نهاية القرن الرابع عشر الهجري	محمد مطيع الحافظ	ShamelaY19	147072	0.2714
		إرشاد الأذهان إلى أحكام الإيمان - الجزء1	العلامة الحلي	Masaha	749	0.2713
		الأرج المسكي في التاريخ المكي وتراجم الملوك والخلفاء	علي بن عبد القادر الطبري	Masaha	4487	0.27119
		العقد الثمين فى تاريخ البلد الأمين	تقي الدين محمد بن أحمد الحسني الفاسى المكي (المتوفى: 832 ه)	ShamelaY19	20989	0.27114
		 تاريخ بناكتى ( روضة اولى الالباب في معرفة التواريخ والانساب ) 	 داود بن محمد بناكتى ( فخر البناكتى ) ( تعريب : محمد عبد الكريم علي ) 	ABLibrary	8164	0.27105
		ذيل التقييد في رواة السنن والأسانيد	محمد بن أحمد بن علي، تقي الدين، أبو الطيب المكي الحسني الفاسي (المتوفى: 832هـ)	ShamAY	8884	0.27079
		 كنوز الذهب في تاريخ حلب 	 أبي ذر سبط ابن العجمي 	ABLibrary	9168	0.27076
		موسوعة العتبات المقدسة - الجزء1	جعفر الخليلي	Masaha	3049	0.27067
		موسوعة العتبات المقدسة  - الجزء1	جعفر الخليلي	Masaha	3747	0.27057
		قلائد الجمان في فرائد شعراء هذا الزمان، المشهور بـ «عقود الجمان في شعراء هذا الزمان»	كمال الدين أبو البركات المبارك بن الشعار الموصلي (المتوفى: 654 هـ)	ShamAY	38967	0.27046
		الأعلام للزركلي	خير الدين بن محمود بن محمد بن علي بن فارس، الزركلي الدمشقي (المتوفى: 1396هـ)	ShamAY	12286	0.26997
		 موسوعة العتبات المقدسة 	 جعفر الخليلي 	ABLibrary	9244	0.26968
		الجوهر المنضد في طبقات متأخري أصحاب أحمد	يوسف بن حسن بن أحمد بن حسن ابن عبد الهادي الصالحي، جمال الدين، ابن المِبْرَد الحنبلي (المتوفى: 909 هـ)	ShamAY	32329	0.26965
		نواهد الأبكار وشوارد الأفكار = حاشية السيوطي على تفسير البيضاوي	عبد الرحمن بن أبي بكر، جلال الدين السيوطي (المتوفى: 911هـ)	ShamAY	21	0.26965
		الاعتقاد الخالص من الشك والانتقاد	علي بن إبراهيم بن داود بن سلمان بن سليمان، أبو الحسن، علاء الدين ابن العطار (المتوفى: 724هـ)	ShamAY	32187	0.26947
		العقد الثّمين في تاريخ البلد الأمين [ج ٤]	تقي الدين محمّد بن أحمد الحسني الفاسي المكّي	Rafed	2225	0.26947
		رحلة ابن معصوم المدني أو سلوة الغريب وأسوة الأريب	السيد علي صدر الدين المدني	Rafed	2267	0.26946
		 موسوعة تاريخ العراق بين احتلالين 	 عباس العزاوي المحامي 	ABLibrary	9257	0.26945
		منائح الكرم في أخبار مكة والبيت وولاة الحرم [ج ٢]	علي بن تاج الدين بن تقي الدين السنجاري	Rafed	2690	0.26939
		تاريخ البناكتي = روضة أولي الألباب في معرفه التواريخ والأنساب	أبو سليمان داود بن أبي الفضل محمد البناكتي (المتوفى: 730 هـ)	ShamAY	33833	0.26928
		تاريخ الإسلام ووفيات المشاهير والأعلام [ج ٣١]	شمس الدين محمّد بن أحمد بن عثمان الذّهبي	Rafed	3566	0.26921
		حلية البشر في تاريخ القرن الثالث عشر	عبد الرزاق بن حسن بن إبراهيم البيطار الميداني الدمشقي (المتوفى: 1335ه)	ShamelaY19	31371	0.2692
		حلية البشر في تاريخ القرن الثالث عشر	عبد الرزاق بن حسن بن إبراهيم البيطار الميداني الدمشقي (المتوفى: 1335هـ)	ShamAY	31371	0.26879
		تاريخ الخلفاء لأبي عبد الله محمد بن يزيد - مخطوط	أبو عبد الله محمد بن يزيد	ShamAY	38110	0.26877
		تاريخ وفاة الشيوخ الذين أدركهم البغوي	أبو القاسم عبد الله بن محمد بن عبد العزيز بن المَرْزُبان بن سابور بن شاهنشاه البغوي (المتوفى: 317هـ)	ShamAY	27106	0.26872
		السحب الوابلة على ضرائح الحنابلة	محمد بن عبد الله بن حميد النجدي ثم المكي (المتوفى: 1295 ه)	ShamelaY19	144222	0.26869
		روائع المخطوطات الفارسيه المصوره بدارالكتب المصريه	هبه نايل بركات	Ghbook	10391	0.26862
		تاريخ دمشق‏  - الجزء1	سهيل زكار	Masaha	3958	0.2682
