automatic URI	Proposed URI	bookTitle	authorName	collection	id	tfidf
		التفسير النبوي مُقَدِّمَةٌ تَأْصِيْلِيَّةٌ مَعَ دِرَاسَةٍ حَدِيثِيَّةٍ لِأَحَادِيْثِ التَّفْسِيْرِ النَّبَوِيِّ الصَّريح	خالد بن عبد العزيز الباتلي	ShamAY	32142	0.26584
		ذكر من لم يكن عنده إلا حديث واحد ومن لم يحدث عن شيخه إلا بحديث واحد	أبو محمد الحسن بن محمد بن الحسن بن علي البغدادي الخلال (المتوفى: 439ه)	Sham19Y	12546	0.26582
		شرح صحيح مسلم للقاضى عياض المسمى إكمال المعلم بفوائد مسلم	عياض بن موسى بن عياض بن عمرون اليحصبي السبتي، أبو الفضل (المتوفى: 544ه)	ShamelaY19	122406	0.26582
		نظرة في كتاب منهاج السنّة النبويّة لابن تيميّة الحرّاني	العلامة الأميني	Rafed	3418	0.26576
		أسباب النزول للواحدي - مؤسسة الحلبي	الواحدي	ShamAY	36754	0.26574
		إزالة الشبهة عن حديث التربة	عبد القادر بن حبيب الله السندي	ShamAY	22821	0.2657
		شم العوارض في ذم الروافض	علي بن (سلطان) محمد، أبو الحسن نور الدين الملا الهروي القاري (المتوفى: 1014ه)	ShamelaY19	37559	0.26569
		أمالي أبي يعلى الفراء	القاضي أبو يعلى، محمد بن الحسين بن محمد بن خلف المعروف بـ ابن الفراء (المتوفى: 458هـ)	ShamAY	29876	0.26567
		من مجالس أبي سعيد النقاش رواية أبي مطيع الصحاف - مخطوط (ن)	أبو سعيد محمد بن علي بن عمر بن مهدي الأصبهاني الحنبلي النقاش (المتوفى: 414هـ)	ShamAY	21702	0.26567
		فضائل الشام ودمشق لأبي الحسن الربعي	علي بن محمد بن صافي بن شجاع الربعي، أبو الحسن، ويعرف بابن أبي الهول (المتوفى: 444هـ)	ShamAY	26527	0.26566
		القول الجازم في سقوط الحد بنكاح المحارم	الإمام محمد عبد الحي اللكنوي (ت1304هـ)	ShamAY	36009	0.26561
		الفصول المهمة في معرفة الأئمة(ع) - الجزء1	ابن صباغ المالكي‏	Masaha	2915	0.26561
		فنون العجائب لأبي سعيد النقاش - ت: مشهور	أبي سعيد محمد بن علي بن أبي اسحاق القراب	ShamAY	33623	0.2656
		طعنة في قلب علي رضي الله عنه	إبراهيم عبد الفتاح المتناوي	ShamAY	35837	0.26551
		فيما ورد عن شفيع الخلق يوم القيامة أنه احتجم وأمر بالحجامة	البوصيري (840 هـ)	ShamAY	34314	0.26549
		فوائد أبي يعلى الخليلي	أبو يعلى الخليلي، خليل بن عبد الله بن أحمد بن إبراهيم بن الخليل القزويني (المتوفى: 446ه)	Sham19Y	8240	0.26549
		أحاديث مستخرجة من مسموعات زاهر بن طاهر الشحامي - مخطوط	زاهر بن طاهر الشحامي	ShamAY	32884	0.26545
		 الغارات ( ط . ق ) 	 إبراهيم بن محمد الثقفي الكوفي 	ABLibrary	7898	0.26543
		الثاني والعشرون من المشيخة البغدادية لأبي طاهر السلفي	صدر الدين، أبو طاهر السلفي أحمد بن محمد بن أحمد بن محمد بن إبراهيم سلفه الأصبهاني (المتوفى: 576ه)	Sham19Y	30099	0.26541
		العواصم من القواصم في تحقيق مواقف الصحابة بعد وفاة النبي صلى الله عليه وسلم	القاضي محمد بن عبد الله أبو بكر بن العربي المعافري الاشبيلي المالكي (المتوفى: 543هـ)	ShamAY	30897	0.26539
		عيد الغدير في الاسلام و التتويج و القربات يوم الغدير	عبدالحسين اميني ( علامه اميني )	Ghbook	7678	0.26538
		ثلاثة مجالس في الحديث للجوهري رواية ابن البناء - مخطوط	أبو محمد الحسن بن علي الجوهري	ShamAY	32954	0.26537
		أخبار الثقلاء للخلال	أبو محمد الحسن بن محمد بن الحسن بن علي البغدادي الخلال (المتوفى: 439ه)	ShamelaY19	26758	0.26525
		العناية بالقرآن الكريم وعلومه من بداية القرن الرابع الهجري إلى عصرنا الحاضر	د. نبيل بن محمد آل إسماعيل	ShamAY	8517	0.26524
		السابع عشر من المشيخة البغدادية لأبي طاهر السلفي	صدر الدين، أبو طاهر السلفي أحمد بن محمد بن أحمد بن محمد بن إبراهيم سلفه الأصبهاني (المتوفى: 576ه)	ShamelaY19	30123	0.26524
		تفسير القرآن العظيم (ابن كثير)	أبو الفداء إسماعيل بن عمر بن كثير القرشي البصري ثم الدمشقي (المتوفى: 774هـ)	ShamAY	23604	0.26523
		الثاني من المصباح في عيون الصحاح	عبد الغني بن عبد الواحد بن علي بن سرور المقدسي الجماعيلي الدمشقي الحنبلي، أبو محمد، تقي الدين (المتوفى: 600هـ)	ShamAY	30617	0.26522
		صب الخمول على من وصل أذاه إلى الصالحين من أولياء الله (مطبوع ضمن مجموع رسائل ابن عبد الهادي)	يوسف بن حسن بن أحمد بن حسن ابن عبد الهادي الصالحي، جمال الدين، ابن المِبْرَد الحنبلي (المتوفى: 909 هـ)	ShamAY	32311	0.26517
		الاحاديث المشتركه حول الامام المهدي	محمد امير ناصري	Ghbook	16363	0.26517
		ذم الدنيا	أبو بكر عبد الله بن محمد بن عبيد بن سفيان بن قيس البغدادي الأموي القرشي المعروف بابن أبي الدنيا (المتوفى: 281ه)	ShamelaY19	21546	0.26515
		عناية العلماء بالإسناد وعلم الجرح والتعديل وأثر ذلك في حفظ السنة النبوية	صالح بن حامد بن سعيد الرفاعي	ShamAY	11305	0.26511
		الشيعة وفنون الإسلام	السيد حسن الصدر	Masaha	635	0.2651
		عشرة أحاديث منتخبة من الجزء الثالث عشر من حديث أبي طاهر الذهلي - مخطوط	محمد بن أحمد بن عبد الله بن نصر الذُّهْلي، أبو الطاهر المالكي (المتوفى: 367هـ)	ShamAY	10485	0.26508
		إحقاق الحقّ وإزهاق الباطل [ج ٣]	السيّد نور الله الحسيني المرعشي التستري	Rafed	2707	0.26504
		الفهرست - فهرست أسماء علماء الشيعة و مصنفيهم‌	الشيخ منتجب الدين علي بن بابويه القمي	Masaha	3497	0.26501
		الثاني من أمالي أبي الحسين بن بشران	علي بن محمد بن عبد الله بن بشران الأموي أبو الحسين البغدادي المعدل (المتوفى: 415هـ)	ShamAY	30399	0.265
		الثبات عند الممات	جمال الدين أبو الفرج عبد الرحمن بن علي بن محمد الجوزي (المتوفى: 597ه)	Sham19Y	6789	0.26499
		جمهرة أنساب العرب لابن الكلبي	أبو المنذر هشام بن محمد أبي النضر ابن السائب ابن بشر الكلبي (المتوفى: 204ه)	Sham19Y	504	0.26493
		مأخذ العلم لابن فارس	أحمد بن فارس بن زكرياء القزويني الرازي، أبو الحسين (المتوفى: 395ه)	ShamelaY19	26675	0.26493
		الإيثار بمعرفة رواة الآثار	أبو الفضل أحمد بن علي بن محمد بن أحمد بن حجر العسقلاني (المتوفى: 852هـ)	ShamAY	5861	0.2649
		المفهوم الصحيح للتوسل	حماد بن محمد الأنصاري الخزرجي السعدي (المتوفى: 1418هـ)	ShamAY	8946	0.2649
		من حديث ابن مندة والشيرازي لعائشة بنت الحسن الوركاني - مخطوط	عائشة بنت الحسن بن إبراهيم الوركاني	ShamAY	32897	0.26486
		الفوائد العوالي المنتقاة من أصول سماعات الحرمي - مخطوط		ShamAY	32764	0.26484
		خمسة أحاديث مسلسلات لضياء الدين المقدسي	ضياء الدين أبو عبد الله محمد بن عبد الواحد المقدسي (المتوفى: 643هـ)	ShamAY	29449	0.26483
		شعب المقال في درجات الرجال	ابوالقاسم بن محمد بن احمد ابوالقاسم نراقي	Ghbook	9011	0.26483
		الثاني من الفوائد المنتقاة لابن السماك ويليه من حديث دعلج للحمامي	عثمان بن أحمد بن عبيد الله بن يزيد، أبو عمرو الدقاق، ابن السماك (المتوفى: 344ه)	ShamelaY19	29940	0.26482
		تاريخ المدينة	قطب الدين الحنفي	Rafed	2192	0.2648
		اصول الكافي	محمد بن يعقوب شيخ كليني	Ghbook	2153	0.2648
		أخبار الدجال لعبد الغني المقدسي	عبد الغني بن عبد الواحد بن علي بن سرور المقدسي الجماعيلي الدمشقي الحنبلي، أبو محمد، تقي الدين (المتوفى: 600هـ)	ShamAY	1303	0.26479
		الجزء الثاني من الحربيات لعلي بن عمر الحربي - مخطوط (ن)	علي بن عمر بن محمد بن الحسين ابن شاذان، أبو الحسن السكري الحربي الصيرفي الكيال (المتوفى: 386هـ)	ShamAY	10494	0.26479
		بغية الراوي في ترجمة الإمام النواوي	الإمام كمال الدين أبي عبد الله محمد بن محمد بن عبد الرحمن الشافعي المعروف بابن إمام الكاملية (874 هـ)	ShamAY	34635	0.26478
		المعجم لابن المقرئ	أبو بكر محمد بن إبراهيم بن علي بن عاصم بن زاذان الأصبهاني الخازن، المشهور بابن المقرئ (المتوفى: 381ه)	Sham19Y	8244	0.26478
		أدب الطّف أو شعراء الحسين عليه السلام [ج ١]	جواد شبّر	Rafed	230	0.26477
		الروض الأنف في شرح السيرة النبوية - الجزء1	عبد الرحمن السهيلي	Masaha	2028	0.26477
		إِحْكَامُ النَّظَرِ فِي أَحْكَامِ النَّظَرِ بِحَاسَّةِ البَصَرِ	علي بن محمد بن عبد الملك الكتامي الحميري الفاسي، أبو الحسن ابن القطان (المتوفى: 628 هـ)	ShamAY	32285	0.26476
		الجزء الرابع من فضائل أبي حنيفة وأخباره ومناقبه للسعدي - مخطوط	أبو القاسم عبد الله بن محمد بن أحمد بن يحيى بن الحارث السعدي	ShamAY	32755	0.26473
		 بحوث في الملل والنحل 	 الشيخ السبحاني 	ABLibrary	8361	0.2647
		 نظرة في كتاب منهاج السنة النبوية ( من فيض الغدير ) 	 الشيخ الأميني 	ABLibrary	8666	0.2647
		العتيق مصنف جامع لفتاوى أصحاب النبي صلى الله عليه وسلم	محمد بن مبارك حكيمي	ShamAY	33183	0.26469
		السُّنَنُ وَالأحْكَامُ عَن المُصْطَفَى عَلَيهِ أَفْضَل الصَّلاَة والسَّلاَم	ضياء الدين أبو عبد الله محمد بن عبد الواحد المقدسي (المتوفى: 643هـ)	ShamAY	31613	0.26469
		مسند الإمام الكاظم أبي الحسن موسى بن جعفر(ع) - الجزء1	عزيز الله عطاردي‏	Masaha	2470	0.26469
		طبقات فحول الشعراء	محمد بن سلّام (بالتشديد) بن عبيد الله الجمحي بالولاء، أبو عبد الله (المتوفى: 232هـ)	ShamAY	6738	0.26468
		منتقى حديث أبي الحسن أحمد بن إبراهيم بن عبدويه بن سدوس العبدويي	ضياء الدين أبو عبد الله محمد بن عبد الواحد المقدسي (المتوفى: 643هـ)	ShamAY	26339	0.26468
		تدوين السنة النبوية في القرنين الثاني والثالث للهجرة	محمد بن صادق بنكيران	ShamAY	11090	0.26467
		الفخري في أنساب الطالبيين‏	السيد عز الدين القاضي المروزي‏	Masaha	2914	0.26467
		طيّب الكلِم في صلة الرحِم	أبو يوسف محمد زايد	ShamAY	35200	0.26466
		اللآلئ المنثورة في الأحاديث المشهورة المعروف بـ (التذكرة في الأحاديث المشتهرة)	أبو عبد الله بدر الدين محمد بن عبد الله بن بهادر الزركشي الشافعي (المتوفى: 794هـ)	ShamAY	1413	0.26465
		الأحكام الشرعية الكبرى	عبد الحق بن عبد الرحمن بن عبد الله بن الحسين بن سعيد إبراهيم الأزدي، الأندلسي الأشبيلي، المعروف بابن الخراط (المتوفى : 581هـ)	ShamAY	4289	0.26465
		معجم البلدان - الفكر	ياقوت بن عبد الله الحموي أبو عبد الله	ShamAY	33803	0.26464
		كتاب في علم الحديث للداني	عثمان بن سعيد بن عثمان بن عمر أبو عمرو الداني (المتوفى: 444ه)	Sham19Y	30386	0.26464
		جزء من حديث الضياء المقدسي - مخطوط	ضياء الدين أبو عبد الله محمد بن عبد الواحد بن أحمد المقدسي	ShamAY	38056	0.26462
		الثاني من الفوائد المنتقاة لابن السماك ويليه من حديث دعلج للحمامي	عثمان بن أحمد بن عبيد الله بن يزيد، أبو عمرو الدقاق، ابن السماك (المتوفى: 344ه)	Sham19Y	29940	0.26462
		مجلس من أمالي أبي الفتح المقدسي_1	نصر بن إبراهيم بن نصر بن إبراهيم ابن داود النابلسي المقدسي، أبو الفتح الشافعي (المتوفى: 490ه)	ShamelaY19	29895	0.26462
		حديث مدينة العلم	الشيخ عبد الحسين الأميني النجفي	Masaha	233	0.26461
		أمالي ابن منده- رواية البزاني	أبو عبد الله محمد بن إسحاق بن محمد بن يحيى بن منده العبدي (المتوفى: 395ه)	ShamelaY19	29737	0.2646
		التَّفْسِيرُ البَسِيْط	أبو الحسن علي بن أحمد بن محمد بن علي الواحدي، النيسابوري، الشافعي (المتوفى: 468هـ)	ShamAY	31808	0.26459
		فضل يوم عرفة لأبي بكر الوراق	أبو بكر محمد بن إسماعيل بن العباس البغدادي المستملي الوراق (المتوفى: 378ه)	Sham19Y	27097	0.26459
		الذيل على جزء بقي بن مخلد من أحاديث الحوض (مطبوع مع كتاب الحوض والكوثر لبقي بن مخلد)	أبو القاسم خلف بن عبد الملك بن مسعود بن بشكوال الخزرجي الأنصاري الأندلسي (المتوفى: 578هـ)	ShamAY	6753	0.26451
		المجروحين من المحدثين والضعفاء والمتروكين	محمد بن حبان بن أحمد بن حبان بن معاذ بن معبد، التميمي، أبو حاتم، الدارمي، البستي (المتوفى: 354ه)	Sham19Y	5834	0.26451
		إحقاق الحقّ وإزهاق الباطل [ج ٢٢]	آية الله السيّد شهاب الدين الحسيني المرعشي النجفي	Rafed	2763	0.26449
		 أعيان الشيعة 	 السيد محسن الأمين 	ABLibrary	78	0.26448
		 معرفة الإمام 	 السيد محمد حسين الطهراني 	ABLibrary	8895	0.26447
		كتاب المحاربة من موطأ ابن وهب	أبو محمد عبد الله بن وهب بن مسلم المصري القرشي (المتوفى: 197ه)	ShamelaY19	30173	0.26447
		فضل أبي بكر الصديق رضي الله عنه	تقي الدين أبو العَباس أحمد بن عبد الحليم بن عبد السلام بن عبد الله بن أبي القاسم بن محمد ابن تيمية الحراني الحنبلي الدمشقي (المتوفى: 728هـ)	ShamAY	22808	0.26443
		سؤالات السلمي للدارقطني	محمد بن الحسين بن محمد بن موسى بن خالد بن سالم النيسابوري، أبو عبد الرحمن السلمي (المتوفى: 412هـ)	ShamAY	1680	0.26443
		طبقات المحدثين بأصبهان والواردين عليها [ج ٤]	أبي محمّد عبدالله بن محمّد بن جعفر بن حيّان [ أبي الشيخ الأنصاري ]	Rafed	2438	0.26442
		العَرْفُ الوَرْدِي في أخبار المَهْدِي	السيوطي	ShamAY	36053	0.26436
		الصحيحان في الميزان	آيت الله علي حسيني ميلاني	Ghbook	4796	0.26436
		بدائع البدائه	علي بن ظافر بن حسين الأزدي الخزرجي، أبو الحسن جمال الدين (المتوفى: 613ه)	ShamelaY19	21559	0.26435
		النزول للدارقطني	أبو الحسن علي بن عمر بن أحمد بن مهدي بن مسعود بن النعمان بن دينار البغدادي الدارقطني (المتوفى: 385هـ)	ShamAY	13074	0.26434
		نفحات الأزهار في خلاصة عبقات الأنوار [ج ١]	السيّد علي الحسيني الميلاني	Rafed	426	0.2643
		 مسند الإمام الباقر ( ع ) 	 الشيخ عزيز الله عطاردي 	ABLibrary	7709	0.2643
		كتاب السنة (ومعه ظلال الجنة في تخريج السنة بقلم: محمد ناصر الدين الألباني)	أبو بكر بن أبي عاصم وهو أحمد بن عمرو بن الضحاك بن مخلد الشيباني (المتوفى: 287هـ)	ShamAY	12051	0.26428
		صحيح وضعيف تاريخ الطبري	الإمام أبو جعفر بن جرير الطبري (224 - 310 ه)	ShamelaY19	145435	0.26428
		 إثبات الهداة بالنصوص والمعجزات 	 الحر العاملي 	ABLibrary	7393	0.26427
		عدة مجالس من أمالي محمد بن إبراهيم الجرجاني - مخطوط		ShamAY	32781	0.26426
		ضوابط الجرح والتعديل مع دراسة تحليلية لترجمة إسرائيل بن يونس	عبد العزيز بن محمد آل عبد اللطيف	ShamAY	37316	0.26426
		العقد الثمين فى تاريخ البلد الأمين	تقي الدين محمد بن أحمد الحسني الفاسى المكي (المتوفى: 832 هـ)	ShamAY	38892	0.26426
		جزء البطاقة للكناني	حمزة بن محمد بن علي بن العباس، أبو القاسم الكناني المصري (المتوفى: 357هـ)	ShamAY	13100	0.26425
		مجلس من أمالي أبي العباس منير بن أحمد الخشاب	أبو العباس منير بن أحمد الخشاب	ShamAY	33640	0.26424
		سيرة ابن إسحاق	محمد بن إسحاق بن يسار	Masaha	2221	0.26424
		الروض الأنف في شرح السيرة النبوية لابن هشام	أبو القاسم عبد الرحمن بن عبد الله بن أحمد السهيلي (المتوفى: 581هـ)	ShamAY	1514	0.26423
		جزء فيه مجلسان من أمالي أبي الحسين بن بشران	علي بن محمد بن عبد الله بن بشران الأموي أبو الحسين البغدادي المعدل (المتوفى: 415هـ)	ShamAY	26562	0.26422
		أمالي ابن بشران - الجزء الثاني	أبو القاسم عبد الملك بن محمد بن عبد الله بن بشْران بن محمد بن بشْران بن مهران البغدادي (المتوفى: 430هـ)	ShamAY	12842	0.26422
		 حلية الأبرار في أحوال محمد وآله الأطهار ( ع ) 	 السيد هاشم البحراني 	ABLibrary	7488	0.26421
		الجامع لابن وهب ت رفعت فوزي عبد المطلب	أبو محمد عبد الله بن وهب بن مسلم المصري القرشي (المتوفى: 197ه)	ShamelaY19	26865	0.26419
		الشيع و النص	جاسم  هاتو الموسوي	Ghbook	10553	0.26419
		مصادر الفقه المالكي «أصولا وفروعا في المشرق والمغرب قديما وحديثا»	أبو عاصم بشير ضيف بن أبي بكر بن البشير بن عمر العربي نسباً الجزائري بلداً المالكي مذهباً	ShamAY	32023	0.26413
		مسند المقلين من الأمراء والسلاطين لتمام بن محمد الدمشقي	أبو القاسم تمام بن محمد بن عبد الله بن جعفر بن عبد الله بن الجنيد البجلي الرازي ثم الدمشقي (المتوفى: 414هـ)	ShamAY	13164	0.26413
		مختصر كفاية المهتدي لمعرفة المهدي عليه السلام	مير لوحي سبزواري	Masaha	4067	0.26407
		حديث ابن أبي المكارم	ضياء الدين أبو عبد الله محمد بن عبد الواحد المقدسي (المتوفى: 643ه)	ShamelaY19	29653	0.26407
		الغوامض والمبهمات لعبدالغني بن سعيد	أبو محمد عبد الغني بن سعيد بن علي بن بشر بن مروان الأزدي المصري (المتوفى: 409هـ)	ShamAY	26507	0.26405
		نشر الصحيفة في ذكر الصحيح من أقوال أئمة الجرح والتعديل في أبي حنيفة	أَبِو عَبد الرَّحمَن مُقْبلُ بنُ هَادِي بنِ مُقْبِلِ بنِ قَائِدَةَ (اسم رجل) الهَمْدَاني الوادعِيُّ (المتوفى: 1422هـ)	ShamAY	2020	0.26405
		وقعة صفين‏	مؤمن بن حسن الشبلنجي‏	Masaha	3026	0.26405
		ثلاثة مجالس من أمالي ابن عبدكويه - مخطوط	أبو الحسن علي بن يحيى بن جعفر بن عبدكويه	ShamAY	38153	0.26403
		أمالي ابن منده- رواية البزاني	أبو عبد الله محمد بن إسحاق بن محمد بن يحيى بن منده العبدي (المتوفى: 395ه)	Sham19Y	29737	0.26403
		تذكرة المحتاج إلى أحاديث المنهاج (تخريج منهاج الأصول للبيضاوي)	ابن الملقن سراج الدين أبو حفص عمر بن علي بن أحمد الشافعي المصري (المتوفى: 804هـ)	ShamAY	9569	0.26402
		المعجم الكبير للطبراني	سليمان بن أحمد بن أيوب بن مطير اللخمي الشامي، أبو القاسم الطبراني (المتوفى: 360هـ)	ShamAY	1733	0.264
		مناورات الأشقياء لقتل خاتم الأنبياء	أبو يوسف محمد زايد	ShamAY	37410	0.26399
		الشافي في شرح مسند الشافعي لابن الأثير	مجد الدين أبو السعادات المبارك بن محمد بن محمد بن محمد ابن عبد الكريم الشيباني الجزري ابن الأثير (المتوفى: 606ه)	Sham19Y	13241	0.26397
		الخامس من الأفراد لابن شاهين	أبو حفص عمر بن أحمد بن عثمان بن أحمد بن محمد بن أيوب بن أزداذ البغدادي المعروف ب ابن شاهين (المتوفى: 385ه)	ShamelaY19	26514	0.26395
		دلائل النبوة لإسماعيل لأصبهاني	إسماعيل بن محمد بن الفضل بن علي القرشي الطليحي التيمي الأصبهاني، أبو القاسم، الملقب بقوام السنة (المتوفى: 535هـ)	ShamAY	6569	0.26393
		دلائل الصدق لنهج الحق - الجزء1	الشيخ محمد حسن المظفر	Masaha	274	0.26388
		جزء فيه ثلاثة أحاديث مسلسلة	صدر الدين، أبو طاهر السلفي أحمد بن محمد بن أحمد بن محمد بن إبراهيم سلفه الأصبهاني (المتوفى: 576ه)	ShamelaY19	30047	0.26388
		تفسير القرآن العظيم [ج ٤]	أبي الفداء اسماعيل بن عمر ابن كثير الدمشقي	Rafed	3410	0.26385
		شعب الإيمان للبيهقي - العلمية	أبو بكر أحمد بن الحسين البيهقي	ShamAY	33962	0.26383
		الثقات لابن حبان - ط العلمية = التراجم	أبو حاتم بن حبان (354هـ)	ShamAY	38017	0.26382
		الفوائد المخرجة من الأصول عن شيوخ ابن المهتدي - مخطوط		ShamAY	32765	0.26381
		الهجرة إلى الثقلين	محمد گوزل الآمدي	Masaha	477	0.2638
		المعجم الكبير للطبراني - ط إحياء التراث	أبو القاسم سليمان بن أحمد الطبراني	ShamAY	38094	0.26379
		الأعلام للزركلي	خير الدين بن محمود بن محمد بن علي بن فارس، الزركلي الدمشقي (المتوفى: 1396ه)	Sham19Y	12286	0.26378
		الاستيعاب في بيان الأسباب «أول موسوعة علمية حديثية محققة في أسباب نزول آي القرآن الكريم»	سليم بن عيد الهلالي (و) محمد بن موسى آل نصر	ShamAY	32141	0.26377
