automatic URI	Proposed URI	bookTitle	authorName	collection	id	tfidf
		الجامع لعلوم الإمام أحمد - علوم الحديث	إبراهيم النحاس	ShamAY	38858	0.28163
		التاسع من الخلعيات	علي بن الحسن بن الحسين بن محمد، أبو الحسن الخلعي الشافعي (المتوفى: 492ه)	ShamelaY19	30480	0.28163
		الثلاثون من المشيخة البغدادية لأبي طاهر السلفي	صدر الدين، أبو طاهر السلفي أحمد بن محمد بن أحمد بن محمد بن إبراهيم سلفه الأصبهاني (المتوفى: 576ه)	ShamelaY19	30103	0.28155
		الجامع لعلوم الإمام أحمد - علل الحديث	إبراهيم النحاس	ShamAY	38860	0.28154
		العوالي الموافقات للأصبهاني	إسماعيل بن محمد بن الفضل بن علي القرشي الطليحي التيمي الأصبهاني، أبو القاسم، الملقب بقوام السنة (المتوفى: 535هـ)	ShamAY	29900	0.28151
		الجزء الثاني من العوالي والفوائد المنتقاة عن مشائخ ابن النشو - مخطوط	شرف الدين أبو الفتح محمد بن عبد الرحيم بن عباس القرشي ابن النشو	ShamAY	32918	0.28151
		المجروحين لابن حبان ت حمدي	ابن حبان	Sham19Y	151099	0.2815
		الأوهام التي في مدخل أبي عبد الله الحاكم النيسابوري	أبو محمد عبد الغني بن سعيد بن علي بن بشر بن مروان الأزدي المصري (المتوفى: 409هـ)	ShamAY	13004	0.28148
		الروايات التفسيرية في فتح الباري	عبد المجيد الشيخ عبد الباري	ShamAY	7447	0.28148
		الدرة الثمينة في أخبار المدينة	محمد بن محمود ابن النجار	Masaha	4408	0.28147
		السابع من الخلعيات	علي بن الحسن بن الحسين بن محمد، أبو الحسن الخِلَعي الشافعيّ (المتوفى: 492هـ)	ShamAY	30507	0.28144
		طبقات القراء السبعة وذكر مناقبهم وقراءاتهم	عبد الوهاب بن يوسف بن إبراهيم، ابن السلار الشافعي (المتوفى: 782ه)	ShamelaY19	30067	0.28142
		فتوح مصر والمغرب	ابن عبد الحكم	Rafed	2445	0.28139
		إمتاع الأسماع بما للنبي من الأحوال و الأموال و الحفدة و المتاع‏ - الجزء1	تقي الدين المقريزي‏	Masaha	1864	0.28139
		الجوس في المنسوب إلى دوس	الدكتور/ مرزوق بن هياس آل مرزوق الزهراني	ShamelaY19	36105	0.28139
		أخبار مكّة في قديم الدّهر وحديثه [ج ٤]	أبي عبد الله محمّد بن إسحاق ابن العبّاس الفاكهي المكّي	Rafed	2127	0.28138
		تسعة مجالس من أمالي طراد بن محمد الزينبي	طِرَاد بن محمد بن علي الهاشمي العباسي الزَّيْنَبي، أبو الفوارس (المتوفى: 491هـ)	ShamAY	30725	0.28134
		استدراكات البعث والنّشور	أبي بكر أحمد بن الحسين البيهقي	Rafed	701	0.28134
		 خزانة التواريخ النجدية 	 عبد الله بن عبد الرحمن آل بسام 	ABLibrary	9043	0.28133
		منة المنعم في شرح صحيح مسلم	أبو الحسين مسلم بن الحجاج بن مسلم القشيري النيسابوري رحمه الله (206 - 261 ه)	ShamelaY19	149015	0.2813
		مناقب الإمام أبي حنيفة وصاحبيه	شمس الدين أبو عبد الله محمد بن أحمد بن عثمان بن قَايْماز الذهبي (المتوفى: 748هـ)	ShamAY	10461	0.28128
		علل الدارقطني = العلل الواردة في الأحاديث النبوية	أبو الحسن علي بن عمر بن أحمد بن مهدي بن مسعود بن النعمان بن دينار البغدادي الدارقطني (المتوفى: 385هـ)	ShamAY	9082	0.28125
		جامع التحصيل في أحكام المراسيل	صلاح الدين أبو سعيد خليل بن كيكلدي بن عبد الله الدمشقي العلائي (المتوفى: 761ه)	ShamelaY19	25864	0.2812
		ذكر المصافحة لضياء الدين المقدسي	ضياء الدين أبو عبد الله محمد بن عبد الواحد المقدسي (المتوفى: 643هـ)	ShamAY	29458	0.28119
		الأحاديث والآثار الواردة في أحكام القرآن للكيا الهراسي، تخريجا ودراسة	صالح البهلال	ShamAY	33082	0.28118
		كتاب ذكر اسم كل صحابي روى عن رسول الله صلى الله عليه وسلم أمراً أونهياً ومن بعده من التابعين وغيرهم ممن لا أخ له يوافق اسمه من نقلة الحديث من جميع الأمصار	أبو الفتح محمد بن الحسين بن أحمد بن عبد الله بن بريدة الموصلي الأزدي (المتوفى: 374هـ)	ShamAY	26918	0.28115
		الكواكب السيّارة في ترتيب الزيارة	شمس الدين أبو عبد الله محمّد بن ناصر الأنصاري [ ابن الزيّات ]	Rafed	2464	0.28114
		تاريخ الرقة ومن نزلها من أصحاب رسول الله صلى الله عليه وسلم والتابعين والفقهاء والمحدثين	محمد بن سعيد بن عبد الرحمن القشيري، أبو علي (المتوفى: 334ه)	ShamelaY19	26383	0.28114
		سؤالات السلفي أبا الكرم خميس بن علي الحوزي - ط الفاروق	أبو طاهر أحمد بن محمد السلفي	ShamAY	34164	0.2811
		 أخبار مكة في قديم الدهر وحديثه 	 محمد بن اسحاق ابن العباس الفاكهي المكي 	ABLibrary	8922	0.28108
		معرفة الصحابة لابن منده	أبو عبد الله محمد بن إسحاق بن محمد بن يحيى بن مَنْدَه العبدي (المتوفى: 395هـ)	ShamAY	21481	0.28107
		فوائد أبي القاسم الحرفي رواية الثقفي	عبد الرحمن بن عبيد الله بن عبد الله ابن محمد، أبو القاسم الحربي الحرفي (المتوفى: 423ه)	ShamelaY19	26533	0.28104
		من هو المهدي	ابو طالب التجليل التبريزي	Masaha	2984	0.28097
		المتحابين في الله	أبو محمد موفق الدين عبد الله بن أحمد بن محمد بن قدامة الجماعيلي المقدسي ثم الدمشقي الحنبلي، الشهير بابن قدامة المقدسي (المتوفى: 620هـ)	ShamAY	6763	0.28096
		عجالة الإملاء المتيسرة من التذنيب	إبراهيم بن محمد بن محمود بن بدر، برهان الدين، أبو إسحاق الحلبي القبيباتي الشافعي الناجي (المتوفى: 900ه)	ShamelaY19	97928	0.28096
		التمهيد لما في الموطأ من المعاني والأسانيد	أبو عمر يوسف بن عبد الله بن محمد بن عبد البر بن عاصم النمري القرطبي (المتوفى: 463هـ)	ShamAY	1719	0.28095
		 تسعة كتب في اصول التصوف والزهد 	 السلمي 	ABLibrary	8704	0.2809
		جزء البطاقة للكناني	حمزة بن محمد بن علي بن العباس، أبو القاسم الكناني المصري (المتوفى: 357ه)	Sham19Y	13100	0.28089
		المناشدة والاحتجاج بحديث الغدير	الشيخ عبد الحسين الأميني النجفي	Masaha	431	0.28087
		الصَّارِمُ المُنْكِي في الرَّدِّ عَلَى السُّبْكِي	شمس الدين محمد بن أحمد بن عبد الهادي الحنبلي (المتوفى: 744هـ)	ShamAY	8622	0.28084
		الشيعة الجذور والبذور	محمود جابر	Rafed	1205	0.28084
		علم علل الحديث ودوره في حفظ السنة النبوية	وصى الله بن محمد عباس	Sham19Y	11300	0.28082
		 أعيان الشيعة 	 السيد محسن الأمين 	ABLibrary	77	0.2808
		الرقة والبكاء لابن قدامة	أبو محمد موفق الدين عبد الله بن أحمد بن محمد بن قدامة الجماعيلي المقدسي ثم الدمشقي الحنبلي، الشهير بابن قدامة المقدسي (المتوفى: 620هـ)	ShamAY	9384	0.28077
		مقتضب الأثر في النص على الأئمة الإثني عشر(ع)	أحمد بن محمد الجوهري‏	Masaha	3308	0.28077
		الْمُخْتَصَرُ النَّصِيحُ فِي تَهْذِيبِ الْكِتَابِ الْجَامِعِ الْصَّحِيحِ	المُهَلَّبُ بنُ أَحْمَدَ بنِ أَبِي صُفْرَةَ أَسِيْدِ بنِ عَبْدِ اللهِ الأَسَدِيُّ الأَنْدَلُسِيُّ، المَرِيِيُّ (المتوفى: 435هـ)	ShamAY	1180	0.28073
		الشيعة الجذور والبذور	محمود جابر	Masaha	494	0.28069
		أخبار ابن أبي ذئب لابن زبر الربعي	أبو سليمان محمد بن عبد الله بن أحمد بن ربيعة بن سليمان بن خالد بن عبد الرحمن بن زبر الربعي (المتوفى: 379هـ)	ShamAY	26343	0.28068
		تهذيب سيرة ابن هشام	الواحدي :: عبد السلام هارون	ShamAY	37388	0.28068
		معجم رجال الحديث [ج ١]	السيّد أبو القاسم الموسوي الخوئي	Rafed	707	0.28067
		تاريخ الإسلام ووفيات المشاهير والأعلام	شمس الدين أبو عبد الله محمد بن أحمد بن عثمان بن قايماز الذهبي (المتوفى: 748ه)	ShamelaY19	35100	0.28065
		الإملاء الأنفس في ترجمة عسعس (مطبوع ضمن مجموع رسائل لابن ناصر الدين)	محمد بن عبد الله (أبي بكر) بن محمد ابن أحمد بن مجاهد القيسي الدمشقي الشافعي، شمس الدين، الشهير بابن ناصر الدين (المتوفى: 842هـ)	ShamAY	9652	0.28064
		الرابع من فوائد أبي عثمان البحيري	أبو عثمان سعيد بن محمد ابن أبي الحسين أحمد بن محمد بن جعفر بن محمد بن بحير البحيري، النيسابوري (المتوفى: 451ه)	ShamelaY19	29959	0.28064
		الصحيح المسند من آثار الصحابة في الزهد والرقائق والأخلاق والأدب	عبد الله بن فهد الخليفي	ShamAY	1124	0.28063
		 الزيارات ( بدمشق ) 	 القاضي محمود الزوكاري 	ABLibrary	9117	0.28063
		معجم مشايخ محمد بن عبد الواحد الدقاق	أَبُو عَبْدِ اللهِ مُحَمَّدُ بنُ عَبْدِ الوَاحِدِ بنِ مُحَمَّدٍ الأَصْبَهَانِيّ، الدَّقَّاق (المتوفى: 516هـ)	ShamAY	9622	0.2806
		المصباح المضي في كتاب النبي الأمي ورسله إلى ملوك الأرض من عربي وعجمي	محمد (أو عبد الله) بن علي بن أحمد بن عبد الرحمن بن حسن الأنصاري، أبو عبد الله، جمال الدين ابن حديدة (المتوفى: 783هـ)	ShamAY	7233	0.28053
		دراسة أقوال العلماء في حديث (أرحم أمتي بأمتي أبو بكر ... )	ربيع بن هادي المدخلي	ShamAY	33028	0.28053
		رسالة في خبر تزويج ام كلثوم من عمر	السيّد علي الحسيني الميلاني	Rafed	222	0.28052
		منتخب الأثر في الإمام الثاني عشر عليه السلام - الجزء1	الشيخ لطف الله الصافي	Masaha	3220	0.28052
		معرفة الصحابة لابن منده = مرقمة	أبو عبد الله محمد بن إسحاق بن يحيى بن منده الأصبهاني	ShamAY	38099	0.2805
		الرابع عشر من الخلعيات	علي بن الحسن بن الحسين بن محمد، أبو الحسن الخلعي الشافعي (المتوفى: 492ه)	ShamelaY19	30504	0.28049
		نظره في كتاب البدايه و النهايه	عبدالحسين اميني ( علامه اميني )	Ghbook	7726	0.28047
		مقتل الامام اميرالمومنين علي بن ابي طالب ( عليه السلام )	ابوبكر عبدالله بن محمد بن عبيد ( ابن ابي دنيا )	Ghbook	9619	0.28046
		مسند عثمان بن عفان لأبي القاسم البغوي (وهو مطبوع ضمن كتاب الفوائد)	أبو القاسم عبد الله بن محمد بن عبد العزيز بن المرزبان بن سابور بن شاهنشاه البغوي (المتوفى: 317ه)	Sham19Y	9922	0.28043
		حديث الثقلين	آيت الله علي حسيني ميلاني	Ghbook	7626	0.28043
		اعتقاد الأئمة الأربعة	محمد بن عبد الرحمن الخميس	ShamelaY19	22273	0.28042
		الحادي والثلاثون من المشيخة البغدادية لأبي طاهر السلفي	صدر الدين، أبو طاهر السلفي أحمد بن محمد بن أحمد بن محمد بن إبراهيم سلفه الأصبهاني (المتوفى: 576ه)	ShamelaY19	30106	0.28041
		قلادة النحر في وفيات أعيان الدهر	أبو محمد الطيب بن عبد الله بن أحمد بن علي بامخرمة، الهجراني الحضرمي الشافعي (870 - 947 ه)	ShamelaY19	29560	0.28036
		الكفاية في معرفة أصول علم الرواية للخطيب البغدادي - ت: ماهر الفحل	أبو بكر أحمد بن علي بن ثابت الخطيب البغدادي	ShamAY	33976	0.28034
		زيادة وبركاته في التسليم	الواحدي :: حمزة عبد الله المليباري	ShamAY	36487	0.2803
		قوارع القرآن وما يستحب أن لا يخل بقراءته كل يوم وليلة للجوري	أبو عمرو محمد بن يحيى بن الحسن الجوري النيسابوري	ShamAY	33672	0.28029
		التلخيص الحبير في تخريج أحاديث الرافعي الكبير	أبو الفضل أحمد بن علي بن محمد بن أحمد بن حجر العسقلاني (المتوفى: 852هـ)	ShamAY	21601	0.28029
		الرابع من الخلعيات	علي بن الحسن بن الحسين بن محمد، أبو الحسن الخلعي الشافعي (المتوفى: 492ه)	ShamelaY19	30505	0.28024
		أمالي أبي يعلى الفراء	القاضي أبو يعلى، محمد بن الحسين بن محمد بن خلف المعروف ب ابن الفراء (المتوفى: 458ه)	ShamelaY19	29876	0.28024
		صحيح ابن خزيمة ط 3	أبو بكر محمد بن إسحاق بن خزيمة بن المغيرة بن صالح بن بكر السلمي النيسابوري (المتوفى: 311هـ)	ShamAY	31687	0.28022
		نفحات الأزهار في خلاصة عبقات الأنوار [ج ٤]	السيّد علي الحسيني الميلاني	Rafed	432	0.28022
		بحوث في تاريخ السنة المشرفة	أكرم بن ضياء العمري	ShamAY	8674	0.28015
		مجمع الآداب في معجم الألقاب	كمال الدين أبو الفضل عبد الرزاق بن أحمد المعروف بابن الفوطي الشيباني (المتوفى: 723 هـ)	ShamAY	32700	0.28014
		الجزء الأول من الفوائد العوالي الصحاح والحسان لأبي القاسم السمرقندي - مخطوط	أبو القاسم إسماعيل بن أحمد السمرقندي	ShamAY	32928	0.2801
		نهاية المراد من كلام خير العباد	عبد الغني بن عبد الواحد بن علي بن سرور المقدسي الجماعيلي الدمشقي الحنبلي، أبو محمد، تقي الدين (المتوفى: 600هـ)	ShamAY	1384	0.2801
		برنامج المجاري	أبو عبد الله محمد بن محمد بن علي بن عبد الواحد المجاري الأندلسي (المتوفى: 862هـ)	ShamAY	10735	0.28009
		الإلماع إلى معرفة أصول الرواية وتقييد السماع	عياض بن موسى بن عياض بن عمرون اليحصبي السبتي، أبو الفضل (المتوفى: 544هـ)	ShamAY	6030	0.28006
		نفح العبير	أبو محمد عبد الله بن مانع بن غلاب الغبيوي الروقي العتيبي	ShamAY	32117	0.28006
		مجلس من أمالي النجاد رواية المحاملي	أبو بكر النجاد، أحمد بن سلمان بن الحسن بن إسرائيل بن يونس البغدادي (المتوفى: 348ه)	ShamelaY19	29865	0.28002
		مجلسان أحدهما عن ابن بشران والثاني عن ابن أبي الفوارس - مخطوط	الواحدي	ShamAY	32888	0.28001
		التعليق الممجد على موطأ محمد (شرح لموطأ مالك برواية محمد بن الحسن)	محمد عبد الحي بن محمد عبد الحليم الأنصاري اللكنوي الهندي، أبو الحسنات (المتوفى: 1304هـ)	ShamAY	9804	0.28
		المسترشد في الإمامة	محمد بن جرير الطبري‏ الصغير	Masaha	2862	0.27999
		جزء فيه عوالي منتقاة من جزء أبي مسعود أحمد بن الفرات، انتقاء الذهبي	أحمد بن الفرات بن خالد الضبي الرازي، أبو مسعود (المتوفى: 258ه)	ShamelaY19	26716	0.27997
		الأول من حديث سعدان بن نصر بن منصور البزاز أبي عثمان	أبو عثمان سعدان بن نصر بن منصور المخرمي المتوفى سنة 265 هـ	ShamAY	35246	0.27995
		مجموع فيه ثلاثة أجزاء حديثية - جرار	مجموعة من المؤلفين	Sham19Y	29857	0.2799
		الانتهاء لمعرفة الأحاديث التي لم يفت بها الفقهاء، ومناقشها على ضوء الأصلين:	أبو عبد الله عبد السلام بن محمد بن عمر علوش	ShamelaY19	96948	0.27986
		التاسع من فوائد أبي عثمان البحيري	أبو عثمان سعيد بن محمد ابن أبي الحسين أحمد بن محمد بن جعفر بن محمد بن بحير البحيري، النيسابوري (المتوفى: 451ه)	ShamelaY19	29948	0.27986
		الرسالة العلوية في فضل أمير المؤمنين(ع) على سائر البرية	الشيخ القاضي أبي الفتح محمد بن علي الكراجكي	Masaha	2027	0.27981
		الخامس عشر من الخلعيات	علي بن الحسن بن الحسين بن محمد، أبو الحسن الخِلَعي الشافعيّ (المتوفى: 492هـ)	ShamAY	30502	0.2798
		المجلس التاسع عشر من أمالي ابن عساكر في تحريم الأبنة - مخطوط	أبو القاسم علي بن الحسن بن هبة الله بن عساكر	ShamAY	32881	0.27978
		نفحات الأزهار في خلاصة عبقات الأنوار [ج ٣]	السيّد علي الحسيني الميلاني	Rafed	428	0.27978
		التاسع عشر من المشيخة البغدادية لأبي طاهر السلفي	صدر الدين، أبو طاهر السلفي أحمد بن محمد بن أحمد بن محمد بن إبراهيم سلفه الأصبهاني (المتوفى: 576ه)	Sham19Y	30086	0.27978
		لوائح الأنوار السنية ولواقح الأفكار السنية «شرح قصيدة ابن أبي داود الحائية في عقيدة أهل الآثار السلفية»	محمد بن أحمد بن سالم السفاريني الحنبلي	ShamAY	38505	0.27976
		الجزء الأول من فوائد محمد بن أحمد بن محمد بن عمرو بن شاكر القطان عن شيوخه	محمد بن علي القطان العسقلاني	ShamAY	33584	0.27976
		 الرسالة العلوية في فضل أمير المؤمنين ( ع ) على سائر البرية ( التفضيل ) 	 أبي الفتح الكراجكي 	ABLibrary	7532	0.27976
		تسمية من روي عنه من أولاد العشرة	علي بن عبد الله بن جعفر السعدي بالولاء المديني، البصري، أبو الحسن (المتوفى: 234هـ)	ShamAY	5893	0.27975
		شرح القسطلاني = إرشاد الساري لشرح صحيح البخاري	أحمد بن محمد بن أبى بكر بن عبد الملك القسطلاني القتيبي المصري، أبو العباس، شهاب الدين (المتوفى: 923هـ)	ShamAY	938	0.27975
		بحار الأنوار [ج ٤٥]	الشيخ محمّد باقر بن محمّد تقي المجلسي	Rafed	977	0.27974
		الجزء السادس من الفوائد العوالي المنتقاة من الثقفيات - مخطوط	الرئيس أبو عبد الله القاسم بن الفضل الثقفي	ShamAY	32905	0.27973
		عوالي مالك رواية عمر بن الحاجب	عمر بن محمد بن منصور الأميني، أبو حفص، عز الدين، المعروف بابن الحاجب (المتوفى: 630هـ)	ShamAY	1317	0.27968
		التاريخ والعلل عن يحيى بن معين رواية الدوري - ط الفاروق الحديثة	يحيى بن معين	ShamAY	38167	0.27967
		الآداب للبيهقي	أحمد بن الحسين بن علي بن موسى الخُسْرَوْجِردي الخراساني، أبو بكر البيهقي (المتوفى: 458هـ)	ShamAY	8203	0.27965
		تأخير الظلامة إلى يوم القيامة	عبد الرحمن بن أبي بكر، جلال الدين السيوطي (المتوفى: 911ه)	ShamelaY19	96851	0.27962
		المهذب في اختصار السنن الكبير	الذهبي، شمس الدين	ShamelaY19	146127	0.27962
		معجم الشعراء	المرزباني	ShamelaY19	26552	0.27962
		المصباح في عيون الصحاح	عبد الغني بن عبد الواحد بن علي بن سرور المقدسي الجماعيلي الدمشقي الحنبلي، أبو محمد، تقي الدين (المتوفى: 600ه)	ShamelaY19	29794	0.27961
		جزء فيه أحاديث أبي حامد أحمد بن محمد بن يحيى بن بلال النيسابوري الخشاب	أَبُو حَامِدٍ أَحْمَدُ بنُ مُحَمَّدِ بنِ يَحْيَى بنِ بِلاَل النَّيْسَابُوْرِيُّ المَعْرُوْف بِالخَشَّاب (المتوفى: 330هـ)	ShamAY	26553	0.27959
		ترتيب الأمالي الخميسية للشجري	يحيى بن الحسين الشجري	Sham19Y	9392	0.27958
		فضائل القرآن	أبي عبد الله محمّد بن أيّوب بن الضريس البجلي	Rafed	1115	0.27955
		السنن الصغير للبيهقي	أحمد بن الحسين بن علي بن موسى الخسروجردي الخراساني، أبو بكر البيهقي (المتوفى: 458ه)	Sham19Y	12415	0.27955
		القلائد الجوهريّة في تاريخ الصالحيّة	أبي عبد الله شمس الدين محمّد بن علي بن طولون الدمشقي الصالحي [ ابن طولون ]	Rafed	2313	0.27948
		رجال العلامة الحلي‏	العلامة الحلي	Masaha	4722	0.27948
		 مقتل الإمام أمير المؤمنين على بن أبى طالب ( ع ) 	 ابن أبي الدنيا 	ABLibrary	7771	0.27948
		عصر الخلافة الراشدة محاولة لنقد الرواية التاريخية وفق منهج المحدثين	أكرم بن ضياء العمري	ShamAY	31726	0.27943
		مجلس إملاء في رؤية الله تعالى للدقاق	أَبُو عَبْدِ اللهِ مُحَمَّدُ بنُ عَبْدِ الوَاحِدِ بنِ مُحَمَّدٍ الأَصْبَهَانِيّ، الدَّقَّاق (المتوفى: 516هـ)	ShamAY	9594	0.27941
		العلل الصغير للترمذي	محمد بن عيسى بن سَوْرة بن موسى بن الضحاك، الترمذي، أبو عيسى (المتوفى: 279هـ)	ShamAY	5897	0.2794
		جزء في تفسير الباقيات الصالحات	صلاح الدين أبو سعيد خليل بن كيكلدي بن عبد الله الدمشقي العلائي (المتوفى: 761هـ)	ShamAY	5509	0.27939
		التنبيهات المجملة على المواضع المشكلة	صلاح الدين أبو سعيد خليل بن كيكلدي بن عبد الله الدمشقي العلائي (المتوفى: 761هـ)	ShamAY	10322	0.2793
		صيانة الإنسان عن وسوسة الشيخ دحلان	محمد بشير بن محمد بدر الدين السهسواني الهندي (المتوفى: 1326ه)	Sham19Y	12027	0.27929
		فوائد الفوائد لابن خزيمة	أبو بكر محمد بن إسحاق بن خزيمة بن المغيرة بن صالح بن بكر السلمي النيسابوري (المتوفى: 311ه)	ShamelaY19	26680	0.27925
		الإيماء إلى أطراف أحاديث كتاب الموطأ	أبو العباس أحمد بن طاهر الداني الأندلسي (المتوفى: 532 ه)	ShamelaY19	127660	0.27925
		الأسماء والصفات	أبي بكر أحمد بن الحسين البيهقي	Rafed	3332	0.27923
		موسوعة فضائل سور وآيات القرآن - القسم الصحيح	محمد بن رزق بن طرهوني	ShamelaY19	144114	0.27923
