automatic URI	Proposed URI	bookTitle	authorName	collection	id	tfidf
		إحقاق الحقّ وإزهاق الباطل [ج ٢٧]	آية الله السيّد شهاب الدين الحسيني المرعشي النجفي	Rafed	2795	0.30387
		السنن الكبرى وفي ذيله الجوهر النقي - ط دائرة المعارف	أحمد بن الحسين بن علي بن موسى الخُسْرَوْجِردي الخراساني، أبو بكر البيهقي	ShamAY	33909	0.30386
		الأباطيل والمناكير والصحاح والمشاهير	الحسين بن إبراهيم بن الحسين بن جعفر، أبو عبد الله الهمذاني الجورقاني (المتوفى: 543هـ)	ShamAY	9642	0.30385
		جمهرة انساب العرب	ابن حزم الأندلسي‏	Masaha	2330	0.30381
		ترجمة الإمام مسلم ورواة صحيحه	شمس الدين أبو عبد الله محمد بن أحمد بن عثمان بن قَايْماز الذهبي (المتوفى: 748هـ)	ShamAY	29830	0.30379
		المنتظم في تاريخ الملوك والأمم	جمال الدين أبو الفرج عبد الرحمن بن علي بن محمد الجوزي (المتوفى: 597هـ)	ShamAY	12406	0.30378
		فتوح البلدان - القاهرة	البلاذري	ShamAY	33821	0.30375
		مشيخة أبي طاهر ابن أبي الصقر (مطبوع مع معجم مشايخ أبي عبد الله بن عبد الواحد الدقاق ومجلس إملاء في رؤية الله تبارك وتعالى)	أَبُو طَاهِرٍ مُحَمَّدُ بنُ أَحْمَدَ بنِ مُحَمَّدِ بنِ إِسْمَاعِيْلَ بنِ أَبِي الصَّقْرِ اللَّخْمِيُّ الأَنْبَارِيُّ (المتوفى: 476هـ)	ShamAY	5725	0.30371
		تاريخ جرجان	أبو القاسم حمزة بن يوسف بن إبراهيم السهمي القرشي الجرجاني (المتوفى: 427هـ)	ShamAY	11077	0.3037
		الاستيعاب في معرفة الأصحاب	أبو عمر يوسف بن عبد الله بن محمد بن عبد البر بن عاصم النمري القرطبي (المتوفى: 463هـ)	ShamAY	12288	0.30368
		الباعث الحثيث إلى اختصار علوم الحديث	أبو الفداء إسماعيل بن عمر بن كثير القرشي البصري ثم الدمشقي (المتوفى: 774ه)	ShamelaY19	21571	0.30365
		المنهل الصافي والمستوفى بعد الوافي	يوسف بن تغري بردي بن عبد الله الظاهري الحنفي، أبو المحاسن، جمال الدين (المتوفى: 874ه)	ShamelaY19	23156	0.30364
		هدية ذوي الألباب في فضائل عمر بن الخطاب لأبي الخير القزويني - مخطوط	أبو الخير أحمد بن إسماعيل الطالقاني القزويني	ShamAY	32964	0.30363
		أداء ما وجب من بيان وضع الوضاعين في رجب	ابن دحية	ShamelaY19	23163	0.30357
		تاريخ الإسلام ووفيات المشاهير والأعلام [ج ٢٣]	شمس الدين محمّد بن أحمد بن عثمان الذّهبي	Rafed	3501	0.30355
		ضعيف أبي داود - الأم	ناصر الدين الألباني	Sham19Y	5914	0.30354
		جمع القرآن - دراسة تحليلية لمروياته	أكرم عبد خليفة حمد الدليمي	ShamAY	1089	0.30353
		الجزء السادس من فوائد الإخوان من الأحاديث الموافقات والأبدال والعوالي الحسان (مشيخة ابن أبي عمر) - مخطوط	شمس الدين أبو الفرج عبد الرحمن بن محمد بن أحمد بن قدامة المقدسي المعروف بابن أبي عمر	ShamAY	32960	0.30347
		المُعْجَمُ الكَبِير للطبراني المُجَلَّدان الثَّالِثَ عَشَرَ والرابع عشر	سليمان بن أحمد بن أيوب بن مطير اللخمي الشامي، أبو القاسم الطبراني (المتوفى: 360هـ)	ShamAY	1353	0.30343
		تاريخ علماء أهل مصر	يحيى بن علي بن محمد بن إبراهيم الحضرمي المعروف بابن الطحان (؟ - 416 ه)	ShamelaY19	130963	0.30343
		بغية الطلب في تاريخ حلب [ج ٧]	كمال الدّين عمر بن أحمد بن أبي جرادة الحلبي [ ابن العديم ]	Rafed	2146	0.30341
		التوبة لابن عساكر	ثقة الدين، أبو القاسم علي بن الحسن بن هبة الله المعروف بابن عساكر (المتوفى: 571ه)	ShamelaY19	26465	0.30341
		الرواة الثقات المتكلم فيهم بما لا يوجب ردهم	شمس الدين أبو عبد الله محمد بن أحمد بن عثمان بن قايماز الذهبي (المتوفى: 748ه)	Sham19Y	5817	0.3034
		ألقاب الصحابة والتابعين في المسندين الصحيحين	أبو علي الحسين بن محمد الغساني وكان يكره أن يقال له الجياني (المتوفى: 498ه)	Sham19Y	5895	0.3034
		أخبار القضاة	أَبُو بَكْرٍ مُحَمَّدُ بْنُ خَلَفِ بْنِِ حَيَّانَ بْنِِ صَدَقَةََ الضَّبِّيّ البَغْدَادِيّ, المُلَقَّب بِـ"وَكِيع" (المتوفى: 306هـ)	ShamAY	150	0.30336
		مسائل الإمام أحمد وإسحاق بن راهويه	إسحاق بن منصور بن بهرام، أبو يعقوب المروزي، المعروف بالكوسج (المتوفى: 251هـ)	ShamAY	3125	0.30334
		تحفة التحصيل في ذكر رواة المراسيل	أحمد بن عبد الرحيم بن الحسين الكردي الرازياني ثم المصري، أبو زرعة ولي الدين، ابن العراقي (المتوفى: 826ه)	Sham19Y	5838	0.30323
		فضل عشر ذي الحجة لابن أبي الدنيا - ط الجمعية السعودية ت الصاعدي	أبو بكر عبد الله بن محمد ابن أبي الدنيا	ShamAY	38170	0.3032
		الجوهر المنضد في طبقات متأخري أصحاب أحمد	يوسف بن حسن بن أحمد بن حسن ابن عبد الهادي الصالحي، جمال الدين، ابن المِبْرَد الحنبلي (المتوفى: 909 هـ)	ShamAY	32329	0.3031
		شرح الأربعين النووية [من بداية شرح الحديث 29 إلى نهاية شرح الحديث 35]	المناوي، عبد الرؤوف	ShamelaY19	133377	0.30307
		الأربعون حديثا من المساواة مستخرجة عن ثقات الرواة	ثقة الدين، أبو القاسم علي بن الحسن بن هبة الله المعروف بابن عساكر (المتوفى: 571هـ) من تخريجه لشيخة الفراوي	ShamAY	9371	0.30302
		مستخرج أبي عوانة ط الجامعة الإسلامية	أبو عوانة يعقوب بن إسحاق الإسفراييني (المتوفى 316 ه)	Sham19Y	18144	0.30301
		نظم العقيان في أعيان الأعيان	عبد الرحمن بن أبي بكر، جلال الدين السيوطي (المتوفى: 911هـ)	ShamAY	9061	0.303
		المدخل إلى الصحيح - ت المدخلي = التراجم	أبو عبد الله الحاكم محمد بن عبد الله بن محمد بن حمدويه بن نُعيم بن الحكم الضبي الطهماني النيسابوري المعروف بابن البيع (المتوفى: 405هـ)	ShamAY	38184	0.30299
		تفسير الثعلبي = الكشف والبيان عن تفسير القرآن	أحمد بن محمد بن إبراهيم الثعلبي، أبو إسحاق (المتوفى: 427هـ)	ShamAY	23578	0.30296
		مجلسان من الأمالي أحدهما في صفات الله لابن مردويه	أبو بكر أحمد بن موسى بن مردوية بن فورك بن موسى بن جعفر الأصبهاني (المتوفى: 410ه)	Sham19Y	26497	0.30295
		مجلس من أمالي أبي سعد البغدادي	أبو سعد أحمد بن محمد بن أحمد بن الحسن بن علي بن أحمد بن سليمان االبغدادي الأصل، الأصبهاني (المتوفى: 540ه)	Sham19Y	29903	0.30293
		تاريخ الإسلام ووفيات المشاهير والأعلام [ج ٤٧]	شمس الدين محمّد بن أحمد بن عثمان الذّهبي	Rafed	3643	0.30288
		التدوين في أخبار قزوين	عبد الكريم بن محمد بن عبد الكريم، أبو القاسم الرافعي القزويني (المتوفى: 623هـ)	ShamAY	7435	0.30286
		الثقات للعجلي ط الباز	أبو الحسن أحمد بن عبد الله بن صالح العجلى الكوفى (المتوفى: 261هـ)	ShamAY	9170	0.30285
		المداوي لعلل الجامع الصغير وشرحي المناوي	أحمد بن محمد بن الصدِّيق بن أحمد، أبو الفيض الغُمَارِي الحسني الأزهري (المتوفى: 1380 هـ)	ShamAY	32538	0.30281
		ذم قرناء السوء (المجلس الثالث والخمسون من أمالي ابن عساكر)	ثقة الدين، أبو القاسم علي بن الحسن بن هبة الله المعروف بابن عساكر (المتوفى: 571ه)	Sham19Y	26861	0.30272
		الرسالة للشافعي	الشافعي أبو عبد الله محمد بن إدريس بن العباس بن عثمان بن شافع بن عبد المطلب بن عبد مناف المطلبي القرشي المكي (المتوفى: 204هـ)	ShamAY	8180	0.30264
		الزهد الكبير للبيهقي	أحمد بن الحسين بن علي بن موسى الخسروجردي الخراساني، أبو بكر البيهقي (المتوفى: 458ه)	Sham19Y	13025	0.30264
		 مناحل الشفا ومناهل الصفا بتحقيق كتاب شرف المصطفى ( ص ) 	 عبد الملك الخركوشي النيسابوري 	ABLibrary	7585	0.30256
		شرف المصطفى - الجزء1	أبو سعيد الخركوشي النيشابوري‏	Masaha	2290	0.30255
		مناقب الشافعي للبيهقي	أبو بكر أحمد بن الحسين البيهقي (384 - 458 هـ)	ShamAY	37997	0.30254
		كتاب الأربعين، المسمى: الأربعون حديثاً فيما ينتهي إليه المتقون ويستعمله الموفقون وينتبه به الغافلون ويلازمه العاقلون	القاسم بن الفضل الثقفي الأصبهاني (489 هـ)	ShamAY	33551	0.3025
		 المصابيح 	 الإمام أبو العباس الحسني 	ABLibrary	8601	0.30242
		المدخل إلى كتاب الإكليل	أبو عبد الله الحاكم محمد بن عبد الله بن محمد بن حمدويه بن نعيم بن الحكم الضبي الطهماني النيسابوري المعروف بابن البيع (المتوفى: 405ه)	Sham19Y	5997	0.30228
		السماع لابن القيسراني	أبو الفضل محمد بن طاهر بن علي بن أحمد المقدسي الشيباني، المعروف بابن القيسراني (المتوفى: 507هـ)	ShamAY	6277	0.30218
		مجلس في نفي التشبيه (المجلس 138 من أمالي ابن عساكر)	أبو القاسم علي بن الحسن بن هبة الله المعروف بابن عساكر الدمشقي	ShamAY	33710	0.30216
		مغاني الأخيار في شرح أسامي رجال معاني الآثار	أبو محمد محمود بن أحمد بن موسى بن أحمد بن حسين الغيتابى الحنفى بدر الدين العينى (المتوفى: 855هـ)	ShamAY	10452	0.30214
		تاريخ مدينة دمشق [ج ٧٠]	أبي القاسم علي بن الحسن ابن هبة الله بن عبد الله الشافعي [ ابن عساكر ]	Rafed	2571	0.30209
		فتح الباب في الكنى والألقاب	أبو عبد الله محمد بن إسحاق بن محمد بن يحيى بن مَنْدَه العبدي (المتوفى: 395هـ)	ShamAY	5813	0.30208
		تاريخ الإسلام ووفيات المشاهير والأعلام [ج ٤٦]	شمس الدين محمّد بن أحمد بن عثمان الذّهبي	Rafed	3640	0.30204
		شرح السنة للبغوي	محيي السنة، أبو محمد الحسين بن مسعود بن محمد بن الفراء البغوي الشافعي (المتوفى: 516هـ)	ShamAY	1533	0.302
		المسلسلات من الأحاديث والآثار	سليمان بن موسى بن سالم بن حسان الكلاعي الحميري، أبو الربيع (المتوفى: 634هـ)	ShamAY	30665	0.30199
		مجلسان من الأمالي أحدهما في صفات الله لابن مردويه	أبو بكر أحمد بن موسى بن مردوية بن فورك بن موسى بن جعفر الأصبهاني (المتوفى: 410ه)	ShamelaY19	26497	0.30199
		تعليقات الدارقطني على المجروحين لابن حبان	أبو الحسن علي بن عمر بن أحمد بن مهدي بن مسعود بن النعمان بن دينار البغدادي الدارقطني (المتوفى: 385هـ)	ShamAY	10843	0.30198
		معرفة رجال البخاري للنحات	أبي جعفر محمد بن الحسن النحات	ShamAY	34594	0.30196
		الضعفاء والمتروكون للدارقطني = التراجم	أبو الحسن علي بن عمر بن أحمد بن مهدي بن مسعود بن النعمان بن دينار البغدادي الدارقطني (المتوفى: 385هـ)	ShamAY	38028	0.30195
		معجم ابن عساكر	ثقة الدين، أبو القاسم علي بن الحسن بن هبة الله المعروف بابن عساكر (المتوفى: 571ه)	Sham19Y	12750	0.30195
		قلادة النحر في وفيات أعيان الدهر	أبو محمد الطيب بن عبد الله بن أحمد بن علي بامخرمة، الهِجراني الحضرمي الشافعي (870 - 947 هـ)	ShamAY	38898	0.30194
		إسعاف المبطأ برجال الموطأ	عبد الرحمن بن أبي بكر، جلال الدين السيوطي (المتوفى: 911ه)	Sham19Y	5849	0.30194
		جزء ابن الجلابي	القاضي، أبو عبد الله محمد بن علي بن محمد بن محمد بن الطيب بن الجلابي - بالضم - الواسطي، المالكي، المغازلي، المعدل، الشروطي (المتوفى: 542ه)	ShamelaY19	26345	0.30191
		ذكر من يعتمد قوله في الجرح والتعديل (مطبوع ضمن كتاب «أربع رسائل في علوم الحديث» )	شمس الدين أبو عبد الله محمد بن أحمد بن عثمان بن قَايْماز الذهبي (المتوفى: 748هـ)	ShamAY	26112	0.3019
		حديث أبي الحسين بن العالي	أبو الحسين العالي، أحمد بن محمد بن منصور العالي البوشنجي (المتوفى: 419ه)	ShamelaY19	29749	0.30189
		المحبر	محمد بن حبيب بن أمية بن عمرو الهاشمي، بالولاء، أبو جعفر البغدادي (المتوفى: 245هـ)	ShamAY	12205	0.30188
		تاريخ مدينة دمشق [ج ٤٨]	أبي القاسم علي بن الحسن ابن هبة الله بن عبد الله الشافعي [ ابن عساكر ]	Rafed	2387	0.30184
		البخلاء للخطيب البغدادي	أبو بكر أحمد بن علي بن ثابت بن أحمد بن مهدي الخطيب البغدادي (المتوفى: 463ه)	ShamelaY19	21475	0.30183
		النهي عن سب الأصحاب وما فيه من الإثم والعقاب	ضياء الدين أبو عبد الله محمد بن عبد الواحد المقدسي (المتوفى: 643هـ)	ShamAY	1294	0.30176
		تاريخ مدينة دمشق [ج ٧٦]	أبي القاسم علي بن الحسن ابن هبة الله بن عبد الله الشافعي [ ابن عساكر ]	Rafed	2612	0.30173
		ضعيف أبي داود - الأم	محمد ناصر الدين الألباني (المتوفى : 1420هـ)	ShamAY	5914	0.30172
		العلل ومعرفة الرجال لأحمد رواية ابنه عبد الله	أبو عبد الله أحمد بن محمد بن حنبل بن هلال بن أسد الشيباني (المتوفى: 241هـ)	ShamAY	2331	0.3017
		الجزء الرابع من كتاب التجريد لابن عساكر - مخطوط	أبو القاسم علي بن الحسن بن هبة الله بن عساكر	ShamAY	32878	0.30164
		أدب الإملاء والاستملاء	عبد الكريم بن محمد بن منصور التميمي السمعاني المروزي، أبو سعد (المتوفى: 562هـ)	ShamAY	6018	0.3016
		طبقات النحويين واللغويين (سلسلة ذخائر العرب 50)	محمد بن الحسن بن عبيد الله بن مذحج الزبيدي الأندلسي الإشبيلي، أبو بكر (المتوفى: 379ه)	Sham19Y	13235	0.30158
		فوائد أبي الفرج الثقفي	أَبُو الفَرَجِ مَسْعُوْدُ بنُ الحَسَنِ الثَّقَفِيُّ الأَصْبَهَانِيُّ (المتوفى: 562هـ)	ShamAY	1377	0.30155
		 العسل المصفى من تهذيب زين الفتى في شرح سورة هل أتى 	 أحمد بن محمد بن علي العاصمي 	ABLibrary	7608	0.30155
		مِنْ عَجَائِبِ الدُّعاء - الجزء الثاني (قصَصٌ لِقَوْم دعوا اللهَ فَاسْتَجاب لَهُمْ مِن المُتقدِّمينَ والمُعاصِرين)	خالد بن سليمان بن علي الربعي	ShamAY	505	0.30154
		ذم ذي الوجهين واللسانين لابن عساكر	ثقة الدين، أبو القاسم علي بن الحسن بن هبة الله المعروف بابن عساكر (المتوفى: 571هـ)	ShamAY	26467	0.30146
		جزء فيه حديث من حديث أهل حردان	ثقة الدين، أبو القاسم علي بن الحسن بن هبة الله المعروف بابن عساكر (المتوفى: 571ه)	ShamelaY19	26851	0.30146
		جزء فيه ستة مجالس من أمالي القاضي أبي يعلى الفراء	القاضي أبو يعلى، محمد بن الحسين بن محمد بن خلف المعروف ب ابن الفراء (المتوفى: 458ه)	ShamelaY19	26579	0.30145
		بغية الطلب في تاريخ حلب [ج ١١]	كمال الدّين عمر بن أحمد بن أبي جرادة الحلبي [ ابن العديم ]	Rafed	2465	0.30144
		مسألة التسمية لمحمد بن طاهر المقدسي	أبو الفضل محمد بن طاهر بن علي بن أحمد المقدسي الشيباني، المعروف بابن القيسراني (المتوفى: 507ه)	ShamelaY19	26591	0.30139
		تحفة التحصيل في ذكر رواة المراسيل	أحمد بن عبد الرحيم بن الحسين الكردي الرازياني ثم المصري، أبو زرعة ولي الدين، ابن العراقي (المتوفى: 826هـ)	ShamAY	5838	0.30137
		عوالي مالك رواية زاهر بن طاهر الشحامي	زاهر بن طاهر بن محمد الشحامي، أبو القاسم (المتوفى: 533ه)	ShamelaY19	26654	0.30136
		مرويات غزوة الحديبية جمع وتخريج ودراسة	حافظ بن محمد عبد الله الحكمي	ShamAY	11394	0.30135
		التاريخ الكبير للبخاري بحواشي المطبوع	محمد بن إسماعيل بن إبراهيم بن المغيرة البخاري، أبو عبد الله (المتوفى: 256هـ)	ShamAY	956	0.30133
		التهذيب في اختصار المدونة	خلف بن أبي القاسم محمد، الأزدي القيرواني، أبو سعيد ابن البراذعي المالكي (المتوفى: 372هـ)	ShamAY	8487	0.30129
		إعلام النبلاء بتاريخ حلب الشهباء [ج ٥]	محمد راغب بن محمود بن هاشم الطبّاخ الحلبي	Rafed	2380	0.30127
		المدلسين	أحمد بن عبد الرحيم بن الحسين الكردي الرازياني ثم المصري، أبو زرعة ولي الدين، ابن العراقي (المتوفى: 826هـ)	ShamAY	1176	0.30125
		شفاء السّقام في زيارة خير الأنام صلى الله عليه وآله	علي بن عبدالكافي بن علي أبوالحسن الأنصاري الخزرجي المصري الشافعي [ تقي الدين السبكي ]	Rafed	3618	0.30124
		تاريخ الإسلام ووفيات المشاهير والأعلام [ج ٣٧]	شمس الدين محمّد بن أحمد بن عثمان الذّهبي	Rafed	3584	0.30123
		من أعلام السلف	أحمد فريد	ShamAY	631	0.30121
		غاية المرام وحجة الخصام - الجزء1	السيد هاشم البحراني	Masaha	358	0.30119
		مغازي الواقدي	محمد بن عمر بن واقد السهمي الأسلمي بالولاء، المدني، أبو عبد الله، الواقدي (المتوفى: 207ه)	ShamelaY19	23680	0.30112
		الطبقات الكبرى، القسم المتمم لتابعي أهل المدينة ومن بعدهم	أبو عبد الله محمد بن سعد بن منيع الهاشمي بالولاء، البصري، البغدادي المعروف بابن سعد (المتوفى: 230ه)	Sham19Y	9352	0.30093
		إثبات صفة العلو - ابن قدامة	المقدسي، موفق الدين	Sham19Y	7268	0.30088
		أنساب الأشراف للبلاذري	أحمد بن يحيى بن جابر بن داود البَلَاذُري (المتوفى: 279هـ)	ShamAY	9773	0.30085
		جزء فيه مجلس من حديث الإمام أبي الحسن علي بن إبراهيم بن داود بن العطار الشافعي	علي بن إبراهيم بن داود بن سلمان بن سليمان، أبو الحسن، علاء الدين ابن العطار (المتوفى: 724ه)	ShamelaY19	27101	0.30083
		منهج الإمام ابن الجارود النيسابوري (ت 307 هـ) في كتابه " المنتقى "	عاصم القريوتي	ShamAY	37328	0.30079
		الأربعون على البلدان لعبد القادر بن عبد الله الرهاوي - مخطوط	أبو محمد عبد القادر بن عبد الله الرهاوي الحنبلي	ShamAY	38072	0.30077
		ذم قرناء السوء (المجلس الثالث والخمسون من أمالي ابن عساكر)	ثقة الدين، أبو القاسم علي بن الحسن بن هبة الله المعروف بابن عساكر (المتوفى: 571ه)	ShamelaY19	26861	0.30073
		مشيخة أبي بكر المراغي	أبو بكر بن الحسين بن عمر، القرشي العبشمي الأموي العثماني، زين الدين، وكنيته أبو محمد ويقال اسمه (عبد الله) والمشهور (أبو بكر) المصري الشافعي المراغي (المتوفى: 816هـ)	ShamAY	26731	0.3007
		خير الخبر في أذان خير البشر	الإمام محمد عبد الحي اللكنوي (ت1304هـ)	ShamAY	36020	0.30067
		تنقيح الروض الأنيق مما وضع في فضل الصديق	أبُو مُحَمَّدٍ الأَلْفِيُّ السَّكَنْدَرِيُّ	ShamAY	36060	0.30064
		بغية الطلب في تاريخ حلب [ج ١٢]	كمال الدّين عمر بن أحمد بن أبي جرادة الحلبي [ ابن العديم ]	Rafed	2467	0.30061
		أحاديث الموطأ وذكر اتفاق الرواة عن مالك واختلافهم فيه وزيادتهم ونقصانهم	أبو الحسن علي بن عمر بن أحمد بن مهدي بن مسعود بن النعمان بن دينار البغدادي الدارقطني (المتوفى: 385ه)	Sham19Y	1518	0.30061
		الجزء الثالث عشر من الفوائد المنتخبة الصحاح والغرائب للنسيب - مخطوط	النسيب أبو القاسم علي بن إبراهيم بن العباس بن أبي الجن الحسيني	ShamAY	32970	0.3006
		إتحاف الزائر وإطراف المقيم للسائر في زيارة النبي صلى الله عليه وسلم	عبد الصمد بن عبد الوهاب بن أبي الحسن محمد بن هبة الله بن عبد الله بن الحسين أمين الدين أبو اليمن بن عساكر الدمشقي نزيل مكة (المتوفى: 686ه)	ShamelaY19	26764	0.30058
		ذكر أسماء التابعين ومن بعدهم ممن صحت روايته عن الثقات عند البخاري ومسلم	أبو الحسن علي بن عمر بن أحمد بن مهدي بن مسعود بن النعمان بن دينار البغدادي الدارقطني (المتوفى: 385ه)	Sham19Y	5881	0.30056
		تحفة الطالب بمعرفة أحاديث مختصر ابن الحاجب	أبو الفداء إسماعيل بن عمر بن كثير القرشي البصري ثم الدمشقي (المتوفى: 774هـ)	ShamAY	9978	0.30055
		ذم الملاهي (المجلس الثاني والخمسون من أمالي ابن عساكر)	ثقة الدين، أبو القاسم علي بن الحسن بن هبة الله المعروف بابن عساكر (المتوفى: 571ه)	ShamelaY19	26707	0.30053
		السنن الأبين والمورد الأمعن في المحاكمة بين الإمامين في السند المعنعن	محمد بن عمر بن محمد، أبو عبد الله، محب الدين ابن رشيد الفهري السبتي (المتوفى: 721ه)	Sham19Y	6011	0.30052
