automatic URI	Proposed URI	bookTitle	authorName	collection	id	tfidf
		طبقات الحفاظ وأسماء المدلسين للذهبي	الذهبي، شمس الدين	ShamAY	34579	0.85585
		تذكير النابهين بسير أسلافهم حفاظ الحديث السابقين اللاحقين	ربيع بن هادي المدخلي	ShamAY	37348	0.39016
		تذكير النابهين بسير أسلافهم حفاظ الحديث السابقين واللاحقين	ربيع بن هادي المدخلي	ShamAY	33029	0.38876
		ذيول تذكرة الحفاظ (الحسيني - ابن فهد - السيوطي)	أبو المحاسن الحسيني	ShamAY	34592	0.38536
		أسنى المطالب في مناقب سيّدنا علي بن أبي طالب	أبي الخير شمس الدين محمد بن محمد بن محمد الجزري الشافعي	Rafed	2614	0.38444
		أسنى المطالب فى مناقب الإمام على(ع)	شمس الدين محمد الجزري	Masaha	1832	0.38396
		 أسنى المطالب في مناقب الإمام علي ( ع ) 	 محمد بن محمد الدمشقي ( ابن الجزري ) 	ABLibrary	7411	0.37593
		المدخل إلى علم السنن للبيهقي ت عوامة	أبو بكر أحمد بن الحسين البيهقي (384 ه - 458 ه)	Sham19Y	39268	0.37582
		ذيل طبقات الحفاظ للذهبي للسيوطي - ط العلمية = التراجم	الواحدي :: السيوطي	ShamAY	38189	0.3753
		تذهيب تهذيب الكمال في أسماء الرجال	شمس الدين أبي عبد الله محمد بن أحمد بن عثمان بن قيماز الشهير ب «الذهبي» (673 - 748 ه)	ShamelaY19	149213	0.37505
		ذيل [طبقات الحفاظ للذهبي]	عبد الرحمن بن أبي بكر، جلال الدين السيوطي (المتوفى: 911هـ)	ShamAY	7315	0.37334
		 ذيل تذكرة الحفاظ 	 محمد الحسيني الدمشقي 	ABLibrary	829	0.3698
		ذيل تأريخ مدينة السلام [ج ٤]	أبي عبد الله محمّد بن سعيد بن الدبيثي	Rafed	2326	0.36955
		ذيل تذكرة الحفاظ للحسيني الدمشقي - ط العلمية = التراجم	أبو المحاسن الحسيني	ShamAY	38190	0.36909
		طبقات الفقهاء	أبو اسحاق إبراهيم بن علي الشيرازي (المتوفى: 476هـ)	ShamAY	1031	0.36801
		ذيل تأريخ مدينة السلام [ج ٣]	أبي عبد الله محمّد بن سعيد بن الدبيثي	Rafed	2323	0.36792
		المدخل إلى علم السنن للبيهقي ت عوامة	أبو بكر أحمد بن الحسين البيهقي (384 ه - 458 ه)	ShamelaY19	39268	0.36629
		سنن أبي داود ت الأرنؤوط	أبو داود سليمان بن الأشعث بن إسحاق بن بشير بن شداد بن عمرو الأزدي السجستاني (المتوفى: 275ه)	Sham19Y	117359	0.36494
		 لحظ الألحاظ بذيل طبقات الحفاظ 	 محمد بن محمد ابن محمد بن فهد الهاشمي المكي 	ABLibrary	830	0.36483
		ذيل تأريخ مدينة السلام [ج ٢]	أبي عبد الله محمّد بن سعيد بن الدبيثي	Rafed	2311	0.36437
		الرد الوافر	محمد بن عبد الله (أبي بكر) بن محمد ابن أحمد بن مجاهد القيسي الدمشقي الشافعي، شمس الدين، الشهير بابن ناصر الدين (المتوفى: 842هـ)	ShamAY	6660	0.36264
		سنن أبي داود ت الأرنؤوط	أبو داود سليمان بن الأشعث بن إسحاق بن بشير بن شداد بن عمرو الأزدي السِّجِسْتاني (المتوفى: 275هـ)	ShamAY	31661	0.36107
		رواية صحيح مسلم من طريق ابن ماهان مقارنة برواية ابن سفيان	مصدق أمين عطية الدوري	Sham19Y	13554	0.36096
		معجم المحدثين للذهبى - العلمية	شمس الدين محمد بن أحمد بن عثمان الذهبي	ShamAY	34631	0.36079
		الجامع لعلوم الإمام أحمد - الترجمة	خالد الرباط، وائل إمام [بمشاركة الباحثين بدار الفلاح]	ShamAY	38862	0.36063
		ذيل تأريخ مدينة السلام [ج ١]	أبي عبد الله محمّد بن سعيد بن الدبيثي	Rafed	2307	0.36055
		ذيل تذكرة الحفاظ للحسيني	شمس الدين أبو المحاسن محمد بن علي بن الحسن بن حمزة الحسيني الدمشقي الشافعي (المتوفى: 765هـ)	ShamAY	7307	0.35956
		معرفة القراء الكبار على الطبقات والأعصار	شمس الدين أبو عبد الله محمد بن أحمد بن عثمان بن قايماز الذهبي (المتوفى: 748ه)	Sham19Y	8349	0.35914
		ترجمة الإمام مسلم ورواة صحيحه	شمس الدين أبو عبد الله محمد بن أحمد بن عثمان بن قايماز الذهبي (المتوفى: 748ه)	Sham19Y	29830	0.35749
		معرفة القراء الكبار على الطبقات والأعصار - ط العلمية = التراجم	شمس الدين أبو عبد الله محمد بن أحمد بن عثمان بن قَايْماز الذهبي (المتوفى: 748هـ)	ShamAY	38181	0.35748
		رواية صحيح مسلم من طريق ابن ماهان مقارنة برواية ابن سفيان	مصدق أمين عطية الدوري	ShamAY	31812	0.35691
		معرفة القراء الكبار على الطبقات والأعصار	شمس الدين أبو عبد الله محمد بن أحمد بن عثمان بن قَايْماز الذهبي (المتوفى: 748هـ)	ShamAY	8349	0.35672
		الغنية فهرست شيوخ القاضي عياض	عياض بن موسى بن عياض بن عمرون اليحصبي السبتي، أبو الفضل (المتوفى: 544ه)	Sham19Y	26463	0.35623
		إكمال تهذيب الكمال لمغلطاي - مقابل	علاء الدين مغلطاي بن قليج الحنفي	ShamAY	34647	0.35537
		ترجمة الإمام مسلم ورواة صحيحه	شمس الدين أبو عبد الله محمد بن أحمد بن عثمان بن قايماز الذهبي (المتوفى: 748ه)	ShamelaY19	29830	0.35522
		جزء فيه : ستة مجالس من أمالي الشيخ الإمام العدل أبي بكر محمد بن عبد الباقي بن محمد الأنصاري عن شيوخه (442هـ ــ 535هـ )	محمد بن زيد الأنصاري	ShamAY	35227	0.35507
		المعجم المختص بالمحدثين	شمس الدين أبو عبد الله محمد بن أحمد بن عثمان بن قايماز الذهبي (المتوفى: 748ه)	Sham19Y	9869	0.35427
		 نفح الطيب من غصن الأندلس الرطيب 	 أحمد بن محمد المقري التلمساني 	ABLibrary	9306	0.354
		المستخرج من كتب الناس للتذكرة والمستطرف من أحوال الرجال للمعرفة	عبد الرحمن بن محمد بن إسحاق، ابن مندة العبدي الأصبهاني، أبو القاسم (المتوفى: 470ه)	Sham19Y	122397	0.35394
		جزء فيه طرق حديث عبد الرحمن بن أبي ليلى عن كعب بن عجرة في الصلاة على النبي صلى الله عليه وسلم	شرف الدين، علي بن المفضل بن علي بن مفرج بن حاتم بن حسن بن جعفر المقدسي (المتوفى: 611ه)	Sham19Y	3981	0.35391
		شجرة النور الزكية في طبقات المالكية	محمد بن محمد بن عمر بن علي ابن سالم مخلوف (المتوفى: 1360ه)	Sham19Y	7669	0.35346
		طبقات المفسرين للداوودي	محمد بن علي بن أحمد، شمس الدين الداوودي المالكي (المتوفى: 945ه)	ShamelaY19	27084	0.35344
		إكمال تهذيب الكمال الجزء الأول والثاني	الحافظ علاء الدين مغلطاي بن قليج الحنفي (689 - 762 هـ)	ShamAY	34632	0.35341
		الجامع لعلوم الإمام أحمد - الترجمة	خالد الرباط، وائل إمام [بمشاركة الباحثين بدار الفلاح]	ShamelaY19	20870	0.353
		برنامج التجيبي	القاسم بن يوسف بن محمد بن علي التجيبي البلنسي السبتي (المتوفى: 730هـ)	ShamAY	9870	0.35298
		إتحاف المرتقي بتراجم شيوخ البيهقي	محمود بن عبد الفتاح النحال	Sham19Y	123666	0.35297
		رجال الحاكم في المستدرك	مقبل بن هادي بن مقبل بن قائدة الهمداني الوادعي (المتوفى: 1422ه)	ShamelaY19	29742	0.35257
		إكمال تهذيب الكمال في أسماء الرجال	مغلطاي بن قليج بن عبد الله البكجري المصري الحكري الحنفي، أبو عبد الله، علاء الدين (المتوفى: 762ه)	ShamelaY19	36515	0.35241
		طرح التثريب في شرح التقريب (المقصود بالتقريب: تقريب الأسانيد وترتيب المسانيد)	أبو الفضل زين الدين عبد الرحيم بن الحسين بن عبد الرحمن بن أبي بكر بن إبراهيم العراقي (المتوفى: 806ه)	Sham19Y	11036	0.35217
		التقييد لمعرفة رواة السنن والمسانيد	محمد بن عبد الغني بن أبي بكر بن شجاع، أبو بكر، معين الدين، ابن نقطة الحنبلي البغدادي (المتوفى: 629ه)	Sham19Y	9584	0.35164
		نفحات الأزهار في خلاصة عبقات الأنوار [ج ١٣]	السيّد علي الحسيني الميلاني	Rafed	458	0.35162
		المقصد الأرشد في ذكر أصحاب الإمام أحمد	إبراهيم بن محمد بن عبد الله بن محمد ابن مفلح، أبو إسحاق، برهان الدين (المتوفى: 884ه)	Sham19Y	5890	0.35131
		الغنية فهرست شيوخ القاضي عياض	عياض بن موسى بن عياض بن عمرون اليحصبي السبتي، أبو الفضل (المتوفى: 544هـ)	ShamAY	26463	0.3512
		الدر الكمين بذيل العقد الثمين في تاريخ البلد الأمين‏  - الجزء1	عمر بن فهد الهاشمي المكي	Masaha	4231	0.35119
		الأربعون على الطبقات لعلي بن المفضل المقدسي	شرف الدين، علي بن المفضل بن علي بن مفرج بن حاتم بن حسن بن جعفر المقدسي (المتوفى: 611ه)	ShamelaY19	26726	0.3507
		كتاب الأربعين حديثا (الأربعين من أربعين عن أربعين)	الحسن بن محمد بن محمد ابن عمروك التيمي النيسابورى ثم الدمشقي، أبو علي، صدر الدين البكري (المتوفى: 656ه)	ShamelaY19	26487	0.35069
		المستَخرجُ من كُتب النَّاس للتَّذكرة والمستطرف من أحوال الرِّجال للمعرفة	عبد الرحمن بن محمد بن إسحاق، ابن مندة العبدي الأصبهاني، أبو القاسم (المتوفى: 470هـ)	ShamAY	31728	0.35002
		طبقات المفسرين للداوودي - ط العلمية = التراجم	محمد بن علي بن أحمد، شمس الدين الداوودي المالكي (المتوفى: 945هـ)	ShamAY	38009	0.34994
		إكمال تهذيب الكمال في أسماء الرجال	مغلطاي بن قليج بن عبد الله البكجري المصري الحكري الحنفي، أبو عبد الله، علاء الدين (المتوفى: 762هـ)	ShamAY	329	0.34994
		التحفة اللطيفة في تاريخ المدينة الشريفة [ج ٢]	شمس الدين السخاوي	Rafed	2248	0.34977
		شجرة النور الزكية في طبقات المالكية	محمد بن محمد بن عمر بن علي ابن سالم مخلوف (المتوفى: 1360هـ)	ShamAY	31725	0.34944
		الثقات ممن لم يقع في الكتب الستة (ينشر لأول مرة على نسخة خطية فريدة بخط الحافظ شمس الدين السخاوي المتوفى سنة 902 ه)	أبو الفداء زين الدين قاسم بن قطلوبغا السودوني (نسبة إلى معتق أبيه سودون الشيخوني) الجمالي الحنفي (المتوفى: 879ه)	Sham19Y	96165	0.34935
		ثبت أبي جعفر أحمد بن علي البلوي الوادي أشي	أبو جعفر أحمد بن علي البلوي الوادي آشي (المتوفى: 938هـ)	ShamAY	10736	0.34934
		نفحات الأزهار في خلاصة عبقات الأنوار [ج ١٥]	السيّد علي الحسيني الميلاني	Rafed	465	0.34907
		إِتْحَافُ المُرْتَقِي بِتَرَاجِمِ شُيُوخ البَيهَقِيّ	محمود بن عبد الفتاح النحال	ShamAY	31744	0.34905
		المتكلمون في الرجال (مطبوع ضمن مجموعة «أربع رسائل في علوم الحديث» )	شمس الدين أبو الخير محمد بن عبد الرحمن بن محمد بن أبي بكر بن عثمان بن محمد السخاوي (المتوفى: 902ه)	ShamelaY19	26111	0.34905
		التقييد لمعرفة رواة السنن والمسانيد	محمد بن عبد الغني بن أبي بكر بن شجاع، أبو بكر، معين الدين، ابن نقطة الحنبلي البغدادي (المتوفى: 629هـ)	ShamAY	9584	0.34898
		البلدانيات‏	محمد بن عبد الرحمن السخاوي	Masaha	3716	0.34896
		فهرسة ابن خير ط دار الغرب	ابن خير الإشبيلي (502 - 575 ه)	Sham19Y	16626	0.34895
		طبقات المفسرين للداوودي	محمد بن علي بن أحمد، شمس الدين الداوودي المالكي (المتوفى: 945هـ)	ShamAY	1451	0.3487
		جزء فيه طرق حديث عبد الرحمن بن أبي ليلى عن كعب بن عجرة في الصلاة على النبي صلى الله عليه وسلم	شَرَفُ الدِّيْنِ، عَلِيُّ بنُ المُفَضَّلِ بنِ عَلِيِّ بنِ مُفَرِّجِ بنِ حَاتِمِ بنِ حَسَنِ بنِ جَعْفَرٍ المَقْدِسِيُّ (المتوفى: 611هـ)	ShamAY	3981	0.34859
		المقصد الأرشد في ذكر أصحاب الإمام أحمد	إبراهيم بن محمد بن عبد الله بن محمد ابن مفلح، أبو إسحاق، برهان الدين (المتوفى: 884هـ)	ShamAY	5890	0.34859
		المعجم المختص بالمحدثين	شمس الدين أبو عبد الله محمد بن أحمد بن عثمان بن قَايْماز الذهبي (المتوفى: 748هـ)	ShamAY	9869	0.34837
		الاستغناء في معرفة المشهورين من حملة العلم بالكنى «وهو مشتمل على ثلاثة كتب في الكنى»	أبو عمر يوسف بن عبد الله بن عبد البر النمري القرطبي (368 - 463 ه)	ShamelaY19	132971	0.34821
		رجال الحاكم في المستدرك	مُقْبلُ بنُ هَادِي بنِ مُقْبِلِ بنِ قَائِدَةَ الهَمْدَاني الوادعِيُّ (المتوفى: 1422هـ)	ShamAY	197	0.34795
		طرح التثريب في شرح التقريب (المقصود بالتقريب: تقريب الأسانيد وترتيب المسانيد)	أبو الفضل زين الدين عبد الرحيم بن الحسين بن عبد الرحمن بن أبي بكر بن إبراهيم العراقي (المتوفى: 806هـ)	ShamAY	11036	0.34788
		السفر الخامس من كتاب الذيل والتكملة لكتابي الموصول والصلة	أبو عبد الله محمد بن محمد بن عبد الملك الأنصاري الأوسي المراكشي (المتوفى: 703ه)	Sham19Y	1030	0.3477
		الغنية فهرست شيوخ القاضي عياض	عياض بن موسى بن عياض بن عمرون اليحصبي السبتي، أبو الفضل (المتوفى: 544ه)	ShamelaY19	26463	0.34711
		الثقات ممن لم يقع في الكتب الستة (يُنشر لأول مرة على نسخة خطية فريدة بخطِّ الحافظ شمس الدين السَّخاوي المتوفى سنة 902 هـ)	أبو الفداء زين الدين قاسم بن قُطْلُوْبَغَا السُّوْدُوْنِي (نسبة إلى معتق أبيه سودون الشيخوني) الجمالي الحنفي (المتوفى: 879هـ)	ShamAY	1676	0.34699
		العقد الثّمين في تاريخ البلد الأمين [ج ٥]	تقي الدين محمّد بن أحمد الحسني الفاسي المكّي	Rafed	2226	0.34697
		المستخرج من كتب الناس للتذكرة والمستطرف من أحوال الرجال للمعرفة	عبد الرحمن بن محمد بن إسحاق، ابن مندة العبدي الأصبهاني، أبو القاسم (المتوفى: 470ه)	ShamelaY19	122397	0.34636
		نزهة الناظر في ذكر من حدث عن أبي القاسم البغوي من الحفاظ والأكابر	يحيى بن علي بن عبد الله بن علي بن مفرج، أبو الحسين، رشيد الدين القرشي الاموي النابلسي ثم المصري، المعروف بالرشيد العطار (المتوفى: 662ه)	ShamelaY19	26428	0.34626
		فهرسة ابن خير ط دار الغرب	ابن خير الإشبيلي (502 - 575 هـ)	ShamAY	38851	0.3462
		بهجة المحافل وأجمل الوسائل بالتعريف برواة الشمائل	إبراهيم بن إبراهيم بن حسن اللقاني، أبو الإمداد، برهان الدين المالكي (المتوفى: 1041ه)	ShamelaY19	96239	0.346
		التراجم الساقطة من كتاب إكمال تهذيب الكمال لمغلطاي (المطبوع)	مغلطاي بن قليج بن عبد الله البكجري المصري الحكري الحنفي، أبو عبد الله، علاء الدين (المتوفى: 762ه)	ShamelaY19	37551	0.34591
		الجواهر المضية في طبقات الحنفية = التراجم	عبد القادر بن محمد بن نصر الله القرشي، أبو محمد، محيي الدين الحنفي (المتوفى: 775هـ)	ShamAY	38014	0.34573
		الأربعون على الطبقات لعلي بن المفضل المقدسي	شَرَفُ الدِّيْنِ، عَلِيُّ بنُ المُفَضَّلِ بنِ عَلِيِّ بنِ مُفَرِّجِ بنِ حَاتِمِ بنِ حَسَنِ بنِ جَعْفَرٍ المَقْدِسِيُّ (المتوفى: 611هـ)	ShamAY	26726	0.34558
		الجواهر المضية في طبقات الحنفية	عبد القادر بن محمد بن نصر الله القرشي، أبو محمد، محيي الدين الحنفي (المتوفى: 775هـ)	ShamAY	6725	0.34553
		الثقات ممن لم يقع في الكتب الستة (ينشر لأول مرة على نسخة خطية فريدة بخط الحافظ شمس الدين السخاوي المتوفى سنة 902 ه)	أبو الفداء زين الدين قاسم بن قطلوبغا السودوني (نسبة إلى معتق أبيه سودون الشيخوني) الجمالي الحنفي (المتوفى: 879ه)	ShamelaY19	96165	0.34553
		تاريخ مدينة دمشق [ج ٦٧]	أبي القاسم علي بن الحسن ابن هبة الله بن عبد الله الشافعي [ ابن عساكر ]	Rafed	2543	0.34545
		السفر الخامس من كتاب الذيل والتكملة لكتابي الموصول والصلة	أبو عبد الله محمد بن محمد بن عبد الملك الأنصاري الأوسي المراكشي (المتوفى: 703هـ)	ShamAY	1030	0.34514
		كفاية الطالب في مناقب علي بن أبي طالب عليه السلام	محمّد بن يوسف الگنجي الشافعي	Rafed	3446	0.34513
		إتحاف المرتقي بتراجم شيوخ البيهقي	محمود بن عبد الفتاح النحال	ShamelaY19	123666	0.34493
		نفحات الأزهار في خلاصة عبقات الأنوار [ج ٢]	السيّد علي الحسيني الميلاني	Rafed	427	0.34482
		تدليس الشيوخ الضعفاء	عبد العزيز بن صالح اللحيدان	ShamAY	35218	0.34476
		 الآثار المروية في الأطعمة السرية والآلات العطرة 	 ابن بشكوال 	ABLibrary	9875	0.34475
		كتاب الأربعين حديثا (الأربعين من أربعين عن أربعين)	الحسن بن محمد بن محمد ابن عمروك التيمي النيسابورىّ ثم الدمشقيّ، أبو علي، صدر الدين البكري (المتوفى: 656هـ)	ShamAY	26487	0.34466
		موطأ مالك ت الأعظمي	مالك بن أنس بن مالك بن عامر الأصبحي المدني (المتوفى: 179ه)	ShamelaY19	28107	0.34461
		تحقيق كتاب البدور السافرة في أمور الآخرة	السيوطي	ShamAY	34815	0.34455
		الطيوريات	أبو طاهر السِّلَفي	ShamAY	9634	0.34453
		لحظ الألحاظ بذيل طبقات الحفاظ	محمد بن محمد بن محمد، أبو الفضل تقي الدين ابن فهد الهاشمي العلوي الأصفوني ثم المكي الشافعي (المتوفى: 871ه)	Sham19Y	7313	0.34442
		 ذيل طبقات الحفاظ 	 جلال الدين السيوطي 	ABLibrary	831	0.34433
		زيادات القطيعي على مسند الإمام أحمد دراسة وتخريجا	دخيل بن صالح اللحيدان	ShamAY	4262	0.34432
		ذيل تاريخ مدينة السلام‏  - الجزء1	محمد بن سعيد ابن الدبيثي	Masaha	4452	0.34427
		إعلام النبلاء بتاريخ حلب الشهباء [ج ٤]	محمد راغب بن محمود بن هاشم الطبّاخ الحلبي	Rafed	2366	0.34353
		مدرسة الحديث في مصر	محمد رشاد خليفة	Sham19Y	9974	0.3435
		الدرر الكامنة في أعيان المائة الثامنة	أبو الفضل أحمد بن علي بن محمد بن أحمد بن حجر العسقلاني (المتوفى: 852ه)	Sham19Y	6674	0.34344
		طبقات المفسرين للسيوطي	عبد الرحمن بن أبي بكر، جلال الدين السيوطي (المتوفى: 911ه)	Sham19Y	6234	0.34342
		موطأ مالك ت الأعظمي	مالك بن أنس بن مالك بن عامر الأصبحي المدني (المتوفى: 179هـ)	ShamAY	1143	0.3434
		لحظ الألحاظ بذيل طبقات الحفاظ	محمد بن محمد بن محمد، أبو الفضل تقي الدين ابن فهد الهاشمي العلويّ الأصفوني ثم المكيّ الشافعي (المتوفى: 871هـ)	ShamAY	7313	0.34333
		شيوخ عبد الله بن وهب القرشي الذين روى عنهم وسمع منهم وذكر تجريح من جرح منهم وتعديله مما وقع في كتاب أبي عبد الله محمد بن وضاح، مع أخبار ابن وهب وفضله وزهده وسبب وفاته	ابن بشكوال أبو القاسم خلف بن عبد الملك بن مسعود القرطبي الأندلسي (578 هـ)	ShamAY	33580	0.34325
		النكت على صحيح البخاري ويليه «التجريد على التنقيح»	أبو الفضل ابن حجر العسقلاني	ShamelaY19	132963	0.34324
		جزء فيه أحاديث يحيي بن معين برواية أبي منصور يحيي بن أحمد الشيباني	أبو زكريا يحيى بن معين بن عون بن زياد بن بسطام بن عبد الرحمن (المتوفى: 233هـ)	ShamAY	33649	0.3431
		شرح أبي داود للعيني	أبو محمد محمود بن أحمد بن موسى بن أحمد بن حسين الغيتابى الحنفى بدر الدين العينى (المتوفى: 855هـ)	ShamAY	8540	0.34283
		التعقب المتواني على السلسلة الضعيفة للألباني	أحمد شحاتة السكندري :: ناصر الدين الألباني	ShamAY	33145	0.34282
		معجم أصحاب القاضي أبي علي الصدفي	ابن الأبار، محمد بن عبد الله بن أبي بكر القضاعي البلنسي (المتوفى: 658ه)	ShamelaY19	28740	0.34274
		طبقات الحفاظ للسيوطي - ط العلمية = التراجم	عبد الرحمن بن أبي بكر، جلال الدين السيوطي (المتوفى: 911هـ)	ShamAY	38187	0.34263
		معجم حفّاظ القرآن عبر التّاريخ [ج ١]	الدكتور محمّد سالم محيسن	Rafed	905	0.34257
		طبقات الحفاظ للسيوطي	عبد الرحمن بن أبي بكر، جلال الدين السيوطي (المتوفى: 911هـ)	ShamAY	5823	0.34237
		معجم حفّاظ القرآن عبر التّاريخ [ج ٢]	الدكتور محمّد سالم محيسن	Rafed	906	0.34209
		تاريخ بغداد أو مدينة السّلام [ج ٢١]	محبّ الدين أبي عبدالله محمّد بن محمود بن الحسن [ ابن النجّار البغدادي ]	Rafed	2982	0.34198
		البلدانيات للسخاوي	شمس الدين أبو الخير محمد بن عبد الرحمن بن محمد السخاوي (المتوفى: 902هـ)	ShamAY	3576	0.3415
		كتاب الأربعين المتباينة بشرط السماع المتصل لرضوان بن محمد المستملي - مخطوط	رضوان بن محمد بن يوسف العقبي أبي النعيم المستملي	ShamAY	32859	0.34134
