automatic URI	Proposed URI	bookTitle	authorName	collection	id	tfidf
		مواهب الفتّاح في شرح تلخيص المفتاح [ج ٢]	أبي العبّاس أحمد بن محمّد بن محمّدابن يعقوب المغربي	Rafed	2210	0.25696
		فقه قراءة القرآن الكريم	أبو خالد سعيد عبد الجليل يوسف صخر المصري	ShamAY	1481	0.25695
		التعرف لمذهب أهل التصوف	أبو بكر محمد بن أبي إسحاق بن إبراهيم بن يعقوب الكلاباذي البخاري الحنفي (المتوفى: 380ه)	Sham19Y	6518	0.25695
		دحض دعوى المستشرقين أن القرأن من عند النبي صلى الله علية وسلم	سعود بن عبد العزيز الخلف	ShamAY	11180	0.25694
		تفسير غريب القرآن - الكواري	كاملة بنت محمد بن جاسم بن علي آل جهام الكواري	Sham19Y	37660	0.25694
		مرآة العقول [ج ١٢]	الشيخ محمّد باقر بن محمّد تقي المجلسي	Rafed	1032	0.25694
		مع المصطفي ( صلي الله عليه و آله و سلم )	عائشة عبدالرحمن بنت شاطي	Ghbook	5302	0.25694
		 بحوث في الملل والنحل 	 الشيخ السبحاني 	ABLibrary	8359	0.25694
		 دولة المهدي ( عج ) المنتظر 	 إبراهيم الأنصاري 	ABLibrary	971	0.25693
		شرح الشيخ جعفر علي قواعد العلامه ابن المطهر	حسن بن جعفر بن خضر نجفي كاشف الغطاء	Ghbook	12078	0.25692
		 فتوح الغيب 	 عبد القادر الجيلاني 	ABLibrary	8722	0.25692
		تذكرة بالأخبار عن اتقافات الأسفار  - الجزء1	محمد بن أحمد ابن جبير	Masaha	4170	0.25692
		شرح التلويح على التوضيح	سعد الدين مسعود بن عمر التفتازاني (المتوفى: 793هـ)	ShamAY	9508	0.25691
		الإنفاق في سبيل الله	عز الدين بحر العلوم	Rafed	10	0.25691
		 التعليقات على شرح اللمعة الدمشقية 	 جمال الدين محمد الخوانساري 	ABLibrary	9348	0.2569
		شَمُّ العَوارِضِ في ذمِّ الرُّوَافِضِ	علي بن (سلطان) محمد، أبو الحسن نور الدين الملا الهروي القاري (المتوفى: 1014هـ)	ShamAY	1071	0.25689
		شرح بلوغ المرام لعطية سالم	عطية بن محمد سالم (المتوفى : 1420هـ)	ShamAY	7714	0.25689
		المقترح في أجوبة بعض أسئلة المصطلح - أكثر من 200 سؤال في المصطلح مع محاضرات في:	أَبِو عَبد الرَّحمَن مُقْبلُ بنُ هَادِي بنِ مُقْبِلِ بنِ قَائِدَةَ (اسم رجل) الهَمْدَاني الوادعِيُّ (المتوفى: 1422هـ)	ShamAY	1998	0.25689
		مختصر تفسير ابن كثير	(اختصار وتحقيق) محمد علي الصابوني	Sham19Y	21549	0.25689
		صدق الله العظيم وكذبت النبوءات	علي بن نايف الشحود	ShamAY	1775	0.25688
		شفاء الصّدور في شرح زيارة العاشور [ج ١]	ميرزا أبي الفضل الطهراني	Rafed	3232	0.25688
		محمد بن عبد الوهاب عقيدته السلفية ودعوته الإصلاحية وثناء العلماء عليه	أحمد بن حجر بن محمد بن حجر بن أحمد بن حجر بن طامي بن حجر بن سند بن سعدون آل بوطامي البنعلي (المتوفى: 1423ه)	Sham19Y	11382	0.25687
		مختصر عجائب الدنيا	شاه إبراهيم ابن وصيف	Masaha	4092	0.25687
		تغيير التنقيح لابن كمال باشا	شيخ الإسلام ابن كمال باشا (ت941هـ)	ShamAY	37541	0.25686
		تفسير بيان السعادة في مقامات العبادة [ج ١]	سلطان محمّد الجنابذي [ سلطان علي شاه ]	Rafed	3362	0.25686
		طبقات الشعراء لابن المعتز	عبد الله بن محمد ابن المعتز العباسي (المتوفى: 296هـ)	ShamAY	7867	0.25685
		شرح القواعد السعدية	عبد المحسن بن عبد الله بن عبد الكريم الزامل	ShamAY	32453	0.25685
		هذه مفاهيمنا	صالح بن عبد العزيز بن محمد بن إبراهيم آل الشيخ	ShamAY	12120	0.25684
		رسائل ابن حزم الأندلسي	أبو محمد علي بن أحمد بن سعيد بن حزم الأندلسي القرطبي الظاهري (المتوفى: 456ه)	Sham19Y	1038	0.25684
		الحاشية على مدارك الأحكام [ج ٣]	محمّد باقر الوحيد البهبهاني	Rafed	680	0.25683
		تفسير الثعالبي - مؤسسة الأعلمي	عبد الرحمن بن محمد بن مخلوف الثعالبي	ShamAY	34066	0.25682
		شرح المنهج المنتخب إلى قواعد المذهب	المنجور أحمد بن علي المنجور (المتوفى 995 ه)	Sham19Y	18279	0.25682
		أنوار الأصول [ج ١]	الناشر: مدرسة الإمام علي بن أبي طالب عليه السلام	Rafed	936	0.25682
		الاتقان في علوم القرآن 	جلال الدين عبدالرحمن بن ابي بكر سيوطي	Ghbook	2793	0.25682
		الإقبال بالأعمال الحسنة (ط - الحديثة) - الجزء1	السيد علي بن موسى بن طاووس	Masaha	1012	0.25682
		شرح ألفية ابن مالك للعثيمين	محمد بن صالح بن محمد العثيمين (المتوفى: 1421ه)	ShamelaY19	36954	0.25681
		مباني نقد متن الحديث	قاسم البيضاني	Masaha	569	0.25681
		محاضرات عقائدية	المستشار الدمرداش العقالي	Masaha	400	0.25681
		أصول أهل السنة والجماعة	أبو الأشبال حسن الزهيري آل مندوه المنصوري المصري	ShamAY	701	0.2568
		شرح القصيدة اللامية لابن تيمية - عبد الرحيم السلمي	عبد الرحيم بن صمايل العلياني السلمي	ShamelaY19	37805	0.2568
		التفسير الوسيط للزحيلي	د وهبة بن مصطفى الزحيلي	ShamAY	2305	0.25679
		موسوعة أخلاق القرآن [ج ٥]	الدكتور أحمد الشرباصي	Rafed	3905	0.25679
		أُصُوْلٌ بِلاَ أُصُوْلٍ - بحثٌ وافٍ في ردِّ عُدوانِ الصُّوفيةِ ومُدَّعِي المَهْدِيَّةِ على مصادر التلقى، والمرجعيةِ الشرعيةِ	محمد بن أحمد بن إسماعيل المقدم	ShamAY	1971	0.25678
		المقترح في أجوبة بعض أسئلة المصطلح - أكثر من 200 سؤال في المصطلح مع محاضرات في:	أبو عبد الرحمن مقبل بن هادي بن مقبل بن قائدة (اسم رجل) الهمداني الوادعي (المتوفى: 1422ه)	ShamelaY19	96783	0.25676
		العبودية	تقي الدين أبو العباس أحمد بن عبد الحليم بن عبد السلام بن عبد الله بن أبي القاسم بن محمد ابن تيمية الحراني الحنبلي الدمشقي (المتوفى: 728ه)	ShamelaY19	22647	0.25674
		تاريخ نزول القرآن	محمد رأفت سعيد	ShamelaY19	37483	0.25674
		موسوعة الأخلاق - الخراز	خالد بن جمعة بن عثمان الخراز	ShamelaY19	121380	0.25674
		شرح الورقات في أصول الفقه - الددو	محمد الحسن الددو الشنقيطي	Sham19Y	7689	0.25674
		أصول الحكم على المبتدعة عند شيخ الإسلام ابن تيمية	د. أحمد بن عبد العزيز الحليبي	ShamAY	35716	0.25673
		توحيد العبادة		ShamAY	35523	0.25673
		الشبهات التي أثيرت حول دعوة الشيخ محمد بن عبد الوهاب (مطبوع ضمن بحوث ندوة دعوة الشيخ محمد بن عبد الوهاب)	عبد الكريم الخطيب	ShamAY	7648	0.25673
		تراثنا ـ العددان [ 43 و 44 ]	مؤسسة آل البيت عليهم السلام لإحياء التراث ـ قم	Rafed	2816	0.25673
		الأديان والمذاهب - جامعة المدينة	مناهج جامعة المدينة العالمية	ShamelaY19	31083	0.25672
		المفَصَّلُ في عواملِ النَّصر والهزيمةِ	علي بن نايف الشحود	ShamAY	33268	0.25671
		الشهادتان	محمد الغزالي	ShamAY	35256	0.25671
		السلفيون وقضية فلسطين في واقعنا المعاصر وفيه (حكم عمليات الاقتحام بالنفس)	أبو عبيدة مشهور بن حسن بن محمود آل سلمان	Sham19Y	1691	0.2567
		المفصل في شرح حديث من بدل دينه فاقتلوه	علي بن نايف الشحود	ShamAY	35956	0.25669
		المناهل الحسان في دروس رمضان	الواحدي :: عبد العزيز السلمان	ShamAY	35008	0.25669
		التوازن التربوي وأهميته لكل مسلم	مجدي الهلالي	ShamAY	267	0.25668
		التبيين عن مذاهب النحويين البصريين والكوفيين	أبو البقاء عبد الله بن الحسين بن عبد الله العكبري البغدادي محب الدين (المتوفى: 616هـ)	ShamAY	31791	0.25667
		رجال المعلقات العشر	مصطفى بن محمد سليم الغلايينى (المتوفى: 1364هـ)	ShamAY	5402	0.25667
		هداية الحيارى في أجوبة اليهود والنصارى	شمس الدّين محمّد بن أبي بكر بن أيّوب الزّرعي [ ابن قيّم الجوزيّة ]	Rafed	3470	0.25667
		درة التنزيل وغرة التأويل	أبو عبد الله محمد بن عبد الله الأصبهاني المعروف بالخطيب الإسكافي (المتوفى: 420هـ)	ShamAY	1340	0.25666
		غاية المنوة في آداب الصحبة وحقوق الأخوة	حازم خنفر	ShamelaY19	36533	0.25666
		أحكام القرآن [ج ٤]	أبي بكر أحمد بن علي الرازي الجصّاص	Rafed	1999	0.25666
		 منهج الرشاد في معرفة المعاد 	 ملا نعيما العرفي الطالقاني 	ABLibrary	8649	0.25666
		نظام القضاء والشهادة في الشريعة الإسلامية الغراء - الجزء1	الشيخ جعفر السبحاني	Masaha	5115	0.25666
		دفاع عن الرسول ضد الفقهاء والمحدثين	الكاتب المصري صالح الورداني	Masaha	256	0.25665
		الحسام الماحق لكل مشرك ومنافق	أبو شكيب محمد تقي الدين بن عبد القادر الهلالي (المتوفى: 1407هـ)	ShamAY	1702	0.25664
		البحر الرائق شرح كنز الدقائق ومنحة الخالق وتكملة الطوري	زين الدين بن إبراهيم بن محمد، المعروف بابن نجيم المصري (المتوفى: 970هـ)	ShamAY	12227	0.25664
		المرشد الوجيز إلى علوم تتعلق بالكتاب العزيز	المقدسي، أبو شامة	ShamelaY19	22676	0.25664
		جواهر الكلام في شرح شرائع الاسلام	محمد حسن بن باقر نجفي ( صاحب جواهر )	Ghbook	10694	0.25664
		تكملة الجامع لسيرة شيخ الإسلام ابن تيمية خلال سبعة قرون - ط عالم الفوائد	علي بن محمد العمران	ShamAY	34400	0.25663
		كوثَر المَعَاني الدَّرَارِي في كَشْفِ خَبَايا صَحِيحْ البُخَاري	محمَّد الخَضِر بن سيد عبد الله بن أحمد الجكني الشنقيطي (المتوفى: 1354هـ)	ShamAY	31959	0.25663
		الإبطال والرفض لعدوان من تجرأ على (كشف الشبهات) بالنقض، ويليه / ملامح جهمية	أبو محمد عبد الكريم بن صالح بن عبد الكريم الحميد	ShamelaY19	37604	0.25663
		أحكام القرآن لابن الفرس	أبو محمد عبد المنعم بن عبد الرحيم المعروف «بابن الفرس الأندلسي» (المتوفى: 597 ه)	Sham19Y	133357	0.25663
		العرش للذهبي	شمس الدين أبو عبد الله محمد بن أحمد بن عثمان بن قَايْماز الذهبي (المتوفى: 748هـ)	ShamAY	7350	0.25662
		البدعة الشرعية	أبو المنذر محمود بن محمد بن مصطفى بن عبد اللطيف المنياوي	ShamelaY19	96850	0.25662
		المرأة بين الفقه والقانون	مصطفى بن حسني السباعي (المتوفى: 1384ه)	Sham19Y	828	0.25662
		العناوين الفقهية - الجزء1	السيد مير عبد الفتاح الحسيني	Masaha	1566	0.25662
		الوقف القرآني وأثره في الترجيح عند الحنفية	عزت شحاته كرار محمد	ShamAY	1205	0.25661
		الإيمان بالقرآن الكريم والكتب السماوية	عَلي محمد محمد الصَّلاَّبي	ShamAY	25	0.25661
		محاضرات الأدباء و محاورات الشعراء و البلغاء - الجزء1	الراغب الأصفهاني	Masaha	3363	0.25661
		بداية المجتهد ونهاية المقتصد	أبو الوليد محمد بن أحمد بن محمد بن أحمد بن رشد القرطبي الشهير بابن رشد الحفيد (المتوفى: 595هـ)	ShamAY	21739	0.25659
		 رسائل ابن حزم الأندلسي 	 ابن حزم 	ABLibrary	8432	0.25659
		إعجاز القرآن بين المعتزلة والأشاعرة	د. منير سلطان (معاصر)	ShamAY	34105	0.25658
		الإيمان بين السلف والمتكلمين	أحمد بن عطية بن علي الغامدي	ShamAY	7563	0.25658
		محمد صلى الله عليه وآله وسلم في مكة	المستشرق الإنجليزي ويليام مونتجمري وات	ShamelaY19	23669	0.25658
		 معرفة الإمام 	 السيد محمد حسين الطهراني 	ABLibrary	8888	0.25658
		الخلاصة في حكم الاستعانة بالكفار في القتال	علي بن نايف الشحود	ShamAY	1604	0.25657
		النجاة في القيامة في تحقيق أمر الإمامة	ميثم بن علي بن ميثم البحراني	Rafed	3523	0.25656
		شرح كلمة الإخلاص لابن رجب	عبد الرحمن بن ناصر البراك	ShamAY	32532	0.25654
		العقد الثمين في شرح أحاديث أصول الدين	حسين بن غنّام (أو ابن أبي بكر بن غنام) النجدي الأحسائي المالكي (المتوفى: 1225هـ)	ShamAY	8514	0.25654
		لا إنكار في مسائل الخلاف	د. عبد السلام مقبل المجيدي	ShamAY	37577	0.25653
		الموسوعة العقدية - الدرر السنية	مجموعة من المؤلفين	Sham19Y	38058	0.25653
		روض الجنان في شرح إرشاد الأذهان [ج ١]	زين الدين بن علي العاملي [ الشهيد الثاني ]	Rafed	1539	0.25653
		معارج الأصول	الشيخ نجم الدين أبي القاسم جعفر بن الحسن بن يحيى بن سعيد الهذلي [ المحقق الحلّي ]	Rafed	271	0.25652
		مختصر الامثل في تفسير كتاب الله المنزل	آيت الله العظمي ناصرمكارم شيرازي	Ghbook	10117	0.25652
		تصحيح إعتقادات الإمامية	الشيخ المفيد	Masaha	220	0.25652
		المسائل النحوية والصرفية في شرح أبي العلاء المعري على ديوان ابن أبي حصينة	هاني القزاز	ShamAY	37054	0.2565
		اشتقاق أسماء الله	عبد الرحمن بن إسحاق البغدادي النهاوندي الزجاجي، أبو القاسم (المتوفى: 337هـ)	ShamAY	31971	0.2565
		جواهر الكلام [ج ٤٠]	الشيخ محمّد حسن النّجفي	Rafed	769	0.2565
		نظم وشرح مختصر المنار لطه أفندي	سنوي زاده	ShamAY	37594	0.25649
		تلقيح الأفهام العلية بشرح القواعد الفقهية	وليد بن راشد السعيدان	ShamAY	842	0.25649
		الامام الصادق ( عليه السلام ) علم و عقيده	رمضان لاوند	Ghbook	4982	0.25649
		 حياة الإمام زين العابدين ( ع ) 	 الشيخ باقر شريف القرشي 	ABLibrary	7500	0.25649
		حاشية المكاسب / تقريرات النجم آبادي	الشيخ آقا ضياء الدين العراقي	Masaha	5019	0.25648
		موسوعة هل يستوي الذين يعلمون والذين لا يعلمون - علم أصول الفقه في سطور	أبو سند محمد	ShamAY	37583	0.25647
		فتاوى الشيخ أبي عبد المعز محمد علي فركوس الجزائري	محمد علي فركوس الجزائري	ShamAY	37665	0.25647
		التوضيح الرشيد في شرح التوحيد المذيل بالتفنيد لشبهات العنيد	أبو عبد الله خلدون بن محمود بن نغوي الحقوي	ShamAY	31786	0.25647
		البلاغة العربية	عبد الرحمن بن حسن حَبَنَّكَة الميداني الدمشقي (المتوفى: 1425هـ)	ShamAY	12825	0.25647
		الطريقة النقشبندية بين ماضيها وحاضرِها	فريد الدين آيدن	ShamAY	35392	0.25645
		دليل المرشدين الي الحق اليقين	آيت الله العظمي جعفر سبحاني	Ghbook	10942	0.25645
		معجم البلدان	شهاب الدين أبو عبد الله ياقوت بن عبد الله الرومي الحموي (المتوفى: 626هـ)	ShamAY	23735	0.25642
		كفاح دين	محمد الغزالي	ShamAY	33247	0.25642
		الميسر في شرح مصابيح السنة للتوربشتي	فضل الله بن حسن بن حسين بن يوسف أبو عبد الله، شهاب الدين التوربشتي (المتوفى: 661 ه)	ShamelaY19	18569	0.25642
		قاعدة جليلة في التوسل والوسيلة	تقي الدين أبو العباس أحمد بن عبد الحليم بن عبد السلام بن عبد الله بن أبي القاسم بن محمد ابن تيمية الحراني الحنبلي الدمشقي (المتوفى: 728ه)	ShamelaY19	22649	0.25642
		المقنع في علوم الحديث	ابن الملقن سراج الدين أبو حفص عمر بن علي بن أحمد الشافعي المصري (المتوفى: 804ه)	Sham19Y	5976	0.25642
		 مجموعه رسائل ابن عربي 	 ابن عربي 	ABLibrary	8752	0.25641
		 في رحاب أهل البيت ( ع ) 	 لجنة بحوث المجمع العالمي لأهل البيت ( ع ) 	ABLibrary	8530	0.25641
		التفسير البياني لما في سورة النحل من دقائق المعاني	سامي وديع عبد الفتاح شحادة القدومي	ShamAY	116	0.2564
		الفقه، القواعد الفقهية	السيد محمد الحسيني الشيرازي	Masaha	3466	0.2564
		معدن الجواهر ورياضة الخواطر	الشيخ القاضي أبي الفتح محمد بن علي الكراجكي	Masaha	4571	0.25639
		الْعَقَائِدُ الْإِسْلاَمِيَّةِ مِنَ الْآيَاتِ الْقُرْآنِيَّةِ وَالْأَحَادِيثِ النَّبَوِيَّةِ	عبد الحميد محمد بن باديس الصنهاجي (المتوفى: 1359هـ)	ShamAY	1698	0.25638
		دعوة أهل البدع	خالد بن أحمد الزهراني	ShamAY	33317	0.25637
		السبع الشداد	السيد محمد باقر الميرداماد	Masaha	1256	0.25636
		كيف تصبح عالما	راغب السرجاني	ShamAY	639	0.25634
		دروس للشيخ صالح المغامسي	أبو هاشم صالح بن عوّاد بن صالح المغامسي	ShamAY	860	0.25632
		فتح المنعم شرح صحيح مسلم	الأستاذ الدكتور موسى شاهين لاشين	ShamAY	38844	0.25632
		التفكر والاعتبار بآياتِ الكسوف والزلازل والإعصار	أبو محمد عبد الكريم بن صالح بن عبد الكريم الحميد	ShamAY	1006	0.25632
		شرح الملوكى في التّصريف	ابن يعيش	Rafed	1971	0.25632
		المخصّص [ج ١٦]	أبي الحسن علي بن إسماعيل بن سيده المرسي [ ابن سيده ]	Rafed	3564	0.25632
		من مشاهير المجددين في الإسلام	صالح بن فوزان بن عبد الله الفوزان	Sham19Y	31084	0.25631
		 تسلية المجالس وزينة المجالس ( مقتل الحسين ع ) 	 السيد محمد بن أبي طالب الحسيني الكركي الحائري 	ABLibrary	7469	0.25631
		مطارح الأنظار - الجزء1	الشيخ أبي القاسم الكلانتري	Masaha	4325	0.25631
		الموسوعة الفقهية الكويتية	مجموعة من المؤلفين	ShamAY	11430	0.2563
		مراقي الفلاح شرح متن نور الإيضاح	حسن بن عمار بن علي الشرنبلالي المصري الحنفي (المتوفى: 1069هـ)	ShamAY	412	0.2563
		الإقناع في حل ألفاظ أبي شجاع	شمس الدين، محمد بن أحمد الخطيب الشربيني الشافعي (المتوفى: 977هـ)	ShamAY	6121	0.2563
		سوس العالمة	محمد المختار بن علي بن أحمد الإلغي السوسي (المتوفى: 1383هـ)	ShamAY	212	0.25629
		النور الساطع في الفقه النافع‏  - الجزء1	الشيخ كاشف الغطاء	Masaha	3583	0.25629
		دلائل الامامه	طبري امامي ( صغير ) ابوجعفر محمد بن جرير بن رستم ( قرن 4و5 ق ) ( صاحب دلائل الامامه )	Ghbook	10443	0.25628
		أَركانُ الإيمانِ	علي بن نايف الشحود	ShamAY	35	0.25627
		تعليقة على معالم الاصول [ج ٥]	السيّد علي الموسوي القزويني	Rafed	1388	0.25627
		موسوعة كشّاف إصطلاحات الفنون والعلوم [ج ١]	محمّد علي التهانوي	Rafed	1548	0.25627
		علم تفسير المنام	نادر زين الدين	ShamAY	35938	0.25626
		الشيعة: نص الحوار مع المستشرق كوربان	السيد محمد حسين الطباطبائي	Masaha	2320	0.25626
		أسس النظام السياسي عند الإمامية	الشيخ محمد السند	Masaha	4913	0.25625
		عصمة الأنبياء	محمّد بن عمر بن الحسن بن الحسين التيمي البكري [ فخر الدين الرازي ]	Rafed	1357	0.25624
		المذاهب والفرق في الإسلام	الدكتور صائب عبد الحميد	Rafed	21	0.25624
		تراجم شهداء الدعوة الإسلامية في العصر الحديث	عبد القادر عبار غنّوش	ShamAY	35816	0.25623
		عرائس البيان في حقائق القرآن [ج ١]	أبي محمّد صدر الدين روزبهان بن أبي نصر البقلي	Rafed	3943	0.25622
		نفح الأزهار في منتخبات الأشعار	شاكر بن مغامس بن محفوظ بن صالح شقير البتلوني (المتوفى: 1314هـ)	ShamAY	28175	0.25621
		انوار الفقاهه - كتاب المكاسب	حسن بن جعفر بن خضر نجفي كاشف الغطاء	Ghbook	12056	0.25621
		الكامل في التاريخ - الجزء1	ابن الأثير الجزري	Masaha	2823	0.25621
		 جواهر العقدين في فضل الشرفين 	 علي بن عبد الله السمهودي 	ABLibrary	7481	0.2562
		الإعتقادات	أبي جعفر محمّد بن علي بن الحسين بن بابويه القمّي [ الشيخ الصدوق ]	Rafed	5	0.25618
		 سند العروة الوثقى - كتاب النكاح 	 الشيخ محمد السند 	ABLibrary	9550	0.25618
		لسان العرب	محمد بن مكرم بن على، أبو الفضل، جمال الدين ابن منظور الأنصاري الرويفعى الإفريقى (المتوفى: 711ه)	Sham19Y	1687	0.25617
		تذكرة الراشد برد تبصرة الناقد	الإمام محمد عبد الحي اللكنوي (ت1304هـ)	ShamAY	36018	0.25616
		الحاكم الجشمي ومنهجه في التفسير	عدنان محمد زرزور	Sham19Y	37682	0.25616
		 إيضاح الغوامض في تقسيم الفرائض 	 الشيخ علي الغروي 	ABLibrary	9396	0.25616
		الوهابية بين المباني الفكرية والنتائج العملية	الشيخ جعفر السبحاني	Rafed	3417	0.25615
		الدر المختار وحاشية ابن عابدين (رد المحتار)	ابن عابدين، محمد أمين بن عمر بن عبد العزيز عابدين الدمشقي الحنفي (المتوفى: 1252هـ)	ShamAY	21613	0.25614
		الإنصاف للباقلاني	الإمام الباقلاني	ShamAY	35407	0.25614
		100 فائدة من سورة يوسف	محمد صالح المنجد	ShamAY	33128	0.25613
		الروح في الكلام على أرواح الأموات والأحياء بالدلائل من الكتاب والسنة	محمد بن أبي بكر بن أيوب بن سعد شمس الدين ابن قيم الجوزية (المتوفى: 751هـ)	ShamAY	6462	0.25613
		المنهاج في شعب الإيمان	الحسين بن الحسن بن محمد بن حليم البخاري الجرجاني، أبو عبد الله الحليمي (المتوفى: 403 ه)	ShamelaY19	18567	0.25612
		الامامه (حجه الاسلام شفتي)	محمد باقر شفتي گيلاني	Ghbook	15561	0.25612
