automatic URI	Proposed URI	bookTitle	authorName	collection	id	tfidf
		مقدمة ابن الصلاح = معرفة أنواع علوم الحديث - ت عتر	عثمان بن عبد الرحمن، أبوعمرو، تقي الدين المعروف بابن الصلاح (المتوفى: 643ه)	ShamelaY19	22870	0.26353
		معارج القبول بشرح سلم الوصول	حافظ بن أحمد حكمي	ShamelaY19	20854	0.26352
		الأشباه والنظائر في النحو [ج ٢]	جلال الدين عبد الرحمن بن أبي بكر السيوطي	Rafed	2064	0.26352
		 جواهر النصوص في حل كلمات الفصوص 	 الشيخ عبد الغني النابلسي 	ABLibrary	8854	0.26351
		شرح ديوان الحماسة	أبو على أحمد بن محمد بن الحسن المرزوقي الأصفهاني (المتوفى: 421 هـ)	ShamAY	26536	0.2635
		إرشاد طلاب الحقائق إلى معرفة سنن خير الخلائق - صلى الله عليه وسلم -	محيي الدين أبو زكريا يحيى بن شرف النووي الدمشقي (631 - 676 ه)	ShamelaY19	127654	0.2635
		 شرح الأنفاس الروحانية لأئمة السلف الصوفية 	 محمد بن عبد الملك الديلمي 	ABLibrary	8727	0.2635
		شرح المنظومة الحائية لابن أبي داود	عبد الكريم الخضير	ShamelaY19	23408	0.26349
		الموسوعة القرآنيّة خصائص السور [ج ٦]	الناشر: دار التقريب بين المذاهب الإسلامية	Rafed	3736	0.26349
		عقائد الإماميّة الإثنى عشريّة [ج ٣]	السيد إبراهيم الموسوي الزنجاني	Rafed	3539	0.26349
		الأمثل في تفسير كتاب الله المنزل [ج ٣]	آية الله مكارم الشيرازي	Rafed	2030	0.26349
		التنبيهات اللطيفة على ما احتوت عليه العقيدة الواسطية من المباحث المنيفة	أبو عبد الله، عبد الرحمن بن ناصر بن عبد الله بن ناصر بن حمد آل سعدي (المتوفى: 1376هـ)	ShamAY	9430	0.26348
		الشيخ الإمام محمد بن عبد الوهاب ومنهجه في مباحث العقيدة	آمنة محمد نصير	ShamAY	7656	0.26348
		دروس في البلاغة [ج ١]	الشيخ محمّدي البامياني	Rafed	1978	0.26348
		مجمع البحرين	فخرالدين طريحي	Ghbook	2695	0.26348
		فتاوى يكثر السؤال عنها	الدكتور صلاح محمد أبو الحاج	ShamAY	37669	0.26347
		النكت العصرية في أخبار الوزراء المصرية	عمارة بن علي بن زيدان الحكمي المذحجي اليمني، أبو محمد، نجم الدين (المتوفى: 569هـ)	ShamAY	9248	0.26346
		الطراز لأسرار البلاغة وعلوم حقائق الإعجاز	يحيى بن حمزة بن علي بن إبراهيم، الحسيني العلويّ الطالبي الملقب بالمؤيد باللَّه (المتوفى: 745هـ)	ShamAY	23788	0.26345
		خريدة القصر وجريدة العصر - قسم شعراء العراق جـ 4 المجلد الثاني 2	عماد الدين الكاتب الأصبهاني، محمد بن محمد صفي الدين بن نفيس الدين حامد بن أله، أبو عبد الله (المتوفى: 597هـ)	ShamAY	12833	0.26345
		شرح مسائل الجاهلية - صالح آل الشيخ	صالح آل الشيخ	ShamAY	34741	0.26344
		نيل المارب بشرح دليل الطالب	عبد القادر بن عمر بن عبد القادر ابن عمر بن أبي تغلب بن سالم التغلبي الشيباني (المتوفى: 1135ه)	ShamelaY19	96876	0.26344
		شرح العقيدة السفارينية - الدرة المضية في عقد أهل الفرقة المرضية	محمد بن صالح بن محمد العثيمين (المتوفى: 1421هـ)	ShamAY	9725	0.26343
		مفاتيح للتعامل مع القرآن	د صلاح عبد الفتاح الخالدي	ShamAY	1229	0.26342
		قواعد في الحكم على الآخرين	الواحدي :: وليد السعيدان	ShamAY	37489	0.26342
		إلزام النّاصب في إثبات الحجّة الغائب عجّل فرجه [ج ٢]	الشيخ علي اليزدي الحائري	Rafed	2566	0.26342
		غرائب التفسير وعجائب التأويل	محمود بن حمزة بن نصر، أبو القاسم برهان الدين الكرماني، ويعرف بتاج القراء (المتوفى: نحو 505ه)	Sham19Y	12820	0.26341
		موسوعة الأسئلة العقائديّة [ج ٤]	مركز الأبحاث العقائديّة	Rafed	1389	0.26341
		 رسائل في ولاية الفقيه 	 رحمان ستايش ومحمد كاظم 	ABLibrary	9633	0.26341
		اللباب في علل البناء والإعراب	أبو البقاء عبد الله بن الحسين بن عبد الله العكبري البغدادي محب الدين (المتوفى: 616هـ)	ShamAY	6986	0.26339
		الموشى = الظرف والظرفاء	محمد بن أحمد بن إسحاق بن يحيى، أبو الطيب، المعروف بالوشاء (المتوفى: 325هـ)	ShamAY	26102	0.26339
		الأمثل في تفسير كتاب الله المنزل [ج ٦]	آية الله مكارم الشيرازي	Rafed	2043	0.26338
		تنوير المقباس من تفسير ابن عباس	الفيروزآبادي	ShamAY	31591	0.26337
		توضيح الأحكام شرح تحفة الحكام	عثمان بن المكي التوزري الزبيدي	ShamelaY19	133369	0.26337
		وصايا الرّسول لزوج البتول عليهم السلام	السيد علي الصدر	Masaha	1755	0.26337
		رؤية إسلامية لأحوال العالم المعاصر	محمد قطب	ShamAY	34766	0.26336
		جامع المسائل لابن تيمية ط عالم الفوائد - المجموعة الرابعة	شيخ الإسلام أحمد بن عبد الحليم بن عبد السلام ابن تيمية (661 - 728 هـ)	ShamAY	37985	0.26336
		تمهيد الأوائل في تلخيص الدلائل	محمد بن الطيب بن محمد بن جعفر بن القاسم، القاضي أبو بكر الباقلاني المالكي (المتوفى: 403هـ)	ShamAY	6389	0.26336
		 معرفة الإمام 	 السيد محمد حسين الطهراني 	ABLibrary	8896	0.26336
		تشنيف المسامع بجمع الجوامع لتاج الدين السبكي	أبو عبد الله بدر الدين محمد بن عبد الله بن بهادر الزركشي الشافعي (المتوفى: 794هـ)	ShamAY	31691	0.26335
		حياة الإمام محمّد الباقر عليه السلام دراسة وتحليل [ج ١]	باقر شريف القرشي	Rafed	613	0.26334
		الكلام على مسألة السماع	أبو عبد الله محمد بن أبي بكر بن أيوب ابن قيم الجوزية (المتوفى: 751 ه)	ShamelaY19	18318	0.26333
		الرحلة الشامية (1910)	الأمير محمد علي بن محمد توفيق بن إسماعيل بن إبراهيم بن محمد علي (المتوفى: 1374ه)	Sham19Y	37027	0.26333
		تفسير من وحي القرآن [ج ٢١]	السيد محمد حسين فضل الله	Rafed	3286	0.26333
		تأريخ القرآن	الدكتور محمد حسين علي الصّغير	Rafed	45	0.26332
		فضل علم الوقف والابتداء وحكم الوقف على رؤوس الآيات	عبد الله علي الميموني	ShamelaY19	36539	0.26331
		ما دل عليه القرآن مما يعضد الهيئة الجديدة القويمة بالبرهان	أبو المعالي محمود شكري بن عبد الله بن محمد بن أبي الثناء الألوسي (المتوفى: 1342ه)	Sham19Y	5551	0.26331
		الآيات البينات في عدم سماع الأموات على مذهب الحنفية السادات	نعمان بن محمود الألوسي (المتوفى: 1317هـ)	ShamAY	247	0.2633
		تفسير أبي السّعود [ج ٩]	أبي السعود محمّد بن محمّد العمادي	Rafed	3258	0.2633
		أنوار النبي(ص) أسرارها و أنواعها	عبد الحق بن سبعين المرسي‏	Masaha	1941	0.2633
		أشعار الشعراء الستة الجاهليين	أبو الحجاج، يوسف بن سليمان بن عيسى الشنتمري الأندلسي المعروف بالأعلم (المتوفى: 476هـ)	ShamAY	5449	0.26329
		الاخلاق والتزكية في رحاب القرآن والسنة	عبد الكريم الحمداوي	ShamAY	34946	0.26329
		الظاهرة القرآنية	مالك بن الحاج عمر بن الخضر بن نبي (المتوفى: 1393ه)	Sham19Y	2910	0.26329
		أم القرى	عبد الرحمن بن أحمد بن مسعود الكواكبي يلقب بالسيد الفراتي (المتوفى: 1320ه)	Sham19Y	9680	0.26329
		المقدمة الجزولية في النحو	عيسى بن عبد العزيز بن يَلَلْبَخْت الجزولي البربري المراكشي، أبو موسى (المتوفى: 607هـ)	ShamAY	31949	0.26328
		نثر الدر في المحاضرات	منصور بن الحسين الرازي، أبو سعد الآبى (المتوفى: 421هـ)	ShamAY	7853	0.26326
		رسالة في حقيقة التأويل	عبد الرحمن بن يحيى بن علي بن محمد المعلمي العتمي اليماني (المتوفى: 1386هـ)	ShamAY	931	0.26325
		أساليب بلاغية، الفصاحة - البلاغة - المعاني	أحمد مطلوب أحمد الناصري الصيادي الرفاعي	ShamAY	32337	0.26325
		صوارم اليقين (رد على الزيدية في تشكيكهم في السنة النبوية)	يحيى المنصور بالله	ShamAY	35743	0.26324
		مطالع البدور ومنازل السرور	علي بن عبد الله الغزولي البهائي الدمشقي (المتوفى: 815ه)	Sham19Y	5390	0.26324
		المقاصد العلية في شرح الرسالة الألفية	الشهيد الثاني	Masaha	1147	0.26324
		شرح كتاب آداب المشي إلى الصلاة أو العبادات (الصلاة، الزكاة، الصيام)	محمد بن إبراهيم بن عبد اللطيف آل الشيخ (المتوفى: 1389هـ)	ShamAY	11263	0.26323
		شرح مقدمة سنن ابن ماجه	عبد الكريم الخضير	Sham19Y	27247	0.26323
		بحر الفوائد في شرح الفرائد [ج ١]	آية الله ميرزا محمّد حسن بن جعفر الآشتياني	Rafed	915	0.26323
		الفرقان في تفسير القرآن بالقرآن والسنّة [ج ٢]	الشيخ محمد الصادقي	Rafed	3004	0.26322
		تراثنا ـ العدد [ 34 ]	مؤسسة آل البيت عليهم السلام لإحياء التراث ـ قم	Rafed	2785	0.26321
		أثر الإيمان في تحصين الأمة الإسلامية ضد الأفكار الهدامة	عبد الله بن عبد الرحمن الجربوع	ShamAY	7265	0.2632
		قبسات من الرسول	الواحدي :: محمد قطب	ShamAY	37401	0.2632
		حاشية البجيرمي على الخطيب = تحفة الحبيب على شرح الخطيب	سليمان بن محمد بن عمر البُجَيْرَمِيّ المصري الشافعي (المتوفى: 1221هـ)	ShamAY	21599	0.2632
		إعجاز القرآن العلمي والبلاغي والحسابي	محمّد حسن قنديل	Rafed	3107	0.2632
		 آثار البلاد واخبار العباد 	 زكريا القزويني 	ABLibrary	8917	0.2632
		عدة الصابرين وذخيرة الشاكرين	محمد بن أبي بكر أيوب الزرعي أبو عبد الله	ShamAY	34428	0.26319
		المستقصى في أمثال العرب	أبو القاسم محمود بن عمرو بن أحمد، الزمخشري جار الله (المتوفى: 538هـ)	ShamAY	6895	0.26319
		أعلام النبوّة	أبي الحسن علي بن محمد الماوردي الشافعي	Rafed	3313	0.26319
		القوانين المحكمة في الأصول [ج ٣]	الميرزا أبو القاسم القمّي	Rafed	2625	0.26319
		روض الأخيار المنتخب من ربيع الأبرار	محمد بن قاسم بن يعقوب الأماسي الحنفي، محيي الدين، ابن الخطيب قاسم (المتوفى: 940هـ)	ShamAY	10512	0.26318
		همع الهوامع [ج ١]	جلال الدين عبد الرحمن بن أبي بكر السيوطي	Rafed	2157	0.26318
		شرح الطيبي على مشكاة المصابيح المسمى بـ (الكاشف عن حقائق السنن)	شرف الدين الحسين بن عبد الله الطيبي (743هـ)	ShamAY	31697	0.26317
		لماذا يمزق القرآن الكريم؟؟	علي بن نايف الشحود	ShamAY	33273	0.26317
		حاشية الشيخ إبراهيم السقا على تفسير الإمام أبي السعود [من أول قوله تعالى: {ثم أفيضوا من حيث أفاض الناس}، الآية: 199 إلى قوله تعالى: {وأولئك أصحاب النار هم فيها خالدون}، الآية: 217]	جميلة عبد السلام	ShamelaY19	151103	0.26315
		حاشية التوضيح والتصحيح لمشكلات كتاب التنقيح على شرح تنقيح الفصول في الأصول (لشهاب الدين القرافي ت 684 ه)	محمد الطاهر بن عاشور (المتوفى: 1393 ه)	ShamelaY19	150938	0.26315
		جواهر البلاغة في المعاني والبيان والبديع	أحمد بن إبراهيم بن مصطفى الهاشمي (المتوفى: 1362هـ)	ShamAY	9256	0.26314
		المهذب في تفسير سورة الملك	علي بن نايف الشحود	ShamAY	33098	0.26314
		 لطائف الأعلام في إشارات أهل الإلهام 	 عبد الرزاق الكاشاني ( القاشاني ) 	ABLibrary	8795	0.26314
		شرح ألفية العراقي في علوم الحديث	عبد الرحمن بن أبي بكر بن محمد، زين الدين المعروف بابن العيني الحنفي (المتوفى: 893ه)	ShamelaY19	96618	0.26313
		الغرر النقية على الدرر البهية	فيصل بن عبد العزيز آل مبارك (المتوفى: 1376 ه)	ShamelaY19	29570	0.26311
		الإيمانُ والعملُ الصالحُ سَببُ النَّجاحِ والفلاحِ	علي بن نايف الشحود	ShamAY	34826	0.2631
		تراثنا ـ العدد [ 57 ]	مؤسسة آل البيت عليهم السلام لإحياء التراث ـ قم	Rafed	3241	0.2631
		رفقاً بالقوارير - نصائح للأزواج	أمة الله بنت عبد المطلب - موقع مكتبة المسجد النبوي	ShamAY	22876	0.26309
		العبقات العنبرية	الشيخ محمد حسين كاشف الغطاء	Masaha	4085	0.26308
		رسالة السجزي إلى أهل زبيد في الرد على من أنكر الحرف والصوت	عبيد الله بن سعيد بن حاتم السجزيّ الوائلي البكري، أبو نصر (المتوفى: 444هـ)	ShamAY	11213	0.26307
		أدب الدنيا والدين ط الهلال	أبو الحسن علي بن محمد بن محمد بن حبيب البصري البغدادي، الشهير بالماوردي (المتوفى: 450هـ)	ShamAY	33725	0.26307
		غاية المريد شرح كتاب التوحيد	د. عبد الرحمن بن عبد العزيز العقل	ShamelaY19	145172	0.26307
		 معرفة المعاد 	 السيد محمد حسين الطهراني 	ABLibrary	8880	0.26307
		رسائل فقهية	الشيخ مرتضى الأنصاري	Masaha	1598	0.26307
		الأجوبة المفيدة لمهمات العقيدة	عبد الرحمن بن محمد بن خلف بن عبد الله الدوسري (المتوفى: 1399هـ)	ShamAY	9209	0.26306
		تهذيب اقتضاء الصراط المستقيم	شحاتة صقر	ShamAY	556	0.26306
		أشعار أولاد الخلفاء وأخبارهم	أبو بكر محمد بن يحيى بن عبد الله الصولي (المتوفى: 335هـ)	ShamAY	7822	0.26304
		التكفير وضوابطه - السقار	منقذ بن محمود السقار	ShamelaY19	95566	0.26304
		مع الحديدي في شرحه: مقتطفات هامة من شرح ابن ابي الحديد	علي خادمي	Ghbook	15626	0.26304
		 المغني في أبواب التوحيد والعدل 	 القاضي عبد الجبار الهمذاني 	ABLibrary	8622	0.26304
		المختصر المفيد في عقائد أئمة التوحيد	مدحت آل فراج	ShamAY	35502	0.26303
		الأحكام الشرعية للثورات العربية	علي بن نايف الشحود	ShamAY	1579	0.26303
		نظم القواعد الفقهية	عبد الرحمن السعدي	ShamAY	37545	0.26302
		شمس العلوم و دواء كلام العرب من الكلوم‌  - الجزء1	نشوان بن سعيد الحميري	Masaha	3682	0.26302
		شرح كتاب فضل الإسلام لمحمد بن عبد الوهاب - ناصر العقل	ناصر بن عبد الكريم العلي العقل	ShamAY	745	0.26301
		أشهد أنّ عليّاً وليّ الله بين الشرعيّة والابتداع	السيد علي الشهرستاني	Rafed	3847	0.26301
		جمل العلم و العمل	السيد المرتضى	Masaha	994	0.263
		التهذيب في فقه الإمام الشافعي	محيي السنة، أبو محمد الحسين بن مسعود بن محمد بن الفراء البغوي الشافعي (المتوفى: 516 ه)	Sham19Y	17885	0.26299
		شرح صحيح البخاري للحويني	أبو إسحاق الحويني الأثري حجازي محمد شريف	ShamAY	2082	0.26298
		المزدكية هي أصل الاشتراكية	عبد اللطيف بن علي بن أحمد بن محمد السلطاني القنطري الجزائري (المتوفى: 1404ه)	ShamelaY19	123658	0.26298
		التعليقة على المكاسب - الجزء1	السيد عبد الحسين اللاري	Masaha	5034	0.26297
		بحار الأنوار [ج ٦١]	الشيخ محمّد باقر بن محمّد تقي المجلسي	Rafed	1058	0.26296
		رسالة في حقيقة التأويل	عبد الرحمن بن يحيى بن علي بن محمد المعلمي العتمي اليماني (المتوفى: 1386ه)	ShamelaY19	37542	0.26295
		عمدة القاري شرح صحيح البخاري	أبو محمد محمود بن أحمد بن موسى بن أحمد بن حسين الغيتابى الحنفى بدر الدين العينى (المتوفى: 855ه)	Sham19Y	5756	0.26295
		إرشاد الأذهان إلى تفسير القرآن	الشيخ محمّد السبزواري النجفي	Rafed	3159	0.26295
		الشرح الكبير لمختصر الأصول من علم الأصول	أبو المنذر محمود بن محمد بن مصطفى بن عبد اللطيف المنياوي	ShamAY	1106	0.26294
		أدب الكاتب = أدب الكتاب لابن قتيبة	أبو محمد عبد الله بن مسلم بن قتيبة الدينوري (المتوفى: 276ه)	ShamelaY19	26349	0.26293
		مفاهيم القرآن [ج ٩]	الشيخ جعفر السبحاني	Rafed	380	0.26293
		 بحار الأنوار 	 العلامة المجلسي 	ABLibrary	757	0.26292
		الحجج السلفية في الرد على آراء ابن فرحان المالكي البدعية	عبد العزيز بن ريس الريس	ShamAY	35702	0.26291
		الأصول الشرعية في التوحيد والشرك، والسنة والبدعة، والتاريخ والصحابة، والدعوة والمنهج، والكفار والجهاد	ناصر الفهد	ShamAY	35721	0.26291
		سلسلة القمم لأهل الهمم	عائض بن عبد الله القرني	ShamAY	424	0.26291
		تمهيد القواعد	زين الدين بن علي العاملي [ الشهيد الثاني ]	Rafed	1344	0.26291
		مقالات الشيخ محمود غريب (الجزء الأول)	محمود محمد غريب: من علماء الأزهر الشريف والموجه الديني لشباب جامعة القاهرة	ShamAY	846	0.2629
		قواعد الأحكام في مصالح الأنام	أبو محمد عز الدين عبد العزيز بن عبد السلام بن أبي القاسم بن الحسن السلمي الدمشقي، الملقب بسلطان العلماء (المتوفى: 660هـ)	ShamAY	8608	0.26289
		الشيعة في العراء	عبد الله علي	ShamAY	35283	0.26289
		جامع المسائل لابن تيمية ط عالم الفوائد - المجموعة الثالثة	شيخ الإسلام أحمد بن عبد الحليم بن عبد السلام ابن تيمية (661 - 728 ه)	Sham19Y	17835	0.26289
		الامام زين العابدين علي بن الحسين بن اميرالمومنين علي بن ابي طالب عليهم السلام 	عبدالرزاق مقرم	Ghbook	6354	0.26289
		التمهيد - شرح مختصر الأصول من علم الأصول	أبو المنذر محمود بن محمد بن مصطفى بن عبد اللطيف المنياوي	ShamelaY19	37591	0.26288
		الرسائل الاعتقاديه	سيدمهدي رجايي	Ghbook	15607	0.26287
		نهاية الأرب في فنون الأدب‏ - الجزء1	أحمد بن عبد الوهاب النويري‏	Masaha	3070	0.26287
		نفح الطّيب [ج ١]	الشيخ أحمد بن محمد المقري التلمساني	Rafed	2786	0.26286
		الفرقان في تفسير القرآن بالقرآن والسنّة [ج ١٧]	الشيخ محمد الصادقي	Rafed	3038	0.26286
		تفسير من وحي القرآن [ج ٣]	السيد محمد حسين فضل الله	Rafed	3260	0.26286
		السراج الوهاج	ابراهيم بن سليمان القطيفي	Masaha	1144	0.26286
		شرح الآجرومية - عبد الكريم الخضير	عبد الكريم الخضير	ShamelaY19	21509	0.26285
		زبدة التّفاسير [ج ٣]	فتح الله بن شكر الله الشريف الكاشاني	Rafed	1712	0.26285
		التفسير الوسيط للقرآن الكريم [ج ٦]	الدكتور محمد سيد طنطاوي	Rafed	3944	0.26284
		الفروق في الشرح الممتع للإمام محمد العثيمين رحمه الله تعالى	عبد الرحمن بن صالح السديس	ShamAY	37525	0.26283
		العاقبة في ذكر الموت	عبد الحق بن عبد الرحمن بن عبد الله بن الحسين بن سعيد إبراهيم الأزدي، الأندلسي الأشبيلي، المعروف بابن الخراط (المتوفى: 581هـ)	ShamAY	6862	0.26283
		شرح القواعد السبع من التدمرية	يوسف بن محمد علي الغفيص	ShamelaY19	37782	0.26283
		عقود الزبرجد على مسند الإمام أحمد	عبد الرحمن بن أبي بكر، جلال الدين السيوطي (المتوفى: 911ه)	Sham19Y	14299	0.26283
		الفتح على أبي الفتح	محمد بن حمد بن محمد بن عبد الله بن محمود بن فورجة البروجردي (المتوفى: نحو 455ه)	ShamelaY19	37025	0.26281
		دروس للشيخ إبراهيم الفارس	إبراهيم بن عثمان الفارس	ShamAY	891	0.2628
		قصة البشرية	محمد إبراهيم الحمد :: محمد بن إبراهيم الحمد	ShamAY	1979	0.26279
		المسائل البصريات	أبو علي الفارسي (ت 377 هـ)	ShamAY	32669	0.26279
		الجرح والتعديل للقاسمي	محمد جمال الدين بن محمد سعيد بن قاسم الحلاق القاسمي (المتوفى: 1332هـ)	ShamAY	607	0.26279
		مجتمع المدينة قبل الهجرة وبعدها	حسن خالد	ShamAY	38427	0.26278
		الخطابة الإسلامية	عبد العاطي محمد شلبي، عبد المعطي عبد المقصود	ShamAY	10779	0.26278
		عليّ المرتضى نقطة باء البسملة	السيّد عادل العلوي	Rafed	1582	0.26278
		مرقاة الصعود إلى سنن أبي داود	أبو الفضل جلال الدين عبد الرحمن السيوطي (849 - 911 ه)	ShamelaY19	150639	0.26277
		المنتقى شرح الموطإ	أبو الوليد سليمان بن خلف بن سعد بن أيوب بن وارث التجيبي القرطبي الباجي الأندلسي (المتوفى: 474هـ)	ShamAY	6684	0.26276
		شرح مختصر الروضة	سليمان بن عبد القوي بن الكريم الطوفي الصرصري، أبو الربيع، نجم الدين (المتوفى : 716هـ)	ShamAY	10781	0.26276
		الاستغاثة [ج ٢]	أبو القاسم علي بن أحمد الكوفي	Rafed	1756	0.26276
		الرّوض المعطار في خبر الأقطار	محمّد عبدالمنعم الحميري	Rafed	3786	0.26275
		ديوان الهبل	الهبل	ShamAY	37831	0.26274
		ألف فتوى للشيخ الألباني = مجموع فتاوى العلامة الألباني (الأجزاء الأول والثاني والثالث)	ناصر الدين الألباني	ShamAY	33152	0.26274
		شرح الآجرومية - عبد الكريم الخضير	عبد الكريم الخضير	ShamAY	154	0.26274
		البلاغة الواضحة	علي الحازم ومصطفى أمين	Rafed	2038	0.26274
		الإفصاح في إمامة أمير المؤمنين(ع)	الشيخ المفيد	Masaha	147	0.26274
		نفحة اليمن فيما يزول بذكره الشجن	أحمد بن محمد بن علي بن إبراهيم الأنصاري الشرواني (المتوفى: 1253ه)	ShamelaY19	35888	0.26273
