automatic URI	Proposed URI	bookTitle	authorName	collection	id	tfidf
		تفسير الرازي: مفاتيح الغيب ـ العلمية	الإمام العالم العلامة والحبر البحر الفهامة فخر الدين محمد بن عمر التميمي الرازي الشافعي	ShamAY	34044	0.2728
		 نفح الطيب من غصن الأندلس الرطيب 	 أحمد بن محمد المقري التلمساني 	ABLibrary	9302	0.2728
		مع المصطفي	الواحدي :: عائشة عبد الرحمن بنت الشاطئ	ShamAY	34436	0.27279
		إحسان سلوك العبد المملوك إلى ملك الملوك	أبو محمد عبد الكريم بن صالح بن عبد الكريم الحميد	ShamAY	1033	0.27279
		دراسات أصولية في القرآن الكريم	محمد إبراهيم الحفناوى	ShamelaY19	37973	0.27278
		ديوان عبد الغفار الأخرس	عبد الغفار بن عبد الواحد بن دهب الأخرس 1290 هـ	ShamAY	37954	0.27277
		سهام الإسلام	عبد اللطيف بن علي بن أحمد بن محمد السلطاني القنطري الجزائري (المتوفى: 1404هـ)	ShamAY	31654	0.27277
		الحور العين	نشوان بن سعيد الحميرى اليمني (المتوفى: 573 هـ)	ShamAY	22885	0.27276
		 أدب الطف أو شعراء الحسين ( ع ) 	 جواد شبر 	ABLibrary	7404	0.27276
		الاقتضاب في شرح أدب الكتاب	أبو محمد عبد الله بن محمد بن السِّيد البَطَلْيَوسي (المتوفى: 521 هـ)	ShamAY	32581	0.27275
		شرح صحيح البخاري - عبد الكريم الخضير	عبد الكريم الخضير	ShamelaY19	21724	0.27275
		فصل الخطاب في شرح مسائل الجاهلية (مطبوع مع رسالة قطف الثمر لصديق حسن خان)	أبو المعالي محمود شكري بن عبد الله بن محمد بن أبي الثناء الألوسي (المتوفى: 1342هـ)	ShamAY	9637	0.27274
		أدب الخلاف - ياسر برهامي	الشيخ ياسر بن حسين برهامي	ShamAY	371	0.27273
		المقدمات الممهدات	أبو الوليد محمد بن أحمد بن رشد القرطبي (المتوفى: 520هـ)	ShamAY	32011	0.27271
		شرح كتاب التوحيد - عبد الكريم الخضير	عبد الكريم الخضير	ShamAY	9	0.27271
		منهج الاعتدال	الشيخ: عدنان بن محمد العرعور	Sham19Y	147099	0.27271
		 تصنيف غرر الحكم ودرر الكلم 	 عبد الواحد الآمدى التميمي 	ABLibrary	7906	0.27271
		العقد المفصل في قبيلة المجد المؤثل	حيدر بن سليمان بن داود الحلي الحسيني (المتوفى: 1304هـ)	ShamAY	5448	0.2727
		الذريعة الى مكارم الشريعة	أبو القاسم الحسين بن محمد المعروف بالراغب الأصفهانى (المتوفى: 502هـ)	ShamAY	1390	0.27269
		حاشية الدرة المضية في عقد الفرقة المرضية	عبد الرحمن بن محمد بن قاسم العاصمي الحنبلي النجدي (المتوفى: 1392هـ)	ShamAY	7369	0.27268
		إتحاف أهل الألباب بمعرفة التوحيد والعقيدة في سؤال وجواب	وليد بن راشد السعيدان	ShamAY	35615	0.27268
		مختصر الأمثل في تفسير كتاب الله المنزل [ج ٣]	آية الله مكارم الشيرازي	Rafed	3861	0.27268
		نهج الحقّ وكشف الصدق	الحسن بن يوسف بن علي المطّهر [ العلامة الحلّي ]	Rafed	3527	0.27267
		 ينابيع النصيحة في العقائد الصحيحة 	 الأمير الحسين بن بدر الدين 	ABLibrary	8681	0.27264
		تزيين الأسواق في أخبار العشاق	داود بن عمر الأنطاكي، المعروف بالأكمه (المتوفى: 1008هـ)	ShamAY	630	0.27263
		98 خطبة للشيخ سامي الحمود	سامي الحمود	ShamAY	34755	0.27262
		ديوان ابن شهاب	أبو بكر بن شهاب الحميني الحضرمي	ShamAY	37872	0.27262
		تفسير التّحرير والتّنوير [ج ٣٠]	الشيخ محمّد الطاهر ابن عاشور	Rafed	2940	0.27262
		شرح التجريد الصريح لأحاديث الجامع الصحيح - عبد الكريم الخضير	عبد الكريم الخضير	ShamAY	62	0.27261
		خاتم النبيين صلى الله عليه وآله وسلم	محمد بن أحمد بن مصطفى بن أحمد المعروف بأبي زهرة (المتوفى: 1394ه)	Sham19Y	9800	0.27261
		لمحات في أحكام الشريعة الإسلاميّة	السيد فاضل الموسوي الجابري	Rafed	802	0.27261
		جلسات رمضانية 1410 هـ - 1415 هـ	محمد بن صالح بن محمد العثيمين (المتوفى : 1421هـ)	ShamAY	7679	0.2726
		الاستدلال بالظني في العقيدة	فتحي سليم	ShamAY	35720	0.27259
		معالم الطريق إلى الله	أبو فيصل البدراني	ShamelaY19	96252	0.27259
		منطلقات طالب العلم	أبو العلاء محمد بن حسين بن يعقوب السلفي المصري	Sham19Y	98137	0.27259
		الفلاكة والمفلوكون	أحمد بن علي بن عبد الله، شهاب الدين الدَّلْجي المصري (المتوفى: 838هـ)	ShamAY	821	0.27258
		الإحكام في أصول الأحكام للآمدي	أبو الحسن سيد الدين علي بن أبي علي بن محمد بن سالم الثعلبي الآمدي (المتوفى: 631هـ)	ShamAY	10801	0.27257
		مرعاة المفاتيح شرح مشكاة المصابيح	أبو الحسن عبيد الله بن محمد عبد السلام بن خان محمد بن أمان الله بن حسام الدين الرحماني المباركفوري (المتوفى: 1414ه)	Sham19Y	8862	0.27257
		سراج الملوك	أبو بكر محمد بن محمد ابن الوليد الفهري الطرطوشي المالكي (المتوفى: 520هـ)	ShamAY	1585	0.27256
		التيسير في أحاديث التفسير	محمد المكي الناصري (المتوفى: 1414ه)	ShamelaY19	115129	0.27256
		 شرح كتاب الفقه الأكبر 	 ملا علي القاري 	ABLibrary	8481	0.27256
		تفسير التّحرير والتّنوير [ج ١٣]	الشيخ محمّد الطاهر ابن عاشور	Rafed	2917	0.27254
		كشف النّقاب عن مخدرات مليحة الإعراب	عبد الله بن محمّد أحمد الفاكهي	Rafed	2615	0.27254
		التفسير المنير [ج ٣]	الدكتور وهبة الزحيلي	Rafed	2944	0.27254
		كتاب الشعر أو شرح الأبيات المشكلة الإعراب	الحسن بن أحمد بن عبد الغفار الفارسيّ الأصل، أبو علي (المتوفى: 377هـ)	ShamAY	870	0.27253
		أحكام القرآن [ج ٣-٤]	عماد الدين بن محمد الطبري [ الكيا الهرّاسي ]	Rafed	3147	0.27253
		 المغني في أبواب التوحيد والعدل 	 القاضي عبد الجبار الهمذاني 	ABLibrary	8634	0.27253
		 الأربعين في اصول الدين 	 الغزالي 	ABLibrary	8327	0.27252
		 التعليقات على شرح الدواني للعقائد العضدية 	 سيد جمال الدين الافغاني ( بقلم محمد عبده ) 	ABLibrary	8387	0.27252
		المرأة العربية في جاهليتها وإسلامها	عبد الله بن عفيفي الباجوري (المتوفى: 1364ه)	ShamelaY19	37059	0.27251
		الاجابات الواضحات لسوالات القرائات 	احمد محمود عبد السميع شافعي حفيان	Ghbook	2794	0.27251
		الشّهيد مسلم بن عقيل(ع)	السيد عبد الرزاق المقرم	Masaha	1702	0.27251
		التفسير القيم = تفسير القرآن الكريم لابن القيم	محمد بن أبي بكر بن أيوب بن سعد شمس الدين ابن قيم الجوزية (المتوفى: 751هـ)	ShamAY	23606	0.2725
		تفسير من وحي القرآن [ج ١٣]	السيد محمد حسين فضل الله	Rafed	3276	0.2725
		التنقيذ لأحكام التقليد	السيد محمد الموسوي الزنجاني	Masaha	3131	0.2725
		التنقيذ لأحكام التقليد	السيد محمد الموسوي الزنجاني	Masaha	2637	0.2725
		لمحات من محاسن الإسلام	محمد بن علي العرفج	ShamAY	33406	0.27249
		اليواقيت والدرر في شرح نخبة ابن حجر	زين الدين محمد المدعو بعبد الرؤوف بن تاج العارفين بن علي بن زين العابدين الحدادي ثم المناوي القاهري (المتوفى: 1031ه)	Sham19Y	5979	0.27248
		الرّحلة الحجازيّة	الأمير شكيب أرسلان	Rafed	2385	0.27248
		شرح الرضيّ على الكافية [ج ٣]	محمّد بن الحسن الرضي الاسترآبادي	Rafed	1800	0.27247
		 الشافي في شرح الكافي 	 المولى خليل القزويني 	ABLibrary	7922	0.27247
		وَقَفَاتٌ على الطَّريق	علي بن نايف الشحود	ShamAY	359	0.27246
		الزهرة	أبو بكر محمد بن داود بن علي بن خلف الأصبهاني ثم البغدادي الظاهري (المتوفى: 297هـ)	ShamAY	738	0.27246
		جمهرة مقالات الأستاذ محمود محمد شاكر	محمود شاكر، أبو فهر	ShamAY	38846	0.27246
		نضرة الإغريض في نصرة القريض	المظفر بن الفضل بن يحيى، أبو علي، العلوي الحسيني العراقي (المتوفى: 656هـ)	ShamAY	629	0.27245
		التبيان في أقسام القرآن	محمد بن أبي بكر بن أيوب بن سعد شمس الدين ابن قيم الجوزية (المتوفى: 751هـ)	ShamAY	7572	0.27245
		كيف نتعامل مع السنة النبوية ط الشروق	يوسف عبد الله القرضاوي	ShamAY	31649	0.27244
		تفسير المراغي [ج ٢٢]	أحمد مصطفى المراغي	Rafed	1694	0.27244
		ثم اهتديت	الدكتور محمّد التيجاني السماوي	Rafed	249	0.2724
		منحة الباري بشرح صحيح البخاري المسمى «تحفة الباري»	زكريا بن محمد بن أحمد بن زكريا الأنصاري، زين الدين أبو يحيى السنيكي المصري الشافعي (المتوفى: 926 هـ)	ShamAY	32556	0.27239
		القراءات المتواترة وأثرها في الرسم القرآني والأحكام الشرعية	محمد الحبش	ShamelaY19	38020	0.27239
		خلاصة القوانين‏	أحمد الأنصاري	Masaha	3767	0.27239
		زهرة التفاسير	محمد بن أحمد بن مصطفى بن أحمد المعروف بأبي زهرة (المتوفى: 1394ه)	Sham19Y	37071	0.27238
		 فيه ما فيه 	 جلال الدين الرومي 	ABLibrary	8769	0.27238
		دقائق التفسير الجامع لتفسير ابن تيمية	تقي الدين أبو العباس أحمد بن عبد الحليم بن عبد السلام بن عبد الله بن أبي القاسم بن محمد ابن تيمية الحراني الحنبلي الدمشقي (المتوفى: 728هـ)	ShamAY	5487	0.27237
		طرق تدريس التربية الإسلامية نماذج لإعداد دروسها	دكتور/ عبد الرشيد عبد العزيز سالم	ShamAY	10007	0.27237
		التفسير الواضح	الحجازي، محمد محمود	ShamAY	23589	0.27237
		خلق المسلم	محمد الغزالي	ShamAY	34811	0.27237
		نتائج البحوث وخواتيم الكتب	هذه نتائج وخواتيم رسائل علمية وأبحاث لمؤلفين مختلفين تحوي خلاصات ما فيها	Sham19Y	95557	0.27237
		الاستغاثة [ج ١]	أبو القاسم علي بن أحمد الكوفي	Rafed	1755	0.27236
		شرح ابن الناظم على ألفية ابن مالك	بدر الدين محمد ابن الإمام جمال الدين محمد بن مالك (ت 686 هـ)	ShamAY	32585	0.27235
		مجموعة الرسائل والمسائل والفتاوى	حمد بن ناصر بن عثمان بن معمر النجدي التميمي الحنبلي (المتوفى: 1225هـ)	ShamAY	11380	0.27235
		أحكام القرآن للجصاص ط العلمية	أحمد بن علي أبو بكر الرازي الجصاص الحنفي (المتوفى: 370هـ)	ShamAY	7370	0.27235
		مدخل إلى موقف القرآن الكريم من العلم	عماد الدين خليل	ShamAY	35117	0.27234
		البواكير	علي بن مصطفى الطنطاوي (المتوفى: 1420هـ)	ShamAY	32210	0.27234
		الميزان في تفسير القرآن [ج ٦]	آية الله السيد محمد حسين الطباطبائي	Rafed	1435	0.27234
		تنزيه الأنبياء عمّا نسب اإيهم حثالة الأغبياء	أبو الحسن علي بن أحمد السبتي [ ابن خمير ]	Rafed	1909	0.27233
		الشيخ محمد بن عبد الوهاب المجدد المفترى عليه	أحمد بن حجر بن محمد بن حجر بن أحمد بن حجر بن طامي بن حجر بن سند بن سعدون آل بوطامي البنعلي (المتوفى: 1423هـ)	ShamAY	7654	0.27232
		السنة في الشريعة الاسلامية	السيد محمد تقي الحكيم	Masaha	559	0.27229
		تفسير المراغي [ج ٣٠]	أحمد مصطفى المراغي	Rafed	1707	0.27228
		الإقناع في الفقه الشافعي	أبو الحسن علي بن محمد بن محمد بن حبيب البصري البغدادي، الشهير بالماوردي (المتوفى: 450ه)	Sham19Y	6120	0.27227
		المقدمات العشر في نقض أصول صوفية العصر	عبد العزيز بن ريس الريس	ShamAY	35699	0.27226
		منهج الاعتدال	الشيخ: عدنان بن محمد العرعور	ShamelaY19	147099	0.27226
		الوجيز في تفسير القرآن العزيز [ج ١]	الشيخ علي بن الحسين بن أبي جامع العاملي	Rafed	3840	0.27226
		أمالي المرتضى غرر الفوائد ودرر القلائد (معتزلي)	الشريف المرتضى علي بن الحسين الموسوي العلوي (355 - 436 ه)	ShamelaY19	20937	0.27224
		تفسير بيان السعادة في مقامات العبادة [ج ٤]	سلطان محمّد الجنابذي [ سلطان علي شاه ]	Rafed	3373	0.27223
		جمهرة مقالات الأستاذ محمود محمد شاكر	محمود شاكر، أبو فهر	ShamelaY19	20641	0.27222
		التفسير المنير [ج ٢]	الدكتور وهبة الزحيلي	Rafed	2943	0.27222
		مذكرة في أصول الفقه	محمد الأمين بن محمد المختار بن عبد القادر الجكني الشنقيطي (المتوفى: 1393هـ)	ShamAY	9885	0.27219
		الفواكه العديدة في المسائل المفيدة	أحمد بن محمد بن أحمد بن حمد المنقور (المتوفى: 1125 ه)	ShamelaY19	150961	0.27219
		تفسير ابن عطية = المحرر الوجيز في تفسير الكتاب العزيز	أبو محمد عبد الحق بن غالب بن عبد الرحمن بن تمام بن عطية الأندلسي المحاربي (المتوفى: 542هـ)	ShamAY	23632	0.27218
		 إيقاظ الهمم في شرح حكم سيدي أحمد بن عطاء الله السكندري 	 أحمد بن محمد بن عجيبة الحسنى 	ABLibrary	8865	0.27218
		الزواجر عن اقتراف الكبائر	أحمد بن محمد بن علي بن حجر الهيتمي السعدي الأنصاري، شهاب الدين شيخ الإسلام، أبو العباس (المتوفى: 974ه)	ShamelaY19	21629	0.27214
		الملل والنحل - المعرفة	محمد بن عبد الكريم بن أبي بكر أحمد الشهرستاني	ShamAY	33890	0.27213
		تبسيط العقائد الإسلامية	حسن محمد أيوب (المتوفى: 1429هـ)	ShamAY	913	0.27212
		فتاوى منوعة - الراجحي	عبد العزيز بن عبد الله بن عبد الرحمن الراجحي	ShamAY	367	0.27211
		الغاية فى شرح الهداية فى علم الرواية	شمس الدين أبو الخير محمد بن عبد الرحمن بن محمد بن أبي بكر بن عثمان بن محمد السخاوي (المتوفى: 902هـ)	ShamAY	5956	0.27211
		اتحاف الفقهاء في تحقيق مسألة اختلاف القراءات والقرّاء	الميرزا محسن آل عصفور	Masaha	1649	0.2721
		 شرح توحيد الصدوق 	 القاضي سعيد القمي 	ABLibrary	8479	0.27209
		المسلك في أصول الدّين	الشيخ نجم الدين أبي القاسم جعفر بن الحسن بن يحيى بن سعيد الهذلي [ المحقق الحلّي ]	Rafed	3474	0.27208
		شرح صحيح مسلم - حسن أبو الأشبال	أبو الأشبال حسن الزهيري آل مندوه المنصوري المصري	ShamAY	109	0.27207
		قضايا المرأة بين التقاليد الراكدة والوافدة	محمد الغزالي	ShamAY	33246	0.27207
		أحكام القرآن [ج ١-٢]	عماد الدين بن محمد الطبري [ الكيا الهرّاسي ]	Rafed	3146	0.27207
		إرشاد الفحول إلى تحقيق الحق من علم الأصول	محمد بن علي بن محمد بن عبد الله الشوكاني اليمني (المتوفى: 1250هـ)	ShamAY	11437	0.27205
		مناط الأحكام‏	الشيخ نظر علي الطالقاني	Masaha	4367	0.27205
		عمدة الكتاب لأبي جعفر النحاس	أبو جعفر النَّحَّاس أحمد بن محمد بن إسماعيل بن يونس المرادي النحوي (المتوفى: 338هـ)	ShamAY	26803	0.27204
		حطم صنمك وكن عند نفسك صغيرا	مجدي الهلالي	ShamelaY19	36328	0.27204
		مجموعة الرسائل والمسائل النجدية	مجموعة من المؤلفين	Sham19Y	16865	0.27204
		التحفه السنيه في شرح النخبه المحسنيه	عبدالله بن نورالدين بن نعمت الله موسوي الجزايري	Ghbook	11904	0.27203
		فتاوى أركان الإسلام	محمد بن صالح بن محمد العثيمين (المتوفى: 1421هـ)	ShamAY	9924	0.27202
		شرح مقدمة في أصول التفسير لابن تيمية	د. مُساعِدُ بن سُلَيْمَان بن نَاصِر الطَّيَّار	ShamAY	31802	0.27202
		فتاوى الأزهر	مجموعة من المؤلفين	ShamAY	37642	0.27201
		التفسير المظهري	المظهري، محمد ثناء الله	ShamelaY19	21766	0.27201
		الفتوحات الربانية على الأذكار النواوية	محمد بن علان الصديقي الشافعي الأشعري المكي (المتوفى: 1057 ه)	ShamelaY19	23625	0.27199
		الأحكام السلطانية للماوردي	أبو الحسن علي بن محمد بن محمد بن حبيب البصري البغدادي، الشهير بالماوردي (المتوفى: 450ه)	ShamelaY19	22881	0.27198
		مجالس التذكير من حديث البشير النذير	عبد الحميد محمد بن باديس الصنهاجي (المتوفى: 1359ه)	ShamelaY19	34886	0.27198
		المجلى في شرح القواعد المثلى في صفات الله وأسمائه الحسنى للعلامة محمد صالح العثيمين	كاملة بنت محمد بن جاسم بن علي آل جهام الكواري	Sham19Y	6942	0.27198
		كتاب العين [ج ١]	الخليل بن أحمد الفراهيدي	Rafed	2820	0.27198
		جامع الشتات	محمد اسماعيل بن الحسين بن محمدرضا مازندراني خواجوئي	Ghbook	15608	0.27198
		مجموع رسائل الحافظ ابن رجب الحنبلي	زين الدين عبد الرحمن بن أحمد بن رجب بن الحسن، السلامي، البغدادي، ثم الدمشقي، الحنبلي (المتوفى: 795ه)	ShamelaY19	95735	0.27197
		الفتوى الحموية الكبرى	تقي الدين أبو العباس أحمد بن عبد الحليم بن عبد السلام بن عبد الله بن أبي القاسم بن محمد ابن تيمية الحراني الحنبلي الدمشقي (المتوفى: 728ه)	ShamelaY19	18381	0.27196
		اصل الشيعه و اصولها	محمد حسين آل كاشف الغطاء	Ghbook	12190	0.27196
		منهاج أهل الحق والاتباع في مخالفة أهل الجهل والابتداع	سليمان بن سحمان بن مصلح بن حمدان بن مصلح بن حمدان بن مسفر بن محمد بن مالك بن عامر الخثعمي , التبالي , العسيري , النجدي (المتوفى: 1349هـ)	ShamAY	12091	0.27194
		جامع الرسائل لابن تيمية - رشاد سالم	ابن تيمية	ShamelaY19	22653	0.27193
		مجالس مع فضيلة الشيخ محمد الأمين الجكني الشنقيطي - رحمه الله تعالى -	أحمد بن محمد الأمين بن أحمد بن المختار المحضريّ، ثم الإبراهيمي، ثم الجكنيّ الشنقيطي (المتوفى: 1434 هـ)	ShamAY	32526	0.27192
		الجنى الداني في حروف المعاني	أبو محمد بدر الدين حسن بن قاسم بن عبد الله بن عليّ المرادي المصري المالكي (المتوفى: 749هـ)	ShamAY	26099	0.27191
		الإحكام في أصول الأحكام لابن حزم	أبو محمد علي بن أحمد بن سعيد بن حزم الأندلسي القرطبي الظاهري (المتوفى: 456هـ)	ShamAY	10432	0.2719
		التدمرية: تحقيق الإثبات للأسماء والصفات وحقيقة الجمع بين القدر والشرع	تقي الدين أبو العباس أحمد بن عبد الحليم بن عبد السلام بن عبد الله بن أبي القاسم بن محمد ابن تيمية الحراني الحنبلي الدمشقي (المتوفى: 728ه)	ShamelaY19	22666	0.27188
		الرحلة الورثيلانيّة [ج ٢]	الحسين بن محمّد الورثيلاني	Rafed	2203	0.27187
		رسائل الشريف المرتضى [ج ٤]	علي بن الحسين الموسوي العلوي [ الشريف المرتضى علم الهدى ]	Rafed	3626	0.27186
		الأشباه والنظائر للسبكي	تاج الدين عبد الوهاب بن تقي الدين السبكي (المتوفى: 771هـ)	ShamAY	8634	0.27183
		موسوعة أخلاق القرآن [ج ٤]	الدكتور أحمد الشرباصي	Rafed	3904	0.27182
		 أنوار الحكمة 	 الفيض الكاشاني 	ABLibrary	8351	0.27182
		 الكشف عن مناهج الأدلة في عقائد الملة 	 ابن رشد 	ABLibrary	8577	0.27182
		الفائق في غريب الحديث والأثر	أبو القاسم محمود بن عمرو بن أحمد، الزمخشري جار الله (المتوفى: 538هـ)	ShamAY	7015	0.2718
		المستصفى	أبو حامد محمد بن محمد الغزالي الطوسي (المتوفى: 505هـ)	ShamAY	5459	0.2718
		التيسير في أحاديث التفسير	محمد المكي الناصري (المتوفى: 1414ه)	Sham19Y	115129	0.2718
		صور وخواطر	علي بن مصطفى الطنطاوي (المتوفى: 1420هـ)	ShamAY	31975	0.27179
		ندوة علوم الحديث علوم وآفاق	بحوث لمجموعة من المؤلفين	Sham19Y	1398	0.27179
		تفسير التّحرير والتّنوير [ج ٢٤]	الشيخ محمّد الطاهر ابن عاشور	Rafed	2933	0.27179
		 المنقذ من التقليد 	 الشيخ سديد الدين الحمصي الرازي 	ABLibrary	8648	0.27179
		مدارج السالكين بين منازل إياك نعبد وإياك نستعين	محمد بن أبي بكر بن أيوب بن سعد شمس الدين ابن قيم الجوزية (المتوفى: 751هـ)	ShamAY	8370	0.27178
		شرح كتاب التوحيد - عبد الكريم الخضير	عبد الكريم الخضير	ShamelaY19	21709	0.27178
		شرح اختصار علوم الحديث - عبد الكريم الخضير	عبد الكريم الخضير	ShamAY	138	0.27175
		تفسير من وحي القرآن [ج ٩]	السيد محمد حسين فضل الله	Rafed	3270	0.27174
		بيان تلبيس الجهمية في تأسيس بدعهم الكلامية	الواحدي :: ابن تيمية	ShamAY	34382	0.27171
		نفاضة الجراب في علالة الاغتراب	لسان الدين بن الخطيب، محمد بن عبد الله (المتوفى: 776ه)	Sham19Y	477	0.27171
		تفسير القرآن الكريم - أسامة سليمان	أسامة علي محمد سليمان	ShamelaY19	37769	0.2717
		ينابيع النصيحة في العقائد الصحيحة	السيد الأمير الحسين بن بدر الدين	Rafed	3448	0.27169
		تفسير المراغي [ج ٢٤]	أحمد مصطفى المراغي	Rafed	1696	0.27167
		 مجمع البحرين في شرح الفصين ( حكم الفصوص وحكم الفتوحات لابن عربي ) 	 ناصر بن الحسن الشريف الكيلاني 	ABLibrary	8842	0.27166
		تفسير التّحرير والتّنوير [ج ١٢]	الشيخ محمّد الطاهر ابن عاشور	Rafed	2916	0.27165
		الولاء والبراء والعداء في الإسلام	أبو فيصل البدراني	ShamAY	1718	0.27164
