automatic URI	Proposed URI	bookTitle	authorName	collection	id	tfidf
		منظومة المقدمة فيما يجب على القارئ أن يعلمه (الجزرية)	شمس الدين أبو الخير ابن الجزري، محمد بن محمد بن يوسف (المتوفى: 833هـ)	ShamAY	12093	0.97648
		الوافي في كيفية ترتيل القرآن الكريم (شرح واف لمتني الجزرية وتحفة الأطفال)	أحمد محمود عبد السميع الشافعى الحفيان	ShamAY	1168	0.4271
		الوافي في كيفية ترتيل القرآن الكريم (شرح واف لمتني الجزرية وتحفة الأطفال)	أحمد محمود عبد السميع الشافعى الحفيان	ShamelaY19	37615	0.4236
		فتح رب البرية شرح المقدمة الجزرية في علم التجويد	صفوت محمود سالم	ShamAY	21580	0.42024
		فتح رب البرية شرح المقدمة الجزرية في علم التجويد	صفوت محمود سالم	ShamelaY19	21580	0.42022
		السلسبيل الشافي في علم التجويد	عثمان بن سليمان مراد علي أغا	ShamAY	36894	0.41941
		الروضة الندية شرح متن الجزرية	محمود بن محمد عبد المنعم بن عبد السلام بن محمد العبد	ShamAY	32214	0.41398
		الأنوار البهية في حل الجزرية	عبد الباسط هاشم	ShamAY	37752	0.41227
		شرح المقدمة الجزرية	صفوت محمود سالم	ShamAY	36838	0.40594
		المذكرة في شرح المقدمة	سليمان بن خالد الحربي	ShamAY	36831	0.40459
		بداية المستفيد في علم التجويد		ShamAY	36895	0.40159
		إعانة المستفيد بِضَبْطِ مَتْنَي " التُّحْفَةِ وَالْجَزَرِيَّةِ " فِي عِلْمِ التَّجْوِيدِ		ShamAY	36956	0.38493
		شرح قطعة من المقدمة الجزرية	الدكتور صلاح محمد أبو الحاج	ShamAY	36880	0.37526
		الميزان في أحكام تجويد القرآن	فريال زكريا العبد	ShamAY	1185	0.37383
		إحكام الأحكام في تجويد القرآن	سيد جمعة سلام	ShamAY	36789	0.37164
		الميزان في أحكام تجويد القرآن	فريال زكريا العبد	Sham19Y	38104	0.37161
		الميزان في أحكام تجويد القرآن	فريال زكريا العبد	ShamelaY19	38104	0.37068
		أحكام تلاوة القرآن	محمود خليل الحصري	ShamAY	36536	0.35315
		مجموعة مهمة في التجويد والقراءات (15 متنا في التجويد والقراءات)	مجموعة من المؤلفين	ShamAY	1461	0.34695
		هداية القاري إلى تجويد كلام الباري	عبد الفتاح المرصفي	ShamelaY19	22869	0.346
		مجموعة مهمة في التجويد والقراءات (15 متنا في التجويد والقراءات)	مجموعة من المؤلفين	Sham19Y	29915	0.34552
		هداية القاري إلى تجويد كلام الباري	عبد الفتاح بن السيد عجمي بن السيد العسس المرصفي المصري الشافعي (المتوفى : 1409هـ)	ShamAY	22869	0.3455
		غاية المريد في علم التجويد	عطية قابل نصر	ShamAY	7311	0.34381
		التمهيد في علم التجويد	شمس الدين أبو الخير ابن الجزري، محمد بن محمد بن يوسف (المتوفى: 833هـ)	ShamAY	8194	0.34029
		التمهيد في علم التجويد	شمس الدين أبو الخير ابن الجزري، محمد بن محمد بن يوسف (المتوفى: 833ه)	Sham19Y	8194	0.33885
		مكتبة المتون العلمية	مجموعة من المؤلفين	ShamAY	36167	0.33858
		السهل المفيد فى أحكام التجويد		ShamAY	36961	0.33744
		تنبيه الغافلين وإرشاد الجاهلين عما يقع لهم من الخطأ حال تلاوتهم لكتاب الله المبين	علي بن محمد بن سالم، أبو الحسن النوري الصفاقسي (المتوفى: 1118هـ)	ShamAY	10929	0.33441
		مجموعة مهمة في التجويد والقراءات (15 متنا في التجويد والقراءات)	مجموعة من المؤلفين	ShamelaY19	29915	0.3343
		قواعد التجويد على رواية حفص عن عاصم بن أبي النجود	عبد العزيز بن عبد الفتاح القارئ	ShamAY	11301	0.33421
		القول السديد في علم التجويد	على الله بن علي أبو الوفا	ShamelaY19	38025	0.33416
		البسيط في علم التجويد		ShamAY	36957	0.32964
		العميد في علم التجويد	محمود بن علي بسّة المصري (المتوفى: بعد 1367هـ)	ShamAY	31592	0.32626
		معلم التجويد	د خالد بن عبد الرحمن بن علي الجريسي	ShamelaY19	21513	0.32466
		بغية المستفيد في علم التجويد - سلسلة لقاء العشر الأواخر بالمسجد الحرام (22)	محمّد بن بدر الدين بن عبد الحق ابن بَلْبَان الحنبلي (المتوفى: 1083 هـ)	ShamAY	32478	0.32417
		معلم التجويد	د خالد بن عبد الرحمن بن علي الجريسي	ShamAY	21513	0.3209
		القول السديد في علم التجويد	على الله بن علي أبو الوفا	ShamAY	1491	0.31902
		المرشد الوجيز	الميرزا محسن آل عصفور	Rafed	875	0.31868
		منظومةَ: "المفيد في التجويد"	شهاب الدين الطيبي	ShamAY	36792	0.31579
		التبتيل في التجويد و الترتيل	حسن عالمي بكتاش	Ghbook	14955	0.31206
		القول المعتبر في بيان الإعجاز للحروف المقطعة من فواتح السور	إياس محمد حرب آل خطاب	ShamelaY19	37350	0.31165
		كيف تقرأ القرآن الكريم برواية الإمام قالون عن نافع المدني	المختار المشري المقروش	ShamelaY19	38033	0.31043
		شرح طيبة النشر في القراءات العشر	محمد بن محمد بن محمد، أبو القاسم، محب الدين النويري (المتوفى: 857ه)	ShamelaY19	38740	0.3097
		الجوانب الصوتية في كتب الاحتجاج للقراءات	عبد البديع النيرباني	ShamelaY19	37680	0.30911
		كيف تقرأ القرآن الكريم برواية الإمام قالون عن نافع المدني	المختار المشري المقروش	ShamAY	1494	0.30846
		منظومة السبل السوية لفقه السنن المروية	حافظ بن أحمد الحكمي	ShamAY	33193	0.30411
		شرح طيّبة النّشر في القراءات العشر	شهاب الدين أبي بكر بن أحمد بن محمّد بن محمّد ابن الجزري الدمشقي	Rafed	1106	0.30377
		شرح طيبة النشر لابن الجزري	شمس الدين أبو الخير ابن الجزري، محمد بن محمد بن يوسف (المتوفى: 833ه)	ShamelaY19	29596	0.30286
		شرح طيبة النشر لابن الجزري	شمس الدين أبو الخير ابن الجزري، محمد بن محمد بن يوسف (المتوفى: 833هـ)	ShamAY	1452	0.30261
		التمثيل والمحاضرة	عبد الملك بن محمد بن إسماعيل أبو منصور الثعالبي (المتوفى: 429هـ)	ShamAY	5683	0.30171
		المنتقى من بطون الكتب	الواحدي :: محمد بن إبراهيم الحمد	ShamAY	37720	0.30082
		سر صناعة الإعراب - القلم	أبي الفتح عثمان بن جني	ShamAY	34702	0.30038
		الموسوعة القرآنية، خصائص السور	جعفر شرف الدين	ShamelaY19	21769	0.30036
		المدرّس الأفضل [ج ١]	الشيخ محمّد علي المدرّس الأفغاني	Rafed	2679	0.30019
		التمثيل والمحاضرة	عبد الملك بن محمد بن إسماعيل أبو منصور الثعالبي (المتوفى: 429ه)	Sham19Y	5683	0.29965
		القول المعتبر في بيان الإعجاز للحروف المقطعة من فواتح السور	إياس محمد حرب آل خطاب	ShamAY	627	0.2996
		المعجزة القرآنية حقائق علمية قاطعة	أحمد عمر أبو شوفة	ShamAY	1473	0.29927
		إعراب القرآن [ج ٣]	الزجّاج	Rafed	3144	0.29912
		روح المعاني [ج ١]	أبي الفضل شهاب الدين السيّد محمود الألوسي البغدادي	Rafed	3178	0.29889
		تفسير غرائب القرآن ورغائب الفرقان [ج ١]	نظام الدين الحسن بن محمّد بن حسين القمي النيسابوري	Rafed	1792	0.2984
		تفسير التّحرير والتّنوير [ج ١]	الشيخ محمّد الطاهر ابن عاشور	Rafed	2905	0.29836
		تفسير غرائب القرآن ورغائب الفرقان [ج ٢]	نظام الدين الحسن بن محمّد بن حسين القمي النيسابوري	Rafed	1793	0.29765
		مدخل في علوم القراءات	السيد رزق الطويل (المتوفى: 1419هـ)	ShamAY	8633	0.29756
		رسائل الشريف المرتضى [ج ٣]	علي بن الحسين الموسوي العلوي [ الشريف المرتضى علم الهدى ]	Rafed	3616	0.29732
		القول المعتبر في بيان الإعجاز للحروف المقطعة من فواتح السور	إياس محمد حرب آل خطاب	Sham19Y	37350	0.29711
		الرسائل للجاحظ	عمرو بن بحر بن محبوب الكناني بالولاء، الليثي، أبو عثمان، الشهير بالجاحظ (المتوفى: 255هـ)	ShamAY	10428	0.29701
		المعجزة القرآنية حقائق علمية قاطعة	أحمد عمر أبو شوفة	Sham19Y	37987	0.29696
		التحرير والتنوير	محمد الطاهر بن محمد بن محمد الطاهر بن عاشور التونسي (المتوفى : 1393هـ)	ShamAY	9776	0.29682
		المعجزة القرآنية حقائق علمية قاطعة	أحمد عمر أبو شوفة	ShamelaY19	37987	0.29669
		 في ظلال نهج البلاغة 	 محمد جواد مغنية 	ABLibrary	962	0.29663
		موسوعة علوم القرآن	عبد القادر محمد منصور	ShamAY	1183	0.29661
		موسوعة علوم القرآن	عبد القادر محمد منصور	ShamelaY19	38103	0.2966
		تفسير غرائب القرآن ورغائب الفرقان [ج ٣]	نظام الدين الحسن بن محمّد بن حسين القمي النيسابوري	Rafed	1794	0.29655
		تفسير غرائب القرآن ورغائب الفرقان [ج ٥]	نظام الدين الحسن بن محمّد بن حسين القمي النيسابوري	Rafed	1803	0.29651
		إعجاز القرآن والبلاغة النبوية للرافعي	مصطفى صادق بن عبد الرزاق بن سعيد بن أحمد بن عبد القادر الرافعي (المتوفى: 1356هـ)	ShamAY	8506	0.29643
		زبدة التّفاسير [ج ١]	فتح الله بن شكر الله الشريف الكاشاني	Rafed	1713	0.29642
		طوق الحمامة في الألفة والألاف	أبو محمد علي بن أحمد بن سعيد بن حزم الأندلسي القرطبي الظاهري (المتوفى: 456هـ)	ShamAY	10518	0.29641
		تفسير ابن بدران = جواهر الأفكار ومعادن الأسرار المستخرجة من كلام العزيز الجبار	عبد القادر بن أحمد بدران	ShamelaY19	20643	0.29626
		أمالي المرزوقي	أبو على أحمد بن محمد بن الحسن المرزوقي الأصفهاني (المتوفى: 421هـ)	ShamAY	722	0.29618
		معجم علوم القرآن	إبراهيم محمد الجرمي	ShamelaY19	38068	0.29611
		النكت الدالة على البيان في أنواع العلوم والأحكام	أحمد محمد بن علي بن محمد الكَرَجي القصَّاب (المتوفى: نحو 360هـ)	ShamAY	9065	0.29598
		معجم علوم القرآن	إبراهيم محمد الجرمي	ShamAY	1228	0.29595
		 رسالة التوحيد 	 الشيخ محمد عبده 	ABLibrary	8430	0.29591
		روح المعاني في تفسير القرآن العظيم والسبع المثاني	شهاب الدين محمود بن عبد الله الحسيني الألوسي (المتوفى: 1270ه)	ShamelaY19	22835	0.29568
		تفسير غرائب القرآن ورغائب الفرقان [ج ٤]	نظام الدين الحسن بن محمّد بن حسين القمي النيسابوري	Rafed	1802	0.29566
		الفواكه الدواني على رسالة ابن أبي زيد القيرواني - الثقافة الدينية	أحمد بن غنيم بن سالم النفراوي (المتوفى : 1126هـ)	ShamAY	34228	0.29543
		مدخل في علوم القراءات	السيد رزق الطويل (المتوفى: 1419ه)	Sham19Y	8633	0.29541
		آلاء الرحمن في تفسير القرآن [ج ١]	الشيخ محمد جواد البلاغي	Rafed	3150	0.29508
		تيسير التفسير للقطان	إبراهيم القطان (المتوفى: 1404هـ)	ShamAY	29	0.29505
		شرح منظومة الزمزمي في علوم القرآن	عبد الكريم الخضير	ShamAY	36814	0.29492
		من روائع القرآن - تأملات علمية وأدبية في كتاب الله عز وجل	محّمد سَعيد رَمضان البوطي	ShamAY	1233	0.2949
		المدخل إلى مذهب الإمام أحمد بن حنبل - العلمية	عبد القادر بن أحمد بن مصطفى بن عبد الرحيم بن محمد بدران (المتوفى: 1346هـ)	ShamAY	34195	0.29479
		الكشكول	محمد بن حسين بن عبد الصمد الحارثي العاملي الهمذاني، بهاء الدين (المتوفى: 1031هـ)	ShamAY	1571	0.29469
		التحديد في الإتقان والتجويد لأبي عمرو الداني	عثمان بن سعيد بن عثمان بن عمر أبو عمرو الداني (المتوفى: 444هـ)	ShamAY	26458	0.29452
		الكشاف - الجزء1	ابو القاسم محمود بن عمر الزمخشري	Masaha	3234	0.29443
		إعجاز القرآن	أبي بكر محمّد بن الطيّب الباقلّاني	Rafed	3267	0.2944
		بغية المرتاد للنطق بالضاد	ابن غانم	ShamAY	37209	0.29436
		دلائل الإعجاز في علم المعاني	أبو بكر عبد القاهر بن عبد الرحمن بن محمد الفارسي الأصل، الجرجاني الدار (المتوفى: 471هـ)	ShamAY	1040	0.29417
		أمالي المرزوقي	أبو على أحمد بن محمد بن الحسن المرزوقي الأصفهاني (المتوفى: 421ه)	Sham19Y	722	0.29414
		الكشّاف [ج ١]	محمود بن عمر الزمخشري	Rafed	3095	0.29413
		الخصائص	أبو الفتح عثمان بن جني الموصلي (المتوفى: 392هـ)	ShamAY	9986	0.29383
		من روائع القرآن - تأملات علمية وأدبية في كتاب الله عز وجل	محمد سعيد رمضان البوطي	ShamelaY19	38086	0.29342
		التحديد في الإتقان والتجويد لأبي عمرو الداني	عثمان بن سعيد بن عثمان بن عمر أبو عمرو الداني (المتوفى: 444 ه)	ShamelaY19	26458	0.29339
		اعجاز القرآن 	ابوبكر محمد بن طيب باقلاني	Ghbook	2771	0.29338
		تفسير ابن باديس ((في مجالس التذكير من كلام الحكيم الخبير)).	عبد الحميد محمد بن باديس الصنهاجي (المتوفى: 1359هـ)	ShamAY	55	0.29332
		الحجة للقراء السبعة	الحسن بن أحمد بن عبد الغفار الفارسي الأصل، أبو علي (المتوفى: 377ه)	ShamelaY19	35101	0.29332
		الاصول في النحو	العلامة ابي بكر محمد بن السري بن سهل النحوي المعروف ب (ابن السراج)	Ghbook	16323	0.29317
		التقريب لتفسير التحرير والتنوير للطاهر بن عاشور	الواحدي	ShamAY	36932	0.29314
		شرح كتاب سيبويه [ج ١]	أبي سعيد السّيرافي الحسن بن عبدالله بن المرزبان	Rafed	2782	0.29305
		تفسير النيسابوري = غرائب القرآن ورغائب الفرقان	نظام الدين الحسن بن محمد بن حسين القمي النيسابوري (المتوفى: 850هـ)	ShamAY	23613	0.29294
		أنوار التنزيل وأسرار التأويل [ج ١]	عبدالله بن عمر بن محمد الشيرازي الشافعي البيضاوي	Rafed	3166	0.29292
		مجلة الحقائق (الدمشقية)	عبد القادر الإسكندراني	ShamAY	187	0.29286
		المثل السائر في أدب الكاتب والشاعر ت محيي الدين عبد الحميد	نصر الله بن محمد بن محمد بن عبد الكريم الشيباني، الجزري، أبو الفتح، ضياء الدين، المعروف بابن الأثير الكاتب (المتوفى: 637ه)	ShamelaY19	23794	0.29283
		فن الإلقاء	طه عبد الفتاح مقلد	ShamAY	11275	0.29276
		تفسير القرآن الحكيم (تفسير المنار)	محمد رشيد بن علي رضا بن محمد شمس الدين بن محمد بهاء الدين بن منلا علي خليفة القلموني الحسيني (المتوفى: 1354هـ)	ShamAY	12304	0.2927
		 تلخيص الشافي 	 الشيخ الطوسي 	ABLibrary	8390	0.29268
		تفسير الشريف المرتضى [ج ٢]	الناشر: شركة الأعلمي للمطبوعات	Rafed	3794	0.29253
		سر الفصاحة	أبو محمد عبد الله بن محمد بن سعيد بن سنان الخفاجي الحلبي (المتوفى: 466هـ)	ShamAY	11239	0.29246
		المثل السائر في أدب الكاتب والشاعر ت الحوفي	ضياء الدين بن الأثير، نصر الله بن محمد (المتوفى: 637هـ)	ShamAY	10551	0.29243
		التوحيد لمحمد عبده	محمد عبده بن حسن خير الله (المتوفى: 1323هـ)	ShamAY	6392	0.29241
		بدائع الفوائد ط عالم الفوائد	أبو عبد الله محمد بن أبي بكر بن أيوب ابن قيم الجوزية (691 - 751)	ShamelaY19	145410	0.29238
		البحر المحيط في التفسير [ج ١]	محمّد بن يوسف [ أبي حيّان الأندلسي الغرناطي ]	Rafed	2415	0.29229
		البرهان في علوم القرآن	أبو عبد الله بدر الدين محمد بن عبد الله بن بهادر الزركشي (المتوفى: 794هـ)	ShamAY	11436	0.29227
		مناهل العرفان في علوم القرآن	محمد عبدالعظيم الزرقاني	ShamAY	34096	0.29226
		تفسير الزمخشري = الكشاف عن حقائق غوامض التنزيل	أبو القاسم محمود بن عمرو بن أحمد، الزمخشري جار الله (المتوفى: 538ه)	Sham19Y	23627	0.29224
		تعريف عام بدين الإسلام	علي بن مصطفى الطنطاوي (المتوفى: 1420هـ)	ShamAY	986	0.29219
		الكتاب الفريد في إعراب القرآن المجيد	المنتجب الهمذاني (المتوفى: 643 ه)	ShamelaY19	147312	0.29218
		روح المعاني في تفسير القرآن العظيم والسبع المثاني	محمود الألوسي أبو الفضل	ShamAY	34055	0.29216
		في علوم القرآن دراسات ومحاضرات	محمد عبد السلام كفافى وعبد الله الشريف	ShamAY	1489	0.29204
		تاريخ آداب العرب	مصطفى صادق بن عبد الرزاق بن سعيد بن أحمد بن عبد القادر الرافعي (المتوفى: 1356هـ)	ShamAY	10548	0.29204
		تفسير القاسمي [ج ١]	محمّد جمال الدين القاسمي	Rafed	3902	0.29198
		المساكين	مصطفى صادق بن عبد الرزاق بن سعيد بن أحمد بن عبد القادر الرافعي (المتوفى: 1356هـ)	ShamAY	5418	0.29184
		عقيدة المسلم	محمد الغزالي	ShamAY	35259	0.29175
		 جامع العلوم في اصطلاحات الفنون الملقب بدستور العلماء 	 القاضى عبد النبي بن عبد الرسول الأحمد نگري 	ABLibrary	8403	0.29175
		الكليات معجم في المصطلحات والفروق اللغوية	أيوب بن موسى الحسيني القريمي الكفوي، أبو البقاء الحنفي (المتوفى: 1094هـ)	ShamAY	7037	0.29174
		الخصائص	أبو الفتح عثمان بن جني الموصلي (المتوفى: 392ه)	Sham19Y	9986	0.29173
		التفسير الوسيط للقرآن الكريم [ج ١]	الدكتور محمد سيد طنطاوي	Rafed	3931	0.29169
		البرهان في وجوه البيان (نشر من قبل باسم نقد النثر لقدامة بن جعفر)	أبو الحسين إسحاق بن إبراهيم بن سليمان بن وهب الكاتب	ShamAY	38891	0.29167
		تفسير غرائب القرآن ورغائب الفرقان [ج ٦]	نظام الدين الحسن بن محمّد بن حسين القمي النيسابوري	Rafed	1804	0.29167
		تفسير النيسابوري = غرائب القرآن ورغائب الفرقان	نظام الدين الحسن بن محمد بن حسين القمي النيسابوري (المتوفى: 850ه)	ShamelaY19	23613	0.29166
		تفسير المراغي [ج ١]	أحمد مصطفى المراغي	Rafed	1658	0.29162
		دلائل الإعجاز في علم المعاني	أبو بكر عبد القاهر بن عبد الرحمن بن محمد الفارسي الأصل، الجرجاني الدار (المتوفى: 471ه)	ShamelaY19	22664	0.2916
		في علوم القرآن دراسات ومحاضرات	محمد عبد السلام كفافى وعبد الله الشريف	ShamelaY19	38014	0.2915
		المحاور الخمسة للقرآن الكريم	محمد الغزالي	ShamAY	36727	0.29149
		الجانب العاطفي من الإسلام	محمد الغزالي :: أبو حامد الغزالي	ShamAY	36031	0.29146
		تفسير القاسمي = محاسن التأويل	محمد جمال الدين بن محمد سعيد بن قاسم الحلاق القاسمي (المتوفى: 1332ه)	ShamelaY19	23631	0.29129
		البحر المحيط في التفسير	أبو حيان محمد بن يوسف بن علي بن يوسف بن حيان أثير الدين الأندلسي (المتوفى: 745ه)	ShamelaY19	23591	0.2912
		سرّ الفصاحة	أبي محمّد عبد الله بن سعيد بن سنان الخفاجي الحلبي	Rafed	2077	0.29109
		دلائل الإعجاز في علم المعاني	عبد القاهر بن عبد الرحمن الجرجاني	Rafed	2081	0.29109
		مناهل العرفان في علوم القرآن	محمد عبد العظيم الزُّرْقاني (المتوفى: 1367هـ)	ShamAY	7249	0.29108
		البرهان في وجوه البيان (نشر من قبل باسم نقد النثر لقدامة بن جعفر)	أبو الحسين إسحاق بن إبراهيم بن سليمان بن وهب الكاتب	ShamelaY19	20986	0.29102
		الوسيط في تراجم أدباء شنقيط والكلام على تلك البلاد تحديدا وتخطيطا وعاداتهم وأخلاقهم وما يتعلق بذلك	أحمد بن الأمين الشّنْقِيطي (المتوفى: 1331هـ)	ShamAY	1629	0.29101
		رسائل الشريف المرتضى [ج ١]	علي بن الحسين الموسوي العلوي [ الشريف المرتضى علم الهدى ]	Rafed	3614	0.291
		روح المعاني في تفسير القرآن العظيم والسبع المثاني	شهاب الدين محمود بن عبد الله الحسيني الألوسي (المتوفى: 1270هـ)	ShamAY	22835	0.29098
		الخصائص [ج ١]	أبي الفتح عثمان بن جنّي	Rafed	2068	0.29097
		زبدة التّفاسير [ج ٥]	فتح الله بن شكر الله الشريف الكاشاني	Rafed	1721	0.29096
		مجلة الحقائق (الدمشقية)	عبد القادر الإسكندراني	ShamelaY19	29676	0.29084
		نظرات في القرآن الكريم	محمد الغزالي	ShamAY	36730	0.2908
		الكشّاف [ج ٣]	محمود بن عمر الزمخشري	Rafed	3123	0.29075
		مجموعة القصائد الزهديات	أبو محمد عبد العزيز بن محمد بن عبد الرحمن بن عبد المحسن السلمان (المتوفى: 1422هـ)	ShamAY	1268	0.2907
		الأجوبة الكافية عن الأسئلة الشامية	محمد بن يوسف بن محمد بن سعد الحيدري التونسي الكافي المالكي (المتوفى: 1380هـ)	ShamAY	591	0.29056
		معترك الأقران في إعجاز القرآن، ويُسمَّى (إعجاز القرآن ومعترك الأقران)	عبد الرحمن بن أبي بكر، جلال الدين السيوطي (المتوفى: 911هـ)	ShamAY	1417	0.29053
		البحر المديد في تفسير القرآن المجيد [ج ٤]	أحمد بن محمد بن عجيبة	Rafed	3805	0.29052
		دلائل الإعجاز في علم المعاني	أبو بكر عبد القاهر بن عبد الرحمن بن محمد الفارسي الأصل، الجرجاني الدار (المتوفى: 471هـ)	ShamAY	1056	0.29046
