automatic URI	Proposed URI	bookTitle	authorName	collection	id	tfidf
		نظم مثلث قطرب	عبد العزيز المكناسي	ShamAY	37032	0.82337
		المثلثات اللغوية للمهلبي = شرح نظم مثلث قطرب	سديد الدين أبي القاسم عبد الوهاب بن الحسن بن بركات المهلبي	ShamAY	37030	0.35613
		المرشد إلى فهم أشعار العرب	عبد الله بن الطيب بن عبد الله بن الطيب بن محمد بن أحمد بن محمد المجذوب (المتوفى: 1426 ه)	ShamelaY19	150936	0.27554
		المرشد إلى فهم أشعار العرب	عبد الله بن الطيب بن عبد الله بن الطيب بن محمد بن أحمد بن محمد المجذوب (المتوفى: 1426 ه)	Sham19Y	150936	0.27511
		رحلة ابن معصوم المدني أو سلوة الغريب وأسوة الأريب	السيد علي صدر الدين المدني	Rafed	2267	0.27217
		الحطة في ذكر الصحاح الستة	أبو الطيب محمد صديق خان بن حسن بن علي ابن لطف الله الحسيني البخاري القِنَّوجي (المتوفى: 1307هـ)	ShamAY	10717	0.27216
		 رحلة ابن معصوم المدني ( سلوة الغريب وأسوة الأريب ) 	 السيد علي صدر الدين المدني ( ابن معصوم ) 	ABLibrary	9080	0.27149
		المثل السائر في أدب الكاتب والشاعر ت الحوفي	ضياء الدين بن الأثير، نصر الله بن محمد (المتوفى: 637هـ)	ShamAY	10551	0.27117
		 أعيان الشيعة 	 السيد محسن الأمين 	ABLibrary	80	0.27011
		 نفح الطيب من غصن الأندلس الرطيب 	 أحمد بن محمد المقري التلمساني 	ABLibrary	9299	0.26969
		أدب الطّف أو شعراء الحسين عليه السلام [ج ٤]	جواد شبّر	Rafed	365	0.26905
		الذخيرة في محاسن أهل الجزيرة	أبو الحسن علي بن بسام الشنتريني (المتوفى: 542هـ)	ShamAY	1035	0.26896
		نفح الطّيب [ج ٣]	الشيخ أحمد بن محمد المقري التلمساني	Rafed	2799	0.26864
		إعجاز القرآن	أبي بكر محمّد بن الطيّب الباقلّاني	Rafed	3267	0.26844
		نفح الطّيب [ج ٤]	الشيخ أحمد بن محمد المقري التلمساني	Rafed	2800	0.26808
		 أدب الطف أو شعراء الحسين ( ع ) 	 جواد شبر 	ABLibrary	7402	0.26739
		 نفح الطيب من غصن الأندلس الرطيب 	 أحمد بن محمد المقري التلمساني 	ABLibrary	9300	0.26675
		أدب الطّف أو شعراء الحسين عليه السلام [ج ٣]	جواد شبّر	Rafed	361	0.26656
		العمدة في محاسن الشعر وآدابه	أبو على الحسن بن رشيق القيرواني الأزدي (المتوفى: 463 هـ)	ShamAY	10909	0.26645
		الدر الفريد وبيت القصيد	محمد بن أيدمر المستعصمي (639 ه - 710 ه)	ShamelaY19	20762	0.26618
		النبوغ المغربي في الأدب العربي	عبد الله كنون الحسني (المتوفى: 1409 ه)	ShamelaY19	148529	0.26606
		 أدب الطف أو شعراء الحسين ( ع ) 	 جواد شبر 	ABLibrary	7401	0.26572
		سلافة العصر في محاسن الشعراء بكل مصر	صدر الدين المدني، علي بن أحمد بن محمد معصوم الحسني الحسيني، المعروف بعلي خان بن ميرزا أحمد، الشهير بابن معصوم (المتوفى: 1119هـ)	ShamAY	298	0.2655
		سلافة العصر في محاسن الشعراء بكل مصر	علي بن أحمد بن محمد معصوم الحسني الحسيني، الشهير بابن معصوم (المتوفى: 1119هـ)	ShamAY	34642	0.26538
		أزهار الرياض في أخبار القاضي عياض	شهاب الدين أحمد بن محمد بن أحمد بن يحيى، أبو العباس المقري التلمساني (المتوفى: 1041ه)	Sham19Y	26350	0.2652
		الحيوان - الجزء1	عمرو بن بحر الجاحظ	Masaha	2972	0.26502
		 أعيان الشيعة 	 السيد محسن الأمين 	ABLibrary	81	0.26499
		المثل السائر في أدب الكاتب والشاعر ت محيي الدين عبد الحميد	نصر الله بن محمد بن محمد بن عبد الكريم الشيباني، الجزري، أبو الفتح، ضياء الدين، المعروف بابن الأثير الكاتب (المتوفى: 637ه)	ShamelaY19	23794	0.26473
		رحلة الشتاء والصيف	محمد بن عبد الله بن محمد، من أحفاد شرف الدين بن يحيى الحمزي الحسيني المولوي المعروف ب كبريت (المتوفى: 1070ه)	ShamelaY19	37345	0.26458
		رحلة العبدري	أبو عبدالله العبدري	Rafed	2452	0.26454
		رحلة الشتاء والصيف	محمد بن عبد الله بن محمد، من أحفاد شرف الدين بن يحيى الحمزي الحسيني المولوي المعروف بـ كِبْرِيت (المتوفى: 1070هـ)	ShamAY	622	0.26428
		المستقصى في أمثال العرب	أبو القاسم محمود بن عمرو بن أحمد، الزمخشري جار الله (المتوفى: 538هـ)	ShamAY	6895	0.26422
		المطالع البدريّة في المنازل الروميّة	بدر الدين محمّد العامري الغزّي الدمشقي	Rafed	2309	0.26419
		أمراء البيان	محمد علي كرد	ShamAY	35859	0.26417
		أزهار الرياض في أخبار القاضي عياض	شهاب الدين أحمد بن محمد بن أحمد بن يحيى، أبو العباس المقري التلمساني (المتوفى: 1041ه)	ShamelaY19	26350	0.26416
		خاص الخاص	عبد الملك بن محمد بن إسماعيل أبو منصور الثعالبي (المتوفى: 429هـ)	ShamAY	7830	0.26413
		الحيوان	عمرو بن بحر بن محبوب الكناني بالولاء، الليثي، أبو عثمان، الشهير بالجاحظ (المتوفى: 255ه)	ShamelaY19	23775	0.26402
		اعجاز القرآن 	ابوبكر محمد بن طيب باقلاني	Ghbook	2771	0.26387
		 أدب الطف أو شعراء الحسين ( ع ) 	 جواد شبر 	ABLibrary	7405	0.26374
		 المطالع البدرية في المنازل الرومية 	 محمد العامري الغزي 	ABLibrary	9207	0.26373
		 رحلة العبدري 	 أبو عبد الله العبدري 	ABLibrary	9101	0.2637
		الكشكول	محمد بن حسين بن عبد الصمد الحارثي العاملي الهمذاني، بهاء الدين (المتوفى: 1031هـ)	ShamAY	1571	0.2634
		نفح الطّيب [ج ٥]	الشيخ أحمد بن محمد المقري التلمساني	Rafed	2801	0.26332
		رحلة المكانسي‏	محمد بن عبد الوهاب المكانسي	Masaha	4382	0.26329
		 رحلة المكناسي 	 محمد بن عبد الوهاب المكناسي 	ABLibrary	9109	0.26319
		كتاب الجواهر الثمينة في محاسن المدينة	محمّد كبريت الحسيني المدني	Rafed	2347	0.2631
		أدب الطّف أو شعراء الحسين عليه السلام [ج ٧]	جواد شبّر	Rafed	374	0.26285
		مجلة المقتبس	محمد كرد علي	ShamAY	443	0.26284
		المثل السائر في أدب الكاتب والشاعر ت محيي الدين عبد الحميد	نصر الله بن محمد بن محمد بن عبد الكريم الشيباني، الجزري، أبو الفتح، ضياء الدين، المعروف بابن الأثير الكاتب (المتوفى: 637هـ)	ShamAY	23794	0.26282
		الحيوان	عمرو بن بحر بن محبوب الكناني بالولاء، الليثي، أبو عثمان، الشهير بالجاحظ (المتوفى: 255هـ)	ShamAY	23775	0.26282
		أسرار البلاغة فى علم البيان	أبو بكر عبد القاهر بن عبد الرحمن بن محمد الفارسي الأصل، الجرجاني الدار (المتوفى: 471 هـ)	ShamAY	32338	0.26225
		أدب الطّف أو شعراء الحسين عليه السلام [ج ١٠]	جواد شبّر	Rafed	384	0.26221
		فصول في الثقافة والأدب	علي بن مصطفى الطنطاوي (المتوفى: 1420هـ)	ShamAY	32247	0.26219
		ريحانة الألبّا وزهرة الحياة الدنيا	شهاب الدين أحمد بن محمد بن عمر الخفاجي (المتوفى: 1069هـ)	ShamAY	1522	0.26206
		نصرة الثائر على المثل السائر	صلاح الدين خليل بن أيبك الصفدي (المتوفى: 764ه)	Sham19Y	514	0.26206
		 أدب الطف أو شعراء الحسين ( ع ) 	 جواد شبر 	ABLibrary	7408	0.26206
		 الجواهر الثمينة في محاسن المدنية 	 محمد كبريت الحسيني المدني 	ABLibrary	9033	0.26194
		مجلة المقتبس	محمد كرد علي	ShamelaY19	26523	0.26186
		أزهار الرياض في أخبار القاضي عياض	شهاب الدين أحمد بن محمد بن أحمد بن يحيى، أبو العباس المقري التلمساني (المتوفى: 1041هـ)	ShamAY	26350	0.26185
		إعجاز القرآن والبلاغة النبوية للرافعي	مصطفى صادق بن عبد الرزاق بن سعيد بن أحمد بن عبد القادر الرافعي (المتوفى: 1356هـ)	ShamAY	8506	0.2614
		من تاريخ النحو العربي	سعيد بن محمد بن أحمد الأفغاني (المتوفى: 1417ه)	Sham19Y	9937	0.26131
		 أدب الطف أو شعراء الحسين ( ع ) 	 جواد شبر 	ABLibrary	7404	0.26126
		سرّ الفصاحة	أبي محمّد عبد الله بن سعيد بن سنان الخفاجي الحلبي	Rafed	2077	0.26103
		 الحور العين 	 أبو سعيد بن نشوان الحميري 	ABLibrary	8418	0.26092
		أدب الطّف أو شعراء الحسين عليه السلام [ج ٦]	جواد شبّر	Rafed	373	0.26077
		رسالة الغفران	أحمد بن عبد الله بن سليمان بن محمد بن سليمان، أبو العلاء المعري، التنوخي (المتوفى: 449هـ)	ShamAY	1589	0.26076
		نصرة الثائر على المثل السائر	صلاح الدين خليل بن أيبك الصفدي (المتوفى: 764هـ)	ShamAY	514	0.26063
		 نفح الطيب من غصن الأندلس الرطيب 	 أحمد بن محمد المقري التلمساني 	ABLibrary	9301	0.26063
		 نفح الطيب من غصن الأندلس الرطيب 	 أحمد بن محمد المقري التلمساني 	ABLibrary	9303	0.26059
		 رسالة التوحيد 	 الشيخ محمد عبده 	ABLibrary	8430	0.26051
		التقريب لتفسير التحرير والتنوير للطاهر بن عاشور	الواحدي	ShamAY	36932	0.26029
		دلائل الإعجاز في علم المعاني	أبو بكر عبد القاهر بن عبد الرحمن بن محمد الفارسي الأصل، الجرجاني الدار (المتوفى: 471ه)	ShamelaY19	22664	0.26024
		الوسيط في تراجم أدباء شنقيط والكلام على تلك البلاد تحديدا وتخطيطا وعاداتهم وأخلاقهم وما يتعلق بذلك	أحمد بن الأمين الشّنْقِيطي (المتوفى: 1331هـ)	ShamAY	1629	0.2602
		ديوان ابن مشرف	أحمد بن علي بن حسين بن مشرف , ت: 1285 هـ	ShamAY	37876	0.26015
		الوسيط في تراجم أدباء شنقيط والكلام على تلك البلاد تحديدا وتخطيطا وعاداتهم وأخلاقهم وما يتعلق بذلك	أحمد بن الأمين الشنقيطي (المتوفى: 1331ه)	ShamelaY19	95696	0.26005
		 مجموعه رسائل ابن عربي 	 ابن عربي 	ABLibrary	8753	0.25999
		الخصائص [ج ١]	أبي الفتح عثمان بن جنّي	Rafed	2068	0.25987
		التلخيص الحبير في تخريج أحاديث الرافعي الكبير	أبو الفضل أحمد بن علي بن محمد بن أحمد بن حجر العسقلاني (المتوفى: 852هـ)	ShamAY	1581	0.25984
		دلائل الإعجاز في علم المعاني	أبو بكر عبد القاهر بن عبد الرحمن بن محمد الفارسي الأصل، الجرجاني الدار (المتوفى: 471هـ)	ShamAY	1040	0.25959
		طوق الحمامة في الألفة والألاف	أبو محمد علي بن أحمد بن سعيد بن حزم الأندلسي القرطبي الظاهري (المتوفى: 456هـ)	ShamAY	10518	0.25957
		من تاريخ النحو العربي	سعيد بن محمد بن أحمد الأفغاني (المتوفى: 1417هـ)	ShamAY	9937	0.25954
		 نفح الطيب من غصن الأندلس الرطيب 	 أحمد بن محمد المقري التلمساني 	ABLibrary	9302	0.25951
		الإمام البقاعي ومنهاجه في تأويل بلاغة القرآن	محمود توفيق محمد سعد	ShamAY	952	0.25945
		تعريف بشروح الكتب الستة	أبو عبد العزيز الحربي	ShamAY	35959	0.25943
		المدرّس الأفضل [ج ١]	الشيخ محمّد علي المدرّس الأفغاني	Rafed	2679	0.25928
		المقتطف من أزاهر الطرف	أبو الحسن على بن موسى بن سعيد المغربي الأندلسي (المتوفى: 685هـ)	ShamAY	9100	0.259
		مناهج المفسرين	الدكتور منيع عبد الحليم محمود	Rafed	876	0.25892
		 سيرة المصطفى ( ص ) ( نظرة جديدة ) 	 هاشم معروف الحسني 	ABLibrary	7577	0.25883
		الرّحلة الحجازيّة	الأمير شكيب أرسلان	Rafed	2385	0.25877
		دراسات في الحديث والمحدّثين	هاشم معروف الحسني	Rafed	1826	0.25859
		 نفح الطيب من غصن الأندلس الرطيب 	 أحمد بن محمد المقري التلمساني 	ABLibrary	9297	0.2584
		العواصم والقواصم في الذب عن سنة أبي القاسم	ابن الوزير، محمد بن إبراهيم بن علي بن المرتضى بن المفضل الحسني القاسمي، أبو عبد الله، عز الدين، من آل الوزير (المتوفى: 840ه)	ShamelaY19	29677	0.25839
		نفح الطّيب [ج ١]	الشيخ أحمد بن محمد المقري التلمساني	Rafed	2786	0.25839
		مقالات الطناحي (صفحات في التراث والتراجم واللغة والأدب) = مقالات العلامة الدكتور محمود محمد الطناحي	محمود محمد الطناحي، أبو أروى (المتوفى: 1419 ه)	ShamelaY19	148533	0.25833
		دلائل الإعجاز في علم المعاني	عبد القاهر بن عبد الرحمن الجرجاني	Rafed	2081	0.25824
		أنوار الربيع في أنواع البديع	صدر الدين المدني، علي بن أحمد بن محمد معصوم الحسني الحسيني، المعروف بعلي خان بن ميرزا أحمد، الشهير بابن معصوم (المتوفى: 1119هـ)	ShamAY	5446	0.25814
		 الرحلة الحجازية ( الارتسامات اللطاف في خاطر الحاج إلى أقدس مطاف ) 	 شكيب أرسلان 	ABLibrary	9092	0.25813
		 الإكليل من أخبار اليمن وأنساب حمير 	 الحسن الهمداني ( ابن الحائك ) 	ABLibrary	8963	0.25807
		العواصم والقواصم في الذب عن سنة أبي القاسم	ابن الوزير، محمد بن إبراهيم بن علي بن المرتضى بن المفضل الحسني القاسمي، أبو عبد الله، عز الدين، من آل الوزير (المتوفى: 840ه)	Sham19Y	29677	0.25802
		 موسوعة العتبات المقدسة 	 جعفر الخليلي 	ABLibrary	9244	0.25799
		جمهرة مقالات ورسائل الشيخ الإمام محمد الطاهر ابن عاشور	ابن عاشور	ShamelaY19	147597	0.25785
		مقتل الحسين عليه السلام	السيد عبد الرزاق الموسوي المقرّم	Rafed	1574	0.25783
		رسالة الصاهل والشاجح	أحمد بن عبد الله بن سليمان بن محمد بن سليمان المعري، التنوخي (المتوفى: 449هـ)	ShamAY	563	0.25782
		إعجاز القرآن للباقلاني	أبو بكر الباقلاني محمد بن الطيب (المتوفى: 403هـ)	ShamAY	953	0.25777
		الروض الباسم في الذب عن سنة أبي القاسم - صلى الله عليه وسلم -	ابن الوزير، محمد بن إبراهيم بن علي بن المرتضى بن المفضل الحسني القاسمي، أبو عبد الله، عز الدين، من آل الوزير (المتوفى: 840ه)	ShamelaY19	36427	0.25777
		الرَّوضُ البَاسمْ في الذِّبِّ عَنْ سُنَّةِ أبي القَاسِم - صَلَّى اللَّهُ عَلَيْهِ وَسَلَّمَ -	ابن الوزير، محمد بن إبراهيم بن علي بن المرتضى بن المفضل الحسني القاسمي، أبو عبد الله، عز الدين، من آل الوزير (المتوفى: 840هـ)	ShamAY	28	0.25776
		تحقيقات وأنظار في القرآن والسنة	محمد الطاهر ابن عاشور	ShamelaY19	133368	0.25773
		الروض النضر في ترجمة أدباء العصر	عثمان بن علي بن مراد العمري	ShamAY	35857	0.25766
		الحدائق النديّة في شرح الفوائد الصمديّة	السيد علي خان المدني الشيرازي	Rafed	1952	0.25765
		تاج العروس من جواهر القاموس - الجزء1	المرتضى الزبيدي	Masaha	2513	0.25758
		المطالع النصرية للمطابع المصرية في الأصول الخطية	نصر (أبو الوفاء) ابن الشيخ نصر يونس الوفائي الهوريني الأحمدي الأزهري الأشعري الحنفي الشافعي (المتوفى: 1291ه)	Sham19Y	97799	0.25757
		تذكرة أولي النهى والعرفان بأيام الله الواحد الديان وذكر حوادث الزمان	إبراهيم بن عبيد آل عبد المحسن «من علماء أهل القصيم»	ShamelaY19	145210	0.25752
		 الوصلة إلى الحبيب في وصف الطيبات والطيب 	 عمر بن أحمد العقيلي الحلبي ( ابن العديم ) 	ABLibrary	9892	0.25748
		فكر ومباحث	علي بن مصطفى الطنطاوي (المتوفى: 1420هـ)	ShamAY	32251	0.25744
		المستقصي في أمثال العرب - الجزء1	ابو القاسم محمود بن عمر الزمخشري	Masaha	4054	0.25733
		مناهج التأليف عند العلماء العرب	مصطفى الشكعة	ShamAY	7248	0.25732
		خزانة الأدب ولب لباب لسان العرب للبغدادي	عبد القادر بن عمر البغدادي (المتوفى: 1093هـ)	ShamAY	12732	0.25728
		الرواشح السماوية في شرح الأحاديث الإمامية	السيد محمد باقر الميرداماد	Masaha	4682	0.25723
		خزانة الأدب ولب لباب لسان العرب للبغدادي - العلمية	عبد القادر بن عمر البغدادي	ShamAY	33782	0.25722
		تفسير التّحرير والتّنوير [ج ١]	الشيخ محمّد الطاهر ابن عاشور	Rafed	2905	0.25719
		مقالات العلامة الدكتور محمود محمد الطناحي	محمود محمد الطناحي	ShamAY	38630	0.25709
		النفحة المسكية في الرحلة المكية	عبد الله بن حسين السويدي البغدادي	Masaha	4134	0.25699
		 خطط الشام 	 محمد كرد علي 	ABLibrary	9057	0.25693
		القول المعتبر في بيان الإعجاز للحروف المقطعة من فواتح السور	إياس محمد حرب آل خطاب	Sham19Y	37350	0.2569
		مناهج المفسرين	منيع بن عبد الحليم محمود (المتوفى: 1430ه)	Sham19Y	38093	0.25682
		أدب الطّف أو شعراء الحسين عليه السلام [ج ٢]	جواد شبّر	Rafed	318	0.25681
		شرح طيبة النشر في القراءات العشر	محمد بن محمد بن محمد، أبو القاسم، محب الدين النُّوَيْري (المتوفى: 857هـ)	ShamAY	1527	0.2568
		خطط الشام [ج ٤]	محمّد كرد علي	Rafed	2282	0.25677
		 تلخيص الشافي 	 الشيخ الطوسي 	ABLibrary	8390	0.25677
		المنتقى من بطون الكتب	الواحدي :: محمد بن إبراهيم الحمد	ShamAY	37720	0.2567
		العواصم والقواصم في الذب عن سنة أبي القاسم	ابن الوزير، محمد بن إبراهيم بن علي بن المرتضى بن المفضل الحسني القاسمي، أبو عبد الله، عز الدين، من آل الوزير (المتوفى: 840هـ)	ShamAY	3	0.25664
		أدب الطلب ومنتهى الأدب	محمد بن علي بن محمد بن عبد الله الشوكاني اليمني (المتوفى: 1250هـ)	ShamAY	6854	0.25663
		زهر الآداب وثمر الألباب	إبراهيم بن علي بن تميم الأنصاري، أبو إسحاق الحصري القيرواني (المتوفى: 453ه)	Sham19Y	10768	0.25663
		الغدير في الكتاب والسنّة والأدب [ج ٤]	الشيخ عبد الحسين أحمد الأميني النجفي	Rafed	2003	0.25662
		سر الفصاحة	أبو محمد عبد الله بن محمد بن سعيد بن سنان الخفاجي الحلبي (المتوفى: 466هـ)	ShamAY	11239	0.25648
		أعيان الشيعة - الجزء1	السيد محسن الأمين	Masaha	1836	0.25647
		نفح الطيب من غصن الأندلس الرطيب، وذكر وزيرها لسان الدين بن الخطيب	شهاب الدين أحمد بن محمد المقري التلمساني (المتوفى: 1041هـ)	ShamAY	1002	0.25642
		 نفح الطيب من غصن الأندلس الرطيب 	 أحمد بن محمد المقري التلمساني 	ABLibrary	9305	0.25634
		الأفضليات	علي بن منجب بن سليمان، أبو القاسم، تاج الرياسة، ابن الصيرفي (المتوفى: 542ه)	Sham19Y	5432	0.25632
		سيرة المصطفى نظرة جديدة	هاشم معروف الحسني‏	Masaha	2224	0.25626
		السيرة النبوية على ضوء القرآن والسنة	محمد بن محمد بن سويلم أبو شُهبة (المتوفى: 1403هـ)	ShamAY	9896	0.25612
		مقامات الزمخشري	ابو القاسم محمود بن عمر الزمخشري	Masaha	2358	0.25606
		مباحث في إعجاز القرآن	د مصطفى مسلم	Sham19Y	9675	0.25605
		موسوعة العتبات المقدسة  - الجزء1	جعفر الخليلي	Masaha	3747	0.25605
		التمثيل والمحاضرة	عبد الملك بن محمد بن إسماعيل أبو منصور الثعالبي (المتوفى: 429ه)	Sham19Y	5683	0.25604
		خريدة القصر وجريدة العصر - قسم شعراء المغرب والأندلس جـ 2	عماد الدين الكاتب الأصبهاني، محمد بن محمد صفي الدين بن نفيس الدين حامد بن أله، أبو عبد الله (المتوفى: 597هـ)	ShamAY	12856	0.25598
		شرح شافية ابن الحاجب [ج ٤]	الشيخ رضي الدين محمّد بن الحسن الاستراباذي النحوي	Rafed	1854	0.25586
		تاج العروس [ج ١]	محبّ الدين أبي فيض السيد محمّد مرتضى الحسيني الواسطي الزبيدي الحنفي	Rafed	1464	0.2558
		القول المعتبر في بيان الإعجاز للحروف المقطعة من فواتح السور	إياس محمد حرب آل خطاب	ShamAY	627	0.25578
		زهر الأكم في الأمثال والحكم	الحسن بن مسعود بن محمد، أبو علي، نور الدين اليوسي (المتوفى: 1102ه)	Sham19Y	7414	0.25573
		الجواهر الثمينة في محاسن المدينة	محمد كبريت الحسيني المدني	Masaha	4131	0.25573
		تاريخ الأدب الأندلسي (عصر سيادة قرطبة)	دكتور إحسان عباس (المتوفى: 1424ه)	Sham19Y	1016	0.25571
		مناهج المفسرين	منيع بن عبد الحليم محمود (المتوفى: 1430ه)	ShamelaY19	38093	0.25568
		مناهج المفسرين	منيع بن عبد الحليم محمود (المتوفى: 1430هـ)	ShamAY	1236	0.25565
		شرح الكافية الشّافية [ج ١]	أبي عبد الله جمال الدين محمّد بن عبد الله بن محمّد بن مالك الطائي الجياني الشافعي	Rafed	1858	0.25557
		في الأدب الحديث	عمر الدسوقي	Sham19Y	11565	0.25556
		الرحلة الحجازية المسماة الارتسامات اللطاف في خاطر الحاج إلى أقدس مطاف‏	شكيب أرسلان	Masaha	4551	0.25552
		مباحث في إعجاز القرآن	د مصطفى مسلم	ShamAY	1505	0.2553
		نظرية النظم وقراءة الشعر عند عبد القاهر الجرجاني	محمود توفيق محمد سعد	ShamAY	34505	0.25525
		موسوعة العتبات المقدسة - الجزء1	جعفر الخليلي	Masaha	3049	0.25525
		يتمة الدهر في محاسن أهل العصر	عبد الملك بن محمد بن إسماعيل أبو منصور الثعالبي (المتوفى: 429هـ)	ShamAY	6743	0.25501
