automatic URI	Proposed URI	bookTitle	authorName	collection	id	tfidf
		الفكر السامي في تاريخ الفقه الإسلامي	محمد بن الحسن بن العربي بن محمد الحجوي الثعالبي الجعفري الفاسي (المتوفى: 1376ه)	Sham19Y	10013	0.2503
		البلدان	أبي عبدالله أحمد بن محمد بن إسحاق الهمذاني [ ابن الفقيه ]	Rafed	3770	0.25025
		تاج العروس من جواهر القاموس - ط الفكر	محمّد بن محمّد بن عبد الرزّاق الحسيني، الملقّب بمرتضى الزَّبيدي (المتوفى: 1205هـ)	ShamAY	34693	0.25024
		دلائل الإعجاز في علم المعاني	أبو بكر عبد القاهر بن عبد الرحمن بن محمد الفارسي الأصل، الجرجاني الدار (المتوفى: 471ه)	Sham19Y	12055	0.25021
		شرح نهج البلاغة - الجزء1	ابن ابي الحديد	Masaha	2790	0.25019
		مجلة البيان (238 عددا)	تصدر عن المنتدى الإسلامي	ShamAY	1541	0.25015
		توحيد المفضل‏	المفضل بن عمر	Masaha	4555	0.25015
		الإعلام بفوائد عمدة الأحكام	ابن الملقن سراج الدين أبو حفص عمر بن علي بن أحمد الشافعي المصري (المتوفى: 804هـ)	ShamAY	31785	0.2501
		 كنز الفوائد 	 أبي الفتح الكراجكي 	ABLibrary	7903	0.25009