automatic URI	Proposed URI	bookTitle	authorName	collection	id	tfidf
		خزانة الأدب وغاية الأرب لابن حجة الحموي	ابن حجة الحموي، تقي الدين أبو بكر بن علي بن عبد الله الحموي الأزراري (المتوفى: 837هـ)	ShamAY	8675	0.25495
		الفصول المهمة في تأليف الأمة	السيد عبدالحسين شرف الدين الموسوي	Rafed	167	0.25494
		 المغرب في ترتيب المعرب 	 ناصر الدين المطرزي 	ABLibrary	9218	0.25493
		غاية الأماني في الرد على النبهاني	أبو المعالي محمود شكري بن عبد الله بن محمد بن أبي الثناء الألوسي (المتوفى: 1342ه)	Sham19Y	12034	0.25484
		كنز الكتاب ومنتخب الآداب (السفر الأول من النسخة الكبرى)	أبو إسحاق إبراهيم بن أبي الحسن الفهري المعروف بالبونسي (651ه)	Sham19Y	13666	0.25477
		نفحة الريحانة ورشحة طلاء الحانة	محمد أمين بن فضل الله بن محب الدين بن محمد المحبي (المتوفى: 1111هـ)	ShamAY	579	0.25475
		أسواق العرب في الجاهلية والإسلام	سعيد بن محمد بن أحمد الأفغاني (المتوفى: 1417هـ)	ShamAY	9999	0.25469
		شرح نونية القرني	كَامِلَةُ الكَوارِي	ShamAY	35708	0.25467
		تاريخ الأدب الأندلسي (عصر سيادة قرطبة)	دكتور إحسان عباس (المتوفى: 1424هـ)	ShamAY	1016	0.25463
		كناشة النوادر	عبد السلام محمد هارون (المتوفى: 1408هـ)	ShamAY	12733	0.25462
		عدة المريد الصادق	شهاب الدين أبو العباس أحمد بن أحمد بن محمد بن عيسى البرنسي الفاسي، المعروف بـ زروق (المتوفى: 899هـ)	ShamAY	31741	0.2546
		التمثيل والمحاضرة	عبد الملك بن محمد بن إسماعيل أبو منصور الثعالبي (المتوفى: 429هـ)	ShamAY	5683	0.25458
		الروض المعطار في خبر الأقطار	محمد بن عبد المنعم الحميري	Masaha	4113	0.25454
		الفلاكة والمفلوكون	أحمد بن علي بن عبد الله، شهاب الدين الدلجي المصري (المتوفى: 838ه)	Sham19Y	36075	0.2545
		خريدة القصر وجريدة العصر - أقسام أخرى	عماد الدين الكاتب الأصبهاني، محمد بن محمد صفي الدين بن نفيس الدين حامد بن أله، أبو عبد الله (المتوفى: 597هـ)	ShamAY	12815	0.25445
		المَطَالِعُ النَّصرية للمَطَابِعِ المصريَّةِ في الأصُول الخَطيَّةِ	نصر (أبو الوفاء) ابن الشيخ نصر يونس الوفائي الهوريني الأحمدي الأزهري الأشعري الحنفي الشافعيّ (المتوفى: 1291هـ)	ShamAY	32171	0.25444
		زهر الأكم في الأمثال والحكم	الحسن بن مسعود بن محمد، أبو علي، نور الدين اليوسي (المتوفى: 1102هـ)	ShamAY	7414	0.2544
		تاريخ آداب العرب	مصطفى صادق بن عبد الرزاق بن سعيد بن أحمد بن عبد القادر الرافعي (المتوفى: 1356هـ)	ShamAY	10548	0.25439
		الأفضليات	علي بن منجب بن سليمان، أبو القاسم، تاج الرياسة، ابن الصيرفي (المتوفى: 542هـ)	ShamAY	5432	0.25433
		 أدب الطف أو شعراء الحسين ( ع ) 	 جواد شبر 	ABLibrary	7400	0.25423
		 الموضح عن جهة إعجاز القرآن 	 الشريف المرتضى 	ABLibrary	8653	0.2542
		خلاصة الأثر في أعيان القرن الحادي عشر	محمد أمين بن فضل الله بن محب الدين بن محمد المحبي الحموي الأصل، الدمشقي (المتوفى: 1111ه)	Sham19Y	6678	0.25418
		تحرير التحبير في صناعة الشعر والنثر وبيان إعجاز القرآن	عبد العظيم بن الواحد بن ظافر ابن أبي الإصبع العدواني، البغدادي ثم المصري (المتوفى: 654ه)	Sham19Y	26520	0.25413
		فيض القدير شرح الجامع الصغير	زين الدين محمد المدعو بعبد الرؤوف بن تاج العارفين بن علي بن زين العابدين الحدادي ثم المناوي القاهري (المتوفى: 1031ه)	Sham19Y	21660	0.25407
		الإعجاز البياني للقرآن ومسائل ابن الأزرق	عائشة محمد علي عبد الرحمن المعروفة ببنت الشاطئ (المتوفى: 1419هـ)	ShamAY	12759	0.25401
		تاريخ الفقه الجعفري	هاشم معروف الحسني	Rafed	3882	0.25398
		التوحيد لمحمد عبده	محمد عبده بن حسن خير الله (المتوفى: 1323هـ)	ShamAY	6392	0.25396
		كتاب معرفة اشتقاق أسماء نطق بها القرآن وجاءت بها السنن والأخبار وتأويل ألفاظ مستعملة	السجستاني، ابن عزير	ShamAY	36737	0.25389
		مجلة لغة العرب العراقية - مجلة شهرية أدبية علمية تاريخية	أنستاس الكرملي	ShamelaY19	36540	0.25387
		تحرير التحبير في صناعة الشعر والنثر وبيان إعجاز القرآن	عبد العظيم بن الواحد بن ظافر ابن أبي الإصبع العدواني، البغدادي ثم المصري (المتوفى: 654ه)	ShamelaY19	26520	0.25386
		تراثنا ـ العدد [ 18 ]	مؤسسة آل البيت عليهم السلام لإحياء التراث ـ قم	Rafed	2738	0.25386
		إحقاق الحقّ وإزهاق الباطل [ج ١]	السيّد نور الله الحسيني المرعشي التستري	Rafed	2654	0.25381
		المحتسب في تبيين وجوه شواذ القراءات والإيضاح عنها	أبو الفتح عثمان بن جني الموصلي (المتوفى: 392ه)	Sham19Y	8660	0.25368
		الخصائص	أبو الفتح عثمان بن جني الموصلي (المتوفى: 392ه)	Sham19Y	9986	0.25367
		لقاءات ملتقى أهل الحديث بالعلماء	ملتقى أهل الحديث	ShamAY	812	0.25365
		زهر الآداب وثمر الألباب	إبراهيم بن علي بن تميم الأنصاري، أبو إسحاق الحُصري القيرواني (المتوفى: 453هـ)	ShamAY	10768	0.2536
		مجلة لغة العرب العراقية - مجلة شهرية أدبية علمية تاريخية	أنستاس الكرملي	Sham19Y	36540	0.2536
		الفوائد المدنيّة	محمّد أمين الإسترابادي	Rafed	1325	0.25358
		مقامات القرني	عائض بن عبدالله القرني :: عائض القرني	ShamAY	34503	0.25357
		الحيوان - ت: عبد السلام هارون	أبو عثمان عمرو بن بحر الجاحظ	ShamAY	33772	0.25355
		درج الدرر في تفسير الآي والسور ط الحكمة	أبو بكر عبد القاهر بن عبد الرحمن بن محمد الفارسي الأصل، الجرجاني الدار (المتوفى: 471ه)	ShamelaY19	122173	0.25354
		جواهر الأدب في أدبيات وإنشاء لغة العرب	أحمد بن إبراهيم بن مصطفى الهاشمي (المتوفى: 1362ه)	ShamelaY19	21505	0.25353
		النفحة المسكية فى الرحلة المكية	عبد الله بن حسين بن مرعي بن ناصر الدين البغدادي، أبو البركات السويدي (المتوفى: 1174هـ)	ShamAY	12086	0.25352
		 أدب الطف أو شعراء الحسين ( ع ) 	 جواد شبر 	ABLibrary	7403	0.25351
		المطالع البدرية في المنازل الرومية	محمد بن محمد بن محمد الغزي العامري الدمشقي، أبو البركات، بدر الدين ابن رضي الدين (المتوفى: 984هـ)	ShamAY	450	0.25345
		آلاء الرحمن في تفسير القرآن [ج ١]	الشيخ محمد جواد البلاغي	Rafed	3150	0.25345
		فيض القدير شرح الجامع الصغير	زين الدين محمد المدعو بعبد الرؤوف بن تاج العارفين بن علي بن زين العابدين الحدادي ثم المناوي القاهري (المتوفى: 1031ه)	ShamelaY19	21660	0.25342
		المطالع البدرية في المنازل الرومية	محمد بن محمد بن محمد الغزي العامري الدمشقي، أبو البركات، بدر الدين ابن رضي الدين (المتوفى: 984ه)	ShamelaY19	37060	0.2534
		نضرة الإغريض في نصرة القريض	المظفر بن الفضل بن يحيى، أبو علي، العلوي الحسيني العراقي (المتوفى: 656ه)	Sham19Y	629	0.25337
		 موسوعة التاريخ الإسلامي 	 الشيخ محمد هادي اليوسفي الغروي 	ABLibrary	7853	0.25329
		التحرير والتنوير	محمد الطاهر بن محمد بن محمد الطاهر بن عاشور التونسي (المتوفى : 1393هـ)	ShamAY	9776	0.25326
		دلائل الإعجاز في علم المعاني	أبو بكر عبد القاهر بن عبد الرحمن بن محمد الفارسي الأصل، الجرجاني الدار (المتوفى: 471هـ)	ShamAY	1056	0.25308
		في الأدب الحديث	عمر الدسوقي	ShamAY	11565	0.25304
		توحيد المفضّل	المفضل بن عمر الجعفي	Rafed	725	0.25303
		العقد المفصل في قبيلة المجد المؤثل	حيدر بن سليمان بن داود الحلي الحسيني (المتوفى: 1304هـ)	ShamAY	5448	0.25301
		 مسالك الأبصار في ممالك الأمصار 	 أحمد بن يحيى العمري 	ABLibrary	9194	0.25298
		 ديوان ابن عربي 	 ابن عربي 	ABLibrary	8737	0.25296
		نفاضة الجراب في علالة الاغتراب	لسان الدين بن الخطيب، محمد بن عبد الله (المتوفى: 776ه)	Sham19Y	477	0.25295
		 سيرة الأئمة الاثني عشر ( ع ) 	 هاشم معروف الحسني 	ABLibrary	7547	0.2528
		الفلاكة والمفلوكون	أحمد بن علي بن عبد الله، شهاب الدين الدَّلْجي المصري (المتوفى: 838هـ)	ShamAY	821	0.25272
		كتاب الصّناعتين الكتابة والشعر	أبي هلال الحسن بن عبدالله بن سهل العسكري	Rafed	3296	0.25265
		نور الطرف ونور الظرف	إبراهيم بن علي بن تميم الأنصاري، أبو إسحاق الحصري (المتوفى: 453هـ)	ShamAY	5351	0.2526
		مجلة البيان للبرقوقي	البرقوقي	ShamelaY19	73348	0.2526
		موسوعة التاريخ الاسلامي - الجزء1	الشيخ محمد هادي اليوسفي	Masaha	3036	0.25256
		خلاصة الأثر في أعيان القرن الحادي عشر	محمد أمين بن فضل الله بن محب الدين بن محمد المحبي الحموي الأصل، الدمشقي (المتوفى: 1111هـ)	ShamAY	6678	0.25255
		شرح اللؤلؤ المكنون في أحوال الأسانيد والمتون	عبد الكريم الخضير	ShamelaY19	23405	0.25254
		الرسائل السياسية	عمرو بن بحر بن محبوب الكناني بالولاء، الليثي، أبو عثمان، الشهير بالجاحظ (المتوفى: 255ه)	Sham19Y	10709	0.25247
		الوحي المحمدي	محمد رشيد بن علي رضا بن محمد شمس الدين بن محمد بهاء الدين بن منلا علي خليفة القلموني الحسيني (المتوفى: 1354هـ)	ShamAY	1202	0.25246
		البحر المحيط في التفسير [ج ١]	محمّد بن يوسف [ أبي حيّان الأندلسي الغرناطي ]	Rafed	2415	0.25246
		المحتسب في تبيين وجوه شواذ القراءات والإيضاح عنها	أبو الفتح عثمان بن جني الموصلي (المتوفى: 392هـ)	ShamAY	8660	0.25245
		مجلة لغة العرب العراقية - مجلة شهرية أدبية علمية تاريخية	أنستاس الكرملي	ShamAY	340	0.25241
		ربيع الأبرار و نصوص الأخبار - الجزء1	ابو القاسم محمود بن عمر الزمخشري	Masaha	2979	0.2524
		موسوعة الأعمال الكاملة للإمام محمد الخضر حسين	الإمام محمد الخضر حسين (المتوفى: 1377 ه)	Sham19Y	14579	0.25239
		رسالة التوحيد - ط الكتاب العربي	محمد عبده	ShamAY	33867	0.25238
		الجماهر في معرفة الجواهر	أبو الريحان محمد بن أحمد البيروني الخوارزمي (المتوفى: 440هـ)	ShamAY	699	0.25236
		نفح الطّيب [ج ٢]	الشيخ أحمد بن محمد المقري التلمساني	Rafed	2788	0.25235
		مطالع البدور ومنازل السرور	علي بن عبد الله الغزولي البهائي الدمشقي (المتوفى: 815ه)	Sham19Y	5390	0.25233
		النكت الوفية بما في شرح الألفية	برهان الدين إبراهيم بن عمر البقاعي	ShamelaY19	23798	0.25228
		الخصائص	أبو الفتح عثمان بن جني الموصلي (المتوفى: 392هـ)	ShamAY	9986	0.25225
		تحفة القادم	ابن الأبار، محمد بن عبد الله بن أبي بكر القضاعي البلنسي (المتوفى: 658ه)	ShamelaY19	26108	0.25221
		جلاء العينين في محاكمة الأحمدين	نعمان بن محمود بن عبد الله، أبو البركات خير الدين، الآلوسي (المتوفى: 1317هـ)	ShamAY	9943	0.2521
		مجموعة القصائد الزهديات	أبو محمد عبد العزيز بن محمد بن عبد الرحمن بن عبد المحسن السلمان (المتوفى: 1422ه)	ShamelaY19	38155	0.2521
		 شجون المسجون وفنون المفتون 	 ابن عربي 	ABLibrary	8740	0.25206
		المسالك في شرح موطأ مالك	القاضي محمد بن عبد الله أبو بكر بن العربي المعافري الاشبيلي المالكي (المتوفى: 543ه)	ShamelaY19	123665	0.25205
		مقالات موقع الدرر السنية	مجموعة من المؤلفين	ShamAY	1572	0.25202
		نضرة الإغريض في نصرة القريض	المظفر بن الفضل بن يحيى، أبو علي، العلوي الحسيني العراقي (المتوفى: 656هـ)	ShamAY	629	0.25194
		تحت راية القرآن	مصطفى صادق بن عبد الرزاق بن سعيد بن أحمد بن عبد القادر الرافعي (المتوفى: 1356ه)	Sham19Y	21784	0.2519
		الروض المعطار في خبر الأقطار	أبو عبد الله محمد بن عبد الله بن عبد المنعم الحميرى (المتوفى: 900ه)	Sham19Y	1043	0.25186
		غاية الأماني في الرد على النبهاني	أبو المعالي محمود شكري بن عبد الله بن محمد بن أبي الثناء الألوسي (المتوفى: 1342هـ)	ShamAY	12034	0.25183
		مقالات موقع الدرر السنية	مجموعة من المؤلفين	ShamelaY19	95660	0.2518
		الرسائل الأحمديّة [ج ١]	الشيخ أحمد آل طعّان	Rafed	1330	0.25177
		مجلة البيان للبرقوقي	البرقوقي	ShamAY	464	0.25173
		الكتيبة الكامنة في من لقيناه بالأندلس من شعراء المائة الثامنة	لسان الدين بن الخطيب، محمد بن عبد الله (المتوفى: 776هـ)	ShamAY	1027	0.25172
		العباس(ع)	السيد عبد الرزاق المقرم	Masaha	515	0.25171
		كنز الكتاب ومنتخب الآداب (السفر الأول من النسخة الكبرى)	أبو إسحاق إبراهيم بن أبي الحسن الفهري المعروف بالبونسي (651هـ)	ShamAY	31931	0.25169
		تحت راية القرآن	مصطفى صادق بن عبد الرزاق بن سعيد بن أحمد بن عبد القادر الرافعي (المتوفى: 1356ه)	ShamelaY19	21784	0.25168
		الوسيط في علوم ومصطلح الحديث	محمد بن محمد بن سويلم أبو شُهبة (المتوفى: 1403هـ)	ShamAY	9987	0.25166
		الموضح عن جهة إعجاز القرآن	علي بن الحسين الموسوي العلوي [ الشريف المرتضى علم الهدى ]	Rafed	3620	0.25165
		 شرح المقاصد 	 التفتازاني 	ABLibrary	8463	0.25164
		عدة المريد الصادق	شهاب الدين أبو العباس أحمد بن أحمد بن محمد بن عيسى البرنسي الفاسي، المعروف ب زروق (المتوفى: 899ه)	ShamelaY19	123663	0.2516
		حياة محمد صلى الله عليه وآله وسلم	محمد حسين هيكل (المتوفى: 1376هـ)	ShamAY	9797	0.25155
		الشاهد الشعري في تفسير القرآن الكريم أهميته، وأثره، ومناهج المفسرين في الاستشهاد به	د. عبد الرحمن بن معاضة الشهري	ShamelaY19	148084	0.25152
		المزهر في علوم اللغة وأنواعها	عبد الرحمن بن أبي بكر، جلال الدين السيوطي (المتوفى: 911هـ)	ShamAY	6936	0.2515
		سيّد المرسلين صلّى الله عليه وآله [ج ١]	الشيخ جعفر السبحاني	Rafed	185	0.2515
		نفاضة الجراب في علالة الاغتراب	لسان الدين بن الخطيب، محمد بن عبد الله (المتوفى: 776هـ)	ShamAY	477	0.25146
		نهاية الأرب في فنون الأدب‏ - الجزء1	أحمد بن عبد الوهاب النويري‏	Masaha	3070	0.25143
		الشيعة في مسارهم التاريخي	السيد محسن الأمين	Masaha	2363	0.2514
		نزهة الأبصار بطرائف الأخبار والأشعار	عبد الرحمن بن عبد الله بن أحمد بن درهم (المتوفى: 1362هـ)	ShamAY	5375	0.25139
		نهاية الأرب في فنون الأدب	أحمد بن عبد الوهاب بن محمد بن عبد الدائم القرشي التيمي البكري، شهاب الدين النويري (المتوفى: 733هـ)	ShamAY	10283	0.25138
		صلح الحسن عليه السلام	الشيخ راضي آل ياسين	Rafed	175	0.25134
		 سيد المرسلين 	 الشيخ السبحاني 	ABLibrary	7634	0.25132
		مجلة «الثقافة» السورية	خليل مردم بك	ShamelaY19	73350	0.25128
		فيض القدير - ط العلمية	المناوي	ShamAY	33524	0.25124
		النفحة المسكية في الرحلة المكية	عبد الله بن حسين السويدي البغدادي	Rafed	2252	0.25124
		الرسائل للجاحظ	عمرو بن بحر بن محبوب الكناني بالولاء، الليثي، أبو عثمان، الشهير بالجاحظ (المتوفى: 255هـ)	ShamAY	10428	0.2512
		التفسير ورجاله للطاهر بن عاشور		ShamAY	36931	0.25118
		أدب الطّف أو شعراء الحسين عليه السلام [ج ٥]	جواد شبّر	Rafed	367	0.25117
		الإمتاع والمؤانسة	أبو حيان التوحيدي، علي بن محمد بن العباس (المتوفى: نحو 400هـ)	ShamAY	10521	0.25114
		علوم الحديث ومصطلحه - عرض ودراسة	د. صبحي إبراهيم الصالح (المتوفى: 1407ه)	ShamelaY19	96229	0.2511
		الرسائل العشر (للشيخ الطوسي)	الشيخ الطوسي	Masaha	1023	0.2511
		الرسائل السياسية	عمرو بن بحر بن محبوب الكناني بالولاء، الليثي، أبو عثمان، الشهير بالجاحظ (المتوفى: 255هـ)	ShamAY	10709	0.25108
		تاريخ الفقه الجعفري‏	هاشم معروف الحسني‏	Masaha	2707	0.25108
		تاريخ الفقه الجعفري‏	هاشم معروف الحسني‏	Masaha	3197	0.25108
		مجلة «الثقافة» السورية	خليل مردم بك	ShamAY	893	0.25107
		المغرب في حلى المغرب	أبو الحسن على بن موسى بن سعيد المغربي الأندلسي (المتوفى: 685هـ)	ShamAY	6633	0.25107
		 خطط الشام 	 محمد كرد علي 	ABLibrary	9058	0.25104
		معجم متن اللغة (موسوعة لغوية حديثة)	أحمد رضا (عضو المجمع العلمي العربي بدمشق)	ShamelaY19	29613	0.25102
		 الشيخ محيي الدين بن عربي ترجمة حياته من كلامه 	 محمود محمود الغراب 	ABLibrary	8910	0.25102
		الرسائل الأحمدية - الجزء1	الشيخ أحمد آل طعان البحراني	Masaha	1796	0.25101
		التذكرة الفخرية	الصاحب بهاء الدين علي بن عيسى بن أبي الفتح الإربلي (المتوفى: 692هـ)	ShamAY	724	0.251
		 دراسات في علم الدراية 	 علي أكبر غفاري 	ABLibrary	923	0.25097
		لمعات التنقيح في شرح مشكاة المصابيح	عبد الحق بن سيف الدين بن سعد الله البخاري الدهلوي الحنفي «المولود بدهلي في الهند سنة (958 ه) والمتوفى بها سنة (1052 ه) رحمه الله تعالى»	ShamelaY19	145212	0.25095
		فيض القدير شرح الجامع الصغير	زين الدين محمد المدعو بعبد الرؤوف بن تاج العارفين بن علي بن زين العابدين الحدادي ثم المناوي القاهري (المتوفى: 1031هـ)	ShamAY	21660	0.25094
		الفلاكة والمفلوكون	أحمد بن علي بن عبد الله، شهاب الدين الدلجي المصري (المتوفى: 838ه)	ShamelaY19	36075	0.25093
		الشعر والشعراء	أبو محمد عبد الله بن مسلم بن قتيبة الدينوري (المتوفى: 276هـ)	ShamAY	23785	0.25088
		ابو الشهداء الحسين بن علي عليه السلام	عباس محمود العقاد	Masaha	4073	0.25081
		جواهر الأدب في أدبيات وإنشاء لغة العرب	أحمد بن إبراهيم بن مصطفى الهاشمي (المتوفى: 1362هـ)	ShamAY	21505	0.2508
		الجواهر والدرر في ترجمة شيخ الإسلام ابن حجر	شمس الدين أبو الخير محمد بن عبد الرحمن بن محمد بن أبي بكر بن عثمان بن محمد السخاوي (المتوفى: 902هـ)	ShamAY	32249	0.25079
		تحرير التحبير في صناعة الشعر والنثر وبيان إعجاز القرآن	عبد العظيم بن الواحد بن ظافر ابن أبي الإصبع العدواني، البغدادي ثم المصري (المتوفى: 654هـ)	ShamAY	26520	0.25078
		 أدب الطف أو شعراء الحسين ( ع ) 	 جواد شبر 	ABLibrary	7407	0.25076
		مطالع البدور ومنازل السرور	علي بن عبد الله الغزولي البهائي الدمشقي (المتوفى: 815هـ)	ShamAY	5390	0.25073
		تراثنا ـ العدد [ 15 ]	مؤسسة آل البيت عليهم السلام لإحياء التراث ـ قم	Rafed	2729	0.25073
		 النفحة المسكية في الرحلة المكية 	 عبد الله بن حسين السويدي البغدادي 	ABLibrary	9307	0.25066
		الصناعتين: الكتابة والشعر	أبو هلال الحسن بن عبد الله بن سهل بن سعيد بن يحيى بن مهران العسكري (المتوفى: نحو 395ه)	ShamelaY19	23787	0.25065
		نشأة النحو وتاريخ أشهر النحاة	الشيخ محمد الطنطاوي رحمه الله	ShamAY	7328	0.25064
		معاهد التنصيص على شواهد التلخيص	عبد الرحيم بن عبد الرحمن بن أحمد، أبو الفتح العباسي (المتوفى: 963هـ)	ShamAY	6951	0.25059
		جمهرة مقالات العلامة الشيخ أحمد محمد شاكر - مع أهم تعقبات الشيخ على دائرة المعارف الإسلامية	أحمد محمد شاكر	ShamelaY19	20642	0.25052
		النبأ العظيم نظرات جديدة في القرآن - ط الثقافة	محمد بن عبد الله دراز	ShamAY	34078	0.2505
		داعية التوحيد محمد بن عبد الوهاب	عبد العزيز شلبي سيد الأهل (المتوفى: 1402هـ)	ShamAY	11177	0.25046
		 شمس العلوم ودواء كلام العرب من الكلوم 	 نشوان بن سعيد الحميري 	ABLibrary	9787	0.25046
		الفن ومذاهبه في الشعر العربي	أحمد شوقي عبد السلام ضيف الشهير بشوقي ضيف (المتوفى: 1426هـ)	ShamAY	8666	0.25045
		 البخلاء 	 الجاحظ 	ABLibrary	809	0.25042
		سيرة حياة الشيخ عبد الرزاق عفيفي	محمد بن أحمد سيد أحمد	ShamAY	35825	0.25041
		الروض المعطار في خبر الأقطار	أبو عبد الله محمد بن عبد الله بن عبد المنعم الحِميرى (المتوفى: 900هـ)	ShamAY	1043	0.2504
		منهج النقد في علوم الحديث	الدكتور نور الدين عتر	ShamAY	38874	0.2504
		اسرار البلاغه في علم البيان 	عبدالقاهر بن عبد الرحمن جرجاني	Ghbook	450	0.25036
		تفسير ابن باديس ((في مجالس التذكير من كلام الحكيم الخبير)).	عبد الحميد محمد بن باديس الصنهاجي (المتوفى: 1359هـ)	ShamAY	55	0.25034
