automatic URI	Proposed URI	bookTitle	authorName	collection	id	tfidf
		منظومة في الكبائر	الحجاوي	ShamAY	34942	0.93263
		عُقُودُ الجُمَانْ في عِلْمِ الْمَعَانِي وَالْبَيَانْ	عبد الرحمن بن أبي بكر، جلال الدين السيوطي (المتوفى: 911هـ)	ShamAY	2065	0.50464
		عقود الجمان في علم المعاني والبيان	عبد الرحمن بن أبي بكر، جلال الدين السيوطي (المتوفى: 911ه)	ShamelaY19	97803	0.50153
		معالم التنزيل في تفسير القرآن = تفسير البغوي	محيي السنة ، أبو محمد الحسين بن مسعود بن محمد بن الفراء البغوي الشافعي (المتوفى : 510هـ)	ShamAY	12217	0.40881
		 الأزمنه والأنواء 	 ابن الأجدابي 	ABLibrary	8929	0.38702
		الأزمنة والأنواء	أبي إسحاق إبراهيم بن إسماعيل [ إبن أجدابي ]	Rafed	2223	0.38615
		فصل الخطاب في شرح مسائل الجاهلية (المسائل التي خالف فيها رسول الله صلى الله عليه وسلم أهل الجاهلية)	أبو المعالي محمود شكري بن عبد الله بن محمد بن أبي الثناء الألوسي (المتوفى: 1342هـ)	ShamAY	8549	0.38352
		الأزمنة والأنواء	إبراهيم بن إسماعيل ابن الأجدابي	Masaha	4130	0.38345
		فصل الخطاب في شرح مسائل الجاهلية (المسائل التي خالف فيها رسول الله صلى الله عليه وسلم أهل الجاهلية)	أبو المعالي محمود شكري بن عبد الله بن محمد بن أبي الثناء الألوسي (المتوفى: 1342ه)	Sham19Y	8549	0.38295
		المسائل التي خالف فيها رسول الله صلى الله عليه وسلم أهل الجاهلية - ت السعيد	محمد بن عبد الوهاب	ShamAY	33889	0.38267
		فصل في تزكية النفس [الطبعة الكاملة للرسالة]	شيخ الإسلام أبو العباس أحمد بن عبد الحليم ابن تيمية الحراني (661 - 728 ه)	ShamelaY19	133364	0.36882
		جمل العلم والعمل	علي بن الحسين الموسوي العلوي [ الشريف المرتضى علم الهدى ]	Rafed	1250	0.36735
		فصل في تزكية النفس [الطبعة الكاملة للرسالة]	شيخ الإسلام أبو العباس أحمد بن عبد الحليم ابن تيمية الحراني (661 - 728 ه)	Sham19Y	133364	0.36711
		تراثنا ـ العدد [ 18 ]	مؤسسة آل البيت عليهم السلام لإحياء التراث ـ قم	Rafed	2738	0.36411
		جمل العلم و العمل	السيد المرتضى	Masaha	994	0.36293
		مائة منقبة	محمّد بن أحمد بن الحسن بن شاذان القمي	Rafed	1178	0.35405
		الفرق لابن أبي ثابت	أبو محمد ثابت بن أبي ثابت اللغوي (المتوفى: ق 13هـ)	ShamAY	7055	0.35271
		شذرات الذهب في أخبار من ذهب	عبد الحي بن أحمد بن محمد ابن العماد العَكري الحنبلي، أبو الفلاح (المتوفى: 1089هـ)	ShamAY	12398	0.35268
		المختلطين للعلائي	صلاح الدين أبو سعيد خليل بن كيكلدي بن عبد الله الدمشقي العلائي (المتوفى: 761ه)	ShamelaY19	25846	0.35204
		شرح طيبة النشر في القراءات العشر	محمد بن محمد بن محمد، أبو القاسم، محب الدين النُّوَيْري (المتوفى: 857هـ)	ShamAY	1527	0.35038
		غريب القرآن في شعر العرب ((مسائل نافع بن الأزرق لعبد الله بن عباس - رضي الله عنه وعن أبيه))	عن الصحابي عبد الله بن عباس بن عبد المطلب القرشي الهاشمي، أبو العباس (المتوفى: 68ه) - رضي الله عنهما	ShamelaY19	23622	0.35
		 الذريعة 	 آقا بزرگ الطهراني 	ABLibrary	865	0.34989
		 الذريعة 	 آقا بزرگ الطهراني 	ABLibrary	868	0.34758
		غريب القرآن في شعر العرب ((مسائل نافع بن الأزرق لعبد الله بن عباس - رضي الله عنه وعن أبيه))	عن الصحابي عبد الله بن عباس بن عبد المطلب القرشي الهاشمي، أبو العباس (المتوفى: 68ه) - رضي الله عنهما	Sham19Y	23622	0.34675
		الذّريعة إلى تصانيف الشّيعة [ج ٥]	الشيخ آقا بزرك الطهراني	Rafed	444	0.3466
		أهل البيت عليهم السلام في المكتبة العربية	السيّد عبد العزيز الطباطبائي	Rafed	702	0.34643
		نزهة النظر في توضيح نخبة الفكر في مصطلح أهل الأثر	أبو الفضل أحمد بن علي بن محمد بن أحمد بن حجر العسقلاني (المتوفى: 852هـ)	ShamAY	1565	0.34542
		بحار الأنوار [ج ٣١]	الشيخ محمّد باقر بن محمّد تقي المجلسي	Rafed	937	0.34509
		المسائل السروية	الشيخ المفيد	Masaha	4537	0.34314
		 الذريعة 	 آقا بزرگ الطهراني 	ABLibrary	859	0.3423
		مجموعة رسائل العلامة قاسم بن قطلوبغا	أبو الفداء زين الدين قاسم بن قُطْلُوْبَغَا السُّوْدُوْنِي الجمالي الحنفي (المتوفى: 879 هـ)	ShamAY	32450	0.34187
		العجاب في بيان الأسباب	أبو الفضل أحمد بن علي بن محمد بن أحمد بن حجر العسقلاني (المتوفى: 852هـ)	ShamAY	2102	0.3414
		الذّريعة إلى تصانيف الشّيعة [ج ٨]	الشيخ آقا بزرك الطهراني	Rafed	449	0.34107
		غريب القرآن في شعر العرب ((مسائل نافع بن الأزرق لعبد الله بن عباس - رضي الله عنه وعن أبيه))	عن الصحابي عبد الله بن عباس بن عبد المطلب القرشي الهاشمي، أبو العباس (المتوفى: 68هـ) - رضي الله عنهما	ShamAY	23622	0.34054
		الإقتباس من القرآن الكريم [ج ١]	أبي منصور عبد الملك بن محمّد بن اسماعيل الثعالبي	Rafed	3176	0.34036
		رحلة العبدري	أبو عبدالله العبدري	Rafed	2452	0.33828
		البرهان في علوم القرآن [ج ٢]	بدر الدين محمّد بن عبد الله الزّركشي	Rafed	2112	0.33718
		تراثنا ـ العدد [ 16 ]	مؤسسة آل البيت عليهم السلام لإحياء التراث ـ قم	Rafed	2736	0.33709
		 الذريعة 	 آقا بزرگ الطهراني 	ABLibrary	867	0.33682
		كشف النقاب عن مؤلفات الأصحاب	سليمان بن عبد الرحمن بن حمدان (1322 - 1397 ه)	ShamelaY19	147066	0.33671
		البرهان في علوم القرآن [ج ١]	بدر الدين محمّد بن عبد الله الزّركشي	Rafed	2086	0.33655
		العواصم والقواصم في الذب عن سنة أبي القاسم	ابن الوزير، محمد بن إبراهيم بن علي بن المرتضى بن المفضل الحسني القاسمي، أبو عبد الله، عز الدين، من آل الوزير (المتوفى: 840ه)	Sham19Y	29677	0.33639
		المسالِك في شرح مُوَطَّأ مالك	القاضي محمد بن عبد الله أبو بكر بن العربي المعافري الاشبيلي المالكي (المتوفى: 543هـ)	ShamAY	31743	0.33625
		المِنَحُ الشَّافِيات بِشَرْحِ مُفْردَاتِ الإمَامِ أحْمَد	منصور بن يونس بن صلاح الدين ابن حسن بن إدريس البهوتى الحنبلى (المتوفى: 1051هـ)	ShamAY	31805	0.33609
		 رحلة العبدري 	 أبو عبد الله العبدري 	ABLibrary	9101	0.33597
		 الذريعة 	 آقا بزرگ الطهراني 	ABLibrary	851	0.33525
		المنح الشافيات بشرح مفردات الإمام أحمد	منصور بن يونس بن صلاح الدين ابن حسن بن إدريس البهوتى الحنبلى (المتوفى: 1051ه)	Sham19Y	6538	0.33515
		العواصم والقواصم في الذب عن سنة أبي القاسم	ابن الوزير، محمد بن إبراهيم بن علي بن المرتضى بن المفضل الحسني القاسمي، أبو عبد الله، عز الدين، من آل الوزير (المتوفى: 840هـ)	ShamAY	3	0.33467
		 الذريعة 	 آقا بزرگ الطهراني 	ABLibrary	860	0.33467
		الإعلام بفوائد عمدة الأحكام	ابن الملقن سراج الدين أبو حفص عمر بن علي بن أحمد الشافعي المصري (المتوفى: 804هـ)	ShamAY	31785	0.33416
		النقد والبيان في دفع أوهام خزيران	محمد كامل القصاب	ShamAY	10276	0.334
		الشفا بتعريف حقوق المصطفى - ت كوشك	عياض بن موسى بن عياض بن عمرون اليحصبي السبتي، أبو الفضل	ShamAY	38635	0.33394
		مختصر عجائب الدنيا	الشيخ إبراهيم بن وصيف شاه	Rafed	2460	0.33342
		 مختصر عجائب الدنيا 	 الشيخ إبراهيم بن وصيف شاه 	ABLibrary	9180	0.33263
		أهل البيت عليهم السلام في المكتبة العربية	السيد عبد العزيز الطباطبائي	Masaha	1942	0.33254
		المختلطين للعلائي	صلاح الدين أبو سعيد خليل بن كيكلدي بن عبد الله الدمشقي العلائي (المتوفى: 761هـ)	ShamAY	25846	0.33229
		منهج الدميري في كتابه حياة الحيوان	إبراهيم بن عبد الله المديهش	ShamelaY19	145430	0.33213
		الذّريعة إلى تصانيف الشّيعة [ج ٧]	الشيخ آقا بزرك الطهراني	Rafed	448	0.33148
		التحبير لإيضاح معاني التيسير	محمد بن إسماعيل بن صلاح بن محمد الحسني، الكحلاني ثم الصنعاني، أبو إبراهيم، عز الدين، المعروف كأسلافه بالأمير (المتوفى: 1182ه)	Sham19Y	14309	0.33145
		التَّحبير لإيضَاح مَعَاني التَّيسير	محمد بن إسماعيل بن صلاح بن محمد الحسني، الكحلاني ثم الصنعاني، أبو إبراهيم، عز الدين، المعروف كأسلافه بالأمير (المتوفى: 1182هـ)	ShamAY	32163	0.33136
		 الأدوية المفردة في كتاب القانون في الطب لابن سينا 	 أبو علي سينا 	ABLibrary	9855	0.33113
		إعلام الموقعين عن رب العالمين ت مشهور	أبو عبد الله محمد بن أبي بكر بن أيوب المعروف بابن قيم الجوزية (المتوفى: 751 هـ)	ShamAY	32703	0.33087
		 نشر المحاسن الغالية في فضائل مشايخ الصوفية أصحاب المقامات العالية 	 عبد الله بن أسعد اليافعي اليمني المكي 	ABLibrary	8801	0.33079
		 الذريعة 	 آقا بزرگ الطهراني 	ABLibrary	853	0.33052
		تقرير القواعد وتحرير الفوائد [المشهور بـ «قواعد ابن رجب»]	زين الدين عبد الرحمن بن أحمد بن رجب الحنبلي (المتوفى: 795 هـ)	ShamAY	37983	0.33039
		ترجمة شيخ الإسلام ابن تيمية من "سير أعلام النبلاء" القسم المفقود	شمس الدين أبو عبد الله محمد بن أحمد بن عثمان بن قَايْماز الذهبي (المتوفى: 748هـ)	ShamAY	34384	0.33
		تراثنا ـ العدد [ 17 ]	مؤسسة آل البيت عليهم السلام لإحياء التراث ـ قم	Rafed	2737	0.32932
		المدخل المفصل لمذهب الإمام أحمد	بكر أبو زيد	ShamelaY19	23611	0.32907
		تراثنا ـ العدد [ 4 ]	مؤسسة آل البيت عليهم السلام لإحياء التراث ـ قم	Rafed	2550	0.3286
		الاعتصام للشاطبي ت الشقير والحميد والصيني	إبراهيم بن موسى بن محمد اللخمي الغرناطي الشهير بالشاطبي (المتوفى: 790ه)	Sham19Y	36558	0.3285
		تراثنا ـ العدد [ 15 ]	مؤسسة آل البيت عليهم السلام لإحياء التراث ـ قم	Rafed	2729	0.32845
		شعراء الغدير في القرن - الجزء7	الشيخ عبد الحسين الأميني النجفي	Masaha	313	0.32841
		تراثنا ـ العدد [ 20 ]	مؤسسة آل البيت عليهم السلام لإحياء التراث ـ قم	Rafed	2740	0.32831
		 مسالك الأبصار في ممالك الأمصار 	 أحمد بن يحيى العمري 	ABLibrary	9192	0.32817
		قواعد الأحكام في معرفة الحلال و الحرام - الجزء1	العلامة الحلي	Masaha	760	0.328
		الذّريعة إلى تصانيف الشّيعة [ج ٢٣]	الشيخ آقا بزرك الطهراني	Rafed	499	0.32764
		ميزان الأصول في نتائج العقول	علاء الدين شمس النظر أبو بكر محمد بن أحمد السمرقندي (المتوفى: 539 هـ)	ShamAY	37996	0.32757
		الاعتصام للشاطبي ت الشقير والحميد والصيني	إبراهيم بن موسى بن محمد اللخمي الغرناطي الشهير بالشاطبي (المتوفى: 790هـ)	ShamAY	445	0.32752
		الذّريعة إلى تصانيف الشّيعة [ج ١٦]	الشيخ آقا بزرك الطهراني	Rafed	471	0.32744
		المسالك في شرح موطأ مالك	القاضي محمد بن عبد الله أبو بكر بن العربي المعافري الاشبيلي المالكي (المتوفى: 543ه)	ShamelaY19	123665	0.32557
		رياض الأفهام في شرح عمدة الأحكام	أبو حفص عمر بن علي بن سالم بن صدقة اللخمي الإسكندري المالكي، تاج الدين الفاكهاني (المتوفى: 734هـ)	ShamAY	32274	0.3254
		 فتوح الغيب 	 عبد القادر الجيلاني 	ABLibrary	8722	0.32533
		تحفة الترك فيما يجب أن يعمل في الملك	إبراهيم بن علي بن أحمد بن عبد الواحد ابن عبد المنعم الطرسوسي، نجم الدين الحنفي (المتوفى: 758هـ)	ShamAY	1044	0.32532
		تعريف بشروح الكتب الستة	أبو عبد العزيز الحربي	ShamAY	35959	0.32524
		الإشارة إلى سيرة المصطفى وتاريخ من بعده من الخلفا	مغلطاي بن قليج بن عبد الله البكجري المصري الحكري الحنفي، أبو عبد الله، علاء الدين (المتوفى: 762هـ)	ShamAY	31700	0.32517
		التراتيب الإدارية والعمالات والصناعات والمتاجر والحالة العلمية التي كانت على عهد تأسيس المدنية الإسلامية في المدينة المنورة العلمية	محمد عَبْد الحَيّ بن عبد الكبير ابن محمد الحسني الإدريسي، المعروف بعبد الحي الكتاني (المتوفى: 1382هـ)	ShamAY	23688	0.32515
		خطط الشام [ج ٤]	محمّد كرد علي	Rafed	2282	0.32515
		نظام الحكومة النبوية - الجزء1	عبد الحي الكتاني‏	Masaha	3105	0.32514
		الاعتقاد الخالص من الشك والانتقاد	علي بن إبراهيم بن داود بن سلمان بن سليمان، أبو الحسن، علاء الدين ابن العطار (المتوفى: 724هـ)	ShamAY	32187	0.32494
		 أعيان الشيعة 	 السيد محسن الأمين 	ABLibrary	80	0.32493
		السر المكتوم في الفرق بين المالين المحمود والمذموم ويليه جواب في الجمع بين حديثين، هما: دعاؤه صلى الله عليه وسلم لأنس بن مالك بكثرة المال والولد، وحديث دعائه بذلك على من لم يؤمن به ويصدقه	شمس الدين أبو الخير محمد بن عبد الرحمن بن محمد بن أبي بكر بن عثمان بن محمد السخاوي (المتوفى: 902هـ)	ShamAY	1500	0.32488
		نظرة في كتاب منهاج السنّة النبويّة لابن تيميّة الحرّاني	العلامة الأميني	Rafed	3418	0.32477
		التدريب في الفقه الشافعي المسمى بـ «تدريب المبتدي وتهذيب المنتهي»	سراج الدين أبي حفص عمر بن رسلان البلقيني الشافعي	ShamAY	37991	0.32473
		الدعوة في كلمة التوحيد	الشيخ محمّد صالح	Rafed	1956	0.32449
		الغدير في الكتاب والسنّة والأدب [ج ٦]	الشيخ عبد الحسين أحمد الأميني النجفي	Rafed	2011	0.3244
		الجواهر والدرر في ترجمة شيخ الإسلام ابن حجر	شمس الدين أبو الخير محمد بن عبد الرحمن بن محمد بن أبي بكر بن عثمان بن محمد السخاوي (المتوفى: 902هـ)	ShamAY	32249	0.32436
		 الذريعة 	 آقا بزرگ الطهراني 	ABLibrary	852	0.32435
		الذّريعة إلى تصانيف الشّيعة [ج ٢٤]	الشيخ آقا بزرك الطهراني	Rafed	503	0.32432
		 الذريعة 	 آقا بزرگ الطهراني 	ABLibrary	845	0.32427
		العواصم والقواصم في الذب عن سنة أبي القاسم	ابن الوزير، محمد بن إبراهيم بن علي بن المرتضى بن المفضل الحسني القاسمي، أبو عبد الله، عز الدين، من آل الوزير (المتوفى: 840ه)	ShamelaY19	29677	0.32405
		 الشافي في شرح الكافي 	 المولى خليل القزويني 	ABLibrary	7921	0.32395
		المدخل المفصل لمذهب الإمام أحمد وتخريجات الأصحاب	بكر بن عبد الله أبو زيد بن محمد بن عبد الله بن بكر بن عثمان بن يحيى بن غيهب بن محمد (المتوفى: 1429هـ)	ShamAY	23611	0.32391
		تراثنا ـ العددان [ 66 و 67 ]	مؤسسة آل البيت عليهم السلام لإحياء التراث ـ قم	Rafed	3298	0.3239
		التراتيب الإدارية والعمالات والصناعات والمتاجر والحالة العلمية التي كانت على عهد تأسيس المدنية الإسلامية في المدينة المنورة العلمية	محمد عبد الحي بن عبد الكبير ابن محمد الحسني الإدريسي، المعروف بعبد الحي الكتاني (المتوفى: 1382ه)	ShamelaY19	23688	0.32346
		تعليم المتعلم طريق التعلم	برهان الإسلام الزرنوجي	ShamAY	36026	0.32333
		رسائل آل طوق القطيفي [ج ٤]	الشيخ أحمد آل طوق	Rafed	1410	0.32317
		مختلف الشيعة في أحكام الشريعة - الجزء1	العلامة الحلي	Masaha	841	0.3231
		كتاب الجواهر الثمينة في محاسن المدينة	محمّد كبريت الحسيني المدني	Rafed	2347	0.32307
		بحوث ومقالات في اللغة والأدب وتقويم النصوص (مقالات محمد أجمل الإصلاحي)	د. محمد أجمل أيوب الإصلاحي	Sham19Y	18270	0.32286
		تراثنا ـ العدد [ 61 ]	مؤسسة آل البيت عليهم السلام لإحياء التراث ـ قم	Rafed	3249	0.3228
		شرح الأربعين النووية [من بداية شرح الحديث 29 إلى نهاية شرح الحديث 35]	المناوي، عبد الرؤوف	Sham19Y	133377	0.32277
		اهل البيت في المكتبة العربية	عبدالعزيز طباطبايي	Ghbook	9167	0.32271
		إفراد أحاديث اسماء الله وصفاته - غير صفات الأفعال - في الكتب الستة	حصة بنت عبد العزيز الصغير	ShamelaY19	133370	0.32256
		 نظرة في كتاب منهاج السنة النبوية ( من فيض الغدير ) 	 الشيخ الأميني 	ABLibrary	8666	0.32251
		 خطط الشام 	 محمد كرد علي 	ABLibrary	9057	0.32223
		الرَّوضُ البَاسمْ في الذِّبِّ عَنْ سُنَّةِ أبي القَاسِم - صَلَّى اللَّهُ عَلَيْهِ وَسَلَّمَ -	ابن الوزير، محمد بن إبراهيم بن علي بن المرتضى بن المفضل الحسني القاسمي، أبو عبد الله، عز الدين، من آل الوزير (المتوفى: 840هـ)	ShamAY	28	0.3222
		 أدب الطف أو شعراء الحسين ( ع ) 	 جواد شبر 	ABLibrary	7403	0.32205
		 المقنع في الإمامة 	 الشيخ عبيد الله بن عبد الله السد آبادي 	ABLibrary	8640	0.3218
		تبصرة الفقهاء [ج ١]	الشيخ محمد تقي الرازي النجفي الاصفهاني	Rafed	1328	0.32173
		الحديث النبوي في النحو العربي	الدكتور محمود فجال	Rafed	1991	0.32163
		 نفح الطيب من غصن الأندلس الرطيب 	 أحمد بن محمد المقري التلمساني 	ABLibrary	9300	0.32161
		الذّريعة إلى تصانيف الشّيعة [ج ١٨]	الشيخ آقا بزرك الطهراني	Rafed	484	0.32147
		الإصابة في تمييز الصحابة [ج ١]	أحمد بن علي بن حجر العسقلاني	Rafed	3386	0.32128
		 تبصرة الفقهاء 	 الشيخ محمد تقي الرازي الأصفهاني 	ABLibrary	9361	0.32126
		المسائل الماردينية - وهي مسائل يكثر وقوعها ويحصل الابتلاء بها	تقي الدين أبو العباس أحمد بن عبد الحليم بن عبد السلام بن عبد الله بن أبي القاسم بن محمد ابن تيمية الحراني الحنبلي الدمشقي (المتوفى: 728ه)	Sham19Y	96844	0.32103
		الغاية في اختصار النهاية	عز الدين عبد العزيز بن عبد السلام السلمي (المتوفى: 660 ه)	ShamelaY19	127703	0.32094
		أدب الطّف أو شعراء الحسين عليه السلام [ج ٥]	جواد شبّر	Rafed	367	0.32047
		جواب الحافظ أبى محمد عبد العظيم المنذري المصري عن أسئلة فى الجرح والتعديل	عبد العظيم بن عبد القوي بن عبد الله، أبو محمد، زكي الدين المنذري (المتوفى: 656هـ)	ShamAY	9863	0.32046
		التوضيح لشرح الجامع الصحيح	ابن الملقن سراج الدين أبو حفص عمر بن علي بن أحمد الشافعي المصري (المتوفى: 804ه)	Sham19Y	13252	0.32044
		إرشاد الأذهان إلى أحكام الإيمان - الجزء1	العلامة الحلي	Masaha	749	0.32032
		تراثنا ـ العدد [ 25 ]	مؤسسة آل البيت عليهم السلام لإحياء التراث ـ قم	Rafed	2745	0.32021
		التوضيح لشرح الجامع الصحيح	ابن الملقن سراج الدين أبو حفص عمر بن علي بن أحمد الشافعي المصري (المتوفى: 804هـ)	ShamAY	31764	0.32013
		 الذريعة 	 آقا بزرگ الطهراني 	ABLibrary	857	0.32012
		شرح أبيات سيبويه [ج ١]	أبي محمّد يوسف بن أبي سعيد السيرافي	Rafed	2243	0.32011
		أدب الطّف أو شعراء الحسين عليه السلام [ج ٤]	جواد شبّر	Rafed	365	0.32006
		شم العوارض في ذم الروافض	علي بن (سلطان) محمد، أبو الحسن نور الدين الملا الهروي القاري (المتوفى: 1014ه)	ShamelaY19	37559	0.31996
		شرح الإلمام بأحاديث الأحكام	تقي الدين أبو الفتح محمد بن علي بن وهب بن مطيع القشيري، المعروف بابن دقيق العيد (المتوفى: 702 هـ)	ShamAY	32554	0.3199
		المشوق إلى القراءة وطلب العلم	علي بن محمد بن حسين العِمران	ShamAY	12300	0.31988
		النكت في المسائل المختلف فيها بين الشافعي وأبي حنيفة للشيرازي (التطوع - الاعتكاف)	الشيرازي، أبو إسحاق	ShamAY	36430	0.31985
		 نزهة الأذهان في إصلاح الأبدان 	 الشيخ داود الأنطاكي 	ABLibrary	9959	0.31975
		تراثنا ـ العدد [ 34 ]	مؤسسة آل البيت عليهم السلام لإحياء التراث ـ قم	Rafed	2785	0.31956
		 الجواهر الثمينة في محاسن المدنية 	 محمد كبريت الحسيني المدني 	ABLibrary	9033	0.31955
		الإيجاز في شرح سنن أبي داود السجستاني رحمه الله تعالى	أبو زكريا محيي الدين يحيى بن شرف النووي (المتوفى: 676هـ)	ShamAY	31678	0.31951
		 دلائل الصدق لنهج الحق 	 الشيخ محمد حسن المظفر 	ABLibrary	939	0.31947
		لوائح الأنوار السنية ولواقح الأفكار السنية «شرح قصيدة ابن أبي داود الحائية في عقيدة أهل الآثار السلفية»	محمد بن أحمد بن سالم السفاريني الحنبلي	ShamAY	38505	0.31946
