automatic URI	Proposed URI	bookTitle	authorName	collection	id	tfidf
		بحار الأنوار [ج ٥٨]	الشيخ محمّد باقر بن محمّد تقي المجلسي	Rafed	1047	0.26777
		 دلائل الصدق لنهج الحق 	 الشيخ محمد حسن المظفر 	ABLibrary	940	0.26776
		روح المعاني [ج ١]	أبي الفضل شهاب الدين السيّد محمود الألوسي البغدادي	Rafed	3178	0.26776
		المنتقى من فرائد الفوائد	محمد بن صالح بن محمد العثيمين (المتوفى: 1421ه)	ShamelaY19	21802	0.26774
		الميزان في تفسير القرآن [ج ٢]	آية الله السيد محمد حسين الطباطبائي	Rafed	67	0.26774
		قاعدة لا ضرر و اليد و الصحة و القرعة	الشيخ مرتضى الأنصاري	Masaha	1642	0.26772
		ثلاث صلوات عظيمة مهجورة فأحيها يا عبد الله	عدنان بن محمد آل عرعور	ShamelaY19	147912	0.26771
		النخبة في الحكمة العملية و الأحكام الشرعية	الفيض الكاشاني	Masaha	1265	0.26771
		الرد الأمين على كُتب عُمر أُمّة الإسلام وردّ السهام والقول المبين	شريف مراد أبو عمرو	ShamAY	1247	0.2677
		الباعث على إنكار البدع والحوادث	أبو القاسم شهاب الدين عبد الرحمن بن إسماعيل بن إبراهيم المقدسي الدمشقي المعروف بأبي شامة (المتوفى: 665هـ)	ShamAY	6276	0.2677
		الرحلة المعينيّة	ماء العينين بن العتيق	Rafed	2198	0.2677
		حقوق الإنسان	محمد الغزالي	ShamAY	36044	0.26769
		منظومة مفردات أحمد	محمد بن علي العمري المقدسي	ShamAY	37377	0.26769
		تاريخ الإسلام ووفيات المشاهير والأعلام [ج ٢٩]	شمس الدين محمّد بن أحمد بن عثمان الذّهبي	Rafed	3559	0.26769
		 الضوء اللامع لأهل القرن التاسع 	 شمس الدين السخاوي 	ABLibrary	948	0.26768
		الفصول العشره في الغيبه	محمد بن  محمد بن نعمان شيخ مفيد	Ghbook	6616	0.26768
		مباحث الأمر التي انتقدها شيخ الإسلام ابن تيمية في مجموع الفتاوى	سليمان بن سليم الله الرحيلي	ShamAY	3552	0.26767
		الشعور بالعور	صلاح الدين خليل بن أيبك بن عبد الله الصفدي (المتوفى: 764هـ)	ShamAY	6939	0.26764
		 الكشف عن مناهج الأدلة في عقائد الملة 	 ابن رشد 	ABLibrary	8577	0.26764
		المنهل الحديث في شرح الحديث	الأستاذ الدكتور موسى شاهين لاشين	ShamAY	38845	0.26763
		المنهج الحركي في ظلال القرآن	علي بن نايف الشحود	ShamAY	36744	0.26763
		الرسائل السياسية	عمرو بن بحر بن محبوب الكناني بالولاء، الليثي، أبو عثمان، الشهير بالجاحظ (المتوفى: 255ه)	Sham19Y	10709	0.26763
		حاشية التوضيح والتصحيح لمشكلات كتاب التنقيح على شرح تنقيح الفصول في الأصول (لشهاب الدين القرافي ت 684 ه)	محمد الطاهر بن عاشور (المتوفى: 1393 ه)	ShamelaY19	150938	0.26761
		الروضة البهية (حاشية سلطان العلماء) - الجزء1	الشهيد الثاني	Masaha	1142	0.2676
		خزانة الأدب ولب لباب لسان العرب للبغدادي - العلمية	عبد القادر بن عمر البغدادي	ShamAY	33782	0.26759
		أبحاث هيئة كبار العلماء	هيئة كبار العلماء بالمملكة العربية السعودية	ShamelaY19	21759	0.26759
		حاشية على مختلف الشيعة (للعلامة)	السيد محمد باقر الميرداماد	Masaha	1268	0.26759
		محمد تقي العثماني القاضي الفقيه والداعية الرحالة	لقمان الحكيم	ShamAY	38619	0.26758
		شرح الأربعين النووية - عبد الكريم الخضير	عبد الكريم الخضير	ShamelaY19	23423	0.26758
		تاريخ الإسلام ووفيات المشاهير والأعلام [ج ٤١]	شمس الدين محمّد بن أحمد بن عثمان الذّهبي	Rafed	3604	0.26758
		المأتم الحسيني مشروعيته وأسراره	السيد عبد الحسين شرف الدين	Masaha	393	0.26758
		فقه الزكاة	يوسف القرضاوي	ShamAY	36406	0.26755
		جامع المسائل لابن تيمية ط عالم الفوائد - المجموعة السابعة	شيخ الإسلام أحمد بن عبد الحليم بن عبد السلام ابن تيمية (661 - 728 هـ)	ShamAY	37973	0.26755
		تاريخ النّياحة على الإمام الشهيد الحسين بن علي عليهما السلام [ج ١]	السيد صالح الشهرستاني	Rafed	281	0.26754
		أبكار الأفكار في أصول الدين	علي بن محمد بن سالم التغلبي، أبو الحسن، سيف الدين الآمدي (المتوفى: 631 هـ)	ShamAY	33900	0.26753
		مرشد الزوار الى قبور الابرار	موفق الدين أبو محمد بن عبد الرحمن، ابن الشيخ أبي الحرم مكي بن عثمان الشارعي الشافعي (المتوفى: 615ه)	Sham19Y	11789	0.26753
		الأفضليات	علي بن منجب بن سليمان، أبو القاسم، تاج الرياسة، ابن الصيرفي (المتوفى: 542ه)	Sham19Y	5432	0.26753
		موضوعات خطبة الجمعة	عبد الرحمن بن معلا اللويحق	Sham19Y	31072	0.26752
		الفرقان في تفسير القرآن بالقرآن والسنة [ج ٦]	الشيخ محمد الصادقي	Rafed	3016	0.26751
		أحاديث لعلي بن عمر الحربي في آخر السادس من كتاب المناسك الكبير عن أحمد بن حنبل - مخطوط	أبو الحسن علي بن عمر السكري الحربي	ShamAY	32958	0.2675
		فتاوى الأئمة في النوازل المدلهمة، وتبرئة دعوة وأتباع محمد بن عبدالوهاب من تهمة التطرف والإرهاب	محمد بن حسين بن سعيد بن هادي بن عبد الرحمن بن محمد بن حسن بن سفران القحطاني	ShamAY	847	0.2675
		تفسير التّحرير والتّنوير [ج ١١]	الشيخ محمّد الطاهر ابن عاشور	Rafed	2915	0.26748
		الأحاديث المرفوعة والموقوفة في كتاب «حياة الحيوان الكبرى» للدميري، من بداية حرف (التاء) إلى نهاية حرف (الجيم)، تخريجا ودراسة	إبراهيم بن عبد الله المديهش	Sham19Y	97978	0.26748
		التفسير المنير [ج ٢]	الدكتور وهبة الزحيلي	Rafed	2943	0.26745
		فتاوى الشيخ أبي عبد المعز محمد علي فركوس الجزائري	محمد علي فركوس الجزائري	ShamAY	37665	0.26744
		إرشاد العباد إلى معاني لمعة الاعتقاد	عبد الرحمن بن ناصر بن براك بن إبراهيم البراك	ShamelaY19	18604	0.26744
		تفسير التّحرير والتّنوير [ج ٢٨]	الشيخ محمّد الطاهر ابن عاشور	Rafed	2937	0.26744
		 عنقا مغرب في ختم الأولياء وشمس المغرب 	 ابن عربي 	ABLibrary	8734	0.26743
		تهنئة أهل الإسلام بتجديد بيت الله الحرام	إبراهيم بن محمّد بن عيسى الميموني	Rafed	2234	0.26743
		مباني الفقيه‏	الشيخ محمد تقي الفقيه	Masaha	4270	0.26743
		منطلقات طالب العلم	أبو العلاء محمد بن حسين بن يعقوب السلفي المصري	Sham19Y	98137	0.26742
		البحر المديد في تفسير القرآن المجيد [ج ٤]	أحمد بن محمد بن عجيبة	Rafed	3805	0.2674
		تاريخ الإسلام ووفيات المشاهير والأعلام [ج ٣٦]	شمس الدين محمّد بن أحمد بن عثمان الذّهبي	Rafed	3581	0.2674
		الفتوى الحموية الكبرى	تقي الدين أبو العَباس أحمد بن عبد الحليم بن عبد السلام بن عبد الله بن أبي القاسم بن محمد ابن تيمية الحراني الحنبلي الدمشقي (المتوفى: 728هـ)	ShamAY	18381	0.26739
		شَوَاهِد التَّوضيح وَالتَّصحيح لمشكلات الجامع الصَّحيح	محمد بن عبد الله، ابن مالك الطائي الجياني، أبو عبد الله، جمال الدين (المتوفى: 672هـ)	ShamAY	31625	0.26739
		الرد المفحم على من خالف العلماء وتشدد وتعصب وألزم المرأة أن تستر وجهها وكفيها وأوجب ولم يقنع بقولهم: إنه سنة ومستحبة	محمد ناصر الدين الألباني (المتوفى: 1420هـ)	ShamAY	314	0.26738
		دروس للشيخ محمد المنجد	محمد صالح المنجد	ShamAY	419	0.26738
		 موسوعة مرآة الحرمين الشريفين وجزيرة العرب 	 أيوب صبري باشا 	ABLibrary	9289	0.26738
		الفرقان في تفسير القرآن بالقرآن والسنّة [ج ٢٥]	الشيخ محمد الصادقي	Rafed	3050	0.26738
				ShamAY	38974	0.26737
		نظرات في القرآن الكريم	محمد الغزالي	ShamAY	36730	0.26737
		معجم متن اللغة (موسوعة لغوية حديثة)	أحمد رضا (عضو المجمع العلمي العربي بدمشق)	ShamAY	38979	0.26737
		تاج العروس [ج ١٨]	محبّ الدين أبي فيض السيد محمّد مرتضى الحسيني الواسطي الزبيدي الحنفي	Rafed	1591	0.26737
		إرشاد السالك إلى أفعال المناسك	برهان الدين إبراهيم بن فرحون المدني المالكي (المتوفى: 799 ه / 1397 م)	ShamelaY19	132974	0.26735
		 صفوة الإعتبار بمستودع الأمصار والأقطار 	 السيد محمد بيرم الخامس التونسي 	ABLibrary	9130	0.26735
		تفسير التّحرير والتّنوير [ج ٩]	الشيخ محمّد الطاهر ابن عاشور	Rafed	2913	0.26735
		الإنصاف في معرفة الراجح من الخلاف (المطبوع مع المقنع والشرح الكبير)	علاء الدين أبو الحسن علي بن سليمان بن أحمد المَرْداوي (المتوفى: 885 هـ)	ShamAY	37990	0.26734
		دلائل الإعجاز في علم المعاني	أبو بكر عبد القاهر بن عبد الرحمن بن محمد الفارسي الأصل، الجرجاني الدار (المتوفى: 471هـ)	ShamAY	1040	0.26734
		عليّ المرتضى نقطة باء البسملة	السيّد عادل العلوي	Rafed	1582	0.26734
		رسالة الغفران ـ موافقا للمطبوع	أحمد بن عبد الله بن سليمان بن محمد التنوخي، المعروف بأبي العلاء	ShamAY	33783	0.26733
		خزانة الأدب ولب لباب لسان العرب للبغدادي	عبد القادر بن عمر البغدادي (المتوفى: 1093هـ)	ShamAY	12732	0.26733
		 البحر المحيط في أصول الفقه 	 الزركشي 	ABLibrary	802	0.26733
		الأزهر في ألف عام‏  - الجزء1	د. محمد عبد المنعم الخفاجي	Masaha	3710	0.26733
		قواعد التجويد على رواية حفص عن عاصم بن أبي النجود	عبد العزيز بن عبد الفتاح القارئ	ShamAY	11301	0.26732
		الهسهسة بنقض الوضوء بالقهقهة	الإمام محمد عبد الحي اللكنوي (ت1304هـ)	ShamAY	36013	0.26732
		فرائد الأصول - الجزء1	الشيخ مرتضى الأنصاري	Masaha	4022	0.26731
		اصطلاحات الأصول ومعظم أبحاثها	الشيخ علي المشكيني	Masaha	2383	0.26731
		 موسوعة أحكام الأطفال وأدلتها 	 مركز فقه الأئمة الأطهار ( ع ) 	ABLibrary	9673	0.2673
		تفسير الثعالبي - مؤسسة الأعلمي	عبد الرحمن بن محمد بن مخلوف الثعالبي	ShamAY	34066	0.26729
		مجلة لغة العرب العراقية - مجلة شهرية أدبية علمية تاريخية	أنستاس الكرملي	Sham19Y	36540	0.26729
		رسائل الشريف المرتضى [ج ١]	علي بن الحسين الموسوي العلوي [ الشريف المرتضى علم الهدى ]	Rafed	3614	0.26728
		النافلة في الأحاديث الضعيفة والباطلة	أبو إسحاق الحويني الأثري حجازي محمد شريف	ShamAY	10024	0.26727
		النّحو الوافي [ج ١]	عبّاس حسن	Rafed	2576	0.26726
		رسائل المحقق الكركي - الجزء1	علي بن الحسين‏ المحقق الكركي	Masaha	1162	0.26726
		الأمة الوسط والمنهاج النبوي في الدعوة إلى الله	عبد الله بن عبد المحسن بن عبد الرحمن التركي	Sham19Y	30910	0.26726
		الاربعون حديثا في اثبات امامه اميرالمومنين عليه السلام 	عبدالله بحراني اصفهاني	Ghbook	15555	0.26726
		الروح في الكلام على أرواح الأموات والأحياء بالدلائل من الكتاب والسنة	محمد بن أبي بكر بن أيوب بن سعد شمس الدين ابن قيم الجوزية (المتوفى: 751هـ)	ShamAY	6462	0.26725
		أدب الاختلاف في الإسلام	طه جابر فياض العلواني	ShamAY	1523	0.26725
		 مجموع رسائل الإمام الهادي إلى الحق القويم يحيى بن الحسين بن قاسم بن إبراهيم 	 الإمام يحيى بن الحسين 	ABLibrary	8590	0.26725
		 تحقيق ما للهند 	 أبو ريحان البيروني 	ABLibrary	9023	0.26724
		كتاب الصلاة (للشيخ الأنصاري) - الجزء1	الشيخ مرتضى الأنصاري	Masaha	828	0.26724
		مناهل العرفان في علوم القرآن	محمد عبد العظيم الزُّرْقاني (المتوفى: 1367هـ)	ShamAY	7249	0.26723
		الناسخ والمنسوخ في القرآن العزيز وما فيه من الفرائض والسنن	أبو عُبيد القاسم بن سلاّم بن عبد الله الهروي البغدادي (المتوفى: 224هـ)	ShamAY	1178	0.26722
		شرح ألفية العراقي - عبد الكريم الخضير	عبد الكريم الخضير	ShamelaY19	23769	0.26722
		 مرشد المغترب 	 السيد محمد سعيد الحكيم 	ABLibrary	9617	0.26721
		النظرات	مصطفى لطفي بن محمد لطفي بن محمد حسن لطفي المَنْفَلُوطي (المتوفى: 1343هـ)	ShamAY	11400	0.2672
				ShamAY	37976	0.2672
		الانتصار لأهل الحديث - بازمول	محمد بن عمر بازمول	ShamAY	37364	0.2672
		تيسير البيان لأحكام القرآن	محمد بن علي بن عبد الله بن إبراهيم بن الخطيب اليمني الشافعي المشهور بـ «ابن نور الدين» (المتوفى: 825 هـ)	ShamAY	37998	0.2672
		العقد الثّمين في تاريخ البلد الأمين [ج ٣]	تقي الدين محمّد بن أحمد الحسني الفاسي المكّي	Rafed	2217	0.2672
		التفسير بالبيان المتصل في القرآن الكريم	بسمة بنت عبد الله الكنهل	ShamelaY19	148082	0.26719
		الرد على شبهات المستعينين بغير الله	أحمد بن إبراهيم بن حمد بن محمد بن حمد بن عبد الله بن عيسى (المتوفى: 1327ه)	Sham19Y	7625	0.26719
		الفردوس الاعلي	محمد حسين آل كاشف الغطاء	Ghbook	11123	0.26719
		جماليات المفردة القرآنية	أحمد ياسوف	ShamelaY19	37654	0.26718
		التحقيق العجيب في التثويب	الإمام محمد عبد الحي اللكنوي (ت1304هـ)	ShamAY	36005	0.26717
		مختصر سنا البرق الشامي	الفتح بن علي بن محمد البنداري الأصفهاني، أبو إبراهيم (المتوفى: 643هـ)	ShamAY	5400	0.26716
		ظاهرة ضعف الإيمان	محمد صالح المنجد	ShamelaY19	36391	0.26716
		الإمام البخاري وكتابه الجامع الصحيح	عبد المحسن بن حمد بن عبد المحسن بن عبد الله بن حمد العباد البدر	ShamAY	8772	0.26715
		البحث المسفر عن تحريم كل مسكر ومفتر	محمد بن علي بن محمد بن عبد الله الشوكاني اليمني (المتوفى: 1250هـ)	ShamAY	7566	0.26714
		خصائص التعبير القرآني وسماته البلاغية	عبد العظيم إبراهيم محمد المطعني (المتوفى: 1429ه)	ShamelaY19	21785	0.26713
		الفوائد الطوسية	الحر العاملي	Masaha	1263	0.26713
		 بحار الأنوار 	 العلامة المجلسي 	ABLibrary	750	0.26712
		 الفقه ومسائل طبية 	 الشيخ محمد آصف المحسني 	ABLibrary	9737	0.26712
		الغدير في الكتاب والسنّة والأدب [ج ١١]	الشيخ عبد الحسين أحمد الأميني النجفي	Rafed	2024	0.26711
		السنة المفترى عليها	سالم البهنساوي (المتوفى: 1427ه)	ShamelaY19	95845	0.2671
		 النسخ والبداء في الكتاب والسنة ورسالة حول حجية أحاديث وأقوال العترة الطاهرة ( ع ) 	 تقرير بحث الشيخ السبحاني لمحمد حسين الحاج العاملي 	ABLibrary	8661	0.2671
		مجلة البحوث الإسلامية - مجلة دورية تصدر عن الرئاسة العامة لإدارات البحوث العلمية والإفتاء والدعوة والإرشاد	الرئاسة العامة لإدارات البحوث العلمية والإفتاء والدعوة والإرشاد	ShamAY	1991	0.26709
		شرح التسهيل المسمى «تمهيد القواعد بشرح تسهيل الفوائد»	محمد بن يوسف بن أحمد، محب الدين الحلبي ثم المصري، المعروف بناظر الجيش (المتوفى: 778 هـ)	ShamAY	32525	0.26709
		ابن قيم الجوزية وجهوده في خدمة السنة النبوية وعلومها	جمال بن محمد السيد	ShamAY	11401	0.26709
		إنارة الدجى في مغازي خير الورى صلى الله عليه وآله وسلم	حسن بن محمد المشاط المالكي (المتوفى: 1399هـ)	ShamAY	9772	0.26708
		تفسير التّحرير والتّنوير [ج ٢٦]	الشيخ محمّد الطاهر ابن عاشور	Rafed	2935	0.26708
		النفح الشذي في شرح جامع الترمذي	محمد بن محمد بن محمد بن أحمد، ابن سيد الناس، اليعمري الربعي، أبو الفتح، فتح الدين (المتوفى: 734 هـ)	ShamAY	32325	0.26706
		النفح الشذي في شرح جامع الترمذي	محمد بن محمد بن محمد بن أحمد، ابن سيد الناس، اليعمري الربعي، أبو الفتح، فتح الدين (المتوفى: 734 ه)	Sham19Y	7488	0.26706
		الحراب في صدر البهاء و الباب	محمد فاضل	Ghbook	7032	0.26706
		 الطريق إلى الله تعالى ( الشيخ والمريد ) 	 ابن عربي 	ABLibrary	8747	0.26705
		التّفسير الحديث  [ج ٢]	محمّد عزّة دروزة	Rafed	3690	0.26705
		تفسير النيسابوري = غرائب القرآن ورغائب الفرقان	نظام الدين الحسن بن محمد بن حسين القمي النيسابوري (المتوفى: 850ه)	ShamelaY19	23613	0.26704
		التهذيب في اختصار المدونة	خلف بن أبي القاسم محمد، الأزدي القيرواني، أبو سعيد ابن البراذعي المالكي (المتوفى: 372هـ)	ShamAY	8487	0.26703
		تفسير المراغي	أحمد بن مصطفى المراغي (المتوفى: 1371ه)	ShamelaY19	23608	0.26703
		إخبار العلماء بأخبار الحكماء	جمال الدين أبو الحسن علي بن يوسف بن إبراهيم الشيباني القفطي (المتوفى: 646 ه)	ShamelaY19	26336	0.26703
		فتاوى ورسائل سماحة الشيخ عبد الرزاق عفيفي - قسم العقيدة	عبد الرزاق عفيفي (المتوفى: 1415هـ)	ShamAY	8613	0.26702
		التنبيه على الألفاظ التي وقع في نقلها وضبطها تصحيف وخطأ في تفسيرها ومعانيها وتحريف في كتاب الغريبين عن أبي عبيد أحمد بن محمد المؤدب الهروي	محمد بن ناصر بن محمد بن علي، أبو الفضل السلامي (المتوفى: 550ه)	ShamelaY19	38160	0.26702
		الغرر النقية على الدرر البهية	فيصل بن عبد العزيز آل مبارك (المتوفى: 1376 ه)	Sham19Y	29570	0.26701
		إيضاح الفوائد في شرح مشكلات القواعد - الجزء1	فخر المحققين الحلي	Masaha	1080	0.267
		علم التفسير	عبدالمنعم احمد النمر	Ghbook	8748	0.267
		في سبيل العقيدة الإسلامية	عبد اللطيف بن علي بن أحمد بن محمد السلطاني القنطري الجزائري (المتوفى: 1404ه)	Sham19Y	115132	0.26699
		تعريف عام بدين الإسلام	علي بن مصطفى الطنطاوي (المتوفى: 1420ه)	ShamelaY19	37562	0.26698
		اعتقاد أئمة السلف أهل الحديث	محمد بن عبد الرحمن الخميس	ShamAY	7506	0.26697
		الرد على البردة	عبد الله بن عبد الرحمن بن عبد العزيز بن عبد الرحمن بن عبد الله بن سلطان بن خميس الملقب بـ"أبابطين" (المتوفى: 1282هـ)	ShamAY	7620	0.26697
		المفصل في فقه الدعوة إلى الله تعالى	علي بن نايف الشحود	ShamAY	33269	0.26697
		نهاية الأفكار [ج ٣]	الشيخ محمد تقي البروجردي النجفي	Rafed	326	0.26697
		مستند الشّيعة [ج ١٨]	أحمد بن محمّد مهدي النّراقي	Rafed	624	0.26696
		الأذان بين الإصالة والتحريف	السيد علي الشهرستاني	Rafed	1587	0.26694
		في ظلال القرآن [ج ٣]	سيّد قطب	Rafed	3880	0.26693
		دفع الشبه عن الرسول (ص) و الرساله	ابوبكر بن محمد حصني	Ghbook	5310	0.26693
		أصول مهذبة	غلام حسين التبريزي	Masaha	2399	0.26692
		القسم العربي من موقع (الإسلام، سؤال وجواب)	الموقع بإشراف الشيخ محمد صالح المنجد - حفظه الله -	ShamelaY19	26332	0.26691
		الغرر النقية على الدرر البهية	فيصل بن عبد العزيز آل مبارك (المتوفى: 1376 ه)	ShamelaY19	29570	0.2669
		موقف العلماء والمفكرين من الشيعة الإثني عشرية		ShamAY	35318	0.26689
		" إعتقاد أهل السنة " (مخطوط)	أبو بكر بن قاسم بن أبي بكر بن عبد الرحمن الرحبي ت 749 هـ	ShamAY	35900	0.26689
		شرح أصول اعتقاد أهل السنة للالكائي - حسن أبو الأشبال	أبو الأشبال حسن الزهيري آل مندوه المنصوري المصري	ShamelaY19	37437	0.26689
		البراهين القاطعة [ج ١]	محمّد جعفر الأسترآبادي	Rafed	705	0.26689
		تفسير القاسمي [ج ٨]	محمّد جمال الدين القاسمي	Rafed	3928	0.26689
		الأمثل في تفسير كتاب الله المنزل [ج ١٩]	آية الله مكارم الشيرازي	Rafed	2066	0.26688
		توضيح الأفكار لمعاني تنقيح الأنظار	محمد بن إسماعيل بن صلاح بن محمد الحسني، الكحلاني ثم الصنعاني، أبو إبراهيم، عز الدين، المعروف كأسلافه بالأمير (المتوفى: 1182هـ)	ShamAY	11990	0.26687
		الشافية في علم التصريف (ومعها الوافية نظم الشافية للنيساري - المتوفى في القرن 12)	عثمان بن عمر بن أبي بكر بن يونس، أبو عمرو جمال الدين ابن الحاجب الكردي المالكي (المتوفى: 646ه)	ShamelaY19	22391	0.26687
		السنة في مواجهة الأباطيل	محمد طاهر بن حكيم غلام رسول	ShamelaY19	26583	0.26687
		 آداب النفوس ( ويليه كتاب الوهم ) 	 الحارث المحاسبي 	ABLibrary	8685	0.26685
		الآداب الشرعية والمنح المرعية	محمد بن مفلح بن محمد بن مفرج، أبو عبد الله، شمس الدين المقدسي الرامينى ثم الصالحي الحنبلي (المتوفى: 763هـ)	ShamAY	21582	0.26684
		الخميني شذوذ في العقائد شذوذ في المواقف-محقق	سعيد حوَّى	ShamAY	33278	0.26684
		مقتل الحسين (ع)	السيد عبد الرزاق المقرم	Masaha	2351	0.26684
		روضة القضاة وطريق النجاة	علي بن محمد بن أحمد، أبو القاسم الرحبي المعروف بابن السمناني (المتوفى: 499 ه)	ShamelaY19	18608	0.26683
