automatic URI	Proposed URI	bookTitle	authorName	collection	id	tfidf
		خصائص التفكير الفقهي عند الشيخ محمد بن عبد الوهاب (مطبوع ضمن بحوث ندوة دعوة الشيخ محمد بن عبد الوهاب، الجزء الأول)	عبد الوهاب بن إبراهيم أبو سليمان	ShamAY	11173	0.28198
		المرشد الوجيز	الميرزا محسن آل عصفور	Rafed	875	0.28198
		أنوار الأصول‏  - الجزء1	الشيخ أحمد القدسي	Masaha	3132	0.28198
		أنوار الأصول‏ - الجزء1	الشيخ أحمد القدسي	Masaha	2638	0.28198
		القلائد من فرائد الفوائد	الواحدي :: مصطفى السباعي	ShamAY	34556	0.28195
		الامام الثاني عشر (عجل الله تعالي فرجه الشريف) 	محمد سعيد موسوي	Ghbook	6577	0.28195
		 الإمام الصادق والمذاهب الأربعة 	 اسد حيدر 	ABLibrary	7424	0.28194
		أزهار الرياض في أخبار القاضي عياض	شهاب الدين أحمد بن محمد بن أحمد بن يحيى، أبو العباس المقري التلمساني (المتوفى: 1041هـ)	ShamAY	26350	0.28193
		مقالات موقع الدرر السنية	مجموعة من المؤلفين	ShamelaY19	95660	0.28193
		بهجة الناظرين إلى تراجم المتأخرين من الشافعية البارعين	رضي الدين أبو البركات محمد بن أحمد بن عبد الله الغزي العامري الشافعي (المتوفى: 864 ه)	ShamelaY19	20578	0.2819
		 أدب الطف أو شعراء الحسين ( ع ) 	 جواد شبر 	ABLibrary	7406	0.2819
		اصطلاح المذهب عند المالكية	د/ محمد إبراهيم علي أستاذ الفقه والفقه المقارن (سابقا) بكلية الشريعة والدراسات الإسلامية جامعة أم القرى - مكة المكرمة	ShamelaY19	150934	0.28189
		الطبقات السنية في تراجم الحنفية	تقي الدين بن عبد القادر التميمي الداري الغزي (المتوفى: 1010هـ)	ShamAY	322	0.28188
		 خلاصة عبقات الأنوار 	 السيد حامد النقوي 	ABLibrary	92	0.28187
		الاجتهاد و التقليد (هداية الأبرار إلى طريق الأئمة الأطهار)	الشيخ الحسين بن شهاب الدين الكركي	Masaha	1254	0.28187
		مجموعة الفوائد البهية على منظومة القواعد الفقهية	أبو مُحمَّدٍ، صالحُ بنُ مُحمَّدٍ بنِ حسنٍ آلُ عُمَيِّرٍ، الأسمريُّ، القحْطانيُّ	ShamAY	9846	0.28186
		تفسير البحر المحيط ـ موافق للمطبوع	محمد بن يوسف الشهير بأبي حيان الأندلسي دار النشر: دار الكتب العلمية - لبنان/ بيروت - 1422 هـ - 2001 م	ShamAY	34064	0.28186
		مسائل ابن الازرق ( حول القرآن - عن ابن عباس )	عائشة عبدالرحمن بنت شاطي	Ghbook	8899	0.28186
		علوم القرآن الكريم - نور الدين عتر	نور الدين محمد عتر الحلبي	ShamelaY19	29910	0.28181
		التفسير المنير في العقيدة والشريعة والمنهج	د وهبة بن مصطفى الزحيلي	ShamAY	22915	0.28176
		 نهاية المرام في علم الكلام 	 العلامة الحلي 	ABLibrary	8672	0.28176
		الرسائل العشر (للشيخ الطوسي)	الشيخ الطوسي	Masaha	1023	0.28176
		الجوهر المنضد في طبقات متأخري أصحاب أحمد	يوسف بن حسن بن أحمد بن حسن ابن عبد الهادي الصالحي، جمال الدين، ابن المِبْرَد الحنبلي (المتوفى: 909 هـ)	ShamAY	32329	0.28169
		مواهب الرحمن في تفسير القرآن [ج ٣]	آية الله السيّد عبد الأعلى السبزواري	Rafed	3908	0.28169
		 الأسفار عن رسالة الأنوار فيما يتجلى لأهل الذكر من الأنوار 	 عبد الكريم بن ابراهيم الجيلي 	ABLibrary	8809	0.28166
		شرح زروق على متن الرسالة لابن أبي زيد القيرواني	شهاب الدين أبو العباس أحمد بن أحمد بن محمد بن عيسى البرنسي الفاسي، المعروف بـ زروق (المتوفى: 899هـ)	ShamAY	32008	0.28163
		أدب الطّف أو شعراء الحسين عليه السلام [ج ٨]	جواد شبّر	Rafed	379	0.28163
		الأمان من أخطار الأسفار والأزمان	السيّد رضي الدين أبو القاسم علي بن موسى بن جعفر بن طاووس الحسني الحلّي [ السيّد بن طاووس ]	Rafed	524	0.28157
		المجالس الفاخرة في مآتم العترة الطاهرة	السيد عبدالحسين شرف الدين الموسوي	Rafed	912	0.28156
		الرّحلة الحجازيّة	الأمير شكيب أرسلان	Rafed	2385	0.28156
		المقترح في أجوبة بعض أسئلة المصطلح - أكثر من 200 سؤال في المصطلح مع محاضرات في:	أبو عبد الرحمن مقبل بن هادي بن مقبل بن قائدة (اسم رجل) الهمداني الوادعي (المتوفى: 1422ه)	Sham19Y	96783	0.28156
		 الميزان الذرية المبينة لعقائد الفرق العلية 	 عبد الوهاب الشعراني 	ABLibrary	8835	0.28155
		 سند العروة الوثقى ( كتاب الطهارة ) 	 الشيخ محمد السند 	ABLibrary	9548	0.28155
		محاضرات في الاعتقادات - الجزء2	السيد علي الحسيني الميلاني	Masaha	402	0.28155
		بحار الأنوار [ج ٦٤]	الشيخ محمّد باقر بن محمّد تقي المجلسي	Rafed	1064	0.28154
		تأويل مشكل القرآن	أبو محمد عبد الله بن مسلم بن قتيبة الدينوري (المتوفى: 276هـ)	ShamAY	23596	0.28151
		أزهار الرياض في أخبار القاضي عياض	شهاب الدين أحمد بن محمد بن أحمد بن يحيى، أبو العباس المقري التلمساني (المتوفى: 1041ه)	Sham19Y	26350	0.28151
		درج الدرر في تفسير الآي والسور ط الفكر	أبو بكر عبد القاهر بن عبد الرحمن بن محمد الفارسي الأصل، الجرجاني الدار (المتوفى: 471ه)	ShamelaY19	122187	0.2815
		المقال وتطوره في الأدب المعاصر	السيد مرسي أبو ذكري	ShamAY	10540	0.28146
		الكشكول	محمد بن حسين بن عبد الصمد الحارثي العاملي الهمذاني، بهاء الدين (المتوفى: 1031هـ)	ShamAY	1571	0.28143
		 التمهيد لقواعد التوحيد 	 أبو الثناء محمود الماتريدي 	ABLibrary	8395	0.28143
		الفوائد الحائرية	الوحيد البهبهاني	Masaha	3468	0.28142
		الفواكه العذاب في الرد على من لم يحكم السنة والكتاب	حمد بن ناصر بن عثمان بن معمر النجدي التميمي الحنبلي (المتوفى: 1225هـ)	ShamAY	1	0.28141
		معاملة الحكام في ضوء الكتاب والسنة	عبد السلام بن برجس آل عبد الكريم	ShamAY	36557	0.28141
		الجوهر المنضد في طبقات متأخري أصحاب أحمد	يوسف بن حسن بن أحمد بن حسن ابن عبد الهادي الصالحي، جمال الدين، ابن المبرد الحنبلي (المتوفى: 909 ه)	Sham19Y	17657	0.28141
		شرح المعتمد في أصول الفقه ((نظمها وشرحها د محمد الحبش))	محمد الحبش	ShamAY	3270	0.2814
		 القول المتين في تشيع الشيخ الأكبر 	 الشيخ قاسم الطهراني 	ABLibrary	8905	0.28138
		مع صاحب الفضيلة والدنا الشيخ محمد الأمين الشنقيطي رحمه الله	عطية بن محمد سالم (المتوفى: 1420هـ)	ShamAY	4993	0.28137
		نفي ظاهرة التكفير عند الامامية	ابومحمد ساعدي	Ghbook	10522	0.28137
		المدخل إلى علوم القرآن الكريم	محمد فاروق النبهان	ShamelaY19	38032	0.28135
		أسرار البلاغة	أبو بكر عبد القاهر بن عبد الرحمن بن محمد الفارسي الأصل، الجرجاني الدار (المتوفى: 471هـ)	ShamAY	8187	0.28134
		تبصرة الفقهاء [ج ٢]	الشيخ محمد تقي الرازي النجفي الاصفهاني	Rafed	1331	0.28134
		مقدمة ابن الصلاح ومحاسن الاصطلاح	البلقيني، سراج الدين	ShamelaY19	29878	0.28133
		منهاج الكرامة في معرفة الإمامة	العلامة الحلي	Masaha	443	0.28132
		الإمامة الإلهية - الجزء2	الشيخ صادق الساعدي	Masaha	86	0.28132
		الغدير - الجزء1	الشيخ عبد الحسين الأميني النجفي	Masaha	263	0.2813
		إهداء للبرنامج من دار الركائز للنشر والتوزيع - دولة الكويت	عبد الرحمن بن عبد الله البعلي الحنبلي (ت: 1192 ه)	ShamelaY19	147660	0.28129
		التراويح أكثر من ألف عام في المسجد النبوي	عطية بن محمد سالم (المتوفى: 1420هـ)	ShamAY	22950	0.28128
		الصفات الإلهية في الكتاب والسنة النبوية في ضوء الإثبات والتنزيه	أبو أحمد محمد أمان بن علي جامي علي (المتوفى: 1415هـ)	ShamAY	10423	0.28128
		أحسن ما سمعت	عبد الملك بن محمد بن إسماعيل أبو منصور الثعالبي (المتوفى: 429هـ)	ShamAY	25011	0.28128
		رسالة إلى أهل الثغر بباب الأبواب	أبو الحسن علي بن إسماعيل بن إسحاق بن سالم بن إسماعيل بن عبد الله بن موسى بن أبي بردة بن أبي موسى الأشعري (المتوفى: 324ه)	Sham19Y	11214	0.28128
		طبقات المفسرين للداوودي	محمد بن علي بن أحمد، شمس الدين الداوودي المالكي (المتوفى: 945ه)	ShamelaY19	27084	0.28127
		نكث الهميان في نكت العميان	صلاح الدين خليل بن أيبك الصفدي (المتوفى: 764ه)	ShamelaY19	28182	0.28127
		أخبار الشيعة وأحوال رواتها	الألوسي، محمود شكري	ShamAY	35891	0.28125
		المراجعات الريحانية	الشيخ محمد حسين كاشف الغطاء	Masaha	4072	0.28122
		رسائل الثعالبي	عبد الملك بن محمد بن إسماعيل أبو منصور الثعالبي (المتوفى: 429هـ)	ShamAY	623	0.2812
		صَحِيحُ التَّرْغِيب وَالتَّرْهِيب	محمد ناصر الدين الألباني	ShamAY	32126	0.28119
		موصل الطلاب	الشيخ خالد الأزهري	Rafed	2026	0.28118
		تاريخ الأدب العربي العصر الجاهلي	أحمد شوقي عبد السلام ضيف الشهير بشوقي ضيف (المتوفى: 1426هـ)	ShamAY	11996	0.28116
		تعليقة القوچاني على كفاية الأصول [ج ٢]	الشيخ علي القوچاني	Rafed	793	0.28116
		الحافظ ابن حجر ومنهجه في تقريب التهذيب	علي بن نايف الشحود	ShamAY	37296	0.28115
		شرح (التبصرة والتذكرة = ألفية العراقي)	أبو الفضل زين الدين عبد الرحيم بن الحسين بن عبد الرحمن بن أبي بكر بن إبراهيم العراقي (المتوفى: 806هـ)	ShamAY	1779	0.28114
		تنوع خطاب القرآن الكريم في العهد المدني ((دراسة لغوية))		ShamAY	36938	0.28114
		تهذيب الأسماء واللغات للإمام النووي	النووي	ShamAY	34626	0.28114
		مصادر نهج البلاغه و اسانيد	سيد عبدالزهراء الحسيني الخطيب	Ghbook	15833	0.28114
		الخلاصة في بيان أسباب اختلاف الفقهاء	الواحدي :: علي بن نايف الشحود	ShamAY	36080	0.28113
		فضائل القرآن لابن كثير	أبو الفداء إسماعيل بن عمر بن كثير القرشي البصري ثم الدمشقي (المتوفى : 774هـ)	ShamAY	22800	0.2811
		 شرح العقيدة الإصفهانية 	 ابن تيميه 	ABLibrary	8459	0.2811
		 تلخيص الشافي 	 الشيخ الطوسي 	ABLibrary	8390	0.28109
		الثّاقب في المناقب	عماد الدين أبي جعفر محمّد بن علي الطوسي [ ابن حمزة ]	Rafed	760	0.28108
		صوارم اليقين (رد على الزيدية في تشكيكهم في السنة النبوية)	يحيى المنصور بالله	ShamAY	35743	0.28107
		أداء ما وجب من بيان وضع الوضاعين في رجب	ابن دحية	ShamelaY19	23163	0.28105
		مكانة الإمام أبي حنيفة في الحديث	محمد عبد الرشيد النعماني الباكستاني (المتوفى: 1420ه)	ShamelaY19	96604	0.28105
		سهام الإسلام	عبد اللطيف بن علي بن أحمد بن محمد السلطاني القنطري الجزائري (المتوفى: 1404ه)	ShamelaY19	115131	0.28104
		 فقه الطب والتضخم النقدي 	 الشيخ محمد السند 	ABLibrary	9552	0.28102
		رحلة الشنقيطي إلى إفريقيا ط عالم الفوائد	محمد الأمين بن محمد المختار الجكني الشنقيطي (1325 - 1393)	ShamelaY19	20555	0.28099
		الفائق في غريب الحديث والأثر	أبو القاسم محمود بن عمرو بن أحمد، الزمخشري جار الله (المتوفى: 538هـ)	ShamAY	7015	0.28098
		هداية المرتاب وغاية الحفاظ والطلاب في تبيين متشابه الكتاب	علي بن محمد بن عبد الصمد الهمداني المصري الشافعي، أبو الحسن، علم الدين السخاوي (المتوفى: 643ه)	Sham19Y	9831	0.28097
		المفَصَّلُ في موضوعات سور القرآن	علي بن نايف الشحود	ShamAY	36743	0.28096
		نفحات الأزهار في خلاصة عبقات الأنوار [ج ١١]	السيّد علي الحسيني الميلاني	Rafed	453	0.28093
		فتحُ البيان في مقاصد القرآن	أبو الطيب محمد صديق خان بن حسن بن علي ابن لطف الله الحسيني البخاري القِنَّوجي (المتوفى: 1307هـ)	ShamAY	660	0.28091
		رحلة الشتاء والصيف	محمد بن عبد الله بن محمد، من أحفاد شرف الدين بن يحيى الحمزي الحسيني المولوي المعروف ب كبريت (المتوفى: 1070ه)	ShamelaY19	37345	0.2809
		بهجه الاريب في بيان ما في كتاب الله من الغريب	علي بن عثمان بن مصطفي مارديني بن تركماني	Ghbook	2893	0.2809
		الضياء الشارق في رد شبهات الماذق المارق	سليمان بن سحمان بن مصلح بن حمدان بن مصلح بن حمدان بن مسفر بن محمد بن مالك بن عامر الخثعمي , التبالي , العسيري , النجدي (المتوفى: 1349هـ)	ShamAY	7664	0.28089
		اجتماع الجيوش الإسلامية على حرب المعطلة والجهمية	أبو عبد الله محمد بن أبي بكر بن أيوب ابن قيم الجوزية (691 - 751)	ShamelaY19	18632	0.28088
		تفسير ابن عطية = المحرر الوجيز في تفسير الكتاب العزيز	أبو محمد عبد الحق بن غالب بن عبد الرحمن بن تمام بن عطية الأندلسي المحاربي (المتوفى: 542ه)	ShamelaY19	23632	0.28088
		الخلاصة في بيان رأي شيخ الإسلام ابن تيمية بالرافضة	علي بن نايف الشحود	ShamAY	35264	0.28085
		الأساس في التفسير [ج ١]	سعيد حوّى	Rafed	3117	0.28085
		لمحات من محاسن الإسلام	محمد بن علي العرفج	ShamAY	33406	0.28084
		إكفار الملحدين في ضروريات الدِّين	محمد أنور شاه بن معظم شاه الكشميري الهندي (المتوفى: 1353هـ)	ShamAY	21788	0.28084
		المعجزة الكبرى القرآن	محمد بن أحمد بن مصطفى بن أحمد المعروف بأبي زهرة (المتوفى: 1394ه)	ShamelaY19	23137	0.28084
		 النور الأبهر في الدفاع عن الشيخ الأكبر 	 مجموعة مؤلفين 	ABLibrary	8805	0.28083
		أنيس المجتهدين [ج ٢]	محمد مهدي بن أبي ذر النراقي [ المولى مهدي النراقي ]	Rafed	1136	0.28083
		شرح الصحيفة الكاملة السجّاديّة	السيّد محمّد باقر المشتهر بمحقّق الداماد	Rafed	2878	0.28081
		اتحاف الفقهاء في تحقيق مسألة اختلاف القراءات والقرّاء	الميرزا محسن آل عصفور	Rafed	95	0.28081
		تحقيق المطالب بشرح دليل الطالب	أبو المنذر محمود بن محمد بن مصطفى بن عبد اللطيف المنياوي	Sham19Y	37590	0.28079
		تاريخ القرآن الكريم	محمد طاهر بن عبد القادر الكردي المكي الشافعي الخطاط (المتوفى: 1400هـ)	ShamAY	2228	0.28078
		 الرحلة الحجازية ( الارتسامات اللطاف في خاطر الحاج إلى أقدس مطاف ) 	 شكيب أرسلان 	ABLibrary	9092	0.28078
		مشكلة السرف في المجتمع المسلم وعلاجها في ضوء الإسلام	عبد الله بن إبراهيم الطريقي	ShamelaY19	31270	0.28077
		 المنية والأمل 	 القاضي عبد الجبار الهمذاني 	ABLibrary	8652	0.28077
		الرد على من كذب بالأحاديث الصحيحة الواردة في المهدي	عبد المحسن بن حمد بن عبد المحسن بن عبد الله بن حمد العباد البدر	ShamAY	22951	0.28074
		 المزار 	 السيد مهدي القزويني 	ABLibrary	9186	0.28074
		فتاوى ورسائل سماحة الشيخ محمد بن إبراهيم بن عبد اللطيف آل الشيخ	محمد بن إبراهيم بن عبد اللطيف آل الشيخ (المتوفى: 1389هـ)	ShamAY	8476	0.28072
		المنمق في أخبار قريش	محمد بن حبيب بن أمية بن عمرو الهاشمي، بالولاء، أبو جعفر البغدادي (المتوفى: 245هـ)	ShamAY	12212	0.28072
		السيرة النبوية الصحيحة محاولة لتطبيق قواعد المحدثين في نقد روايات السيرة النبوية	د. أكرم ضياء العمري	ShamelaY19	122396	0.28071
		تفسير ابن عطية = المحرر الوجيز في تفسير الكتاب العزيز	أبو محمد عبد الحق بن غالب بن عبد الرحمن بن تمام بن عطية الأندلسي المحاربي (المتوفى: 542هـ)	ShamAY	23632	0.2807
		بلوغ الغاية من تهذيب بداية الهداية للإمام أبي حامد الغزالي (رحمه الله)	وائل حافظ خلف	Sham19Y	37549	0.2807
		معجم المطبوعات العربية والمعربة	يوسف بن إليان بن موسى سركيس (المتوفى: 1351هـ)	ShamAY	1242	0.28068
		أحكام القرآن [ج ٢]	أبي بكر محمّد بن عبدالله [ ابن العربي ]	Rafed	3219	0.28067
		خريدة العجائب وفريدة الغرائب	سراج الدين بن الوردي	Rafed	2213	0.28066
		الاعتصام للشاطبي ت الشقير والحميد والصيني	إبراهيم بن موسى بن محمد اللخمي الغرناطي الشهير بالشاطبي (المتوفى: 790ه)	ShamelaY19	36558	0.28065
		مجموع رسائل الحافظ ابن رجب الحنبلي	زين الدين عبد الرحمن بن أحمد بن رجب بن الحسن، السَلامي، البغدادي، ثم الدمشقي، الحنبلي (المتوفى: 795هـ)	ShamAY	1625	0.28063
		مطارح الأنظار [ج ٣]	الميرزا أبو القاسم الكلانتري الطهراني	Rafed	997	0.28062
		الحقيقة الضائعة رحلتي نحو مذهب آل البيت(ع)	الشيخ معتصم سيد أحمد	Masaha	240	0.28062
		أثر علامة القصيم عبد الرحمن السعدي على الحركة العلمية المعاصرة	أبو محمد عبد الله بن محمد بن أحمد الطيار	ShamAY	35841	0.28061
		معالم الدين وملاذ المجتهدين [ج ٢]	الشيخ حسن بن زين الدين العاملي	Rafed	1363	0.2806
		حاشية الإرشاد ـ مقدمة	الشهيد الثاني	Masaha	1152	0.28059
		نظرة تاريخية في حدوث المذاهب الفقهية الأربعة: الحنفي - المالكي - الشافعي - الحنبلي وانتشارها عند جمهور المسلمين	أحمد بن إسماعيل بن محمد تيمور (المتوفى: 1348ه)	ShamelaY19	96605	0.28058
		إتحاف النبلاء بسيرة العلامة عبد الرزاق عفيفي	راشد بن عثمان الزهراني	ShamAY	35810	0.28057
		فيض القدير شرح الجامع الصغير	زين الدين محمد المدعو بعبد الرؤوف بن تاج العارفين بن علي بن زين العابدين الحدادي ثم المناوي القاهري (المتوفى: 1031ه)	ShamelaY19	21660	0.28057
		اعجاز القرآن بين المعتزلة والأشاعرة	دكتور منير سلطان	Rafed	3292	0.28057
		 الوصلة إلى الحبيب في وصف الطيبات والطيب 	 عمر بن أحمد العقيلي الحلبي ( ابن العديم ) 	ABLibrary	9892	0.28054
		كتاب الأعلام بأعلام بيت الله الحرام	محمّد بن أحمد بن محمّد النهرواني	Rafed	2400	0.28054
		موقف ابن تيمية من الأشاعرة	عبد الرحمن بن صالح المحمود	ShamAY	12766	0.28049
		 الله ، القصد المجرد في معرفة الاسم المفرد ( ويليه حبة المحبة ) 	 ابن عطاء الله السكندري 	ABLibrary	8788	0.28049
		نفحات القرآن [ج ٨]	آية الله مكارم الشيرازي	Rafed	3823	0.28049
		 أهل البيت في مصر 	 مجموعة مؤلفين 	ABLibrary	7432	0.28048
		الدعوة والدعاء شرع من الله لجميع عباده	سعد الحصين	ShamAY	33510	0.28047
		منحة الباري بشرح صحيح البخاري المسمى «تحفة الباري»	زكريا بن محمد بن أحمد بن زكريا الأنصاري، زين الدين أبو يحيى السنيكي المصري الشافعي (المتوفى: 926 هـ)	ShamAY	32556	0.28046
		مشرق الشمسين و إكسير السعادتين مع تعليقات الخواجوئى	الشيخ البهائي	Masaha	1208	0.28046
		روضة التقرير في اختلاف القراءات بين الإرشاد والتيسير	علي بن أبي محمد بن أبي سعد بن الحسن الواسطي المعروف بالديواني (663 - 743 ه)	ShamelaY19	145211	0.28044
		اللباب في تسلية المصاب	أبو الحسن علاء الدين علي بن أيوب بن منصور المقدسي (ت 746هـ)	ShamAY	35003	0.28042
		الفتنة في عهد الخلفاء الراشدين رضي الله عنهم برؤية موضوعية	علي بن نايف الشحود	ShamAY	35789	0.28042
		غاية المرام في شرح شرائع الإسلام [ج ٤]	الشيخ مفلح الصّيمري البحراني	Rafed	1495	0.28042
		 الخيال عالم البرزخ والمثال من كلام الشيخ الأكبر 	 محمود محمود الغراب 	ABLibrary	8909	0.28041
		 مآثر الكبراء تاريخ سامراء 	 الشيخ ذبيح الله المحلاتي 	ABLibrary	9174	0.28036
		مطالع التمام ونصائح الأنام ومنجاة الخواص والعوام في رد إباحة إغرام ذوي الجنايات والإجرام زيادة على ما شرع الله من الحدود والأحكام	القاضي أبي العباس أحمد الشماع الهنتاتي (ت 833هـ)	ShamAY	36197	0.28035
		أنموذج اللبيب في خصائص الحبيب (مطبوع مع شرح محمد بن أحمد عبد الباري الأهدل، المسمى: فتح الكريم القريب شرح أنموذج اللبيب)	عبد الرحمن بن أبي بكر، جلال الدين السيوطي (المتوفى: 911هـ)	ShamAY	12824	0.28034
		الإشارة إلى سيرة المصطفى وتاريخ من بعده من الخلفا	مغلطاي بن قليج بن عبد الله البكجري المصري الحكري الحنفي، أبو عبد الله، علاء الدين (المتوفى: 762ه)	ShamelaY19	122236	0.28034
		طوق الحمامة في الألفة والألاف	أبو محمد علي بن أحمد بن سعيد بن حزم الأندلسي القرطبي الظاهري (المتوفى: 456هـ)	ShamAY	10518	0.28033
		أدب المفتي والمستفتي	عثمان بن عبد الرحمن، أبو عمرو، تقي الدين المعروف بابن الصلاح (المتوفى: 643هـ)	ShamAY	10720	0.28033
