automatic URI	Proposed URI	bookTitle	authorName	collection	id	tfidf
		من عيب على مسلم إخراج حديثه والإجابة عنه	ربيع بن هادي المدخلي	ShamAY	32999	0.2582
		مقاصد الشريعة الإسلامية	محمد الطاهر بن محمد بن محمد الطاهر بن عاشور التونسي (المتوفى: 1393هـ)	ShamAY	32107	0.2582
		العين حق	محمد بن عبد المعطي	ShamelaY19	29566	0.2582
		الطّراز الأوّل [ج ٨]	السيّد علي بن أحمد بن محمّد معصوم الحسيني	Rafed	512	0.2582
		أحكام القرآن  [ج ١]	أبي بكر أحمد بن علي الرازي الجصّاص	Rafed	1987	0.2582
		 المواعظ والإعتبار في ذكر الخطط والآثار ( ط بيروت ) 	 المقريزي 	ABLibrary	9234	0.25819
		تسفيه أدعياء التنزيه - عبد الله الخليفي	ابن الجوزي	ShamAY	35519	0.25818
		الشهب الثاقبه (تلخيص الصوارم المهرقه في رد الصواعق المحرقه)	نورالله تستري	Ghbook	11353	0.25818
		قصة الحضارة	وِل ديورَانت = ويليام جيمس ديورَانت (المتوفى: 1981 م)	ShamAY	224	0.25817
		الأعياد وأثرها على المسلمين	سليمان بن سالم السحيمي	ShamAY	7545	0.25817
		صدق النبأ في بيان حقيقة عبد الله بن سبأ	أبو عبد الله الذهبي	ShamAY	35683	0.25816
		غيث العقيدة السلفية شرح منظومة الحائية	خالد بن إبراهيم الصقعبي	ShamAY	35552	0.25816
		حجة الله البالغة ـ الكتب الحديثة	الإمام أحمد المعروف بشاه ولي الله ابن عبد الرحيم الدهلوي	ShamAY	34279	0.25814
		الدر المنضود في الصلاة والسلام على صاحب المقام المحمود	أحمد بن محمد بن علي بن حجر الهيتمي السعدي الأنصاري، شهاب الدين شيخ الإسلام، أبو العباس (المتوفى: 974هـ)	ShamAY	9801	0.25814
		كشف كذب اللئيم حول الإسلام العظيم		ShamAY	35352	0.25814
		 لواقح الأنوار القدسية في بيان العهود المحمدية 	 عبد الوهاب الشعراني 	ABLibrary	8840	0.25814
		الإعجاز اللغوي في القرآن الكريم - جامعة المدينة	مناهج جامعة المدينة العالمية	ShamAY	1658	0.25813
		مع الاثنى عشرية في الأصول والفروع [موسوعة شاملة]	د علي بن أحمد علي السالوس	ShamAY	1507	0.25811
		شرح تنقيح الفصول	أبو العباس شهاب الدين أحمد بن إدريس بن عبد الرحمن المالكي الشهير بالقرافي (المتوفى: 684هـ)	ShamAY	21813	0.25811
		الشيعة قادمون	جمال بدوي	ShamAY	35673	0.2581
		مختصر كتاب الاعتصام	علوي السقاف	ShamelaY19	22888	0.2581
		فتاوى حديثية - سعد آل حميد	سعد الحميد	ShamAY	37281	0.25809
		مجالس مع فضيلة الشيخ محمد الأمين الجكني الشنقيطي - رحمه الله تعالى -	أحمد بن محمد الأمين بن أحمد بن المختار المحضريّ، ثم الإبراهيمي، ثم الجكنيّ الشنقيطي (المتوفى: 1434 هـ)	ShamAY	32526	0.25808
		التفسير المنير [ج ٦]	الدكتور وهبة الزحيلي	Rafed	2948	0.25808
		النكت الدالة على البيان في أنواع العلوم والأحكام	أحمد محمد بن علي بن محمد الكَرَجي القصَّاب (المتوفى: نحو 360هـ)	ShamAY	9065	0.25807
		 العقد الثمين في تاريخ البلد الأمين 	 محمد بن أحمد الفاسي 	ABLibrary	9141	0.25807
		 بحار الأنوار 	 العلامة المجلسي 	ABLibrary	762	0.25807
		الاتجاهات العامة للاجتهاد ومكانة الحديث الآحادي الصحيح فيها	نور الدين محمد عتر الحلبي	ShamAY	1701	0.25806
		الأشاعرة		ShamAY	35644	0.25806
		رد الاباطيل عن نهضه الحسين عليه السلام	عبدالله حسين	Ghbook	5961	0.25806
		نصاب الاحتساب	عمر بن محمد بن عوض السَّنَامي الحنفي (المتوفى: 734هـ)	ShamAY	9679	0.25805
		خطط الشام	محمد بن عبد الرزاق بن محمد، كرد علي (المتوفى: 1372ه)	ShamelaY19	37063	0.25805
		تفسير فرات الكوفي‏	فرات بن إبراهيم‏ الكوفي	Masaha	4578	0.25805
		الانتصار للسلف الأخيار: نقد لكتاب «أسماء الله الحسنى» للدكتور: محمود عبدالرازق الرضواني	محمد محب الدين أبو زيد	Sham19Y	19449	0.25805
		لكي لا تتنازعوا ..	آيت الله العظمي سيد محمد حسيني شيرازي	Ghbook	7911	0.25805
		كتب أحاديث الأحكام جمع ودراسة بلوغ المرام نموذجاً	عبد الله بن سفر عباده العبدلي الغامدي	ShamAY	37352	0.25804
		تنزيه القرآن الكريم عن دعاوى المبطلين	منقذ بن محمود السقار	ShamelaY19	95574	0.25804
		من وحي الإسلام [ج ١]	الشيخ حسن طراد	Rafed	145	0.25804
		المسترشد في الإمامة	محمد بن جرير الطبري‏ الصغير	Masaha	2862	0.25804
		الخطيب الخوارزمي وشعره في الغدير	الشيخ عبد الحسين الأميني النجفي	Masaha	247	0.25804
		أحكام حضور المساجد	الواحدي :: عبد الله الفوزان	ShamAY	36537	0.25803
		وَا مُحَمَّدَاهُ {إِنَّ شَانِئَكَ هُوَ الْأَبْتَرُ}	أبو التراب سيد بن حسين بن عبد الله العفاني	ShamAY	2059	0.25803
		علوم البلاغة البيان والمعاني والبديع	أحمد مصطفى المراغي	Rafed	2618	0.25803
		المبشرون بالجنة	توفيق عمر سيدي	ShamAY	35164	0.25802
		إتحاف فضلاء البشر في القراءات الأربعة عشر	الشيخ شهاب الدين أحمد بن محمد بن عبدالغني الدمياطي	Rafed	3090	0.25802
		مختصر المؤمل في الرد إلى الأمر الأول	أبو القاسم شهاب الدين عبد الرحمن بن إسماعيل بن إبراهيم المقدسي الدمشقي المعروف بأبي شامة (المتوفى: 665ه)	Sham19Y	6299	0.25802
		الموسوعة القرآنيّة [ج ٢]	ابراهيم الأبياري	Rafed	3784	0.258
		حياه الامام علي بن الحسين ( عليهما السلام ) 	سيد جعفر شهيدي	Ghbook	6379	0.258
		إتحاف العباد بفضائل الجهاد	عبد الله عزام	ShamAY	35043	0.25799
		الألغاز النحوية وهو الكتاب المسمى (الطراز في الألغاز)	عبد الرحمن بن أبي بكر، جلال الدين السيوطي (المتوفى: 911ه)	ShamelaY19	29729	0.25799
		النظرات الماتعة في سورة الفاتحة	مرزوق بن هياس آل مرزوق الزهراني، الأستاذ المشارك بكلية الحديث الشريف والدراسات الإسلامية بالجامعة الإسلامية بالمدينة المنورة	ShamelaY19	132391	0.25799
		ميزان الأصول في نتائج العقول	علاء الدين شمس النظر أبو بكر محمد بن أحمد السمرقندي (المتوفى: 539 ه)	ShamelaY19	19237	0.25799
		لمحات من المعاد	السيد علي الحسيني الصدر	Rafed	1750	0.25799
		علم التخريج ودوره في خدمة السنة النبوية - عبد الغفور البوشلي	عبد الغفور بن عبد الحق حسين بر البلوشي	Sham19Y	11296	0.25799
		الاسس المنهجيه في تفسير النص القرآني	عدي جواد علي الحجار	Ghbook	12282	0.25799
		مفتاح السعيدية في شرح الألفية الحديثية	شمس الدين محمد بن عمار بن محمد بن أحمد المصري المالكي المعروف بابن عمار (المتوفى: 844هـ)	ShamAY	2026	0.25798
		فتح القريب المجيب في شرح ألفاظ التقريب = القول المختار في شرح غاية الاختصار (ويعرف بشرح ابن قاسم على متن أبي شجاع)	محمد بن قاسم بن محمد بن محمد، أبو عبد الله، شمس الدين الغزي، ويعرف بابن قاسم وبابن الغرابيلي (المتوفى: 918هـ)	ShamAY	229	0.25798
		تاريخ المساجد الشهيرة	عبد الله سالم نجيب	ShamAY	37121	0.25797
		التبيان في أيمان القرآن ط عالم الفوائد	أبو عبد الله محمد بن أبي بكر بن أيوب ابن قيم الجوزية (691 - 751)	ShamelaY19	18337	0.25797
		بحوث في قراءه النص الديني	محمد السند	Ghbook	15177	0.25796
		آداب الأكل	أحمد بن عماد الدين بن يوسف بن عبد النبي، أبو العباس، شهاب الدين الأقفهسي ثم القاهري الشافعي (المتوفى: 808هـ)	ShamAY	8185	0.25795
		شرح الحديث المقتفى في مبعث النبي المصطفى	أبو القاسم شهاب الدين عبد الرحمن بن إسماعيل بن إبراهيم المقدسي الدمشقي المعروف بأبي شامة (المتوفى: 665هـ)	ShamAY	7808	0.25795
		نضرة النعيم في مكارم أخلاق الرسول الكريم	مجموعة من المؤلفين	ShamelaY19	22798	0.25795
		أمالي ابن الحاجب	عثمان بن عمر بن أبي بكر بن يونس، أبو عمرو جمال الدين ابن الحاجب الكردي المالكي (المتوفى: 646ه)	ShamelaY19	124755	0.25795
		صلاة التراويح	الدكتور الشيخ جعفر الباقري [ سامي صبيح علي ]	Rafed	1230	0.25795
		الحج عبر الحضارات والامم	ماجده آل مرتضي مومن	Ghbook	3490	0.25794
		مفهوم الولاء والبراء في القرآن والسنة	علي بن نايف الشحود	ShamAY	1615	0.25792
		إعلام الموقعين عن رب العالمين - ت: طه عبد الرؤوف	محمد بن أبي بكر بن أيوب بن سعد شمس الدين ابن قيم الجوزية (المتوفى : 751هـ)	ShamAY	34411	0.25792
		فتح الرحمن بشرح زبد ابن رسلان	شهاب الدين أبو العباس أحمد بن أحمد بن حمزة الرملي (المتوفى: 957 ه)	ShamelaY19	32197	0.25792
		شريعة الله لا شريعة البشر	شحاتة محمد صقر	Sham19Y	36159	0.25792
		بهجة قلوب الأبرار وقرة عيون الأخيار في شرح جوامع الأخبار	أبو عبد الله، عبد الرحمن بن ناصر بن عبد الله بن ناصر بن حمد آل سعدي (المتوفى: 1376هـ)	ShamAY	9945	0.25791
		كتاب و عتاب	الشيخ قيس بهجة العطار	Masaha	382	0.25791
		إجلاء الحقيقة في سيرة عائشة الصِّدِّيقة	ياسين الخليفة الطيب المحجوب	ShamAY	518	0.2579
		دعاوى المناوئين لشيخ الإسلام ابن تيمية - عرض ونقد	د. عبد الله بن صالح بن عبد العزيز الغصن	ShamAY	9585	0.2579
		 مسالك الأبصار في ممالك الأمصار 	 أحمد بن يحيى العمري 	ABLibrary	9193	0.2579
		الميزان في تفسير القرآن [ج ١٨]	آية الله السيد محمد حسين الطباطبائي	Rafed	1451	0.2579
		المهدي (عج)	السيد صدر الدين الصدر	Masaha	2368	0.2579
		الصارم المنكي في الرد على السبكي	شمس الدين محمد بن أحمد بن عبد الهادي الحنبلي (المتوفى: 744ه)	Sham19Y	8622	0.2579
		هذا ديننا	محمد الغزالي	ShamAY	33259	0.25789
		تفسير النعماني اورساله المحكم و المتشابه	محمد بن ابراهيم نعماني	Ghbook	13999	0.25789
		اتخاذ القرآن الكريم أساسا لشؤون الحياة والحكم في المملكة	أ:د صالح بن غانم السدلان	ShamAY	33397	0.25788
		العقد المفصل في قبيلة المجد المؤثل	حيدر بن سليمان بن داود الحلي الحسيني (المتوفى: 1304هـ)	ShamAY	5448	0.25786
		دلائل الصدق لنهج الحق [ج ٦]	الشيخ محمد حسن المظفر	Rafed	253	0.25786
		 أهوال القبور وأحوال أهلها إلى النشور 	 عبد الرحمن بن أحمد الحنبلي البغدادي الدمشقي 	ABLibrary	8352	0.25785
		موسوعة القرآن العظيم [ج ١]	دكتور عبد المنعم الحفني	Rafed	3910	0.25785
		نفحات الأزهار في خلاصة عبقات الأنوار [ج ١٣]	السيّد علي الحسيني الميلاني	Rafed	458	0.25784
		الإبطال لنظرية الخلط بين دين الإسلام وغيره من الأديان	بكر بن عبد الله أبو زيد بن محمد بن عبد الله بن بكر بن عثمان بن يحيى بن غيهب بن محمد (المتوفى: 1429ه)	Sham19Y	10487	0.25784
		التَّراجِمُ السَّاقِطَةُ مِنْ كِتَابِ إِكْمَال تَهْذِيبَ الكَمَال لمُغْلَطَاي (المَطْبُوع)	مغلطاي بن قليج بن عبد الله البكجري المصري الحكري الحنفي، أبو عبد الله، علاء الدين (المتوفى: 762هـ)	ShamAY	958	0.25783
		المُعْلم بفوائد مسلم	أبو عبد الله محمد بن علي بن عمر التَّمِيمي المازري المالكي (المتوفى: 536هـ)	ShamAY	31765	0.25783
		السنن والمبتدعات المتعلقة بالأذكار والصلوات	محمد بن أحمد عبد السلام خضر الشقيري الحوامدي (المتوفى: بعد 1352هـ)	ShamAY	6884	0.25783
		روضة الطالبين- الكتب العلمية	محي الدين النووي (ت 676هـ)	ShamAY	34251	0.25782
		 معرفة الإمام 	 السيد محمد حسين الطهراني 	ABLibrary	8892	0.25782
		شرح مقدمة التفسير لابن تيمية - العثيمين	محمد بن صالح بن محمد العثيمين (المتوفى: 1421هـ)	ShamAY	21521	0.25781
		الاقتضاب في غريب الموطأ وإعرابه على الأبواب	محمد بن عبد الحق اليفرني (625 هـ)	ShamAY	32513	0.25781
		هيا بنا نؤمن ساعة - مجدي الهلالي	مجدي الهلالي	ShamelaY19	36415	0.2578
		محمد صلى الله عليه وآله وسلم في الكتب المقدسة	سامى عامرى	ShamelaY19	23668	0.2578
		فدك في التاريخ	آية الله السيّد محمّد باقر الصدر	Rafed	187	0.2578
		الأوراق قسم أخبار الشعراء	أبو بكر محمد بن يحيى بن عبد الله الصولي (المتوفى: 335هـ)	ShamAY	10532	0.25779
		من روائع القرآن - تأملات علمية وأدبية في كتاب الله عز وجل	محّمد سَعيد رَمضان البوطي	ShamAY	1233	0.25779
		تذكرة المؤتسي شرح عقيدة الحافظ عبد الغني المقدسي	عبد الرزاق بن عبد المحسن البدر	ShamAY	11093	0.25779
		 الملخص في أصول الدين 	 الشريف المرتضى 	ABLibrary	8641	0.25779
		كشف موقف الغزالي من السنة وأهلها ونقد بعض آرائه	ربيع بن هادي المدخلي	ShamAY	33004	0.25778
		الحديث المقلوب تعريفه، وفوائده، وحكمه، والمصنفات فيه	د. محمد بن عمر بن سالم بازمول	ShamAY	37301	0.25778
		شرح الحموية - عبد الرحيم السلمي	عبد الرحيم بن صمايل العلياني السلمي	ShamelaY19	37798	0.25778
		موقف أصحاب الأهواء والفرق من السنة النبوية ورواتها جذورهم ووسائلهم وأهدافهم قديما وحديثا	أبو ياسر محمد بن مطر بن عثمان آل مطر الزهراني (المتوفى: 1427هـ)	ShamAY	12105	0.25777
		صحيح السيرة النبوية للعلي	إبراهيم بن محمد بن حسين العلي الشبلي الجنيني (المتوفى: 1425هـ)	ShamAY	32186	0.25777
		صفات الله عز وجل الواردة في الكتاب والسنة	علوي السقاف	ShamelaY19	22889	0.25777
		حقوق الإنسان في الإسلام لعبد الفتاح عشماوي	عبد الفتاح بن سليمان عشماوي	ShamAY	23068	0.25776
		شرح شواهد المغني	عبد الرحمن بن أبي بكر، جلال الدين السيوطي (المتوفى: 911 هـ)	ShamAY	32346	0.25775
		مجموعة الرسائل والمسائل النجدية	مجموعة من المؤلفين	ShamAY	37978	0.25775
		روح المعاني [ج ٨]	أبي الفضل شهاب الدين السيّد محمود الألوسي البغدادي	Rafed	3192	0.25775
		 أبهى المداد في شرح مؤتمر علماء بغداد 	 مقاتل ابن عطية 	ABLibrary	8320	0.25774
		أهوال القبور وأحوال أهلها إلى النشور ط العصرية	زين الدين عبد الرحمن بن أحمد بن رجب الحنبلي (المتوفى: 795هـ)	ShamAY	33761	0.25773
		الذخائر والعبقريات - معجم ثقافي جامع	عبد الرحمن بن عبد الرحمن بن سيد بن أحمد البرقوقي الأديب المصري (المتوفى: 1363هـ)	ShamAY	819	0.25773
		غزوة فتح مكة في ضوء السنة المطهرة	عبد الرحمن بن سعيد بن علي بن وهف القحطاني (المتوفى: 1422هـ)	ShamAY	1863	0.25773
		التفسير المنير [ج ٢٥]	الدكتور وهبة الزحيلي	Rafed	2973	0.25773
		المرشد إلى فهم أشعار العرب	عبد الله بن الطيب بن عبد الله بن الطيب بن محمد بن أحمد بن محمد المجذوب (المتوفى: 1426 ه)	Sham19Y	150936	0.25772
		بين الطليعة والتهافت	د. ماهر ياسين الفحل	ShamAY	37268	0.25771
		دروس للشيخ صالح بن حميد	صالح بن حميد	Sham19Y	7735	0.25771
		تحقيق القول بالعمل بالحديث الضعيف	د. عبد العزيز عبد الرحمن بن محمد العثيم	ShamAY	10050	0.2577
		مسألة الإيمان دراسة تأصيلية	علي بن عبد العزيز بن علي الشبل	ShamAY	1929	0.2577
		شرح مختصر الخرقي - عبد الكريم الخضير	عبد الكريم الخضير	ShamelaY19	26252	0.2577
		الأربعون حديثاً عن أربعين شيخاً من أربعين صحابياً في فضائل الإمام أمير المؤمنين(ع)	الشيخ منتجب الدين علي بن بابويه القمي	Masaha	4533	0.2577
		شرح شافية ابن الحاجب - الجزء2	نجم الأئمة رضي الدين الاسترابادي	Masaha	3162	0.2577
		سيرتنا وسنتنا	الشيخ عبد الحسين الأميني النجفي	Masaha	305	0.25769
		الإرشادات في تقوية الأحاديث بالشواهد والمتابعات	أبو معاذ طارق بن عوض الله بن محمد	ShamAY	9938	0.25768
		الشرك في القديم والحديث	أبو بكر محمد زكريا	ShamelaY19	145209	0.25768
		القوانين المحكمة في الأصول - الجزء1	الميرزا القمي	Masaha	3479	0.25767
		شفاء السقام في زياره خير الانام	تقي الدين السبكي	Ghbook	5294	0.25767
		القصيدة الوردية في سيرة خير البرية	عبد الكريم بن محمد بن فاتح بن سليمان بن مصطفى بن محمد المدرس المشهور بالشيخ عبد الكريم بيارة (المتوفى: 1426هـ)	ShamAY	23661	0.25766
		مواقف فى الدعوة والتربية	عباس السيسي	ShamAY	33233	0.25766
		أمالي المرتضى غرر الفوائد ودرر القلائد (معتزلي)	الشريف المرتضى علي بن الحسين الموسوي العلوي (355 - 436 ه)	ShamelaY19	20937	0.25766
		الفرقان في تفسير القرآن بالقرآن والسنّة [ج ١٠]	الشيخ محمد الصادقي	Rafed	3021	0.25766
		مستمسك العروة الوثقى [ج ١٤]	آية الله السيد محسن الطباطبائي الحكيم	Rafed	422	0.25766
		الأمثل في تفسير كتاب الله المنزل - الجزء2	الشيخ ناصر مكارم الشيرازي	Masaha	95	0.25765
		شرح شذور الذهب في معرفة كلام العرب	شمس الدين محمد بن عبد المنعم بن محمد الجَوجَري القاهري الشافعي (المتوفى: 889هـ)	ShamAY	9134	0.25763
		نحو منهج أمثل لتفسير القرآن - مؤتمر ماليزيا	أحمد بن محمد الشرقاوى	ShamAY	36819	0.25763
		 الكهف والرقيم في شرح بسم الله الرحمن الرحيم ( ويليه شرح الكهف والرقيم ) 	 عبد الكريم بن ابراهيم الجيلي 	ABLibrary	8812	0.25763
		حديث ردالشمس	آيت الله علي حسيني ميلاني	Ghbook	15922	0.25762
		فرائد الاصول	مرتضي انصاري (اعظم انصاري)	Ghbook	12191	0.25762
		مذكرة مختصرة في تخريج الأحاديث النبوية	سامي بن محمد بن جاد الله	ShamAY	37288	0.25761
		 الجوامع والفوارق بين السنة والشيعة 	 محمد جواد مغنيه 	ABLibrary	8406	0.25761
		الواسطة في معرفة أحوال مالطة ، كشف المخبّا عن فنون أوروبّة	أحمد فارس الشدياق	Rafed	2254	0.25761
		مستمسك العروة الوثقى [ج ١٠]	آية الله السيد محسن الطباطبائي الحكيم	Rafed	418	0.2576
		 تلخيص الشافي 	 الشيخ الطوسي 	ABLibrary	8392	0.25759
		التعصب بين المسيحية والإسلام	محمد الغزالي	ShamAY	36030	0.25758
		مناقب الشيخين في التفسير و الحديث عرض و نقد: محاضرات الشيخ نجم الدين الطبسي	نجم الدين طبسي	Ghbook	16274	0.25758
		الإمام أحمد بن حنبل الشيباني ومسنده	أحمد بن عبدالرحمن بن سليمان الصويان	ShamAY	37336	0.25757
		 الحاكمية في الإسلام 	 السيد محمد مهدي الموسوي الخلخالي 	ABLibrary	9628	0.25757
		الإرشاد في معرفة حجج الله على العباد [ج ٢]	محمّد بن محمّد النعمان العكبري [ الشيخ المفيد ]	Rafed	429	0.25757
		مناقب الإمام علي بن أبي طالب عليه السلام	أبي الحسن علي بن محمّد الشافعي [ ابن المغازلي ]	Rafed	3743	0.25756
		الإنصاف في مسائل دام فيها الخلاف [ج ١]	الشيخ جعفر السبحاني	Rafed	688	0.25756
		ارشاد العباد الي استحباب ليس السواد علي سيدالشهدا و الائمه الامجاد ( عليهم السلا...	جعفر طباطبائي حائري	Ghbook	5897	0.25756
		المفصل في أحكام الربا	الواحدي :: علي بن نايف الشحود	ShamAY	36096	0.25753
		الحسام الماحق لكل مشرك ومنافق	أبو شكيب محمد تقي الدين بن عبد القادر الهلالي (المتوفى: 1407هـ)	ShamAY	1702	0.25753
		كتاب المراتب في فضائل أمير المؤمنين و سيد الوصيين(ع)	أبو القاسم إسماعيل بن أحمد البستي‏	Masaha	2490	0.25752
		الطفل بين الوراثة والتربية - الجزء1	الشيخ محمد تقي الفلسفي	Masaha	560	0.25751
		الرسائل للجاحظ	عمرو بن بحر بن محبوب الكناني بالولاء، الليثي، أبو عثمان، الشهير بالجاحظ (المتوفى: 255هـ)	ShamAY	10428	0.2575
		مفاهيم القرآن [ج ٥]	الشيخ جعفر السبحاني	Rafed	273	0.2575
		النشر فى القراءات العشر [ج ٢]	الحافظ أبي الخير محمّد بن محمّد الدمشقي	Rafed	1120	0.2575
		فتح القدير للشوكاني	محمد بن علي بن محمد بن عبد الله الشوكاني اليمني (المتوفى: 1250هـ)	ShamAY	23623	0.25749
		فتح القدير للشوكاني	محمد بن علي بن محمد بن عبد الله الشوكاني اليمني (المتوفى: 1250ه)	ShamelaY19	23623	0.25749
		شفاء العليل	شمس الدّين محمّد بن أبي بكر بن أيّوب الزّرعي [ ابن قيّم الجوزيّة ]	Rafed	3602	0.25749
		الآثار الفكرية أشعار وكتابات عبد الله باشا فكري	أمين فكري	ShamAY	34492	0.25748
		بغية الوعاة في طبقات اللغويين والنحاة	عبد الرحمن بن أبي بكر، جلال الدين السيوطي (المتوفى: 911هـ)	ShamAY	6744	0.25748
		المحيط في اللّغة [ج ٤]	إسماعيل بن عبّاد [ كافي الكفاة ]	Rafed	2861	0.25748
		الطيوريات	أبو طاهر السِّلَفي	ShamAY	9634	0.25747
