automatic URI	Proposed URI	bookTitle	authorName	collection	id	tfidf
		 موسوعة الإمام الهادي ( ع ) 	 الشيخ أبو القاسم الخزعلي 	ABLibrary	7845	0.27721
		 مجلة فقه أهل البيت ( ع ) 	 مجموعة مؤلفين 	ABLibrary	9749	0.2772
		 المنية في حكم الشارب واللحية 	 محمد رضا الطبسي النجفي 	ABLibrary	9428	0.27719
		 فقه الحدود والتعزيرات 	 السيد عبد الكريم الموسوي الاردبيلي 	ABLibrary	9532	0.27716
		 ولاية الفقيه ، تأريخها ومبانيها 	 محسن الحيدري 	ABLibrary	9626	0.27711
		 ألفية السيرة النبوية ( نظم الدّرر السنية في السّير الزكية ) 	 زين الدّين عبد الرّحيم بن الحسين العراقي 	ABLibrary	7421	0.27711
		سد المفر علي منكر عالم الذر	علي رضوي	Ghbook	12135	0.27709
		 أخبار مكة في قديم الدهر وحديثه 	 محمد بن اسحاق ابن العباس الفاكهي المكي 	ABLibrary	8922	0.27705
		 بهجة النظر في إثبات الوصاية والإمامة للأئمة الاثني عشر ( ع ) 	 السيد هاشم البحراني 	ABLibrary	7444	0.27696
		 مجموعه رسائل ابن عربي 	 ابن عربي 	ABLibrary	8752	0.27694
		 حياة الإمام الحسين ( ع ) 	 الشيخ باقر شريف القرشي 	ABLibrary	7496	0.27693
		حول التوسل	خليفه عبيد كلباني عماني	Ghbook	7635	0.27682
		 الإنسان الكامل في معرفة الأواخر والأوائل 	 عبد الكريم بن ابراهيم الجيلي 	ABLibrary	8810	0.27681
		 نفح الطيب من غصن الأندلس الرطيب 	 أحمد بن محمد المقري التلمساني 	ABLibrary	9300	0.27675
		 المرجعية والقيادة 	 السيد كاظم الحائري 	ABLibrary	9612	0.27673
		 مجلة فقه أهل البيت ( ع ) 	 مجموعة مؤلفين 	ABLibrary	9742	0.27665
		 استدراكات البعث والنشور 	 أحمد بن الحسين البيهقي 	ABLibrary	8331	0.27662
		 مباني منهاج الصالحين 	 السيد تقي الطباطبائي القمي 	ABLibrary	9723	0.2766
		 الجواهر الفخرية في شرح الروضة البهية 	 قدرت الله وجداني فخر 	ABLibrary	9449	0.27649
		 الزبدة الفقهية في شرح الروضة البهية 	 السيد محمد حسن الترحيني العاملي 	ABLibrary	9692	0.27647
		البيان في عقائد اهل الايمان	محمد باقر شريعتي اصفهاني	Ghbook	7533	0.27644
		 رحلة المكناسي 	 محمد بن عبد الوهاب المكناسي 	ABLibrary	9109	0.27641
		 في رحاب أهل البيت ( ع ) 	 لجنة بحوث المجمع العالمي لأهل البيت ( ع ) 	ABLibrary	8544	0.2764
		 عنقا مغرب في ختم الأولياء وشمس المغرب 	 ابن عربي 	ABLibrary	8734	0.2764
		 الخيال عالم البرزخ والمثال من كلام الشيخ الأكبر 	 محمود محمود الغراب 	ABLibrary	8909	0.2762
		الثاقب في المناقب	عماد الدين ابي جعفر محمدبن علي طوسي ابن حمزه	Ghbook	5226	0.27609
		سفينه البحار و مدينه الحكم و الاثار مع تطبيق النصوص الوارده فيها علي بحار الانوا...	عباس قمي	Ghbook	12046	0.27608
		 حواريات فقهية 	 السيد محمد سعيد الحكيم 	ABLibrary	9615	0.27607
		 في رحاب أهل البيت ( ع ) 	 لجنة بحوث المجمع العالمي لأهل البيت ( ع ) 	ABLibrary	8548	0.27586
		شرح منهاج الكرامه في معرفه الامامه	آيت الله علي حسيني ميلاني	Ghbook	4777	0.27571
		 جواهر الكلام في ثوبه الجديد 	 الشيخ الجواهري 	ABLibrary	9368	0.27567
		منهج الرشاد في معرفه المعاد	محمد نعيم  بن محمدتقي نعيما طالقاني	Ghbook	16366	0.27555
		 الموسوعة الكبرى عن فاطمة الزهراء ( س ) 	 اسماعيل الأنصاري الزنجاني الخوئيني 	ABLibrary	7821	0.27547
		 سند العروة الوثقى ( كتاب الطهارة ) 	 الشيخ محمد السند 	ABLibrary	9547	0.27539
		 موسوعة مصطلحات التصوف الإسلامي 	 رفيق العجم 	ABLibrary	8899	0.27534
		 الأنوار في علم الاسرار ومقامات الأبرار 	 عبد الرحمن بن محمد البكري 	ABLibrary	8701	0.27532
		القطره من بحار مناقب النبي والعتره عليهم السلام	احمد مستنبط	Ghbook	11371	0.27526
		 في رحاب أهل البيت ( ع ) 	 لجنة بحوث المجمع العالمي لأهل البيت ( ع ) 	ABLibrary	8546	0.27526
		دفع الشبه عن الرسول (ص) و الرساله	ابوبكر بن محمد حصني	Ghbook	5310	0.27518
		 خلاصة عبقات الأنوار 	 السيد حامد النقوي 	ABLibrary	91	0.27498
		 ولاية الأمر في عصر الغيبة 	 السيد كاظم الحائري 	ABLibrary	9614	0.27495
		لا تخونوا الله و الرسول !	صباح علي بياتي	Ghbook	4576	0.27487
		 الفقه ومسائل طبية 	 الشيخ محمد آصف المحسني 	ABLibrary	9737	0.27485
		 حسن المحاضرة في أخبار مصر والقاهرة 	 جلال الدين السيوطي 	ABLibrary	9036	0.27475
		 موسوعة الإمام الهادي ( ع ) 	 الشيخ أبو القاسم الخزعلي 	ABLibrary	7843	0.27474
		 الأنوار القدسية في معرفة قواعد الصوفية 	 عبد الوهاب الشعراني 	ABLibrary	8832	0.27471
		 دلائل الصدق لنهج الحق 	 الشيخ محمد حسن المظفر 	ABLibrary	941	0.27464
		 موسوعة مصطلحات علم الكلام الإسلامي 	 سميح دغيم 	ABLibrary	8657	0.27463
		 زاد المعاد ( ويليه مفتاح الجنان ) 	 العلامة المجلسي 	ABLibrary	9341	0.27461
		مسائل فقهيه	عبدالحسين شرف الدين	Ghbook	7706	0.2746
		 مقتل الإمام أمير المؤمنين على بن أبى طالب ( ع ) 	 ابن أبي الدنيا 	ABLibrary	7771	0.27455
		 التوحيد 	 أبي منصور محمد الماتريدي السمرقندي الأنصاري 	ABLibrary	8398	0.27445
		 شرح المقاصد 	 التفتازاني 	ABLibrary	8467	0.27444
		 دفاع عن الرسول ضد الفقهاء والمحدثين 	 صالح الورداني 	ABLibrary	881	0.27434
		 اعتقادات فرق المسلمين والمشركين 	 فخر الدين الرازي 	ABLibrary	8341	0.27431
		 المرتقى إلى الفقه الأرقى ( كتاب الزكاة ) 	 السيد محمد الروحاني 	ABLibrary	9468	0.27424
		 البحر المحيط في أصول الفقه 	 الزركشي 	ABLibrary	804	0.27411
		 هداية الأبرار إلى طريق الأئمة الأطهار ( ع ) 	 الشيخ حسين الكركي العاملي 	ABLibrary	9334	0.27409
		 سلسلة المسائل الفقهية 	 الشيخ السبحاني 	ABLibrary	9570	0.27403
		ارشاد العباد الي استحباب ليس السواد علي سيدالشهدا و الائمه الامجاد ( عليهم السلا...	جعفر طباطبائي حائري	Ghbook	5897	0.27401
		اقناع اللائم علي اقامه الماتم	محسن امين عاملي	Ghbook	5900	0.274
		تراثنا ـ العددان [ 71 و 72 ]	مؤسسة آل البيت عليهم السلام لإحياء التراث ـ قم	Rafed	3304	0.27389
		 خزانة التواريخ النجدية 	 عبد الله بن عبد الرحمن آل بسام 	ABLibrary	9052	0.27387
		 كتاب الماء 	 ابن الذهبي 	ABLibrary	7942	0.27383
		 الحياة الفكرية والسياسية لأئمة أهل البيت ( ع ) 	 الشيخ رسول جعفريان 	ABLibrary	7511	0.27381
		 الدلائل في شرح منتخب المسائل 	 السيد تقي الطباطبائي 	ABLibrary	9706	0.27378
		 فضائل أمير المؤمنين ( ع ) 	 ابن عقدة الكوفي 	ABLibrary	7899	0.27378
		 فتوح مصر والمغرب 	 ابن عبد الحكم 	ABLibrary	9150	0.27375
		 بحار الأنوار 	 العلامة المجلسي 	ABLibrary	751	0.27371
		الفوائد المدنيه	حسين  الشيخ الاسلامي  التويسركاني	Ghbook	11210	0.27342
		 مباني منهاج الصالحين 	 السيد تقي الطباطبائي القمي 	ABLibrary	9722	0.27331
		 مع الركب الحسيني 	 مجموعة مؤلفين 	ABLibrary	7745	0.27325
		 نظام القضاء والشهادة في الشريعة الإسلامية الغراء 	 الشيخ السبحاني 	ABLibrary	9601	0.27322
		البدعه مفهومها، حدها و آثارها	آيت الله العظمي جعفر سبحاني	Ghbook	7531	0.27309
		محاكمات الخلفاء و اتباعهم	جواد جعفر خليلي	Ghbook	7701	0.27304
		 الديباج على مسلم 	 جلال الدين السيوطي 	ABLibrary	884	0.27304
		الاربعون حديثا في اثبات امامه اميرالمومنين عليه السلام 	عبدالله بحراني اصفهاني	Ghbook	15555	0.27303
		 عمدة المطالب في التعليق على المكاسب 	 السيد تقي الطباطبائي القمي 	ABLibrary	9710	0.27274
		علي امامنا و امامكم ابوبكر	محمد رضي رضوي	Ghbook	7652	0.27273
		تظلم الزهراء من اهراق دماء آل العباء	رضي بن نبي قزويني	Ghbook	5950	0.27262
		 إثبات الهداة بالنصوص والمعجزات 	 الحر العاملي 	ABLibrary	7391	0.2726
		 مصطفى ، الدين القيم 	 الشيخ بشير النجفي 	ABLibrary	9766	0.27256
		التبرك والتوسل والصلح مع العدو الصهيوني في رسالتين	فتح الله محمدي نجارزادگان	Ghbook	3347	0.2725
		خواص الاشياء	بختيشوع بن جبرئيل	Ghbook	10033	0.27245
		 الحج في السنة 	 معاونية شؤون التعليم والبحوث الإسلامية في الحج 	ABLibrary	9764	0.27239
		 أبناء الرسول في كربلاء 	 خالد محمد خالد 	ABLibrary	87	0.27239
		 شرح ديوان ابن الفارض 	 الحسن بن محمد البوريني وعبد الغني النابلسي 	ABLibrary	8859	0.27237
		 نتائج الأفكار القدسية في بيان معاني شرح الرسالة القشيرية 	 الشيخ عبد الله العروسي 	ABLibrary	8825	0.27235
		 ينابيع الأحكام في معرفة الحلال والحرام 	 السيد علي الموسوي القزويني 	ABLibrary	9389	0.27234
		 الموسوعة الكبرى عن فاطمة الزهراء ( س ) 	 اسماعيل الأنصاري الزنجاني الخوئيني 	ABLibrary	7833	0.27229
		 رد الحموي على الوهابية 	 السيد أحمد الحموي 	ABLibrary	901	0.27226
		 إعلام النبلاء بتاريخ حلب الشهباء 	 محمد راغب الطباخ الحلبي 	ABLibrary	8960	0.27226
		 مسند الإمام الصادق ( ع ) 	 الشيخ عزيز الله عطاردي 	ABLibrary	7734	0.2722
		دعوه الي سبيل المومنين	طارق زين العابدين	Ghbook	7645	0.27216
		 شرح آقا جمال خوانسارى بر غرر الحكم ودرر الكلم ( فارسي ) 	 جمال الدين محمد الخوانساري 	ABLibrary	7934	0.2721
		 حياة الإمام الحسين ( ع ) 	 الشيخ باقر شريف القرشي 	ABLibrary	7495	0.27208
		 سلسلة المسائل الفقهية 	 الشيخ السبحاني 	ABLibrary	9577	0.27207
		الروائع المختاره من خطب الامام الحسن عليه السلام 	مصطفي موسوي	Ghbook	6066	0.27203
		ائمه اهل البيت عليهم السلام	علي آل محسن	Ghbook	2602	0.27203
		 الكشف عن مناهج الأدلة في عقائد الملة 	 ابن رشد 	ABLibrary	8577	0.27198
		 شرح أصول الكافي 	 صدر الدين محمد الشيرازي ( صدر المتألهين ) 	ABLibrary	7915	0.27195
		دفع المناواة عن التفضيل المساواة	سيدمهدي رجايي	Ghbook	15632	0.27191
		فقهيات بين السنه و الشيعه	عاطف سلام	Ghbook	7683	0.27189
		ثم اهتديت ...	محمد تيجاني سماوي	Ghbook	7621	0.27186
		الاعتصام بالكتاب و السنه	آيت الله العظمي جعفر سبحاني	Ghbook	7525	0.27185
		 مقالات الإسلاميين واختلاف المصلين 	 أبو الحسن الأشعري 	ABLibrary	8637	0.27185
		 رسالة في تواريخ النبي والآل ( ع ) 	 الشيخ محمد تقي التستري 	ABLibrary	7533	0.27184
		 الدر المنضود في أحكام الحدود 	 تقرير بحث السيد الگلپايگاني للجهرمي 	ABLibrary	9441	0.27182
		 الموسوعة الكبرى عن فاطمة الزهراء ( س ) 	 اسماعيل الأنصاري الزنجاني الخوئيني 	ABLibrary	7839	0.27165
		 تاريخ اربل ( نباهة البلد الخامل بمن ورده من الاماثل ) 	 ابن المستوفي 	ABLibrary	8978	0.27163
		 الزبدة الفقهية في شرح الروضة البهية 	 السيد محمد حسن الترحيني العاملي 	ABLibrary	9694	0.27148
		 أمراء الكوفة وحكامها 	 محمد على آل خليفة 	ABLibrary	8937	0.27139
		بحوث في الملل و النحل	آيت الله العظمي جعفر سبحاني	Ghbook	6746	0.27125
		إرشاد العباد إلى لبس السواد على سيد الشهداء و الأئمة الأمجاد	السيد جعفر الطباطبائي الحائري	Masaha	1795	0.27116
		 رحلة العبدري 	 أبو عبد الله العبدري 	ABLibrary	9101	0.2711
		 القواعد الكشفية الموضحة لمعانى الصفات الإلهية 	 عبد الوهاب الشعراني 	ABLibrary	8841	0.27109
		 إثنا عشر رسالة 	 السيد محمد باقر الداماد ( الميرداماد ) 	ABLibrary	839	0.27106
		اعلام الوري 	طبرسي ( معروف ) ، امين الاسلام ابوعلي فضل بن حسن ( صاحب مجمع البيان و اعلام الوري و... )	Ghbook	2363	0.27094
		 ديوان الحقائق ومجموع الرقائق 	 الشيخ عبد الغني النابلسي 	ABLibrary	8856	0.27085
		عده الداعي و نجاح الساعي	احمد بن شمس الدين محمد ابن فهد حلي	Ghbook	2579	0.27074
		 البراهين الواضحات ( دراسات في القضاء ) 	 الشيخ محمد علي اسماعيل پور القمشه‌اى 	ABLibrary	9702	0.27068
		 أعيان الشيعة 	 السيد محسن الأمين 	ABLibrary	80	0.27066
		 اللوامع الإلهية في المباحث الكلامية 	 المقداد السيوري 	ABLibrary	8584	0.27064
		سنن النبي ( صلي الله عليه و آله )	محمد حسين طباطبايي	Ghbook	5292	0.27045
		 الاربعينيات لكشف أنوار القدسيات 	 القاضي سعيد القمي 	ABLibrary	8853	0.27039
		 شرح مشاهد الأسرار القدسية ومطالع الأنوار الإلهية 	 ست العجم بنت النفيس البغدادية 	ABLibrary	8822	0.27031
		 النظرة الدقيقة في قاعدة بسيط الحقيقة 	 محمود شهابي 	ABLibrary	8868	0.2703
		 البداء في ضوء الكتاب والسنة 	 الشيخ السبحاني 	ABLibrary	8364	0.27019
		مع الحديدي في شرحه: مقتطفات هامة من شرح ابن ابي الحديد	علي خادمي	Ghbook	15626	0.27018
		 شرح فصوص الحكم 	 مصطفى بن سليمان بالي زاده الحنفي 	ABLibrary	8849	0.27012
		 كتاب الحج 	 السيد حسن الطباطبائي 	ABLibrary	9503	0.27007
		 العوالم ، الإمام الرضا ( ع ) 	 الشيخ عبد الله البحراني 	ABLibrary	7620	0.27002
		 في رحاب أهل البيت ( ع ) 	 لجنة بحوث المجمع العالمي لأهل البيت ( ع ) 	ABLibrary	8533	0.26999
		قبس من القرآن في صفات الرسول الاعظم ( صلي الله عليه و آله و سلم )	عبداللطيف بغدادي	Ghbook	5299	0.26996
		 المواعظ والإعتبار في ذكر الخطط والآثار ( ط بيروت ) 	 المقريزي 	ABLibrary	9236	0.26983
		موسوعة معارف الكتاب والسنة	محمد محمدي ري شهري	Ghbook	15912	0.26982
		 ديوان ابن عربي 	 ابن عربي 	ABLibrary	8737	0.2698
		 نفح الطيب من غصن الأندلس الرطيب 	 أحمد بن محمد المقري التلمساني 	ABLibrary	9305	0.26979
		 كتاب الزكاة 	 الشيخ المنتظري 	ABLibrary	9528	0.26978
		الكبائر من الذنوب	حسين الشاكري	Ghbook	4638	0.26974
		 موسوعة التصوف الاسلامي 	 محمود حمدي زقزوق 	ABLibrary	8914	0.26971
		 الدرر في اختصار المغازي والسير 	 ابن عبد البر 	ABLibrary	7522	0.26967
		 دروس تمهيدية في الفقه الاستدلالي على المذهب الجعفري 	 الشيخ محمد باقر الإيرواني 	ABLibrary	9540	0.26961
		 فرق الشيعة 	 حسن بن موسى النوبختي 	ABLibrary	8523	0.26961
		 مصطلحات الفقه 	 الشيخ علي المشكيني 	ABLibrary	9775	0.26947
		 موسوعة كشاف اصطلاحات الفنون والعلوم 	 محمد علي التهانوي 	ABLibrary	8654	0.26938
		 في رحاب أهل البيت ( ع ) 	 لجنة بحوث المجمع العالمي لأهل البيت ( ع ) 	ABLibrary	8531	0.26937
		آيات الغدير	مركز المصطفي للدراسات الاسلاميه - برعايه آيه الله السيستاني	Ghbook	2706	0.26935
		 موسوعة الإمام الجواد ( ع ) 	 الشيخ أبو القاسم الخزعلي 	ABLibrary	7841	0.26931
		القمقام الزخار والصمصام البتار	فرهاد ميرزا قاجار	Ghbook	12701	0.26928
		نوادر الاثر في علم عمر	عبدالحسين اميني ( علامه اميني )	Ghbook	4588	0.26925
		 مباني منهاج الصالحين 	 السيد تقي الطباطبائي القمي 	ABLibrary	9727	0.26924
		 الجواهر الفخرية في شرح الروضة البهية 	 قدرت الله وجداني فخر 	ABLibrary	9453	0.2692
		جامع الاخبار او معارج اليقين في اصول الدين	محمد بن محمد [ شعيري ]	Ghbook	14703	0.26908
		الحكمه المتعاليه في الاسفار العقليه الاربعه	محمد بن ابراهيم صدرالدين شيرازي	Ghbook	12174	0.26907
		 شرح أصول الكافي 	 صدر الدين محمد الشيرازي ( صدر المتألهين ) 	ABLibrary	7918	0.26907
		 أساس الحكومة الإسلامية 	 السيد كاظم الحائري 	ABLibrary	9607	0.26906
		اصل الشيعه و اصولها	محمد حسين آل كاشف الغطاء	Ghbook	12190	0.26904
		 شرح المقاصد 	 التفتازاني 	ABLibrary	8466	0.26901
		فضائل آل الرسول ( صلي الله عليه و آله و سلم ) من الصواعق المحرقه ( لابن حجر المك...	آيت الله العظمي سيد محمد حسيني شيرازي	Ghbook	8082	0.26888
		منتخب الصحاح	محمد باقربن محمدنقي شفتي بيدآبادي	Ghbook	13081	0.26882
		 ذخائر الأعلاق شرح ترجمان الأشواق 	 ابن عربي 	ABLibrary	8736	0.26879
		 العرف الوردي في أخبار المهدي 	 جلال الدين السيوطي 	ABLibrary	7607	0.26873
		محمد ( صلي الله عليه و آله ) في القرآن	رضا صدر	Ghbook	5301	0.26872
		 شرح فروع الكافي 	 محمد هادي المازندراني 	ABLibrary	9344	0.26865
		تفريغ الفواد لمعرفه المبدا و المعاد	ابوالقاسم بن محمد بن احمد ابوالقاسم نراقي	Ghbook	14752	0.26855
		 الإرشاد إلى قواطع الأدلة في أول الاعتقاد 	 عبد الملك الجويني 	ABLibrary	8329	0.26855
		 موسوعة العتبات المقدسة 	 جعفر الخليلي 	ABLibrary	9244	0.26851
		ارشاد العباد الى استحباب لبس السواد على سيد الشهداء والائمة الامجاد عليهم السلام	السيد ميرزا جعفر الطباطبائي الحائري	Rafed	180	0.26846
		 مباني منهاج الصالحين 	 السيد تقي الطباطبائي القمي 	ABLibrary	9728	0.26831
		العقائد الاسلامية	علي كوراني	Ghbook	15126	0.26827
		التبرك	سيد جعفرمرتضي حسيني عاملي	Ghbook	7503	0.26819
		 مكاتيب الأئمة ( ع ) 	 علي الأحمدي الميانجي 	ABLibrary	7780	0.26796
		 الديباج على مسلم 	 جلال الدين السيوطي 	ABLibrary	883	0.26795
		 صلاة الجمعة 	 السيد محمد حسين الطهراني 	ABLibrary	9443	0.26781
		 في رحاب أهل البيت ( ع ) 	 لجنة بحوث المجمع العالمي لأهل البيت ( ع ) 	ABLibrary	8559	0.26779
		ايمان ابي طالب عليه السلام و سيرته	عبدالحسين اميني ( علامه اميني )	Ghbook	7610	0.26776
		 في رحاب أهل البيت ( ع ) 	 لجنة بحوث المجمع العالمي لأهل البيت ( ع ) 	ABLibrary	8552	0.26774
		 الصحابي وعدالته 	 السيد مرتضى العسكري 	ABLibrary	8486	0.26771
		 الموسوعة الكبرى عن فاطمة الزهراء ( س ) 	 اسماعيل الأنصاري الزنجاني الخوئيني 	ABLibrary	7825	0.26767
		 نحو القلوب 	 ابو القاسم عبد الكريم القشيري 	ABLibrary	8713	0.26767
		 شرح فروع الكافي 	 محمد هادي المازندراني 	ABLibrary	9347	0.26765
		 أدوار الفقه الإمامي 	 الشيخ السبحاني 	ABLibrary	9774	0.26765
		الارشاد و التطريز في فضل ذكر الله و تلاوه كتابه العزيز	عبدالله بن اسعد بن علي يافعي	Ghbook	2795	0.26758
		 الدلائل في شرح منتخب المسائل 	 السيد تقي الطباطبائي 	ABLibrary	9707	0.26757
		الامام الصادق ( عليه السلام ) علم و عقيده	رمضان لاوند	Ghbook	4982	0.26754
		 نظام الإرث في الشريعة الإسلامية الغراء 	 الشيخ السبحاني 	ABLibrary	9599	0.2675
		 دراسات في نهج البلاغة 	 الشيخ محمد مهدي شمس الدين 	ABLibrary	917	0.26749
		 الأرج المسكي في التاريخ المكي وتراجم الملوك والخلفاء 	 علي بن عبد القادر الطبري 	ABLibrary	8928	0.26747
		 سنن أبي داود 	 سليمان بن الأشعث السجستاني 	ABLibrary	85	0.26746
		 إقبال الأعمال ( ط . ق ) 	 السيد ابن طاووس 	ABLibrary	7907	0.26733
		 الموسوعة الكبرى عن فاطمة الزهراء ( س ) 	 اسماعيل الأنصاري الزنجاني الخوئيني 	ABLibrary	7819	0.2673
		جمع الكلمه و تعدد الاحزاب	آيت الله العظمي سيد محمد حسيني شيرازي	Ghbook	8142	0.26722
		 الانتصارات الإسلامية في كشف شبه النصرانية 	 سليمان بن عبد القوي الطوفي الصرصي الحنبلي 	ABLibrary	8312	0.2672
		الاخلاق	عبدالله بن محمدرضا شبر حسيني كاظميني	Ghbook	12378	0.26717
		 أدب الطف أو شعراء الحسين ( ع ) 	 جواد شبر 	ABLibrary	7404	0.26713
		 الزكاة في الشريعة الإسلامية الغراء 	 الشيخ السبحاني 	ABLibrary	9567	0.26711
		تاريخ المدينه	محمد بن احمد نهرواني	Ghbook	11109	0.26704
		من كرامات الاولياء	آيت الله العظمي سيد محمد حسيني شيرازي	Ghbook	7841	0.26693
		حليه الابرار في احوال محمد و آله الاطهار عليهم السلام	هاشم بن سليمان بحراني	Ghbook	9259	0.26691
		 فرائد السمطين في فضائل المرتضى والبتول والسبطين والأئمة من ذريتهم ( ع ) 	 ابراهيم بن سعد الدين الشافعي 	ABLibrary	7629	0.26684
		 فقه الحج 	 الشيخ لطف الله الصافي الگلپايگاني 	ABLibrary	9740	0.26677
		آيات الغدير	علي كوراني	Ghbook	7506	0.26676
		البيان الجلي في افضليه مولي المومنين علي عليه السلام 	عيدروس بن احمد السقاف ابن رويش اندونيسي	Ghbook	8351	0.26675
		 نتائج الأفكار القدسية في بيان معاني شرح الرسالة القشيرية 	 الشيخ عبد الله العروسي 	ABLibrary	8824	0.26674
		تمسك  العترة الطاهرة باقرآن  الكريم: دراسة تفصيلية حول الايات  التي تمسك بها  ال...	محمد جعفر طبسي	Ghbook	15964	0.26659
		 موسوعة أحكام الأطفال وأدلتها 	 مركز فقه الأئمة الأطهار ( ع ) 	ABLibrary	9672	0.26658
