automatic URI	Proposed URI	bookTitle	authorName	collection	id	tfidf
		 الكامل في التاريخ ( تاريخ كامل ) ( فارسي ) 	 ابن الأثير ( مترجم : خليلى / حالت ) 	ABLibrary	7663	0.68125
		 عبقات الأنوار في إمامة الأئمة الأطهار ( فارسي ) 	 السيد حامد النقوي 	ABLibrary	8508	0.68066
		 تاريخ لرستان ( روزگار پهلوى ) ( فارسى ) 	 محمد رضا واليزاده معجزى 	ABLibrary	8063	0.68053
		 ظفرنامه خسروى ( شرح حكمروايى سيد امير نصر الله بهادر سلطان بن حيدر بر بخارا وسمرقند ، 1277 - 1242 ه . ق ) ( فارسى ) 	 مؤلف مجهول 	ABLibrary	8234	0.68017
		 دفتر تاريخ ( مجموعه اسناد و منابع تاريخى ) ( فارسى ) 	 ايرج افشار 	ABLibrary	8133	0.68004
		 الكامل في التاريخ ( تاريخ كامل ) ( فارسي ) 	 ابن الأثير ( مترجم : خليلى / حالت ) 	ABLibrary	7675	0.67986
		 تاريخ هرودت ( فارسى ) 	 هرودت ( مترجم : هدايتى ) 	ABLibrary	8085	0.67985
		 تاريخ ادبيات در ايران ( فارسى ) 	 ذبيح الله صفا 	ABLibrary	8004	0.67925
		 صحيفة الارشاد ( تاريخ افشار كرمان - پايان كار صفويه ) ( فارسى ) 	 ملا محمد مومن كرمانى 	ABLibrary	8224	0.67923
		 سيرت رسول الله ( سيرة النبي ص ) ( عربي ، فارسي ) 	 قاضى ابرقوه 	ABLibrary	7583	0.67891
		 إحياء الأطفال مظفري ( فارسي ) 	 ميرزا علي بن زين العابدين همدانى ( ميرزا علي دكتور ) 	ABLibrary	9982	0.67886
		 دلائل الصدق لنهج الحق ( فارسي ) 	 الشيخ محمد حسن المظفر ( مترجم : سپهري ) 	ABLibrary	945	0.6787
		 تاريخ عالم آراى عباسى ( فارسى ) 	 اسكندر بيگ تركمان 	ABLibrary	8054	0.67852
		 منتخب التواريخ ( فارسى ) 	 عبد القادر بن ملوك شاه بداونى 	ABLibrary	8286	0.67765
		 روزنامه خاطرات عين السلطنه ( فارسى ) 	 قهرمان ميرزا عين السلطنه 	ABLibrary	8151	0.67747
		 تجارب الأمم ( فارسى ) 	 أحمد بن محمد مسكويه الرازي ( مترجم : ابو القاسم امامى و على نقى منزوى ) 	ABLibrary	8090	0.67589
		 رستم التواريخ ( فارسى ) 	 محمد هاشم آصف ( رستم الحكماء ) 	ABLibrary	8142	0.67475
		 الكامل في التاريخ ( تاريخ كامل ) ( فارسي ) 	 ابن الأثير ( مترجم : خليلى / حالت ) 	ABLibrary	7659	0.67474
		 تاريخ الفي ( فارسى ) 	 قاضى احمد تتوى / آصف خان قزوينى 	ABLibrary	8017	0.67461
		 احياء الملوك ( تاريخ سيستان تا عصر صفوى ) ( فارسى ) 	 ملك شاه حسين بن ملك غياث الدين / محمد بن شاه محمود سيستانى 	ABLibrary	7954	0.67439
		 تاريخ عالم آراى عباسى ( فارسى ) 	 اسكندر بيگ تركمان 	ABLibrary	8052	0.6743
		 ظفرنامه ( قسم الاسلاميه ) ( فارسى ) 	 حمد الله مستوفى قزوينى 	ABLibrary	8232	0.67372
		 الكامل في التاريخ ( تاريخ كامل ) ( فارسي ) 	 ابن الأثير ( مترجم : خليلى / حالت ) 	ABLibrary	7661	0.67337
		 ايران در جنگ بزرگ 1914 - 1918 ( فارسي ) 	 احمد على سپهر ( مورخ الدوله ) 	ABLibrary	7971	0.67329
		 تاريخ سلسله سلجوقى ( زبدة النصره ونخبة العصره ) ( فارسى ) 	 فتح بن على بندارى اصفهانى ( مترجم : محمد حسين جليلى ) 	ABLibrary	8041	0.67315
		 مجموعة الوثائق السياسية للعهد النبوي و الخلافة الراشدة ( نامه ها و پيمانهاى سياسى حضرت محمد ( ص ) و اسناد صدر اسلام ) ( فارسي ) 	 محمد حميد الله ( مترجم : سيد محمد حسينى ) 	ABLibrary	7697	0.67293
		 سازمان وكالت و نقش آن در عصر ائمة ( ع ) ( فارسي ) 	 محمدرضا جبارى 	ABLibrary	7542	0.67222
		 جنگنامه كشم و جرون نامه ( فارسى ) 	 مؤلف مجهول / قدرى 	ABLibrary	8107	0.67206
		 سمط العلى للحضرة العليا ( در تاريخ قراختائيان كرمان ) ( فارسى ) 	 ناصر الدين منشى كرمانى 	ABLibrary	8209	0.67161
		 الكامل في التاريخ ( تاريخ كامل ) ( فارسي ) 	 ابن الأثير ( مترجم : خليلى / حالت ) 	ABLibrary	7662	0.67111
		 تاريخ ذو القرنين ( فارسى ) 	 ميرزا فضل الله شيرازى ( خاورى ) 	ABLibrary	8042	0.67081
		 الكامل في التاريخ ( تاريخ كامل ) ( فارسي ) 	 ابن الأثير ( مترجم : خليلى / حالت ) 	ABLibrary	7677	0.67028
		 منتخب التواريخ معينى ( فارسى ) 	 معين الدين نطنزى 	ABLibrary	8288	0.66993
		 نامه هاى حكومتى فيروز ميرزا فرمانفرما ( فارسى ) 	 فيروز ميرزا بن عباس ميرزا فرمانفرما 	ABLibrary	8292	0.66972
		 تاريخ الفي ( فارسى ) 	 قاضى احمد تتوى / آصف خان قزوينى 	ABLibrary	8014	0.66972
		 طبقات ناصرى ( تاريخ كامل ايران واسلام ) ( فارسى ) 	 منهاج سراج 	ABLibrary	8226	0.66938
		 الكامل في التاريخ ( تاريخ كامل ) ( فارسي ) 	 ابن الأثير ( مترجم : خليلى / حالت ) 	ABLibrary	7660	0.66928
		 الكامل في التاريخ ( تاريخ كامل ) ( فارسي ) 	 ابن الأثير ( مترجم : خليلى / حالت ) 	ABLibrary	7658	0.66919
		 مناقب الطاهرين ( فارسي ) 	 عماد الدين حسن بن علي الطبري 	ABLibrary	7782	0.66905
		 تاريخ خانى ( شامل حوادث چهل ساله گيلان ) ( فارسى ) 	 على بن شمس الدين بن حاجى حسين لاهيجى 	ABLibrary	8040	0.66905
		 تاريخ ادبيات در ايران ( فارسى ) 	 ذبيح الله صفا 	ABLibrary	8007	0.66688
		 تاريخ ادبيات در ايران ( فارسى ) 	 ذبيح الله صفا 	ABLibrary	8003	0.66631
		 نظام ايالات در دوره صفويه ( فارسى ) 	 رربورن كلاوس ميشائيل ( مترجم : كيكاوس جهاندارى ) 	ABLibrary	8294	0.66588
		 روزنامه خاطرات عين السلطنه ( فارسى ) 	 قهرمان ميرزا عين السلطنه 	ABLibrary	8149	0.66575
		الكشكول - الجزء1	الشيخ البهائي	Masaha	3394	0.66547
		 مجمل رشوند ( فارسى ) 	 محمد على خان رشوند 	ABLibrary	8269	0.66516
		 تاريخ ايران باستان ( تاريخ مفصل ايران قديم ) ( فارسى ) 	 حسن پيرنيا ( مشير الدوله ) 	ABLibrary	8026	0.6651
		 تاريخ هرودت ( فارسى ) 	 هرودت ( مترجم : هدايتى ) 	ABLibrary	8082	0.66441
		موسوعة كشّاف إصطلاحات الفنون والعلوم [ج ٢]	محمّد علي التهانوي	Rafed	3030	0.66382
		 نقاوة الآثار في ذكر الاخيار در تاريخ صفويه ( فارسى ) 	 محمود بن هدايت الله افوشته اى نطنزى 	ABLibrary	8296	0.66232
		 تاريخ گيلان و ديلمستان ( فارسى ) 	 سيد ظهير الدين مرعشى 	ABLibrary	8061	0.66091
		 مطلع سعدين ومجمع بحرين ( فارسى ) 	 كمال الدين عبد الرزاق سمرقندى 	ABLibrary	8281	0.66045
		 الكامل في التاريخ ( تاريخ كامل ) ( فارسي ) 	 ابن الأثير ( مترجم : خليلى / حالت ) 	ABLibrary	7667	0.66038
		 ظفرنامه ( تاريخ فتوحات امير تيمور گوركانى ) ( فارسى ) 	 نظام الدين شامى 	ABLibrary	8233	0.66
		 تاريخ لرستان ( روزگار قاجار ) ( فارسى ) 	 محمد رضا واليزاده معجزى 	ABLibrary	8062	0.65982
		 ظفرنامه ( فارسى ) 	 شرف الدين على يزدى 	ABLibrary	8229	0.65972
		 تاريخ منتظم ناصرى ( فارسى ) 	 محمد حسن خان اعتماد السلطنه 	ABLibrary	8069	0.65886
		 شجرة الملوك ( تاريخ منظوم سيستان ) ( فارسى ) 	 صبورى / ناصح / ظهير 	ABLibrary	8218	0.65776
		 تاريخ الفي ( فارسى ) 	 قاضى احمد تتوى / آصف خان قزوينى 	ABLibrary	8018	0.65737
		 تاريخ مغول در ايران ( فارسى ) 	 برتولد اشپولر ( مترجم : محمود ميرآفتاب ) 	ABLibrary	8067	0.65638
		 الكامل في التاريخ ( تاريخ كامل ) ( فارسي ) 	 ابن الأثير ( مترجم : خليلى / حالت ) 	ABLibrary	7664	0.65608
		 تاريخ آل مظفر ( فارسي ) 	 محمود كتبى 	ABLibrary	7985	0.65506
		 مجمل التواريخ والقصص ( تصحيح نجم الدين سيف آبادى ) ( فارسى ) 	 ابن مهلب ( نواده مهلب پسر محمد پسر شادى ) 	ABLibrary	8268	0.65276
		 تزوكات تيمورى ( فارسى ) 	 ابو طالب حسينى تربتى 	ABLibrary	8095	0.65268
		 تاريخ جهان آراى عباسى ( فارسى ) 	 ميرزا محمد طاهر وحيد قزوينى 	ABLibrary	8035	0.65224
		 روزشمار تاريخ معاصر ايران ( فارسى ) 	 حسن فراهانى 	ABLibrary	8144	0.65188
		 روضات الجنات في اوصاف مدينه هرات ( فارسى ) 	 معين الدين محمد زمچى اسفزارى 	ABLibrary	8161	0.65166
		 نظام التواريخ ( فارسى ) 	 ناصر الدين بيضاوى 	ABLibrary	8293	0.65087
		 سفرنامه استرآباد و مازندران و گيلان و . . . ( فارسى ) 	 ميرزا ابراهيم 	ABLibrary	8178	0.65055
		 تاريخ ايران باستان ( تاريخ مفصل ايران قديم ) ( فارسى ) 	 حسن پيرنيا ( مشير الدوله ) 	ABLibrary	8027	0.64961
		 سلسله هاى اسلامى جديد : راهنماى گاهشمارى و تبارشناسى ( فارسى ) 	 كليفورد ادموند باسورث ( مترجم : فريدون بدره اى ) 	ABLibrary	8208	0.64919
		 عبقات الأنوار في إمامة الأئمة الأطهار ( فارسي ) 	 السيد حامد النقوي 	ABLibrary	8495	0.64903
		 پيراسته تاريخنامه هرات ( فارسى ) 	 سيف بن محمد سيفى هروى 	ABLibrary	7983	0.64823
		 تاريخ سرى مغولان ( يوان چائوپى شه ) ( فارسى ) 	 مؤلف مجهول ( مترجم : شيرين بيانى ) 	ABLibrary	8046	0.64749
		 تاريخ هيجده ساله آذربايجان ( فارسى ) 	 احمد كسروى 	ABLibrary	8086	0.64692
		 اسناد تاريخى خاندان غفارى ( فارسي ) 	 كريم اصفهانيان و بهرام غفارى و على اصغر عمران 	ABLibrary	7958	0.64413
		 سفرنانه كروسينسكى ( فارسى ) 	 كروسينسكى ( مترجم : عبد الرزاق دنبلى " مفتون " ) 	ABLibrary	8200	0.64387
		 راحة الصدور و آية السرور در تاريخ آل سلجوق ( فارسى ) 	 محمد بن علي بن سليمان الراوندي 	ABLibrary	8139	0.64382
		 الكشكول 	 الشيخ البهائي العاملي 	ABLibrary	8843	0.64202
		 الكامل في التاريخ ( تاريخ كامل ) ( فارسي ) 	 ابن الأثير ( مترجم : خليلى / حالت ) 	ABLibrary	7668	0.64194
		 در محضر شيخ فضل الله نورى ، اسناد حقوقى عهد ناصرى ( فارسى ) 	 منصوره اتحاديه و سعيد روحى 	ABLibrary	8126	0.64056
		 ظفرنامه ( قسم الاسلاميه ) ( فارسى ) 	 حمد الله مستوفى قزوينى 	ABLibrary	8231	0.63908
		 سفرهاى ناصر الدين شاه به قم ( فارسى ) 	 ناصر الدين شاه قاجار 	ABLibrary	8204	0.63848
		 تاريخ نو ( شامل حوادث دوره قاجاريه ) ( فارسى ) 	 جهانگير ميرزا 	ABLibrary	8073	0.63795
		 الكامل في التاريخ ( تاريخ كامل ) ( فارسي ) 	 ابن الأثير ( مترجم : خليلى / حالت ) 	ABLibrary	7666	0.63736
		 ألواح الصحة ( فارسي ) 	 متطبب جيلاني ( گيلانى ) 	ABLibrary	9955	0.63654
		 خوشه هاى طلائى ( فارسي ) 	 محمد على مجاهدى 	ABLibrary	7890	0.63591
		 تاريخ تطبيقى ايران با كشورهاى جهان ( فارسى ) 	 عزيز الله بيات 	ABLibrary	8034	0.6348
		 خلاصة التواريخ ( فارسى ) 	 قاضى احمد بن شرف الدين الحسين الحسينى القمى 	ABLibrary	8123	0.63455
		 رؤيت هلال ( فارسي ) 	 رضا مختاري / محسن صادقي 	ABLibrary	9762	0.63378
		 وقايع السنين والاعوام ( يا گزارشهاى ساليانه از ابتداى خلقت تا سال 1195 هجرى ) ( فارسى ) 	 سيد عبد الحسين الحسينى خاتون آبادى 	ABLibrary	8299	0.63375
		 زبدة التواريخ ( فارسى ) 	 عبدالله ابن لطف الله ( حافظ ابرو ) 	ABLibrary	8168	0.63353
		 زبدة التواريخ ( فارسى ) 	 عبدالله ابن لطف الله ( حافظ ابرو ) 	ABLibrary	8167	0.63257
		 تذكره همايون و اكبر ( فارسى ) 	 بايزيد بيات 	ABLibrary	8093	0.63152
		 مناقب الطاهرين ( فارسي ) 	 عماد الدين حسن بن علي الطبري 	ABLibrary	7783	0.63057
		 روزنامه خاطرات ناصر الدين شاه ( در سفر دوم فرنگستان ) ( فارسى ) 	 ناصر الدين شاه قاجار 	ABLibrary	8158	0.63036
		 تاريخ ذو القرنين ( فارسى ) 	 ميرزا فضل الله شيرازى ( خاورى ) 	ABLibrary	8043	0.62718
		 سبع رسائل 	 المحقق الدواني / ملا اسماعيل خواجوئي 	ABLibrary	8446	0.62252
		 تاريخ آل سلجوق در آناطولى ( فارسي ) 	 مؤلف مجهول 	ABLibrary	7984	0.62233
		 سلجوقنامه ( وذيل سلجوقنامه محمد بن ابراهيم ) ( فارسى ) 	 خواجه امام ظهير الدين نيشابورى / ابو حامد محمد بن ابراهيم ت 599 	ABLibrary	8206	0.62005
		 تاريخ گيتى گشا ( در تاريخ سلسله زنديه ) ( فارسى ) 	 محمد صادق موسوى اصفهانى 	ABLibrary	8059	0.61829
		 دستور الكاتب في تعيين المراتب ( فارسى ) 	 محمد بن هندوشاه نخجوانى 	ABLibrary	8129	0.61812
		 تاريخ منتظم ناصرى ( فارسى ) 	 محمد حسن خان اعتماد السلطنه 	ABLibrary	8071	0.61768
		 سفرنامه عراق عجم ( فارسى ) 	 ناصر الدين شاه قاجار 	ABLibrary	8193	0.61636
		 شاه عباس ( مجموعه اسناد و مكاتبات تاريخى همراه با يادداشتهاى تفصيلى ) ( فارسى ) 	 عبد الحسين نوايى 	ABLibrary	8216	0.61424
		 شهريار جاده ها ( سفرنامه ناصر الدين شاه به عتبات ) ( فارسى ) 	 ناصر الدين شاه قاجار 	ABLibrary	8222	0.61107
		 روزنامه سفر مازندران ( فارسى ) 	 ناصر الدين شاه قاجار 	ABLibrary	8160	0.60841
		 الدليل على موضوعات نهج البلاغة 	 علي انصاريان 	ABLibrary	930	0.60424
		 آراء المراجع في الحج 	 الشيخ علي افتخاري الگلپايگاني 	ABLibrary	9739	0.60338
		 موسوعة كشاف اصطلاحات الفنون والعلوم 	 محمد علي التهانوي 	ABLibrary	8655	0.60105
		 مطلع سعدين ومجمع بحرين ( فارسى ) 	 كمال الدين عبد الرزاق سمرقندى 	ABLibrary	8282	0.59717
		 ايران در دوره سلطنت قاجار ( فارسي ) 	 على اصغر شميم 	ABLibrary	7972	0.59694
		 سيرة جلال الدين يا تاريخ جلالى ( فارسى ) 	 نور الدين محمد خرندزي زيدري نسوي ( مترجم : محمد علي ناصح ) 	ABLibrary	8214	0.59685
		فرهنگ ابجدى = المنجد الأبجدي	فؤاد افرام البستاني (ت: 1906م)	ShamAY	34691	0.59458
		 همايون نامه ( تاريخ منظوم حكيم زجاجى ) ( فارسى ) 	 حكيم زجاجى 	ABLibrary	8300	0.59446
		 مسخر البلاد ( تاريخ شيبانيان ) ( فارسى ) 	 محمد يار بن عرب قطغان 	ABLibrary	8278	0.59385
		 أعلام النبوة 	 أبو حاتم الرازي 	ABLibrary	8339	0.59272
		 روزنامه خاطرات سيد محمد كمره اى ( فارسى ) 	 سيد محمد كمره اى 	ABLibrary	8146	0.59149
		 سوانح عمر ( فارسى ) 	 شمس الدين رشديه 	ABLibrary	8210	0.58924
		 روزشمار تاريخ معاصر ايران ( فارسى ) 	 حسن فراهانى 	ABLibrary	8143	0.58892
		تفسير كنز الدقائق وبحر الغرائب‏  - الجزء1	محمد بن محمد رضا القمي المشهدي	Masaha	4778	0.58874
		 رجال عصر مشروطيت ( فارسى ) 	 سيد ابو الحسن علوى 	ABLibrary	8140	0.58834
		 سفر نامه هاى سهام الدولة بجنوردى ( فارسى ) 	 يار محمد خان سهام الدوله / خاور بى بى شادلو 	ABLibrary	8203	0.58043
		 اشرف التواريخ ( فارسي ) 	 محمدتقى نورى 	ABLibrary	7964	0.57734
		إحقاق الحقّ وإزهاق الباطل [ج ٣٠]	آية الله السيّد شهاب الدين الحسيني المرعشي النجفي	Rafed	2806	0.57584
		 تاريخ گيلان ( فارسى ) 	 ملا عبد الفتاح فومنى گيلانى 	ABLibrary	8060	0.57319
		 تاريخ مبارك شاهى ( فارسى ) 	 يحيى بن احمد عبد الله السيهرندى 	ABLibrary	8065	0.57179
		 روزنامه خاطرات ناصر الدين شاه ( در سفر سوم فرنگستان ) ( فارسى ) 	 ناصر الدين شاه قاجار 	ABLibrary	8159	0.57076
		 تاريخ مبارك غازانى ( داستان غازان خان ) ( فارسى ) 	 رشيد الدين فضل الله همدانى 	ABLibrary	8066	0.56893
		فهرست نسخه هاي خطي كتابخانه آيه الله گلپايگاني ( قدس سره )	ابوالفضل عربزاده	Ghbook	7180	0.56389
		 الكشكول 	 الشيخ البهائي العاملي 	ABLibrary	8844	0.56336
		 بررسى تاريخى ، سياسى و اجتماعى اسناد بندر عباس ( فارسي ) 	 حسن حبيبى ومحمد باقر وثوقى 	ABLibrary	7982	0.56118
		 تاريخ منتظم ناصرى ( فارسى ) 	 محمد حسن خان اعتماد السلطنه 	ABLibrary	8070	0.55998
		 ضياء العيون ( فارسي ) 	 محمد باقر بن عماد الدين شيرازي 	ABLibrary	9967	0.55871
		 جامع التواريخ ( تاريخ اغوز ) ( فارسى ) 	 رشيد الدين فضل الله همدانى 	ABLibrary	8098	0.55837
		 خلاصهء سيرت رسول الله ( ص ) 	 محمد بن عبد الله بن عمر 	ABLibrary	7519	0.55693
		 دستور الكاتب في تعيين المراتب ( فارسى ) 	 محمد بن هندوشاه نخجوانى 	ABLibrary	8128	0.55586
		 خاطرات ديوان بيگى ( فارسى ) 	 ميرزا حسين خان 	ABLibrary	8115	0.5513
		 در محضر شيخ فضل الله نورى ، اسناد حقوقى عهد ناصرى ( فارسى ) 	 منصوره اتحاديه و سعيد روحى 	ABLibrary	8127	0.5506
		 فهرس التواريخ ( فارسى ) 	 رضا قليخان هدايت 	ABLibrary	8245	0.53844
		العقد الحسيني - الرسالة الوسواسية	الحسين بن عبد الصمد العاملي	Masaha	1145	0.53412
		 تقويم التواريخ ( فارسى ) 	 مصطفى بن عبدالله چلپى ( حاجى خليفه ) ( مترجم : مجهول ) 	ABLibrary	8094	0.53398
		أحكام المياه	الشيخ محمد رضا النجفي الأصفهاني	Masaha	4862	0.53369
		 همايون نامه ( تاريخ منظوم حكيم زجاجى ) ( فارسى ) 	 حكيم زجاجى 	ABLibrary	8301	0.53272
		احكام المياه	محمد رضا نجفي	Ghbook	11141	0.52247
		 مناقب علي بن أبي طالب ( ع ) ( بهمراه مناقب كلابى ) ( فارسي ) 	 ابن المغازلي / الكلابي ( مترجم : سيد جواد مرعشى نجفى ) 	ABLibrary	7784	0.51851
		 روزنامه خاطرات امين لشكر ( فارسى ) 	 ميرزا قهرمان امين لشكر 	ABLibrary	8145	0.51534
		 عبقات الأنوار في إمامة الأئمة الأطهار ( فارسي ) 	 السيد حامد النقوي 	ABLibrary	8504	0.51198
		كتب حوزه : صرف	جمعي از نويسندگان	Ghbook	16310	0.51067
		 جامع التواريخ ( تاريخ افرنج و پايان قياصره ) ( فارسى ) 	 رشيد الدين فضل الله همدانى 	ABLibrary	8099	0.51008
		 جامع مفيدى ( فارسى ) 	 محمد مفيد مستوفى بافقى 	ABLibrary	8103	0.50936
		 طبقات ناصرى ( تاريخ كامل ايران واسلام ) ( فارسى ) 	 منهاج سراج 	ABLibrary	8227	0.50808
		إحقاق الحقّ وإزهاق الباطل [ج ٢٩]	آية الله السيّد شهاب الدين الحسيني المرعشي النجفي	Rafed	2797	0.5077
		فهرس المخطوطات العربية والفارسية في مكتبة راجا محمودآباد-لكهنو-الهند-عربي		ShamAY	37624	0.50348
		فهرس مخطوطات مكتبة عالية مهدوية-كجرات-الهند-عربي		ShamAY	37627	0.50166
		 روزنامه خاطرات سيد محمد كمره اى ( فارسى ) 	 سيد محمد كمره اى 	ABLibrary	8147	0.4979
		جامع الشتات	الشيخ الخواجوئي	Masaha	1457	0.49474
		 المراتب في فضائل أميرالمؤمنين وسيد الوصيين ( ع ) 	 أبى القاسم اسماعيل بن احمد البستي المعتزلي 	ABLibrary	7700	0.49422
		الذخيره في العقبي في موده ذوي القربي	سيدمهدي رجايي	Ghbook	15611	0.49331
		 روزنامه خاطرات عين السلطنه ( فارسى ) 	 قهرمان ميرزا عين السلطنه 	ABLibrary	8148	0.49006
		إحقاق الحقّ وإزهاق الباطل [ج ٣٣]	آية الله السيّد شهاب الدين الحسيني المرعشي النجفي	Rafed	2814	0.48944
		 الذريعة إلى حافظ الشريعة ( شرح أصول الكافي ) 	 رفيع الدين محمد بن محمد مؤمن الجيلاني 	ABLibrary	7913	0.4878
		الذريعة إلى حافظ الشريعة - الجزء1	رفيع الدين محمد الجيلاني	Masaha	4739	0.48738
		 رسائل طبي محمد بن زكرياى رازى 	 محمد بن زكريا الرازي 	ABLibrary	9827	0.48717
		فهرس مخطوطات مكتبة عالية جستية-كجرات-الهند-عربي		ShamAY	37626	0.48425
		 بحر الجواهر ( معجم الطب الطبيعي ) 	 محمد بن يوسف الهروي 	ABLibrary	9952	0.48154
		كتاب المراتب في فضائل أمير المؤمنين و سيد الوصيين(ع)	أبو القاسم إسماعيل بن أحمد البستي‏	Masaha	2490	0.47095
		جامع الشتات	محمد اسماعيل بن الحسين بن محمدرضا مازندراني خواجوئي	Ghbook	15608	0.46996
		الغارات أو الاستنفار والغارات - الجزء1	إبراهيم بن محمد الثقفي	Masaha	4561	0.46962
		 عبقات الأنوار في إمامة الأئمة الأطهار ( فارسي ) 	 السيد حامد النقوي 	ABLibrary	8497	0.46767
		الصحيفه السجاديه الجامعه	محمد باقر بن مرتضي موحد ابطحي اصفهاني	Ghbook	6369	0.46715
		الرسائل التوحيديه	محمد حسين طباطبايي	Ghbook	12175	0.46638
		 الآثار الباقية عن القرون الخالية 	 أبو ريحان البيروني 	ABLibrary	8916	0.46425
		فوائد الفوائد لابن خزيمة	أبو بكر محمد بن إسحاق بن خزيمة بن المغيرة بن صالح بن بكر السلمي النيسابوري (المتوفى: 311هـ)	ShamAY	1339	0.46176
		معتمد الشيعة في أحكام الشريعة	محمد مهدي بن أبي ذر النراقي [ المولى مهدي النراقي ]	Rafed	1339	0.45579
		الوافي - الجزء14	الفيض الكاشاني	Masaha	1339	0.4515
		 رؤيت هلال ( فارسي ) 	 رضا مختاري / محسن صادقي 	ABLibrary	9761	0.45075
		رسالة في الغناء	الحر العاملي	Masaha	1271	0.44029
		 عبقات الأنوار في إمامة الأئمة الأطهار ( فارسي ) 	 السيد حامد النقوي 	ABLibrary	8501	0.43145
		 رؤيت هلال ( فارسي ) 	 رضا مختاري / محسن صادقي 	ABLibrary	9760	0.42628
		 تاريخ فيروزشاهى ( فارسى ) 	 شمس سراج عفيف 	ABLibrary	8056	0.42552
		 شرح دعاء الصباح 	 حاج ملا هادي السبزواري 	ABLibrary	8866	0.4203
		 درر الأخبار من بحار الأنوار 	 سيد مهدي حجازي 	ABLibrary	977	0.41929
		فهرس مخطوطات مكتبة سيد ظل الرحمن-عليكر-الهند-عربي		ShamAY	37625	0.41357
		العوامل لملّا محسن	محسن بن محمدطاهر قزويني	Ghbook	15379	0.41353
