automatic URI	Proposed URI	bookTitle	authorName	collection	id	tfidf
		 أبكار الأفكار في أصول الدين 	 سيف الدين الآمدي 	ABLibrary	8317	0.31101
		 مسند الإمام الصادق ( ع ) 	 الشيخ عزيز الله عطاردي 	ABLibrary	7717	0.31088
		 بحار الأنوار 	 العلامة المجلسي 	ABLibrary	793	0.31081
		 تحفة الازهار وزلال الانهار في نسب ابناء الائمة الاطهار ( ع ) 	 ضامن بن شدقم الحسيني المدني 	ABLibrary	7459	0.31076
		 مسند الإمام الجواد ( ع ) 	 الشيخ عزيز الله عطاردي 	ABLibrary	7740	0.31069
		 دراسات فقهية في مسائل خلافية 	 الشيخ نجم الدين الطبسي 	ABLibrary	982	0.31058
		 شرح الأنفاس الروحانية لأئمة السلف الصوفية 	 محمد بن عبد الملك الديلمي 	ABLibrary	8727	0.31057
		 نظرية الحكم في الإسلام 	 الشيخ محسن الأراكي 	ABLibrary	9531	0.31056
		 مسند الإمام الصادق ( ع ) 	 الشيخ عزيز الله عطاردي 	ABLibrary	7714	0.31052
		 الكامل في التاريخ 	 ابن الأثير 	ABLibrary	8246	0.31041
		 الرسالة القشيرية 	 ابو القاسم عبد الكريم القشيري 	ABLibrary	8711	0.31034
		 تكمله يكم طب العترة ( ع ) ( كتاب في خواص بعض الفواكه والخضار ) 	 محمد نبي بن أحمد التويسركاني 	ABLibrary	9815	0.31024
		 مرشد المغترب 	 السيد محمد سعيد الحكيم 	ABLibrary	9617	0.3102
		 شبهات حول القرآن وتفنيدها 	 غازي عناية 	ABLibrary	8450	0.31009
		 حياة الإمام محمد الباقر ( ع ) 	 الشيخ باقر شريف القرشي 	ABLibrary	7503	0.31
		 بحار الأنوار 	 العلامة المجلسي 	ABLibrary	773	0.30988
		 أعيان الشيعة 	 السيد محسن الأمين 	ABLibrary	74	0.30981
		 بحار الأنوار 	 العلامة المجلسي 	ABLibrary	784	0.30978
		 المصابيح 	 الإمام أبو العباس الحسني 	ABLibrary	8601	0.30976
		 بحار الأنوار 	 العلامة المجلسي 	ABLibrary	781	0.30965
		 قوانين حكم الاشراق إلى كافة الصوفية بجميع الآفاق 	 محمد بن أحمد الشاذلي ( ابن زغدان ) 	ABLibrary	8818	0.30957
		 رسائل ومقالات 	 الشيخ السبحاني 	ABLibrary	8443	0.30954
		 مسند الإمام الصادق ( ع ) 	 الشيخ عزيز الله عطاردي 	ABLibrary	7721	0.30945
		 دلائل الصدق لنهج الحق 	 الشيخ محمد حسن المظفر 	ABLibrary	939	0.30918
		 رسائل في ولاية الفقيه 	 رحمان ستايش ومحمد كاظم 	ABLibrary	9633	0.30893
		 موسوعة الإمام الهادي ( ع ) 	 الشيخ أبو القاسم الخزعلي 	ABLibrary	7844	0.3089
		 مناقب الأسد الغالب ممزق الكتائب ومظهر العجائب ليث بن غالب أمير المؤمنين أبي الحسن علي بن أبي طالب ( يليه خصائص أمير المؤمنين علي بن أبي طالب للنسائي ) 	 محمد بن عبد الله ابن الجزري 	ABLibrary	7412	0.30889
		 مسند الإمام الباقر ( ع ) 	 الشيخ عزيز الله عطاردي 	ABLibrary	7708	0.30888
		 رسائل ومقالات 	 الشيخ السبحاني 	ABLibrary	8442	0.30865
		 مفتاح المعية في دستور الطريقة النقشبندية 	 الشيخ عبد الغني النابلسي 	ABLibrary	8858	0.30863
		 ولاية الفقيه في حكومة الإسلام 	 السيد محمد حسين الطهراني 	ABLibrary	9446	0.30863
		 المسائل والرسائل المروية عن الإمام أحمد بن حنبل في العقيدة 	 عبد الإله بن سلمان بن سالم الأحمدي 	ABLibrary	8599	0.30829
		 تأويل الدعائم 	 القاضي النعمان المغربي 	ABLibrary	9315	0.30827
		 موسوعة الفقه الإسلامي طبقا لمذهب أهل البيت ( ع ) 	 مؤسسة دائرة معارف الفقه الاسلامي 	ABLibrary	9649	0.30826
		 شرح القصيدة النونية المسماة الكافية الشافية في الانتصار للفرقة الناجية 	 ابن قيم الجوزية 	ABLibrary	8460	0.30774
		 حوار مع الشيخ صالح بن عبدالله الدرويش ( حول تأملات في نهج البلاغة ) 	 الشيخ السبحاني 	ABLibrary	8416	0.30771
		 المنهل الروي في الطب النبوي ( ص ) 	 محمد بن طولون الصالحي 	ABLibrary	9956	0.3077
		 الأسفار عن رسالة الأنوار فيما يتجلى لأهل الذكر من الأنوار 	 عبد الكريم بن ابراهيم الجيلي 	ABLibrary	8809	0.30735
		 تلخيص الشافي 	 الشيخ الطوسي 	ABLibrary	8391	0.30735
		 بحار الأنوار 	 العلامة المجلسي 	ABLibrary	783	0.30712
		 العوالم ، الإمام الحسين ( ع ) 	 الشيخ عبد الله البحراني 	ABLibrary	7614	0.30709
		 آية التطهير رؤية مبتكرة 	 الشيخ فاضل اللنكراني - الشيخ شهاب الدين الإشراقي 	ABLibrary	8306	0.30669
		 شرح الشفاء ( شرح ملا علي القاري ) 	 القاضي عياض 	ABLibrary	8456	0.30662
		 المصباح في مكاشفة بعث الأرواح ( ويليه شرح الحجب والأستار / لوامع التوحيد / مسالك التوحيد ) 	 روزبهان البقلي الشيرازي ( شطاح فارس ) 	ABLibrary	8729	0.30648
		 بحوث في الملل والنحل 	 الشيخ السبحاني 	ABLibrary	8359	0.30639
		 شرح العقائد النسفية 	 التفتازاني 	ABLibrary	8458	0.3063
		 من الآداب الطبية 	 السيد محمد الحسيني الشيرازي 	ABLibrary	9990	0.30626
		 موسوعة كربلاء 	 لبيب بيضون 	ABLibrary	7863	0.30625
		 دليل النص بخبر الغدير 	 أبي الفتح الكراجكي 	ABLibrary	832	0.30617
		 منهج الرشاد في معرفة المعاد 	 ملا نعيما العرفي الطالقاني 	ABLibrary	8649	0.30615
		 مقتل الحسين ( ع ) 	 الموفق الخوارزمي 	ABLibrary	7775	0.30612
		 معرفة المعاد 	 السيد محمد حسين الطهراني 	ABLibrary	8876	0.3061
		الاربعين في امامه الائمه الطاهرين	محمدطاهربن محمدحسين الشيرازي النجفي القمي	Ghbook	15554	0.30591
		 الاعتماد في شرح واجب الاعتقاد 	 المقداد السيوري 	ABLibrary	8310	0.30579
		 الإلهيات على هدى الكتاب والسنة والعقل 	 الشيخ السبحاني 	ABLibrary	8346	0.30575
		 شرح القصيدة النونية المسماة الكافية الشافية في الانتصار للفرقة الناجية 	 ابن قيم الجوزية 	ABLibrary	8461	0.30561
		 بحار الأنوار 	 العلامة المجلسي 	ABLibrary	753	0.30557
		 دلائل النبوة ومعرفة أحوال صاحب الشريعة 	 أحمد بن الحسين البيهقي 	ABLibrary	933	0.30545
		 جامع العلوم في اصطلاحات الفنون الملقب بدستور العلماء 	 القاضى عبد النبي بن عبد الرسول الأحمد نگري 	ABLibrary	8403	0.30526
		 دلائل الصدق لنهج الحق 	 الشيخ محمد حسن المظفر 	ABLibrary	943	0.3052
		 الموسوعة الكبرى عن فاطمة الزهراء ( س ) 	 اسماعيل الأنصاري الزنجاني الخوئيني 	ABLibrary	7828	0.30497
		 دلائل النبوة ومعرفة أحوال صاحب الشريعة 	 أحمد بن الحسين البيهقي 	ABLibrary	932	0.30492
		 مسند الإمام الصادق ( ع ) 	 الشيخ عزيز الله عطاردي 	ABLibrary	7719	0.30489
		 إثنا عشر رسالة 	 السيد محمد باقر الداماد ( الميرداماد ) 	ABLibrary	840	0.3048
		 رسائل الجنيد 	 الجنيد البغدادي 	ABLibrary	8688	0.30477
		 الولاية الإلهية وولاية الفقيه 	 الشيخ محسن العراقي 	ABLibrary	9701	0.30477
		 موسوعة التاريخ الإسلامي 	 الشيخ محمد هادي اليوسفي الغروي 	ABLibrary	7853	0.30471
		 عدة الأكياس في شرح معاني الأساس 	 أحمد الشرفي القاسمي 	ABLibrary	8510	0.30461
		 شرح حكم الشيخ الأكبر 	 حسن بن موسى القادري 	ABLibrary	8861	0.30458
		 معرفة الإمام 	 السيد محمد حسين الطهراني 	ABLibrary	8881	0.30434
		 في رحاب أهل البيت ( ع ) 	 لجنة بحوث المجمع العالمي لأهل البيت ( ع ) 	ABLibrary	8530	0.30431
		 بقيع الغرقد 	 الشيخ محمد أمين الأميني 	ABLibrary	8968	0.30416
		 الأسماء والصفات 	 أحمد بن الحسين البيهقي 	ABLibrary	8333	0.30395
		 موسوعة التاريخ الإسلامي 	 الشيخ محمد هادي اليوسفي الغروي 	ABLibrary	7857	0.3039
		 مع الركب الحسيني 	 مجموعة مؤلفين 	ABLibrary	7748	0.3038
		 بحوث في الملل والنحل 	 الشيخ السبحاني 	ABLibrary	8357	0.30364
		 مسند الإمام الحسين ( ع ) 	 الشيخ عزيز الله عطاردي 	ABLibrary	7703	0.30363
		 حلية الأبرار في أحوال محمد وآله الأطهار ( ع ) 	 السيد هاشم البحراني 	ABLibrary	7489	0.30356
		 شرح توحيد الصدوق 	 القاضي سعيد القمي 	ABLibrary	8479	0.30331
		 حياة الإمام موسى بن جعفر ( ع ) 	 الشيخ باقر شريف القرشي 	ABLibrary	7505	0.3032
		 دلائل النبوة ومعرفة أحوال صاحب الشريعة 	 أحمد بن الحسين البيهقي 	ABLibrary	935	0.30263
		 بحار الأنوار 	 العلامة المجلسي 	ABLibrary	740	0.30259
		 العوالم ، الإمام جعفر الصادق ( ع ) 	 الشيخ عبد الله البحراني 	ABLibrary	7617	0.30256
		 محاضرات في المواريث 	 محاضرات السيد الخوئي لمحمد علي الخرسان 	ABLibrary	9433	0.30236
		 دلائل النبوة ومعرفة أحوال صاحب الشريعة 	 أحمد بن الحسين البيهقي 	ABLibrary	934	0.30229
		 المكتوبات ( الدرر المكنونات النفيسة ) 	 أحمد الفاروقي السرهندي 	ABLibrary	8846	0.30213
		 حج الأنبياء والأئمة ( ع ) 	 معاونية شؤون التعليم والبحوث الإسلامية في الحج 	ABLibrary	9769	0.30204
		 شرح الأربعين حديثا 	 أبي المعالي القونوي 	ABLibrary	8772	0.30203
		 الرسالة العلوية في فضل أمير المؤمنين ( ع ) على سائر البرية ( التفضيل ) 	 أبي الفتح الكراجكي 	ABLibrary	7532	0.30201
		 الفوائد الرجالية 	 الخاجوئي 	ABLibrary	9771	0.30179
		 العوالم ، الإمام الجواد ( ع ) 	 الشيخ عبد الله البحراني 	ABLibrary	7621	0.3017
		 دفاع عن التشيع 	 السيد نذير يحيى الحسني 	ABLibrary	966	0.30165
		 آداب الصحبه 	 عبد الوهاب الشعراني 	ABLibrary	8830	0.3016
		 شرح فروع الكافي 	 محمد هادي المازندراني 	ABLibrary	9343	0.30157
		 الرسائل التوحيدية 	 السيد الطباطبائي 	ABLibrary	8435	0.30139
		 الحاشية على أصول الكافي 	 السيد أحمد بن زين العابدين العلوي العاملي 	ABLibrary	7919	0.30136
		 بحار الأنوار 	 العلامة المجلسي 	ABLibrary	749	0.30133
		 عصمة الأنبياء والرسل 	 السيد مرتضى العسكري 	ABLibrary	8512	0.30125
		 موسوعة التاريخ الإسلامي 	 الشيخ محمد هادي اليوسفي الغروي 	ABLibrary	7858	0.30105
		 الموسوعة الكبرى عن فاطمة الزهراء ( س ) 	 اسماعيل الأنصاري الزنجاني الخوئيني 	ABLibrary	7822	0.30099
		 كتاب المعرفة 	 ابن عربي 	ABLibrary	8738	0.30099
		 بحار الأنوار 	 العلامة المجلسي 	ABLibrary	741	0.30091
		 الهدايا لشيعة أئمة الهدى ( شرح اصول الكافى ) 	 شرف الدين مجذوب التبريزي 	ABLibrary	7927	0.30086
		 لوامع البينات شرح أسماء الله تعالى والصفات 	 فخر الدين الرازي 	ABLibrary	8452	0.30068
		 خلاصة المفاخر في مناقب الشيخ عبد القادر ( تتمة روح الرياحين ) 	 عبد الله بن أسعد اليافعي اليمني المكي 	ABLibrary	8800	0.30067
		 فضائح الباطنية 	 الغزالي 	ABLibrary	8525	0.30035
		 دراسات في علم الدراية 	 علي أكبر غفاري 	ABLibrary	923	0.30014
		 في ظلال نهج البلاغة 	 محمد جواد مغنية 	ABLibrary	962	0.30013
		 بحار الأنوار 	 العلامة المجلسي 	ABLibrary	769	0.2999
		 بحار الأنوار 	 العلامة المجلسي 	ABLibrary	775	0.29982
		 الديباج على مسلم 	 جلال الدين السيوطي 	ABLibrary	887	0.29982
		 نتائج الأفكار القدسية في بيان معاني شرح الرسالة القشيرية 	 الشيخ عبد الله العروسي 	ABLibrary	8826	0.2997
		 رسالتان في الحكمة المتعالية والفكر الروحي 	 حسن بن حمزة الشيرازي ( شرف البلاسي ) 	ABLibrary	8784	0.29953
		 قواعد التصوف 	 أبي العباس أحمد زروق الفاسي 	ABLibrary	8821	0.29953
		الامام الثاني عشر (عجل الله تعالي فرجه الشريف) 	محمد سعيد موسوي	Ghbook	6577	0.29947
		 نظرة في كتاب الوشيعة ( من فيض الغدير ) 	 الشيخ الأميني 	ABLibrary	8665	0.29946
		 الفقه ، السلم والسلام 	 السيد محمد الحسيني الشيرازي 	ABLibrary	9486	0.2994
		 الملخص في أصول الدين 	 الشريف المرتضى 	ABLibrary	8641	0.29937
		 منازل السائرين ( شرح القاساني ) 	 عبد الله الأنصاري الهروي 	ABLibrary	8792	0.29885
		 الدر المنثور في التفسير بالمأثور 	 جلال الدين السيوطي 	ABLibrary	915	0.2988
		 بحار الأنوار 	 العلامة المجلسي 	ABLibrary	798	0.29875
		 المقدمات من كتاب نص النصوص 	 السيد حيدر الآملي 	ABLibrary	8806	0.29865
		 مناقب آل محمد ( النعيم المقيم لعترة النبأ العظيم ) 	 عمر بن شجاع الموصلي 	ABLibrary	7787	0.29858
		 مسند الإمام الكاظم ( ع ) 	 الشيخ عزيز الله عطاردي 	ABLibrary	7736	0.29844
		 بحار الأنوار 	 العلامة المجلسي 	ABLibrary	750	0.2984
		 الشهاب الثاقب في وجوب صلاة الجمعة العيني 	 الفيض الكاشاني 	ABLibrary	9337	0.29827
		 التعليقات على شرح الدواني للعقائد العضدية 	 سيد جمال الدين الافغاني ( بقلم محمد عبده ) 	ABLibrary	8387	0.29826
		 أدب الطف أو شعراء الحسين ( ع ) 	 جواد شبر 	ABLibrary	7399	0.29799
		 في رحاب أهل البيت ( ع ) 	 لجنة بحوث المجمع العالمي لأهل البيت ( ع ) 	ABLibrary	8539	0.29789
		 العوالم ، الإمام محمد الباقر ( ع ) 	 الشيخ عبد الله البحراني 	ABLibrary	7616	0.29785
		 آثار البلاد واخبار العباد 	 زكريا القزويني 	ABLibrary	8917	0.29777
		 طرف من الأنباء والمناقب في شرف سيد الأنبياء 	 السيد ابن طاووس 	ABLibrary	7606	0.29757
		 موسوعة الإمام أمير المؤمنين على بن أبى طالب ( ع ) 	 الشيخ باقر شريف القرشي 	ABLibrary	7811	0.29746
		 رحلة مصر والسودان 	 محمد مهري كركوكي 	ABLibrary	9107	0.29744
		 سيرة الأئمة الاثني عشر ( ع ) 	 هاشم معروف الحسني 	ABLibrary	7548	0.2974
		 موسوعة الإمام أمير المؤمنين على بن أبى طالب ( ع ) 	 الشيخ باقر شريف القرشي 	ABLibrary	7815	0.2974
		 دروس في العقائد الإسلامية 	 الشيخ ناصر مكارم الشيرازي 	ABLibrary	8422	0.2973
		 نفح الطيب من غصن الأندلس الرطيب 	 أحمد بن محمد المقري التلمساني 	ABLibrary	9304	0.29716
		 الدرر النجفية من الملتقطات اليوسفية 	 المحقق البحراني 	ABLibrary	994	0.29715
		 أخبار مكة في قديم الدهر وحديثه 	 محمد بن اسحاق ابن العباس الفاكهي المكي 	ABLibrary	8924	0.29714
		 آداب عصر الغيبة 	 الشيخ حسين كوراني 	ABLibrary	97	0.2971
		 شمس العلوم ودواء كلام العرب من الكلوم 	 نشوان بن سعيد الحميري 	ABLibrary	9798	0.29708
		 الألف المألوف على اللام المعطوف 	 علي بن محمد الديلمي 	ABLibrary	8709	0.29706
		 موسوعة الإمام أمير المؤمنين على بن أبى طالب ( ع ) 	 الشيخ باقر شريف القرشي 	ABLibrary	7814	0.29706
		 تاريخ النجف ( اليتيمة الغروية والتحفة النجفية ) 	 السيد حسين البراقي النجفي 	ABLibrary	9011	0.29691
		 أربعة كتب إسماعيلية 	 مجموعة مؤلفين 	ABLibrary	8324	0.29681
		 بحار الأنوار 	 العلامة المجلسي 	ABLibrary	754	0.2966
		 جواهر النصوص في حل كلمات الفصوص 	 الشيخ عبد الغني النابلسي 	ABLibrary	8854	0.29638
		 في رحاب أهل البيت ( ع ) 	 لجنة بحوث المجمع العالمي لأهل البيت ( ع ) 	ABLibrary	8555	0.29634
		 موسوعة طب الأئمة ( ع ) 	 باسم الأنصاري 	ABLibrary	9999	0.29622
		 لطائف الأعلام في إشارات أهل الإلهام 	 عبد الرزاق الكاشاني ( القاشاني ) 	ABLibrary	8795	0.29615
		 نهج الإعلان بما يثبت به دخول شهر رمضان 	 الشيخ علي الغروي 	ABLibrary	9398	0.2961
		 الرسائل الأربع 	 الشيخ السبحاني 	ABLibrary	9565	0.29606
		 الموسوعة الكبرى عن فاطمة الزهراء ( س ) 	 اسماعيل الأنصاري الزنجاني الخوئيني 	ABLibrary	7824	0.29601
		 مناظرات عقائدية بين الشيعة وأهل السنة 	 السيد أمير محمد القزويني 	ABLibrary	8645	0.29598
		 الكمالات الإلهية في الصفات المحمدية 	 عبد الكريم بن ابراهيم الجيلي 	ABLibrary	8811	0.29587
		 إرشاد ذوي العقول إلى براءة الصوفية من الاتحاد والحلول 	 مجموعة مؤلفين 	ABLibrary	8828	0.29576
		 تأويل الدعائم 	 القاضي النعمان المغربي 	ABLibrary	9317	0.29572
		 الكامل في التاريخ 	 ابن الأثير 	ABLibrary	8248	0.29565
		 الرحلة السعودية الحجازية النجدية 	 محمد سعود العوري 	ABLibrary	9096	0.29556
		 مع الركب الحسيني 	 مجموعة مؤلفين 	ABLibrary	7746	0.29555
		 المعجزة القرآنية 	 دكتور محمد حسن هيتو 	ABLibrary	8620	0.29535
		 مسند الإمام الحسين ( ع ) 	 الشيخ عزيز الله عطاردي 	ABLibrary	7705	0.29521
		 نهاية الارب في اخبار الفرس والعرب 	 مؤلف مجهول 	ABLibrary	8297	0.29514
		 الكوثر في أحوال فاطمة بنت النبي الأعظم ( ع ) 	 السيد محمد باقر الموسوي 	ABLibrary	7687	0.29513
		 في رحاب أهل البيت ( ع ) 	 لجنة بحوث المجمع العالمي لأهل البيت ( ع ) 	ABLibrary	8560	0.295
		 نفح الطيب من غصن الأندلس الرطيب 	 أحمد بن محمد المقري التلمساني 	ABLibrary	9302	0.29488
		 شرح توحيد الصدوق 	 القاضي سعيد القمي 	ABLibrary	8480	0.29476
		 وضوء عبد الله بن عباس ودور السياسة في اختلاف النقل عنه 	 السيد علي الشهرستاني 	ABLibrary	9660	0.29474
		 البيان والتبيين 	 الجاحظ 	ABLibrary	824	0.29472
		 الكوثر في أحوال فاطمة بنت النبي الأعظم ( ع ) 	 السيد محمد باقر الموسوي 	ABLibrary	7688	0.29462
		 حلية الأبرار في أحوال محمد وآله الأطهار ( ع ) 	 السيد هاشم البحراني 	ABLibrary	7488	0.29459
		 أخبار مكة في قديم الدهر وحديثه 	 محمد بن اسحاق ابن العباس الفاكهي المكي 	ABLibrary	8925	0.29452
		 موسوعة أحكام الأطفال وأدلتها 	 مركز فقه الأئمة الأطهار ( ع ) 	ABLibrary	9671	0.29447
		 الدرر النجفية من الملتقطات اليوسفية 	 المحقق البحراني 	ABLibrary	992	0.29444
		 المسالك والممالك 	 أبي عبيد البكري 	ABLibrary	9204	0.29441
		 خصوص النعم في شرح فصوص الحكم 	 علي بن أحمد المهائمي 	ABLibrary	8817	0.2944
		 كتاب المعراج 	 ابو القاسم عبد الكريم القشيري 	ABLibrary	8712	0.29435
		 الشافي في شرح الكافي 	 المولى خليل القزويني 	ABLibrary	7922	0.29431
		 رياضة النفس ( ويليه نحو القلوب ) 	 الحكيم الترمذي 	ABLibrary	8695	0.29425
		 أبكار الأفكار في أصول الدين 	 سيف الدين الآمدي 	ABLibrary	8318	0.2942
		 الأنوار الجلالية في شرح الفصول النصيرية 	 المقداد السيوري 	ABLibrary	8350	0.29412
		 الجوامع والفوارق بين السنة والشيعة 	 محمد جواد مغنيه 	ABLibrary	8406	0.29411
		 اللمع في التصوف 	 عبد الله بن علي السراج الطوسي 	ABLibrary	8700	0.29387
		 أنوار الفقاهة ( كتاب التجارة ) 	 الشيخ ناصر مكارم الشيرازي 	ABLibrary	9677	0.29385
		 الدر المنثور في التفسير بالمأثور 	 جلال الدين السيوطي 	ABLibrary	910	0.2937
		 نفح الطيب من غصن الأندلس الرطيب 	 أحمد بن محمد المقري التلمساني 	ABLibrary	9299	0.29359
		 سيرة المصطفى ( ص ) ( نظرة جديدة ) 	 هاشم معروف الحسني 	ABLibrary	7577	0.29355
		 حماة الوحي ( پاسداران وحى ) 	 الشيخ فاضل اللنكراني - شهاب الدين الاشراقي ( تعريب : عبد الرحيم الحمراني ) 	ABLibrary	8414	0.29351
		 سلسلة المسائل الفقهية 	 الشيخ السبحاني 	ABLibrary	9575	0.29347
		 المقنع في الإمامة 	 الشيخ عبيد الله بن عبد الله السد آبادي 	ABLibrary	8640	0.29322
		 بحار الأنوار 	 العلامة المجلسي 	ABLibrary	778	0.2932
		 منتخب الأثر في أحوال الإمام الثاني عشر ( عج ) 	 الشيخ لطف الله الصافي الگلپايگاني 	ABLibrary	7791	0.29315
		نظره عابره الي الصحاح السته	عبدالصمد شاكر	Ghbook	7725	0.29314
		موسوعه الامام المهدي ( عجل الله تعالي فرجه الشريف )	مركز الابحاث العقائدية	Ghbook	4584	0.29302
		 كتاب القضاء والقدر 	 أحمد بن الحسين البيهقي 	ABLibrary	8572	0.29296
		 في ظلال نهج البلاغة 	 محمد جواد مغنية 	ABLibrary	964	0.29287
		 تسهيل السبيل بالحجة في انتخاب كشف المحجة لثمرة المهجة 	 الفيض الكاشاني 	ABLibrary	8385	0.29282
		 بحار الأنوار 	 العلامة المجلسي 	ABLibrary	752	0.29279
		 مقالة في تحقيق إقامة الحدود في هذه الأعصار 	 سيد محمد باقر شفتي 	ABLibrary	9364	0.29276
		 الشفاعة في الكتاب والسنة 	 الشيخ السبحاني 	ABLibrary	8483	0.29275
		 فدك والعوالي أو الحوائط السبعة في الكتاب والسنة والتاريخ والأدب 	 سيد محمد باقر الحسيني الجلالي 	ABLibrary	7627	0.29247
		 رسالتان حول العصمة 	 الشيخ لطف الله الصافي الگلپايگاني 	ABLibrary	879	0.29242
		 دور العقيدة في بناء الإنسان 	 مركز الرسالة 	ABLibrary	896	0.29237
		 حسن المحاضرة في أخبار مصر والقاهرة 	 جلال الدين السيوطي 	ABLibrary	9035	0.29223
		 الزبدة الفقهية في شرح الروضة البهية 	 السيد محمد حسن الترحيني العاملي 	ABLibrary	9695	0.29217
		 رحلة أفوقاي الأندلسي 	 حمد بن قاس الحجري أفوقاي 	ABLibrary	9081	0.29216
		 التعليقة على الرسالة الصومية ( مع تعليقات الخاجوئي ) 	 الشيخ البهائي العاملي 	ABLibrary	9349	0.29214
		 مع الركب الحسيني 	 مجموعة مؤلفين 	ABLibrary	7747	0.29213
