automatic URI	Proposed URI	bookTitle	authorName	collection	id	tfidf
		انيس الموحدين	ملا محمد مهدي نراقي	Ghbook	8813	0.85095
		 آغاز و انجام ( فارسي ) 	 خواجه نصير الدين الطوسي 	ABLibrary	8304	0.85062
		 وسيلة الخادم إلى المخدوم در شرح صلوات چهارده معصوم ( ع ) ( فارسي ) 	 فضل الله بن روزبهان خنجى اصفهانى 	ABLibrary	7883	0.83878
		 مقامع الفضل 	 آقا محمد علي كرمانشاهي 	ABLibrary	9352	0.82954
		 حياة الإمام الهادي ( ع ) ( تحليلى از زندگانى امام هادى ع ) ( فارسي ) 	 الشيخ باقر شريف القرشي ( مترجم : محمدرضا عطائى ) 	ABLibrary	7464	0.82951
		 عبقات الأنوار في إمامة الأئمة الأطهار ( فارسي ) 	 السيد حامد النقوي 	ABLibrary	8493	0.82791
		 منتهى الآمال في تواريخ النبي و الآل ( فارسي ) 	 الشيخ عباس القمي 	ABLibrary	7795	0.82703
		 مجموعه آثار شهيد مطهرى ( فارسي ) 	 مرتضى مطهرى 	ABLibrary	7574	0.82682
		 حياة الإمام زين العابدين ( ع ) ( تحليلى از زندگانى امام سجاد ع ) ( فارسي ) 	 الشيخ باقر شريف القرشي ( مترجم : محمدرضا عطائى ) 	ABLibrary	7502	0.82676
		 آداب نماز ( فارسي ) 	 السيد الخميني 	ABLibrary	99	0.82628
		 رساله در پادشاهى صفوى ( فارسى ) 	 محمد يوسف ناجى 	ABLibrary	8141	0.82549
		 شرح نهج البلاغة ( فارسي ) 	 ابن ميثم البحراني ( مترجم : محمدى مقدم / نوايي ) 	ABLibrary	8381	0.82446
		 سه ارجوزه در كلام ، امامت وفقه ( فارسي ) 	 ابن داود الحلي 	ABLibrary	8448	0.82397
		 مجموعه آثار شهيد مطهرى ( فارسي ) 	 مرتضى مطهرى 	ABLibrary	7575	0.82181
		 مناقب مرتضوى ( فارسي ) 	 محمد صالح الحسينى الترمذى ( كشفي ) 	ABLibrary	7788	0.82092
		 درسهايى از نهج البلاغه ( فارسي ) 	 الشيخ المنتظري 	ABLibrary	922	0.82062
		 شرح آقا جمال خوانسارى بر غرر الحكم ودرر الكلم ( فارسي ) 	 جمال الدين محمد الخوانساري 	ABLibrary	7928	0.81905
		 موسوعة التاريخ الإسلامي ( تاريخ تحقيقى اسلام ) ( فارسي ) 	 الشيخ محمد هادي اليوسفي الغروي ( مترجم : حسينعلى عربى ) 	ABLibrary	7860	0.81819
		 دلائل النبوة ومعرفة أحوال صاحب الشريعة ( فارسي ) 	 أحمد بن الحسين البيهقي / مترجم محمود مهدوى دامغانى 	ABLibrary	7525	0.81765
		 كشف اليقين ( فارسي ) 	 العلامة الحلي ( مترجم : حميدرضا آژير ) 	ABLibrary	7681	0.81749
		 اخبار و احاديث و حكايات در فضائل اهل بيت ( ع ) ( فارسي ) 	 عماد الدين حسن بن علي الطبري ( مترجم : عبد الملك بن اسحاق بن فتحان واعظ قمى ) 	ABLibrary	7398	0.81644
		 شرح قصيده برده ( فارسي ) 	 مؤلف مجهول 	ABLibrary	7584	0.81583
		 شرح نهج البلاغة ( فارسي ) 	 ابن ميثم البحراني ( مترجم : محمدى مقدم / نوايي ) 	ABLibrary	8379	0.81527
		 سيره معصومان ( فارسي ) 	 السيد محسن الأمين ( مترجم : على حجتى كرمانى ) 	ABLibrary	7419	0.81505
		 درسهايى از نهج البلاغه ( فارسي ) 	 الشيخ المنتظري 	ABLibrary	920	0.81417
		 حياة الامام علي بن موسى الرضا ( ع ) ( پژوهشى دقيق در زندگانى امام رضا ع ) ( فارسي ) 	 الشيخ باقر شريف القرشي ( مترجم : سيد محمد صالحى ) 	ABLibrary	7508	0.81351
		 نهج الحق و كشف الصدق ( فارسي ) 	 العلامة الحلي ( مترجم : عليرضا كهنسال ) 	ABLibrary	7881	0.81346
		جامع الشتات في أجوبة السؤالات - الجزء1	الميرزا القمي	Masaha	1514	0.81283
		 مجموعه آثار شهيد مطهرى ( فارسي ) 	 مرتضى مطهرى 	ABLibrary	7554	0.81261
		 مجموعه آثار شهيد مطهرى ( فارسي ) 	 مرتضى مطهرى 	ABLibrary	7572	0.81258
		المجدي في أنساب الطالبيين‏	ابن الصوفي النسابة	Masaha	2861	0.81111
		 أنيس المؤمنين ( فارسي ) 	 محمد بن اسحاق بن محمد الحموي 	ABLibrary	7429	0.8104
		 مآثر الملوك ( به ضميمه خاتمه خلاصة الأخبار وقانون همايونى ) ( فارسى ) 	 غياث الدين بن همام الدين حسينى ( خواند مير ) 	ABLibrary	8263	0.81037
		 الامام الجواد ( ع ) ( نگاهى گذرا بر زندگانى امام جواد ع ) ( فارسي ) 	 عبد الرزاق مقرّم ( مترجم : پرويز لولاور ) 	ABLibrary	7877	0.81022
		 مجموعه آثار شهيد مطهرى ( فارسي ) 	 مرتضى مطهرى 	ABLibrary	7570	0.81015
		وسيله الخادم الي المخدوم ، در شرح صلوات چهارده معصوم ( عليهم السلام ) - قسمت مرب...	فضل الله بن روزبهان خنجي اصفهاني	Ghbook	6610	0.8088
		المجدي في أنساب الطالبيين	علي بن أبي الغنائم العمري	Rafed	1973	0.80875
		 تذكرة الخواص ( شرح حال و فضائل خاندان نبوت ) ( فارسي ) 	 سبط ابن الجوزي ( مترجم : محمدرضا عطائى ) 	ABLibrary	7467	0.80853
		 الإمام الحسين ( ع ) سماته وسيرته ( سيره و سيماى امام حسين ع ) ( فارسي ) 	 السيد محمد رضا الجلالي ( مترجم : جويا جهانبخش ) 	ABLibrary	7551	0.80835
		 مجموعه آثار شهيد مطهرى ( فارسي ) 	 مرتضى مطهرى 	ABLibrary	7568	0.80791
		 مناجات الهيات حضرت أمير ( ع ) وما نزل من القرآن في علي ( ع ) 	 المرزباني الخراساني 	ABLibrary	7900	0.80752
		 موسوعة التاريخ الإسلامي ( تاريخ تحقيقى اسلام ) ( فارسي ) 	 الشيخ محمد هادي اليوسفي الغروي ( مترجم : حسينعلى عربى ) 	ABLibrary	7859	0.80735
		 مجموعه آثار شهيد مطهرى ( فارسي ) 	 مرتضى مطهرى 	ABLibrary	7552	0.80731
		رساله في جواز بيع الوقف	محمد علي بن ملا مهدي آراني كاشاني	Ghbook	11290	0.80707
		الامام علي بن ابي طالب عليه السلام 	احمد رحماني همداني	Ghbook	7123	0.80694
		 تحفة الأبرار في مناقب الأئمة الأطهار ( ع ) ( فارسي ) 	 عماد الدين حسن بن علي الطبري 	ABLibrary	7458	0.80667
		 شرح نهج البلاغة ( فارسي ) 	 ابن ميثم البحراني ( مترجم : محمدى مقدم / نوايي ) 	ABLibrary	8382	0.80638
		 ديوان أمير المؤمنين ( ع ) 	 حسين بن معين الدين الميبدي ( مترجم : زمانى ) 	ABLibrary	7910	0.80632
		 موسوعة التاريخ الإسلامي ( تاريخ تحقيقى اسلام ) ( فارسي ) 	 الشيخ محمد هادي اليوسفي الغروي ( مترجم : حسينعلى عربى ) 	ABLibrary	7861	0.80622
		 شرح نهج البلاغة ( فارسي ) 	 ابن ميثم البحراني ( مترجم : محمدى مقدم / نوايي ) 	ABLibrary	8380	0.80617
		 المعيار و الموازنة ( فارسي ) 	 أبو جعفر الإسكافي ( مترجم : محمود مهدوى دامغانى ) 	ABLibrary	7767	0.80574
		 دانشنامهء شعر عاشورايى انقلاب حسينى در شعر شاعران عرب و عجم ( فارسي ) 	 مرضيه محمدزاده 	ABLibrary	7520	0.80561
		 مجموعه آثار شهيد مطهرى ( فارسي ) 	 مرتضى مطهرى 	ABLibrary	7576	0.80513
		 عبقات الأنوار في إمامة الأئمة الأطهار ( فارسي ) 	 السيد حامد النقوي 	ABLibrary	8490	0.80333
		 مجموعه آثار شهيد مطهرى ( فارسي ) 	 مرتضى مطهرى 	ABLibrary	7566	0.80304
		مقامع الفضل - الجزء1	الشيخ محمد علي البهباني	Masaha	1494	0.80301
		 الامام الرضا ( ع ) تاريخ و دراسة ( تحليلى از زندگانى امام رضا ع ) ( فارسي ) 	 محمدجواد فضل الله ( مترجم : سيد محمد صادق عارف ) 	ABLibrary	7463	0.80295
		 كامل بهائى ( فارسي ) 	 عماد الدين حسن بن علي الطبري 	ABLibrary	7647	0.80262
		 مجموعه آثار شهيد مطهرى ( فارسي ) 	 مرتضى مطهرى 	ABLibrary	7571	0.80256
		 مأساة الزهراء ( ع ) ( رنجهاى حضرت زهرا س ) ( فارسي ) 	 السيد جعفر مرتضى العاملي ( مترجم : محمد سپهرى ) 	ABLibrary	7693	0.80232
		 بيست رساله ( فارسي ) 	 ميرزا أحمد الآشتياني 	ABLibrary	8372	0.80171
		 الحياة السياسية للامام الحسن ( ع ) ( تحليلى از زندگانى سياسى امام حسن مجتبى ع ) ( فارسي ) 	 سيد جعفر مرتضى العاملي ( مترجم : سپهرى ) 	ABLibrary	7462	0.8014
		 جنة العاصمة ( فارسي ) 	 سيد حسن مير جهانى طباطبائى 	ABLibrary	7479	0.80107
		 دلائل الصدق لنهج الحق ( فارسي ) 	 الشيخ محمد حسن المظفر ( مترجم : سپهري ) 	ABLibrary	946	0.80066
		 ينابيع المودة لذوي القربى ( على و شكوه غدير بر فراز وحى و رسالت ) ( فارسي ) 	 القندوزي ( مترجم : محمد على شاه محمدى ) 	ABLibrary	7889	0.8005
		 مجموعه آثار شهيد مطهرى ( فارسي ) 	 مرتضى مطهرى 	ABLibrary	7567	0.80024
		 مقتل الإمام أمير المؤمنين على بن أبى طالب ( ع ) ( فارسي ) 	 ابن أبي الدنيا ( مترجم : محمود مهدوى دامغانى ) 	ABLibrary	7772	0.8001
		 مهمان نامه بخارا ( تاريخ پادشاهى محمد شيبانى ) ( فارسى ) 	 فضل الله روزبهان خنجى اصفهانى 	ABLibrary	8290	0.79985
		 حيات فكرى و سياسى امامان شيعه ( ع ) ( فارسي ) 	 الشيخ رسول جعفريان 	ABLibrary	7509	0.79969
		 مجموعه آثار شهيد مطهرى ( فارسي ) 	 مرتضى مطهرى 	ABLibrary	7573	0.79966
		 بحار الأنوار ( احتجاجات ) ( فارسي ) 	 العلامة المجلسي ( مترجم : موسى خسروى ) 	ABLibrary	8321	0.79943
		 روضة الواعظين و بصيرة المتعظين ( فارسي ) 	 الفتال النيسابوري ( مترجم : محمود مهدوى دامغانى ) 	ABLibrary	7536	0.79908
		 الدرة الباهرة من الأصداف الطاهرة ( فارسي ) 	 الشهيد الأول ( مترجم : مسعودى ) 	ABLibrary	974	0.79871
		 تاريخ الغيبة الكبرى ( تاريخ غيبت كبرى ) ( فارسي ) 	 السيد محمد الصدر ( مترجم : سيد حسن افتخارزاده ) 	ABLibrary	7452	0.79863
		 حياة الإمام زين العابدين ( ع ) ( تحليلى از زندگانى امام سجاد ع ) ( فارسي ) 	 الشيخ باقر شريف القرشي ( مترجم : محمدرضا عطائى ) 	ABLibrary	7501	0.79821
		 تاريخ عالم آراى امينى ( فارسى ) 	 فضل الله روزبهان خنجى اصفهانى 	ABLibrary	8050	0.79596
		 بحار الأنوار ( زندگانى حضرت مهدى موعود عج ) ( فارسي ) 	 العلامة المجلسي ( مترجم : على دوانى ) 	ABLibrary	7441	0.79553
		 الإمام الصادق و المذاهب الأربعة ( امام صادق و مذاهب چهارگانه ) ( فارسي ) 	 اسد حيدر ( مترجم : حسن يوسفى اشكورى ) 	ABLibrary	7427	0.79488
		 حياة القلوب ( فارسي ) 	 العلامة المجلسي 	ABLibrary	7516	0.7941
		 تاريخ ما بعد الظهور ( تاريخ پس از ظهور ) ( فارسي ) 	 السيد محمد الصدر ( مترجم : حسن سجادپور ) 	ABLibrary	7453	0.79322
		 تاريخ اجتماعى ايران ( فارسي ) 	 مرتضى راوندى 	ABLibrary	7992	0.79277
		 حياة الإمام الحسين ( ع ) ( زندگانى حضرت امام حسين ع ) ( فارسي ) 	 الشيخ باقر شريف القرشي ( مترجم : سيد حسين محفوظى اهوازى ) 	ABLibrary	7497	0.79204
		 منتهى الآمال في تواريخ النبي و الآل ( فارسي ) 	 الشيخ عباس القمي 	ABLibrary	7793	0.79183
		 تاريخ اجتماعى ايران ( فارسي ) 	 مرتضى راوندى 	ABLibrary	7997	0.79128
		 تحقيق دربارهء اول اربعين حضرت سيد الشهدا ( ع ) ( فارسي ) 	 محمد على قاضى طباطبائى 	ABLibrary	7461	0.79115
		 تفضيل امير المؤمنين ( ع ) ( اثبات برترى حضرت امير مؤمنان ع ) ( فارسي ) 	 الشيخ المفيد ( مترجم : على رضا بهاردوست و محمد حسين شمسائى ) 	ABLibrary	7475	0.79063
		 زندگانى على بن الحسين ( ع ) ( فارسي ) 	 سيد جعفر شهيدى 	ABLibrary	7540	0.78996
		 مجموعه آثار شهيد مطهرى ( فارسي ) 	 مرتضى مطهرى 	ABLibrary	7563	0.78794
		المجدي في انساب الطالبين	نجم الدين ابو الحسن علي بن محمد بن علي بن محمد علوي عمري	Ghbook	7088	0.78789
		 شرح نهج البلاغة ( فارسي ) 	 ابن ميثم البحراني ( مترجم : محمدى مقدم / نوايي ) 	ABLibrary	8378	0.78719
		فيض الاله في ترجمه القاضي نورالله	جلال الدين حسيني	Ghbook	7083	0.7866
		 مجموعه آثار شهيد مطهرى ( فارسي ) 	 مرتضى مطهرى 	ABLibrary	7557	0.78659
		 سفرنامه خراسان و كرمان ( فارسى ) 	 غلامحسين افضل الملك 	ABLibrary	8185	0.7862
		 عقد العلى للموقف الأعلى ( ضميمه رساله صلاح الصحاح فى طب ) ( فارسى ) 	 أحمد بن حامد كرمانى 	ABLibrary	8238	0.78619
		 مع الركب الحسيني ( با كاروان حسينى ) ( فارسي ) 	 مجموعة مؤلفين ( مترجم : عبد الحسين بينش ) 	ABLibrary	7750	0.78572
		 الكافي ( أصول الكافي ) ( فارسي ) 	 الشيخ الكليني ( مترجم : كوه كمره اى ) 	ABLibrary	7641	0.78564
		 مقامع الفضل 	 آقا محمد علي كرمانشاهي 	ABLibrary	9351	0.78521
		 سيره معصومان ( فارسي ) 	 السيد محسن الأمين ( مترجم : على حجتى كرمانى ) 	ABLibrary	7416	0.78509
		 جلاء العيون ( فارسي ) 	 العلامة المجلسي 	ABLibrary	7478	0.78485
		 كلمات مكنونة من علوم أهل الحكمة والمعرفة 	 الفيض الكاشاني 	ABLibrary	8578	0.78483
		 منتهى الآمال في تواريخ النبي و الآل ( فارسي ) 	 الشيخ عباس القمي 	ABLibrary	7794	0.7844
		 الرسائل المختارة 	 المحقق الدواني / السيد محمد باقر الداماد ( الميرداماد ) 	ABLibrary	8437	0.78402
		 المعالم الأثيره في السنة و السيرة ( فرهنگ اعلام جغرافيايى تاريخى در حديث و سيره نبوى ) ( فارسي ) 	 محمد بن محمد حسن شُرَّاب ( مترجم : حميدرضا شيخى ) 	ABLibrary	7755	0.78393
		 چكيده انديشه ها ( فارسي ) 	 الدكتور محمد التيجاني ( كوشش : ساروى ) 	ABLibrary	825	0.78353
		 مسائل الامامة ومقتطفات من الكتاب الاوسط ( فرقه هاى اسلامى و مسأله امامت ) ( فارسي ) 	 ناشئ اكبر ( مترجم : على رضا ايمانى ) 	ABLibrary	8353	0.78325
		 الدرة الفاخرة في تحقيق مذهب الصوفية والمتكلمين والحكماء المتقدمين 	 عبد الرحمن جامي 	ABLibrary	8421	0.7825
		 اكبرنامه ( تاريخ گوركانيان هند ) ( فارسي ) 	 ابو الفضل مبارك 	ABLibrary	7966	0.78235
		 مجموعه آثار شهيد مطهرى ( فارسي ) 	 مرتضى مطهرى 	ABLibrary	7564	0.78233
		 مع الركب الحسيني ( با كاروان حسينى ) ( فارسي ) 	 مجموعة مؤلفين ( مترجم : عبد الحسين بينش ) 	ABLibrary	7749	0.78225
		 فاطمة الزهراء ( ع ) بهجة قلب المصطفى ( ص ) ( فاطمه زهرا ( ع ) شادمانى دل پيامبر ) ( فارسي ) 	 أحمد رحمانى همدانى ( مترجم : سيد حسن افتخارزاده ) 	ABLibrary	7624	0.78215
		 منتخب التواريخ ( فارسى ) 	 عبد القادر بن ملوك شاه بداونى 	ABLibrary	8287	0.78191
		 سه سال در دربار ايران ( فارسى ) 	 فووريه ( مترجم : عباس اقبال آشتيانى ) 	ABLibrary	8211	0.78087
		 خاطرات و خطرات ( فارسى ) 	 مهديقلى هدايت ( مخبر السلطنه ) 	ABLibrary	8120	0.78074
		 مجموعه آثار شهيد مطهرى ( فارسي ) 	 مرتضى مطهرى 	ABLibrary	7558	0.78046
		 ناسخ التواريخ ( زندگانى پيامبر ) ( فارسي ) 	 لسان الملك سپهر 	ABLibrary	7867	0.78042
		 حياة الامام علي بن موسى الرضا ( ع ) ( پژوهشى دقيق در زندگانى امام رضا ع ) ( فارسي ) 	 الشيخ باقر شريف القرشي ( مترجم : سيد محمد صالحى ) 	ABLibrary	7507	0.78034
		 تاريخ شاهى ( فارسى ) 	 مولف ناشناخته 	ABLibrary	8048	0.78024
		 تصوير امامان شيعه در دائرة المعارف اسلام ( فارسي ) 	 محمود تقى زاده داورى 	ABLibrary	7473	0.7801
		 موسوعة التاريخ الإسلامي ( تاريخ تحقيقى اسلام ) ( فارسي ) 	 الشيخ محمد هادي اليوسفي الغروي ( مترجم : حسينعلى عربى ) 	ABLibrary	7862	0.77992
		تذكره القبور : بضميمه اشعار و مثنويات 	عبدالكريم بن مهدي گزي	Ghbook	7070	0.77938
		 مناقب علوى در آئينه شعر فارسى ( فارسي ) 	 ابوالقاسم رادفر 	ABLibrary	7893	0.77925
		 تاريخ اجتماعى ايران ( فارسي ) 	 مرتضى راوندى 	ABLibrary	7995	0.77912
		 قضاء أمير المؤمنين على بن أبى طالب ( ع ) ( قضاوتهاى امير المؤمنين ع ) ( فارسي ) 	 الشيخ محمد تقي التستري ( مترجم : سيد علىمحمد موسوى جزايرى ) 	ABLibrary	7640	0.77869
		 تاريخ اجتماعى ايران ( فارسي ) 	 مرتضى راوندى 	ABLibrary	7996	0.77858
		 حياة الإمام حسن العسكري ( ع ) ( زندگانى امام حسن عسكرى ع ) ( فارسي ) 	 الشيخ باقر شريف القرشي ( مترجم : سيد حسن اسلامى ) 	ABLibrary	7541	0.77831
		 اللهوف في قتلى الطفوف ( فارسي ) 	 السيد ابن طاووس ( مترجم : سيد ابوالحسن مير ابوطالبى ) 	ABLibrary	7692	0.77824
		 عبقات الأنوار في إمامة الأئمة الأطهار ( فارسي ) 	 السيد حامد النقوي 	ABLibrary	8502	0.77813
		 سيره معصومان ( فارسي ) 	 السيد محسن الأمين ( مترجم : حسين وجدانى ) 	ABLibrary	7418	0.77739
		 مجموعه آثار شهيد مطهرى ( فارسي ) 	 مرتضى مطهرى 	ABLibrary	7553	0.77717
		 روضة الشهداء ( فارسي ) 	 ملا حسين كاشفى سبزوارى 	ABLibrary	7535	0.77595
		 شرح آقا جمال خوانسارى بر غرر الحكم ودرر الكلم ( فارسي ) 	 جمال الدين محمد الخوانساري 	ABLibrary	7929	0.77585
		 مجموعه آثار شهيد مطهرى ( فارسي ) 	 مرتضى مطهرى 	ABLibrary	7569	0.77574
		 مع الركب الحسيني ( با كاروان حسينى ) ( فارسي ) 	 مجموعة مؤلفين ( مترجم : عبد الحسين بينش ) 	ABLibrary	7754	0.77517
		 أحسن التقاسيم في معرفة الأقاليم ( فارسي ) 	 محمد بن أحمد المقدسي ( المشاري ) ( مترجم : علينقي منزوي ) 	ABLibrary	8920	0.77497
		 مجموعه آثار شهيد مطهرى ( فارسي ) 	 مرتضى مطهرى 	ABLibrary	7556	0.77465
		 صلح امام حسن ( ع ) ( فارسي ) 	 شيخ راضى آل ياسين ( مترجم : السيد الخامنئي ) 	ABLibrary	7596	0.77463
		 مع الركب الحسيني ( با كاروان حسينى ) ( فارسي ) 	 مجموعة مؤلفين ( مترجم : عبد الحسين بينش ) 	ABLibrary	7752	0.77446
		 حياة القلوب ( فارسي ) 	 العلامة المجلسي 	ABLibrary	7513	0.77428
		 الفصول العشرة في الغيبة ( ده انتقاد و پاسخ پيرامون غيبت امام مهدى عج ) ( فارسي ) 	 الشيخ المفيد ( مترجم : محمد باقر خالصى ) 	ABLibrary	7636	0.77399
		 بحار الأنوار ( احتجاجات ) ( فارسي ) 	 العلامة المجلسي ( مترجم : موسى خسروى ) 	ABLibrary	8322	0.77396
		 سفرنامه شاردن ( فارسى ) 	 ژان شاردن ( مترجم : اقبال يغمايى ) 	ABLibrary	8190	0.7737
		 نظام الحكومة النبوة المسمى التراتيب الادارية ( نظام ادارى مسلمانان در صدر اسلام ) ( فارسي ) 	 عبد الحي الكتاني ( مترجم : عليرضا ذكاوتى قراگزلو ) 	ABLibrary	7876	0.77368
		 الغارات ( فارسي ) 	 إبراهيم بن محمد الثقفي الكوفي ( مترجم : عبد المحمد آيتى ) 	ABLibrary	7622	0.77363
		الصوارم المهرقه	قاضي نورالله شوشتري	Ghbook	2412	0.77312
		 سفرنامه شاردن ( فارسى ) 	 ژان شاردن ( مترجم : اقبال يغمايى ) 	ABLibrary	8191	0.773
		 مجموعه آثار شهيد مطهرى ( فارسي ) 	 مرتضى مطهرى 	ABLibrary	7555	0.77264
		 مجموعه آثار شهيد مطهرى ( فارسي ) 	 مرتضى مطهرى 	ABLibrary	7559	0.77259
		 تاريخ ادبيات ايران از فردوسى تا سعدى ( فارسى ) 	 ادوارد براون ( مترجم : فتح الله مجتبائى و غلام حسين صدرى افشار ) 	ABLibrary	8000	0.77203
		 خاطرات و اسناد حسين قلى خان نظام السلطنه مافي ( فارسى ) 	 حسين قلى خان نظام السلطنه مافى 	ABLibrary	8118	0.77154
		 جانشينى محمد ( ص ) ( فارسي ) 	 ويلفرد مادلونگ ( مترجم : نمايى / قاسمى / مهدوى / ضابط ) 	ABLibrary	7476	0.77145
		 فيض الدموع شرح زندگانى و شهادت امام حسين ( ع ) ( فارسي ) 	 محمد ابراهيم نواب ( بدايع نگار ) 	ABLibrary	7638	0.77134
		 عبقات الأنوار في إمامة الأئمة الأطهار ( فارسي ) 	 السيد حامد النقوي 	ABLibrary	8491	0.77116
		 تاريخ و فرهنگ ايران ( فارسى ) 	 محمد مهدى ملايرى 	ABLibrary	8078	0.77102
		 سفر در ايران ( فارسى ) 	 گاسپار دروويل ( مترجم : منوچهر اعتماد مقدم ) 	ABLibrary	8175	0.77071
		 سفرنامه شاردن ( فارسى ) 	 ژان شاردن ( مترجم : اقبال يغمايى ) 	ABLibrary	8189	0.77063
		 الكامل في التاريخ ( تاريخ كامل ) ( فارسي ) 	 ابن الأثير ( مترجم : خليلى / حالت ) 	ABLibrary	7650	0.77029
		 تجارب الأمم ( فارسى ) 	 أحمد بن محمد مسكويه الرازي ( مترجم : ابو القاسم امامى و على نقى منزوى ) 	ABLibrary	8088	0.76967
		 ايران وقضيهء ايران ( فارسي ) 	 جورج ناتانيل كرزن ( مترجم : غلام على وحيد مازندرانى ) 	ABLibrary	7976	0.76937
		 انقلاب مشروطيت ايران ( فارسي ) 	 ادوارد براون ( مترجم : مهرى قزوينى ) 	ABLibrary	7969	0.76933
		 عبقات الأنوار في إمامة الأئمة الأطهار ( فارسي ) 	 السيد حامد النقوي 	ABLibrary	8492	0.7692
		 إحياء الميت بفضائل اهل البيت ( ع ) ( عربي ، فارسي ) 	 جلال الدين السيوطي ( مترجم : امامى ) 	ABLibrary	7396	0.76902
		 فتوحات شاهى ( تاريخ صفوى از آغاز تا سال 920 ه . ق ) ( فارسى ) 	 أمير صدر الدين ابراهيم امينى هروى 	ABLibrary	8241	0.76886
		 بدايع الوقايع ( فارسى ) 	 زين الدين محمود واصفى 	ABLibrary	7980	0.7688
		 إثنا عشر رسالة 	 السيد محمد باقر الداماد ( الميرداماد ) 	ABLibrary	835	0.76869
		 تاريخ الفي ( فارسى ) 	 قاضى احمد تتوى / آصف خان قزوينى 	ABLibrary	8011	0.76852
		 حياة الإمام الحسن بن على ( ع ) ( زندگانى حسن بن على ع ) ( فارسي ) 	 الشيخ باقر شريف القرشي ( مترجم : فخر الدين حجازى ) 	ABLibrary	7492	0.7685
