automatic URI	Proposed URI	bookTitle	authorName	collection	id	tfidf
		 المواعظ العددية أحاديث وحكم ومواعظ تبدأ بالآحاد وتنتهي بالإثنى عشر 	 ابن قاسم الحسيني العاملي ( العيناثي ) 	ABLibrary	10439	0.26211
		 موسوعة اخلاق القرآن 	 أحمد الشرباصي 	ABLibrary	12475	0.26207
		 تفسير القرآن الحكيم ( تفسير المنار ) 	 الشيخ محمد رشيد رضا 	ABLibrary	12054	0.26207
		 الجديد في تفسير القرآن المجيد 	 الشيخ محمد السبزواري النجفي 	ABLibrary	12234	0.26205
		 أنوار النبي ( ص ) أسرارها وأنواعها 	 ابن سبعين 	ABLibrary	7431	0.26204
		طوق الحمامة في الألفة والألاف	أبو محمد علي بن أحمد بن سعيد بن حزم الأندلسي القرطبي الظاهري (المتوفى: 456هـ)	ShamAY	10518	0.26202
		 التنبيهات العَليّة على وظائف الصلاة القلبية 	 الشهيد الثاني 	ABLibrary	10436	0.26201
		نهج البلاغة [ج ٢]	محمد عبده	Rafed	1618	0.26199
		ريحانة الألبّا وزهرة الحياة الدنيا	شهاب الدين أحمد بن محمد بن عمر الخفاجي (المتوفى: 1069هـ)	ShamAY	1522	0.26196
		ديوان البوصيري	شرف الدين محمد بن سعيد بن حمّاد الجنوني الصنهاجي (608 ـ 696 هـ)	ShamAY	37846	0.26195
		 نفح الطيب من غصن الأندلس الرطيب 	 أحمد بن محمد المقري التلمساني 	ABLibrary	9299	0.26189
		الامام زين العابدين العابدين (ع) صاحب الصحيفه الربانيه و حامل الالام المضيئه	هادي مدرسي	Ghbook	6353	0.26188
		 تفسير المراغي 	 أحمد مصطفى المراغي 	ABLibrary	12030	0.26181
		 خلق المسلم 	 محمد الغزالي 	ABLibrary	10506	0.26181
		رسالات ولائية	السيد عادل العلوي	Masaha	299	0.26179
		 تفسير البيان الصافي لكلام الله الوافي 	 محمدحسن القبيسي العاملي 	ABLibrary	12380	0.26174
		تزيين الأسواق في أخبار العشاق	داود بن عمر الأنطاكي، المعروف بالأكمه (المتوفى: 1008ه)	ShamelaY19	630	0.26174
		 الكواكب الدرية على الحدائق الوردية في أجلاء السادة النقشبندية 	 الشيخ عبد المجيد الخاني النقشبندي 	ABLibrary	13017	0.26168
		 شقائق النعمان على سموط الجمان في أسماء شعراء عمان 	 محمد بن راشد الخصيبي 	ABLibrary	13308	0.26157
		 مصابيح الأنوار في حل مشكلات الأخبار 	 السيد عبد الله شبر 	ABLibrary	11508	0.26154
		 من هدى القرآن 	 السيد محمد تقي المدرسي 	ABLibrary	10358	0.26152
		 موسوعة مصطلحات التصوف الإسلامي 	 رفيق العجم 	ABLibrary	8899	0.2615
		 نزهة الجليس ومنية الأديب الأنيس 	 سيد عباس بن علي بن نور الدين الحسيني الموسوي المكي 	ABLibrary	14191	0.26146
		 لطائف الإشارات 	 ابو القاسم عبد الكريم القشيري 	ABLibrary	11683	0.26143
		الكتيبة الكامنة في من لقيناه بالأندلس من شعراء المائة الثامنة	لسان الدين بن الخطيب، محمد بن عبد الله (المتوفى: 776ه)	ShamelaY19	1027	0.26141
		 نفحة الريحانة ورشحة طلاء الحانة ( دار الكتب العلمية ) 	 محمد أمين المحبي 	ABLibrary	12941	0.26137
		 موسوعة الكلمة 	 السيد حسن الحسيني الشيرازي 	ABLibrary	10488	0.26133
		 فيض القدير شرح الجامع الصغير 	 المناوي 	ABLibrary	1331	0.26131
		النظرات	مصطفى لطفي بن محمد لطفي بن محمد حسن لطفي المنفلوطي (المتوفى: 1343ه)	ShamelaY19	11400	0.2613
		البلد الأمين و الدرع الحصين	ابراهيم بن علي الكفعمي	Masaha	1057	0.2613
		 المثنوي المعنوي ( معرب الدسوقي ) 	 جلال الدين الرومي 	ABLibrary	8766	0.26129
		 التفسير القرآنى للقرآن 	 عبد الكريم الخطيب 	ABLibrary	12190	0.26129
		 من هدى القرآن 	 السيد محمد تقي المدرسي 	ABLibrary	10355	0.26128
		ديوان ابن مشرف	أحمد بن علي بن حسين بن مشرف , ت: 1285 هـ	ShamAY	37876	0.26125
		 أدب الطف أو شعراء الحسين ( ع ) 	 جواد شبر 	ABLibrary	7404	0.26115
		التمثيل والمحاضرة	عبد الملك بن محمد بن إسماعيل أبو منصور الثعالبي (المتوفى: 429ه)	Sham19Y	5683	0.26108
		 مناسك الحج 	 السيد كاظم الحائري 	ABLibrary	9613	0.26106
		 مجموع كتب ورسائل الإمام القاسم بن إبراهيم الرسي 	 القاسم بن إبراهيم الرسي 	ABLibrary	8592	0.26106
		 في ظلال العقيده والاخلاق 	 السيد كمال الحيدري 	ABLibrary	10324	0.26106
		تفسير البيان الصافي لكلام الله الوافي [ج ٤]	الشيخ محمد حسن القبيسي العاملي	Rafed	3759	0.26101
		 الجديد في تفسير القرآن المجيد 	 الشيخ محمد السبزواري النجفي 	ABLibrary	12232	0.26099
		 التمهيد في علوم القرآن 	 محمد هادي معرفة 	ABLibrary	12455	0.26099
		 الذريعة إلى مكارم الشريعة 	 الراغب الأصفهاني 	ABLibrary	10416	0.26092
		 بيان السعادة في مقامات العبادة 	 سلطان محمد الجنابذي ( سلطان علي شاه ) 	ABLibrary	12039	0.26089
		تعريف عام بدين الإسلام	علي بن مصطفى الطنطاوي (المتوفى: 1420هـ)	ShamAY	986	0.26086
		 تفسير البيان الصافي لكلام الله الوافي 	 محمدحسن القبيسي العاملي 	ABLibrary	12378	0.26085
		الرد على الشاذلي في حزبيه، وما صنفه في آداب الطريق	تقي الدين أبو العباس أحمد بن عبد الحليم بن عبد السلام بن عبد الله بن أبي القاسم بن محمد ابن تيمية الحراني الحنبلي الدمشقي (المتوفى: 728هـ)	ShamAY	1463	0.26085
		ديوان الشريف الرضي - الجزء1	الشريف الرضي	Masaha	3399	0.26083
		النص الكامل لكتاب العواصم من القواصم	القاضي محمد بن عبد الله أبو بكر بن العربي المعافري الاشبيلي المالكي (المتوفى: 543ه)	ShamelaY19	96180	0.26082
		 شرح رسالة الحقوق للإمام زين العابدين ( ع ) 	 السيد حسن القبانچي 	ABLibrary	10504	0.26081
		 تفسير المراغي 	 أحمد مصطفى المراغي 	ABLibrary	12024	0.2608
		 أخلاقيات الإمام علي أمير المؤمنين ( ع ) 	 هادي المدرسي 	ABLibrary	10559	0.26078
		 التفسير الصوفى الفلسفى للقرآن الكريم 	 محمد غازي عرابي 	ABLibrary	12490	0.26076
		مختصر الصواعق المرسلة على الجهميّة والمعطّلة	ابن القيّم الجوزيّة	Rafed	3496	0.26074
		نهج البلاغة [ج ٣]	محمد عبده	Rafed	1619	0.26068
		التفسير القيم = تفسير القرآن الكريم لابن القيم	محمد بن أبي بكر بن أيوب بن سعد شمس الدين ابن قيم الجوزية (المتوفى: 751ه)	ShamelaY19	23606	0.26067
		تفسير المراغي [ج ٧]	أحمد مصطفى المراغي	Rafed	1677	0.26066
		ديوان ابن شهاب	أبو بكر بن شهاب الحميني الحضرمي	ShamAY	37872	0.26061
		 تفسير المراغي 	 أحمد مصطفى المراغي 	ABLibrary	12029	0.2606
		 الفرقان في تفسير القرآن بالقرآن والسنه 	 الشيخ محمد الصادقي 	ABLibrary	12125	0.26059
		 المقدمات من كتاب نص النصوص 	 السيد حيدر الآملي 	ABLibrary	8806	0.26058
		 أخلاق الوزيرين ( مثالب الوزيرين الصاحب ابن عباد وابن العميد ) 	 علي بن محمد التوحيدي 	ABLibrary	13471	0.26055
		 منازل السائرين ( شرح التلمساني ) 	 عبد الله الأنصاري الهروي 	ABLibrary	8779	0.26051
		 كتاب ألف باء ( في أنواع الآداب وفنون المحاضرات واللغة ) 	 يوسف بن محمد البلوي المالقي ( ابن الشيخ ) 	ABLibrary	14126	0.26049
		النظرات	مصطفى لطفي بن محمد لطفي بن محمد حسن لطفي المَنْفَلُوطي (المتوفى: 1343هـ)	ShamAY	11400	0.26047
		التمثيل والمحاضرة	عبد الملك بن محمد بن إسماعيل أبو منصور الثعالبي (المتوفى: 429هـ)	ShamAY	5683	0.26045
		 المحاسن والأضداد 	 الجاحظ 	ABLibrary	13605	0.26042
		 الجديد في تفسير القرآن المجيد 	 الشيخ محمد السبزواري النجفي 	ABLibrary	12235	0.2604
		المحاضرات في اللغة والأدب	الحسن بن مسعود بن محمد، أبو علي، نور الدين اليوسي (المتوفى: 1102ه)	ShamelaY19	473	0.26039
		الرسائل للجاحظ	عمرو بن بحر بن محبوب الكناني بالولاء، الليثي، أبو عثمان، الشهير بالجاحظ (المتوفى: 255هـ)	ShamAY	10428	0.26035
		 بحار الأنوار 	 العلامة المجلسي 	ABLibrary	794	0.26034
		ديوان الشريف المرتضى	علي بن الحسين بن موسى بن محمد بن إبراهيم أبو القاسم.	ShamAY	37891	0.26033
		نور وهداية	علي بن مصطفى الطنطاوي (المتوفى: 1420ه)	Sham19Y	1791	0.26033
		 الموسوعة القرآنية 	 ابراهيم الأبياري 	ABLibrary	12440	0.2603
		 التعريفات 	 علي بن محمد الجرجاني 	ABLibrary	8386	0.26029
		 الجبر والاختيار 	 السيد محمد صادق الروحاني 	ABLibrary	8404	0.26028
		 الاقتصاد في الاعتقاد 	 الغزالي 	ABLibrary	8311	0.26026
		مدارج السالكين بين منازل إياك نعبد وإياك نستعين	محمد بن أبي بكر بن أيوب بن سعد شمس الدين ابن قيم الجوزية (المتوفى: 751ه)	ShamelaY19	8370	0.26026
		 الفوز الأصغر 	 أحمد بن محمد مسكويه الرازي 	ABLibrary	10404	0.26022
		التفسير القيم = تفسير القرآن الكريم لابن القيم	محمد بن أبي بكر بن أيوب بن سعد شمس الدين ابن قيم الجوزية (المتوفى: 751هـ)	ShamAY	23606	0.26021
		 مختصر الميزان في تفسير القرآن 	 السيد محمدحسين الطباطبائي ( تلخيص إلياس الكلانتري ) 	ABLibrary	12237	0.2602
		ديوان مهيار الديلمي	مهيار بن مرزويه، أبو الحسن الديلمي المتوفى سنة (428 هـ / 1037 م)	ShamAY	37863	0.26017
		تفسير المراغي [ج ١٢]	أحمد مصطفى المراغي	Rafed	1682	0.26012
		 الفرقان في تفسير القرآن بالقرآن والسنه 	 الشيخ محمد الصادقي 	ABLibrary	12136	0.26012
		بوارق القهر في تفسير سورة الدّهر	الملّا حبيب الله الشريف الكاشاني	Rafed	1573	0.26011
		 عقائد الإمامية الإثني عشرية 	 السيد ابراهيم الموسوي الزنجانى النجفي 	ABLibrary	8513	0.2601
		 نفحة الريحانة ورشحة طلاء الحانة ( دار الكتب العلمية ) 	 محمد أمين المحبي 	ABLibrary	12942	0.26004
		التوحيد لمحمد عبده	محمد عبده بن حسن خير الله (المتوفى: 1323هـ)	ShamAY	6392	0.26002
		ذم النفس والهوى	الشيخ عبد الهادي حسن وهبي	ShamAY	35107	0.25996
		 الفرقان في تفسير القرآن بالقرآن والسنه 	 الشيخ محمد الصادقي 	ABLibrary	12133	0.25994
		 المثنوي المعنوي ( معرب الدسوقي ) 	 جلال الدين الرومي 	ABLibrary	8762	0.25994
		 النور الأبهر في الدفاع عن الشيخ الأكبر 	 مجموعة مؤلفين 	ABLibrary	8805	0.25993
		نزهة الأبصار بطرائف الأخبار والأشعار	عبد الرحمن بن عبد الله بن أحمد بن درهم (المتوفى: 1362ه)	ShamelaY19	5375	0.25988
		 بحار الأنوار 	 العلامة المجلسي 	ABLibrary	772	0.25985
		 كتاب النصيحة ( قابوس نامه ) 	 عنصرالمعالي كيكاوس بن اسكندر ( تعريب : نشأت / عبد المجيد ) 	ABLibrary	10415	0.25985
		 مفاهيم القرآن 	 الشيخ السبحاني 	ABLibrary	12604	0.25979
		 معترك الاقران في اعجاز القرآن 	 جلال الدين السيوطي 	ABLibrary	11883	0.25977
		 تفسير النهر الماد من البحر المحيط 	 أبي حيان الأندلسي 	ABLibrary	11785	0.25975
		 تفسير روح البيان 	 الشيخ اسماعيل حقي البروسوي 	ABLibrary	11899	0.2597
		 مقدمة في علم الأخلاق 	 السيد كمال الحيدري 	ABLibrary	10545	0.2597
		نفحة اليمن فيما يزول بذكره الشجن	أحمد بن محمد بن علي بن إبراهيم الأنصاري الشرواني (المتوفى: 1253هـ)	ShamAY	1022	0.25967
		تفسير المراغي [ج ٣]	أحمد مصطفى المراغي	Rafed	1660	0.25966
		 تفسير روح البيان 	 الشيخ اسماعيل حقي البروسوي 	ABLibrary	11900	0.25966
		 من وحي القرآن 	 السيد محمد حسين فضل الله 	ABLibrary	12155	0.25965
		شرح العقيدة الطّحاويّة	ابن أبي العزّ الحنفي	Rafed	3437	0.25959
		أضواء على دعاء كميل	عز الدين بحر العلوم	Rafed	2808	0.25953
		ديوان محمود سامي البارودي	محمود سامي باشا بن حسن حسين بن عبد الله البارودي المصري	ShamAY	37857	0.25952
		 تفسير ابن عجيبة ( البحر المديد في تفسير القرآن المجيد ) 	 ابن عجيبة 	ABLibrary	11956	0.2595
		 تحرير المواعظ العددية فيها ما تشتهيه الأنفس وتلذ الأعين 	 الشيخ علي المشكيني 	ABLibrary	10508	0.25949
		 تفسير القرآن الحكيم ( تفسير المنار ) 	 الشيخ محمد رشيد رضا 	ABLibrary	12052	0.25945
		طوق الحمامة في الألفة والألاف	أبو محمد علي بن أحمد بن سعيد بن حزم الأندلسي القرطبي الظاهري (المتوفى: 456ه)	ShamelaY19	10518	0.25944
		إغاثة اللهفان من مصائد الشيطان - المعرفة	محمد بن أبي بكر أيوب الزرعي أبو عبد الله	ShamAY	34412	0.25943
		البخلاء	عمرو بن بحر الجاحظ	Masaha	2332	0.25942
		الرد على الشاذلي في حزبيه، وما صنفه في آداب الطريق	تقي الدين أبو العباس أحمد بن عبد الحليم بن عبد السلام بن عبد الله بن أبي القاسم بن محمد ابن تيمية الحراني الحنبلي الدمشقي (المتوفى: 728ه)	ShamelaY19	1463	0.25939
		 اختيار مصباح السالكين 	 ابن ميثم البحراني 	ABLibrary	1229	0.25938
		 الأساس في التفسير 	 سعيد حوي 	ABLibrary	12390	0.25933
		 خريدة القصر وجريدة العصر 	 عماد الدين الكاتب الأصبهاني 	ABLibrary	12739	0.25931
		 المدرس الأفضل فيما يرمز ويشار إليه في المطول 	 الشيخ محمد علي المدرس الأفغاني 	ABLibrary	11415	0.2593
		 ميزان العمل 	 الغزالي 	ABLibrary	10418	0.25929
		 آثار ابن المقفع 	 ابن المقفع 	ABLibrary	10384	0.25919
		 غور الأمور 	 الحكيم الترمذي 	ABLibrary	8696	0.25919
		 تفسير ابن عجيبة ( البحر المديد في تفسير القرآن المجيد ) 	 ابن عجيبة 	ABLibrary	11954	0.25918
		 إحياء علوم الدين 	 الغزالي 	ABLibrary	1218	0.25917
		كلمه الامام المهدي ( عليه السلام )	حسن شيرازي	Ghbook	6560	0.25917
		شرح القصيدة النونيّة [ج ١]	ابن القيّم الجوزيّة	Rafed	3430	0.25915
		 الكهف والرقيم في شرح بسم الله الرحمن الرحيم ( ويليه مراتب الوجود وحقيقة كل موجود ونسيم السحر ) 	 عبد الكريم بن ابراهيم الجيلي 	ABLibrary	8815	0.25915
		ديوان ابن الخياط	ابن الخياط، احمد بن محمد بن على بن يحيى التغلبى 450 - 517 هـ	ShamAY	37837	0.2591
		تفسير ابن عربي [ج ١]	محيي الدين بن علي بن أحمد بن عبدالله الطائي الحاتمي [ ابن عربي ]	Rafed	3854	0.25901
		 نور الأنوار في شرح الصحيفة السجادية 	 السيد نعمة الله الجزائري 	ABLibrary	10444	0.25901
		 عصمة الأنبياء في القرآن الكريم 	 الشيخ السبحاني 	ABLibrary	1298	0.25899
		ريحانة الألبا وزهرة الحياة الدنيا	شهاب الدين أحمد بن محمد بن عمر الخفاجي (المتوفى: 1069ه)	ShamelaY19	1522	0.25899
		نور وهداية	علي بن مصطفى الطنطاوي (المتوفى: 1420ه)	ShamelaY19	1791	0.25897
		التّفسير القرآني للقرآن [ج ٧]	عبدالكريم الخطيب	Rafed	3349	0.25896
		مفتاح الأفكار للتأهب لدار القرار	أبو محمد عبد العزيز بن محمد بن عبد الرحمن بن عبد المحسن السلمان (المتوفى: 1422هـ)	ShamAY	120	0.25895
		تفسير ابن عربي [ج ٢]	محيي الدين بن علي بن أحمد بن عبدالله الطائي الحاتمي [ ابن عربي ]	Rafed	3855	0.25889
		 غاية المرام في علم الكلام 	 سيف الدين الآمدي 	ABLibrary	8522	0.25881
		 إرشاد القلوب 	 الحسن بن محمد الديلمي 	ABLibrary	1249	0.25881
		 تفسير المراغي 	 أحمد مصطفى المراغي 	ABLibrary	12022	0.25881
		 مختصر الميزان في تفسير القرآن 	 السيد محمدحسين الطباطبائي ( تلخيص إلياس الكلانتري ) 	ABLibrary	12240	0.2588
		صيد الخاطر	جمال الدين أبو الفرج عبد الرحمن بن علي بن محمد الجوزي (المتوفى: 597هـ)	ShamAY	12028	0.25879
		 اليواقيت والجواهر في بيان عقائد الأكابر ( وفي الحاشية الكبريت الأحمر ) 	 عبد الوهاب الشعراني 	ABLibrary	8837	0.25878
		 تفسير المعين 	 محمد بن مرتضى الكاشاني 	ABLibrary	11913	0.25869
		العدد القوية لدفع المخاوف اليومية	رضي الدين الحلي	Masaha	1072	0.25867
		التمثيل والمحاضرة	عبد الملك بن محمد بن إسماعيل أبو منصور الثعالبي (المتوفى: 429ه)	ShamelaY19	5683	0.25865
		 مناهج البيان في تفسير القرآن 	 محمد باقر الملكي الميانجي 	ABLibrary	12338	0.25863
		تفسير المراغي [ج ١٣]	أحمد مصطفى المراغي	Rafed	1683	0.25862
		شرح الكافي - الجزء1	الشيخ محمد صالح المازندراني	Masaha	1352	0.25862
		 عين اليقين الملقب بالأنوار والأسرار 	 الفيض الكاشاني 	ABLibrary	8519	0.25861
		 التطورات النحوية في اللغة العربية من البداية حتى الآن 	 محمد خاقاني أصفهاني 	ABLibrary	13851	0.25861
		 رسائل في الفلسفة والعرفان 	 سيد جمال الدين الحسيني الأفغاني والشيخ محمد عبده 	ABLibrary	13972	0.25858
		 إحياء علوم الدين 	 الغزالي 	ABLibrary	1209	0.25855
		 الفواتح الإلهية والمفاتح الغيبية 	 الشيخ نعمة الله بن محمود النخجواني 	ABLibrary	11855	0.25852
		 نثر الدر في المحاضرات 	 أبو سعد منصور بن الحسين الآبي 	ABLibrary	14187	0.2585
		الميزان في تفسير القرآن [ج ٧]	آية الله السيد محمد حسين الطباطبائي	Rafed	1436	0.25846
		 كيفية السلوك إلى رب العالمين 	 الحكيم الترمذي 	ABLibrary	8697	0.25845
		 جمهرة خطب العرب في عصور العربية الزاهرة 	 أحمد زكي صفوت 	ABLibrary	13568	0.25845
		 الكشكول 	 الشيخ البهائي العاملي 	ABLibrary	8844	0.25844
		ديوان بهاء الدين	أبو الفضل بهاء الدين زهير بن محمد بن على بن يحى 581 - 656هـ	ShamAY	37942	0.25843
		التّفسير القرآني للقرآن [ج ١]	عبدالكريم الخطيب	Rafed	3343	0.25841
		 مختصر مجمع البيان 	 الشيخ الطبرسي 	ABLibrary	11726	0.2584
		 شرح العقائد النسفية 	 التفتازاني 	ABLibrary	8458	0.25838
		السحر الحلال في الحكم والأمثال	أحمد بن إبراهيم بن مصطفى الهاشمي (المتوفى: 1362هـ)	ShamAY	6903	0.25837
		الفرقان في تفسير القرآن بالقرآن والسنّة [ج ٢٩]	الشيخ محمد الصادقي	Rafed	3058	0.25835
		 التفسير القرآنى للقرآن 	 عبد الكريم الخطيب 	ABLibrary	12189	0.25834
		 الفواتح الإلهية والمفاتح الغيبية 	 الشيخ نعمة الله بن محمود النخجواني 	ABLibrary	11856	0.25834
		الروض النضر في ترجمة أدباء العصر	عثمان بن علي بن مراد العمري	ShamAY	35857	0.25827
		تفسير المراغي [ج ٨]	أحمد مصطفى المراغي	Rafed	1678	0.25825
		التوحيد لمحمد عبده	محمد عبده بن حسن خير الله (المتوفى: 1323ه)	ShamelaY19	6392	0.25823
		 تفسير روح البيان 	 الشيخ اسماعيل حقي البروسوي 	ABLibrary	11907	0.2582
		الموشى = الظرف والظرفاء	محمد بن أحمد بن إسحاق بن يحيى، أبو الطيب، المعروف بالوشاء (المتوفى: 325ه)	Sham19Y	26102	0.25819
		الميزان في تفسير القرآن [ج ١٣]	آية الله السيد محمد حسين الطباطبائي	Rafed	1446	0.25816
		 روض الأخيار المنتخب من ربيع الأبرار 	 محمد بن قاسم بن يعقوب الأماسي ( ابن خطيب ) 	ABLibrary	14066	0.25816
		إشارات على الطريق	علي القرني	ShamAY	35045	0.25815
		 في ظلال القرآن 	 سيد قطب 	ABLibrary	12040	0.2581
		التفسير الواضح [ج ٢]	دكتور محمّد محمود حجازي	Rafed	3988	0.25804
		 فوات الوفيات والذيل عليها 	 محمد بن شاكر الكتبي 	ABLibrary	12817	0.25802
		 من هدى القرآن 	 السيد محمد تقي المدرسي 	ABLibrary	10356	0.25797
		 نقض الوشيعة أو الشيعة بين الحقائق الأوهم 	 السيد محسن الأمين 	ABLibrary	8670	0.25795
		 الفرقان في تفسير القرآن بالقرآن والسنه 	 الشيخ محمد الصادقي 	ABLibrary	12137	0.25794
		 مناهج البيان في تفسير القرآن 	 محمد باقر الملكي الميانجي 	ABLibrary	12336	0.25791
		 جمهرة خطب العرب في عصور العربية الزاهرة 	 أحمد زكي صفوت 	ABLibrary	13566	0.25783
		مجموعة الرسائل والمسائل لابن تيمية - رشيد رضا	ابن تيمية	Sham19Y	11730	0.25783
		السحر الحلال في الحكم والأمثال	أحمد بن إبراهيم بن مصطفى الهاشمي (المتوفى: 1362ه)	ShamelaY19	6903	0.2578
		رسالة التوحيد - ط الكتاب العربي	محمد عبده	ShamAY	33867	0.25776
		آداب الدعاء المسمى أدب المُرتَعى في علم الدعا	الواحدي :: يوسف بن عبد الهادي	ShamAY	33728	0.25776
		 تفسير الشعراوى 	 محمد متولي الشعراوي 	ABLibrary	12318	0.25775
		الأخلاق والسير في مداواة النفوس	أبو محمد علي بن أحمد بن سعيد بن حزم الأندلسي القرطبي الظاهري (المتوفى: 456هـ)	ShamAY	6874	0.25774
		مجموعة رسائل الإمام الغزالي	أبو حامد محمد بن محمد الغزالي الطوسي (المتوفى: 505هـ)	ShamAY	34797	0.25772
		الرسائل للجاحظ	عمرو بن بحر بن محبوب الكناني بالولاء، الليثي، أبو عثمان، الشهير بالجاحظ (المتوفى: 255ه)	ShamelaY19	10428	0.25772
		 تفسير المحيط الأعظم والبحر الخضم في تأويل كتاب الله العزيز المحكم 	 السيد حيدر الآملي 	ABLibrary	11775	0.2577
