automatic URI	Proposed URI	bookTitle	authorName	collection	id	tfidf
		نور وهداية	علي بن مصطفى الطنطاوي (المتوفى: 1420هـ)	ShamAY	31960	0.25768
		 فوات الوفيات والذيل عليها 	 محمد بن شاكر الكتبي 	ABLibrary	12815	0.25762
		الأخلاق والسير لابن حزم الأندلسي - دار المشرق	علي بن أحمد بن سعيد بْنِ حَزْمٍ، أبو محمد، الأَنْدَلُسِيّ (384 - 456هـ)	ShamAY	33746	0.25762
		نفحة اليمن فيما يزول بذكره الشجن	أحمد بن محمد بن علي بن إبراهيم الأنصاري الشرواني (المتوفى: 1253ه)	ShamelaY19	35888	0.25762
		 زهرة التفاسير 	 محمد أبو زهرة 	ABLibrary	12078	0.25759
		 محاضرة الأبرار ومسامرة الأخيار 	 ابن عربي 	ABLibrary	8746	0.25752
		غرر الخصائص الواضحة، وعرر النقائض الفاضحة	أبو إسحق برهان الدين محمد بن إبراهيم بن يحيى بن علي المعروف بالوطواط (المتوفى: 718هـ)	ShamAY	1349	0.25751
		 تفسير الشريف المرتضى ( نفائس التأويل ) 	 الشريف المرتضى 	ABLibrary	11694	0.2575
		المستطرف في كل فن مستطرف - العلمية	شهاب الدين محمد بن أحمد أبي الفتح الأبشيهي	ShamAY	33781	0.2575
		 أعلام النبوة 	 علي بن محمد البغدادي الماوردي 	ABLibrary	8340	0.25747
		قلائد العقيان	الفتح بن خاقان بن أحمد بن غرطوج، أبو محمد (المتوفى: 247ه)	Sham19Y	21510	0.25747
		الجانب العاطفي من الإسلام	محمد الغزالي :: أبو حامد الغزالي	ShamAY	36031	0.25744
		المقنعة (للشيخ المفيد)	الشيخ المفيد	Masaha	989	0.25743
		 دراسات في التفسير الموضوعى للقصص القرآنى 	 أحمد جمال العمري 	ABLibrary	12509	0.25741
		عقائد الإمامية	الشيخ محمد رضا المظفر	Masaha	346	0.2574
		الدروع الواقية	السيد علي بن موسى بن طاووس	Masaha	1021	0.2574
		 روضة الحبور ومعدن السرور في مناقب الجنيد البغدادى وإبي يزيد طيفور 	 محمد بن احمد الأطعاني البسطامي 	ABLibrary	8808	0.25736
		الوسيط في تراجم أدباء شنقيط والكلام على تلك البلاد تحديدا وتخطيطا وعاداتهم وأخلاقهم وما يتعلق بذلك	أحمد بن الأمين الشّنْقِيطي (المتوفى: 1331هـ)	ShamAY	1629	0.25736
		 جامع البيان في تفسير القرآن ( مع حواشي الغزنوي ) 	 محمد بن عبد الرحمن الإيجي الشيرازي 	ABLibrary	11864	0.2573
		 العقد الفريد 	 أحمد بن محمد ابن عبد ربه الأندلسي 	ABLibrary	14111	0.25728
		 الرسائل التوحيدية 	 السيد الطباطبائي 	ABLibrary	8435	0.25728
		الميزان في تفسير القرآن [ج ٨]	آية الله السيد محمد حسين الطباطبائي	Rafed	1437	0.25721
		نهج البلاغة [ج ١]	محمد عبده	Rafed	1617	0.2572
		 مشرع الخصوص إلى معاني النصوص ( النصوص في تحقيق الطور المخصوص ) 	 علي بن أحمد المهائمي 	ABLibrary	8816	0.25719
		الجديد في تفسير القرآن المجيد [ج ٤]	الشيخ محمّد السبزواري النجفي	Rafed	3702	0.25717
		 مشاهد الأسرار القدسية ومطالع الأنوار الالهية 	 ابن عربي 	ABLibrary	8742	0.25716
		 الحيوان 	 الجاحظ 	ABLibrary	10122	0.25716
		 أصول الدين 	 محمد حسن آل ياسين 	ABLibrary	8335	0.25715
		 بدائع السلك في طبائع الملك 	 محمد بن علي الغرناطي ( ابن الأزرق ) 	ABLibrary	13525	0.25712
		هكذا علمتني الحياة	مصطفى بن حسني السباعي (المتوفى: 1384هـ)	ShamAY	969	0.25712
		 تفسير النهر الماد من البحر المحيط 	 أبي حيان الأندلسي 	ABLibrary	11784	0.25709
		الأخلاق والسير في مداواة النفوس	أبو محمد علي بن أحمد بن سعيد بن حزم الأندلسي القرطبي الظاهري (المتوفى: 456ه)	ShamelaY19	6874	0.25709
		 موسوعة اخلاق القرآن 	 أحمد الشرباصي 	ABLibrary	12478	0.25706
		سراج الملوك	أبو بكر محمد بن محمد ابن الوليد الفهري الطرطوشي المالكي (المتوفى: 520هـ)	ShamAY	1585	0.25704
		 البلاغ في تفسير القرآن بالقرآن 	 الشيخ محمد الصادقي 	ABLibrary	12249	0.25699
		 تفسير روح البيان 	 الشيخ اسماعيل حقي البروسوي 	ABLibrary	11901	0.25694
		شفاء العليل	شمس الدّين محمّد بن أبي بكر بن أيّوب الزّرعي [ ابن قيّم الجوزيّة ]	Rafed	3602	0.25691
		البخلاء للجاحظ	عمرو بن بحر بن محبوب الكناني بالولاء، الليثي، أبو عثمان، الشهير بالجاحظ (المتوفى: 255ه)	Sham19Y	10501	0.25691
		 تفسير ابن وهب ( الواضح في تفسير القرآن الكريم ) 	 عبد الله بن محمد بن وهب الدينوري 	ABLibrary	11654	0.2569
		نظم اللآل في الحكم والأمثال	عبد الله فكري «باشا» بن محمد بليغ بن عبد الله بن محمد (المتوفى: 1306هـ)	ShamAY	5385	0.25685
		 تفسير القرآن العظيم ( تفسير ابن كثير ) ( بيروت ) 	 ابن كثير 	ABLibrary	10112	0.25678
		قلائد الدرر في مناسك من حج و اعتمر	احمد بن علي بن محمد رضا نجفي (كاشف الغطاء)	Ghbook	11258	0.25677
		 عرائس البيان في حقائق القرآن 	 روزبهان البقلي الشيرازي ( شطاح فارس ) 	ABLibrary	11759	0.25676
		 التفسير المنير في العقيدة والشريعة والمنهج 	 وهبة الزحيلي 	ABLibrary	12209	0.25675
		 من وحي القرآن 	 السيد محمد حسين فضل الله 	ABLibrary	12148	0.25674
		 موسوعة أهل البيت ( ع ) 	 السيد علي عاشور 	ABLibrary	11318	0.25674
		كتاب الجواب الكافي لمن سأل عن الدواء الشافي (الداء والدواء)	محمد بن أبي بكر أيوب الزرعي ابن القيم أبو عبد الله	ShamAY	34414	0.25674
		 هداية الحيارى في أجوبة اليهود والنصارى 	 ابن قيم الجوزية 	ABLibrary	8676	0.25672
		فتح الرحيم الملك العلام في علم العقائد والتوحيد والأخلاق والأحكام المستنبطة من القرآن - ت البدر	عبد الرحمن السعدي	ShamAY	35742	0.2567
		مختصر الصواعق المرسلة على الجهمية والمعطلة	ابن الموصلي	ShamAY	8363	0.2567
		التّفسير القرآني للقرآن [ج ٩]	عبدالكريم الخطيب	Rafed	3351	0.25669
		 زهرة التفاسير 	 محمد أبو زهرة 	ABLibrary	12082	0.25669
		نفحة الريحانة ورشحة طلاء الحانة	محمد أمين بن فضل الله بن محب الدين بن محمد المحبي (المتوفى: 1111هـ)	ShamAY	579	0.25666
		حليه الصالحين	آيت الله العظمي حسيني	Ghbook	7993	0.25665
		 الكتاب التذكاري ( محيي الدين بن عربي في الذكرى المئوية الثامنة ) 	 مجموعة مؤلفين 	ABLibrary	8903	0.25663
		 عدة الداعي ونجاح الساعي 	 ابن فهد الحلي 	ABLibrary	1206	0.25661
		 تفسير غرائب القرآن ورغائب الفرقان 	 حسن بن محمد القمي النيسابوري ( نظام الأعرج ) 	ABLibrary	11783	0.25661
		 منارات السائرين إلى حضرة الله ومقامات الطائرين 	 عبد الله بن محمد بن شاهاور الرازي 	ABLibrary	8755	0.25659
		 الفرقان في تفسير القرآن بالقرآن والسنه 	 الشيخ محمد الصادقي 	ABLibrary	12130	0.25658
		الصواعق المرسلة في الرد على الجهمية والمعطلة	محمد بن أبي بكر بن أيوب بن سعد شمس الدين ابن قيم الجوزية (المتوفى: 751هـ)	ShamAY	7345	0.25657
		 الفرقان في تفسير القرآن بالقرآن والسنه 	 الشيخ محمد الصادقي 	ABLibrary	12138	0.25654
		تفسير المراغي [ج ٢]	أحمد مصطفى المراغي	Rafed	1659	0.25653
		 أخلاقيات الإمام علي أمير المؤمنين ( ع ) 	 هادي المدرسي 	ABLibrary	10558	0.25651
		رحلة الشتاء والصيف	محمد بن عبد الله بن محمد، من أحفاد شرف الدين بن يحيى الحمزي الحسيني المولوي المعروف بـ كِبْرِيت (المتوفى: 1070هـ)	ShamAY	622	0.25651
		البرهان في وجوه البيان (نشر من قبل باسم نقد النثر لقدامة بن جعفر)	أبو الحسين إسحاق بن إبراهيم بن سليمان بن وهب الكاتب	ShamAY	38891	0.25645
		لا تحزن	عائض بن عبد الله القرني	ShamelaY19	12729	0.25645
		ميزان العمل	أبو حامد محمد بن محمد الغزالي الطوسي (المتوفى: 505هـ)	ShamAY	9264	0.25642
		 الرعاية لحقوق الله 	 الحارث المحاسبي 	ABLibrary	8682	0.25637
		 بستان الواعظين ورياض السامعين 	 ابن الجوزي 	ABLibrary	13529	0.25635
		 شرح مقامات الحريري 	 أحمد بن عبد المؤمن بن موسى القيسي الشريشي 	ABLibrary	14087	0.25635
		 الفرقان في تفسير القرآن بالقرآن والسنه 	 الشيخ محمد الصادقي 	ABLibrary	12113	0.25634
		 من هدى القرآن 	 السيد محمد تقي المدرسي 	ABLibrary	10353	0.25634
		لا تحزن	عائض بن عبد الله القرني	ShamAY	12729	0.25634
		 بهج الصباغة في شرح نهج البلاغة 	 الشيخ محمد تقي التستري ( الشوشتري ) 	ABLibrary	13945	0.25633
		الميزان في تفسير القرآن [ج ١١]	آية الله السيد محمد حسين الطباطبائي	Rafed	1440	0.25632
		 تفسير المراغي 	 أحمد مصطفى المراغي 	ABLibrary	12026	0.25628
		إغاثة اللهفان من مصايد الشيطان	محمد بن أبي بكر بن أيوب بن سعد شمس الدين ابن قيم الجوزية (المتوفى: 751ه)	ShamelaY19	11688	0.25624
		البخلاء للجاحظ	عمرو بن بحر بن محبوب الكناني بالولاء، الليثي، أبو عثمان، الشهير بالجاحظ (المتوفى: 255هـ)	ShamAY	10501	0.25623
		 التفسير المنير في العقيدة والشريعة والمنهج 	 وهبة الزحيلي 	ABLibrary	12210	0.25622
		عقيدة المسلم	محمد الغزالي	ShamAY	35259	0.2562
		ديوان ابن أبي حصينة	الأمير أبو الفتح الحسن بن عبد الله المشهور بابن أبي حصينة السلمي المعري	Sham19Y	148536	0.25616
		معالم الطريق إلى الله	أبو فيصل البدراني	ShamAY	1742	0.25614
		نظم اللآل في الحكم والأمثال	عبد الله فكري «باشا» بن محمد بليغ بن عبد الله بن محمد (المتوفى: 1306ه)	ShamelaY19	5385	0.25613
		الجواهر الثمينة في محاسن المدينة	محمد كبريت الحسيني المدني	Masaha	4131	0.25604
		أدب الطلب ومنتهى الأدب	محمد بن علي بن محمد بن عبد الله الشوكاني اليمني (المتوفى: 1250هـ)	ShamAY	6854	0.25603
		 تثبيت دلائل النبوة 	 القاضي عبد الجبار الهمذاني 	ABLibrary	7457	0.25602
		تعريف عام بدين الإسلام	علي بن مصطفى الطنطاوي (المتوفى: 1420ه)	ShamelaY19	37562	0.25602
		 مجموع رسائل الإمام المنصور بالله 	 المنصور بالله عبد الله بن حمزة بن سليمان 	ABLibrary	8589	0.25599
		 من وحي القرآن 	 السيد محمد حسين فضل الله 	ABLibrary	12159	0.25599
		البرهان في وجوه البيان (نشر من قبل باسم نقد النثر لقدامة بن جعفر)	أبو الحسين إسحاق بن إبراهيم بن سليمان بن وهب الكاتب	ShamelaY19	20986	0.25595
		مجمع الحكم والأمثال في الشعر العربي	أحمد قبش بن محمد نجيب	ShamAY	32578	0.25589
		عقائد الإماميّة الإثنى عشريّة [ج ٢]	السيد إبراهيم الموسوي الزنجاني	Rafed	3538	0.25588
		 الحب والمحبة الإلهية من كلام الشيخ الأكبر 	 محمود محمود الغراب 	ABLibrary	8908	0.25588
		 التعليقات على شرح الدواني للعقائد العضدية 	 سيد جمال الدين الافغاني ( بقلم محمد عبده ) 	ABLibrary	8387	0.25588
		 الكشكول 	 المحقق البحراني 	ABLibrary	14137	0.25588
		 سفينة النجاة والكلمات الطريفة 	 الفيض الكاشاني 	ABLibrary	10321	0.25588
		من هدى القرآن [ج ١٤]	السيّد محمّد تقي المدرّسي	Rafed	2143	0.25587
		 البداية في الأخلاق العملية 	 الشيخ محمد رضا مهدوي كني 	ABLibrary	10532	0.25586
		 مع الشيعة الإمامية في عقائدهم 	 الشيخ السبحاني 	ABLibrary	13381	0.25584
		مجلة البيان للبرقوقي	البرقوقي	ShamAY	464	0.25583
		 زهرة التفاسير 	 محمد أبو زهرة 	ABLibrary	12083	0.25578
		موضوعات صالحة للخطب والوعظ	محمد بن عبد الرحمن بن محمد بن عبد الله بن عبد الرحمن بن محمد بن قاسم العاصمي الحنبلي (المتوفى: 1421هـ)	ShamAY	7373	0.25576
		 الفرج بعد الشدة 	 القاضي التنوخي 	ABLibrary	1345	0.25575
		معارج القدس في مدارج معرفه النفس	أبو حامد محمد بن محمد الغزالي الطوسي (المتوفى: 505هـ)	ShamAY	6494	0.25575
		 مرآة العقول في شرح أخبار آل الرسول 	 العلامة المجلسي 	ABLibrary	13439	0.25568
		شرح دعاء كميل	آية الله السيّد عبد الأعلى السبزواري	Rafed	2841	0.25567
		فاكهة الخلفاء ومفاكهة الظرفاء	أبو محمد أحمد بن محمد، المعروف بابن عربشاه (المتوفى: 854هـ)	ShamAY	12726	0.25567
		 زهرة التفاسير 	 محمد أبو زهرة 	ABLibrary	12081	0.25564
		 شرح إحقاق الحق 	 السيد المرعشي 	ABLibrary	1016	0.25564
		 مسند الإمام الكاظم ( ع ) 	 الشيخ عزيز الله عطاردي 	ABLibrary	7737	0.25564
		سراج الملوك	أبو بكر محمد بن محمد ابن الوليد الفهري الطرطوشي المالكي (المتوفى: 520ه)	ShamelaY19	1585	0.25563
		 نتائج الأفكار القدسية في بيان معاني شرح الرسالة القشيرية 	 الشيخ عبد الله العروسي 	ABLibrary	8825	0.2556
		 المعاد روية قرآنية 	 السيد كمال الحيدري 	ABLibrary	10177	0.2556
		ديوان بشار بن برد	أبو معاذ بشار بن برد بن يرجوخ العقيلى 95 - 167 هـ	ShamAY	37930	0.25554
		المجتنى من الدعاء المجتبى	السيد علي بن موسى بن طاووس	Masaha	1024	0.25552
		 ثمرات الأوراق 	 علي بن محمد الحموي ( ابن حجة الحموي ) 	ABLibrary	13561	0.2555
		 شرح فصوص الحكم 	 مصطفى بن سليمان بالي زاده الحنفي 	ABLibrary	8849	0.25549
		 الواضح المنهاج في نظم ما للتاج أحمد بن عطاء الله السكندري ( ويليه الحكمة الحاتمية والاقتباسات الالهامية ويليه رسائلة نفائس العرفان ) 	 عبد الكريم بن العربي بنيس 	ABLibrary	8867	0.25548
		 بحار الأنوار 	 العلامة المجلسي 	ABLibrary	788	0.25547
		 بحار الأنوار 	 العلامة المجلسي 	ABLibrary	753	0.25544
		 شرح أصول الكافي 	 صدر الدين محمد الشيرازي ( صدر المتألهين ) 	ABLibrary	7917	0.25544
		 التفسير المنير في العقيدة والشريعة والمنهج 	 وهبة الزحيلي 	ABLibrary	12213	0.25537
		فاكهة الخلفاء ومفاكهة الظرفاء	أبو محمد أحمد بن محمد، المعروف بابن عربشاه (المتوفى: 854ه)	ShamelaY19	12726	0.25536
		 خاطرات جمال الدين الحسيني الأفغاني ( آراء وأفكار ) 	 سيد جمال الدين الحسيني الأفغاني ( اعداد سيد هادي خسرو شاهى ) 	ABLibrary	13976	0.25529
		الكشف عن حقيقة الصوفية	محمود القاسم	ShamAY	37771	0.25529
		مرزبان نامه	اسبهبد مرزبان بن شروين بن رستم بن شهريار (المتوفى: ق 4 ه)	Sham19Y	8305	0.25527
		مجمع الحكم والأمثال في الشعر العربي	أحمد قبش بن محمد نجيب	ShamelaY19	12930	0.25526
		إغاثة اللهفان من مصايد الشيطان	محمد بن أبي بكر بن أيوب بن سعد شمس الدين ابن قيم الجوزية (المتوفى: 751هـ)	ShamAY	11688	0.25525
		تفسير المراغي [ج ٦]	أحمد مصطفى المراغي	Rafed	1666	0.25524
		ميزان العمل	أبو حامد محمد بن محمد الغزالي الطوسي (المتوفى: 505ه)	ShamelaY19	9264	0.25522
		الموشى = الظرف والظرفاء	محمد بن أحمد بن إسحاق بن يحيى، أبو الطيب، المعروف بالوشاء (المتوفى: 325ه)	ShamelaY19	26102	0.25522
		مختصر الصواعق المرسلة على الجهمية والمعطلة	ابن الموصلي	ShamelaY19	8363	0.25522
		 المعجزة الكبرى القرآن 	 محمد أبو زهرة 	ABLibrary	12111	0.25519
		مجموعة الرسائل والمسائل لابن تيمية - رشيد رضا	تقي الدين أبو العباس أحمد بن عبد الحليم بن تيمية الحراني (المتوفى : 728هـ)	ShamAY	11730	0.25519
		 أدب النفس 	 الحكيم الترمذي 	ABLibrary	8694	0.25517
		وانقضت أوهام العمر	السيّد جمال محمّد صالح	Rafed	1221	0.25512
		تفسير المراغي	أحمد بن مصطفى المراغي (المتوفى: 1371ه)	Sham19Y	23608	0.25512
		التّفسير القرآني للقرآن [ج ٤]	عبدالكريم الخطيب	Rafed	3346	0.25511
		 رسائل الجاحظ 	 الجاحظ 	ABLibrary	8436	0.2551
		 من وحي القرآن 	 السيد محمد حسين فضل الله 	ABLibrary	12157	0.25507
		الموشى = الظرف والظرفاء	محمد بن أحمد بن إسحاق بن يحيى، أبو الطيب، المعروف بالوشاء (المتوفى: 325هـ)	ShamAY	26102	0.25507
		غرر الخصائص الواضحة، وعرر النقائض الفاضحة	أبو إسحق برهان الدين محمد بن إبراهيم بن يحيى بن علي المعروف بالوطواط (المتوفى: 718ه)	ShamelaY19	1349	0.25505
		 شرح رسالة الحقوق للإمام زين العابدين ( ع ) 	 السيد حسن القبانچي 	ABLibrary	10505	0.25504
		 المناظر الإلهية ( ويليه شرح مشكلات الفتوحات المكية لابن عربي ) 	 عبد الكريم بن ابراهيم الجيلي 	ABLibrary	8813	0.25503
		الوسيط في تراجم أدباء شنقيط والكلام على تلك البلاد تحديدا وتخطيطا وعاداتهم وأخلاقهم وما يتعلق بذلك	أحمد بن الأمين الشنقيطي (المتوفى: 1331ه)	ShamelaY19	95696	0.25503
		 التفسير المنير في العقيدة والشريعة والمنهج 	 وهبة الزحيلي 	ABLibrary	12217	0.25501
		المستطرف في كل فن مستطرف	شهاب الدين محمد بن أحمد بن منصور الأبشيهي أبو الفتح (المتوفى: 852هـ)	ShamAY	23802	0.25501
		بشريات السلامة من أهوال القيامة	جميلة المصري	ShamAY	34950	0.25501
		 مرآة العقول في شرح أخبار آل الرسول 	 العلامة المجلسي 	ABLibrary	13445	0.25498
		 الإعجاز والتحدى في القرآن الكريم 	 السيد محمدحسين الطباطبائي 	ABLibrary	10091	0.25497
		 تزكية النفس وتهذيبها 	 الشيخ ابراهيم الأميني 	ABLibrary	10538	0.25497
		تفسير المراغي [ج ١٥]	أحمد مصطفى المراغي	Rafed	1685	0.25496
		 الاعمال الصوفية 	 محمد بن عبد الجبار بن الحسن النفري 	ABLibrary	8699	0.25496
		تفسير المراغي [ج ٩]	أحمد مصطفى المراغي	Rafed	1679	0.25495
		الصواعق المرسلة في الرد على الجهمية والمعطلة	محمد بن أبي بكر بن أيوب بن سعد شمس الدين ابن قيم الجوزية (المتوفى: 751ه)	ShamelaY19	7345	0.25493
		 عدة الصابرين وذخيرة الشاكرين 	 ابن قيم الجوزية 	ABLibrary	1205	0.25491
		 الأساس في التفسير 	 سعيد حوي 	ABLibrary	12387	0.2549
		 معارج التفكر ودقائق التدبر 	 عبد الرحمن حسن حبنكه الميداني 	ABLibrary	12329	0.2549
		 العقد الفريد 	 أحمد بن محمد ابن عبد ربه الأندلسي 	ABLibrary	14105	0.25489
		 سيرة الأئمة الاثني عشر ( ع ) 	 هاشم معروف الحسني 	ABLibrary	7548	0.25488
		 تفسير المراغي 	 أحمد مصطفى المراغي 	ABLibrary	12032	0.25488
		 الصناعتين ، الكتابة والشعر 	 أبي هلال العسكري 	ABLibrary	10755	0.25488
		 ديوان الشريف الرضي 	 الشريف الرضي 	ABLibrary	13592	0.25481
		تفسير غرائب القرآن ورغائب الفرقان [ج ٢]	نظام الدين الحسن بن محمّد بن حسين القمي النيسابوري	Rafed	1793	0.25476
		 العرش والكرسى في القرآن الكريم مراتب العلم الالهى وكيفيه وقوع البداء فيه التوحيد 	 السيد كمال الحيدري 	ABLibrary	10148	0.25476
		ديوان المعاني	أبو هلال الحسن بن عبد الله بن سهل بن سعيد بن يحيى بن مهران العسكري (المتوفى: نحو 395هـ)	ShamAY	6909	0.25475
		كنز الفوائد  - الجزء1	الشيخ القاضي أبي الفتح محمد بن علي الكراجكي	Masaha	4568	0.25475
		التّفسير القرآني للقرآن [ج ٦]	عبدالكريم الخطيب	Rafed	3348	0.25473
		زبدة التّفاسير [ج ٦]	فتح الله بن شكر الله الشريف الكاشاني	Rafed	1725	0.25473
		 تأويلات أهل السنة ( تفسير الماتريدي ) 	 أبي منصور الماتريدي 	ABLibrary	11659	0.25473
		مرزبان نامه	اسبهبد مرزبان بن شروين بن رستم بن شهريار (المتوفى: ق 4 هـ)	ShamAY	8305	0.25472
		 دار السلام فيما يتعلق بالرؤيا والمنام 	 ميرزا حسين النوري الطبرسي 	ABLibrary	14050	0.25471
		 مختصر الميزان في تفسير القرآن 	 السيد محمدحسين الطباطبائي ( تلخيص إلياس الكلانتري ) 	ABLibrary	12241	0.25466
		 موسوعة مصطلحات علم الكلام الإسلامي 	 سميح دغيم 	ABLibrary	8657	0.25462
		 في ظلال القرآن 	 سيد قطب 	ABLibrary	12043	0.25462
		 الفرقان في تفسير القرآن بالقرآن والسنه 	 الشيخ محمد الصادقي 	ABLibrary	12122	0.25462
		رحلة الشتاء والصيف	محمد بن عبد الله بن محمد، من أحفاد شرف الدين بن يحيى الحمزي الحسيني المولوي المعروف ب كبريت (المتوفى: 1070ه)	ShamelaY19	37345	0.25462
		 أدب الطف أو شعراء الحسين ( ع ) 	 جواد شبر 	ABLibrary	7405	0.25461
		معالم الطريق إلى الله	أبو فيصل البدراني	ShamelaY19	96252	0.25459
		سلافة العصر في محاسن الشعراء بكل مصر	صدر الدين المدني، علي بن أحمد بن محمد معصوم الحسني الحسيني، المعروف بعلي خان بن ميرزا أحمد، الشهير بابن معصوم (المتوفى: 1119هـ)	ShamAY	298	0.25458
		قلائد العقيان	الفتح بن خاقان بن أحمد بن غرطوج، أبو محمد (المتوفى: 247ه)	ShamelaY19	21510	0.25457
		 معرفة المعاد 	 السيد محمد حسين الطهراني 	ABLibrary	8877	0.25453
		 بحار الأنوار 	 العلامة المجلسي 	ABLibrary	771	0.25451
		رسائل الثعالبي	عبد الملك بن محمد بن إسماعيل أبو منصور الثعالبي (المتوفى: 429هـ)	ShamAY	623	0.2545
